news_url,image_url,title,text,source_name,date,topics,sentiment,type,tickers
https://www.benzinga.com/trading-ideas/long-ideas/19/08/14350762/option-traders-making-large-bullish-bets-on-facebook-following-recent-weakness,https://cdn.snapi.dev/images/v1/g/b/fn2-1.jpg,Option Traders Making Large Bullish Bets On Facebook Following Recent Weakness,"Facebook, Inc. (NASDAQ: FB) shares have bounced a bit this week, but remain down 7.5% overall in the past month.",Benzinga,"Thu, 29 Aug 2019 12:50:23 -0400",,Positive,Article,FB
https://www.youtube.com/watch?v=AXxdppqEH1g,https://cdn.snapi.dev/images/v1/5/4/5415jpgwidth460quality85autoformatfitmaxs0556408cfa49916fd76abf9bd88b1502.jpg,"Market is focused on individual stocks, not broader tech sector: Portfolio manager","Brook Dane of Goldman Sachs Asset Management, joins CNBC's ""Fast Money Halftime Report"" team to discuss how the market is trading tech stocks and what he's watching.",CNBC Television,"Thu, 29 Aug 2019 12:48:01 -0400",,Neutral,Video,"AAPL,FB,GOOG,GOOGL"
https://techcrunch.com/2019/08/29/instagram-may-allow-creators-to-syndicate-igtv-videos-to-facebook/,https://cdn.snapi.dev/images/v1/y/k/fb2.jpg,Instagram may allow creators to syndicate IGTV videos to Facebook,"Following the departure of Instagram’s founders, Facebook is working to more closely integrate the photo-sharing app with its flagship social network. It’s already added its brand name next to Instagram’s, and is working to make both platforms’ messaging products interoperable.",TechCrunch,"Thu, 29 Aug 2019 12:22:33 -0400",,Neutral,Article,FB
https://techcrunch.com/2019/08/29/facebook-rolls-out-new-business-tools-for-messenger-kills-the-discover-tab/,https://cdn.snapi.dev/images/v1/l/b/105255159-gettyimages-104885616530x298.jpg,"Facebook rolls out new business tools for Messenger, kills the ‘Discover’ tab","Facebook today is formally rolling out a new suite of tools for its 40 million active businesses on Messenger, including appointment booking, lead generation, and others announced earlier this year at its F8 developer conference. As a part of these changes, Facebook will also begin to phase out the Discover tab in Messenger — a […]",TechCrunch,"Thu, 29 Aug 2019 10:41:08 -0400",,Positive,Article,FB
https://seekingalpha.com/article/4288640-big-news-facebook-investors-one-noticed,https://cdn.snapi.dev/images/v1/f/v/fbwa7.jpg,Big News For Facebook Investors And No One Noticed,"In February 2019, the FCO has imposed on Facebook far-reaching restrictions in the processing of user data. The FCO's decision was defined as the company's internal break up at the.",Seeking Alpha,"Thu, 29 Aug 2019 10:21:03 -0400",,Neutral,Article,FB
https://news.sky.com/story/facebook-tightens-political-ad-rules-ahead-of-us-presidential-election-11796647,https://cdn.snapi.dev/images/v1/l/s/489.jpg,Facebook tightens political ad rules ahead of US election,Facebook is tightening its rules on US political adverts to combat potentially misleading campaigns ahead of the 2020 presidential election.,Skynews,"Thu, 29 Aug 2019 04:09:00 -0400",,Neutral,Article,FB
