news_url,image_url,title,text,source_name,date,topics,sentiment,type,tickers
https://nypost.com/2020/06/25/verizon-joins-in-on-mounting-ad-boycott-against-facebook/,https://cdn.snapi.dev/images/v1/y/p/verizonfbjpgquality90stripall.jpg,Verizon joins in on Facebook ad boycott,"A Facebook ad boycott gathered more steam on Thursday, when telecom giant Verizon said it would pull ads in July over criticisms of the social media giant’s failure to monitor hate speech. The “Stop the Hate for Profit” campaign had already convinced Unilever-owned ice cream maker Ben & Jerry’s to join the campaign, as well.",New York Post,"Thu, 25 Jun 2020 21:25:34 -0400",,Neutral,Article,"FB,VZ,VZA"
https://www.youtube.com/watch?v=dzUBt61NvUw,https://cdn.snapi.dev/images/v1/d/w/dwwed22.jpg,Jim Cramer: Texas' reopening pause fired up the stay-at-home stocks,"""Many of today's winners were the usual suspects that benefit from the pandemic,"" the ""Mad Money"" host said.",CNBC Television,"Thu, 25 Jun 2020 19:07:37 -0400","cramer,madmoney",Positive,Video,"AAPL,AMZN,CLX,CRWD,ETSY,FB,GOOG,GOOGL,MKC,MSFT,RNG,SHOP,TWLO,WIX,ZM,ZS"
https://www.theguardian.com/technology/2020/jun/25/verizon-advertising-facebook-hate-speech-boycott,https://cdn.snapi.dev/images/v1/x/n/urlhttps3a2f2fgfoolcdncom2feditorial2fimages2f5790292fgettyimages-1182866691jpgw700opresize.jpg,Verizon pulls ads from Facebook over inaction on hate speech,"Company is the biggest yet to join growing movement, which includes Ben & Jerry’s and Patagonia, to boycott the social network",The Guardian,"Thu, 25 Jun 2020 19:05:56 -0400",,Neutral,Article,"FB,VZ,VZA"
https://www.cnn.com/2020/06/25/tech/verizon-pulls-facebook-ads/index.html,https://cdn.snapi.dev/images/v1/y/c/200625182807-verizon-restricted-super-169.jpg,Verizon is pulling its advertising from Facebook,"Telecom giant Verizon said Thursday it is pulling its advertising from Facebook, in what may be the biggest brand yet to join the #StopHateForProfit boycott.",CNN Business,"Thu, 25 Jun 2020 18:53:11 -0400",,Neutral,Article,"FB,VZ,VZA"
https://www.cnet.com/news/verizon-pauses-facebook-ads-amid-growing-ad-boycott/,https://cdn.snapi.dev/images/v1/s/d/facebook-logo-money-1.jpg,Verizon pauses Facebook ads amid growing ad boycott,Nearly 100 brands have reportedly joined effort to push Facebook  to do more to police abusive content on its platform.,CNET,"Thu, 25 Jun 2020 18:41:00 -0400",,Neutral,Article,"FB,VZ,VZA"
https://www.youtube.com/watch?v=RsnqSrg_N8A,https://cdn.snapi.dev/images/v1/e/d/facebook-more-companies-halt-advertising-campaigns-on-facebook.jpg,Facebook: More companies halt advertising campaigns on Facebook,Anti-Defamation League CEO Jonathan Greenblatt joins Zack Guzman to address why advertisers are boycotting Facebook Ads.,Yahoo Finance,"Thu, 25 Jun 2020 18:37:13 -0400",,Negative,Video,FB
https://www.reuters.com/article/us-facebook-ads-boycott-verizon/verizon-suspends-advertising-on-facebook-idUSKBN23W3HK,https://cdn.snapi.dev/images/v1/f/7/m02d20200625t2i1523666122w940fhfwllplsqrlynxmpeg5o2kl.jpg,Verizon suspends advertising on Facebook,Verizon Communications Inc said on Thursday it was pausing advertising on Facebook Inc following wide spread support for a campaign that called out the social media giant for not doing enough to stop hate speech on its platforms.,Reuters,"Thu, 25 Jun 2020 18:21:00 -0400",,Neutral,Article,"FB,VZ,VZA"
https://www.youtube.com/watch?v=telGEajQHck,https://cdn.snapi.dev/images/v1/t/d/verizon-pulling-ads-from-facebook.jpg,Verizon pulling ads from Facebook,CNBC's Dom Chu reports that Verizon is joining other companies in pulling its ads from Facebook until it develops new content policies.,CNBC Television,"Thu, 25 Jun 2020 18:17:25 -0400",,Neutral,Video,"FB,VZ,VZA"
https://www.marketwatch.com/story/verizon-is-latest-to-pull-ads-from-facebook-over-hate-speech-misinformation-on-platform-2020-06-25,https://cdn.snapi.dev/images/v1/0/k/fbuu.jpg,"Verizon is latest to pull ads from Facebook over hate speech, misinformation on platform","Facebook Inc. FB, +0.70% shares dipped 1.4% in extended trading Thursday after Verizon Communications Inc.",Market Watch,"Thu, 25 Jun 2020 18:14:15 -0400",,Neutral,Article,"FB,VZ,VZA"
https://deadline.com/2020/06/verizon-joins-facebook-ad-boycott-adding-to-growing-backlash-against-tech-giants-laissez-faire-approach-to-posts-1202970276/,https://cdn.snapi.dev/images/v1/f/a/facebook-15.jpg,"Verizon Joins Facebook Ad Boycott, Adding To Growing Backlash Against Tech Giant’s Laissez-Faire Approach To Posts",Verizon has joined a growing boycott of advertisers boycotting Facebook and its Instagram subsidiary after the company’s handling of objectionable posts has left many brands uneasy on the massive social platforms. “We’re pausing our advertising until Facebook can create an acceptable solution that makes us comfortable and is consistent with what we’ve done with YouTube,Deadline,"Thu, 25 Jun 2020 18:12:43 -0400",,Neutral,Article,"FB,VZ,VZA"
https://www.cnbc.com/2020/06/25/verizon-pulling-advertising-from-facebook-and-instagram.html,https://cdn.snapi.dev/images/v1/d/q/106375565-1580969931683gettyimages-1165309438.jpeg,Verizon is pulling advertising from Facebook and Instagram,"Verizon says it is pulling advertising on Facebook until the company ""can create an acceptable solution that makes us comfortable.""",CNBC,"Thu, 25 Jun 2020 17:23:53 -0400",,Neutral,Article,"FB,VZ,VZA"
https://www.theguardian.com/technology/2020/jun/25/exclusive-viber-severs-ties-with-facebook-in-growing-boycott,https://cdn.snapi.dev/images/v1/2/n/fb64-3.jpg,Exclusive: Viber severs ties with Facebook in growing boycott,Service adds to firms shunning Facebook over refusal to act against Donald Trump posts,The Guardian,"Thu, 25 Jun 2020 13:18:31 -0400",,Neutral,Article,FB
https://www.youtube.com/watch?v=Arg-Ehprfsc,https://cdn.snapi.dev/images/v1/p/2/apple-facebook-and-nvidia-receive-price-target-upgrades.jpg,"Apple, Facebook and Nvidia receive price target upgrades","CNBC's ""Halftime Report"" team discusses their market investments.",CNBC Television,"Thu, 25 Jun 2020 13:09:38 -0400",,Positive,Video,"AAPL,NVDA,FB"
https://www.youtube.com/watch?v=B7e4F_fNXJk,https://cdn.snapi.dev/images/v1/b/z/why-baird-analyst-is-raising-price-target-on-facebook-to-300.jpg,Why Baird analyst is raising price target on Facebook to $300,"Colin Sebastian of Baird joins ""Squawk Alley"" to discuss his new price target for Facebook as the company is in the midst of another controversy.",CNBC Television,"Thu, 25 Jun 2020 13:04:20 -0400",,Positive,Video,FB
https://www.youtube.com/watch?v=WkHEoEcm-58,https://cdn.snapi.dev/images/v1/o/s/oskw12wed.jpg,Early Facebook investor Roger McNamee on the ad boycott,"Roger McNamee of Elevation Partners joins ""Squawk Alley"" to discuss the boycott over Facebook's advertising practices.",CNBC Television,"Thu, 25 Jun 2020 12:37:49 -0400",,Negative,Video,FB
https://www.fool.com/investing/2020/06/25/will-facebook-stock-surge-to-300.aspx,https://cdn.snapi.dev/images/v1/m/u/fb-1.jpg,Will Facebook Stock Surge to $300?,This analyst says it will. Is he right?,The Motley Fool,"Thu, 25 Jun 2020 12:30:00 -0400",,Positive,Article,FB
https://investorplace.com/2020/06/why-you-can-blame-cloud-stocks-for-the-next-market-crash/,https://cdn.snapi.dev/images/v1/3/w/stm8-1.jpg,Why You Will Blame Cloud Stocks for the Next Market Crash,"In 2020 the market is recognizing the financial power of cloud data centers, bidding the five biggest owners of them to the sky.",InvestorPlace,"Thu, 25 Jun 2020 10:24:04 -0400",,Neutral,Article,"AAPL,AMZN,FB,GOOG,GOOGL,MSFT"
https://nypost.com/2020/06/25/naacp-ceo-derrick-johnson-calls-facebook-a-threat-to-democracy/,https://cdn.snapi.dev/images/v1/t/x/105632161-1545065307257employeewalkspastafacebooklogo.jpg,NAACP chief calls Facebook ‘one of the biggest threats to democracy’,"""They are probably one of the biggest threats to democracy that we see,"" Derrick Johnson, the civil-rights group's president and CEO, said Thursday on MSNBC's ""Morning Joe.""",New York Post,"Thu, 25 Jun 2020 09:01:16 -0400",,Negative,Article,FB
https://www.fool.com/investing/2020/06/25/facebook-ad-boycott-wont-have-big-impact-investing.aspx,https://cdn.snapi.dev/images/v1/w/w/chc0cw-ghts-1.jpg,A Facebook Ad Boycott Won't Have a Big Impact on Investors,Some big companies are pulling their ad spend from Facebook and Instagram.,The Motley Fool,"Thu, 25 Jun 2020 08:45:00 -0400",,Negative,Article,FB
https://www.marketwatch.com/story/here-are-tech-companies-plans-for-increasing-diversity-amid-protests-over-racial-inequality-2020-06-25,https://cdn.snapi.dev/images/v1/d/e/de3r42.jpg,Here are tech companies’ plans for increasing diversity amid protests over racial inequality,"Sparked by social protests over systemic racism, the tech industry is laying out concrete plans to increase diversity within their workforces. Here are the plans that have been publicly announced by some of the biggest names in technology.",Market Watch,"Thu, 25 Jun 2020 07:01:29 -0400",,Positive,Article,"AAPL,FB,GOOG,GOOGL,HPE,INTC,MSFT,SAP"
