news_url,image_url,title,text,source_name,date,topics,sentiment,type,tickers
https://nypost.com/2020/08/17/facebooks-plan-to-merge-instagram-messenger-chats-underway/,https://cdn.snapi.dev/images/v1/g/s/gsu12we.jpg,"Facebook’s plan to merge Instagram, Messenger chats underway","Facebook is quietly moving forward with a controversial plan to merge the messaging features of its Messenger and Instagram platforms. US Instagram users over the weekend were met with an onscreen prompt advertising a “new way to message on Instagram,” urging them to merge the photo-sharing app’s messaging platform with Facebook Messenger.",New York Post,"Mon, 17 Aug 2020 12:28:21 -0400",,Neutral,Article,FB
https://www.zacks.com/stock/news/1042979/facebook-fb-begins-merging-chats-from-instagram-messenger,https://cdn.snapi.dev/images/v1/k/q/facebook-f8-mark-zuckerberg-2018-0172.jpg,"Facebook (FB) Begins Merging Chats From Instagram, Messenger",Facebook's (FB) latest update to allow users to access the inboxes of both Messenger and Instagram Messages at the same time.,Zacks Investment Research,"Mon, 17 Aug 2020 10:38:00 -0400",manda,Neutral,Article,FB
https://www.zacks.com/stock/news/1042871/facebook-targets-apple-for-paid-events-fee-on-its-platform,https://cdn.snapi.dev/images/v1/b/p/ghrwqcuujksv-1-3.jpg,Facebook Targets Apple for Paid Events Fee on Its Platform,"Facebook (FB) rolls out paid online events feature to help small businesses earn 100% revenues from online events, following the economic effects of the coronavirus outbreak.",Zacks Investment Research,"Mon, 17 Aug 2020 10:16:00 -0400",,Neutral,Article,"AAPL,FB"
https://www.forbes.com/sites/anthonysvirskis/2020/08/17/instagrams-reels-not-yet-the-real-deal/,https://cdn.snapi.dev/images/v1/a/p/aplqwedf.jpg,"Instagram’s Reels, Not Yet The Real Deal",The hurried launch of Instagram’s new feature is intended to capitalize on a moment in time when users are hesitant to invest more effort into the unknown future of TikTok.,Forbes,"Mon, 17 Aug 2020 09:50:00 -0400",,Neutral,Article,FB
https://www.fool.com/investing/2020/08/17/2-great-stocks-help-you-send-your-kids-to-college/,https://cdn.snapi.dev/images/v1/z/c/urlhttps3a2f2fgfoolcdncom2feditorial2fimages2f5880152fgettyimages-1177967778jpgw700opresize.jpg,2 Great Stocks That Can Help You Send Your Kids to College,"These two companies are poised for long-term success, and they can boost your college savings in the process.",The Motley Fool,"Mon, 17 Aug 2020 09:08:00 -0400",,Positive,Article,"FB,PLNT"
https://techcrunch.com/2020/08/17/indian-lawmakers-accuse-facebook-of-political-bias/,https://cdn.snapi.dev/images/v1/l/a/105584881-1542728852047rts24l5s530x298.jpg,Indian lawmakers accuse Facebook of political bias,"Facebook is facing heat in India, its biggest market by users, over a report that claimed the company compromised its hate speech policy to favor the ruling party. Politicians from both Bharatiya Janata Party, which rules the government in India, and opposition Indian National Congress lambasted Facebook for its supposed favoritism to the other and […]",TechCrunch,"Mon, 17 Aug 2020 03:57:34 -0400",,Negative,Article,FB
https://www.youtube.com/watch?v=xhpZHjL_BVs,https://cdn.snapi.dev/images/v1/2/n/2nbfag-1.jpg,Can the FAANGs Sustain Their Rally?,"Mega-cap tech stocks are resuming their rally. The Nasdaq futures are pushing higher as the pandemic is likely to keep consumers reliant on e-commerce, websites and door-to-door delivery.",Bloomberg Markets and Finance,"Mon, 17 Aug 2020 03:06:33 -0400",,Neutral,Video,"AAPL,AMZN,FB,GOOG,GOOGL,NFLX"
https://www.reuters.com/article/us-facebook-india/facebook-faces-heat-from-indian-lawmakers-on-content-practices-idUSKCN25D0M1,https://cdn.snapi.dev/images/v1/i/h/m02d20200817t2i1529875875w940fhfwllplsqrlynxnpeg7g0at.jpg,Facebook faces heat from Indian lawmakers on content practices,"Indian politicians are trading barbs over a media report that Facebook Inc's content policies favoured Prime Minister Narendra Modi's party, putting the social network at the centre of a political storm in its biggest market by users.",Reuters,"Mon, 17 Aug 2020 02:56:00 -0400",,Negative,Article,FB
https://www.benzinga.com/news/20/08/17114455/facebook-decries-apples-app-store-tax-on-its-initiative-to-help-small-businesses,https://cdn.snapi.dev/images/v1/q/6/yura-fresh-n31x0hhnzos-unsplash.jpg,Facebook Decries Apple's App Store Tax On Its Initiative To Support Small Businesses During Pandemic,Facebook Inc (NASDAQ: FB) on Friday denounced what it called “App Store Tax” on its initiative to support small businesses through online events.,Benzinga,"Mon, 17 Aug 2020 00:21:30 -0400",,Negative,Article,"AAPL,FB"
