news_url,image_url,title,text,source_name,date,topics,sentiment,type,tickers
https://www.theguardian.com/media/2020/sep/03/regional-publishers-hit-back-at-facebooks-inflammatory-threat-to-ban-news-sharing-in-australia,https://cdn.snapi.dev/images/v1/3/5/3500jpgwidth460quality85autoformatfitmaxs7c383a9e025fd9eb7d1d17e74c2eb421.jpg,Regional publishers hit back at Facebook's 'inflammatory' threat to ban news sharing in Australia,"The president of Country Press Australia, Bruce Ellen, says the social media giant’s response is ‘preemptive’ of the negotiation process",The Guardian,"Wed, 02 Sep 2020 22:29:31 -0400",,Negative,Article,FB
https://techcrunch.com/2020/09/02/facebook-now-lets-you-customize-your-watch-video-feed-with-topics/,https://cdn.snapi.dev/images/v1/e/m/facebook-3474124b-10.jpg,Facebook now lets you customize your Watch video feed with #Topics,"Facebook’s video destination, Facebook Watch, is introducing a new feature called “Your Topics” that will allow you to tailor its feed to include more of the content you want to see. Currently, Facebook leverages its existing understanding of each viewer’s interests to personalize the Watch Feed.",TechCrunch,"Wed, 02 Sep 2020 18:18:38 -0400",,Neutral,Article,FB
https://www.gurufocus.com/news/1224434/technology-let-the-good-times-roll,https://cdn.snapi.dev/images/v1/j/b/computer-electronic38.jpg,Technology: Let the Good Times Roll,"Investing in technology, including the likes of the FAANG stocks (Facebook (NASDAQ:FB), Apple (NASDAQ:AAPL), Amazon (NASDAQ:AMZN), Netflix (NASDAQ:NFLX), Google (NASDAQ:GOOGL)) has been a lucrative strategy over the last two decades, especially since the end of the bursting dot-com technology bubble in 2002.",GuruFocus,"Wed, 02 Sep 2020 12:20:30 -0400",,Positive,Article,"AAPL,AMZN,DOCU,FB,GOOGL,NFLX,TDOC,GOOG,ZM"
https://investorplace.com/2020/09/4-communications-stocks-still-holding-their-own/,https://cdn.snapi.dev/images/v1/f/0/stocks34-5.jpg,4 Communications Stocks Still Holding Their Own,Communication stocks are likely to deliver healthy returns as the coronavirus pandemic increases the demand for voice and video calls.,InvestorPlace,"Wed, 02 Sep 2020 09:12:11 -0400",,Positive,Article,"FB,T,VZ,ZM"
https://www.zacks.com/stock/news/1051374/3-solid-tech-stocks-to-ride-on-a-booming-ai-market,https://cdn.snapi.dev/images/v1/z/1/m02d20190604t2i1394403951rlynxnpef531x4w640.jpg,3 Solid Tech Stocks to Ride on a Booming AI Market,Tech companies are increasingly resorting to AI to make their presence felt during this pandemic,Zacks Investment Research,"Wed, 02 Sep 2020 07:24:00 -0400",,Positive,Article,"CRM,FB,ZM"
https://news.sky.com/story/fake-left-wing-news-organisation-targeting-uk-and-us-from-russia-banned-by-facebook-12061662,https://cdn.snapi.dev/images/v1/9/q/gettyimages-1153735129.jpg,Fake left-wing news targeting UK and US from Russia banned by Facebook,A fake left-wing news organisation operated by the Russian agency accused of interfering in the US election in 2016 has been uncovered and banned by Facebook.,Skynews,"Wed, 02 Sep 2020 06:48:00 -0400",,Negative,Article,FB
