news_url,image_url,title,text,source_name,date,topics,sentiment,type
https://www.cnbc.com/2019/07/17/us-china-trade-beijing-wants-deal-despite-hardline-stanceclete-willems.html,https://cdn.snapi.dev/images/v1/w/c/105808810-1553257743878rtx6mh5gcopy.jpg,"China may be signaling it's going hard-line but it still wants a trade deal, says ex-negotiator","China may have just signaled it's going more hard-line on trade, but it could actually be a good thing, former top White House trade negotiator Clete Willems told CNBC on Wednesday.",CNBC,"Tue, 16 Jul 2019 23:58:00 -0400",,Positive,Article
https://www.reuters.com/article/us-global-oil/oil-prices-gain-u-s-crude-little-changed-after-inventory-data-idUSKCN1UC023,https://cdn.snapi.dev/images/v1/q/t/m02d20190717t2i1408771626rlynxnpef6g013w640.jpg,"Oil prices gain, U.S. crude little changed after inventory data","Oil prices rose on Wednesday after steep falls in the previous session, although U.S. crude trailed gains for international benchmark Brent after U.S.",Reuters,"Tue, 16 Jul 2019 23:39:52 -0400",oil,Positive,Article
https://www.reuters.com/article/us-global-markets/asia-shares-subdued-dollar-benefits-as-sterling-suffers-idUSKCN1UC01B,https://cdn.snapi.dev/images/v1/m/0/m02d20190717t2i1408769503rlynxnpef6g00rw640-2.jpg,"Asia shares subdued, dollar benefits as sterling suffers","Asian shares drifted off on Wednesday as anxious investors awaited more earnings reports from corporate America, while the dollar held firm in the wake of robust U.S. retail data and a Brexit-driven dive in the pound.",Reuters,"Tue, 16 Jul 2019 23:06:31 -0400",,Neutral,Article
https://www.reuters.com/article/us-usa-trade-japan/u-s-japan-eye-possible-small-trade-deal-by-september-sources-idUSKCN1UC009,https://cdn.snapi.dev/images/v1/n/n/m02d20190717t2i1408798767rlynxnpef6g00cw640.jpg,"U.S., Japan eye possible small trade deal by September: sources","The United States and Japan are working on a trade deal involving agriculture and autos that could be agreed by  President Donald Trump and Prime Minister Shinzo Abe when they meet in New York in September, three industry sources familiar with the discussions said on Tuesday.",Reuters,"Tue, 16 Jul 2019 22:48:20 -0400",,Neutral,Article
https://www.cnbc.com/2019/07/17/us-could-face-chinese-sanctions-against-obama-era-export-tariffs-wto.html,https://cdn.snapi.dev/images/v1/w/t/106022802-1563323835158gettyimages-534813264.jpeg,World Trade Organization opens the way for Chinese sanctions against US tariffs in Obama-era,The WTO ruling recognized that the United States had proved that China used state-owned enterprises to subsidize and distort its economy. But the U.S.,CNBC,"Tue, 16 Jul 2019 22:13:00 -0400",,Negative,Article
https://nypost.com/2019/07/16/bitcoin-takes-hit-as-lawmakers-rip-facebooks-cryptocurrency/,https://cdn.snapi.dev/images/v1/2/i/105239873-gettyimages-962171220.jpg,Bitcoin takes hit as lawmakers rip Facebook’s cryptocurrency,"The price of bitcoin plunged 10 percent on Tuesday after Facebook’s own digital currency project faced another drubbing — this time by lawmakers. A Facebook executive in charge of the planned digital coin, known as Libra, received a harsh reception Tuesday by members of the Senate Banking Committee, including a senator who said people would.",New York Post,"Tue, 16 Jul 2019 21:27:20 -0400",,Neutral,Article
https://www.investopedia.com/how-small-investors-are-becoming-the-gorilla-of-the-bond-market-4693183,https://cdn.snapi.dev/images/v1/3/7/371-4.jpg,How Small Investors Are Becoming The Gorilla of The Bond Market,"The booming demand for government debt demonstrates that while the S&P 500 reaches new highs, many individual investors remain cautious.",Investopedia,"Tue, 16 Jul 2019 20:53:01 -0400",,Neutral,Article
https://www.reuters.com/article/us-global-oil/oil-prices-steady-after-falling-to-more-than-one-week-lows-idUSKCN1UC023,https://cdn.snapi.dev/images/v1/s/8/m02d20190717t2i1408771626rlynxnpef6g013w640.jpg,Oil prices steady after falling to more than one-week lows,"Oil steadied after falling more than 3% overnight, with U.S. crude trailing Brent after U.S.",Reuters,"Tue, 16 Jul 2019 20:48:40 -0400",oil,Neutral,Article
https://www.reuters.com/article/us-usa-fed-evans-rates/as-fed-nears-rate-cut-policymakers-debate-how-deep-and-even-if-idUSKCN1UB2LT,https://cdn.snapi.dev/images/v1/0/s/m02d20190716t2i1408731113rlynxnpef6f1otw640.jpg,"As Fed nears rate cut, policymakers debate how deep, and even if","With the first U.S. interest rate reduction in a decade expected later this month, two Federal Reserve policymakers sketched out arguments on Tuesday on how deep the cut should be, even as a third said she needs more data before being ready to sign on at all.",Reuters,"Tue, 16 Jul 2019 20:28:49 -0400",,Neutral,Article
https://www.youtube.com/watch?v=mGpaI62E0a8,https://cdn.snapi.dev/images/v1/h/v/cramer-explains-how-the-fed-is-creating-buying-opportunities.jpg,Cramer explains how the Fed is creating buying opportunities,"""When you have a Fed chief who's hellbent on cutting interest rates … then you should own stocks that benefit from lower rates,"" Jim Cramer says.",CNBC Television,"Tue, 16 Jul 2019 19:34:06 -0400",cramer,Positive,Video
https://www.nytimes.com/2019/07/16/technology/big-tech-antitrust-hearing.html,https://cdn.snapi.dev/images/v1/n/9/merlin-158036388-7b85d293-7076-4255-8e62-7a1ddd4b44ad-articlelargejpgquality75autowebpdisableupscale.jpg,‘I Don’t Trust You Guys’: Lawmakers Unite to Take Aim at Big Tech,A series of hearings on Capitol Hill showed the rising force of the political backlash against the country’s tech giants.,NYTimes,"Tue, 16 Jul 2019 19:20:11 -0400",paywall,Negative,Article
https://www.forbes.com/sites/cbovaird/2019/07/16/bitcoin-remains-volatile-as-libra-hearing-draws-interest/,https://cdn.snapi.dev/images/v1/e/t/etf18-56.jpg,Bitcoin Remains Volatile As Libra Hearing Draws Interest,"Bitcoin prices remained volatile today, as many market observers tuned in to the U.S. Senate hearing regarding libra.",Forbes,"Tue, 16 Jul 2019 18:14:00 -0400",,Negative,Article
https://www.reuters.com/article/us-usa-fed-evans-rates/as-fed-approaches-rate-cut-policymakers-debate-how-deep-to-trim-idUSKCN1UB2LT,https://cdn.snapi.dev/images/v1/v/n/m02d20190716t2i1408731113rlynxnpef6f1otw640.jpg,"As Fed approaches rate cut, policymakers debate how deep to trim","U.S. Federal Reserve policymakers, moving toward their first interest rate reduction in a decade later this month, on Tuesday sketched out arguments for whether rates should be cut by a quarter or a half a percentage point.",Reuters,"Tue, 16 Jul 2019 17:57:03 -0400",,Neutral,Article
https://www.youtube.com/watch?v=CwFVyqYSzCk,https://cdn.snapi.dev/images/v1/s/i/wells-fargo-well-positioned-for-rate-cut-and-not-nervous-about-mortgages-cfo-says.jpg,"Wells Fargo Well Positioned for Rate Cut and Not Nervous About Mortgages, CFO Says","John Shrewsberry, Wells Fargo & Co. chief financial officer, discusses the bank's second-quarter earnings and growth outlook with Bloomberg's Caroline Hyde, Taylor Riggs and Romaine Bostick on ""Bloomberg Markets: What'd You Miss?""",Bloomberg Markets and Finance,"Tue, 16 Jul 2019 17:55:24 -0400",CFO,Positive,Video
https://www.youtube.com/watch?v=lMY3sPf30k0,https://cdn.snapi.dev/images/v1/t/6/pncs-jeff-mills-says-something-may-be-bubbling-under-the-surface-for-small-caps.jpg,PNC's Jeff Mills says something may be bubbling under the surface for small caps,PNC's Jeff Mills on a small cap catch up.,CNBC Television,"Tue, 16 Jul 2019 17:50:24 -0400",,Neutral,Video
https://www.investors.com/market-trend/stock-market-today/dow-jones-futures-stock-market-rally-stalls-apple-facebook-united-airlines-csx-active-late/,https://cdn.snapi.dev/images/v1/y/e/wall-street-bulljpgw560.jpg,Dow Jones Futures: Stock Market Rally Stalls,Stock futures: The market rally stalled Tuesday on President Trump's China trade war threat. United Airlines and CSX moved late on earnings.,Investors Business Daily,"Tue, 16 Jul 2019 17:47:20 -0400",,Negative,Article
https://www.youtube.com/watch?v=eLJeUE8nDj8,https://cdn.snapi.dev/images/v1/m/q-6/transports-surging-are-they-signaling-alls-clear-for-the-market.jpg,"Transports surging, are they signaling all's clear for the market?","Transports truck higher, after earnings from JB Hunt.",CNBC Television,"Tue, 16 Jul 2019 17:47:02 -0400",,Positive,Video
https://www.marketwatch.com/story/techs-day-of-reckoning-was-long-and-harsh-on-capitol-hill-2019-07-16,https://cdn.snapi.dev/images/v1/m/w/mw-hn465-sinema-20190716164212-zhjpguuid307a50ee-a80a-11e9-bd08-9c8e992d421e.jpg,Tech’s day of reckoning was long and harsh on Capitol Hill,"Tech’s day of reckoning Tuesday on Capitol Hill started with skepticism about Facebook Inc.’s proposed digital currency, and ended with a spirited debate over charges of anti-conservative bias on Alphabet Inc.’s Google search.",Market Watch,"Tue, 16 Jul 2019 17:28:34 -0400",,Negative,Article
https://www.marketwatch.com/story/house-judiciary-committee-presses-big-tech-on-anti-competitive-behavior-2019-07-16,https://cdn.snapi.dev/images/v1/m/w/mw-hn359-dave-20190715141335-zhjpguuid42ecee28-a72c-11e9-9471-9c8e992d421e.jpg,House Judiciary Committee presses Big Tech on anti-competitive behavior,"Alphabet, Amazon, Facebook, Apple grilled on business practices.",Market Watch,"Tue, 16 Jul 2019 16:51:00 -0400",,Negative,Article
https://www.youtube.com/watch?v=iY9oidMcuOs,https://cdn.snapi.dev/images/v1/z/m/chicago-fed-president-sees-argument-for-a-couple-rate-cuts-by-end-of-year-liesman.jpg,Chicago Fed president sees argument for a couple rate cuts by end of year: Liesman,"Art Laffer, Laffer Associates, joins CNBC's ""Closing Bell"" to discuss potential interest rate cuts from the Fed.",CNBC Television,"Tue, 16 Jul 2019 16:40:24 -0400",,Positive,Video
https://www.reuters.com/article/us-usa-stocks/wall-street-slips-as-bank-earnings-trump-trade-comments-weigh-idUSKCN1UB180,https://cdn.snapi.dev/images/v1/g/q/m02d20190716t2i1408614296rlynxnpef6f103w640.jpg,"Wall Street slips as bank earnings, Trump trade comments weigh","U.S. stocks edged lower on Tuesday as quarterly results from banks added to concerns about lower interest rates dampening their profits, while comments from U.S. President Donald Trump on trade also dragged down Wall Street's major indexes.",Reuters,"Tue, 16 Jul 2019 16:35:40 -0400",earnings,Negative,Article
https://www.youtube.com/watch?v=GXbXSlH6jHQ,https://cdn.snapi.dev/images/v1/y/h/markets-may-not-react-to-weak-earnings-bd8s-doran.jpg,Markets may not react to weak earnings: BD8's Doran,"Barbara Doran of BD8 Capital Partners and David Ellison from Hennessy Funds join CNBC's ""Closing Bell"" to discuss today's market action.",CNBC Television,"Tue, 16 Jul 2019 16:33:48 -0400",,Neutral,Video
https://www.cnbc.com/2019/07/16/ex-fed-vice-chair-meddling-with-dollar-could-kick-off-a-real-swoon.html,https://cdn.snapi.dev/images/v1/j/b/103331211-gettyimages-118413370.jpg,Former Fed Vice Chair Blinder: Meddling with the dollar could 'kick off a real swoon',Princeton professor and former Fed Vice Chairman Alan Blinder told CNBC that political meddling to weaken the dollar could 'kick off a real swoon.',CNBC,"Tue, 16 Jul 2019 16:31:00 -0400",,Neutral,Article
https://www.youtube.com/watch?v=QM34wGzMTz8,https://cdn.snapi.dev/images/v1/m/q-6/wilmington-trusts-shue-we-dont-think-ipo-market-froth-shows-signs-of-tech-bubble.jpg,Wilmington Trust's Shue: We don't think IPO market froth shows signs of tech bubble,"Meghan Shue of Wilmington Trust joins CNBC's ""Closing Bell"" to give her take on recent headlines, including a potential tech bubble and automotive stock performance.",CNBC Television,"Tue, 16 Jul 2019 16:29:59 -0400",,Neutral,Video
https://www.youtube.com/watch?v=VicnoC1u-KE,https://cdn.snapi.dev/images/v1/m/q-6/santelli-exchange-is-the-us-economy-stabilizing.jpg,Santelli Exchange: Is the U.S. economy stabilizing?,Neuberger Berman's Ashok Bhatia and CNBC's Rick Santelli discuss strong retail sales and the Fed's data dependency.,CNBC Television,"Tue, 16 Jul 2019 16:28:47 -0400",,Positive,Video
https://investorplace.com/2019/07/nasdaq-today-rokus-new-highs-beyond-meats-partnership/,https://cdn.snapi.dev/images/v1/6/n/bank3.jpg,Nasdaq Today: Roku’s New Highs; Beyond Meat’s Partnership,"We didn't see new highs in the Nasdaq today. However, Roku, Beyond Meat, Slack and big tech were in focus on the day.",InvestorPlace,"Tue, 16 Jul 2019 16:18:05 -0400",,Positive,Article
https://www.youtube.com/watch?v=-XgDkyAB428,https://cdn.snapi.dev/images/v1/f/t/fts72-1.jpg,Strategist:'If the Fed lowers rates... it means the economy is not as strong as we think',"Nuveen Chief Strategist Bob Doll discusses the Fed, earnings, and stock market highs.",Yahoo Finance,"Tue, 16 Jul 2019 16:18:00 -0400",,Neutral,Video
https://investorplace.com/2019/07/dow-jones-today-earnings-disappointments/,https://cdn.snapi.dev/images/v1/d/o/dow1600-300x169-5.jpg,Dow Jones Today: Earnings Disappointments,Arguably adding to the disappointment that was Tuesday's broader market action was that there was some encouraging economic data out earlier in the day.,InvestorPlace,"Tue, 16 Jul 2019 16:17:35 -0400",earnings,Negative,Article
https://www.reuters.com/article/us-global-markets/u-s-retail-sales-data-dents-stocks-lifts-treasury-yields-idUSKCN1UB03U,https://cdn.snapi.dev/images/v1/4/s/m02d20190716t2i1408704466rlynxnpef6f1ksw640.jpg,"U.S. retail sales data dents stocks, lifts Treasury yields",A gauge of global equities lost ground on Tuesday and U.S. Treasury yields moved higher as a stronger-than-anticipated report on retail sales raised the possibility the Federal Reserve could adopt a less dovish stance.,Reuters,"Tue, 16 Jul 2019 16:14:43 -0400",,Neutral,Article
https://www.forbes.com/sites/greatspeculations/2019/07/16/oil-is-fueling-the-commodities-rally-2019-halftime-report/,https://cdn.snapi.dev/images/v1/e/d/edd2-2.jpg,Oil Is Fueling the Commodities Rally: 2019 Halftime Report,"Commodities were on mostly sound footing in the first half of 2019. The S&P GSCI returned more than 13 percent as of June 30, one of the best first six months in recent memory.",Forbes,"Tue, 16 Jul 2019 16:10:00 -0400",oil,Neutral,Article
https://www.reuters.com/article/us-usa-stocks/u-s-stocks-end-lower-on-concerns-about-bank-earnings-trade-idUSKCN1UB180,https://cdn.snapi.dev/images/v1/h/u/m02d20190716t2i1408614296rlynxnpef6f103w640.jpg,"U.S. stocks end lower on concerns about bank earnings, trade","Wall Street stocks edged lower on Tuesday as quarterly results from banks added to concerns about lower interest rates dampening profits, while comments from U.S. President Donald Trump on trade also weighed on investor sentiment.",Reuters,"Tue, 16 Jul 2019 16:08:28 -0400",earnings,Negative,Article
https://www.gurufocus.com/news/909796/us-indexes-close-lower-tuesday,https://cdn.snapi.dev/images/v1/e/t-2/etf48-46.jpg,US Indexes Close Lower Tuesday (July 16),"The Dow Jones Industrial Average closed at 27,335.63 on Tuesday with a loss of 23.53 points or -0.09%.",GuruFocus,"Tue, 16 Jul 2019 16:00:55 -0400",,Neutral,Article
https://www.reuters.com/article/us-sec-american-realty-settlement/sec-reaches-60-million-settlements-involving-ex-american-realty-executives-idUSKCN1UB2JO,https://cdn.snapi.dev/images/v1/y/t/m02d20190716t2i1408698726rlynxnpef6f1jnw640.jpg,SEC reaches $60 million settlements involving ex-American Realty executives,"Two former executives at American Realty Capital Properties Inc, including the onetime billionaire who built it, have reached more than $60 million in settlements with the U.S. Securities and Exchange Commission of charges they wrongfully extracted millions of dollars from the real estate investment trust.",Reuters,"Tue, 16 Jul 2019 15:53:54 -0400",,Neutral,Article
https://www.youtube.com/watch?v=AyPAeqm6HuI,https://cdn.snapi.dev/images/v1/m/q-6/the-leveraged-loan-collapse-that-reveals-a-key-risk-in-the-credit-market.jpg,The Leveraged-Loan Collapse That  Reveals a Key Risk in the Credit Market,"Jul.16 -- Almost overnight, a $693 million loan Clover Technologies took to the market five years ago lost about a third of its value.",Bloomberg Markets and Finance,"Tue, 16 Jul 2019 15:44:48 -0400",,Negative,Video
https://www.youtube.com/watch?v=vCX2e9Yj074,https://cdn.snapi.dev/images/v1/v/8/chicago-feds-evans-global-economy-fiscal-policy-would-help-inflation.jpg,"Chicago Fed's Evans: Global economy, fiscal policy would help inflation","CNBC's Steve Liesman sits down with Chicago Fed president Charles Evans to discuss his U.S. economic outlook, policy and inflation at the @Work event in Chicago.",CNBC Television,"Tue, 16 Jul 2019 15:41:40 -0400",,Neutral,Video
https://www.youtube.com/watch?v=hs236kcpw7U,https://cdn.snapi.dev/images/v1/i/n/fed-pushing-on-a-string-as-credit-market-poses-significant-risk-ex-cantor-ceo-says.jpg,"Fed Pushing on a String as Credit Market Poses Significant Risk, Ex-Cantor CEO Says","Shawn Matthews, Hondius Capital Management chief investment officer and former Cantor Fitzgerald chief executive officer, discusses the risk in credit markets and Federal Reserve monetary policy with Bloomberg's Vonnie Quinn on ""Bloomberg Markets.""",Bloomberg Markets and Finance,"Tue, 16 Jul 2019 15:27:12 -0400",CEO,Negative,Video
https://www.cnbc.com/2019/07/16/big-banks-signal-fed-rate-cuts-may-not-be-so-great-for-them.html,https://cdn.snapi.dev/images/v1/y/s/bank7.jpg,Big banks signal Fed rate cuts may not be so great for them,The largest U.S. banks are scrutinizing members of the Federal Reserve for any insight into how the central bank will tinker interest rates.,CNBC,"Tue, 16 Jul 2019 15:24:00 -0400",,Negative,Article
https://www.youtube.com/watch?v=ajzGi-xA-7U,https://cdn.snapi.dev/images/v1/w/w/etf38-41.jpg,Is the Bar Too Low for Q2 Earnings?,"Not much growth is expected for the June and September quarters, but growth is expected to improve in Q4 and beyond.",Zacks Investment Research,"Tue, 16 Jul 2019 15:18:46 -0400",earnings,Negative,Video
https://www.reuters.com/article/us-crypto-currencies/bitcoin-tumbles-as-u-s-senators-grill-facebook-on-crypto-plans-idUSKCN1UB24T,https://cdn.snapi.dev/images/v1/b/i/bit922-1.jpg,Bitcoin tumbles as U.S. senators grill Facebook on crypto plans,"The cryptocurrency market took a beating on Tuesday with bitcoin losing over 10% in value after U.S. lawmakers grilled Facebook  on its cryptocurrency plans, as political and regulatory scrutiny of digital coins intensifies.",Reuters,"Tue, 16 Jul 2019 15:18:00 -0400",,Negative,Article
https://www.cnbc.com/2019/07/16/peter-thiel-silicon-valley-spy-comments-have-some-basis-in-reality.html,https://cdn.snapi.dev/images/v1/1/0-3/105068487-gettyimages-619458242.jpg,"Peter Thiel's comments about spies in Silicon Valley have some basis in reality, but no evidence","But it's important to separate this very real threat from Thiel's specific allegations about Google, which were presented without proof, and from his claims that Google has participated in ""treasonous"" activity.",CNBC,"Tue, 16 Jul 2019 15:06:00 -0400",,Neutral,Article
https://www.investors.com/market-trend/stock-market-today/nasdaq-today-ual-stock-leads-airline-rally/,https://cdn.snapi.dev/images/v1/e/t/etf26-53.jpg,"Nasdaq Today: UAL Stock Leads Airline Rally, But Semiconductor Stocks Weak","The Nasdaq today was weighed down by weakness in semiconductor stocks, but United Airlines was a top gainer in the Nasdaq 100.",Investors Business Daily,"Tue, 16 Jul 2019 15:03:32 -0400",,Neutral,Article
https://www.youtube.com/watch?v=UZ03XT7OITU,https://cdn.snapi.dev/images/v1/d/w/presidents-can-send-dreadful-nominees-to-fed-as-a-weapon-blinder.jpg,Presidents can send dreadful nominees to Fed as a weapon: Blinder,"CNBC's ""Power Lunch"" discusses Federal Reserve picks with Alan Blinder, economic professor at Princeton University and the former vice chairman of the Federal Reserve.",CNBC Television,"Tue, 16 Jul 2019 15:02:01 -0400",,Negative,Video
https://www.cnbc.com/2019/07/16/feds-evans-comfortable-with-a-couple-rate-cuts-before-the-end-of-year.html,https://cdn.snapi.dev/images/v1/8/t/105852403-1555336007832img-0432r.jpg,Fed's Charles Evans says he'd be comfortable with 'a couple' rate cuts before the end of the year,Evans spoke Tuesday at CNBC's @Work Human Capital + Finance Conference in Chicago.,CNBC,"Tue, 16 Jul 2019 14:47:00 -0400",,Positive,Article
https://www.youtube.com/watch?v=RkoxOE7XcwM,https://cdn.snapi.dev/images/v1/s/d/what-would-happen-if-congress-approached-tech-regulation-like-europe.jpg,What would happen if Congress approached tech regulation like Europe?,"CNBC's ""Power Lunch"" team breaks down the impact tech regulation may have with Ali Mogharabi, Morningstar analyst, and James Pethokoukis of AEI.",CNBC Television,"Tue, 16 Jul 2019 14:41:44 -0400",,Neutral,Video
https://www.youtube.com/watch?v=jAmS-0JLdR8,https://cdn.snapi.dev/images/v1/o/j/july-earnings-be-critical-to-market-outlook-says-expert.jpg,"July earnings be critical to market outlook, says expert","CNBC's ""Power Lunch"" team discusses markets with Jim Paulsen, Leuthold chief investment strategist, and Alli McCartney, UBS managing director.",CNBC Television,"Tue, 16 Jul 2019 14:36:13 -0400",earnings,Neutral,Video
https://www.youtube.com/watch?v=m5KjycN-u00,https://cdn.snapi.dev/images/v1/r/t/beats-on-bank-earnings-mostly-not-high-quality-says-cnbcs-hugh-son.jpg,"Beats on bank earnings mostly not high quality, says CNBC's Hugh Son","Anton Schutz, Mendon Capital Advisors CIO, and CNBC's Hugh Son join ""The Exchange"" to discuss bank earnings and Wells Fargo's search for a new CEO.",CNBC Television,"Tue, 16 Jul 2019 14:29:36 -0400",earnings,Positive,Video
https://www.cnbc.com/2019/07/16/the-us-consumer-is-keeping-the-economy-from-tanking.html,https://cdn.snapi.dev/images/v1/s/4/103236236-gettyimages-89636283.jpg,The US consumer is keeping the economy from tanking and will get another boost from the Fed,"American consumers are flexing their muscles, and that's helping to save the economy from even slower growth as it faces what could be a protracted trade war.",CNBC,"Tue, 16 Jul 2019 14:29:00 -0400",,Positive,Article
https://www.youtube.com/watch?v=tJafkiStpkY,https://cdn.snapi.dev/images/v1/f/u/the-market-has-generally-been-more-right-than-the-fed-says-chief-economist.jpg,"The market has generally been more right than The Fed, says chief economist","Joe LaVorgna, Natixis chief economist, and Steve Grasso of Stuart Frankel & Co.",CNBC Television,"Tue, 16 Jul 2019 14:27:58 -0400",,Neutral,Video
https://www.reuters.com/article/us-global-markets/global-stocks-fall-u-s-yields-rise-on-retail-sales-data-idUSKCN1UB03U,https://cdn.snapi.dev/images/v1/z/k/m02d20190716t2i1408506437rlynxnpef6f0drw640.jpg,"Global stocks fall, U.S. yields rise on retail sales data",A gauge of global equities fell on Tuesday and U.S. Treasury yields climbed as a stronger-than-anticipated report on retail sales raised the possibility the Federal Reserve could move towards a less dovish stance.,Reuters,"Tue, 16 Jul 2019 14:22:31 -0400",,Negative,Article
https://www.marketwatch.com/story/more-than-half-of-gulf-of-mexico-oil-production-remains-offline-after-hurricane-barry-2019-07-16,https://cdn.snapi.dev/images/v1/o/i/oil44.jpg,More than half of Gulf of Mexico oil production remains offline after Hurricane Barry,"Oil production in the Gulf of Mexico improved for a second straight day on Tuesday, but more than half remained offline.",Market Watch,"Tue, 16 Jul 2019 14:19:21 -0400",oil,Neutral,Article
