news_url,image_url,title,text,source_name,date,topics,sentiment,type
https://www.reuters.com/article/us-global-markets/asian-shares-edge-up-before-ecb-decision-euro-near-two-month-lows-idUSKCN1UK02P,https://cdn.snapi.dev/images/v1/u/f/m02d20190725t2i1411687924rlynxnpef6o05qw640.jpg,"Asian shares edge up before ECB decision, euro near two-month lows","Asian shares rose but struck a more cautious note than a tech-fueled rally on Wall Street, while the euro stayed near two-month lows as soft economic data fueled hopes the European Central Bank could cut rates at its meeting on Thursday.",Reuters,"Wed, 24 Jul 2019 23:55:15 -0400",,Positive,Article
https://www.reuters.com/article/us-global-oil/oil-advances-as-markets-eye-mideast-worries-but-weak-demand-outlook-caps-gains-idUSKCN1UK04B,https://cdn.snapi.dev/images/v1/9/x/m02d20190725t2i1411681740rlynxnpef6o056w640.jpg,"Oil advances as markets eye MidEast worries, but weak demand outlook caps gains","Oil prices edged higher on Thursday amid lingering Middle East tensions and after U.S. crude stocks dropped more than expected, but gains were stemmed by a fragile demand outlook amid more signs of slowing global economic growth.",Reuters,"Wed, 24 Jul 2019 23:24:00 -0400",oil,Negative,Article
https://nypost.com/2019/07/24/thanks-to-our-trillion-dollar-deficit-inflation-will-hit-us-hard/,https://cdn.snapi.dev/images/v1/p/p/inflationjpgquality90stripall.jpg,"Thanks to our trillion dollar deficit, inflation will hit us hard",The White House reported last week that the 2019 budget deficit will top $1 trillion. Remember when people used to care.,New York Post,"Wed, 24 Jul 2019 22:09:22 -0400",,Negative,Article
https://nypost.com/2019/07/24/bullish-gdp-report-could-make-feds-rate-decision-a-lot-harder/,https://cdn.snapi.dev/images/v1/7/r/190724-crudele-gdpjpgquality90stripall.jpg,Bullish GDP report could make Fed’s rate decision a lot harder,"The Federal Reserve’s job could be a lot easier or a lot harder depending on what Friday’s report on the nation’s gross domestic product shows. The report will also show, with greater clarity, what has really been happening with the US economy since well before the last presidential election.",New York Post,"Wed, 24 Jul 2019 21:56:12 -0400",,Positive,Article
https://www.reuters.com/article/us-global-markets/asian-shares-dither-ahead-of-ecb-outcome-euro-near-two-month-lows-idUSKCN1UK02P,https://cdn.snapi.dev/images/v1/2/2/m02d20190725t2i1411673948rlynxnpef6o03jw640.jpg,"Asian shares dither ahead of ECB outcome, euro near two-month lows","Asian shares were cautious on Thursday, shrugging off a tech-fuelled rally on Wall Street while the euro hovered near two-month lows as soft economic data bolstered expectations of rate cuts in Europe.",Reuters,"Wed, 24 Jul 2019 21:00:47 -0400",,Neutral,Article
https://www.youtube.com/watch?v=S8dELxRFfag,https://cdn.snapi.dev/images/v1/m/q-6/cramer-trumps-government-has-become-the-wildcard-wreaking-havoc-in-this-market.jpg,Cramer: Trump's government has become the wildcard wreaking havoc in this market,"The White House is not as business-friendly as previously thought, and it's not getting enough attention, CNBC's Jim Cramer says.",CNBC Television,"Wed, 24 Jul 2019 19:40:56 -0400","cramer,madmoney",Neutral,Video
https://www.investopedia.com/tech-leads-melt-up-4705433,https://cdn.snapi.dev/images/v1/1/0-3/105656004-1546454238884gettyimages-1076544150.jpeg,Tech Leads Melt-Up,The S&P 500 and Nasdaq Composite hit new highs as the tech sector reached for new highs and small caps showing signs of life.,Investopedia,"Wed, 24 Jul 2019 19:37:43 -0400",,Neutral,Article
https://www.youtube.com/watch?v=6YpcoxX9M2Y,https://cdn.snapi.dev/images/v1/c/w/us-trade-negotiators-head-back-to-china-to-resume-trade-talks.jpg,US trade negotiators head back to China to resume trade talks,"Fundstrat Global Advisors Tom Lee discusses the upcoming U.S. trade talks with China, the federal reserve and the market's reaction.",Yahoo Finance,"Wed, 24 Jul 2019 19:34:21 -0400",,Neutral,Video
https://www.youtube.com/watch?v=-fzYetBL868,https://cdn.snapi.dev/images/v1/j/d/if-the-fed-cuts-rates-in-july-2019-how-much-will-it-be-for.jpg,"If the Fed cuts rates in July 2019, how much will it be for?","Angel Oak Capital Senior Portfolio Manager  Sam Dunlop discusses what the likelihood of a Fed rate cut is, and factors weighing on the Fed's decision.",Yahoo Finance,"Wed, 24 Jul 2019 19:24:20 -0400",,Neutral,Video
https://www.forbes.com/sites/bryanrich/2019/07/24/fed-rate-cut-should-fuel-a-boom-in-global-stocks/,https://cdn.snapi.dev/images/v1/e/t/etf19-54.jpg,Fed Rate Cut Should Fuel A Boom In Global Stocks,We already know all three of these major central banks have made it clear over the past seven months that they will do more easing and more unconventional policies if needed.,Forbes,"Wed, 24 Jul 2019 19:15:25 -0400",,Positive,Article
https://www.reuters.com/article/us-usa-trade-china-tariffs-focus/to-survive-trade-war-some-u-s-importers-embark-on-major-revamps-of-product-lines-idUSKCN1UJ37D,https://cdn.snapi.dev/images/v1/z/z/m02d20190724t2i1411645582rlynxnpef6n2b5w640.jpg,"To survive trade war, some U.S. importers embark on major revamps of product lines","When U.S President Donald Trump tweeted in May his intention to raise tariffs on Chinese goods, management at California-based NewAir Appliances knew they needed to do something or their business would be in trouble.",Reuters,"Wed, 24 Jul 2019 19:08:14 -0400",,Neutral,Article
https://www.forbes.com/sites/bryanrich/2019/07/24/these-earnings-reports-are-signaling-a-q2-gdp-surprise/,https://cdn.snapi.dev/images/v1/e/t/etf38-43.jpg,These Earnings Reports Are Signaling A Q2 GDP Surprise,"With about a fifth of the companies now reported, close to 80% have surprised positively on earnings, on an earnings growth rate of about 7%.",Forbes,"Wed, 24 Jul 2019 18:55:19 -0400",earnings,Neutral,Article
https://www.youtube.com/watch?v=ZO3HHBboUrw,https://cdn.snapi.dev/images/v1/a/7/markets-are-in-a-mid-cycle-slowdown-voya-ceo-says.jpg,"Markets Are in a Mid-Cycle Slowdown, Voya CEO Says","Christine Hurtsellers, Voya Investment Management chief executive officer, discusses the performance of U.S. stocks and the fixed-income market with Bloomberg's Romaine Bostick, Caroline Hyde and Taylor Riggs on ""Bloomberg Markets: What'd You Miss?""",Bloomberg Markets and Finance,"Wed, 24 Jul 2019 18:18:31 -0400",CEO,Negative,Video
https://www.zacks.com/commentary/448903/q2-earnings-season-the-trade-issue,https://cdn.snapi.dev/images/v1/y/l/machinery-construction8.jpg,Q2 Earnings Season & the Trade Issue,Q2 Earnings Season & the Trade Issue,Zacks Investment Research,"Wed, 24 Jul 2019 17:45:00 -0400",earnings,Neutral,Article
https://www.forbes.com/sites/greatspeculations/2019/07/24/how-bank-closures-could-be-giving-rise-to-digital-currencies/,https://cdn.snapi.dev/images/v1/c/l/closing-sign-e1564004078301.jpg,How Bank Closures Could Be Giving Rise to Digital Currencies,"Fintech has undoubtedly given millions of people access to fast, convenient and 24-hour banking and payment services such as Venmo, Apple Pay, PayPay and more. But these services only work if you have a bank account.",Forbes,"Wed, 24 Jul 2019 17:43:00 -0400",,Neutral,Article
https://www.youtube.com/watch?v=xiGiLExW7M0,https://cdn.snapi.dev/images/v1/v/s/technicals-support-new-highs-for-nasdaq-100-bofa-merrills-suttmeier-says.jpg,"Technicals Support New Highs for Nasdaq 100, BofA Merrill's Suttmeier Says","On this edition of ""Charting Futures,"" Steve Suttmeier, Bank of America Merrill Lynch technical analyst, examines the performance of tech and growth stocks with Bloomberg's Abigail Doolittle on ""Bloomberg Markets: The Close.",Bloomberg Markets and Finance,"Wed, 24 Jul 2019 17:41:46 -0400",tanalysis,Positive,Video
https://www.youtube.com/watch?v=jJRbvGLO7Ug,https://cdn.snapi.dev/images/v1/i/v/wall-streets-role-in-the-demise-of-popular-retailers.jpg,Wall Street's Role in the Demise of Popular Retailers,"Bloomberg's Lisa Abramowicz explains why private equity and hedge funds are partially to blame for the demise of popular retailers. She speaks on ""Bloomberg Markets: The Close.""",Bloomberg Markets and Finance,"Wed, 24 Jul 2019 17:04:42 -0400",,Negative,Video
https://www.gurufocus.com/news/914680/us-indexes-continue-to-gain-closing-mostly-higher-on-wednesday-,https://cdn.snapi.dev/images/v1/e/t-2/etf39-35.jpg,"US Indexes Continue to Gain, Closing Mostly Higher on Wednesday","The Dow Jones Industrial Average closed at 27,269.97 on Wednesday with a loss of 79.22 points or -0.29%.",GuruFocus,"Wed, 24 Jul 2019 17:03:21 -0400",,Positive,Article
https://investorplace.com/2019/07/stock-market-today-big-tech-in-focus-automotive-drama/,https://cdn.snapi.dev/images/v1/1/0-3/106006431-1562578426334gettyimages-452926200.jpeg,"Stock Market Today: Big Tech in Focus, Automotive Drama","Amazon, Facebook and Alphabet report earnings in the next two days, but a government investigation is stealing the headlines in the stock market today.",InvestorPlace,"Wed, 24 Jul 2019 16:55:05 -0400",,Neutral,Article
https://www.youtube.com/watch?v=OW1NMy5zeVY,https://cdn.snapi.dev/images/v1/h/e/etf4.jpg,Stocks Overbought? One Simple Gauge Nobody's Using,This technical tool should be applied whenever it looks like the market is running too hot.,Zacks Investment Research,"Wed, 24 Jul 2019 16:54:48 -0400",tanalysis,Neutral,Video
https://www.reuters.com/article/us-usa-trade-china/top-u-s-china-trade-negotiators-to-meet-in-shanghai-next-week-idUSKCN1UJ1JI,https://cdn.snapi.dev/images/v1/l/g/m02d20190724t2i1411607952rlynxnpef6n0zsw640.jpg,"Top U.S., China trade negotiators to meet in Shanghai next week",Top U.S. and Chinese negotiators will meet face-to-face next week for the first time since Presidents Donald Trump and Xi Jinping agreed to revive talks to end their year-long trade war.,Reuters,"Wed, 24 Jul 2019 16:52:19 -0400",,Neutral,Article
https://www.cnbc.com/2019/07/24/doj-goes-after-big-techheres-what-5-experts-are-watching-now.html,https://cdn.snapi.dev/images/v1/h/f/105841141-1555591529863barr.jpg,DOJ goes after Big Tech—here's what 5 experts are watching now,"Facebook, Amazon and Google parent Alphabet were front and center Wednesday as the Justice Department prepared for an antitrust probe of Big Tech, and experts have their eyes on earnings.",CNBC,"Wed, 24 Jul 2019 16:51:00 -0400",,Negative,Article
https://www.youtube.com/watch?v=N8cVOLxbg40,https://cdn.snapi.dev/images/v1/r/o/i-dont-think-this-is-an-earnings-driven-rally-peter-cecchini.jpg,I don't think this is an earnings-driven rally: Peter Cecchini,"Peter Cecchini, global chief market strategist at Cantor Fitzergerald, joins CNBC's ""Closing Bell"" to discuss his take on the earnings season so far.",CNBC Television,"Wed, 24 Jul 2019 16:28:31 -0400",,Neutral,Video
https://investorplace.com/2019/07/dow-jones-today-the-dow-has-a-caterpillar-problem/,https://cdn.snapi.dev/images/v1/r/p/edd2-7.jpg,Dow Jones Today: The Dow Has a Caterpillar Problem,"It was a different ballgame for the Dow Jones Industrial Average, which slumped 0.29%.The Dow's Wednesday weakness was largely attributable to a 4.50% loss industrial machinery maker Caterpillar.
The post Dow Jones Today: The Dow Has a Caterpillar Problem appeared first on InvestorPlace.",InvestorPlace,"Wed, 24 Jul 2019 16:13:29 -0400",,Negative,Article
https://www.reuters.com/article/us-markets-shortinterest-nasdaq/nasdaq-short-interest-up-0-8-in-early-july-idUSKCN1UJ2UD,https://cdn.snapi.dev/images/v1/o/c/m02d20190724t2i1411597491rlynxnpef6n1z1w640.jpg,Nasdaq short interest up 0.8% in early July,"Short interest on the Nasdaq rose 0.8% in early July, the exchange said on Wednesday.",Reuters,"Wed, 24 Jul 2019 16:12:45 -0400",,Negative,Article
https://www.marketwatch.com/story/tech-shares-lead-sp-500-nasdaq-to-record-finish-2019-07-24,https://cdn.snapi.dev/images/v1/f/n/etf29.jpg,"Tech shares lead S&P 500, Nasdaq to record finish","The S&P 500 and Nasdaq Composite index posted record finishes on Wednesday, led in part by gains for tech stocks.",Market Watch,"Wed, 24 Jul 2019 16:11:52 -0400",,Neutral,Article
https://www.cnbc.com/2019/07/24/europe-up-next-as-central-banks-return-to-lower-rate-world.html,https://cdn.snapi.dev/images/v1/s/w/105276812-gettyimages-949169642.jpg,"The Fed is leading a global push to lower rates, and Europe is getting ready to follow suit",The European Central Bank on Thursday is expected to weigh lowering its already-negative interest rate.,CNBC,"Wed, 24 Jul 2019 16:09:00 -0400",,Neutral,Article
https://www.forbes.com/sites/betsyatkins/2019/07/24/antitrust-probe-against-tech-giants-how-boards-can-brace-themselves/,https://cdn.snapi.dev/images/v1/u/t/0x600.jpg,Antitrust Probe Against Tech Giants - How Boards Can Brace Themselves,"Regardless of where you fall on the spectrum of opinion, the ongoing inquiries into the practices of dominant tech companies have the potential to completely reshape the competitive landscape and lead to revamped regulations and higher standards for best practices.",Forbes,"Wed, 24 Jul 2019 15:55:00 -0400",,Negative,Article
https://www.youtube.com/watch?v=WAAmiXGgQfE,https://cdn.snapi.dev/images/v1/p/u/the-us-has-most-stable-growth-in-the-world-says-bmo-capital-markets-brian-belski.jpg,"The US has 'most stable' growth in the world, says BMO Capital Markets' Brian Belski","Brian Belski, BMO Capital Markets, and Greg Ip, Wall Street Journal, join 'The Exchange' to discuss the current state of the U.S.",CNBC Television,"Wed, 24 Jul 2019 15:39:23 -0400",,Positive,Video
https://www.youtube.com/watch?v=wPtTLbjhJm8,https://cdn.snapi.dev/images/v1/f/f/unclear-if-doj-ftc-have-clearance-to-investigate-specific-big-tech-companies-antitrust-lawyer.jpg,"Unclear if DOJ, FTC have clearance to investigate specific Big Tech companies: Antitrust lawyer","Josh Brown, CEO of Ritholtz Wealth Management and Alexis Gilman, a lawyer with Crowell & Moring's Antitrust Group, join CNBC's ""Closing Bell"" team breaks down the Department of Justice's antitrust overview and what it means for the technology industry.",CNBC Television,"Wed, 24 Jul 2019 15:38:58 -0400",,Negative,Video
https://www.reuters.com/article/us-global-oil/oil-falls-1-despite-large-u-s-stockpile-decline-idUSKCN1UJ03K,https://cdn.snapi.dev/images/v1/4/l/m02d20190724t2i1411277194rlynxnpef6n021w640.jpg,Oil falls 1% despite large U.S. stockpile decline,"Oil prices fell 1% on Wednesday, failing to draw lasting support from a large decrease in U.S. crude stockpiles as investors worried about global oil demand.",Reuters,"Wed, 24 Jul 2019 15:08:42 -0400",oil,Negative,Article
https://www.gurufocus.com/news/914595/royce-funds-commentary-how-smallcaps-are-navigating-an-uncertain-economy,https://cdn.snapi.dev/images/v1/a/s/asset-management31-15.jpg,Royce Funds Commentary: How Small-Caps Are Navigating an Uncertain Economy,Chuck Royce and Francis Gannon detail where they are finding small-cap opportunities amid negative economic news.,GuruFocus,"Wed, 24 Jul 2019 15:04:02 -0400",,Neutral,Article
https://www.youtube.com/watch?v=oGU-E_woWp0,https://cdn.snapi.dev/images/v1/g/i/doj-wont-hesitate-to-take-action-again-big-tech-says-former-ftc-employee.jpg,"DOJ won't hesitate to take action again Big Tech, says former FTC employee","Mike Isaac of The New York Times and Kevin Arquit, former FTC employee, break down the Department of Justice's broad review of Big Tech with CNBC's ""Power Lunch"" team.",CNBC Television,"Wed, 24 Jul 2019 14:52:57 -0400",,Neutral,Video
https://www.marketwatch.com/story/sp-500-earnings-outlook-worsens-slightly-in-the-past-week-2019-07-24,https://cdn.snapi.dev/images/v1/a/j/etf27.jpg,S&P 500 earnings outlook worsens slightly in the past week.,"The outlook for the second-quarter earnings season is now a little more negative, after a little more than one-quarter of the S&P 500 SPX, +0.26% companies reported results.",Market Watch,"Wed, 24 Jul 2019 14:49:23 -0400",earnings,Negative,Article
https://www.cnbc.com/2019/07/24/market-analyst-ponders-whether-weve-hit-peak-fang-peak-pot-peak-millennials.html,https://cdn.snapi.dev/images/v1/1/0-3/105585065-1542733867543gettyimages-1020986250.jpeg,"Market analyst ponders whether we've hit 'peak FANG, peak Pot, peak millennials'",One strategist thinks this bull market could end as focus shifts away from millennials and onto Gen Z.,CNBC,"Wed, 24 Jul 2019 14:43:00 -0400",,Neutral,Article
https://www.reuters.com/article/us-usa-stocks/surging-chip-stocks-send-nasdaq-to-record-high-idUSKCN1UJ1D6,https://cdn.snapi.dev/images/v1/4/e/m02d20190724t2i1411569114rlynxnpef6n1sfw640.jpg,Surging chip stocks send Nasdaq to record high,The Nasdaq hit a record high on Wednesday and the S&P 500 was close behind as reassuring comments from Texas Instruments about global chip demand blunted the impact of weak earnings reports from Boeing and Caterpillar.,Reuters,"Wed, 24 Jul 2019 14:32:29 -0400",,Positive,Article
https://www.gurufocus.com/news/914524/dow-jones-declines-wednesday,https://cdn.snapi.dev/images/v1/u/s/us882-3.jpg,Dow Jones Declines Wednesday,The Dow Jones Industrial Average fell on Wednesday after Caterpillar (NYSE:CAT) and Boeing (NYSE:BA) missed expectations for the quarter.,GuruFocus,"Wed, 24 Jul 2019 14:29:34 -0400",,Negative,Article
https://www.cnbc.com/2019/07/24/new-pentagon-chief-very-concerned-about-chinese-tech-getting-into-us-systems.html,https://cdn.snapi.dev/images/v1/r/j/106037716-1563990427706gettyimages-1157420096.jpeg,New Defense secretary: We should be 'very concerned' about Chinese tech getting into US systems,"""And I think we need to be very concerned about Chinese technology getting into our systems or the systems of our allies. Huawei is the poster child right now for that,"" Mark Esper says.",CNBC,"Wed, 24 Jul 2019 14:23:00 -0400",,Negative,Article
https://seekingalpha.com/article/4277137-bitcoin-ride-just-starting-part-4?source=feed_tag_long_ideas,https://cdn.snapi.dev/images/v1/b/i/bit922-2.jpg,Bitcoin - The Ride Is Just Starting Part 4,Investors who want to own Bitcoin will have one last chance before it leaves the price station headed to significantly higher levels.,Seeking Alpha,"Wed, 24 Jul 2019 14:19:33 -0400",,Positive,Article
https://www.reuters.com/article/us-global-markets/downbeat-u-s-earnings-cap-investor-enthusiasm-euro-drops-on-soft-data-idUSKCN1UJ02N,https://cdn.snapi.dev/images/v1/r/e/m02d20190724t2i1411558917rlynxnpef6n1pxw640.jpg,Downbeat U.S. earnings cap investor enthusiasm; euro drops on soft data,"U.S. stocks were mixed on Wednesday as a series of disappointing second-quarter results curbed investor optimism over a new round of U.S.-China trade talks next week, while the euro dropped to a two-month low, pressured by soft economic data.",Reuters,"Wed, 24 Jul 2019 14:01:14 -0400",earnings,Negative,Article
https://www.youtube.com/watch?v=yBDlzbXL8Kc,https://cdn.snapi.dev/images/v1/7/4/us-10-year-yield-is-headed-to-0-says-jpmorgan-asset-management-cio.jpg,"US 10-year yield is headed to 0%, says JPMorgan Asset Management CIO","Bob Michele, J.P. Morgan Asset Management CIO and head of global fixed income, joins 'Fast Money Halftime Report' to discuss his predictions for the U.S. ten-year yield, bond stocks and what the Fed's next move could be.",CNBC Television,"Wed, 24 Jul 2019 13:29:15 -0400",,Neutral,Video
https://www.cnbc.com/2019/07/24/heres-how-the-stock-market-will-react-to-a-rate-cut-next-week.html,https://cdn.snapi.dev/images/v1/p/u/105710130-1548884128761powell.jpg,"Here's how the stock market will likely react to the Fed's big decision next week, history shows",Barclays's chief U.S. stock strategist says stock could sell off by about 1% if the Fed surprises investors and holds rates steady.,CNBC,"Wed, 24 Jul 2019 13:18:00 -0400",,Neutral,Article
https://www.youtube.com/watch?v=S6Y0YXv-poA,https://cdn.snapi.dev/images/v1/o/6/former-antitrust-chief-voters-will-help-decide-if-big-tech-should-be-regulated.jpg,Former antitrust chief: Voters will help decide if Big Tech should be regulated,"Bill Baer, partner at the Arnold and Porter law firm and former antitrust head at the DOJ, joins ""Squawk Alley"" to discuss the FTC's settlement with Facebook and regulating Big Tech.",CNBC Television,"Wed, 24 Jul 2019 12:24:17 -0400",,Neutral,Video
https://www.marketwatch.com/story/us-oil-futures-take-a-turn-lower-despite-the-hefty-drop-in-weekly-us-crude-supplies-2019-07-24,https://cdn.snapi.dev/images/v1/o/i/oil25-2.jpg,U.S. oil futures take a turn lower despite the hefty drop in weekly U.S. crude supplies,"U.S. oil futures took a turn lower on Wednesday, giving up earlier gains that came on the back of a significant weekly drop in U.S. crude supplies.",Market Watch,"Wed, 24 Jul 2019 12:20:29 -0400",oil,Neutral,Article
https://www.youtube.com/watch?v=qGFV16Z0Eu0,https://cdn.snapi.dev/images/v1/m/q-6/now-is-the-time-to-be-cautious-in-muni-market-neuberger-berman.jpg,Now Is the Time to Be Cautious in Muni Market: Neuberger Berman,"Jamie Iseliin, head of muni fixed income at Neuberger Berman, examines the municipal bond market with Bloomberg's Taylor Riggs in this week's ""Muni Moment"" on ""Bloomberg Markets.",Bloomberg Markets and Finance,"Wed, 24 Jul 2019 12:11:51 -0400",,Negative,Video
https://www.geekwire.com/2019/huawei-cuts-jobs-seattle-area-research-division-part-larger-layoff/,https://cdn.snapi.dev/images/v1/2/0/20180111-ces-13-768x512.jpg,Huawei cuts jobs at Seattle-area research division as part of larger layoff,"Chinese tech giant Huawei is shedding 41 jobs at its Bellevue, Wash.",GeekWire,"Wed, 24 Jul 2019 12:10:21 -0400",,Negative,Article
https://www.youtube.com/watch?v=EDD9fKA21Yk,https://cdn.snapi.dev/images/v1/u/d/listen-to-that-earnings-call-jim-cramer-on-boeing-and-caterpillar-earnings.jpg,Listen to That Earnings Call: Jim Cramer on Boeing and Caterpillar Earnings,"SUBSCRIBE | http://t.st/TheStreetTV

Jim Cramer wrote about the importance of doing your investing homework and listening to the earnings call, and he weighs in on Boeing and Caterpllar's earnings.",The Street,"Wed, 24 Jul 2019 12:06:57 -0400","earnings,cramer",Neutral,Video
https://www.investopedia.com/why-storm-clouds-are-hanging-over-the-everything-rally-4694511,https://cdn.snapi.dev/images/v1/e/t/etf48-46.jpg,Why Storm Clouds Are Hanging Over The 'Everything Rally',"A variety of asset classes have rallied in response to dovish monetary policies, but those gains may be at risk.",Investopedia,"Wed, 24 Jul 2019 12:03:30 -0400",,Negative,Article
https://www.gurufocus.com/news/914226/mohnish-pabrais-ten-commandments-of-investing-,https://cdn.snapi.dev/images/v1/a/s/asset-management30-15.jpg,Mohnish Pabrai's Ten Commandments Of Investing,The ten rules of investing according to Mohnish Pabrai.,GuruFocus,"Wed, 24 Jul 2019 11:59:57 -0400",,Neutral,Article
https://www.gurufocus.com/news/914264/warren-buffett-the-options-trader,https://cdn.snapi.dev/images/v1/1/0-3/105187087-warren-buffett-256-2530x298.jpg,Warren Buffett the Options Trader,"When it comes to long-term investing, there's one undisputed champion, and that's Warren Buffett (Trades, Portfolio).",GuruFocus,"Wed, 24 Jul 2019 11:59:16 -0400",wbuffett,Neutral,Article
