news_url,image_url,title,text,source_name,date,topics,sentiment,type
https://www.forbes.com/sites/greatspeculations/2019/07/31/what-investors-believe-central-banks-have-their-backs/,https://cdn.snapi.dev/images/v1/i/b/0x600.jpg,What Investors Believe: Central Banks Have Their Backs,"In a world of fragile economic growth where the odds of recession have been on the rise, investors are now convinced that central banks (CBs), led by the Fed, have their backs, as they see the CBs as “buyers of last resort.”",Forbes,"Wed, 31 Jul 2019 23:10:51 -0400",,Neutral,Article
https://nypost.com/2019/07/31/economists-call-the-fed-interest-rate-cut-an-unwise-decision/,https://cdn.snapi.dev/images/v1/9/h/jerome-powelljpgquality90stripall.jpg,Economists call the Fed interest rate cut an ‘unwise decision’,"The Federal Reserve’s quarter-point rate cut was too little for Wall Street — and too much for some economists. “The Fed’s decision today is like in the days when doctors bled their patients to heal them,” Chris Rupkey, chief financial economist at MUFG Union Bank, said Wednesday, calling the cut an “unwise decision.",New York Post,"Wed, 31 Jul 2019 22:18:46 -0400",,Negative,Article
https://nypost.com/2019/07/31/the-fed-getting-a-sneak-peek-at-julys-job-numbers-isnt-a-bad-thing/,https://cdn.snapi.dev/images/v1/k/x/federal-reserve-1jpgquality90stripall.jpg,The Fed getting a sneak peek at July’s job numbers isn’t a bad thing,"The way things are supposed to work, the Federal Reserve shouldn’t have seen the job figures for July that will be reported Friday. Those numbers are supposed to be secret until late Thursday, when the head of the Federal Reserve is given a sneak peek.",New York Post,"Wed, 31 Jul 2019 21:42:15 -0400",,Neutral,Article
https://www.youtube.com/watch?v=PNfC57Fk5lU,https://cdn.snapi.dev/images/v1/x/6/asian-central-banks-will-continue-to-ease-policy-says-axa-investments-yao.jpg,"Asian Central Banks Will Continue to Ease Policy, says AXA Investment’s Yao","Aidan Yao, senior emerging Asia economist at AXA Investment Managers, discusses South Korea’s July CPI and export data and Asian central bank policy. He speaks on “Bloomberg Daybreak: Asia.”",Bloomberg Markets and Finance,"Wed, 31 Jul 2019 21:37:03 -0400",,Neutral,Video
https://www.reuters.com/article/us-global-oil/oil-drops-as-fed-signals-rate-cuts-may-be-limited-idUSKCN1UR32F,https://cdn.snapi.dev/images/v1/j/s/m02d20190801t2i1414085322rlynxnpef7023jw640.jpg,Oil drops as Fed signals rate cuts may be limited,"Oil prices fell more than $1 on Thursday, declining for the first time in six days, after the U.S. Federal Reserve dampened hopes for a string of rate cuts and Sino-U.S.",Reuters,"Wed, 31 Jul 2019 21:14:53 -0400",oil,Negative,Article
https://www.youtube.com/watch?v=O5ey46f3F00,https://cdn.snapi.dev/images/v1/q/c/cramer-reviews-the-top-july-performers-on-the-dow-jones-and-sp-500.jpg,Cramer reviews the top July performers on the Dow Jones and S&P 500,"""When you get days like today ... look to those July leaders for guidance, and, in some cases, you're going to find some solid buying opportunities,"" Jim Cramer says.",CNBC Television,"Wed, 31 Jul 2019 19:52:11 -0400","cramer,madmoney",Positive,Video
https://www.cnbc.com/2019/08/01/asia-stocks-china-data-south-korea-currencies-in-focus.html,https://cdn.snapi.dev/images/v1/a/s/105547433-1541114297736gettyimages-1055654284.jpeg,Asia set to trade lower after Fed dampens hopes of more rate cuts,Asia stocks were set to trade lower on Thursday after U.S. Federal Reserve Chairman Jerome Powell dampened hopes of further rate cuts later this year.,CNBC,"Wed, 31 Jul 2019 19:45:00 -0400",,Negative,Article
https://www.reuters.com/article/us-global-markets/asian-shares-seen-falling-on-hawkish-fed-outlook-idUSKCN1UQ2Y9,https://cdn.snapi.dev/images/v1/c/3/m02d20190731t2i1414065352rlynxnpef6u1zlw640.jpg,Asian shares seen falling on 'hawkish' Fed outlook,Asian shares were set to open significantly lower on Thursday as the U.S. Federal Reserve poured cold water on market expectations of a lengthy easing cycle after delivering a 25-basis-point cut.,Reuters,"Wed, 31 Jul 2019 19:42:42 -0400",,Negative,Article
https://www.zacks.com/commentary/455325/making-sense-of-q2-earnings-results,https://cdn.snapi.dev/images/v1/o/j/machinery-construction2.jpg,Making Sense of Q2 Earnings Results,"Q2 results have largely met expectations, with growth on the weak side and positive EPS beats about in-line with historical trends",Zacks Investment Research,"Wed, 31 Jul 2019 18:19:00 -0400",earnings,Neutral,Article
https://www.youtube.com/watch?v=lHWzPjab3As,https://cdn.snapi.dev/images/v1/i/j/ij922-2.jpg,Technician says these are three areas of the market to watch,Mark Newton of Newton Advisors on the Fed's big day.,CNBC Television,"Wed, 31 Jul 2019 18:18:40 -0400",tanalysis,Neutral,Video
https://www.youtube.com/watch?v=NCVI6N_kxI8,https://cdn.snapi.dev/images/v1/p/6/the-federal-reserve-cuts-rates-by-a-quarter-point.jpg,The Federal Reserve cuts rates by a quarter point,The Fed cuts rates by a quarter point.,CNBC Television,"Wed, 31 Jul 2019 17:54:52 -0400",,Neutral,Video
https://www.youtube.com/watch?v=FcGAjO99qRI,https://cdn.snapi.dev/images/v1/3/5/marko-kolanovic-from-jp-morgan-weighs-in-on-fed-rate-cut.jpg,Marko Kolanovic from JP Morgan weighs in on Fed rate cut,JP Morgan's Marko Kolanovic says investors should be happy with the rate cut.,CNBC Television,"Wed, 31 Jul 2019 17:51:45 -0400",,Positive,Video
https://www.youtube.com/watch?v=4JOfnyZuK-E,https://cdn.snapi.dev/images/v1/d/z/heres-what-investors-should-be-doing-after-fed-cut.jpg,Here's what investors should be doing after Fed cut,"Dan Suzuki, Portfolio Strategy at Richard Bernstein Advisors, and Tom Kennedy, global head of fixed income strategy at J.P. Morgan, discuss the Federal Reserve's decision to cut rates.",CNBC Television,"Wed, 31 Jul 2019 17:26:57 -0400",,Neutral,Video
https://www.youtube.com/watch?v=rINeTvMstAI,https://cdn.snapi.dev/images/v1/s/o/president-trump-blasts-fed-after-rate-cut.jpg,President Trump blasts Fed after rate cut,Yahoo Finance's Jen Rogers and Dan Roberts discuss President Trump's harsh words for the Federal Reserve following a 25 basis point rate cut after the July 2019 FOMC meeting.,Yahoo Finance,"Wed, 31 Jul 2019 17:14:48 -0400",,Negative,Video
https://www.nytimes.com/2019/07/31/upshot/why-fed-cut-rates.html,https://cdn.snapi.dev/images/v1/n/v/merlin-158692188-45a51387-d9a8-491d-8595-aef8c4ef86b4-articlelargejpgquality75autowebpdisableupscale.jpg,Why the Fed Cut Rates: To Try to Fix Last Year’s Mistake,"Not a recession-fighting measure per se, but a recalibration of strategy, and a recognition that the world has changed.",NYTimes,"Wed, 31 Jul 2019 17:14:06 -0400",paywall,Negative,Article
https://www.youtube.com/watch?v=kLWWgxFQRtM,https://cdn.snapi.dev/images/v1/e/i/eij2-1.jpg,Federal Reserve chief asked if he gave into Donald Trump,"President Donald Trump had been publicly saying the Federal Reserve should cuts rates and they finally did so, cutting the rate a quarter-point.",CNN,"Wed, 31 Jul 2019 17:14:02 -0400",,Neutral,Video
https://www.cnbc.com/2019/07/31/stocks-plunge-after-fed-cuts-ratesheres-what-experts-are-saying.html,https://cdn.snapi.dev/images/v1/a/e/106051801-1564599043517rtx71ppp.jpg,Stocks plunge after Fed cuts rates for first time since 2008—here's what experts are saying,"The Federal Reserve's interest rate cut changes the layout for U.S. and global markets, experts say.",CNBC,"Wed, 31 Jul 2019 17:14:00 -0400",,Negative,Article
https://www.youtube.com/watch?v=Df631jkYeu4,https://cdn.snapi.dev/images/v1/n/0/powell-says-dont-assume-fed-wont-raise-rates-again.jpg,Powell Says Don't Assume Fed Won't Raise Rates Again,Jul.31 -- Federal Reserve Chairman Jerome Powell speaks at a news conference in Washington about the decision by the Fed's policy-setting Federal Open Market Committee to cut interest rates for the first time since the financial crisis.,Bloomberg Markets and Finance,"Wed, 31 Jul 2019 17:12:12 -0400",,Neutral,Video
https://www.youtube.com/watch?v=LUgEq0vNB-A,https://cdn.snapi.dev/images/v1/f/s/federal-reserve-explains-why-they-cut-rates.jpg,Federal Reserve explains why they cut rates,The Federal Reserve lowered interest rates for the first time since the Great Recession in 2008 to help stave off the possibility of an economic downturn.,CNN,"Wed, 31 Jul 2019 17:10:23 -0400",,Neutral,Video
https://www.youtube.com/watch?v=9FlwLnm-TXE,https://cdn.snapi.dev/images/v1/8/f/trump-says-fed-chairman-powell-let-us-down.jpg,Trump says Fed Chairman Powell 'let us down',CNBC's Eamon Javers reports on President Trump's response to the Federal Reserve rate cut.,CNBC Television,"Wed, 31 Jul 2019 17:09:16 -0400",,Negative,Video
https://nypost.com/2019/07/31/dow-jones-tanks-as-fed-chairman-raises-doubts-on-further-rate-cuts/,https://cdn.snapi.dev/images/v1/m/l/dow-plunges-powelljpgquality90stripall.jpg,Dow Jones tanks as Fed chairman raises doubts on further rate cuts,"Wall Street got what it wanted from the Federal Reserve — just not enough of it. The stock market plunged Wednesday despite the Fed announcing its first interest-rate cut in a decade, as Fed Chairman Jerome Powell signaled that the quarter-point cut was an “adjustment” and not the beginning of a “lengthy cutting cycle.",New York Post,"Wed, 31 Jul 2019 16:57:52 -0400",,Negative,Article
https://www.cnbc.com/2019/07/31/trump-says-fed-chief-powell-let-us-down-by-not-clearly-signaling-more-rate-cuts.html,https://cdn.snapi.dev/images/v1/j/b/104816486-gettyimages-869477424.jpg,Trump says Fed Chief Powell 'let us down' by not clearly signaling more rate cuts,"President Donald Trump said that Federal Reserve Chairman Jerome Powell ""let us down"" on Wednesday hours after the Fed lowered its benchmark rate by a quarter point.",CNBC,"Wed, 31 Jul 2019 16:42:00 -0400",,Negative,Article
https://www.youtube.com/watch?v=r2peRbA0neM,https://cdn.snapi.dev/images/v1/p/n/fed-dampens-hope-for-future-rate-cut-after-25-basis-point-cut.jpg,Fed dampens hope for future rate cut after 25 basis point cut,"Yahoo Finance's Brian Cheung, Jen Rogers Brian Sozzi and Dan Roberts break down Fed Chair Jerome Powell's comments regarding the July 2019 FOMC meeting.",Yahoo Finance,"Wed, 31 Jul 2019 16:33:15 -0400",,Negative,Video
https://www.youtube.com/watch?v=zI0-nl4lECw,https://cdn.snapi.dev/images/v1/f/e/fed44-1.jpg,Does the Fed's 25 basis point cut really do anything for the economy?,UBS U.S. Economist Robert Martin looks at the Fed's reason for a 15 basis point interest rate cut and the impact on the economy.,Yahoo Finance,"Wed, 31 Jul 2019 16:16:12 -0400",,Neutral,Video
https://www.youtube.com/watch?v=AqFVszOB8vc,https://cdn.snapi.dev/images/v1/d/7/not-a-lot-of-specificity-from-powell-former-fed-governor-says.jpg,"""Not a lot of specificity,"" from Powell, former fed governor says","Sarah Bloom Raskin, former Federal Reserve governor, shares her reaction to the rate cut on CNBC's ""Closing Bell.",CNBC Television,"Wed, 31 Jul 2019 16:09:59 -0400",,Neutral,Video
https://www.reuters.com/article/us-usa-stocks/sp-500-posts-biggest-drop-since-may-after-fed-cut-powell-comments-idUSKCN1UQ1GR,https://cdn.snapi.dev/images/v1/j/8/m02d20190731t2i1414009342rlynxnpef6u1p7w640.jpg,"S&P 500 posts biggest drop since May after Fed cut, Powell comments","The Dow and S&P 500 suffered their biggest daily percentage drops since May 31 on Wednesday after the Federal Reserve cut interest rates for the first time in a decade, but remarks by Fed Chair Jerome Powell dampened expectations for further cuts going forward.",Reuters,"Wed, 31 Jul 2019 16:09:33 -0400",,Negative,Article
https://www.youtube.com/watch?v=cXBsDASydJw,https://cdn.snapi.dev/images/v1/c/e/feds-hawkish-rate-cut-suggests-fed-went-too-far-in-december-economist-swonk-says.jpg,"Fed's Hawkish Rate Cut Suggests Fed Went Too Far in December, Economist Swonk Says","Diane Swonk, Grant Thornton chief economist, reacts to the decision by the Fed's policy-setting Federal Open Market Committee to cut interest rates for the first time since the financial crisis.",Bloomberg Markets and Finance,"Wed, 31 Jul 2019 16:07:53 -0400",,Neutral,Video
https://www.gurufocus.com/news/919704/us-indexes-close-lower-wednesday-after-rate-cut-announcement-,https://cdn.snapi.dev/images/v1/2/w/2ws-15.jpg,US Indexes Close Lower Wednesday After Rate Cut Announcement,Federal Reserve cuts the federal funds target rate by 0.25% and stops shrinking the balance sheet,GuruFocus,"Wed, 31 Jul 2019 16:04:59 -0400",,Negative,Article
https://www.youtube.com/watch?v=V4uXCojnEb0,https://cdn.snapi.dev/images/v1/j/h/the-market-is-trying-to-guess-where-were-going-cashin-says.jpg,"""The market is trying to guess where we're going,"" Cashin says","Art Cashin, managing director of UBS Financial Services, joins ""Closing Bell"" to discuss his reaction to the rate cut.",CNBC Television,"Wed, 31 Jul 2019 16:02:51 -0400",,Neutral,Video
https://www.youtube.com/watch?v=As9kh6B55dg,https://cdn.snapi.dev/images/v1/k/r/fed-chair-powell-rate-cut-is-to-support-the-us-expansion.jpg,Fed chair Powell: Rate cut is to support the US expansion,Federal Reserve chair Jerome Powell takes questions following the Fed's decision to cut interest rates by a quarter point.,CNBC Television,"Wed, 31 Jul 2019 16:00:07 -0400",,Positive,Video
https://www.benzinga.com/markets/options/19/07/14173194/how-large-option-traders-are-reacting-to-the-interest-rate-cut,https://cdn.snapi.dev/images/v1/x/t/m02d20190726t2i1412288494rlynxnpef6p1ijw640.jpg,How Large Option Traders Are Reacting To The Interest Rate Cut,"The markets traded lower on Wednesday after the Federal Reserve lowered interest rates by 0.25%, in-line with economist expectations.",Benzinga,"Wed, 31 Jul 2019 15:55:26 -0400",,Negative,Article
https://www.youtube.com/watch?v=8RK6eq0WLas,https://cdn.snapi.dev/images/v1/i/q/fed-chair-powell-this-is-not-the-beginning-of-a-long-cutting-cycle.jpg,Fed chair Powell: This is not the beginning of a long cutting cycle,Federal Reserve chair Jerome Powell takes questions following the Fed's decision to cut interest rates by a quarter point.,CNBC Television,"Wed, 31 Jul 2019 15:51:14 -0400",,Neutral,Video
https://www.youtube.com/watch?v=jCLb8k9mOYA,https://cdn.snapi.dev/images/v1/w/j/fed-chair-powell-we-monitor-financial-stablity-every-quarter.jpg,Fed chair Powell: We monitor financial stablity every quarter,Federal Reserve chair Jerome Powell takes questions following the Fed's decision to cut interest rates by a quarter point.,CNBC Television,"Wed, 31 Jul 2019 15:50:59 -0400",,Neutral,Video
https://www.forbes.com/sites/miltonezrati/2019/07/31/the-conflicted-fed/,https://cdn.snapi.dev/images/v1/9/s/0x600.jpg,The Conflicted Fed,"The Fed has refused to promise the market more interest rate cuts and with good cause, since policy makers remain highly conflicted on what the economy needs.",Forbes,"Wed, 31 Jul 2019 15:48:33 -0400",,Negative,Article
https://www.youtube.com/watch?v=bqyRNgisSNw,https://cdn.snapi.dev/images/v1/8/e/powell-calls-fed-rate-move-a-mid-cycle-adjustment.jpg,Powell Calls Fed Rate Move a 'Mid-Cycle Adjustment',Jul.31 -- Federal Reserve Chairman Jerome Powell speaks at a news conference in Washington about the decision by the Fed's policy-setting Federal Open Market Committee to cut interest rates for the first time since the financial crisis.,Bloomberg Markets and Finance,"Wed, 31 Jul 2019 15:43:04 -0400",,Neutral,Video
https://www.youtube.com/watch?v=AdKJQkZ-H34,https://cdn.snapi.dev/images/v1/r/r/powell-says-somewhat-lower-rate-path-is-warranted.jpg,Powell Says 'Somewhat Lower' Rate Path Is Warranted,Jul.31 -- Federal Reserve Chairman Jerome Powell speaks at a news conference in Washington about the decision by the Fed's policy-setting Federal Open Market Committee to cut interest rates for the first time since the financial crisis.,Bloomberg Markets and Finance,"Wed, 31 Jul 2019 15:39:11 -0400",,Neutral,Video
https://www.cnbc.com/2019/07/31/the-two-words-from-jerome-powell-that-rocked-the-financial-markets.html,https://cdn.snapi.dev/images/v1/i/a/106051853-1564600374047gettyimages-1158904964.jpeg,The two words from Jerome Powell that rocked the financial markets,"Fed Chair Jerome Powell said the Fed's quarter point rate cut was a ""midcycle adjustment,"" meaning it was not a promise of more easing to come.",CNBC,"Wed, 31 Jul 2019 15:39:00 -0400",,Neutral,Article
https://www.reuters.com/article/us-usa-fed-trump/is-trump-the-reason-the-fed-cut-rates-idUSKCN1UQ1DM,https://cdn.snapi.dev/images/v1/p/6/m02d20190731t2i1414001416rlynxnpef6u0u3w640.jpg,Is Trump the reason the Fed cut rates?,U.S. President Donald Trump's repeated calls for easier monetary policy may not be what drove the Federal Reserve to cut interest rates on Wednesday.,Reuters,"Wed, 31 Jul 2019 15:36:49 -0400",,Neutral,Article
https://www.youtube.com/watch?v=ChtDcL6qS_s,https://cdn.snapi.dev/images/v1/e/m/feds-powell-we-never-take-into-account-political-considerations.jpg,Fed's Powell: We never take into account political considerations,Federal Reserve chair Jerome Powell takes questions following the Fed's decision to cut interest rates by a quarter point.,CNBC Television,"Wed, 31 Jul 2019 15:29:01 -0400",,Neutral,Video
https://www.forbes.com/sites/jjkinahan/2019/07/31/feds-quarter-point-rate-cut-weak-global-growth-trade-tensions-muted-inflation-cited/,https://cdn.snapi.dev/images/v1/g/d/istock-4.jpg,"Fed's Quarter-Point Rate Cut: Weak Global Growth, Trade Tensions, Muted Inflation Cited","Hearing from Fed Chair Jerome Powell that today’s rate cut is simply a “mid-cycle adjustment” appears to be disappointing the stock market, where some investors might have hoped for more hints of additional easing.",Forbes,"Wed, 31 Jul 2019 15:29:00 -0400",earnings,Negative,Article
https://www.reuters.com/article/us-global-markets/dollar-up-stocks-fall-after-fed-cut-pound-rebound-stalls-idUSKCN1UQ03E,https://cdn.snapi.dev/images/v1/c/x/m02d20190731t2i1413998443rlynxnpef6u1q1w640.jpg,"Dollar up, stocks fall after Fed cut; pound rebound stalls",The dollar index rose on Wednesday and stocks tumbled even as the Federal Reserve cut interest rates after Fed Chairman Jerome Powell said the 25-basis-point cut was not the same as the beginning of a lengthy rate cutting cycle.,Reuters,"Wed, 31 Jul 2019 15:27:17 -0400",,Negative,Article
https://www.youtube.com/watch?v=Lf6VSOoI0Zk,https://cdn.snapi.dev/images/v1/w/r/powell-says-fed-rate-cut-isnt-necessarily-start-of-easing-cycle.jpg,Powell Says Fed Rate Cut Isn't Necessarily Start of Easing Cycle,Jul.31 -- Federal Reserve Chairman Jerome Powell speaks at a news conference in Washington about the decision by the Fed's policy-setting Federal Open Market Committee to cut interest rates for the first time since the financial crisis.,Bloomberg Markets and Finance,"Wed, 31 Jul 2019 15:25:47 -0400",,Neutral,Video
https://www.youtube.com/watch?v=FMl7F5eGVbk,https://cdn.snapi.dev/images/v1/m/m/feds-powell-no-reason-why-economic-expansion-cant-keep-going.jpg,Fed's Powell: No reason why economic expansion can't keep going,Federal Reserve chair Jerome Powell takes questions following the Fed's decision to cut interest rates by a quarter point.,CNBC Television,"Wed, 31 Jul 2019 15:22:55 -0400",,Positive,Video
https://www.youtube.com/watch?v=zEn7OL5tT98,https://cdn.snapi.dev/images/v1/o/6/feds-powell-on-real-time-payment-systems.jpg,Fed's Powell on real-time payment systems,Federal Reserve chair Jerome Powell takes questions following the Fed's decision to cut interest rates by a quarter point.,CNBC Television,"Wed, 31 Jul 2019 15:20:44 -0400",,Neutral,Video
https://www.youtube.com/watch?v=LrpNFxRVbQ0,https://cdn.snapi.dev/images/v1/m/u/fed-chair-powell-business-investment-manufacturing-weakness-is-not-just-result-of-trade-talks.jpg,"Fed chair Powell: Business investment, manufacturing weakness is not just result of trade talks",Federal Reserve chair Jerome Powell takes questions following the Fed's decision to cut interest rates by a quarter point.,CNBC Television,"Wed, 31 Jul 2019 15:17:58 -0400",,Negative,Video
https://www.youtube.com/watch?v=2HdKaRnFSdI,https://cdn.snapi.dev/images/v1/s/7/fed-is-finally-realizing-inflation-rates-are-too-low-says-portfolio-strategist.jpg,"'Fed is finally realizing inflation rates are too low,' says portfolio strategist","Merrill Lynch Wealth Management Head of Portfolio Strategy Niladri Mukherjee discusses inflation, the Fed and the global economy.",Yahoo Finance,"Wed, 31 Jul 2019 15:17:18 -0400",,Neutral,Video
https://www.youtube.com/watch?v=uFulnB4l54E,https://cdn.snapi.dev/images/v1/5/v/fed-chair-powell-defends-25-basis-point-cut.jpg,Fed chair Powell defends 25 basis point cut,Federal Reserve chair Jerome Powell takes questions following the Fed's decision to cut interest rates by a quarter point.,CNBC Television,"Wed, 31 Jul 2019 15:12:39 -0400",,Neutral,Video
https://www.fool.com/investing/2019/07/31/how-to-prepare-for-a-recession.aspx,https://cdn.snapi.dev/images/v1/a/n/urlhttps3a2f2fgfoolcdncom2feditorial2fimages2f5310442frecession-market-crashjpgw700opresize.jpg,How to Prepare for a Recession,"While economic slowdowns are increasingly rare and typically short, we will go through one at some point. Here's what you can do to make sure you're ready when it happens.",The Motley Fool,"Wed, 31 Jul 2019 15:11:00 -0400",,Negative,Article
https://www.youtube.com/watch?v=l27M_1UHO74,https://cdn.snapi.dev/images/v1/g/l/guggenheims-minerd-says-fed-is-in-with-both-feet-expect-more-rate-cuts.jpg,"Guggenheim's Minerd Says Fed Is in With Both Feet, Expect More Rate Cuts","Jul.31 -- Scott Minerd, Guggenheim Partners co-founder and Guggenheim Global chief investment officer, discusses the outlook for Federal Reserve monetary policy with Bloomberg's Scarlet Fu and Tom Keene on ""Bloomberg Markets.",Bloomberg Markets and Finance,"Wed, 31 Jul 2019 15:09:47 -0400",,Neutral,Video
https://www.youtube.com/watch?v=-iBNiWec4d0,https://cdn.snapi.dev/images/v1/a/3/fed-chair-powell-on-federal-reserves-decision-to-cut-rates.jpg,Fed Chair Powell on Federal Reserve's decision to cut rates,Federal Reserve chair Jerome Powell gives comments following the Fed's decision to cut interest rates by a quarter point.,CNBC Television,"Wed, 31 Jul 2019 15:04:34 -0400",,Neutral,Video
