news_url,image_url,title,text,source_name,date,topics,sentiment,type
https://www.reuters.com/article/us-china-markets-fed/with-china-a-manipulator-heightened-pressure-on-fed-to-ease-idUSKCN1UW054,https://cdn.snapi.dev/images/v1/i/w/m02d20190806t2i1415868913rlynxnpef75038w640.jpg,"With China a 'manipulator,' heightened pressure on Fed to ease","Federal Reserve Chair Jerome Powell, who last week cut U.S. interest rates as an insurance policy against the effects of ""simmering"" trade tensions, may need to buy more coverage after the United States late on Monday designated China a currency manipulator.",Reuters,"Mon, 05 Aug 2019 22:12:20 -0400",,Neutral,Article
https://nypost.com/2019/08/05/trump-and-china-tussle-over-tariffs/,https://cdn.snapi.dev/images/v1/5/g/trump-jinpingjpgquality90stripall.jpg,Trump and China tussle over tariffs,"Now, what’s a president to do? President Trump made a big bet when he said last week that he was going to impose stiff tariffs on billions of dollars worth of Chinese-produced goods.",New York Post,"Mon, 05 Aug 2019 22:10:14 -0400",,Negative,Article
https://www.cnbc.com/2019/08/06/oil-markets-us-china-trade-in-focus.html,https://cdn.snapi.dev/images/v1/7/h/104253169-gettyimages-505882540.jpg,Oil prices edge up but US-China trade war drags,"Oil prices edged up on Tuesday, but remained under pressure as the escalating U.S.-China trade war stoked concerns over global economic growth and future demand for crude.",CNBC,"Mon, 05 Aug 2019 22:04:00 -0400",oil,Negative,Article
https://www.reuters.com/article/us-global-markets/global-stocks-deepen-losses-as-u-s-brands-china-currency-manipulator-idUSKCN1UW00R,https://cdn.snapi.dev/images/v1/w/x/m02d20190806t2i1415844430rlynxnpef7500gw640.jpg,Global stocks deepen losses as U.S. brands China currency manipulator,Global stocks extended their already substantial losses and the offshore yuan hit an all-time low on Tuesday after Washington designated Beijing a currency manipulator in a rapid escalation of the U.S.-China trade war.,Reuters,"Mon, 05 Aug 2019 20:27:29 -0400",,Negative,Article
https://www.cnbc.com/2019/08/05/trade-war-heads-to-currency-war-as-us-calls-china-manipulator.html,https://cdn.snapi.dev/images/v1/a/s/106057682-1564771720657trump.jpg,Trade war turns into 'nasty' currency war as US calls China manipulator for first time since '90s,"The U.S. took the trade war up a notch, calling China a currency manipulator, raising expectations it has other moves to make against China.",CNBC,"Mon, 05 Aug 2019 20:21:00 -0400",,Negative,Article
https://techcrunch.com/2019/08/05/u-s-treasury-just-designated-china-as-a-currency-manipulator-so-expect-more-economic-shocks/,https://cdn.snapi.dev/images/v1/3/s/gettyimages-1158023925jpgw580.jpg,"U.S. Treasury just designated China as a currency manipulator, so expect more economic shocks","The U.S. Treasury has just taken the extraordinary step of designating China as a currency manipulator, something no administration has done since the days of Bill Clinton. With the action, the trade war between the U.S.",TechCrunch,"Mon, 05 Aug 2019 19:42:03 -0400",,Negative,Article
https://www.youtube.com/watch?v=lpBUx4U1reE,https://cdn.snapi.dev/images/v1/n/f/cramer-says-its-time-to-slowly-buy-stocks-amid-market-turmoil-nobody-ever-made-a-dime-panicking.jpg,Cramer says it's time to slowly buy stocks amid market turmoil — 'Nobody ever made a dime panicking',"If you slowly buy the stocks of companies with great fundamentals, you will be in good shape when the smoke clears around trade tensions, Jim Cramer says.",CNBC Television,"Mon, 05 Aug 2019 19:39:45 -0400","cramer,madmoney",Positive,Video
https://www.youtube.com/watch?v=Y8OFmXcmgpc,https://cdn.snapi.dev/images/v1/j/r/us-stocks-plunge-after-china-devalues-currency-making-it-the-worst-day-of-2019.jpg,US stocks plunge after China devalues currency making it the worst day of 2019,"Yahoo Finance's Jared Blikre and Myles Udland break down the stock market for August 5, 2019.",Yahoo Finance,"Mon, 05 Aug 2019 19:37:19 -0400",,Negative,Video
https://www.youtube.com/watch?v=w6JFYJz5_zs,https://cdn.snapi.dev/images/v1/m/c/worst-day-for-stocks-biggest-laggard-is-apple-tech-is-worst-performing-sector.jpg,"Worst day for stocks, biggest laggard is Apple, tech is worst performing sector","Yahoo Finance's Scott Gamm breaks down  the worst performing stocks and sectors for August 5, 2019.",Yahoo Finance,"Mon, 05 Aug 2019 19:19:48 -0400",,Negative,Video
https://www.forbes.com/sites/cbovaird/2019/08/05/bitcoin-flirts-with-12000-as-yuan-struggles/,https://cdn.snapi.dev/images/v1/u/j/0x600.jpg,"Bitcoin Flirts With $12,000 As Yuan Struggles",Will the trade wars continue to escalate? Will bitcoin benefit from any such conflict?,Forbes,"Mon, 05 Aug 2019 19:16:00 -0400",,Neutral,Article
https://www.forbes.com/sites/russellflannery/2019/08/05/u-s-labels-china-currency-manipulator-raising-tension-and-stakes/,https://cdn.snapi.dev/images/v1/e/e/ee555-1.jpg,"U.S. Labels China A Currency Manipulator, Raising Tension And Stakes","“China has a long history of facilitating an undervalued currency through protracted, large-scale intervention in the foreign exchange market,” the Treasury Department said.",Forbes,"Mon, 05 Aug 2019 19:12:00 -0400",,Negative,Article
https://www.youtube.com/watch?v=6kjaqgfGtOY,https://cdn.snapi.dev/images/v1/2/t/american-importerspay-for-tariffs-says-economist.jpg,"'American importers...pay for tariffs,' says economist",Milken Institute Chief Economist William Lee discusses escalating trade tensions between the United States and China and the effect on the stock market and global economy.,Yahoo Finance,"Mon, 05 Aug 2019 19:11:22 -0400",,Negative,Video
https://www.youtube.com/watch?v=B7RXJ7g0kaw,https://cdn.snapi.dev/images/v1/v/i/new-highs-for-bitcoin-possible-this-year-fundstrats-tom-lee.jpg,New highs for bitcoin possible this year: Fundstrat's Tom Lee,CFundstrat's Tom Lee on whether the market selloff is driving people into bitcoin.,CNBC Television,"Mon, 05 Aug 2019 19:11:05 -0400",,Positive,Video
https://www.cnbc.com/2019/08/05/heres-how-the-stock-market-lost-more-than-1point4-trillion-and-counting-in-less-than-a-week.html,https://cdn.snapi.dev/images/v1/l/z/105927684-1558538218593gettyimages-1086428006.jpeg,Here's how the stock market lost more than $1.4 trillion (and counting) in less than a week,It took just four brutal trading days for a $1.4 trillion wipeout in the S&P 500 stock value. Here's how it all went down.,CNBC,"Mon, 05 Aug 2019 19:09:00 -0400",,Negative,Article
https://www.youtube.com/watch?v=i9E6kxYuw6M,https://cdn.snapi.dev/images/v1/m/q/7-sectors-of-opportunity-amid-steep-market-wide-sell-off-jim-cramer.jpg,7 sectors of opportunity amid steep market-wide sell-off: Jim Cramer,"So what's left when you take out retail, pharma, tech, fossil fuels and the industrials?",CNBC Television,"Mon, 05 Aug 2019 19:08:11 -0400","cramer,madmoney",Positive,Video
https://www.cnbc.com/2019/08/05/crypto-rally-sparked-by-investors-seeking-hedge-against-rising-global-risks-says-bitcoin-bull-tom-lee.html,https://cdn.snapi.dev/images/v1/1/m/105634865-1545155685988img-6638r.jpg,"Crypto rally sparked by investors seeking hedge against rising global risks, says bitcoin bull Tom Lee","Bitcoin bull Tom Lee told CNBC on Monday that cryptocurrency is a hedge against global risks, amid the U.S.-China trade conflict and currency war.",CNBC,"Mon, 05 Aug 2019 19:08:00 -0400",,Positive,Article
https://www.youtube.com/watch?v=4PHrHiITMsc,https://cdn.snapi.dev/images/v1/q/w/itd-be-foolhardy-to-buy-the-dip-in-tech-stocks-wireless-funds-meeks-says.jpg,"It'd Be Foolhardy to Buy the Dip in Tech Stocks, Wireless Fund's Meeks Says","Paul Meeks, lead portfolio manager for Wireless Fund, and Michael Purves, chief executive officer at Tallbacken Capital Advisors, discuss the sell-off in tech stocks with Bloomberg's Emily Chang on ""Bloomberg Technology.""",Bloomberg Technology,"Mon, 05 Aug 2019 19:01:33 -0400",,Neutral,Video
https://www.youtube.com/watch?v=kDs1H7hDuCo,https://cdn.snapi.dev/images/v1/2/e/2e2-1.jpg,Yuan devaluation potential beginning of broader currency reduction,"Rebecca Patterson, chief investment officer at Bessemer Trust, joins CNBC's ""Closing Bell"" to discuss China's retaliatory moves against U.S. tariffs.",CNBC Television,"Mon, 05 Aug 2019 18:47:01 -0400",,Negative,Video
https://www.youtube.com/watch?v=98bJYUijqLg,https://cdn.snapi.dev/images/v1/y/j/treasury-designates-china-as-a-currency-manipulator.jpg,Treasury designates China as a currency manipulator,The United States Treasury has designated China as a currency manipulator.,CNBC Television,"Mon, 05 Aug 2019 18:38:46 -0400",,Negative,Video
https://www.forbes.com/sites/kenrapoza/2019/08/05/with-currency-manipulator-label-china-trade-war-moves-into-unchartered-waters/,https://cdn.snapi.dev/images/v1/5/w/0x600.jpg,"With Currency Manipulator Label, China Trade War Moves Into Unchartered Waters","Treasury labels China a currency manipulator. ""We just threw gasoline on the fire.",Forbes,"Mon, 05 Aug 2019 18:35:20 -0400",,Negative,Article
https://www.reuters.com/article/us-usa-stocks-futures/sp-500-futures-fall-after-u-s-treasury-calls-china-currency-manipulator-idUSKCN1UV2D7,https://cdn.snapi.dev/images/v1/u/u/m02d20190805t2i1415815495rlynxnpef7426gw640.jpg,S&P 500 futures fall after U.S. Treasury calls China currency manipulator,S&P 500 futures dropped 1.2% late on Monday after the U.S. Treasury Department labeled China as a currency manipulator.,Reuters,"Mon, 05 Aug 2019 18:30:30 -0400",,Negative,Article
https://www.youtube.com/watch?v=Gk-FkBvCJpI,https://cdn.snapi.dev/images/v1/b/t/i-continue-to-be-incredibly-worried-on-the-bond-market-says-william-cohen.jpg,"'I continue to be incredibly worried on the bond market,"" says William Cohen","Vanity Fair contributor William Cohen discusses the stock market, globalism, President Trump and the bond market with Yahoo Finance's Jen Rogers, Myles Udland and Andy Serwer.",Yahoo Finance,"Mon, 05 Aug 2019 18:21:09 -0400",,Negative,Video
https://www.benzinga.com/government/19/08/14205551/us-treasury-declares-china-a-currency-manipulator,https://cdn.snapi.dev/images/v1/p/3/money-938269-1920-2.jpg,US Treasury Declares China A Currency Manipulator,"For the first time since the Clinton administration in 1994, the U.S. Treasury Department has declared China as a currency manipulator.",Benzinga,"Mon, 05 Aug 2019 18:12:31 -0400",,Negative,Article
https://www.youtube.com/watch?v=3XKToEa4o30,https://cdn.snapi.dev/images/v1/g/c/the-pullback-will-continue-warns-blackstones-joe-zidle.jpg,"The pullback will continue, warns Blackstone's Joe Zidle",Blackstone's Joe Zidle offers the protection playbook.,CNBC Television,"Mon, 05 Aug 2019 18:10:27 -0400",,Negative,Video
https://www.marketwatch.com/story/treasury-department-declares-china-a-currency-manipulator-2019-08-05,https://cdn.snapi.dev/images/v1/s/w/swe2-1.jpg,Treasury Department declares China a currency manipulator,"The U.S. Treasury Department designated China as a currency manipulator on Monday afternoon, after the yuan's value CNYUSD, +0.0001% against the dollar fell below a ""line in the sand"" and intensified trade tensions.",Market Watch,"Mon, 05 Aug 2019 18:02:29 -0400",,Negative,Article
https://www.cnbc.com/2019/08/05/dow-futures-fall-implying-a-200-point-drop-on-tuesday-as-trade-war-fears-batter-wall-street.html,https://cdn.snapi.dev/images/v1/w/d/104955758-gettyimages-906207428.jpg,"Dow futures fall, implying a 480-point drop on Tuesday as trade war sell-off continues","Stock futures fell on Monday night, adding to Wall Street's losses from its worst day of 2019 amid intensifying trade-war fears.",CNBC,"Mon, 05 Aug 2019 18:01:00 -0400",,Negative,Article
https://www.reuters.com/article/us-usa-investors-china/big-u-s-investors-use-summer-sell-off-to-ramp-up-bets-idUSKCN1UV2AT,https://cdn.snapi.dev/images/v1/2/t/m02d20190805t2i1415807328rlynxnpef7423kw640.jpg,Big U.S. investors use summer sell-off to ramp up bets,The summer sell-off is finally here - and not all U.S. investors are rattled by it.,Reuters,"Mon, 05 Aug 2019 17:59:19 -0400",,Neutral,Article
https://www.youtube.com/watch?v=I6CNhQ31w4s,https://cdn.snapi.dev/images/v1/1/n/top-technician-says-theres-an-even-rockier-road-ahead-for-commodities.jpg,Top technician says there's an even rockier road ahead for commodities,Cornerstone Macro's Carter Worth on how trade fears are hitting commodities.,CNBC Television,"Mon, 05 Aug 2019 17:56:49 -0400",tanalysis,Negative,Video
https://www.cnbc.com/2019/08/05/us-treasury-designates-china-as-a-currency-manipulator.html,https://cdn.snapi.dev/images/v1/q/a/106019810-1563216731954steven.jpg,US Treasury designates China as a currency manipulator,"The U.S. Treasury Department on Monday designated China as currency manipulator, a historic move that no White House had exercised since the Clinton administration.",CNBC,"Mon, 05 Aug 2019 17:55:00 -0400",,Negative,Article
https://www.investopedia.com/china-s-yuan-devaluation-sends-u-s-stocks-to-worst-day-of-2019-4766790,https://cdn.snapi.dev/images/v1/u/s/ust2-1.jpg,China's Yuan devaluation sends U.S. stocks to worst day of 2019,China's devaluation of the Yuan set off a global stock rout that sends U.S. markets to their worst day of 2019.,Investopedia,"Mon, 05 Aug 2019 17:54:40 -0400",,Negative,Article
https://www.youtube.com/watch?v=EYYmVOl2TbU,https://cdn.snapi.dev/images/v1/x/d/the-wall-street-selloff-and-nasdaqs-longest-losing-streak-since-2016.jpg,The Wall Street selloff and Nasdaq's longest losing streak since 2016,What happened on Wall Street today?,CNBC Television,"Mon, 05 Aug 2019 17:51:05 -0400",,Negative,Video
https://www.benzinga.com/news/19/08/14205018/survey-data-shows-slowing-economy-as-tariffs-loom,https://cdn.snapi.dev/images/v1/a/i/china-15989-1920-29.jpg,Survey Data Shows Slowing Economy As Tariffs Loom,"Survey data points to an economy that is slowing thus far in the third quarter. Manufacturing and service sector data continues to signal expansion in the overall economy, but values in each area have hit multi-year lows.",Benzinga,"Mon, 05 Aug 2019 17:26:58 -0400",,Negative,Article
https://www.cnbc.com/2019/08/05/us-china-trade-war-escalatescramer-and-other-experts-on-whats-next.html,https://cdn.snapi.dev/images/v1/g/0/105736847-1550072834915rtx6mk6w.jpg,Stocks plunge as US-China trade war escalates—Cramer and other experts on what's next,"U.S. stocks had their worst performance of 2019 on Monday as trade fears roiled the major averages, and experts are split on what's next.",CNBC,"Mon, 05 Aug 2019 17:21:00 -0400",cramer,Negative,Article
https://www.reuters.com/article/us-usa-stocks-selloff-graphic/stock-market-slump-raises-fears-of-deeper-pain-idUSKCN1UV28L,https://cdn.snapi.dev/images/v1/0/i/m02d20190805t2i1415797343rlynxnpef7421rw640.jpg,Stock market slump raises fears of deeper pain,Sharper losses could be in store for Wall Street.,Reuters,"Mon, 05 Aug 2019 17:19:14 -0400",,Negative,Article
https://www.forbes.com/sites/jjkinahan/2019/08/05/sell-off-on-trade-fears-intensifies-with-apple-semiconductors-hit-hardest/,https://cdn.snapi.dev/images/v1/e/d/edw2-1.jpg,"Sell-Off On Trade Fears Intensifies, With Apple, Semiconductors Hit Hardest","Monday’s action wasn’t pretty to watch, but this is what happens when the sausage gets made right in front of the market rather than behind closed doors. There are signs that investors have become more cautious, embracing fixed income over stocks even before the latest downturn.",Forbes,"Mon, 05 Aug 2019 17:16:00 -0400",,Negative,Article
https://www.youtube.com/watch?v=WO2O6TG--I8,https://cdn.snapi.dev/images/v1/y/q/stocks-plummet-as-uschina-trade-tensions-escalate.jpg,Stocks plummet as US–China trade tensions escalate,"Yahoo Finance's Brian Cheung, Zack Guzman and Charleton English of the New York Post discuss how rising trade tensions will affect the stock market and the economy.",Yahoo Finance,"Mon, 05 Aug 2019 16:59:36 -0400",,Negative,Video
https://www.youtube.com/watch?v=zPKIvquevP8,https://cdn.snapi.dev/images/v1/e/s/es23-1.jpg,What Jim Cramer has to say about the Dow and S&P at 2-month lows,"CNBC's Jim Cramer joins ""Closing Bell"" to discuss the day's record-breaking market sell-off and what he's looking for moving forward.",CNBC Television,"Mon, 05 Aug 2019 16:58:34 -0400",cramer,Negative,Video
https://www.youtube.com/watch?v=228BBVgLvQs,https://cdn.snapi.dev/images/v1/8/w/if-tariffs-persist-global-recession-could-hit-in-9-months-economist.jpg,"If tariffs persist, global recession could hit in 9 months: Economist","Chetan Ahya, chief economist and global head of economics at Morgan Stanley, joins CNBC's ""Closing Bell"" to discuss proposed tariffs by President Trump and how they can lead to a future recession.",CNBC Television,"Mon, 05 Aug 2019 16:57:29 -0400",,Negative,Video
https://www.cnbc.com/2019/08/05/wall-street-needs-to-chill-out-about-trumps-tariffs.html,https://cdn.snapi.dev/images/v1/d/h/106060670-1565034121057ap-19217550121008.jpg,"Wall Street is terrified about Trump's tariffs, but it needs to cool off and look at the big picture","There are three main reasons why this and other major U.S. market selloffs connected to the trade war are overblown, even for the companies and consumers that have more relative China exposure, Jake Novak writes.",CNBC,"Mon, 05 Aug 2019 16:42:00 -0400",,Negative,Article
https://investorplace.com/2019/08/stock-market-today-time-to-hope-for-turnaround-tuesday/,https://cdn.snapi.dev/images/v1/m/0/m02d20190801t2i1414315768rlynxnpef703new640.jpg,Stock Market Today: Time to Hope for ‘Turnaround Tuesday’,"It was a brutal day in the stock market today. Here's what happened, what stocks were strong and what to look for now.",InvestorPlace,"Mon, 05 Aug 2019 16:35:43 -0400",,Negative,Article
https://techcrunch.com/2019/08/05/tech-stocks-walloped-as-china-retaliates-in-the-latest-salvo-of-its-trade-war-with-the-u-s/,https://cdn.snapi.dev/images/v1/a/y/default8-2.jpg,Tech stocks walloped as China retaliates in the latest salvo of its trade war with the U.S.,"All U.S. stock markets were down severely today, and tech stocks were hit especially hard, as China retaliated to increasing U.S. tariffs by halting imports on U.S.",TechCrunch,"Mon, 05 Aug 2019 16:34:48 -0400",,Negative,Article
https://www.youtube.com/watch?v=7maYCLEGP-M,https://cdn.snapi.dev/images/v1/n/c/why-this-weeks-hot-trade-focuses-on-crude-and-russell-2k-futures.jpg,Why This Week’s Hot Trade Focuses on Crude and Russell 2K Futures,"In ""Charting Futures: This Week,” Bloomberg Intelligence's Mike McGlone focuses on downtrends in crude and Russell 2K futures. We also take a look at today's news on gold.",Bloomberg Markets and Finance,"Mon, 05 Aug 2019 16:33:19 -0400",,Neutral,Video
https://www.youtube.com/watch?v=8aH_dVdMEa4,https://cdn.snapi.dev/images/v1/d/w/dwd2-1.jpg,Global recession risks are rising: chief economist David Rosenberg,"David Rosenberg, chief economist and strategist at Gluskin Sheff, joins CNBC's ""Closing Bell"" to discuss today's market sell-off and how it all started.",CNBC Television,"Mon, 05 Aug 2019 16:31:50 -0400",,Negative,Video
https://www.youtube.com/watch?v=ApiSFzfBLpo,https://cdn.snapi.dev/images/v1/t/e/how-options-traders-are-playing-the-stock-market-sell-off.jpg,How Options Traders Are Playing the Stock Market Sell-Off,"On this edition of ""Options Insight,"" Equity Armor Investments' Joe Tigay discusses the volatility in U.S. stocks with Bloomberg's Luke Kawa on ""Bloomberg Markets: The Close.""",Bloomberg Markets and Finance,"Mon, 05 Aug 2019 16:29:08 -0400",,Neutral,Video
https://www.youtube.com/watch?v=ltMVTovHG8Q,https://cdn.snapi.dev/images/v1/a/q/positive-sentiment-response-to-tariffs-could-turn-markets-sonders.jpg,"Positive sentiment, response to tariffs could turn markets: Sonders","Liz Ann Sonders, Charles Schwab's chief investment strategist, joins CNBC's ""Closing Bell"" to discuss today's market sell-off and what she thinks needs to happen for it to turn around.",CNBC Television,"Mon, 05 Aug 2019 16:28:08 -0400",,Neutral,Video
https://nypost.com/2019/08/05/stocks-suffer-worst-drop-in-2019-even-after-dow-recovers-from-950-plunge/,https://cdn.snapi.dev/images/v1/9/n/stocks-worstofjpgquality90stripall.jpg,Stocks suffer worst drop in 2019 even after Dow recovers from 950 plunge,"Stocks went into freefall Monday, suffering their worst day of 2019 as China showed off its financial weaponry in a worsening trade war with the US. The Dow Jones Industrial Average plunged by more than 950 points in afternoon trading as China delivered a one-two punch to the US — first by allowing its currency.",New York Post,"Mon, 05 Aug 2019 16:23:33 -0400",,Negative,Article
https://www.youtube.com/watch?v=ovIB6Fyzdns,https://cdn.snapi.dev/images/v1/o/c/steve-moore-on-trade-donald-trump-doesnt-back-down.jpg,Steve Moore on trade: Donald Trump doesn't back down,China’s yuan fell below 7 to the U.S.,Fox Business,"Mon, 05 Aug 2019 16:17:34 -0400",,Neutral,Video
https://www.youtube.com/watch?v=CrAMfEcWU2M,https://cdn.snapi.dev/images/v1/a/m/amrk92-1.jpg,"Kyle Bass talks Hong Kong, China, the trade war, and impact on markets","At Yahoo Finance, you get free stock quotes, up-to-date news, portfolio management resources, international market data, social interaction and mortgage rates that help you manage your financial life.",Yahoo Finance,"Mon, 05 Aug 2019 15:56:13 -0400",,Negative,Video
https://www.youtube.com/watch?v=dGRUqxc2kw8,https://cdn.snapi.dev/images/v1/m/k/chinas-currency-weaponization-its-most-effective-trade-war-tool-pro.jpg,China's currency weaponization its most effective trade war tool: Pro,"CNBC's ""Power Lunch"" team discusses the weakening of China's yuan against the U.S.",CNBC Television,"Mon, 05 Aug 2019 15:41:06 -0400",,Negative,Video
https://www.youtube.com/watch?v=zgM9VDa7YK0,https://cdn.snapi.dev/images/v1/p/r/yield-curve-inversion-deepens-on-trade-woes.jpg,Yield Curve Inversion Deepens on Trade Woes,Aug.05 -- Bloomberg's Lisa Abramowicz examines U.S.,Bloomberg Markets and Finance,"Mon, 05 Aug 2019 15:40:33 -0400",,Negative,Video
