news_url,image_url,title,text,source_name,date,topics,sentiment,type
https://www.youtube.com/watch?v=9QaaPAWuJZ0,https://cdn.snapi.dev/images/v1/m/q/pinterest-joins-surge-of-tech-related-companies-planning-to-go-public.jpg,Pinterest Joins Surge of Tech-Related Companies Planning to Go Public,"Image search site Pinterest Inc. revealed steady revenue gains with narrowing losses as well as a big bet on overseas expansion, as it joined a surge of technology-related companies planning to go public in the U.S.",Bloomberg Markets and Finance,"Fri, 22 Mar 2019 19:56:44 -0400",,Positive,Video
https://feeds.marketwatch.com/~r/marketwatch/internet/~3/YihiWK9BvwI/story.asp,https://cdn.snapi.dev/images/v1/m/w/mw-hg166-pinter-20190321192944-zh-2.jpg,MarketWatch First Take: Pinterest’s IPO filing: 5 things investors should know,"Pinterest filed the first documents in its much anticipated initial public offering on Friday, and the 184-plus page S-1 had a surprise or two about the online image discovery company.",Market Watch,"Fri, 22 Mar 2019 19:20:29 -0400",,Neutral,Article
https://www.cnbc.com/2019/03/22/pinterests-ipo-filing-shows-dependence-on-google-and-facebook.html,https://cdn.snapi.dev/images/v1/i/p/ipo76.jpg,Pinterest's IPO filing shows how dependent websites and apps have become on Google and Facebook,Pinterest says changes by Google and Facebook in early 2018 negatively impacted its user growth.,CNBC,"Fri, 22 Mar 2019 18:21:38 -0400",,Negative,Article
https://www.youtube.com/watch?v=ikemz664WhA,https://cdn.snapi.dev/images/v1/m/q/sell-off-sparks-concerns-of-global-slow-down-and-recession.jpg,Sell-off sparks concerns of global slow down and recession,"Brian Sozzi, Myles Udland, Seana Smith and Julia LaRoche discuss why the sell-off happened.",Yahoo Finance,"Fri, 22 Mar 2019 17:52:04 -0400",,Negative,Video
https://www.youtube.com/watch?v=kNPlaaLx2oY,https://cdn.snapi.dev/images/v1/m/q/pinterest-files-for-initial-public-offering.jpg,Pinterest files for initial public offering,"CNBC's Leslie Picker discusses the breaking news that Pinterest has filed for its IPO under the ticker symbol ""PINS.""",CNBC Television,"Fri, 22 Mar 2019 17:08:02 -0400",,Positive,Video
https://www.cnbc.com/2019/03/22/pinterest-releases-s-1-for-ipo.html,https://cdn.snapi.dev/images/v1/1/0/101710521-483491811530x298.jpg,"Pinterest just dropped its filing to go public, revealing financials for the first time",Pinterest is joining a bevy of tech companies going public in 2019.,CNBC,"Fri, 22 Mar 2019 16:24:00 -0400",,Neutral,Article
https://www.youtube.com/watch?v=pWDCCrIjrbI,https://cdn.snapi.dev/images/v1/m/q/timing-of-next-recession-depends-on-trade-deal-says-schwabs-sonders.jpg,"Timing of next recession depends on trade deal, says Schwab's Sonders","Liz Ann Sonders, chief investment strategist at Charles Schwab, discusses the market selloff with CNBC's ""Closing Bell.""",CNBC Television,"Fri, 22 Mar 2019 16:20:14 -0400",,Neutral,Video
https://www.youtube.com/watch?v=3mNnCNljmaE,https://cdn.snapi.dev/images/v1/m/q/inverted-yield-curve-is-a-flashing-yellow-light-says-strategist.jpg,"'Inverted yield curve is a flashing yellow light,' says strategist",Sun Trust Strategist Keith Lerner discusses the market sell-off and the inverted yield curve on the 10-year-treasury note that may be pointing to a recession and a slower growth outlook.,Yahoo Finance,"Fri, 22 Mar 2019 16:12:12 -0400",,Neutral,Video
https://www.youtube.com/watch?v=zVsgCYGn_cs,https://cdn.snapi.dev/images/v1/m/q/what-an-inverted-yield-curve-means-to-the-market.jpg,What an inverted yield curve means to the market,CNBC's Mike Santoli and Rick Santelli break down what the yield curve may be signaling for the market and how a yield curve works.,CNBC Television,"Fri, 22 Mar 2019 16:05:11 -0400",,Neutral,Video
https://feeds.marketwatch.com/~r/marketwatch/internet/~3/gf75TnMyj4o/story.asp,https://cdn.snapi.dev/images/v1/e/t/etf34.jpg,"Deep Dive: Stocks took a big hit Friday, and these shares fell the most",Nike led the Dow Jones Industrial Average lower as bond investors sent a clear signal they expect the economic expansion to end.,Market Watch,"Fri, 22 Mar 2019 15:47:45 -0400",,Negative,Article
https://www.youtube.com/watch?v=1EtnN5oJU0k,https://cdn.snapi.dev/images/v1/m/q/rally-off-decembers-lows-is-still-intact-says-strategist.jpg,"Rally off December's lows is still intact, says strategist",Brian Strazzullo of Bell Curve Trading joins CNBC's Melissa Lee at the telestrator to break down market technicals that may indicate that the rally off of the late December lows is still intact.,CNBC Television,"Fri, 22 Mar 2019 15:30:22 -0400",,Neutral,Video
https://feeds.marketwatch.com/~r/marketwatch/marketpulse/~3/Tp-MARQwVc4/story.aspx,https://cdn.snapi.dev/images/v1/z/o/zoom876.jpg,Software maker Zoom Communications files IPO documents,Zoom Communications Inc. filed its initial public offering documents Friday and plans to list under the ticker ZM on the Nasdaq Global Select Market.,Market Watch,"Fri, 22 Mar 2019 15:29:23 -0400",,Positive,Article
https://www.cnbc.com/2019/03/22/video-conferencing-company-zoom-files-to-go-public-is-profitable.html,https://cdn.snapi.dev/images/v1/1/0/105284513-eric-headshot-wide-aug530x298.jpg,Video-conferencing company Zoom files to go public with over $300 million in revenue,"Zoom, which provides video-conferencing software that can be used across devices, filed its IPO prospectus on Friday, joining a crop of Bay Area start-ups preparing to hit the public markets.",CNBC,"Fri, 22 Mar 2019 15:20:00 -0400",,Positive,Article
https://www.youtube.com/watch?v=-8Aix4AAL4k,https://cdn.snapi.dev/images/v1/m/q/consumer-sentiment-remains-strong-despite-global-slowdown.jpg,Consumer sentiment remains strong despite global slowdown,"Nick Setyan, Wedbush Securities managing director, and CNBC's Kate Rogers join 'The Exchange' to discuss how the global slowdown is impacting U.S. restaurants.",CNBC Television,"Fri, 22 Mar 2019 14:57:35 -0400",,Neutral,Video
https://www.youtube.com/watch?v=Tb34fvEeKfU,https://cdn.snapi.dev/images/v1/m/q/brewers-of-all-sizes-are-being-hurt-by-aluminum-tariffs-the-beer-institute-ceo-says.jpg,"Brewers of all sizes are being hurt by aluminum tariffs, The Beer Institute CEO says","Jim McGreevy, The Beer Institute president and CEO, joins 'The Exchange' to discuss how aluminium tariffs are hurting brewers and how they're working with the weight.",CNBC Television,"Fri, 22 Mar 2019 14:57:16 -0400",CEO,Negative,Video
https://www.youtube.com/watch?v=5sz9Gm2Rjss,https://cdn.snapi.dev/images/v1/m/q/reading-too-much-into-yield-curve-is-a-mistake-at-this-point-says-cio.jpg,"Reading too much into yield curve is a mistake at this point, says CIO","CNBC's ""Power Lunch"" team is joined by Ron Insana, CNBC contributor and senior advisor to Schroders North America, and Krishna Memani, chief investment officer with Oppenheimer Funds, to break down how the markets are reacting today as well as what the yield curve represents at this time.",CNBC Television,"Fri, 22 Mar 2019 14:55:10 -0400",,Neutral,Video
https://www.youtube.com/watch?v=7uXaFUNsYLg,https://cdn.snapi.dev/images/v1/m/q/not-out-of-harms-way-stocks-vulnerable-to-potential-trade-brexit-fallout-market-watcher.jpg,"Not Out Of Harm's Way? Stocks Vulnerable to Potential Trade, Brexit Fallout: Market Watcher",Crossmark Global Investments' Victoria Fernandez is keeping her investment strategy nimble to cope with geopolitical risks.,CNBC,"Fri, 22 Mar 2019 14:38:25 -0400",,Neutral,Video
https://feeds.benzinga.com/~r/benzinga/~3/MnxJzykGp_c/how-scott-coyle-is-opening-up-the-ipo-process-to-retail-investors,https://cdn.snapi.dev/images/v1/s/c/scott-coyle-1-720.jpg,How Scott Coyle Is Opening Up The IPO Process To Retail Investors,Benzinga's Fintech Focus Podcast features conversations with the biggest names in fintech.,Benzinga,"Fri, 22 Mar 2019 13:36:49 -0400",,Neutral,Article
https://www.youtube.com/watch?v=5ljFRKfz-E8,https://cdn.snapi.dev/images/v1/m/q/its-time-to-put-bonds-in-your-portfolio-says-blackrocks-global-cio.jpg,"It's time to put bonds in your portfolio, says BlackRock's Global CIO","Rick Rieder, BlackRock Global CIO of fixed income, calls into 'Fast Money Halftime Report' to discuss the mid-day markets amid concerns of an economic slowdown. He also weighs in on the Fed's dovish call.",CNBC Television,"Fri, 22 Mar 2019 13:34:39 -0400",,Neutral,Video
https://www.youtube.com/watch?v=4YcZm-QQMXE,https://cdn.snapi.dev/images/v1/m/q/fed-is-going-to-drive-us-into-a-recession-says-canaccord-genuity-chief-market-strategist.jpg,"Fed is going to drive us into a recession, says Canaccord Genuity chief market strategist","Tony Dwyer, Canaccord Genuity chief equity strategist, calls into 'Fast Money Halftime Report' to discuss the mid-day markets amid concerns of an economic slowdown. He also shares his thoughts on the Fed's dovish call.",CNBC Television,"Fri, 22 Mar 2019 13:25:11 -0400",,Negative,Video
https://www.youtube.com/watch?v=4W5vQY72vBU,https://cdn.snapi.dev/images/v1/m/q/slow-economic-growth-is-not-a-shock-says-ceo.jpg,"Slow economic growth is not a shock, says CEO","Shannon Saccocia, Boston Private Wealth CIO, and Michael Farr, president and CEO of Farr, Miller and Washington, join CNBC's ""Fast Money Halftime Report"" to discuss the mid-day market amid concerns of a global slowdown.",CNBC Television,"Fri, 22 Mar 2019 12:59:59 -0400",CEO,Neutral,Video
https://www.youtube.com/watch?v=BCDEAMEgquU,https://cdn.snapi.dev/images/v1/m/q/stash-and-green-dot-ceos-making-money-by-spending-mad-money-cnbc-2.jpg,Stash and Green Dot CEOs: Making Money by Spending,Jim Cramer speaks sits down with Green Dot CEO Steven Streit and Stash CEO Brandon Krieg to hear how the companies have partnered to help users save money through everyday spending.,CNBC Television,"Fri, 22 Mar 2019 12:59:19 -0400",CEO,Positive,Video
https://www.youtube.com/watch?v=foXsmOCzYBs,https://cdn.snapi.dev/images/v1/m/q/etf-investors-bring-risk-on-mentality-to-us-inflows.jpg,ETF Investors Bring Risk-On Mentality to U.S. Inflows,"Mar.22 -- Bloomberg Intelligence's Athanasios Psarofagis examines weekly ETF inflows for U.S. and European equities. He speaks on ""Bloomberg Markets.""",Bloomberg Markets and Finance,"Fri, 22 Mar 2019 12:06:25 -0400",,Positive,Video
https://www.youtube.com/watch?v=8YbLM0ie1DA,https://cdn.snapi.dev/images/v1/m/q/demand-for-ipos-seems-infinite-but-could-face-reckoning-says-larry-haverty.jpg,"Demand for IPOs seems infinite, but could face 'reckoning,' says Larry Haverty","David Ethridge, U.S. IPO services leader at PWC, and Larry Haverty, managing director at LJH Investment Advisors, discuss the expected wave of IPOs in 2019 with ""Squawk Alley"". Some of the most anticipated names are Lyft, Uber and Pinterest.",CNBC Television,"Fri, 22 Mar 2019 11:58:48 -0400",,Positive,Video
https://www.fool.com/investing/2019/03/22/uber-vs-lyft-which-is-the-better-autonomous-vehicl.aspx?source=iedfolrf0000001,https://cdn.snapi.dev/images/v1/u/r/urlhttps3a2f2fgfoolcdncom2feditorial2fimages2f5170102fca9908-edit-1.jpg,Uber vs. Lyft: Which Is the Better Autonomous Vehicle Company?,These two ride-sharing juggernauts are gearing up for a self-driving future.,The Motley Fool,"Fri, 22 Mar 2019 11:57:00 -0400",,Neutral,Article
https://www.youtube.com/watch?v=mq_sLAjF-lU,https://cdn.snapi.dev/images/v1/m/q/baird-declares-partys-over-for-us-financials.jpg,Baird Declares 'Party's Over' for U.S. Financials,"Mar.22 -- David George, senior research analyst at Baird, discusses his expectation for banks' net interest margins to be reduced by a lack of interest rate hikes. He speaks with Bloomberg's Jonathan Ferro on ""Bloomberg Markets: The Open.""",Bloomberg Markets and Finance,"Fri, 22 Mar 2019 11:44:34 -0400",,Neutral,Video
https://www.youtube.com/watch?v=oim7H3rWrHc,https://cdn.snapi.dev/images/v1/m/q/market-skepticism-keeps-prevailing-amongst-investors-says-strategist.jpg,"Market skepticism keeps prevailing amongst investors, says strategist","Tobias Levkovich, Citi chief U.S. equity strategist, discusses the market sell-off and pressures on the economy with ""Squawk on the Street"".",CNBC Television,"Fri, 22 Mar 2019 11:22:22 -0400",,Neutral,Video
https://www.youtube.com/watch?v=v_mmgk-v-Tg,https://cdn.snapi.dev/images/v1/m/q/what-is-lyft-worth.jpg,What Is Lyft Worth?,"Morningstar's Ali Mogharabi gives his take on the company's value, how it stacks up against Uber, and the threat that regulation poses",Morningstar,"Fri, 22 Mar 2019 11:00:14 -0400",,Positive,Video
https://www.youtube.com/watch?v=l1iW2fFjixI,https://cdn.snapi.dev/images/v1/m/q/investors-readjust-to-lower-for-longer-interest-rates.jpg,Investors Readjust to Lower-for-Longer Interest Rates,"Mar.22 -- Diana Jaffee, senior portfolio manager at TCW Group, Michael Kushma, global fixed income chief investment officer at Morgan Stanley Investment Management, and Noah Weisberger, managing director at Sanford Bernstein, discus expectations for lower interest rates. They speak with Bloomberg's Jonathan Ferro on ""Bloomberg Markets: The Open.""",Bloomberg Markets and Finance,"Fri, 22 Mar 2019 10:40:32 -0400",,Neutral,Video
https://www.cnbc.com/2019/03/22/uber-faces-fresh-legal-challenge-over-driver-data.html,https://cdn.snapi.dev/images/v1/1/0/105539694-1540907611493gettyimages-986142902530x298.jpeg,Uber faces fresh legal challenge over driver data,Uber drivers in the U.K. are filing a lawsuit against the company over allegations the firm has continuously broken European data protection laws.,CNBC,"Fri, 22 Mar 2019 10:25:00 -0400",,Negative,Article
https://www.youtube.com/watch?v=9evJ_pMEAfM,https://cdn.snapi.dev/images/v1/m/q/dow-slides-more-than-250-points-as-fears-of-global-slowdown-persist.jpg,Dow slides more than 250 points as fears of global slowdown persist,CNBC's Bob Pisani looks ahead at the day's market action.,CNBC Television,"Fri, 22 Mar 2019 10:17:02 -0400",,Neutral,Video
https://www.youtube.com/watch?v=cNt3Tw_3PX0,https://cdn.snapi.dev/images/v1/m/q/how-rent-the-runway-built-unicorn-status-on-sharing-economy.jpg,How Rent the Runway Built Unicorn Status on Sharing Economy,"Mar.22 -- Jennifer Hyman, co-founder and chief executive officer at Rent the Runway, discusses reaching a $1 billion valuation following its latest round of funding, the evolution of the business, and customer adoption of their subscription service. Mike Wilson, chief U.S. equity strategist at Morgan Stanley, joins the conversation on ""Bloomberg Daybreak: Americas.""",Bloomberg Markets and Finance,"Fri, 22 Mar 2019 10:12:56 -0400",,Positive,Video
https://www.forbes.com/sites/bhaktimirchandani/2019/03/22/what-you-need-to-know-about-the-lyft-ipo-strong-investor-demand-and-strong-esg-characteristics/,https://cdn.snapi.dev/images/v1/l/y/lyft654.jpg,What You Need To Know About The Lyft IPO: Strong Investor Demand and Strong ESG Characteristics,Sharing economy unicorn Lyft has turned to the public markets for growth capital.,Forbes,"Fri, 22 Mar 2019 10:03:00 -0400",,Positive,Article
https://www.youtube.com/watch?v=XLV27knf6A4,https://cdn.snapi.dev/images/v1/m/q/china-us-deal-would-be-a-win-win-situation-for-the-entire-globe-strategist-squawk-box-europe.jpg,China-US deal would be a win-win situation for the entire globe: Strategist | Squawk Box Europe,"Fahad Kamal, chief market strategist at Kleinwort Hambros, discusses the Sino-U.S. trade conflict.",CNBC International TV,"Fri, 22 Mar 2019 10:00:13 -0400",,Positive,Video
https://www.youtube.com/watch?v=AW0emRv2QEs,https://cdn.snapi.dev/images/v1/m/q/economist-daco-sees-bond-yields-dampened-by-inflation-expectations.jpg,Economist Daco Sees Bond Yields Dampened by Inflation Expectations,"Mar.22 -- In ""Single Best Chart,"" Gregory Daco, chief U.S. economist at Oxford Economics, discusses the impact of inflation expectations on global bond yields. He speaks with Bloomberg's Taylor Riggs on ""Bloomberg Surveillance.""",Bloomberg Markets and Finance,"Fri, 22 Mar 2019 09:59:35 -0400",,Neutral,Video
https://www.youtube.com/watch?v=wo5FvgwbQ1w,https://cdn.snapi.dev/images/v1/m/q/a-strong-public-market-will-drive-innovation-in-tech-says-revolution-ceo-steve-case.jpg,"A strong public market will drive innovation in tech, says Revolution CEO Steve Case","Steve Case, CEO of Revolution, joins ""Squawk Box"" to talk about the highly anticipated tech IPOs such as Uber, Pinterest and Lyft.",CNBC Television,"Fri, 22 Mar 2019 09:15:20 -0400",CEO,Positive,Video
https://www.youtube.com/watch?v=CR7afPUibb0,https://cdn.snapi.dev/images/v1/m/q/investors-try-to-determine-whether-lyfts-ipo-valuation-is-expensive-or-cheap.jpg,Investors try to determine whether Lyft's IPO valuation is expensive or cheap,"CNBC's Leslie Picker joins ""Squawk Box"" to report on the latest news in tech IPOs. On the watch list are big companies like Uber, Pinterest and Lyft.",CNBC Television,"Fri, 22 Mar 2019 09:07:46 -0400",,Positive,Video
https://www.youtube.com/watch?v=w51XndJQEQc,https://cdn.snapi.dev/images/v1/m/q/german-manufacturing-slump-deals-blow-to-euro-economy-outlook.jpg,German Manufacturing Slump Deals Blow to Euro Economy Outlook,"Mar.22 -- A euro-area Purchasing Managers Index signaled 0.2 percent growth this quarter as German manufacturing suffered its deepest slump in six years. Bloomberg's John Ainger reports on ""Bloomberg Daybreak: Americas.""",Bloomberg Markets and Finance,"Fri, 22 Mar 2019 08:55:06 -0400",,Negative,Video
https://www.youtube.com/watch?v=wYpuD0AetWw,https://cdn.snapi.dev/images/v1/m/q/rent-the-runway-ceo-the-sharing-economy-is-the-future-of-retail.jpg,Rent the Runway CEO: The sharing economy is the future of retail,"Rent the Runway CEO Jennifer Hyman sits down with ""Squawk Box"" as the company hits a $1 billion valuation. The discussion touches on the apparel sector, the sharing economy and how millennial are changing the consumer landscape.",CNBC Television,"Fri, 22 Mar 2019 08:22:17 -0400",CEO,Positive,Video
https://www.youtube.com/watch?v=Cvu78Dcxssk,https://cdn.snapi.dev/images/v1/m/q/former-aetna-ceo-mark-bertolini-on-medicare-for-all-no-one-can-explain-to-me-what-it-is.jpg,Former Aetna CEO Mark Bertolini on 'Medicare for All': No one can explain to me what it is,"Former Aetna CEO Mark Bertolini joins ""Squawk Box"" to talk about the state of the health care industry. The discussion touches on how the U.S. can improve its system, socialized medicine, and the recent Biogen Alzheimer's trial cancellation.",CNBC Television,"Fri, 22 Mar 2019 08:18:45 -0400",CEO,Neutral,Video
https://www.youtube.com/watch?v=6RHjlQrV87I,https://cdn.snapi.dev/images/v1/m/q/watch-one-strategist-explain-how-investors-can-protect-their-profits-amid-global-uncertainty.jpg,Watch one strategist explain how investors can protect their profits amid global uncertainty,"Hank Smith, chief investment officer at Haverford Trust, and Kathryn Rooney Vera, head of global research and chief investment strategist at Bulltick Capital Markets, join ""Squawk Box"" to discuss how the turmoil in the global economy as well as the various trade wars around the world might be affecting the markets.",CNBC Television,"Fri, 22 Mar 2019 07:33:04 -0400",,Positive,Video
https://www.youtube.com/watch?v=KjxkHErCR8c,https://cdn.snapi.dev/images/v1/m/q/are-corporate-profits-starting-to-show-the-strain-of-trade-sanctions.jpg,Are Corporate Profits Starting to Show the Strain of Trade Sanctions?,"Mar.22 -- Mark Burgess, deputy global chief investment officer at Columbia Threadneedle Investments, discusses the impact of trade sanctions on financial markets and corporate earnings. He speaks on ""Bloomberg Surveillance.""",Bloomberg Markets and Finance,"Fri, 22 Mar 2019 06:37:43 -0400",,Neutral,Video
https://feedproxy.google.com/~r/BusinessRss/~3/vH0tIATiNjM/,https://cdn.snapi.dev/images/v1/e/t/etf38.jpg,Stocks Mixed; Gold Climbs As Bonds Hold Advances: Markets Wrap,Global stocks traded mixed while gold advanced and bonds held recent gains as investors reassess prospects for the major central banks to monetary policy.,Investors Business Daily,"Fri, 22 Mar 2019 05:20:38 -0400",,Positive,Article
https://www.cnbc.com/2019/03/22/nyse-wins-uber-pinterest-listings-sources.html,https://cdn.snapi.dev/images/v1/1/0/105420180-1535465985259gettyimages-1021366182530x298.jpeg,NYSE reportedly won the Uber and Pinterest IPO listings,"Uber Technologies and Pinterest have picked the New York Stock Exchange as the venue for their stock listings, according to sources familiar with the matter.",CNBC,"Fri, 22 Mar 2019 05:18:00 -0400",,Positive,Article
https://seekingalpha.com/article/4250425-buy-profitable-fintech-stock-big-investors?source=feed,https://cdn.snapi.dev/images/v1/e/t/etf26.jpg,How To Buy A Profitable FinTech Stock Before The Big Investors,It's no surprise that American consumers are rapidly shifting away from cash to digital payments.,Seeking Alpha,"Fri, 22 Mar 2019 00:57:55 -0400",,Positive,Article
