news_url,image_url,title,text,source_name,date,topics,sentiment,type
https://www.reuters.com/article/us-usa-trump-powell-tweet-fed/trump-says-he-told-feds-powell-u-s-interest-rates-are-too-high-idUSKBN1XT0EF,https://cdn.snapi.dev/images/v1/3/t/m02d20191119t2i1454013875rlynxmpefai0a8w640.jpg,Trump says he told Fed's Powell U.S. interest rates are too high,U.S. President Donald Trump said he complained to Federal Reserve Chair Jerome Powell about high U.S. interest rates in a meeting they held at the White House on Monday morning.,Reuters,"Mon, 18 Nov 2019 22:47:22 -0500",,Neutral,Article
https://nypost.com/2019/11/18/the-yield-curve-is-no-longer-signaling-a-recession/,https://cdn.snapi.dev/images/v1/u/d/interest-ratesjpgquality90stripall.jpg,The yield curve is no longer signaling a recession,The yield curve is no longer inverted! Hear ye! Hear ye!,New York Post,"Mon, 18 Nov 2019 22:33:18 -0500",,Neutral,Article
https://www.cnbc.com/2019/11/19/us-china-could-sign-phase-one-trade-deal-before-christmas-pimco-says.html,https://cdn.snapi.dev/images/v1/j/0/106252346-1574131136221gettyimages-1188523258.jpeg,"US and China could sign 'phase one' trade deal before Christmas, Pimco predicts","Reaching a ""phase one"" deal will not resolve all issues between the two economic giants, noted John Studzinski, Pimco's managing director.",CNBC,"Mon, 18 Nov 2019 21:55:00 -0500",,Positive,Article
https://www.cnn.com/2019/11/18/investing/asian-market-latest/index.html,https://cdn.snapi.dev/images/v1/k/n/191118211255-nanjing-stock-exchange-hall-restricted-super-169.jpg,Investors don't seem to know what to make of the US-China trade war,A muddled view of US-China trade talks once again seems to be weighing on investors.,CNN Business,"Mon, 18 Nov 2019 21:34:30 -0500",,Negative,Article
https://www.reuters.com/article/us-global-oil/oil-slips-as-lack-of-u-s-china-trade-talk-progress-frays-investor-nerves-idUSKBN1XT062,https://cdn.snapi.dev/images/v1/o/i/oil44.jpg,Oil slips as lack of U.S.-China trade talk progress frays investor nerves,"U.S. oil prices fell for the second straight day on Tuesday amid market jitters over limited progress between China and the United States on rolling back trade tariffs, exacerbated by a rise in U.S. inventories.",Reuters,"Mon, 18 Nov 2019 20:52:40 -0500",oil,Negative,Article
https://www.youtube.com/watch?v=4TVHYF3CC_Y,https://cdn.snapi.dev/images/v1/m/q/dont-see-why-anyone-should-be-wholesale-negative-right-now-trivariate-ceo.jpg,Don't see why anyone should be wholesale negative right now: Trivariate CEO,"CNBC's ""Closing Bell"" team breaks down markets with Mark Tepper, president and CEO of Strategic Wealth Partners, and Adam Parker, founder and CEO at Trivariate Capital Management.",CNBC Television,"Mon, 18 Nov 2019 20:50:33 -0500",CEO,Positive,Video
https://www.reuters.com/article/us-icahn-sec/carl-icahn-urges-u-s-sec-to-rethink-proposed-rule-change-for-proxy-advisers-idUSKBN1XT04Q,https://cdn.snapi.dev/images/v1/m/0/m02d20191119t2i1453974543rlynxmpefai04fw640.jpg,Carl Icahn urges U.S. SEC to 'rethink' proposed rule change for proxy advisers,"Billionaire activist investor Carl Icahn on Monday urged the U.S. Securities Exchange Commission (SEC) to rethink a proposed rule change for proxy adviser firms, saying it would make activist investing ""even more difficult and expensive to practice.",Reuters,"Mon, 18 Nov 2019 20:30:44 -0500",,Neutral,Article
https://www.cnbc.com/2019/11/19/us-china-businesses-look-for-ways-to-collaborate-rather-than-decouple.html,https://cdn.snapi.dev/images/v1/1/0/106250345-1574061016909gettyimages-1188328702.jpeg,"Rather than decouple, US, China businesses look for ways to collaborate","For some big companies, U.S.-China business ties are still holding up, despite worries that trade tensions will cause the two economies to decouple.",CNBC,"Mon, 18 Nov 2019 20:23:00 -0500",,Positive,Article
https://seekingalpha.com/article/4307610-investors-bullish-timing-makes-difference-weekly-blog-603,https://cdn.snapi.dev/images/v1/i/u/iush25-1.jpg,"All Investors Are Bullish, Timing Makes The Difference",Good analysts should always be looking for signs that generally accepted views and their own views could be wrong.,Seeking Alpha,"Mon, 18 Nov 2019 20:10:17 -0500",,Positive,Article
https://www.cnbc.com/2019/11/18/gary-cohn-trump-will-impose-dec-15-tariffs-if-no-deal-with-china.html,https://cdn.snapi.dev/images/v1/1/0/105709778-1548877256276gettyimages-1084491694.jpeg,Gary Cohn: Trump knows he'll lose 'credibility' with China if he blinks on tariff deadline,"""And December 15 is a long time from now in terms of tariff negotiations,"" the former White House chief economic advisor says.",CNBC,"Mon, 18 Nov 2019 19:33:00 -0500",,Negative,Article
https://www.youtube.com/watch?v=sRZDC_KxVqA,https://cdn.snapi.dev/images/v1/d/h/investing-strategies-streaming-stocks-to-watch-dividend-etf-tactic.jpg,"Investing Strategies: Streaming Stocks To Watch, Dividend ETF Tactic","Now that the market has hit new all-time highs several weeks in a row, is it time to get more bullish, or more defensive?",Investors Business Daily,"Mon, 18 Nov 2019 19:08:42 -0500",dividend,Positive,Video
https://www.youtube.com/watch?v=Ji1Jo4y4cok,https://cdn.snapi.dev/images/v1/k/y/with-stocks-at-record-highs-are-trade-tensions-the-rallys-biggest-threat.jpg,"With stocks at record highs, are trade tensions the rally's biggest threat?","The biggest threats to the rally. With CNBC's Eunice Yoon and Melissa Lee, and the Fast Money traders, Tim Seymour, Chris Verrone, Steve Grasso and Guy Adami.",CNBC Television,"Mon, 18 Nov 2019 17:51:01 -0500",,Positive,Video
https://www.youtube.com/watch?v=ZIO19RA3BXc,https://cdn.snapi.dev/images/v1/4/c/market-bull-warns-sell-off-risks-rising-but-would-vigorously-buy-dip.jpg,"Market bull warns sell-off risks rising, but would vigorously buy dip","BTIG's Julian Emanuel on near-term risks to this rally. With CNBC's Melissa Lee and the Fast Money traders, Tim Seymour, Chris Verrone, Steve Grasso and Guy Adami.",CNBC Television,"Mon, 18 Nov 2019 17:48:01 -0500",,Negative,Video
https://investorplace.com/2019/11/chinese-biotech-stocks-100x-play/,https://cdn.snapi.dev/images/v1/b/i/biotech31.jpg,Chinese Biotech Stocks: The 100X Play as Big Pharma Money Moves In,Investing in Chinese biotech stocks today is similar to getting into U.S. biotech back in the 1990s.,InvestorPlace,"Mon, 18 Nov 2019 17:42:20 -0500",,Positive,Article
https://investorplace.com/2019/11/time-to-buy-value-stocks-2/,https://cdn.snapi.dev/images/v1/s/m/smallcap1600-300x169.jpg,Time to Buy Value Stocks?,"The financial media may be hammering the table on value stocks right now. But, here's why you should consider small-cap stocks instead.",InvestorPlace,"Mon, 18 Nov 2019 17:21:45 -0500",,Positive,Article
https://www.youtube.com/watch?v=VgWdQTe7hdA,https://cdn.snapi.dev/images/v1/q/t/gold-may-rally-above-1560-hedge-fund-telemetrys-thornton-says.jpg,"Gold May Rally Above $1,560, Hedge Fund Telemetry's Thornton Says","Nov.18 -- In this edition of ""Charting Futures,"" Hedge Fund Telemetry President Tom Thornton examines gold futures with Bloomberg's Abigail Doolittle on ""Bloomberg Markets: The Close.",Bloomberg Markets and Finance,"Mon, 18 Nov 2019 17:16:07 -0500",gold,Positive,Video
https://www.youtube.com/watch?v=riW8t6rRlEw,https://cdn.snapi.dev/images/v1/m/q/feds-rosengren-says-economy-is-in-a-good-place-data-quite-good.jpg,"Fed’s Rosengren Says Economy Is in a Good Place, Data ‘Quite Good’",Federal Reserve Bank of Boston President Eric Rosengren discusses the state of the U.S. economy and his concerns about policy room in case of an economic shock. He speaks with Bloomberg’s Michael McKee on “Bloomberg Markets: The Close.”,Bloomberg Markets and Finance,"Mon, 18 Nov 2019 16:40:07 -0500",,Positive,Video
https://www.youtube.com/watch?v=Iq0FEbqNbQE,https://cdn.snapi.dev/images/v1/k/d/dow-and-nasdaq-close-at-record-high.jpg,Dow and Nasdaq close at record high,The Dow and Nasdaq close at record highs.,CNBC Television,"Mon, 18 Nov 2019 16:37:15 -0500",,Positive,Video
https://investorplace.com/2019/11/disney-again-and-unitedhealth-boosted-the-dow-jones-today/,https://cdn.snapi.dev/images/v1/d/o/dowjones1600b-768x432.jpg,Dow Jones Today: The Slow Grind Higher Continues,"It was a slow day for stocks, but today the Dow Jones Industrial Average was supported by some of its marquee holdings, including Disney.",InvestorPlace,"Mon, 18 Nov 2019 16:29:37 -0500",,Positive,Article
https://www.youtube.com/watch?v=-JlKitHsnGs,https://cdn.snapi.dev/images/v1/d/w/dwmm2m2-1.jpg,Gotham's Greenblatt Says Plunge in IPOs Is Starving Firms of Capital,"Joel Greenblatt, Gotham Asset Management co-chief investment officer and managing principal, comments on the plunge in initial public offerings during an interview with Bloomberg's Vonnie Quinn and Guy Johnson on ""Bloomberg Markets.",Bloomberg Markets and Finance,"Mon, 18 Nov 2019 16:26:11 -0500",,Negative,Video
https://investorplace.com/2019/11/stock-market-today-should-investors-fear-the-trade-war-again/,https://cdn.snapi.dev/images/v1/w/a/wall-street-264381-1920-100.jpg,Stock Market Today: Should Investors Fear the Trade War Again? ,"Trade-war worries weigh on Wall Street on Monday, but not for long. Here's what happened in the stock market today.",InvestorPlace,"Mon, 18 Nov 2019 16:25:48 -0500",,Negative,Article
https://www.youtube.com/watch?v=zu7LWUA4kbA,https://cdn.snapi.dev/images/v1/k/p/did-powell-make-the-right-decision-to-continually-cut-rates.jpg,Did Powell make the right decision to continually cut rates?,Gibbs Wealth Management CIO and president Erin Gibbs discusses the importance of investing in U.S.,Fox Business,"Mon, 18 Nov 2019 16:16:21 -0500",,Positive,Video
https://www.youtube.com/watch?v=1OF-WGBfyBY,https://cdn.snapi.dev/images/v1/m/q/feds-rosengren-need-capital-buffers-fiscal-policy-in-next-downturn.jpg,"Fed’s Rosengren: Need Capital Buffers, Fiscal Policy in Next Downturn",Federal Reserve Bank of Boston President Eric Rosengren explains the need for fiscal policy and more capital buffers in the event of another economic downturn. He speaks with Bloomberg’s Michael McKee on “Bloomberg Markets: The Close.”,Bloomberg Markets and Finance,"Mon, 18 Nov 2019 16:11:03 -0500",,Negative,Video
https://www.marketwatch.com/story/stocks-grab-another-round-of-records-as-wall-street-parses-trade-news-2019-11-18,https://cdn.snapi.dev/images/v1/w/l/wlqn2233-1.jpg,Stocks grab another round of records as Wall Street parses trade news,"Stocks finished slightly higher on Monday, carving out record closes for all three major equity benchmarks, as investors tried to gauge the progress on a phase one trade deal between U.S. and China.",Market Watch,"Mon, 18 Nov 2019 16:08:08 -0500",,Positive,Article
https://www.youtube.com/watch?v=k_0Xv_mOlyI,https://cdn.snapi.dev/images/v1/f/e/fefffgos29-1.jpg,US economy may not grow at all in the fourth quarter,"Keel Point Chief Economic Advisor Steven Skancke discusses the economic outlook, the Federal Reserve and the U.S. consumer.",Yahoo Finance,"Mon, 18 Nov 2019 16:05:22 -0500",,Negative,Video
https://www.forbes.com/sites/investor/2019/11/18/fed-chair-jerome-powell-debt-bubble-warnings/,https://cdn.snapi.dev/images/v1/1/2/106137130-1568838462484rtx73j2p.jpg,Fed Chair Jerome Powell Is Blind To These Debt Bubble Warnings,The Fed boss says that he doesn't see any risks of asset bubbles. He should look more closely.,Forbes,"Mon, 18 Nov 2019 15:59:14 -0500",,Negative,Article
https://www.reuters.com/article/us-global-markets/stocks-climb-on-huawei-extension-buoying-u-s-treasuries-idUSKBN1XS02E,https://cdn.snapi.dev/images/v1/n/v/m02d20191118t2i1453836453rlynxmpefah1dkw640.jpg,"Stocks climb on Huawei extension, buoying U.S. Treasuries","Global equity markets edged higher on Monday, lifting prices of U.S. government debt, as a new 90-day extension allowing U.S.",Reuters,"Mon, 18 Nov 2019 15:45:35 -0500",,Positive,Article
https://www.youtube.com/watch?v=M4Y-mM4Zq3M,https://cdn.snapi.dev/images/v1/w/j/josh-brown-on-the-backdrop-to-consider-when-assessing-us-stocks.jpg,Josh Brown on the backdrop to consider when assessing US stocks,"Josh Brown, Ritholtz Wealth Management, joins 'Fast Money Halftime Report' to discuss the backdrop for the new market highs.",CNBC Television,"Mon, 18 Nov 2019 15:26:48 -0500",,Positive,Video
https://www.youtube.com/watch?v=wNxcnKKABGk,https://cdn.snapi.dev/images/v1/i/d/china-will-just-cheat-anyway-no-matter-the-trade-deal-chris-garcia.jpg,"China 'will just cheat anyway,' no matter the trade deal: Chris Garcia",Former Commerce Department deputy director Chris Garcia gives his insights on the ongoing U.S.,Fox Business,"Mon, 18 Nov 2019 15:01:33 -0500",,Negative,Video
https://www.youtube.com/watch?v=G09QS7QFp2c,https://cdn.snapi.dev/images/v1/8/f/fomo-driving-stocks-higher-says-investing-pro.jpg,"FOMO driving stocks higher, says investing pro","CNBC's ""Power Lunch"" team dives into what's driving markets after Friday's record-making trading session with David Katz of Matrix Asset and Evan Brown, head of multi-asset strategy at UBS Asset Management.",CNBC Television,"Mon, 18 Nov 2019 14:53:50 -0500",,Positive,Video
https://www.reuters.com/article/us-usa-stocks/wall-street-nudges-up-as-investors-await-u-s-china-trade-clarity-idUSKBN1XS1LU,https://cdn.snapi.dev/images/v1/f/9/m02d20191118t2i1453820603rlynxmpefah1axw640.jpg,Wall Street nudges up as investors await U.S.-China trade clarity,Wall Street's main indexes were very slightly higher on Monday after closing at records on Friday and investors digested mixed headlines on U.S.-China trade relations.,Reuters,"Mon, 18 Nov 2019 14:47:14 -0500",,Positive,Article
https://www.reuters.com/article/us-usa-stocks/wall-street-nudge-up-as-investors-await-u-s-china-trade-clarity-idUSKBN1XS1LU,https://cdn.snapi.dev/images/v1/w/g/m02d20191118t2i1453820603rlynxmpefah1axw640.jpg,Wall Street nudge up as investors await U.S.-China trade clarity,Wall Street's main indexes were very slightly higher on Monday after closing at records on Friday and investors digested mixed headlines on U.S.-China trade relations.,Reuters,"Mon, 18 Nov 2019 14:47:14 -0500",,Positive,Article
https://www.cnbc.com/2019/11/18/heres-what-to-think-about-before-you-invest-in-that-next-ipo.html,https://cdn.snapi.dev/images/v1/1/0/105906111-1557488043168rtx6v5rb.jpg,Here's what to consider before you invest in that next IPO,"From Beyond Meat to Uber to Levi Strauss, some big names have attempted to tap the public markets to raise capital this year. But individuals who want to buy these companies' stocks should beware the risks.",CNBC,"Mon, 18 Nov 2019 14:17:00 -0500",,Positive,Article
https://www.iris.xyz/learn/equities/are-pension-funds-creating-dangerous-risks,https://cdn.snapi.dev/images/v1/t/f/are-pension-funds-creating-dangerous-risks-1000x600.jpg,Are Pension Funds Creating Dangerous Risks By Reaching For Yield?,"Written by: Guild Investment Management It has long been obvious to every professional investor, pension administrator or member of a corporate or union pension committee. Now it’s even in The Wall Street Journal: an article on the increasing risks that pension funds are having to take on as they struggle to earn adequate returns in an […]
The post Are Pension Funds Creating Dangerous Risks By Reaching For Yield?",Iris,"Mon, 18 Nov 2019 14:00:56 -0500",,Negative,Article
https://seekingalpha.com/article/4307433-indexes-passive-good-thing-podcast-transcript,https://cdn.snapi.dev/images/v1/p/o/podc14-19.jpg,Not All Indexes Are Passive - And That's A Good Thing (Podcast Transcript),The rapid growth in ETF assets has occurred in parallel with the widespread adoption of index-based approaches to investing - no mere coincidence.,Seeking Alpha,"Mon, 18 Nov 2019 14:00:03 -0500",podcast,Positive,Article
https://www.reuters.com/article/us-usa-trump-powell/trump-powell-met-monday-at-white-house-to-discuss-economy-idUSKBN1XS20L,https://cdn.snapi.dev/images/v1/w/6/m02d20191118t2i1453843628rlynxmpefah1c2w640.jpg,"Trump, Powell met Monday at White House to discuss economy","U.S. President Donald Trump and Federal Reserve Chair Jerome Powell met at the White House on Monday morning, their second meeting since Powell started the job in February 2017 and soon after became the target of frequent criticism from the president who had appointed him.",Reuters,"Mon, 18 Nov 2019 13:20:27 -0500",,Neutral,Article
https://www.reuters.com/article/us-usa-fed-mester/feds-mester-u-s-monetary-policy-in-a-good-spot-idUSKBN1XS27D,https://cdn.snapi.dev/images/v1/m/0/m02d20191118t2i1453862535rlynxmpefah1glw640.jpg,Fed's Mester: U.S. monetary policy 'in a good spot',"The current stance of monetary policy is appropriate for the U.S. economy and the Federal Reserve should now wait and see how the economy evolves, Cleveland Fed President Loretta Mester said on Monday.",Reuters,"Mon, 18 Nov 2019 13:09:52 -0500",,Positive,Article
https://www.nytimes.com/2019/11/18/business/economy/trump-powell-fed.html,https://cdn.snapi.dev/images/v1/l/9/18dc-powell-01-articlelargejpgquality75autowebpdisableupscale.jpg,Trump Meets With Fed Chair Powell for a ‘Cordial’ Talk,"The president has made a habit of criticizing the chair of the Federal Reserve, Jerome H. Powell, whom he picked to lead the central bank.",NYTimes,"Mon, 18 Nov 2019 13:04:34 -0500",paywall,Positive,Article
https://www.youtube.com/watch?v=JW8WRyPppOc,https://cdn.snapi.dev/images/v1/p/1/tariffs-remain-sticking-point-in-us-china-trade-war-negotiations.jpg,Tariffs remain sticking point in US-China trade war negotiations,Yahoo Finance's Jessica Smith reports on the trade talks between the United States and China.,Yahoo Finance,"Mon, 18 Nov 2019 13:00:56 -0500",,Negative,Video
https://www.iris.xyz/learn/forward-looking-investing/investing-income-with-durable-dividends,https://cdn.snapi.dev/images/v1/i/n/investing-income-with-durable-dividends-1000x600.png,Investing for Income with Durable Dividends,"The search for yield continues to dominate discussions among advisors, investors and asset managers more than 10 years after the global financial crisis.",Iris,"Mon, 18 Nov 2019 13:00:34 -0500",dividend,Positive,Article
https://www.etftrends.com/in-the-know-looking-at-recession-concerns/,https://cdn.snapi.dev/images/v1/9/0/in-the-know-looking-at-recession-concerns-915x510.png,In the Know: Looking At Recession Concerns,"In this latest episode of “In the Know” for Q4 2019, Sam Azzarello, Global Market Strategist with J.P. Morgan Asset Management chats with ETF Trends CEO Tom Lydon on the floor of NYSE to address the possibility of a recession.",ETF Trends,"Mon, 18 Nov 2019 12:56:12 -0500",,Negative,Article
https://www.reuters.com/article/us-usa-stocks/wall-street-at-record-levels-after-u-s-extends-huawei-reprieve-idUSKBN1XS1LU,https://cdn.snapi.dev/images/v1/9/8/m02d20191118t2i1453820603rlynxmpefah1axw640.jpg,Wall Street at record levels after U.S. extends Huawei reprieve,Wall Street hovered around record levels on Monday after Washington's move to grant an extension for U.S. companies to do business with China's Huawei helped ease some concerns around U.S.,Reuters,"Mon, 18 Nov 2019 12:41:26 -0500",,Positive,Article
https://www.youtube.com/watch?v=7PXqhB_kwzo,https://cdn.snapi.dev/images/v1/m/q/gothams-greenblatt-says-negative-rates-would-be-bad-for-us.jpg,Gotham's Greenblatt Says Negative Rates Would Be Bad for U.S.,"Joel Greenblatt, Gotham Asset Management co-chief investment officer and managing principal, comments on negative interest rates during an interview with Bloomberg's Vonnie Quinn and Guy Johnson on ""Bloomberg Markets.""",Bloomberg Markets and Finance,"Mon, 18 Nov 2019 12:35:59 -0500",,Neutral,Video
https://www.youtube.com/watch?v=o1SPKxiLCYA,https://cdn.snapi.dev/images/v1/0/v/us-falling-behind-china-on-deployment-of-5g-analyst-says-east-tech-west.jpg,"US falling behind China on deployment of 5G, analyst says","Rebecca Fannin, founder of Silicon Dragon Ventures, discusses the global rollout of superfast 5G mobile internet.",CNBC International TV,"Mon, 18 Nov 2019 12:30:00 -0500",,Negative,Video
https://www.youtube.com/watch?v=0dyki1zdA44,https://cdn.snapi.dev/images/v1/m/q/gothams-greenblatt-says-market-has-factored-in-solution-to-trade-war.jpg,Gotham's Greenblatt Says Market Has Factored In Solution to Trade War,"Joel Greenblatt, Gotham Asset Management co-chief investment officer and managing principal, discusses the impact of U.S.-China trade relations on the stock market with Bloomberg's Vonnie Quinn and Guy Johnson on ""Bloomberg Markets.""",Bloomberg Markets and Finance,"Mon, 18 Nov 2019 12:16:31 -0500",,Positive,Video
https://www.youtube.com/watch?v=mwTBoTPoJ4U,https://cdn.snapi.dev/images/v1/m/q/policy-clarity-will-drive-corporate-investing-tallbacken-founder-ceo.jpg,Policy clarity will drive corporate investing: Tallbacken founder & CEO,"Michael Purves, founder and CEO of Tallbacken Capital Advisors, and Jim Paulsen, Leuthold Group chief investment strategist, join ""Squawk Alley"" to discuss the markets and Fed Chair Powell's meeting with President Trump.",CNBC Television,"Mon, 18 Nov 2019 12:07:37 -0500",,Neutral,Video
https://www.youtube.com/watch?v=vLUzdM6YmF8,https://cdn.snapi.dev/images/v1/a/m/feds-powell-met-trump-mnuchin-monday-to-discuss-economy.jpg,"Fed's Powell Met Trump, Mnuchin Monday to Discuss Economy",Nov.18 -- Federal Reserve Chairman Jerome Powell met with President Donald Trump and Treasury Secretary Steven Mnuchin Monday to discuss the economy.,Bloomberg Markets and Finance,"Mon, 18 Nov 2019 12:07:32 -0500",,Neutral,Video
https://www.reuters.com/article/us-usa-trump-powell-tweet/trump-says-cordial-talk-with-feds-powell-covered-negative-interest-rates-trade-idUSKBN1XS20X,https://cdn.snapi.dev/images/v1/q/6/m02d20191118t2i1453843629rlynxmpefah1caw640.jpg,"Trump says 'cordial' talk with Fed's Powell covered negative interest rates, trade","U.S. President Donald Trump said he met with U.S. Federal Reserve Chairman Jerome Powell on Monday and discussed a wide range of topics including negative interest rates, monetary policy easing, dollar strength and U.S.",Reuters,"Mon, 18 Nov 2019 11:57:51 -0500",,Positive,Article
https://www.reuters.com/article/us-usa-trump-powell/trump-and-powell-met-monday-at-white-house-to-discuss-economy-idUSKBN1XS20L,https://cdn.snapi.dev/images/v1/u/k/m02d20191118t2i1453843628rlynxmpefah1c2w640.jpg,Trump and Powell met Monday at White House to discuss economy,"U.S. President Donald Trump and Federal Reserve Chair Jerome Powell met at the White House on Monday morning, the second meeting between the two since Powell became head of the Fed and faced withering criticism from Trump.",Reuters,"Mon, 18 Nov 2019 11:57:51 -0500",,Neutral,Article
https://www.youtube.com/watch?v=EHU6fOHCNVA,https://cdn.snapi.dev/images/v1/n/u/how-much-higher-will-the-dow-go.jpg,How much higher will the Dow go?,"Global Market Strategist at Invesco  Brian Levitt discusses what's driving the market, volatility, and financial conditions that support the market.",Yahoo Finance,"Mon, 18 Nov 2019 11:52:59 -0500",,Positive,Video
