news_url,image_url,title,text,source_name,date,topics,sentiment,type
https://www.reuters.com/article/us-global-oil/oil-climbs-more-than-1-barrel-as-opec-allied-producers-agree-record-output-cut-idUSKCN21U0WQ,https://cdn.snapi.dev/images/v1/o/i/oil49-10.jpg,"Oil climbs more than $1/barrel as OPEC, allied producers agree record output cut","Oil prices jumped more than $1 a barrel on Monday after major producers finally agreed their biggest-ever output cut, but gains were capped amid concern that it won't be enough to head off oversupply with the coronavirus pandemic hammering demand.",Reuters,"Sun, 12 Apr 2020 21:10:22 -0400",oil,Positive,Article
https://www.forbes.com/sites/greatspeculations/2020/04/12/the-feds-big-bazooka/,https://cdn.snapi.dev/images/v1/s/w/swedf222.jpg,The Fed’s Big Bazooka,Chairman Powell signaled that the Fed was prepared to expand their balance sheet indefinitely. The announcement alone had a huge impact on corporate bond prices.,Forbes,"Sun, 12 Apr 2020 20:58:32 -0400",,Neutral,Article
https://www.youtube.com/watch?v=Bzxl2ahqrZI,https://cdn.snapi.dev/images/v1/x/r/oil-price-war-ends-with-opec-deal-to-cut-output.jpg,Oil Price War Ends With OPEC+ Deal to Cut Output,"The world’s top oil producers pulled off a historic deal to cut global petroleum output by nearly a 10th, putting an end to the devastating price war between Saudi Arabia and Russia.",Bloomberg Markets and Finance,"Sun, 12 Apr 2020 20:43:30 -0400",oil,Positive,Video
https://www.reuters.com/article/us-global-markets/oil-equities-slip-as-opec-cut-fails-to-lift-confidence-idUSKCN21U0YI,https://cdn.snapi.dev/images/v1/a/c/m02d20200412t2i1514840521rlynxnpeg3b0nfw640.jpg,"Oil, equities slip as OPEC+ cut fails to lift confidence",Oil prices and U.S. stock futures dipped in early Monday trade as a landmark agreement by OPEC and its allies to slash output by a record amount failed to give investors any cause for lasting optimism about the economic outlook.,Reuters,"Sun, 12 Apr 2020 19:40:56 -0400",oil,Negative,Article
https://www.forbes.com/sites/judeclemente/2020/04/12/another-record-year-for-low-cost-us-natural-gasand-why-thats-good-news/,https://cdn.snapi.dev/images/v1/o/k/okihbuy00.jpg,Another Record Year For Low-Cost U.S. Natural Gas - And Why That’s Good News,"“Natural gas is one of the mainstays of global energy...it improves air quality and limits emissions of carbon dioxide,” Dr. Fatih Birol, Executive Director, International Energy Agency, 2019",Forbes,"Sun, 12 Apr 2020 19:16:37 -0400",,Neutral,Article
https://www.cnn.com/2020/04/12/investing/global-stocks/index.html,https://cdn.snapi.dev/images/v1/u/h/200412180755-nyse-0409-super-169.jpg,US stock futures down ahead of earnings week for big banks,"US stock futures were down on Sunday evening, ahead of a week when many companies will begin reporting earnings for the three months ending in March, offering a look at how corporate America's finances have been hit by coronavirus.",CNN Business,"Sun, 12 Apr 2020 19:09:53 -0400",earnings,Negative,Article
https://www.theguardian.com/business/2020/apr/12/major-oil-producing-nations-agree-historic-10-cut-in-output,https://cdn.snapi.dev/images/v1/w/f/3500jpgwidth460quality85autoformatfitmaxs3638776c8ca12fc12b8d2d42680c9b05.jpg,Major oil-producing nations agree historic 10% cut in output,Saudi Arabia and Russia reach truce after collapse in demand caused by coronavirus,The Guardian,"Sun, 12 Apr 2020 18:39:36 -0400",oil,Neutral,Article
https://www.marketwatch.com/story/us-oil-trades-2-lower-gives-up-6-gain-in-electronic-trade-after-opec-forges-historic-energy-output-cut-with-us-russia-2020-04-12,https://cdn.snapi.dev/images/v1/o/i/oil48-7.jpg,"U.S. oil  trades 2% lower, gives up 6% gain in electronic trade, after OPEC forges historic energy output cut with U.S., Russia","Oil futures Sunday evening bounced around, giving up a sharp gain in electronic trade, after Saudi Arabia, Russia and the U.S.",Market Watch,"Sun, 12 Apr 2020 18:25:07 -0400",oil,Neutral,Article
https://www.reuters.com/article/us-global-oil-opec-iraq/iraqi-oil-minister-says-big-oil-cut-deal-will-help-to-stabilize-oil-market-idUSKCN21U0WY,https://cdn.snapi.dev/images/v1/j/g/stock-exchange-738671-1280-1-24.jpg,Iraqi oil minister says big oil cut deal will help to stabilize oil market,Iraq's oil minister said late on Sunday that the big oil cut deal reached at an OPEC+ meeting would help stabilize the market.,Reuters,"Sun, 12 Apr 2020 18:24:57 -0400",oil,Positive,Article
https://www.marketwatch.com/story/us-stock-futures-decline-in-choppy-trade-after-oil-producers-reach-pact-to-end-price-war-2020-04-12,https://cdn.snapi.dev/images/v1/x/g/wall-street-264381-1920-100.jpg,U.S. stock futures decline in choppy trade after oil producers reach pact to end price war,"U.S. stock-index futures opened higher Sunday evening but soon gave up early gains, tracking choppy trade in oil futures after major oil producers reached an agreement on output cuts that ends a price war between Russia and Saudi Arabia.",Market Watch,"Sun, 12 Apr 2020 18:20:08 -0400",oil,Negative,Article
https://www.cnbc.com/2020/04/12/oil-prices-flat-after-opec-and-allies-agree-to-historic-production-cut.html,https://cdn.snapi.dev/images/v1/a/j/106452951-1584672763533gettyimages-1212606206.jpeg,Oil prices are flat after OPEC and allies agree to historic production cut,Oil prices were flat in overnight trading after OPEC and its allies agreed to a historic deal to cut production by a record 9.7 million barrels per day.,CNBC,"Sun, 12 Apr 2020 18:10:18 -0400",oil,Neutral,Article
https://www.cnbc.com/2020/04/12/stock-market-futures-open-to-close-news.html,https://cdn.snapi.dev/images/v1/e/m/106456817-1585088933461bull.jpg,US stock futures are flat as investors weigh coronavirus and oil outlook,U.S. stock futures were flat on Sunday night after OPEC and other oil-producing countries reached a deal on a massive production cut.,CNBC,"Sun, 12 Apr 2020 18:09:20 -0400",oil,Neutral,Article
https://www.reuters.com/article/us-global-oil/opec-deal-could-boost-oil-prices-but-oversupply-remains-idUSKCN21U0WQ,https://cdn.snapi.dev/images/v1/2/s/m02d20200412t2i1514834004rlynxnpeg3b0mmw640.jpg,"OPEC+ deal could boost oil prices, but oversupply remains",An oil producer deal to make record output cuts will lend some support this week to oil prices that have lost half their value this year as the coronavirus hammers demand.,Reuters,"Sun, 12 Apr 2020 18:04:11 -0400",oil,Neutral,Article
https://www.reuters.com/article/us-global-oil-opec-canada/canada-welcomes-oil-cut-deal-says-it-is-committed-to-achieving-price-certainty-idUSKCN21U0W0,https://cdn.snapi.dev/images/v1/o/l/m02d20200412t2i1514833111rlynxnpeg3b0mew640.jpg,"Canada welcomes oil cut deal, says it is committed to achieving price certainty","Canada on Sunday formally welcomed a deal by OPEC and allies to cut oil output by a record amount, saying Ottawa was committed to achieving price certainty and economic stability.",Reuters,"Sun, 12 Apr 2020 17:45:32 -0400",oil,Positive,Article
https://www.benzinga.com/news/20/04/15785486/opec-agrees-to-historic-deal-to-cut-oil-prices,https://cdn.snapi.dev/images/v1/0/s/refinery-514010-1920-11.jpg,OPEC+ Agrees To Historic Deal To Cut Oil Prices,"Following several days of meetings that began last Thursday, a historic oil deal has been reached.",Benzinga,"Sun, 12 Apr 2020 17:41:38 -0400",oil,Positive,Article
https://www.cnbc.com/2020/04/11/robert-shiller-pandemic-of-fear-could-tip-economy-into-a-depression.html,https://cdn.snapi.dev/images/v1/0/t/106433369-1583790081984gettyimages-1088261070.jpeg,Robert Shiller: Pandemic of fear could tip economy into a depression,Nobel-prize winning economist Robert Shiller warns a painful self-fulfilling prophecy may be unfolding in the market.,CNBC,"Sun, 12 Apr 2020 17:11:32 -0400",,Negative,Article
https://www.cnn.com/2020/04/12/energy/opec-deal-production-cut/index.html,https://cdn.snapi.dev/images/v1/a/v/200412160455-opec-oil-drilling-restricted-super-169.jpg,OPEC+ reaches deal to cut oil production by 9.7 million barrels per day,"In an emergency virtual meeting Sunday, OPEC+ arrived at a deal to slash oil production by 9.7 million barrels a day starting May 1, a senior OPEC source told CNN. The cuts will remain in place through June, the source said.",CNN Business,"Sun, 12 Apr 2020 16:19:33 -0400",oil,Positive,Article
https://www.reuters.com/article/us-global-oil-saudi/saudi-energy-minister-says-opec-effective-oil-cuts-are-12-5-million-bpd-idUSKCN21U0UA,https://cdn.snapi.dev/images/v1/b/a/m02d20200412t2i1514827706rlynxnpeg3b0kxw640.jpg,Saudi energy minister says OPEC+ effective oil cuts are 12.5 million bpd,"The Saudi energy minister said on Sunday that effective oil supply cuts by OPEC and its allies, a group known as OPEC+, will amount to 12.5 million barrels per day, because of higher output in April from Saudi Arabia, the United Arab Emirates and Kuwait.",Reuters,"Sun, 12 Apr 2020 16:13:55 -0400",oil,Neutral,Article
https://www.reuters.com/article/us-health-coronavirus-stocks/oil-agreement-could-support-stocks-providing-a-floor-idUSKCN21U0U4,https://cdn.snapi.dev/images/v1/f/m/m02d20200412t2i1514827318rlynxnpeg3b0ktw640.jpg,"Oil agreement could support stocks, providing a floor","An agreement by oil producing nations to cut output by a record amount may sustain a recent bounce in stocks, though stay-at-home restrictions and closures tied to the coronavirus pandemic continue to weigh on the global economy.",Reuters,"Sun, 12 Apr 2020 16:08:42 -0400",oil,Positive,Article
https://www.reuters.com/article/us-global-oil-opec-trump/trump-says-great-opec-deal-will-save-u-s-jobs-idUSKCN21U0TW,https://cdn.snapi.dev/images/v1/j/q/m02d20200412t2i1514827705rlynxnpeg3b0kqw640.jpg,Trump says 'great' OPEC+ deal will save U.S. jobs,"U.S. President Donald Trump on Sunday praised a deal among the world's top oil producers to cut global petroleum output, saying it would save jobs in the U.S. energy industry.",Reuters,"Sun, 12 Apr 2020 16:04:46 -0400",oil,Positive,Article
https://www.forbes.com/sites/jackbrewster/2020/04/12/worlds-top-oil-producers-agree-to-historic-deal-to-end-devastating-price-war/,https://cdn.snapi.dev/images/v1/s/d/worlds-top-oil-producers-agree-to-historic-deal-to-end-devastating-price-war.jpg,World’s Top Oil Producers Agree To Historic Deal To End Devastating Price War,The coronavirus outbreak has caused oil demand to plummet.,Forbes,"Sun, 12 Apr 2020 15:24:05 -0400",oil,Positive,Article
https://www.reuters.com/article/us-global-oil-opec-emirates/uae-committed-to-reducing-oil-production-from-its-current-4-1-million-bpd-energy-minister-idUSKCN21U0SU,https://cdn.snapi.dev/images/v1/w/z/m02d20200412t2i1514824716rlynxnpeg3b0k9w640.jpg,UAE committed to reducing oil production from its current 4.1 million bpd:  Energy minister,"The United Arab Emirates is committed to reducing oil production from its current level of 4.1 million barrels per day (MBOPD), energy minister Suhail Al Mazrouei said in a tweet on Sunday.",Reuters,"Sun, 12 Apr 2020 15:20:40 -0400",oil,Positive,Article
https://www.reuters.com/article/us-global-oil-opec-russia-talks/kremlin-says-leaders-of-russia-u-s-saudi-arabia-support-opec-oil-deal-idUSKCN21U0SM,https://cdn.snapi.dev/images/v1/r/x/105638005-1545256725122gettyimages-1084667734.jpg,"Kremlin says leaders of Russia, U.S., Saudi Arabia support OPEC+ oil deal","Russian President Vladimir Putin, U.S. President Donald Trump and Saudi Arabia's King Salman all supported the OPEC+ deal to cut global crude output, the Kremlin said on Sunday.",Reuters,"Sun, 12 Apr 2020 15:15:54 -0400",oil,Positive,Article
https://investorplace.com/2020/04/another-bullish-week/,https://cdn.snapi.dev/images/v1/b/l/jobless-claims-weaker-than-expected-but-fed-jumps-in-with-more-help.jpg,Another Bullish Week,"It was another big rally-week for stocks, with the S&P climbing 12%. However, while these gains are welcomed by investors, it turns out that slower, smaller moves are more indicative of a healthy bull market.",InvestorPlace,"Sun, 12 Apr 2020 14:24:10 -0400",,Positive,Article
https://www.reuters.com/article/us-global-oil-opec-mexico/mexicos-energy-minister-says-oil-producers-agreed-to-cut-output-by-9-7-mln-bpd-from-may-idUSKCN21U0RJ,https://cdn.snapi.dev/images/v1/o/n/m02d20200412t2i1514822405rlynxnpeg3b0jrw640.jpg,Mexico's energy minister says oil producers agreed to cut output by 9.7 mln bpd from May,Mexico's Energy Minister Rocio Nahle said on Sunday oil producers unanimously agreed to cut output by 9.7 million barrels per day from May at OPEC+ talks and thanked OPEC members for their support in reaching the deal.,Reuters,"Sun, 12 Apr 2020 14:22:42 -0400",oil,Positive,Article
https://www.cnbc.com/2020/04/12/opec-and-allies-finalize-record-oil-production-cut-after-days-of-discussion.html,https://cdn.snapi.dev/images/v1/h/f/106474793-1585989567876gettyimages-881610952.jpeg,OPEC and allies finalize record oil production cut after days of discussion,"The 9.7 million barrels per day cut will begin on May 1, and will extend through the end of June.",CNBC,"Sun, 12 Apr 2020 14:14:21 -0400",oil,Positive,Article
https://www.reuters.com/article/us-global-oil-opec-deal/opec-agrees-largest-ever-oil-output-cut-of-9-7-million-bpd-sources-idUSKCN21U0QO,https://cdn.snapi.dev/images/v1/i/k/m02d20200412t2i1514821117rlynxnpeg3b0j8w640.jpg,OPEC+ agrees largest ever oil output cut of 9.7 million bpd: sources,"OPEC, Russia and other oil producing nations agreed on Sunday to cut output by a record amount, representing around 10% of global supply, to support oil prices amid the coronavirus pandemic, sources said.",Reuters,"Sun, 12 Apr 2020 13:56:00 -0400",oil,Positive,Article
https://www.etftrends.com/multi-factor-channel/volatile-start-to-2020-whats-next/,https://cdn.snapi.dev/images/v1/s/t/stocks161-38.jpg,Volatile Start to 2020 – What’s Next?,Last year’s prognostications about the events and trends to monitor in 2020 have evaporated as COVID-19 has upended people’s lives and caused massive recalibrations in financial markets.,ETF Trends,"Sun, 12 Apr 2020 13:21:17 -0400",,Negative,Article
https://www.cnbc.com/2020/04/12/coronavirus-feds-kashkari-says-economic-recovery-could-be-slow-hard.html,https://cdn.snapi.dev/images/v1/f/x/105021335-gettyimages-511149858.jpg,"Fed's Neel Kashkari says coronavirus economic recovery 'could be a long, hard road'",Kashkari's comments came days after the Labor Department reported that another 6.6 million Americans filed first-time unemployment claims in the past week.,CNBC,"Sun, 12 Apr 2020 12:21:17 -0400",,Negative,Article
https://www.cnbc.com/2020/04/12/state-and-local-governments-face-budget-crunch-hurting-hopes-for-a-quick-economic-recovery.html,https://cdn.snapi.dev/images/v1/i/g/106482589-1586456700052closed.jpg,"State and local governments face budget crunch, hurting hopes for a quick economic recovery",The coronvirus-induced economic slowdown will hurt tax receipts that state and local governments rely upon to pay their employees.,CNBC,"Sun, 12 Apr 2020 12:03:57 -0400",,Negative,Article
https://www.fool.com/investing/2020/04/12/this-warren-buffett-strategy-could-bring-you-succe.aspx,https://cdn.snapi.dev/images/v1/b/e/berk92-3.jpg,"This Warren Buffett Strategy Could Bring You Success, Too",It's easier than ever to do this -- and you might never get a better chance.,The Motley Fool,"Sun, 12 Apr 2020 12:02:00 -0400",wbuffett,Positive,Article
https://www.seeitmarket.com/the-federal-reserve-gone-wild/,https://cdn.snapi.dev/images/v1/z/q/rodo2111-1.jpg,The Federal Reserve Gone Wild!,"iShares iBoxx Investment Grade Bonds ETF NYSEARCA: LQD The Federal Reserve injected another 2.3 trillion into buying bonds including junk.  The Fed has bypassed the Federal Reserve act, which means they can buy whatever they want.",See It Market,"Sun, 12 Apr 2020 11:37:29 -0400",,Neutral,Article
https://www.seeitmarket.com/v-shaped-economic-recovery-time-to-think-outside-the-box/,https://cdn.snapi.dev/images/v1/2/b/106216647-1572551374530gettyimages-1179069735.jpeg,V-Shaped Economic Recovery? Time to Think Outside the Box,"It seems the entirety of the financial media and many on Wall Street believe a “V” shaped economic recovery is in our future. While we hope they are right, we would be foolish to take such analysis and, quite frankly, unwarranted optimism, at face value.",See It Market,"Sun, 12 Apr 2020 11:24:15 -0400",,Neutral,Article
https://www.forbes.com/sites/brettsteenbarger/2020/04/12/what-can-we-learn-from-the-recent-stock-market-rally/,https://cdn.snapi.dev/images/v1/s/t/stocks131-48.jpg,What Can We Learn From The Recent Stock Market Rally?,"After a historic market rally, what does market history tell us about the path forward?",Forbes,"Sun, 12 Apr 2020 10:45:36 -0400",,Positive,Article
https://www.reuters.com/article/us-global-oil-opec-azerbaijan/russian-saudi-ministers-to-chair-opec-meeting-on-sunday-azerbaijan-idUSKCN21U0J6,https://cdn.snapi.dev/images/v1/o/i/oil28-8.jpg,"Russian, Saudi ministers to chair OPEC+ meeting on Sunday: Azerbaijan","Russian Energy Minister Alexander Novak and Saudi Energy Minister Prince Abdulaziz bin Salman will chair an OPEC and non-OPEC online meeting later on Sunday, the Azerbaijan energy ministry said.",Reuters,"Sun, 12 Apr 2020 09:40:46 -0400",oil,Neutral,Article
https://www.cnbc.com/2020/04/12/opec-and-allies-will-hold-an-emergency-virtual-meeting-sunday-night-to-finalize-cut-agreement.html,https://cdn.snapi.dev/images/v1/a/l/106474793-1585989567876gettyimages-881610952.jpeg,OPEC and allies will hold an emergency virtual meeting Sunday night to finalize cut agreement,"OPEC and its allies agreed to a historic 10 million barrel per day production cut Thursday, but opposition from Mexico is holding up a final deal.",CNBC,"Sun, 12 Apr 2020 09:31:36 -0400",oil,Neutral,Article
https://www.forbes.com/sites/davidrae/2020/04/12/the-laws-of-wealth-covid/,https://cdn.snapi.dev/images/v1/2/9/the-laws-of-wealth-and-investing-during-the-covid-19-pandemic.jpg,The Laws Of Wealth And Investing During The COVID-19 Pandemic,We have seen the stock market values of some of your favorite companies drop precipitously.  The Laws of Wealth will share tips to turn scary times into opportunities.,Forbes,"Sun, 12 Apr 2020 09:00:00 -0400",,Negative,Article
https://www.reuters.com/article/us-global-oil-opec/opec-allies-to-confer-on-sunday-to-try-to-end-standoff-over-cuts-plan-sources-idUSKCN21U0HN,https://cdn.snapi.dev/images/v1/w/5/m02d20200412t2i1514806181rlynxnpeg3b0ciw640.jpg,"OPEC, allies to confer on Sunday to try to end standoff over cuts plan: sources","OPEC and its allies will hold a virtual meeting on Sunday evening in a bid to end a standoff that has prevented the finalisation of a global oil supply cut pact, six OPEC+ sources said.",Reuters,"Sun, 12 Apr 2020 08:43:31 -0400",oil,Neutral,Article
https://seekingalpha.com/article/4337064-sentiment-speaks-this-6-week-bear-market-may-be-over,https://cdn.snapi.dev/images/v1/s/t/stocks1234-6.jpg,Sentiment Speaks: This '6-Week Bear Market' May Be Over,There are too many fallacies that ordinary investors are willing to accept about the market.,Seeking Alpha,"Sun, 12 Apr 2020 08:00:00 -0400",,Neutral,Article
https://www.cnn.com/2020/04/12/investing/stocks-week-ahead-earnings-outlook-coronavirus/index.html,https://cdn.snapi.dev/images/v1/p/d/200408075305-01-empty-wall-street-0405-super-169.jpg,How bad will earnings be? Nobody really knows,Corporate America is getting hit hard by the Covid-19 pandemic.,CNN Business,"Sun, 12 Apr 2020 07:57:12 -0400",earnings,Negative,Article
https://www.forbes.com/sites/tomaspray/2020/04/12/why-do-bear-market-rallies-occur/,https://cdn.snapi.dev/images/v1/0/v/why-do-bear-market-rallies-occur.jpg,Why Do Bear Market Rallies Occur?,Despite the economic uncertainty and the imminent start of the earnings season the stock market had its best week in 45 years. This has many wondering if this is a new bull market or just a bear market rally.,Forbes,"Sun, 12 Apr 2020 07:37:27 -0400",,Negative,Article
https://247wallst.com/economy/2020/04/12/100-of-major-economist-group-say-u-s-is-in-recession/,https://cdn.snapi.dev/images/v1/f/e/106007058-1562599908150bull.jpg,100% Of Major Economist Group Say U.S. Is In Recession,"Not a large fraction, or even a majority. 100% of the economists at the widely regarded NABE (National Association of Business Economists) say the U.S.",24/7 Wall Street,"Sun, 12 Apr 2020 07:09:32 -0400",,Negative,Article
https://www.forbes.com/sites/hershshefrin/2020/04/12/great-depression-economics-101-what-historical-numbers-and-charts-from-the-great-depression-foretell-about-the-economy-and-stock-market/,https://cdn.snapi.dev/images/v1/e/t/etf48-50.jpg,Great Depression Economics 101: What Historical Numbers And Charts From The Great Depression Foretell About The Economy And Stock Market,"Historical economic trends from the Great Depression provide useful information for estimating the the depth and duration of the current contraction, along with associated stock market risk.",Forbes,"Sun, 12 Apr 2020 03:10:00 -0400",,Negative,Article
https://seekingalpha.com/article/4337065-weighing-week-ahead-many-good-questions-many-poor-answers,https://cdn.snapi.dev/images/v1/e/t/etf40-48.jpg,"Weighing The Week Ahead: So Many Good Questions, So Many Poor Answers",The market rally was a surprise for nearly everyone. There seemed to be improved confidence on limiting the spread of the virus and the impact of government programs.,Seeking Alpha,"Sun, 12 Apr 2020 02:12:30 -0400",,Negative,Article
