news_url,image_url,title,text,source_name,date,topics,sentiment,type
https://www.forbes.com/sites/martineparis/2020/04/30/venture-capital-outlook-6-ai-trends-that-will-drive-economic-recovery/,https://cdn.snapi.dev/images/v1/i/a/venture-capital-outlook-6-ai-trends-that-will-drive-economic-recovery.jpg,Venture Capital Outlook: 6 AI Trends That Will Drive Economic Recovery,"With historic unemployment topping 30 million, GDP QI contracting 4.8% expected to surpass 30% for Q2, and a stock market propped up by trillions of dollars in government stimulus soaring to record highs, this is either the worst economy ever as Fed Chair Powell declared or the best times to come.",Forbes,"Thu, 30 Apr 2020 23:57:29 -0400",,Positive,Article
https://www.cnbc.com/2020/05/01/oil-markets-us-stockpiles-output-cuts-in-focus.html,https://cdn.snapi.dev/images/v1/m/n/106507420-1587988455124gettyimages-1211017768.jpeg,"Oil prices surge again US stockpiles grow less than feared, output cuts kick in","Oil prices jumped on Friday, extending the previous session's gains, buoyed by a lower-than-expected gain in U.S. crude inventories and the start of output cuts in a bid to offset a slump in fuel demand triggered by the coronavirus pandemic.",CNBC,"Thu, 30 Apr 2020 21:51:38 -0400",oil,Positive,Article
https://www.cnbc.com/2020/04/30/long-time-bear-david-rosenberg-doesnt-hate-stocks-right-now-heres-why.html,https://cdn.snapi.dev/images/v1/a/u/105598220-1543443410181gettyimages-854153614.jpg,Long-time bear David Rosenberg doesn't hate stocks right now. Here's why,One of Wall Street's biggest bears may be starting to shift gears despite a tough economic recovery ahead.,CNBC,"Thu, 30 Apr 2020 21:07:32 -0400",,Positive,Article
https://www.forbes.com/sites/mikepatton/2020/04/30/what-the-past-90-years-has-taught-us-about-recessions-and-stock-behavior/,https://cdn.snapi.dev/images/v1/i/w/what-the-past-90-years-has-taught-us-about-recessions-and-stock-behavior.jpg,What The Past 90 Years Has Taught Us About Recessions And Stock Behavior,"The current recession is expected to be the most severe since the Great Depression, which is not good for stocks.",Forbes,"Thu, 30 Apr 2020 20:30:37 -0400",,Neutral,Article
https://www.youtube.com/watch?v=e6xa9QjZ-WA,https://cdn.snapi.dev/images/v1/h/y/cramer-says-his-most-trusted-market-indicator-makes-me-concerned-about-the-markets-trajectory.jpg,Cramer says his most trusted market indicator 'makes me concerned' about the market's trajectory,"Stocks on Wall Street have reached levels that are ""too hot"" for CNBC's Jim Cramer's liking.",CNBC Television,"Thu, 30 Apr 2020 19:21:04 -0400","cramer,madmoney",Negative,Video
https://www.cnbc.com/2020/04/30/jim-cramer-says-his-most-trusted-market-indicator-makes-me-concerned.html,https://cdn.snapi.dev/images/v1/p/v/106434857-1583852989603hand.jpg,Cramer says his most trusted indicator 'makes me concerned' about the market's trajectory,"Stocks on Wall Street have reached levels that are ""too hot"" for Jim Cramer's liking.",CNBC,"Thu, 30 Apr 2020 19:11:05 -0400",cramer,Negative,Article
https://www.forbes.com/sites/lcarrel/2020/04/30/t-rowe-offers-5-rules-for-investing-during-time-of-pandemic/,https://cdn.snapi.dev/images/v1/v/o/t-rowe-offers-5-rules-for-investing-during-time-of-pandemic.jpg,T. Rowe Offers 5 Rules For Investing During Time Of Pandemic,The extreme volatility in the markets and the uncertainty over the economy has left individual investors worrying about how to manage their portfolios. Fund manager T.,Forbes,"Thu, 30 Apr 2020 19:09:58 -0400",,Negative,Article
https://www.reuters.com/article/us-health-coronavirus-usa-china/trump-threatens-new-tariffs-on-china-as-u-s-mulls-retaliatory-action-over-virus-idUSKBN22C3DS,https://cdn.snapi.dev/images/v1/u/u/m02d20200430t2i1517095018rlynxmpeg3t221w640.jpg,Trump threatens new tariffs on China as U.S. mulls retaliatory action over virus,"U.S. President Donald Trump said on Thursday his hard-fought trade deal with China was now of secondary importance to the coronavirus pandemic and he threatened new tariffs on Beijing, as his administration crafted retaliatory measures over the outbreak.",Reuters,"Thu, 30 Apr 2020 19:06:11 -0400",,Negative,Article
https://www.youtube.com/watch?v=w2vwmjfA9TA,https://cdn.snapi.dev/images/v1/7/b/jim-cramer-expects-a-lot-more-bad-news-after-jobless-claims-top-30-million.jpg,Jim Cramer expects 'a lot more bad news' after jobless claims top 30 million,"""The market was overbought and we got hit with yet another great depression sized unemployment number.",CNBC Television,"Thu, 30 Apr 2020 19:05:34 -0400","cramer,madmoney",Negative,Video
https://www.marketwatch.com/story/us-stock-futures-fall-after-apple-amazon-post-earnings-2020-04-30,https://cdn.snapi.dev/images/v1/j/l/us-consumer-spending-sees-sharpest-monthly-drop-ever-recorded.jpg,"U.S. stock futures fall after Apple, Amazon post earnings","U.S. stock index futures sank late Thursday, after Apple Inc. and Amazon.com Inc.",Market Watch,"Thu, 30 Apr 2020 19:05:31 -0400",earnings,Negative,Article
https://www.forbes.com/sites/sarahhansen/2020/04/30/what-do-30-million-unemployment-claims-actually-look-like/,https://cdn.snapi.dev/images/v1/u/m/what-do-30-million-unemployment-claims-actually-look-like.jpg,What Do 30 Million Unemployment Claims Actually Look Like?,We’ve seen more jobless claims in the last six weeks than there are people in the state of Texas.,Forbes,"Thu, 30 Apr 2020 18:34:35 -0400",,Negative,Article
https://www.youtube.com/watch?v=Iop3OsdOA-k,https://cdn.snapi.dev/images/v1/h/y/savita-subramanian-on-the-biggest-risks-to-the-market.jpg,Savita Subramanian on the biggest risks to the market,"Savita Subramanian, Bank of America, discusses banks, Big Tech and the biggest risks to the market. With CNBC's Melissa Lee and the Fast Money traders, Guy Adami, Tim Seymour, Karen Finerman and Dan Nathan.",CNBC Television,"Thu, 30 Apr 2020 18:09:33 -0400",,Negative,Video
https://www.youtube.com/watch?v=zHFNZAh5LwE,https://cdn.snapi.dev/images/v1/a/e/trump-says-he-can-retaliate-against-china-for-coronavirus-with-more-tariffs.jpg,Trump says he can retaliate against China for coronavirus with more tariffs,CNBC's Kayla Tausche report on President Trump comments about punishing China for the coronavirus.,CNBC Television,"Thu, 30 Apr 2020 18:07:06 -0400",,Negative,Video
https://www.cnbc.com/2020/04/30/stock-market-futures-open-to-close-news.html,https://cdn.snapi.dev/images/v1/w/c/106371867-1580834532806gettyimages-1198368917.jpeg,Dow futures fall 200 points after Wall Street wraps up best month in three decades,Stock futures fell sharply on Thursday night as traders pored through the latest batch of big tech earnings after Wall Street wrapped up its best month in decades.,CNBC,"Thu, 30 Apr 2020 18:01:27 -0400",,Negative,Article
https://www.youtube.com/watch?v=jG3pMGxVXbY,https://cdn.snapi.dev/images/v1/1/b/white-collar-jobless-claims-on-the-rise.jpg,White collar jobless claims on the rise,"The Washington Post has seen a shift in the composition of layoffs. With CNBC's Melissa Lee and the Fast Money traders, Guy Adami, Tim Seymour, Karen Finerman and Dan Nathan.",CNBC Television,"Thu, 30 Apr 2020 18:00:34 -0400",,Negative,Video
https://www.youtube.com/watch?v=Y3-6fL2DZdQ,https://cdn.snapi.dev/images/v1/p/o/podc9-8.jpg,IBD Live: Stock Market Rally Hits Headwinds; Will Stocks Rise Above?,"On Thursday’s IBD Live, the Team discusses the overall trend of the current stock market rally and why the major indexes could fully recover faster than expected.",Investors Business Daily,"Thu, 30 Apr 2020 17:58:33 -0400",podcast,Negative,Video
https://www.cnbc.com/2020/04/30/jobless-claims-surge-to-more-than-30-million-heres-what-to-watch.html,https://cdn.snapi.dev/images/v1/h/m/106493958-1587141181772gettyimages-1210212643.jpeg,Jobless claims surge to more than 30 million — here's what to watch,Jobless claims continue to rise. Here's what four market experts have to say about the data.,CNBC,"Thu, 30 Apr 2020 17:49:39 -0400",,Negative,Article
https://www.youtube.com/watch?v=mEZUDdFI-Sc,https://cdn.snapi.dev/images/v1/u/w/we-are-approaching-a-period-of-very-precipitous-drop-in-economic-activity-says-jpm-strategist.jpg,"'We are approaching a period of very precipitous drop in economic activity,' says,' JPM strategist","Jack Manley, JPMorgan Asset Mgmt Global Market Strategist breaks down the impact the coronavirus pandemic has had on the economy and stocks and what the economic recovery looks like.",Yahoo Finance,"Thu, 30 Apr 2020 17:47:34 -0400",,Negative,Video
https://www.marketwatch.com/story/trump-threatens-use-of-tariffs-against-china-as-coronavirus-retaliation-2020-04-30,https://cdn.snapi.dev/images/v1/e/s/esdfdsw4.jpg,Trump threatens use of tariffs against China as coronavirus retaliation,President Donald Trump on Thursday said he could use tariffs to respond to China over its handling of the coronavirus pandemic.,Market Watch,"Thu, 30 Apr 2020 17:45:51 -0400",,Negative,Article
https://www.benzinga.com/analyst-ratings/analyst-color/20/04/15921172/gasbuddy-analyst-talks-battered-oil-industry-why-gasoline-prices-arent-lower,https://cdn.snapi.dev/images/v1/6/v/refinery-3613526-1920-9.jpg,"GasBuddy Analyst Talks Battered Oil Industry, Why Gasoline Prices Aren't Lower","Patrick DeHann, head of petroleum analysis at GasBuddy.com, joined Benzinga’s PreMarket Prep show this week to discuss the state of the U.S.",Benzinga,"Thu, 30 Apr 2020 17:30:46 -0400",oil,Negative,Article
https://www.benzinga.com/analyst-ratings/analyst-color/20/04/15908997/mining-sector-hit-by-coronavirus-lockdowns-silver-production-walloped,https://cdn.snapi.dev/images/v1/4/f/tunnel-957963-1920-1.jpg,"Mining Sector Hit By Coronavirus Lockdowns, Silver Production Walloped","The mining sector is seeing severe disruption, with activity being suspended across a number of countries due to the coronavirus pandemic and silver production affected.",Benzinga,"Thu, 30 Apr 2020 17:29:25 -0400",,Negative,Article
https://investorplace.com/2020/04/dow-jones-today-a-rough-day-to-end-a-strong-month/,https://cdn.snapi.dev/images/v1/d/o/dollarstocks-3.jpg,Dow Jones Today: A Rough Day to End A Strong Month,"Saddled by another round of bleak economic data delivered on a Thursday and tepid earnings reports, stocks faltered in the final trading day of April, though the major equity benchmarks posted strong monthly performances.
The post Dow Jones Today: A Rough Day to End A Strong Month appeared first on InvestorPlace.",InvestorPlace,"Thu, 30 Apr 2020 16:57:51 -0400",,Negative,Article
https://www.gurufocus.com/news/1122204/us-indexes-close-lower-thursday,https://cdn.snapi.dev/images/v1/f/a/interest-ratesjpgquality90stripall.jpg,US Indexes Close Lower Thursday (April 30),"The Dow Jones Industrial Average closed at 24,345.72 on Thursday with a loss of 288.14 points or -1.17%.",GuruFocus,"Thu, 30 Apr 2020 16:51:42 -0400",,Negative,Article
https://www.marketwatch.com/story/guid/959f823f-cdd5-41fb-aa6e-7d094c59e58d,https://cdn.snapi.dev/images/v1/3/n/sdfr3222-1.jpg,Dow ends lower as Washington Post reports U.S. 'crafting' retaliation against China for coronavirus handling,U.S. stocks midday Thursday took a firm leg down midday but finished off the worst levels of the session after the Washington Post reported that U.S.,Market Watch,"Thu, 30 Apr 2020 16:49:16 -0400",,Negative,Article
https://www.zacks.com/stock/news/909768/you-can-be-a-value-investor-and-a-bull,https://cdn.snapi.dev/images/v1/y/c/podc7.jpg,You Can Be a Value Investor and a Bull,Waiting for the hot growth stocks to crash? Forget those and look for big cap bargains as the market heats up.,Zacks Investment Research,"Thu, 30 Apr 2020 16:42:00 -0400",podcast,Neutral,Article
https://www.youtube.com/watch?v=-Q1cxCd_mMk,https://cdn.snapi.dev/images/v1/l/k/dow-sp-have-its-best-month-since-1987.jpg,"Dow, S&P have its best month since 1987",The Dow Jones Industrial Average and S&P wrapped its best month since 1987 while retailer J.,Fox Business,"Thu, 30 Apr 2020 16:34:57 -0400",,Positive,Video
https://www.etftrends.com/6-etf-questions-im-pondering-following-the-coronavirus-selloff/,https://cdn.snapi.dev/images/v1/6/-/6-etf-questions-im-pondering-following-the-coronavirus-selloff-440x250.jpg,6 ETF Questions I’m Pondering Following the Coronavirus Selloff,This article originally appeared at TheETFEducator.com. You can follow the author on Twitter @NateGeraci.,ETF Trends,"Thu, 30 Apr 2020 16:29:28 -0400",,Neutral,Article
https://investorplace.com/2020/04/stock-market-today-jobless-claims-boeing-bonds-bonanza/,https://cdn.snapi.dev/images/v1/g/m/stocks222-6.jpg,Stock Market Today: Jobless Claims Top 30 Million; Boeing Bonds Bonanza,"Jobless claims top 30 million, while stocks struggle despite strong earnings from Big Tech. Here's what happened in the stock market today.",InvestorPlace,"Thu, 30 Apr 2020 16:22:53 -0400",,Neutral,Article
https://www.forbes.com/sites/kenrapoza/2020/04/30/have-we-hit-peak-coronavirus-unemployment-yet/,https://cdn.snapi.dev/images/v1/b/v/have-we-hit-peak-coronavirus-unemployment-yet.jpg,Have We Hit Peak Coronavirus Unemployment Yet?,We keep talking about peak infections and peak coronavirus deaths. What about peak unemployment?,Forbes,"Thu, 30 Apr 2020 16:15:26 -0400",,Negative,Article
https://nypost.com/2020/04/30/larger-companies-can-apply-for-federal-reserves-main-street-coronavirus-help-lending-program/,https://cdn.snapi.dev/images/v1/e/e/sized-executivesjpgquality90stripall.jpg,Larger companies can apply for Fed’s coronavirus relief program,"The US Federal Reserve on Thursday widened a key program to nurse the “Main Street” economy through the coronavirus pandemic, agreeing to lend to even larger firms, taking on more risk in participation with banks, and hinting at some form of dedicated help for nonprofits. The central bank said it would expand its “Main Street.",New York Post,"Thu, 30 Apr 2020 16:15:12 -0400",,Neutral,Article
https://www.reuters.com/article/us-global-markets/global-equities-dip-at-end-of-best-month-since-09-idUSKBN22B3HI,https://cdn.snapi.dev/images/v1/o/1/105638005-1545256725122gettyimages-1084667734.jpg,Global equities dip at end of best month since '09,"World equity benchmarks dipped on Thursday to close their best month in 11 years as a rebound in oil prices, encouraging early results from a COVID-19 treatment trial and expectations of more government stimulus helped ease the pain of February and March.",Reuters,"Thu, 30 Apr 2020 16:14:06 -0400",,Negative,Article
https://www.marketwatch.com/story/dow-books-nearly-300-point-loss-as-stocks-hold-onto-double-digit-gains-in-april-2020-04-30,https://cdn.snapi.dev/images/v1/d/h/dpek2fff-1.jpg,"Dow books nearly 300 point loss, as stocks hold onto double-digit gains in April","U.S. stocks fell modestly on Thursday, but left their double-digit percentage gains for this month intact, after a round of mixed corporate earnings and a report that the federal government was considering retaliating against China for its handling of the coronavirus.",Market Watch,"Thu, 30 Apr 2020 16:08:45 -0400",,Negative,Article
https://www.reuters.com/article/us-usa-stocks/wall-st-falls-but-sp-posts-biggest-monthly-gain-in-decades-idUSKBN22C202,https://cdn.snapi.dev/images/v1/k/a/may-markets-not-your-usual-spring-as-crisis-continues-with-dismal-data-seen-ahead.jpg,Wall St falls but S&P posts biggest monthly gain in decades,"U.S. stocks lost ground on Thursday as grim economic data and mixed earnings prompted investors to take profits at the close of the S&P 500's best month in decades, a remarkable run driven by expectations the economy will soon start recovering from restrictions enacted to curb the coronavirus pandemic.",Reuters,"Thu, 30 Apr 2020 16:04:41 -0400",,Positive,Article
https://www.kiplinger.com/slideshow/investing/T031-S001-sell-in-may-and-go-away-should-you-in-2020/index.html,https://cdn.snapi.dev/images/v1/i/n/intro-3.jpg,Sell in May and Go Away: Should You in 2020?,"The seasonal suggestion to ""sell in May and go away,"" an adage spurred by the market's superior performance during certain months of the year, is backed by the numbers more often than not.",Kiplinger,"Thu, 30 Apr 2020 16:02:13 -0400",,Neutral,Article
https://www.youtube.com/watch?v=veKGPEuczLg,https://cdn.snapi.dev/images/v1/n/w/jobless-claims-just-topped-30-million-over-the-past-six-weeksheres-what-it-means-for-the-economy.jpg,Jobless claims just topped 30 million over the past six weeks—Here's what it means for the economy,First-time filings for unemployment insurance hit 3.84 million last week as the wave of economic pain caused by the coronavirus pandemic continues.,CNBC Television,"Thu, 30 Apr 2020 15:53:43 -0400",,Negative,Video
https://www.gurufocus.com/news/1121878/wall-street-declines-on-thursday,https://cdn.snapi.dev/images/v1/a/a/business-1730089-1920-1-12.jpg,Wall Street Declines on Thursday (April 30),U.S. stocks were in the red on Thursday with utilities and materials leading declines in the indexes.,GuruFocus,"Thu, 30 Apr 2020 15:29:28 -0400",,Negative,Article
https://www.youtube.com/watch?v=RC6ioNuFpvA,https://cdn.snapi.dev/images/v1/q/2/the-stock-market-often-doesnt-know-more-about-the-economic-future-than-anybody-else-expert-warns.jpg,The stock market often doesn't know more about the economic future than anybody else: Expert warns,"Jeff Mills, Bryn Mawr Trust CIO, and Richard Bernstein, Richard Bernstein Advisors CEO and CIO, join 'Power Lunch' to discuss the state of the markets and what they are advising their clients.",CNBC Television,"Thu, 30 Apr 2020 15:16:51 -0400",,Negative,Video
https://www.youtube.com/watch?v=Z9Q2yiSI-ys,https://cdn.snapi.dev/images/v1/b/f/expect-mixed-bag-of-earnings-from-media-entertainment-companies-says-amobi.jpg,"Expect Mixed Bag of Earnings From Media, Entertainment Companies, Says Amobi","Tuna Amobi, consumer cyclicals analyst at CFRA, discusses the headwinds facing media and entertainment companies.",Bloomberg Technology,"Thu, 30 Apr 2020 15:13:58 -0400",earnings,Neutral,Video
https://www.marketwatch.com/story/us-oil-futures-climb-for-the-session-fall-for-the-month-2020-04-30,https://cdn.snapi.dev/images/v1/g/q/sdfr3222-1.jpg,"U.S. oil futures climb for the session, fall for the month","U.S. benchmark oil futures rose about 25% on Thursday, paring the monthly loss, based on the front-month contracts, to 8%, according to Dow Jones Market Data.",Market Watch,"Thu, 30 Apr 2020 14:55:55 -0400",oil,Positive,Article
https://www.youtube.com/watch?v=9sL9_VPB_Ys,https://cdn.snapi.dev/images/v1/q/q/fed-plans-to-expand-scope-of-main-street-lending-facility.jpg,Fed plans to expand scope of Main Street lending facility,The Fed announced that it will be targeting companies that are too big to qualify for Paycheck Protection Program and too small to access capital markets.,Yahoo Finance,"Thu, 30 Apr 2020 14:32:18 -0400",,Positive,Video
https://www.forbes.com/sites/robisbitts2/2020/04/30/how-to-interpret-the-sp-500-rally/,https://cdn.snapi.dev/images/v1/s/t/stocks101-48.jpg,How To Interpret The S&P 500 Rally,"When 5 stocks make you ignore 495 others, that’s an issue.",Forbes,"Thu, 30 Apr 2020 14:30:32 -0400",,Positive,Article
https://www.reuters.com/article/us-usa-stocks/wall-st-slides-on-bleak-data-capping-a-banner-month-idUSKBN22C202,https://cdn.snapi.dev/images/v1/d/h/stocks23-41.jpg,"Wall St. slides on bleak data, capping a banner month",U.S. stocks fell on Thursday as grim economic data and mixed earnings prompted investors to take some profits at the close of Wall Street's best month in decades.,Reuters,"Thu, 30 Apr 2020 14:26:01 -0400",,Negative,Article
https://www.cnbc.com/2020/04/30/op-ed-the-market-comeback-seems-callous-but-investors-are-betting-on-a-bright-post-crisis-future.html,https://cdn.snapi.dev/images/v1/o/y/106508019-1588010324906gettyimages-1221317598.jpeg,"Op-ed: The market comeback seems callous, but investors are betting on a bright post-crisis future","Stocks have risen swiftly as investors look beyond the coronavirus pandemic, but millions of Americans continue to suffer unemployment and sickness.",CNBC,"Thu, 30 Apr 2020 14:01:20 -0400",,Positive,Article
https://www.forbes.com/sites/cherryreynard/2020/04/30/absolute-return-funds-delivering-in-a-downturn/,https://cdn.snapi.dev/images/v1/a/b/absolute-return-funds-delivering-in-a-downturn.jpg,Absolute Return Funds: Delivering In A Downturn?,"Absolute return funds may not have delivered in the short-term, but it doesn't mean they don't have a role to play.",Forbes,"Thu, 30 Apr 2020 13:53:29 -0400",,Neutral,Article
https://www.youtube.com/watch?v=wA5cbEdYkpw,https://cdn.snapi.dev/images/v1/m/q/could-be-six-months-to-a-year-until-people-are-flying-again-marc-lasry.jpg,Could be six months to a year until people are flying again: Marc Lasry,"CNBC's ""Halftime Report"" team breaks down investment strategies and the outlook for the U.S. economy with Marc Lasry of Avenue Capital.",CNBC Television,"Thu, 30 Apr 2020 13:45:45 -0400",,Negative,Video
https://www.geekwire.com/2020/washington-state-unemployment-claims-jump-75-startups-brace-slowdown/,https://cdn.snapi.dev/images/v1/j/u/48894188808-f72c60079d-k-768x576.jpg,Washington state unemployment claims jump 75% as startups brace for slowdown,"Washington state jobless claims surged last week as federally backed, expanded unemployment benefits became available for the first time.",GeekWire,"Thu, 30 Apr 2020 13:23:42 -0400",,Negative,Article
https://www.gurufocus.com/news/1121492/warren-buffetts-tips-on-analyzing-stocks,https://cdn.snapi.dev/images/v1/5/l/191115080924-01-warren-buffett-super-169.jpg,Warren Buffett’s Tips on Analyzing Stocks,"The stock market may have rebounded after its market crash, but there are still a large number of companies trading at relatively attractive valuations, in my opinion.",GuruFocus,"Thu, 30 Apr 2020 13:14:26 -0400",wbuffett,Neutral,Article
https://www.youtube.com/watch?v=vNOrYtXnOuM,https://cdn.snapi.dev/images/v1/4/t/fed-to-expand-main-street-loan-facility.jpg,Fed to expand ‘Main Street’ loan facility,"The Federal Reserve is making changes to its Main Street lending facility, which can help businesses hit by the coronavirus.",Fox Business,"Thu, 30 Apr 2020 13:11:58 -0400",,Positive,Video
https://www.forbes.com/sites/carlieporterfield/2020/04/30/us-consumer-spending-sees-sharpest-monthly-drop-ever-recorded/,https://cdn.snapi.dev/images/v1/a/l/us-consumer-spending-sees-sharpest-monthly-drop-ever-recorded.jpg,U.S. Consumer Spending Sees Sharpest Monthly Drop Ever Recorded,"In March, consumer spending dropped by nearly 8%.",Forbes,"Thu, 30 Apr 2020 13:06:14 -0400",,Negative,Article
https://www.youtube.com/watch?v=4KcB4uoX7pw,https://cdn.snapi.dev/images/v1/m/q/trichet-financing-recovery-program-must-be-done-as-soon-as-possible.jpg,Trichet: Financing recovery program must be done as soon as possible,Honorary Banque de France Governor and Former ECB President Jean-Claude Trichet and CNBC's Rick Santelli discuss global economic contraction and the importance of the European government to enact a recovery program.,CNBC Television,"Thu, 30 Apr 2020 13:03:09 -0400",,Neutral,Video
