news_url,image_url,title,text,source_name,date,topics,sentiment,type
https://www.reuters.com/article/us-global-oil/oil-rises-after-u-s-crude-stocks-drop-focus-on-opec-meeting-idUSKCN24G02G,https://cdn.snapi.dev/images/v1/s/p/m02d20200715t2i1525743526w940fhfwllplsqrlynxnpeg6e01g.jpg,"Oil rises after U.S. crude stocks drop, focus on OPEC+ meeting","Oil prices rose on Wednesday after a sharp drop in U.S. crude inventories, with the market waiting for more direction from a meeting later in the day on the future level of production by OPEC and its allies.",Reuters,"Tue, 14 Jul 2020 20:54:00 -0400",oil,Positive,Article
https://www.youtube.com/watch?v=27cjUaHCpy8,https://cdn.snapi.dev/images/v1/l/r/wall-street-did-something-highly-unusual-in-tuesdays-session-jim-cramer-says.jpg,"Wall Street did something 'highly unusual' in Tuesday's session, Jim Cramer says","""This market is divided into four camps,"" the ""Mad Money"" host said.",CNBC Television,"Tue, 14 Jul 2020 19:43:57 -0400","cramer,madmoney",Neutral,Video
https://www.youtube.com/watch?v=AAC33EiPraE,https://cdn.snapi.dev/images/v1/3/g/jim-cramer-wall-street-is-divided-into-four-camps.jpg,Jim Cramer: Wall Street is divided into four camps,"Tuesday's market action was highly unusual, the ""Mad Money"" host said.",CNBC Television,"Tue, 14 Jul 2020 19:15:44 -0400","cramer,madmoney",Neutral,Video
https://www.youtube.com/watch?v=OpWEY7nnvAM,https://cdn.snapi.dev/images/v1/w/c/jim-cramer-legendary-trader-larry-williams-sees-the-sp-500-peaking-near-july-27.jpg,Jim Cramer: Legendary trader Larry Williams sees the S&P 500 peaking near July 27,"The S&P 500 could rally near its old highs in coming weeks, but the charts suggest that those levels will be ephemeral, Jim Cramer said on ""Mad Money.",CNBC Television,"Tue, 14 Jul 2020 19:10:01 -0400","cramer,madmoney",Neutral,Video
https://www.cnbc.com/2020/07/14/jim-cramer-charts-suggest-sp-500-climb-will-stall-out-in-late-july.html,https://cdn.snapi.dev/images/v1/n/b/105637843-1545252894012rtx6j8ks.jpg,"Charts suggest the S&P 500 climb will stall out at the end of July, Jim Cramer warns","The charts, as interpreted by the legendary Larry Williams, suggest the S&P 500 could climb another 5% in coming weeks before equities begin to retreat, the ""Mad Money"" host said.",CNBC,"Tue, 14 Jul 2020 19:02:43 -0400","tanalysis,cramer",Negative,Article
https://www.cnbc.com/2020/07/14/coronavirus-vaccine-is-closer-than-the-market-thinks-jeremy-siegel.html,https://cdn.snapi.dev/images/v1/r/l/103747594-img-4258.jpg,"Coronavirus vaccine is closer than the market thinks, Wharton's Jeremy Siegel predicts","Wharton finance professor Jeremy Siegel expects a game changer to surprise a ""pretty resilient"" market.",CNBC,"Tue, 14 Jul 2020 18:29:58 -0400",,Positive,Article
https://www.youtube.com/watch?v=KCKa3ngln20,https://cdn.snapi.dev/images/v1/m/q/summer-correction-underway-despite-todays-bounce-mss-mike-wilson.jpg,Summer correction underway despite today's bounce: MS's Mike Wilson,"Morgan Stanley Chief U.S. Equity Strategist Mike Wilson says a healthy correction is hitting stocks. With CNBC's Melissa Lee and the Fast Money traders, Guy Adami, Dan Nathan, Carter Worth and Bonawyn Eisen.",CNBC Television,"Tue, 14 Jul 2020 18:06:35 -0400",,Negative,Video
https://www.fool.com/investing/2020/07/14/sp-500-roars-back-oil-stocks-up-bank-stocks-down-w.aspx,https://cdn.snapi.dev/images/v1/t/z/heres-why-you-need-to-hedge-your-stock-investments.jpg,"S&P 500 Roars Back: Oil Stocks Up, Bank Stocks Down, Will COVID-19 Shutdowns End the Rally?","Bank earnings to the downside, oil stocks moving up, but COVID-19 is in the background, threatening the economy and the market rally.",The Motley Fool,"Tue, 14 Jul 2020 17:58:42 -0400",oil,Positive,Article
https://www.youtube.com/watch?v=MHzY1Y_CGhw,https://cdn.snapi.dev/images/v1/n/v/big-risks-to-a-strong-economic-recovery.jpg,Big risks to a strong economic recovery,Global Chief Investment Strategist at Conning Rich Sega joins Yahoo Finance’s Kristin Myers to discuss earnings season and what to expect.,Yahoo Finance,"Tue, 14 Jul 2020 17:30:53 -0400",,Neutral,Video
https://www.gurufocus.com/news/1185658/us-indexes-close-higher-after-bank-earnings,https://cdn.snapi.dev/images/v1/c/6/106007058-1562599908150bull.jpg,US Indexes Close Higher After Bank Earnings,"The Dow Jones Industrial Average closed at 26,642.59 on Tuesday with a gain of 556.79 points or 2.13%.",GuruFocus,"Tue, 14 Jul 2020 17:21:49 -0400",earnings,Positive,Article
https://www.cnn.com/2020/07/14/business/dow-stock-market-today/index.html,https://cdn.snapi.dev/images/v1/v/p/200707162414-wall-street-0630-super-169.jpg,Stocks surge even as banks signal a choppy recovery ahead,US stocks finished sharply higher Tuesday even as America's leading banks warned the economic recovery from the pandemic will be choppy.,CNN Business,"Tue, 14 Jul 2020 17:21:07 -0400",,Positive,Article
https://www.youtube.com/watch?v=sb70kB_TYIA,https://cdn.snapi.dev/images/v1/p/5/fmr-asian-policy-analyst-says-us-china-relationship-now-long-term-competition.jpg,Fmr. Asian policy analyst says U.S.-China relationship now long-term competition,"Dewardric McNeal, Longview Global managing director and former Asian policy analyst at the Department of Defense, joins ""Closing Bell"" to talk about the U.S. and China relationship.",CNBC Television,"Tue, 14 Jul 2020 17:05:12 -0400",,Neutral,Video
https://www.cnbc.com/2020/07/14/feds-kaplan-says-the-us-economy-will-see-above-trend-growth-in-2021.html,https://cdn.snapi.dev/images/v1/v/a/105046951-487a7632.jpg,Fed's Kaplan says the U.S. economy will see above-trend growth in 2021,Dallas Federal Reserve President Robert Kaplan said the U.S. economic growth will accelerate next year as the country rebounds from the coronavirus crisis.,CNBC,"Tue, 14 Jul 2020 17:03:57 -0400",,Positive,Article
https://www.youtube.com/watch?v=9WG0AJVRNBE,https://cdn.snapi.dev/images/v1/b/b/cash-is-king-when-breaking-down-earnings-liquidity-disclosures-and-company-earnings-analyst.jpg,"'Cash is king,' when breaking down earnings, liquidity disclosures, and company earnings: Analyst","Wes Bricker, PwC US & Mexico Assurance Leader and Vice Chair joins the Yahoo Finance On the Move panel to discuss how to break down earnings this year.",Yahoo Finance,"Tue, 14 Jul 2020 17:03:12 -0400",earnings,Neutral,Video
https://www.youtube.com/watch?v=0MmuQ-4vB_M,https://cdn.snapi.dev/images/v1/9/k/dallas-fed-president-robert-kaplan-says-mandatory-masks-will-improve-economic-outlook.jpg,Dallas Fed President Robert Kaplan says mandatory masks will improve economic outlook,"Robert Kaplan, Dallas Fed President, joins ""Closing Bell"" to talk about his conversation with epidemiologists on how mandatory masks could improve the recovery of the economy.",CNBC Television,"Tue, 14 Jul 2020 16:47:42 -0400",,Neutral,Video
https://www.reuters.com/article/us-usa-fed-kaplan/feds-kaplan-says-there-is-lots-of-overcapacity-in-u-s-economy-cnbc-idUSKCN24F2RK,https://cdn.snapi.dev/images/v1/c/v/m02d20200714t2i1525722393w940fhfwllplsqrlynxnpeg6d1ml.jpg,Fed's Kaplan says there is 'lots of overcapacity' in U.S. economy: CNBC,"Dallas Federal Reserve Bank President Robert Kaplan said on Tuesday there is ""lots of overcapacity in the economy,"" which he described as ""disinflationary.""",Reuters,"Tue, 14 Jul 2020 16:45:00 -0400",,Neutral,Article
https://www.marketwatch.com/story/api-data-show-a-more-than-8-million-barrel-drop-in-us-crude-supplies-sources-say-2020-07-14,https://cdn.snapi.dev/images/v1/o/i/oil33-12.jpg,"API data show a more than 8 million-barrel drop in U.S. crude supplies, sources say","The American Petroleum Institute reported late Tuesday that U.S. crude supplies fell by 8.3 million barrels for the week ended July 10, according to sources.",Market Watch,"Tue, 14 Jul 2020 16:42:33 -0400",oil,Neutral,Article
https://investorplace.com/2020/07/this-strategy-beat-the-market-in-the-first-half-of-2020/,https://cdn.snapi.dev/images/v1/s/t/stocks1-76.jpg,This Strategy Beat the Market in the First Half of 2020,"Matt McCall shares his bullish market outlook along with a strategy that will allow you to keep making outsized gains no matter what the market throws your way.
The post This Strategy Beat the Market in the First Half of 2020 appeared first on InvestorPlace.",InvestorPlace,"Tue, 14 Jul 2020 16:33:37 -0400",,Positive,Article
https://www.kiplinger.com/investing/stocks/601059/stock-market-today-071420-momentum-dow-jones,https://cdn.snapi.dev/images/v1/s/t/stocks101-71.jpg,Stock Market Today: Momentum Swings the Dow's Way,Many of the Dow Jones' economically sensitive components pushed higher on Tuesday on the back of slightly better COVID-19 data from a few U.S. hotspots.,Kiplinger,"Tue, 14 Jul 2020 16:27:55 -0400",,Positive,Article
https://www.marketwatch.com/story/feds-bullard-says-stock-markets-optimism-has-been-proven-right-at-least-for-now-2020-07-14,https://cdn.snapi.dev/images/v1/e/l/vcfdew33nas-4.jpg,"Fed's Bullard says stock market's optimism has been proven right, at least for now","U.S. investors, who been running up equity market values.",Market Watch,"Tue, 14 Jul 2020 16:25:17 -0400",,Positive,Article
https://www.marketwatch.com/story/guid/c0edd842-3e79-4421-a27b-5d8b5d6f55e9,https://cdn.snapi.dev/images/v1/e/c/m02d20191121t2i1455018522rlynxmpefak11uw640.jpg,Dow books 557-point gain as Fed's Bullard says unemployment could fall rapidly 'if we play our cards right',"U.S. stocks finished sharply higher Tuesday, and the Dow industrials notched a third straight gain, powered by a rally in energy and materials shares, a day after technology stocks staged a stunning reversal.",Market Watch,"Tue, 14 Jul 2020 16:17:58 -0400",,Positive,Article
https://www.youtube.com/watch?v=zUqF4WGMQM4,https://cdn.snapi.dev/images/v1/1/d/barbara-doran-markets-up-because-fed-has-filled-system-with-liquidity.jpg,Barbara Doran: Markets up because Fed has filled system with liquidity,"Barbara Doran, BD8 Capital Partners, and David Ellison, Hennessy Funds portfolio manager join ""Closing Bell"" to talk about the broader markets.",CNBC Television,"Tue, 14 Jul 2020 16:17:46 -0400",,Positive,Video
https://www.marketwatch.com/story/dow-books-over-550-point-gain-as-feds-bullard-says-unemployment-could-fall-rapidly-if-we-play-our-cards-right-2020-07-14,https://cdn.snapi.dev/images/v1/b/l/106551960-1590499260160gettyimages-1227099154.jpeg,Dow books over 550-point gain as Fed's Bullard says unemployment could fall rapidly 'if we play our cards right',"U.S. stocks finished sharply higher Tuesday, and the Dow industrials notched a third straight gain, powered by a rally in energy and materials shares, a day after technology stocks staged a stunning reversal.",Market Watch,"Tue, 14 Jul 2020 16:14:09 -0400",,Positive,Article
https://www.forbes.com/sites/jjkinahan/2020/07/14/technology-sector-earnings-q2-and-the-rise-of-tech-sub-industries/,https://cdn.snapi.dev/images/v1/s/t/stocks161-63.jpg,Technology Sector Earnings: Q2 And The Rise Of Tech Sub-Industries,"As tech companies begin reporting Q2 earnings, the current market environment might best be summed up by that Dickens line about being the best of times and the worst of times.",Forbes,"Tue, 14 Jul 2020 16:09:41 -0400",earnings,Neutral,Article
https://www.youtube.com/watch?v=siFahx7LKsk,https://cdn.snapi.dev/images/v1/v/f/vfre322.jpg,How coronavirus could impact the global economy as countries try to rebuild,Nomura Chief U.S. Economist Lewis Alexander joins Yahoo Finance’s Zack Guzman to discuss Nomura's latest report on how the coronavirus may alter the global landscape.,Yahoo Finance,"Tue, 14 Jul 2020 16:07:50 -0400",,Negative,Video
https://www.forbes.com/sites/sergeiklebnikov/2020/07/14/dow-rallies-over-500-points-as-jpmorgan-wells-fargo-jumpstart-earnings-season/,https://cdn.snapi.dev/images/v1/i/z/dow-rallies-over-500-points-as-jpmorgan-wells-fargo-jumpstart-earnings-season.jpg,"Dow Rallies Over 500 Points As JPMorgan, Wells Fargo Jumpstart Earnings Season",The market is bracing for its worst earnings season in 12 years.,Forbes,"Tue, 14 Jul 2020 16:01:51 -0400",,Positive,Article
https://www.forbes.com/sites/oliverrenick/2020/07/14/did-the-nasdaq-just-peak-heres-a-better-question-for-investors/,https://cdn.snapi.dev/images/v1/l/m/did-the-nasdaq-just-peak-heres-a-better-question-for-investors.jpg,Did The Nasdaq Just Peak? Here’s A Better Question For Investors,"A common phrase among market pundits is that “nobody rings a bell at the top.” I.e., it’s never obvious when a great run in the market is over.",Forbes,"Tue, 14 Jul 2020 15:56:12 -0400",,Neutral,Article
https://www.reuters.com/article/us-usa-fed-harker/feds-harker-says-u-s-economic-downturn-is-painful-and-stubbornly-long-lasting-idUSKCN24F2MV,https://cdn.snapi.dev/images/v1/v/q/m02d20200714t2i1525715824w940fhfwllplsqrlynxnpeg6d1js.jpg,Fed's Harker says U.S. economic downturn is painful and 'stubbornly long-lasting',"Months after the coronavirus arrived in the United States, the economy remains ""mired"" in crisis and policymakers need to create solutions that offer better support to struggling small businesses, Philadelphia Federal Reserve Bank President Patrick Harker said on Tuesday.",Reuters,"Tue, 14 Jul 2020 15:34:00 -0400",,Negative,Article
https://www.reuters.com/article/us-health-coronavirus-stock-options-anal/virus-worries-and-fomo-drive-options-bets-on-surging-tech-giants-idUSKCN24F2LN,https://cdn.snapi.dev/images/v1/m/0/m02d20200714t2i1525714273w940fhfwllplsqrlynxnpeg6d1j2.jpg,Virus worries and FOMO drive options bets on surging tech giants,"Options investors are ramping up bets on some of this year's biggest winners, including Amazon.com Inc , Netflix Inc and Tesla Inc, even as they turn cautious on the wider market amid a resurgent U.S. coronavirus outbreak.",Reuters,"Tue, 14 Jul 2020 15:17:00 -0400",,Positive,Article
https://www.youtube.com/watch?v=Zxp4lhQcMH8,https://cdn.snapi.dev/images/v1/o/k/okfcdw1.jpg,Consumer Price Index Rebounds 0.6% in June,Yahoo Finance’s Brian Cheung joins Zack Guzman to discuss how U.S. consumer prices rebounded last month despite coronavirus restrictions.,Yahoo Finance,"Tue, 14 Jul 2020 15:05:21 -0400",,Positive,Video
https://www.reuters.com/article/us-usa-stocks/dow-jumps-1-6-leads-wall-street-higher-idUSKCN24F15N,https://cdn.snapi.dev/images/v1/d/o/dowjones-9.jpg,"Dow jumps 1.6%, leads Wall Street higher","Wall Street rose on Tuesday, led by energy and materials, as investors looked beyond a recent surge in coronavirus cases and rotated out Amazon and other recent strong performers.",Reuters,"Tue, 14 Jul 2020 14:52:00 -0400",,Positive,Article
https://www.youtube.com/watch?v=36aPqaA2hjQ,https://cdn.snapi.dev/images/v1/d/y/earnings-potential-is-still-high-for-tech-zoe-financial-ceo.jpg,Earnings potential is still high for tech: Zoe Financial CEO,"Andres Garcia-Amaya, Zoe Financial founder and CEO, and Tom Lydon, ETF Trends CEO, join 'Power Lunch' to discuss how they see the us economy unfolding and how it impacts the equity market.",CNBC Television,"Tue, 14 Jul 2020 14:44:32 -0400",earnings,Neutral,Video
https://www.marketwatch.com/story/oil-futures-finish-slightly-higher-as-traders-await-outcome-of-opec-committee-meeting-2020-07-14,https://cdn.snapi.dev/images/v1/9/z/106551736-1590491115191gettyimages-1215156232.jpeg,"Oil futures finish slightly higher, as traders await outcome of OPEC+ committee meeting","Oil futures finished slightly higher on Tuesday, with traders awaiting outcome of Wednesday's OPEC+ Joint Ministerial Monitoring Committee meeting as well as this week's updates on U.S.",Market Watch,"Tue, 14 Jul 2020 14:42:13 -0400",oil,Positive,Article
https://www.marketwatch.com/story/dow-rises-430-points-as-brainard-urges-fed-to-shift-to-stimulus-as-thick-fog-of-uncertainty-surrounds-coronavirus-battered-economy-2020-07-14,https://cdn.snapi.dev/images/v1/o/g/etf31.jpg,Dow rises 430 points as Brainard urges Fed to shift to stimulus as 'thick fog of uncertainty' surrounds coronavirus-battered economy,"U.S. stock benchmarks added to gains Tuesday afternoon after Federal Reserve Gov. Lael Brainard painted a grim outlook for the economy facing the COVID-19 pandemic, but said she advocated for policy that would stimulate the virus-beaten business sector.",Market Watch,"Tue, 14 Jul 2020 14:22:50 -0400",,Positive,Article
https://www.youtube.com/watch?v=HRfWkdfqmrs,https://cdn.snapi.dev/images/v1/a/w/feds-brainard-thick-fog-of-uncertainty-surrounds-us.jpg,Fed's Brainard: Thick fog of uncertainty surrounds us,CNBC's Steve Liesman reports on the latest comments from Federal Reserve Governor Lael Brainard.,CNBC Television,"Tue, 14 Jul 2020 14:16:05 -0400",,Negative,Video
https://www.reuters.com/article/us-usa-fed-brainard/thick-fog-over-u-s-economy-and-fed-will-need-to-provide-sustained-accommodation-brainard-idUSKCN24F2HQ,https://cdn.snapi.dev/images/v1/l/z/m02d20200714t2i1525707424w940fhfwllplsqrlynxnpeg6d1fz.jpg,"""Thick fog"" over U.S. economy and Fed will need to provide sustained accommodation: Brainard","There is a great deal of uncertainty about the path ahead for the U.S. economy and the Federal Reserve should use forward guidance and large-scale asset purchases for a ""sustained"" period in order to help the recovery, Fed Governor Lael Brainard said on Tuesday, as she offered a downbeat assessment of the risks ahead.",Reuters,"Tue, 14 Jul 2020 14:06:00 -0400",,Negative,Article
https://www.reuters.com/article/us-europe-stocks-results/wanted-signs-of-v-shaped-recovery-in-earnings-reports-idUSKCN24F2GA,https://cdn.snapi.dev/images/v1/a/w/awq1qwsed-4.jpg,Wanted: signs of V-shaped recovery in earnings reports,"Equity investors are no longer losing sleep over the short-term hit to company earnings from coronavirus lockdowns, instead they are looking for early evidence to support the V-shaped recovery narrative that has lifted stocks out of their mid-March crash.",Reuters,"Tue, 14 Jul 2020 13:55:00 -0400",earnings,Positive,Article
https://www.marketwatch.com/story/gold-futures-settle-with-a-modest-loss-2020-07-14,https://cdn.snapi.dev/images/v1/g/o/gold23-16.jpg,Gold futures settle with a modest loss,"Gold futures posted a modest loss on Tuesday, holding ground above the key $1,800 an ounce mark.",Market Watch,"Tue, 14 Jul 2020 13:50:55 -0400",gold,Negative,Article
https://www.youtube.com/watch?v=Uf8w0eKT5QE,https://cdn.snapi.dev/images/v1/m/a/if-schools-dont-reopen-in-the-fall-itll-be-an-economic-disaster-josh-brown.jpg,"If schools don't reopen in the fall, it'll be an economic disaster: Josh Brown","CNBC's ""Halftime Report"" team discusses their investment strategies and economic outlook.",CNBC Television,"Tue, 14 Jul 2020 12:42:58 -0400",,Negative,Video
https://www.marketwatch.com/story/charting-a-bull-trend-whipsaw-sp-500-nails-next-resistance-2020-07-14-12103350,https://cdn.snapi.dev/images/v1/2/h/m02d20191121t2i1455018522rlynxmpefak11uw640.jpg,"The Technical Indicator: Charting a bull-trend whipsaw, S&P 500 nails next resistance","Technically speaking, the U.S. benchmarks have registered a mid-July market whipsaw, pressured at least briefly amid the month’s first real selling pressure.",Market Watch,"Tue, 14 Jul 2020 12:35:00 -0400",tanalysis,Neutral,Article
https://www.seeitmarket.com/the-stock-market-vs-the-economy-two-very-different-tales/,https://cdn.snapi.dev/images/v1/d/c/m02d20191126t2i1457020850rlynxmpefap1esw640.jpg,The Stock Market vs The Economy: Two Very Different Tales,"One of the most recurring questions of late has been how the stock market can be within a stone’s throw of previous highs in the midst of a deep global recession triggered by a pandemic. Measuring from January 1, 2020, the S&P 500 Index and TSX Composite are down only 1% and 8%, respectively.",See It Market,"Tue, 14 Jul 2020 12:30:15 -0400",,Neutral,Article
https://www.reuters.com/article/us-global-markets/stocks-rebound-on-cyclical-surge-gold-edges-higher-idUSKCN24E32S,https://cdn.snapi.dev/images/v1/e/d/edfe3e555-9.jpg,"Stocks rebound on cyclical surge, gold edges higher","Global equity markets wavered and gold prices rose on Tuesday after a rollback of California's reopening hit sentiment, but cyclical stocks surged on Wall Street as some investors bet a recovery would overcome the COVID-19 pandemic's spread.",Reuters,"Tue, 14 Jul 2020 12:19:00 -0400",gold,Positive,Article
https://www.youtube.com/watch?v=ba8udLPkTSg,https://cdn.snapi.dev/images/v1/o/a/could-we-see-inflation-come-back-take-a-look-at-the-metals-market.jpg,Could we see inflation come back? Take a look at the metals market.,"What will prove the market right or wrong is inflation increasing, and that’s already starting to happen.",Bloomberg Markets and Finance,"Tue, 14 Jul 2020 12:10:41 -0400",,Negative,Video
https://www.reuters.com/article/us-usa-stocks/sp-500-dow-rise-after-mixed-bank-earnings-tech-heavy-nasdaq-falls-idUSKCN24F15N,https://cdn.snapi.dev/images/v1/s/t/stocks8-87.jpg,"S&P 500, Dow rise after mixed bank earnings; tech-heavy Nasdaq falls",The S&P 500 and Dow indexes edged higher in volatile trading on Tuesday as investors digested a mixed bag of quarterly earnings reports from U.S. lenders but technology stocks fell on worries over new business restrictions in California.,Reuters,"Tue, 14 Jul 2020 11:57:00 -0400",earnings,Neutral,Article
https://seekingalpha.com/article/4358402-parsing-treasury-markets-mixed-messages?utm_source=feed_articles_market_outlook_todays_market&utm_medium=referral,https://cdn.snapi.dev/images/v1/f/e/fedfed1-3.jpg,Parsing The Treasury Market's Mixed Messages,Once upon a time the bond market could be counted on for sober analysis and clear thinking in the critical work of providing reliable economic indicators based on the so-called wisdom of the crowd.,Seeking Alpha,"Tue, 14 Jul 2020 11:55:00 -0400",,Neutral,Article
https://www.reuters.com/article/us-usa-stocks-tech/crowded-trade-high-valuations-why-investors-worry-about-tech-stocks-idUSKCN24F25B,https://cdn.snapi.dev/images/v1/e/t/etf16-104.jpg,"Crowded trade, high valuations: why investors worry about tech stocks",Some investors are getting increasingly worried about the outlook for technology and big growth stocks after a massive rally which has pushed the Nasdaq Composite index to record highs despite the coronavirus-inflicted economic damage.,Reuters,"Tue, 14 Jul 2020 11:48:00 -0400",,Negative,Article
https://seekingalpha.com/article/4358400-technically-speaking-golden-cross-arrives-are-bulls-safe?utm_source=feed_articles_market_outlook_todays_market&utm_medium=referral,https://cdn.snapi.dev/images/v1/s/t/stocks18-61.jpg,"Technically Speaking: 'Golden Cross' Arrives, Are The Bulls Safe?","In this week's ""Technically Speaking,"" the ""Golden Cross"" arrives, but are the bulls safe?",Seeking Alpha,"Tue, 14 Jul 2020 11:47:24 -0400",tanalysis,Neutral,Article
https://www.youtube.com/watch?v=PanmdFyQtRQ,https://cdn.snapi.dev/images/v1/7/x/bank-earnings-dont-bode-well-for-estimates-going-forward-says-raymond-james-analyst.jpg,"Bank earnings don't bode well for estimates going forward, says Raymond James analyst","David Konrad of D.A. Davidson and David Long of Raymond James join ""Squawk on the Street"" to discuss the latest bank earnings.",CNBC Television,"Tue, 14 Jul 2020 11:33:52 -0400",earnings,Negative,Video
https://www.youtube.com/watch?v=qCQsYL5gx8Y,https://cdn.snapi.dev/images/v1/6/v/jim-cramer-explains-what-drove-mondays-market-reversal.jpg,Jim Cramer explains what drove Monday's market reversal,"CNBC's Jim Cramer and the ""Squawk on the Street"" crew discuss Monday's market reversals after Big Tech stocks gave up their gains.",CNBC Television,"Tue, 14 Jul 2020 11:31:59 -0400",cramer,Neutral,Video
https://www.seeitmarket.com/stock-market-today-bulls-let-off-the-gas-pedal/,https://cdn.snapi.dev/images/v1/p/h/191121101804-nyse-1113-powell-super-169.jpg,Stock Market Today: Bulls Let Off The Gas Pedal,"A relentless rally lifted the Nasdaq 100 over 11,000 briefly on Monday before reversing course and selling off. Tech has been the market leader, so watching how this plays out will be key.",See It Market,"Tue, 14 Jul 2020 11:20:17 -0400",,Negative,Video
