news_url,image_url,title,text,source_name,date,topics,sentiment,type
https://www.cnbc.com/2019/05/16/sofi-ceo-reveals-millennial-stock-investing-habits-on-the-fintech-app.html,https://cdn.snapi.dev/images/v1/1/0-2/105600498-1543526834820img-4664.jpg,SoFi CEO reveals what he learned about millennial stock investing habits,"Early investors are showing ""that they don't want to put a lot of money at risk,"" SoFi CEO Anthony Soto says.",CNBC,"Thu, 16 May 2019 18:41:00 -0400",CEO,Positive,Article
https://www.youtube.com/watch?v=8CyQgH04Hts,https://cdn.snapi.dev/images/v1/m/q-4/austrian-mcdonalds-now-offer-us-passport-help.jpg,Austrian McDonalds now offer U.S. passport help,The U.S. embassy Vienna announced via Facebook that American citizens in Austria who find they have no way to contact the U.S.,Yahoo Finance,"Thu, 16 May 2019 18:35:14 -0400",,Positive,Video
https://www.youtube.com/watch?v=c8N3ioaztAE,https://cdn.snapi.dev/images/v1/t/w/one-of-starbucks-biggest-rivals-in-china-is-going-public-and-heres-what-it-means-for-the-stocks.jpg,One of Starbucks' biggest rivals in China is going public and here's what it means for the stocks,CNBC's Leslie Picker on Luckin's IPO pricing.,CNBC Television,"Thu, 16 May 2019 18:32:41 -0400",,Positive,Video
https://www.youtube.com/watch?v=JIgo_nID6Fc,https://cdn.snapi.dev/images/v1/m/q-4/13-f-roundup-where-money-was-moving-in-first-quarter.jpg,13-F Roundup: Where Money Was Moving in First Quarter,May.16 -- Bloomberg's Hema Parmar examines the latest 13-F releases to track the holdings of money managers.,Bloomberg Markets and Finance,"Thu, 16 May 2019 17:51:58 -0400",earnings,Neutral,Video
https://www.youtube.com/watch?v=IsoR2ajeTyU,https://cdn.snapi.dev/images/v1/m/q-4/nasdaq-reclaims-50-day-line-in-bullish-fashion.jpg,Nasdaq Reclaims 50-Day Line In Bullish Fashion,Another big percentage gain for the Nasdaq Thursday sent the bears running for cover again.,Investors Business Daily,"Thu, 16 May 2019 16:40:47 -0400",,Positive,Video
https://www.youtube.com/watch?v=JsqdUT4Zutw,https://cdn.snapi.dev/images/v1/m/q-4/consumer-discretionary-could-suffer-amid-trade-tensions-says-pro.jpg,"Consumer discretionary could suffer amid trade tensions, says pro","Mark Otto, GTS designated market maker, joins CNBC's ""Closing Bell"" to discuss the markets heading into the close.",CNBC Television,"Thu, 16 May 2019 16:26:41 -0400",,Neutral,Video
https://www.cnbc.com/2019/05/16/starbucks-china-challenger-luckin-coffee-will-likely-price-ipo-at-high-end-of-range-or-above.html,https://cdn.snapi.dev/images/v1/a/z/105917145-1558012462530gettyimages-1077008218.jpeg,Starbucks' China challenger Luckin Coffee will likely price IPO at high end of range or above,Starbucks' China challenger Luckin Coffee is preparing for its public debut Friday on the Nasdaq.,CNBC,"Thu, 16 May 2019 16:18:00 -0400",,Positive,Article
https://www.youtube.com/watch?v=M5wMQWRIymM,https://cdn.snapi.dev/images/v1/m/q-4/president-trump-speaks-on-immigration-policy.jpg,President Trump speaks on immigration policy,CNBC's Eamon Javers reports on President Donald Trump's comments on his new immigration plan.,CNBC Television,"Thu, 16 May 2019 15:37:53 -0400",,Neutral,Video
https://www.youtube.com/watch?v=rXBY0UgbU1Q,https://cdn.snapi.dev/images/v1/m/q-4/president-trump-unveils-his-plan-for-immigration.jpg,President Trump unveils his plan for immigration,Yahoo Finance's Jessica Smith of Yahoo Finance reports on President Trump's latest plan for immigration reform.,Yahoo Finance,"Thu, 16 May 2019 15:33:57 -0400",,Positive,Video
https://www.youtube.com/watch?v=vSG0TfRKvW8,https://cdn.snapi.dev/images/v1/m/q-4/april-housing-starts-up-57-in-april-but-still-lag-behind-last-years-data.jpg,April housing starts up 5.7% in April but still lag behind last year's data,Yahoo Finance's Seana Smith discusses the rise in US  housing starts compared to last years data with Rogers Healy owner and CEO of The Rogers Healy Company.,Yahoo Finance,"Thu, 16 May 2019 15:23:16 -0400",,Neutral,Video
https://feedproxy.google.com/~r/Techcrunch/~3/wGHTcbStZlM/,https://cdn.snapi.dev/images/v1/l/7/l7itaigjjpegw600.jpg,"Fiverr files to go public, reports revenue of $75.5M and a net loss of $36.1M for 2018",Freelance marketplace Fiverr has filed to go public on the New York Stock Exchange.,TechCrunch,"Thu, 16 May 2019 15:14:54 -0400",,Positive,Article
https://www.youtube.com/watch?v=ZTvxZTK21n0,https://cdn.snapi.dev/images/v1/m/q-4/chance-of-trade-deal-15-says-eurasia-groups-sumpter.jpg,"Chance of trade deal 15%, says Eurasia Group's Sumpter","CNBC's ""Power Lunch"" team breaks down how the United States is approaching Huawei with Meredith Sumpter, head of research strategy and operations at the Eurasia Group.",CNBC Television,"Thu, 16 May 2019 15:07:57 -0400",,Neutral,Video
https://www.youtube.com/watch?v=dsBwj8kJZTc,https://cdn.snapi.dev/images/v1/m/q-4/how-one-company-turns-pollution-into-fuel.jpg,How one company turns pollution into fuel,"CNBC's Julia Boorstin reports from Lanzatech Lab, mission-driven disrupter companies on CNBC's Disrupter 50 list.",CNBC Television,"Thu, 16 May 2019 14:48:01 -0400",,Neutral,Video
https://www.youtube.com/watch?v=IRCZPG5FgQQ,https://cdn.snapi.dev/images/v1/x/k/this-isnt-a-trade-war-its-an-escalation-ubs-alli-mccartney.jpg,"This isn't a trade war, it's an escalation: UBS' Alli McCartney","David Kelly, chief market strategist with J.P.",CNBC Television,"Thu, 16 May 2019 14:35:36 -0400",,Neutral,Video
https://www.cnbc.com/2019/05/16/rent-the-runway-ceo-jennifer-hyman-on-profitability-and-going-public.html,https://cdn.snapi.dev/images/v1/a/c/105515639-1539883043311img-5130r.jpg,Rent the Runway CEO: I haven't been given the privilege or permission to lose $1 billion,Rent the Runway co-founder and CEO Jennifer Hyman has her sights set on expanding her business without sacrificing profitability.,CNBC,"Thu, 16 May 2019 13:54:00 -0400",CEO,Neutral,Article
https://www.youtube.com/watch?v=cDJnoBCnDak,https://cdn.snapi.dev/images/v1/m/q-4/former-bank-ceo-slams-trumps-handling-of-china-trade-tension.jpg,Former bank CEO slams Trump's handling of China trade tension,Former Wells Fargo CEO Richard Kovacevich on the potential impact of the mounting trade tensions with China and the debate over capitalism versus socialism.,Fox Business,"Thu, 16 May 2019 13:46:08 -0400",,Negative,Video
https://www.youtube.com/watch?v=HkNDLZ7r3cU,https://cdn.snapi.dev/images/v1/m/q-4/we-need-to-keep-close-eye-on-consumers-to-track-tariff-impact-says-macropolicy-perspectives-corona.jpg,"We need to keep close eye on consumers to track tariff impact, says Macropolicy Perspectives' Corona","John Augustine, Huntington Private Bank CIO, and Julia Coronado, Macropolicy Perspectives, join 'The Exchange' to discuss how the U.S.",CNBC Television,"Thu, 16 May 2019 13:41:01 -0400",,Neutral,Video
https://www.youtube.com/watch?v=MKwkThW0OF0,https://cdn.snapi.dev/images/v1/m/q-4/dow-briefly-turns-positive-for-the-week-as-stocks-surge.jpg,Dow briefly turns positive for the week as stocks surge,"Jenny Harrington, Gilman Hill Asset Management CEO and portfolio manager, and Quint Tatro, Joule Financial founder and managing director, join 'Fast Money Halftime Report' to discuss the stock market reversal after news that U.S.",CNBC Television,"Thu, 16 May 2019 13:35:16 -0400",,Positive,Video
https://www.youtube.com/watch?v=URuLjTQehXI,https://cdn.snapi.dev/images/v1/m/q-4/fed-governor-lael-brainard-fed-needs-to-preserve-as-much-as-policy-space-as-it-can.jpg,Fed Governor Lael Brainard: Fed needs to preserve as much as policy space as it can,Fed governor Lael Brainard gave speeches on the direction the Fed needs to head in.,CNBC Television,"Thu, 16 May 2019 13:33:59 -0400",,Positive,Video
https://nypost.com/2019/05/16/chick-fil-a-says-it-has-much-higher-calling-amid-charity-backlash/,https://cdn.snapi.dev/images/v1/c/h/chick-fil-a-01jpgquality90stripall.jpg,Chick-fil-A says it has ‘much higher calling’ amid charity backlash,Chick-fil-A is taking the high road in response to a handful of liberal critics alleging the popular fast food restaurant is hostile to LGBTQ individuals.,New York Post,"Thu, 16 May 2019 13:29:43 -0400",,Neutral,Article
https://www.youtube.com/watch?v=AC7_IFiGALg,https://cdn.snapi.dev/images/v1/w/2/the-ipo-market-looks-stronger-without-big-names-says-ubs-jason-draho.jpg,"The IPO market looks stronger without big names, says UBS' Jason Draho",Jason Draho of UBS and CNBC's Mike Santoli discuss the current IPO market after big losses from the likes of Uber and Lyft.,CNBC Television,"Thu, 16 May 2019 13:16:40 -0400",,Positive,Video
https://www.youtube.com/watch?v=lKJPNcxdrp8,https://cdn.snapi.dev/images/v1/j/3/elon-musk-says-the-key-to-funding-his-mars-vision-is-his-starlink-satellite-project.jpg,Elon Musk says the key to funding his Mars vision is his Starlink satellite project,"A internet satellite network for consumers is how CEO Elon Musk believes SpaceX can ""generate revenue that can be used to develop more and more advanced rockets and spaceships,"" he said on Wednesday.",CNBC Television,"Thu, 16 May 2019 13:15:09 -0400",,Positive,Video
https://www.youtube.com/watch?v=8jXi3WA2Bfo,https://cdn.snapi.dev/images/v1/m/q-4/goodrx-co-ceo-discovering-cheaper-drug-prices.jpg,GoodRx co-CEO: Discovering Cheaper Drug Prices,Jim Cramer chats with GoodRx co-CEO Doug Hirsch in San Francisco to find out how the app is working with health insurers and pharmacies to prevent high prescription costs from bankrupting people.,CNBC Television,"Thu, 16 May 2019 13:11:49 -0400",CEO,Neutral,Video
https://feedproxy.google.com/~r/Techcrunch/~3/_tVIcgn5_3s/,https://cdn.snapi.dev/images/v1/i/j/gettyimages-1005673996jpgw600.jpg,Airbnb adds former Apple retail chief Angela Ahrendts to board,"Ahrendts, the former senior vice president fo retail at Apple, joins as Airbnb's third independent non-affiliated board member.",TechCrunch,"Thu, 16 May 2019 13:00:02 -0400",,Positive,Article
https://feedproxy.google.com/~r/typepad/RyNm/~3/TQrSbhGbxLE/,https://cdn.snapi.dev/images/v1/a/d/adnl8.jpg,New York to London in 90 Minutes Is in the Works,"It’s 3,459 miles from New York City to London. The current flying time is around seven hours.",24/7 Wall Street,"Thu, 16 May 2019 12:50:29 -0400",,Positive,Article
https://www.cnbc.com/2019/05/16/why-huaweis-problems-with-the-us-government-have-been-so-bad.html,https://cdn.snapi.dev/images/v1/1/0-2/105780044-1551963206679rtx6q160.jpg,This is why there's been a decade-long disconnect between Huawei and the US,Huawei chief security officer Andy Purdy and former Homeland Security Secretary Michael Chertoff describe the decade-long disconnect between the U.S. and the Chinese telecom giant.,CNBC,"Thu, 16 May 2019 12:47:00 -0400",,Neutral,Article
https://feedproxy.google.com/~r/Techcrunch/~3/BWsltN1hQEg/,https://cdn.snapi.dev/images/v1/t/i/tik-tok-ios-iconjpgw712.jpg,TikTok tops the iOS App Store for the fifth quarter in a row,"Despite a $5.7 million FTC fine and changes to restrict its use by under 13-year-olds, TikTok retained its No. 1 position as the most downloaded app on the Apple App Store for the fifth consecutive quarter, according to a new report from Sensor Tower.",TechCrunch,"Thu, 16 May 2019 12:35:53 -0400",,Positive,Article
https://www.youtube.com/watch?v=3FnOtGudKyA,https://cdn.snapi.dev/images/v1/m/q-4/auto-stocks-rally-as-trump-could-delay-auto-tariffs-for-six-months.jpg,Auto stocks rally as Trump could delay auto tariffs for six months,Yahoo Finance's Jessica Smith reports on the latest information regarding President Trump delaying auto tariffs for up to six months.,Yahoo Finance,"Thu, 16 May 2019 12:08:09 -0400",,Neutral,Video
https://www.cnbc.com/2019/05/16/analysts-downgraded-these-stocks-due-to-the-us-china-trade-war.html,https://cdn.snapi.dev/images/v1/e/t/etf29-16.jpg,US-China trade war worries caused analysts to bail on these stocks,CNBC did a deep dive through sell-side stock research since the trade war escalated to find companies that analysts are singling out in their respective coverage universes.,CNBC,"Thu, 16 May 2019 11:37:00 -0400",,Neutral,Article
https://www.youtube.com/watch?v=o_qRKR8W_OE,https://cdn.snapi.dev/images/v1/m/q-4/trade-tensions-a-lose-lose-situation-all-around-says-jp-morgans-joyce-chang.jpg,"Trade tensions a lose-lose situation all around, says JP Morgan's Joyce Chang","Joyce Chang, research chair at JP Morgan, and Matthew Gold, former deputy assistant U.S.",CNBC Television,"Thu, 16 May 2019 11:35:19 -0400",,Neutral,Video
https://www.youtube.com/watch?v=uy9vB64s514,https://cdn.snapi.dev/images/v1/m/q-4/us-housing-starts-rise-for-second-straight-month-in-april.jpg,U.S. Housing Starts Rise for Second-Straight Month in April,"May.16 -- Nela Richardson, investment strategist at Edward Jones, and Yana Barton, portfolio manager at Eaton Vance, examine U.S.",Bloomberg Markets and Finance,"Thu, 16 May 2019 11:35:10 -0400",,Positive,Video
https://www.youtube.com/watch?v=OvqogZXP6BU,https://cdn.snapi.dev/images/v1/m/q-4/market-upside-truncated-by-trade-tensions-btigs-emanuel-says.jpg,"Market Upside Truncated by Trade Tensions, BTIG's Emanuel Says","May.16 -- Julian Emanuel, chief equity and derivatives strategist at BTIG, discusses the market impact of U.S.",Bloomberg Markets and Finance,"Thu, 16 May 2019 11:26:54 -0400",,Positive,Video
https://www.youtube.com/watch?v=BxlSKaCF2fA,https://cdn.snapi.dev/images/v1/m/q-4/etf-spotlight-the-fang-revival.jpg,ETF Spotlight: The FANG revival,"CNBC's Mike Santoli and David Faber take a look at FANG stocks rebounding off their lows, particularly in software.",CNBC Television,"Thu, 16 May 2019 11:25:02 -0400",,Neutral,Video
https://www.youtube.com/watch?v=Eky60iHXfOM,https://cdn.snapi.dev/images/v1/m/q-4/how-have-25-tariffs-impacted-the-steel-industry.jpg,How Have 25% Tariffs Impacted the Steel Industry?,May.16 -- President Donald Trump placed a 25% tariff on steel from China and other nations in March of 2018.,Bloomberg Markets and Finance,"Thu, 16 May 2019 11:23:15 -0400",,Neutral,Video
https://www.youtube.com/watch?v=udCj688SIvE,https://cdn.snapi.dev/images/v1/p/b/how-wasabi-is-taking-on-amazon-in-the-cloud.jpg,How Wasabi Is Taking On Amazon in the Cloud,"Wasabi Technologies, Inc. Chief Executive Officer David Friend discusses how the company is taking on Amazon.com in cloud storage. He speaks with Bloomberg's Carol Massar on ""Bloomberg Technology.""",Bloomberg Technology,"Thu, 16 May 2019 10:58:07 -0400",,Neutral,Video
https://www.cnbc.com/2019/05/16/former-apple-retail-boss-angela-ahrendts-reportedly-joins-airbnbs-board.html,https://cdn.snapi.dev/images/v1/t/b/101113309-184667505.jpg,Former Apple retail boss Angela Ahrendts joins Airbnb's board,Angela Ahrendts previously served as the chief executive at Burberry.,CNBC,"Thu, 16 May 2019 10:58:00 -0400",,Positive,Article
https://www.youtube.com/watch?v=zgMXaeOtQrc,https://cdn.snapi.dev/images/v1/8/e/goldman-says-bond-market-doesnt-react-as-it-used-to-in-risk-off.jpg,Goldman Says Bond Market Doesn't React as It Used to in Risk-Off,"Christian Mueller-Glissmann, managing director of portfolio strategy at Goldman Sachs, explains why he is ""underweight"" bonds and discusses Federal Reserve policy.",Bloomberg Markets and Finance,"Thu, 16 May 2019 10:57:13 -0400",,Neutral,Video
https://www.youtube.com/watch?v=fovPOrbPCdI,https://cdn.snapi.dev/images/v1/m/q-4/bookingcom-ceo-on-trade-war-bookings-tech-in-france-tax-reform.jpg,"Booking.com CEO on Trade War, Bookings, Tech in France, Tax Reform","May.16 -- Gillian Tans, chief executive officer at Booking.com, discusses the impact of the trade war in the tech sector, bookings for this summer, attracting tech and talent in France, tax reform and Brexit.",Bloomberg Markets and Finance,"Thu, 16 May 2019 10:55:17 -0400",,Neutral,Video
https://www.youtube.com/watch?v=8N13za4M_78,https://cdn.snapi.dev/images/v1/m/q-4/we-are-cautiously-optimistic-on-assets-asset-values-in-2h-says-cibcs-stretch.jpg,"We Are Cautiously Optimistic on Assets, Asset Values in 2H, Says CIBC’s Stretch","May.16 -- Jeremy Stretch, head of FX strategy at CIBC, discusses his asset allocation strategy and his outlook for the yuan.",Bloomberg Markets and Finance,"Thu, 16 May 2019 10:49:38 -0400",,Positive,Video
https://www.cnbc.com/2019/05/16/cramer-us-companies-didnt-think-trump-had-the-resolve-on-tarrifs.html,https://cdn.snapi.dev/images/v1/1/0-2/105680050-1547584264634img-0009r.jpg,Cramer: US firms are getting hurt by tariffs because 'they didn't think Trump had the resolve',"Some American companies ""let themselves get hurt"" by tariffs because they assumed Trump wouldn't follow through on his China trade threats, CNBC's Jim Cramer says.",CNBC,"Thu, 16 May 2019 10:47:00 -0400",,Neutral,Article
https://www.cnbc.com/2019/05/16/former-goldman-ceo-lloyd-blankfein-on-trumps-tariffs-i-dont-think-hes-wrong-here.html,https://cdn.snapi.dev/images/v1/k/k/104832668-gettyimages-622173694-blankfein.jpg,Former Goldman CEO Lloyd Blankfein on Trump's tariffs: 'I don't think he's wrong here',Former Goldman Sachs chief Lloyd Blankfein agrees with President Trump's stance on tariffs in the ongoing trade war with China.,CNBC,"Thu, 16 May 2019 10:32:00 -0400",CEO,Neutral,Article
https://feedproxy.google.com/~r/BusinessRss/~3/yb_G4B7s0Ws/,https://cdn.snapi.dev/images/v1/o/2/o22.jpg,"This Startup Joins Boeing, Airbus In The Electric Flying Car Race","Lilium's all-electric flying car successfully completed take off and landing flight tests in Munich earlier this month as the startup enters a race with Boeing, Airbus and others to create an on-demand air taxi. 
The post This Startup Joins Boeing, Airbus In The Electric Flying Car Race appeared first on Investor's Business Daily.",Investors Business Daily,"Thu, 16 May 2019 10:16:13 -0400",,Neutral,Article
https://www.youtube.com/watch?v=G_uohGLOiK0,https://cdn.snapi.dev/images/v1/m/q-4/cramer-companies-underestimated-trumps-resolve-for-a-china-trade-deal.jpg,Cramer: Companies underestimated Trump's resolve for a China trade deal,President Trump signed an executive order that effectively blacklists Chinese telecom giant Huawei.,CNBC Television,"Thu, 16 May 2019 10:15:09 -0400",,Neutral,Video
https://www.youtube.com/watch?v=V4u3OhJcVcI,https://cdn.snapi.dev/images/v1/m/q-4/stocks-extend-rally-on-china-trade-war-developments.jpg,Stocks extend rally on China trade war developments,CNBC's Bob Pisani looks ahead at the day's market action.,CNBC Television,"Thu, 16 May 2019 10:11:49 -0400",,Neutral,Video
https://feedproxy.google.com/~r/Techcrunch/~3/y97RM5rrHQg/,https://cdn.snapi.dev/images/v1/g/e/gettyimages-832158646-1jpgw601.jpg,SugarCRM moves into marketing automation with Salesfusion acquisition,SugarCRM announced today that it has acquired Atlanta-based Salesfusion to help build out the the marketing automation side of its business. The deal closed last Friday.,TechCrunch,"Thu, 16 May 2019 10:06:35 -0400",manda,Positive,Article
https://www.youtube.com/watch?v=38txGqyLSkM,https://cdn.snapi.dev/images/v1/m/q-4/the-tariffs-are-a-means-to-an-end-says-former-cea-chair.jpg,"The tariffs are a means to an end, says former CEA chair","Jason Furman, a former Council of Economics Advisors chairman who is currently a professor at Harvard's Kennedy School, joins ""Squawk Box"" to discuss the effect the new trade tariffs may have on the economy.",CNBC Television,"Thu, 16 May 2019 09:46:23 -0400",,Neutral,Video
https://feeds.reuters.com/~r/reuters/businessNews/~3/2HNuEtMLQl8/wall-st-opens-higher-after-upbeat-cisco-walmart-earnings-idUSKCN1SM176,https://cdn.snapi.dev/images/v1/e/g/m02d20190516t2i1387710143rlynxnpef4f0oxw640.jpg,"Wall St. opens higher after upbeat Cisco, Walmart earnings","U.S. stocks opened higher on Thursday, helped by upbeat earnings from Cisco and Walmart, although the Trump administration's move to blacklist Chinese telecom company Huawei kept chip stocks under pressure.",Reuters,"Thu, 16 May 2019 09:37:18 -0400",earnings,Neutral,Article
https://www.youtube.com/watch?v=jYqljY4qOQw,https://cdn.snapi.dev/images/v1/m/q-4/us-weekly-jobless-claims-total-212000-vs-220000-expected.jpg,"US weekly jobless claims total 212,000, vs 220,000 expected","CNBC's Rick Santelli and Steve Liesman break down the latest jobless claims, housing starts, building permits and Philadelphia Fed manufacturing numbers.",CNBC Television,"Thu, 16 May 2019 08:57:58 -0400",,Positive,Video
https://www.cnbc.com/2019/05/15/us-airlines-brought-in-almost-5-billion-dollars-in-baggage-fees-last-year.html,https://cdn.snapi.dev/images/v1/8/b/8b-4.jpg,US airlines charged almost $5 billion in baggage fees last year—here's how to avoid them,American Airlines alone brought in $1.2 billion.,CNBC,"Thu, 16 May 2019 08:45:00 -0400",,Negative,Article
https://www.fool.com/investing/2019/05/16/is-it-time-to-reset-expectations-around-5g.aspx?source=iedfolrf0000001,https://cdn.snapi.dev/images/v1/u/r-2/urlhttps3a2f2fgfoolcdncom2feditorial2fimages2f5258452fgettyimages-951632154jpgw700opresize.jpg,Is It Time to Reset Expectations Around 5G?,Don’t believe the hype.,The Motley Fool,"Thu, 16 May 2019 08:45:00 -0400",,Neutral,Article
