news_url,image_url,title,text,source_name,date,topics,sentiment,type
https://seekingalpha.com/article/4400319-housing-market-forecasts-strong-economy-least-through-2021-pandemic-is-under-control,https://cdn.snapi.dev/images/v1/n/g/103905600-gettyimages-94868577-nuegmzzwyp.jpg,"Housing Market Forecasts A Strong Economy At Least Through 2021, Once Pandemic Is Under Control","The housing market historically proceeds in a fixed order: interest rates lead sales, which in turn lead prices, which in turn lead inventory. Interest rates have persistently declined for the past 18+ months to all-time lows, which led to a sharp increase in sales by the end of 2019.",Seeking Alpha,"Thu, 21 Jan 2021 23:31:55 -0500",paylimitwall,Positive,Article
https://www.youtube.com/watch?v=SXeetw477Cs,https://cdn.snapi.dev/images/v1/u/5/could-president-biden-be-good-for-the-stock-market.jpg,Could President Biden be good for the stock market?,"#stockmarket #Biden #2021outlook Yahoo Finance's Alexis Christoforous and Sam Stovall, Chief Investment Strategist at CFRA, discuss market outlook amid Biden's first 100 days. For 2020 election results please visit: Election results: https://www.yahoo.com/elections Subscribe to Yahoo Finance: https://yhoo.it/2fGu5Bb About Yahoo Finance: At Yahoo Finance, you get free stock quotes, up-to-date news, portfolio management resources, international market data, social interaction and mortgage rates that help you manage your financial life.",Yahoo Finance,"Thu, 21 Jan 2021 22:15:00 -0500",Political,Neutral,Video
https://www.youtube.com/watch?v=CfDiady-GBM,https://cdn.snapi.dev/images/v1/e/g/global-trade-recovered-sharply-with-the-us-and-china-leading-transactions-but-uk-and-europe-lag.jpg,Global trade recovered sharply with the US and China leading transactions but UK and Europe lag,"#coronavirus #COVID19 #Globaltrade Tradeshift CEO Christian Lanng joins Yahoo Finance Live to discuss the rise in global trade in December as supply chains recover and vaccines are distributed. For 2020 election results please visit: Election results: https://www.yahoo.com/elections Subscribe to Yahoo Finance: https://yhoo.it/2fGu5Bb About Yahoo Finance: At Yahoo Finance, you get free stock quotes, up-to-date news, portfolio management resources, international market data, social interaction and mortgage rates that help you manage your financial life.",Yahoo Finance,"Thu, 21 Jan 2021 22:05:54 -0500",Political,Positive,Video
https://www.youtube.com/watch?v=o0PadpaMzBg,https://cdn.snapi.dev/images/v1/m/q/etfs-in-2021-are-really-strong-cfras-todd-rosenbluth-breaks-down-etfs-and-the-biden-presidency.jpg,ETF's in 2021 are really strong: CFRA's Todd Rosenbluth breaks down ETFs and the Biden presidency,"Yahoo Finance's Alexis Christoforous and Todd Rosenbluth, Head of ETF and Mutual Fund Research at CFRA, discuss which ETFs stand to gain under the Biden administration. For 2020 election results please visit: Election results: https://www.yahoo.com/elections Subscribe to Yahoo Finance: https://yhoo.it/2fGu5Bb About Yahoo Finance: At Yahoo Finance, you get free stock quotes, up-to-date news, portfolio management resources, international market data, social interaction and mortgage rates that help you manage your financial life.",Yahoo Finance,"Thu, 21 Jan 2021 21:55:09 -0500",Political,Positive,Video
https://www.youtube.com/watch?v=CrCsh2iFynE,https://cdn.snapi.dev/images/v1/m/q/stocks-near-records-as-biden-signs-more-orders-on-covid-19.jpg,Stocks near records as Biden signs more orders on COVID-19,"People's United Advisors CIO John Traynor joined Yahoo FInance Live to break down what investors can expect from the market in the first few months of Biden's presidency. For 2020 election results please visit: Election results: https://www.yahoo.com/elections Subscribe to Yahoo Finance: https://yhoo.it/2fGu5Bb About Yahoo Finance: At Yahoo Finance, you get free stock quotes, up-to-date news, portfolio management resources, international market data, social interaction and mortgage rates that help you manage your financial life.",Yahoo Finance,"Thu, 21 Jan 2021 21:25:24 -0500",Political,Positive,Video
https://www.youtube.com/watch?v=8rgO1lcWn8M,https://cdn.snapi.dev/images/v1/m/q/jim-cramer-heres-how-i-would-invest-powerball-lottery-winnings.jpg,Jim Cramer: Here's how I would invest Powerball lottery winnings,CNBC's Jim Cramer on Thursday offered suggestions for how the person who bought the winning Powerball lottery ticket could invest their jackpot.,CNBC Television,"Thu, 21 Jan 2021 20:56:47 -0500","cramer,madmoney",Positive,Video
https://seekingalpha.com/article/4400292-healthcare-thoughts-for-new-year,https://cdn.snapi.dev/images/v1/8/x/im-242691width620size14463276836158192.jpg,Healthcare: Thoughts For The New Year,"2020 was a busy year for global healthcare with unprecedented efforts to develop vaccines, treatments, and diagnostics for COVID-19. Deal flow in the sector continued to gain momentum in 2020, with M&A transactions and product licensing deals totalling five-year highs as large-cap pharma sought to bolster top lines and expand into new therapeutic areas.",Seeking Alpha,"Thu, 21 Jan 2021 19:57:10 -0500",paylimitwall,Positive,Article
https://www.youtube.com/watch?v=ouseNcAD8EQ,https://cdn.snapi.dev/images/v1/f/h/cramer-says-the-strong-us-housing-market-has-been-an-economic-bridge-to-covid-vaccine.jpg,Cramer says the strong U.S. housing market has been an economic bridge to Covid vaccine,CNBC's Jim Cramer said Thursday that the hot housing market has been key to helping the U.S. economy during the coronavirus pandemic.,CNBC Television,"Thu, 21 Jan 2021 19:21:37 -0500","cramer,madmoney",Positive,Video
https://seekingalpha.com/article/4400285-markets-are-strong-technically-speaking-for-1-21,https://cdn.snapi.dev/images/v1/j/e/106727425-1601646130354-nyse.jpg,The Markets Are Very Strong (Technically Speaking For 1/21),"Today's economic data was mixed. While housing is strong and there is ample liquidity, the labor market is still very weak. The tech sector broke out today.",Seeking Alpha,"Thu, 21 Jan 2021 19:20:51 -0500","tanalysis,paylimitwall",Positive,Article
https://www.zacks.com/stock/news/1250103/new-highs-for-nasdaq-sp-q4-earnings-for-intc-ibm-csx,https://cdn.snapi.dev/images/v1/o/n/stocks4-13.jpg,"New Highs for Nasdaq, S&P; Q4 Earnings for INTC, IBM & CSX","While the Dow fell just short of closing in the green, the S&P squeaked just above it",Zacks Investment Research,"Thu, 21 Jan 2021 18:48:03 -0500",earnings,Positive,Article
https://www.youtube.com/watch?v=YfqOescewPM,https://cdn.snapi.dev/images/v1/0/a/what-a-50-year-bond-means-for-the-yield-curve.jpg,What a 50-year bond means for the yield curve,"CNBC's Steve Liesman reports on whether 10- and 30-year bond holders will move to the longer dated bond if it's offered. With CNBC's Melissa Lee and the Fast Money traders, Guy Adami, Tim Seymour, Karen Finerman and Dan Nathan.",CNBC Television,"Thu, 21 Jan 2021 18:20:57 -0500",,Neutral,Video
https://seekingalpha.com/article/4400277-latin-american-equities-close-year-in-red-despite-strongest-q4-in-20-years,https://cdn.snapi.dev/images/v1/m/a/106419724-1583164885503rts34fgq-dahzkkx03s.jpg,Latin American Equities Close The Year In The Red Despite The Strongest Q4 In 20 Years,Latin American Equities Close The Year In The Red Despite The Strongest Q4 In 20 Years,Seeking Alpha,"Thu, 21 Jan 2021 18:18:27 -0500",paylimitwall,Negative,Article
https://www.youtube.com/watch?v=GHA7SaeNJBg,https://cdn.snapi.dev/images/v1/m/q/another-900000-americans-filed-for-unemployment-for-the-week-ending-january-16.jpg,"Another 900,000 Americans filed for unemployment for the week ending January 16","#unemployment #joblessclaims #economy Yahoo Finance's Aikiko Fujita ans Zack Guzman discuss the latest jobless claims and what that means for states and the American economy. For 2020 election results please visit: Election results: https://www.yahoo.com/elections Subscribe to Yahoo Finance: https://yhoo.it/2fGu5Bb About Yahoo Finance: At Yahoo Finance, you get free stock quotes, up-to-date news, portfolio management resources, international market data, social interaction and mortgage rates that help you manage your financial life.",Yahoo Finance,"Thu, 21 Jan 2021 18:10:28 -0500",,Negative,Video
https://seekingalpha.com/article/4400268-data-update-2-for-2021-price-of-risk,https://cdn.snapi.dev/images/v1/1/k/wsdew22-w4wb147xqj.jpg,Data Update 2 For 2021: The Price Of Risk,"The price of risk is what investors demand as a premium, an extra return over and above what they can make on a guaranteed investment (risk free), to invest in a risky asset. Corporate bonds are traded, and as a consequence, and you can use traded prices to estimate default spreads in the market.",Seeking Alpha,"Thu, 21 Jan 2021 17:33:27 -0500",paylimitwall,Negative,Article
https://www.youtube.com/watch?v=oQYEZwVF3Dw,https://cdn.snapi.dev/images/v1/g/t/if-we-get-a-fiscal-package-it-can-weigh-on-inflationary-concerns-mohamed-el-erian.jpg,"If we get a fiscal package, it can weigh on inflationary concerns: Mohamed El-Erian","Mohamed El-Erian, Allianz chief economic advisor, joins 'Closing Bell' to discuss central banks' response to further stimulus and whether that will result in inflation.",CNBC Television,"Thu, 21 Jan 2021 17:11:38 -0500",,Negative,Video
https://www.gurufocus.com/news/1337811/us-stocks-end-mostly-flat-on-bidens-first-day,https://cdn.snapi.dev/images/v1/w/e/a-significant-majority-of-democrats-and-republicans-support-strong-consumer-protection-regulations-and-tougher-rules-for-wall-street.jpg,US Stocks End Mostly Flat on Biden's First Day,"The Dow Jones Industrial Average closed at 31,176.01 on Thursday with a loss of 12.37 points or -0.04%. The S&P 500 closed at 3,853.07 for a gain of 1.22 points or 0.03%.",GuruFocus,"Thu, 21 Jan 2021 17:10:27 -0500",Political,Neutral,Article
https://www.barrons.com/articles/dow-jones-industrial-average-intel-and-apple-stock-softened-blow-51611266023,https://cdn.snapi.dev/images/v1/a/n/how-to-navigate-the-largest-economic-stimulus-in-us-history.jpg,The Dow Fell 12 Points Because Intel and Apple Stock Softened the Blow,"Concern from Republicans and moderate Democrats in Congress put a damper on the nascent market rally, as more stimulus looks less like a done deal. Big Tech stocks surged, backstopping the major stock indexes.",Barrons,"Thu, 21 Jan 2021 16:57:00 -0500",paywall,Negative,Article
https://www.cnbc.com/2021/01/21/sp-500-hits-new-highs-as-biden-takes-office-impact-on-markets.html,https://cdn.snapi.dev/images/v1/f/y/106827213-1611166415436-joe6.jpg,S&P 500 hits fresh highs as Biden takes office — how a new administration could impact markets,Three market analysts weigh in about how investors can navigate the new administration's potential policies.,CNBC,"Thu, 21 Jan 2021 16:52:55 -0500",Political,Positive,Article
https://www.kiplinger.com/investing/stocks/602129/stock-market-today-012121-big-tech-keeps-the-rally-moving,https://cdn.snapi.dev/images/v1/0/h/stock-market-today-012121.jpg,Stock Market Today: Big Tech Keeps the Rally Moving,"While Biden got to work on a number of new COVID-fighting measures Thursday, Wall Street kept its eye on mega-cap technology firms.",Kiplinger,"Thu, 21 Jan 2021 16:37:00 -0500",,Positive,Article
https://www.businessinsider.com/stock-market-news-today-indexes-tech-rally-biden-stimulus-plan-2021-1,https://cdn.snapi.dev/images/v1/s/p/sp-500-nasdaq-close-at-record-highs-for-2nd-day-as-tech-giants-rally.jpg,"S&P 500, Nasdaq close at record highs for 2nd day as tech giants rally","US equities rose on Thursday as investors bet on the Biden administration to accelerate the nation's economic recovery. President Joe Biden unveiled new plans for how the government will tackle the coronavirus pandemic on Thursday. The president aims to sign 10 executive orders and invoke the Defense Production Act to accelerate testing, vaccine distribution, and reopen schools and businesses.",Business Insider,"Thu, 21 Jan 2021 16:09:19 -0500",paylimitwall,Positive,Article
https://www.marketwatch.com/story/dow-finishes-with-small-loss-as-sp-500-nasdaq-eke-out-another-record-close-2021-01-21,https://cdn.snapi.dev/images/v1/3/i/aaad1.jpg,"Dow finishes with small loss as S&P 500, Nasdaq eke out another record close","Stocks saw a mixed finish Thursday, with the Dow Jones Industrial Average posting a small loss and the S&P 500 and Nasdaq Composite building on the previous session's record close as investors weighed President Joe Biden's efforts to ramp up COVID-19 vaccine efforts and parsed fourth-quarter corporate earnings. The Dow fell around 12 points, or less than 0.1%, to end near 12,899, according to preliminary figures, while the S&P 500 rose by around 1 point to end near 3,853.",Market Watch,"Thu, 21 Jan 2021 16:05:02 -0500",paylimitwall,Positive,Article
https://www.youtube.com/watch?v=xnxq9wihOR8,https://cdn.snapi.dev/images/v1/m/q/how-the-biden-administration-might-impact-the-etf-industry.jpg,How the Biden administration might impact the ETF industry,Tom Lydon of ETF Trends shares his predictions for ETFs under President Joe Biden with CNBC's Bob Pisani.,CNBC Television,"Thu, 21 Jan 2021 16:01:11 -0500",Political,Neutral,Video
https://www.youtube.com/watch?v=vKjXJwl4lhM,https://cdn.snapi.dev/images/v1/m/q/why-investors-are-excited-about-the-municipal-bond-market.jpg,Why investors are excited about the municipal bond market,"Mark Paris, Invesco fixed income CIO, joins 'The Exchange' to discuss what about the Biden administration gets investors excited to invest in the muni bond market.",CNBC Television,"Thu, 21 Jan 2021 15:57:54 -0500",,Positive,Video
https://www.youtube.com/watch?v=oWqbOuXNLck,https://cdn.snapi.dev/images/v1/m/q/why-this-long-term-investor-says-it-is-time-to-reposition.jpg,Why this long-term investor says it is time to reposition,"CNBC's ""Closing Bell"" team discusses investment strategies with markets with Liz Ann Sonders of Charles Schwab and Rupal Bhansali of Ariel Investments.",CNBC Television,"Thu, 21 Jan 2021 15:57:24 -0500",,Neutral,Video
https://www.etftrends.com/seeking-novel-approach-high-yield-investing/,https://cdn.snapi.dev/images/v1/z/g/seeking-a-novel-approach-to-high-yield-bond-investing-440x250.jpg,Seeking a Novel Approach to High-Yield Bond Investing?,"As income-minded exchange traded fund investors look for ways to generate additional cash in their portfolios, it is equally important to think about managing the risk in doing so. In the recent webcast, Tactical High Yield Solutions for Today's Yield-Starved Environment, Matthew Bartolini, Head of SPDR Americas Research, State Street Global Advisors, outlined how the [.",ETF Trends,"Thu, 21 Jan 2021 15:55:41 -0500",dividend,Neutral,Article
https://www.youtube.com/watch?v=9K8QzNLiE7I,https://cdn.snapi.dev/images/v1/n/y/why-hercules-investments-mcdonald-thinks-the-market-is-overvalued.jpg,Why Hercules Investments' McDonald thinks the market is overvalued,"James McDonald, Hercules Investments, and Art Hogan, National Securities, join 'The Exchange' to discuss whether the market could be headed for a bubble burst.",CNBC Television,"Thu, 21 Jan 2021 15:47:56 -0500",,Negative,Video
https://www.forbes.com/sites/bradmcmillan/2021/01/21/should-politics-play-a-role-in-our-investments/,https://cdn.snapi.dev/images/v1/s/h/should-politics-play-a-role-in-our-investments.jpg,Should Politics Play A Role In Our Investments?,"With a new administration just beginning, Commonwealth CIO Brad McMillan reflects on how he thinks about politics and investments.",Forbes,"Thu, 21 Jan 2021 15:45:07 -0500",paylimitwall,Neutral,Article
https://www.youtube.com/watch?v=ptSOvbyGyh8,https://cdn.snapi.dev/images/v1/m/q/2021-investing-outlook-strategist-weighs-in-on-what-to-look-out-for-in-foreign-and-domestic-stocks.jpg,2021 investing outlook: Strategist weighs in on what to look out for in foreign and domestic stocks,"#Biden #Bidenstockmarket #PresidentBiden TD Ameritrade Senior Market Strategist Shawn Cruz speaks with Yahoo Finance's Zack Guzman about what to look out for when investing in 2021. For 2020 election results please visit: Election results: https://www.yahoo.com/elections Subscribe to Yahoo Finance: https://yhoo.it/2fGu5Bb About Yahoo Finance: At Yahoo Finance, you get free stock quotes, up-to-date news, portfolio management resources, international market data, social interaction and mortgage rates that help you manage your financial life.",Yahoo Finance,"Thu, 21 Jan 2021 15:42:26 -0500",,Neutral,Video
https://seekingalpha.com/article/4400246-anatomy-of-recession-reasons-recovery-accelerate,https://cdn.snapi.dev/images/v1/9/u/wall-street-4847629-1920-1.jpg,Anatomy Of Recession: Reasons Recovery Could Accelerate,"It only took six months for retail sales to regain pre-COVID levels during this recession, that was exponentially quicker than what you saw during the dot-com bubble at 16 months, and then much, much quicker than what you saw during the global financial crisis at 34 months. Manufacturing PMI new orders are synonymous with the business cycle.",Seeking Alpha,"Thu, 21 Jan 2021 15:42:07 -0500",paylimitwall,Negative,Article
https://www.youtube.com/watch?v=qXW3bCRFKqc,https://cdn.snapi.dev/images/v1/s/t/who-cares-about-market-valuations-if-fed-keeps-rate-near-zero-strategist.jpg,Who cares about market valuations if Fed keeps rate near zero: Strategist,"CNBC's ""Power Lunch"" team breaks down markets with Michael Labella of Franklin Templeton and Michael Arone of State Street Global Advisors.",CNBC Television,"Thu, 21 Jan 2021 14:36:18 -0500",,Neutral,Video
https://www.cnbc.com/2021/01/21/covid-stimulus-update-biden-relief-plan-faces-republican-moderate-opposition.html,https://cdn.snapi.dev/images/v1/1/0/106825538-16107452982021-01-15t210450z-1777938175-rc2l8l9v2dyt-rtrmadp-0-usa-biden.jpeg,Biden is already facing pressure to scale back his $1.9 trillion Covid relief plan,President Joe Biden's $1.9 trillion coronavirus relief plan is facing skepticism from Republicans as Democrats start the process of passing a bill.,CNBC,"Thu, 21 Jan 2021 14:22:06 -0500",Political,Negative,Article
https://www.youtube.com/watch?v=XJDff20bqh4,https://cdn.snapi.dev/images/v1/v/j/futures-outlook-trading-the-us-dollar.jpg,Futures Outlook: Trading the U.S. dollar,The U.S. dollar is sinking today amid fears of rising inflation. Scott Nations of Nations Indexes joins 'Futures Outlook' to discuss where he thinks the U.S. currency could be headed next.,CNBC Television,"Thu, 21 Jan 2021 14:14:25 -0500",,Negative,Video
https://seekingalpha.com/article/4400209-amazing-grace-stock-market,https://cdn.snapi.dev/images/v1/s/v/ipos-banner-year-markets-e1600964930157jpgquality90stripall.jpg,The 'Amazing Grace' Stock Market,We have a lot more that brings us together than separates us in America. What the SKEW index portends for the market moving forward.,Seeking Alpha,"Thu, 21 Jan 2021 14:03:35 -0500",paylimitwall,Positive,Article
https://www.youtube.com/watch?v=8iQimRz5Yjo,https://cdn.snapi.dev/images/v1/o/f/blackrocks-rick-rieder-explains-why-shifting-more-assets-to-cash.jpg,BlackRock's Rick Rieder explains why shifting more assets to cash,"Rick Rieder, BlackRock Global Fixed Income and Global Allocation team head CIO, joins 'Fast Money Halftime Report' to discuss his portfolio and where he's moving his money.",CNBC Television,"Thu, 21 Jan 2021 13:46:41 -0500",,Neutral,Video
https://www.cnbc.com/2021/01/20/sluggish-covid-vaccine-rollout-threatens-wall-streets-rosy-outlook.html,https://cdn.snapi.dev/images/v1/d/i/106827425-1611180519383-wallmain.jpg,Sluggish Covid vaccine rollout threatens Wall Street's rosy outlook,The market's optimism and economic realities could clash if Americans hold on to pandemic habits or spend conservatively because of the recession.,CNBC,"Thu, 21 Jan 2021 13:46:12 -0500",,Negative,Article
https://www.youtube.com/watch?v=k6bMEu_Bpu8,https://cdn.snapi.dev/images/v1/b/d/why-wisdomtrees-jeremy-schwartz-believes-international-stocks-could-outperform-us-stocks.jpg,Why WisdomTree's Jeremy Schwartz believes international stocks could outperform US stocks,"Jeremy Schwartz, WisdomTree Asset Management global head of research, joins 'ETF Edge' to discuss why he thinks the international names have more room to grow than U.S. stocks.",CNBC Television,"Thu, 21 Jan 2021 13:44:45 -0500",,Neutral,Video
https://investorplace.com/2021/01/4-sectors-you-need-in-your-portfolio-this-year/,https://cdn.snapi.dev/images/v1/z/0/bank1---jdo5hx8afw.jpg,4 Sectors You Need in Your Portfolio this Year,A sound investing strategy is to look for stock market sectors that are expected to outperform the market. Here are four to watch now.,InvestorPlace,"Thu, 21 Jan 2021 13:43:50 -0500",,Positive,Article
https://www.businessinsider.com/us-home-starts-gain-housing-market-boom-construction-economic-recovery-2021-1,https://cdn.snapi.dev/images/v1/u/s/us-home-starts-gained-to-best-rate-since-2006-to-close-out-the-housing-markets-triumphant-year.jpg,US home starts gained to best rate since 2006 to close out the housing market's triumphant year,"Home starts in the US climbed in December to the fastest pace since 2006 as housing-market activity thrived into the new year. New residential construction starts gained 5.8% to a seasonally adjusted annual rate of roughly 1.67 million units, according to Census Bureau data published Thursday. The rate sits 5.2% above the year-ago level. Economists surveyed by Bloomberg expected the rate to fall slightly to 1.56 million from November's revised level.",Business Insider,"Thu, 21 Jan 2021 13:25:00 -0500",paylimitwall,Positive,Article
https://www.youtube.com/watch?v=EpOSBqRSvdk,https://cdn.snapi.dev/images/v1/9/m/wall-street-visionaries-warn-of-the-next-big-risk.jpg,Wall Street Visionaries Warn of the 'Next Big Risk',"Jan.21 -- While investors deal with present risks like the Covid-19 pandemic and global political unrest, some visionaries on Wall Street are already looking ahead to the 'next big risk.' Bloomberg's Sonali Basak speaks with longtime Goldman Sachs executive R.",Bloomberg Markets and Finance,"Thu, 21 Jan 2021 13:21:24 -0500",,Negative,Video
https://www.youtube.com/watch?v=eRMFE0bO2Nk,https://cdn.snapi.dev/images/v1/m/q/valuation-is-a-bad-timing-mechanism-liz-young.jpg,Valuation is a bad timing mechanism: Liz Young,The 'Fast Money Halftime Report' team discusses whether the stock market is overvalued and how they are recommending investors play it.,CNBC Television,"Thu, 21 Jan 2021 13:13:00 -0500",,Neutral,Video
https://seekingalpha.com/article/4400195-covidminus-19-crisis-record-drop-in-covered-employment-im-weekly-unemployment-monitor-update,https://cdn.snapi.dev/images/v1/u/n/201006170805-nyse-1002-super-169.jpg,Covid-19 Crisis - Record Drop In Covered Employment: The iM-Weekly Unemployment Monitor: Update 1/21/2021,Covid-19 Crisis - Record Drop In Covered Employment: The iM-Weekly Unemployment Monitor: Update 1/21/2021,Seeking Alpha,"Thu, 21 Jan 2021 13:04:47 -0500",paylimitwall,Positive,Article
https://www.marketwatch.com/story/rally-time-the-biggest-red-flag-in-this-bull-market-just-vanished-trader-says-11611252079,https://cdn.snapi.dev/images/v1/c/i/im-288612width620size14953271028037383.jpg,"The Tell: Rally time? The ‘biggest red flag' in this bull market just vanished, trader says","Those ""highflying FAANG stocks"" haven't exactly lived up to their billing in recent month, but the longtime leaders of the bull market did help the S&P 500 break into record territory on Inauguration Day.",Market Watch,"Thu, 21 Jan 2021 13:01:00 -0500",paylimitwall,Positive,Article
https://www.benzinga.com/news/21/01/19259677/oil-stocks-are-trading-lower-on-api-data,https://cdn.snapi.dev/images/v1/o/i/oil-5086759-1280-17.png,Oil Stocks Are Trading Lower On API Data,"The shares of several oil companies are trading lower Thursday after American Petroleum Institute data released on Wednesday showed a build in U.S. crude oil inventories. BP plc (NYSE: BP) is an integrated oil and gas company that explores for, produces, and refines oil worldwide.",Benzinga,"Thu, 21 Jan 2021 12:43:57 -0500",oil,Negative,Article
https://investorplace.com/2021/01/market-bubble-s-p-500-spared/,https://cdn.snapi.dev/images/v1/w/0/2dew2q1-fbxdlklrog.jpg,The S&P 500 Won't Be Spared If This Market Is in a Bubble,"While tech has gotten the attention, the S&P 500 has posted an impressive rally of its own. If investors get nervous, this index too will suffer.",InvestorPlace,"Thu, 21 Jan 2021 12:38:17 -0500",,Negative,Article
https://www.nytimes.com/2021/01/21/business/economy/unemployment-claims-economy.html,https://cdn.snapi.dev/images/v1/0/z/merlin-181419225-4383be36-5257-42f3-ac57-cabf7b19ce83-articlelargejpgquality75autowebpdisableupscale.jpg,New unemployment claims remain high in the latest weekly report.,Relentless unemployment claims show the pandemic's grip on the labor market. Help from the recent stimulus bill may lapse before an upturn arrives.,NYTimes,"Thu, 21 Jan 2021 12:14:49 -0500",paywall,Negative,Article
https://www.youtube.com/watch?v=3ND2_xE83OY,https://cdn.snapi.dev/images/v1/m/q/2021-stock-outlook-what-investors-should-focus-on.jpg,2021 Stock outlook: What investors should focus on,"Yahoo Finance's Julie Hyman, Brian Sozzi, and Myles Udland break down the outlook for stocks in 2021 with Daniel Morris, BNP Paribas Asset Management Chief Market Strategist. For 2020 election results please visit: Election results: https://www.yahoo.com/elections Subscribe to Yahoo Finance: https://yhoo.it/2fGu5Bb About Yahoo Finance: At Yahoo Finance, you get free stock quotes, up-to-date news, portfolio management resources, international market data, social interaction and mortgage rates that help you manage your financial life.",Yahoo Finance,"Thu, 21 Jan 2021 12:03:16 -0500",,Positive,Video
