news_url,image_url,title,text,source_name,date,topics,sentiment,type
https://www.youtube.com/watch?v=KHMgGMgQFn8,https://cdn.snapi.dev/images/v1/m/q/bank-earnings-investment-banks-did-well-but-retail-banking-not-so-strong-opimas-ceo.jpg,Bank earnings: Investment banks did well but retail banking not so strong: Opimas CEO,"#bankearnings #bankstocks #YahooFinance Yahoo Finance's Alexis Christoforous and Octavio Marenzi, Opimas CEO, discuss bank earnings as the coronavirus pandemic continues to challenge the economy. For 2020 election results please visit: Election results: https://www.yahoo.com/elections Subscribe to Yahoo Finance: https://yhoo.it/2fGu5Bb About Yahoo Finance: At Yahoo Finance, you get free stock quotes, up-to-date news, portfolio management resources, international market data, social interaction and mortgage rates that help you manage your financial life.",Yahoo Finance,"Fri, 22 Jan 2021 23:44:29 -0500","earnings,CEO",Neutral,Video
https://www.youtube.com/watch?v=NU5OHzwKcFk,https://cdn.snapi.dev/images/v1/m/q/there-a-uniquely-bullish-backdrop-for-risk-taking-wells-fargo-cio.jpg,There a uniquely bullish backdrop for risk-taking: Wells Fargo CIO,"#investing #bullmarket #2021stocks Wells Fargo Wealth & Investment Management CIO Darrell Cronk joins Yahoo Finance's Adam Shapiro to discuss what investors should look for in the market For 2020 election results please visit: Election results: https://www.yahoo.com/elections Subscribe to Yahoo Finance: https://yhoo.it/2fGu5Bb About Yahoo Finance: At Yahoo Finance, you get free stock quotes, up-to-date news, portfolio management resources, international market data, social interaction and mortgage rates that help you manage your financial life. About Yahoo Finance Premium: With a subscription to Yahoo Finance Premium, get the tools you need to invest with confidence.",Yahoo Finance,"Fri, 22 Jan 2021 23:43:53 -0500",,Positive,Video
https://www.youtube.com/watch?v=R4vL3ufK_pU,https://cdn.snapi.dev/images/v1/m/q/2021-investing-outlook-stocks-to-watch-during-earning-season.jpg,2021 investing outlook: Stocks to watch during earning season,"#Apple #stockmarket #microsoft Keith Fitz-Gerald, Fitz-Gerald Group Chief Investment Officer, joins Yahoo Finance's Kristin Myers to break down the latest market action, and discuss what he's expecting from earnings season. For 2020 election results please visit: Election results: https://www.yahoo.com/elections Subscribe to Yahoo Finance: https://yhoo.it/2fGu5Bb About Yahoo Finance: At Yahoo Finance, you get free stock quotes, up-to-date news, portfolio management resources, international market data, social interaction and mortgage rates that help you manage your financial life.",Yahoo Finance,"Fri, 22 Jan 2021 23:37:07 -0500",,Positive,Video
https://www.youtube.com/watch?v=Wgpp03Q9YPw,https://cdn.snapi.dev/images/v1/z/9/were-in-a-secular-bull-market-and-nobody-believes-it-strategist.jpg,We're in a secular bull market and nobody believes it: Strategist,"Capital Wealth Planning Chief Market Strategist Jeff Saut joins Yahoo Finance's Zack Guzman to weigh in on how markets are faring, following Biden's inauguration. For 2020 election results please visit: Election results: https://www.yahoo.com/elections Subscribe to Yahoo Finance: https://yhoo.it/2fGu5Bb About Yahoo Finance: At Yahoo Finance, you get free stock quotes, up-to-date news, portfolio management resources, international market data, social interaction and mortgage rates that help you manage your financial life.",Yahoo Finance,"Fri, 22 Jan 2021 22:44:53 -0500",,Positive,Video
https://www.barrons.com/articles/28-stock-and-bond-picks-from-the-barrons-roundtable-51611370098,https://cdn.snapi.dev/images/v1/i/k/im-288626.jpg,28 Investment Picks to Beat the Market,"Barron's Roundtable members Rupal J. Bhansali, Scott Black, Mario Gabelli, and Sonal Desai share their top stock and bond recommendations for 2021.",Barrons,"Fri, 22 Jan 2021 21:48:00 -0500",paywall,Positive,Article
https://www.youtube.com/watch?v=Uuq3zYTSl4E,https://cdn.snapi.dev/images/v1/m/q/why-jim-cramer-says-hes-nervous-about-investors-chasing-the-trades-of-ark-invests-cathie-wood.jpg,Why Jim Cramer says he's nervous about investors chasing the trades of Ark Invest's Cathie Wood,"""Mad Money"" host Jim Cramer explains why he's concerned about investors trying to chase the trades made by Cathie Wood of ARK Invest.",CNBC Television,"Fri, 22 Jan 2021 21:28:29 -0500","cramer,madmoney",Negative,Video
https://www.youtube.com/watch?v=2btHX8vAfNM,https://cdn.snapi.dev/images/v1/w/b/summers-says-markets-will-survive-reddit-traders.jpg,Summers Says: Markets Will Survive Reddit Traders,"Jan.22 -- Former U.S. Treasury Secretary Lawrence H. Summers, a Wall Street Week contributor, says markets will survive the actions of Reddit-charged day traders, but regulations need to be more modern.",Bloomberg Markets and Finance,"Fri, 22 Jan 2021 20:59:01 -0500",,Positive,Video
https://www.youtube.com/watch?v=PSf9tz1P-Zs,https://cdn.snapi.dev/images/v1/6/m/there-are-micro-bubbles-in-the-market-sonders.jpg,There Are Micro Bubbles in the Market: Sonders,Jan.22 -- Charles Schwab Chief Investment Strategist Liz Ann Sonders says she sees micro bubbles in the market. She says that the froth coming from the retail investors piling into low-priced stocks is different from the bubble on the late 1990s to 2000s.,Bloomberg Markets and Finance,"Fri, 22 Jan 2021 20:41:13 -0500",,Negative,Video
https://www.barrons.com/articles/big-tech-stocks-are-back-whats-behind-the-nasdaqs-4-rally-51611364722,https://cdn.snapi.dev/images/v1/s/z/im-289416.jpg,Big Tech Stocks Are Back. What's Behind the Nasdaq's 4% Rally.,"Netflix, Apple, and the rest of the FAANGs helped lift the stock market this past week. What investors need to know.",Barrons,"Fri, 22 Jan 2021 20:18:00 -0500",paywall,Positive,Article
https://seekingalpha.com/article/4400530-markets-end-week-in-strong-shape-technically-speaking-for-week-of-1-18minus-1-22,https://cdn.snapi.dev/images/v1/q/z/what-do-the-dow-sp-nasdaq-and-russell-2000-charts-look-like-now.jpg,The Markets End The Week In Very Strong Shape (Technically Speaking For The Week Of 1/18-1/22),Most long-leading and coincidental indicators are positive. There is some weakness in the short-term indicators.,Seeking Alpha,"Fri, 22 Jan 2021 19:28:51 -0500","tanalysis,paylimitwall",Positive,Article
https://www.youtube.com/watch?v=808GRczanSc,https://cdn.snapi.dev/images/v1/n/y/cramers-week-ahead-earnings-from-apple-ge-and-more-will-offer-insight-into-us-business-strength.jpg,"Cramer's week ahead: Earnings from Apple, GE and more will offer insight into U.S. business strength","""Mad Money"" host Jim Cramer looks ahead to next week's Wall Street developments, which includes Apple's latest quarterly earnings report.",CNBC Television,"Fri, 22 Jan 2021 19:10:04 -0500","earnings,cramer,madmoney",Positive,Video
https://seekingalpha.com/article/4400524-smallest-bit-of-empathy-for-swollen-herd,https://cdn.snapi.dev/images/v1/v/e/106630005-1595532860080-gettyimages-1227707089-363421803-1-5.jpeg,The Smallest Bit Of Empathy For The Swollen Herd,"Unemployment aid isn't supposed to be permanent, however, since recoveries are believed to just happen; organic and symmetrical. Payments had to be extended because, for one big reason, the job-cutting didn't actually end until almost a year after the Great ""Recession"" was ""officially"" declared ended.",Seeking Alpha,"Fri, 22 Jan 2021 18:31:00 -0500",paylimitwall,Neutral,Article
https://www.youtube.com/watch?v=mLSatApO4O8,https://cdn.snapi.dev/images/v1/m/q/biden-resigned-the-us-to-the-global-paris-agreement-heres-a-look-at-what-it-means-for-investors.jpg,"Biden resigned the US to the Global Paris Agreement, here's a look at what it means for investors","#ParisAgreement #GreenEnergy #Biden Yahoo Finance's Sibile Marcellus looks at what the United States rejoining the Global Paris Agreement means for investors. For 2020 election results please visit: Election results: https://www.yahoo.com/elections Subscribe to Yahoo Finance: https://yhoo.it/2fGu5Bb About Yahoo Finance: At Yahoo Finance, you get free stock quotes, up-to-date news, portfolio management resources, international market data, social interaction and mortgage rates that help you manage your financial life.",Yahoo Finance,"Fri, 22 Jan 2021 18:10:08 -0500",Political,Neutral,Video
https://www.gurufocus.com/news/1338693/us-stocks-end-flat-again-friday,https://cdn.snapi.dev/images/v1/p/z/wedw322-6wdaea84k2.jpg,US Stocks End Flat Again Friday,"The Dow Jones Industrial Average closed at 30,996.98 on Friday with a loss of 179.03 points or -0.57%. The S&P 500 closed at 3,841.47 for a loss of 11.60 points or -0.30%.",GuruFocus,"Fri, 22 Jan 2021 17:22:11 -0500",,Neutral,Article
https://www.etftrends.com/model-portfolio-channel/u-s-quality-dividend-growth-2020-reconstitution/,https://cdn.snapi.dev/images/v1/u/s/us-quality-dividend-growth2020-reconstitution-440x250.jpg,U.S. Quality Dividend Growth—2020 Reconstitution,"By Alejandro Saltiel, CFA, Associate Director of Modern Alpha, WisdomTree Across the globe, quality stocks were among the best performers in 2020, as companies with high profitability maintained an earnings edge despite Covid-19's impact on the economy. The WisdomTree U.S. Quality Dividend Growth Fund (DGRW), which seeks to track the WisdomTree U.S. Quality Dividend Growth Index (WTDGI), selects companies [.",ETF Trends,"Fri, 22 Jan 2021 16:56:17 -0500",dividend,Positive,Article
https://www.barrons.com/articles/dow-jones-industrial-average-fell-as-fauci-warned-about-covid-mutations-51611352436,https://cdn.snapi.dev/images/v1/g/h/im-273323.jpg,The Dow Fell 179 Points Because Fauci Warned About Covid Mutations,"Coronavirus vaccinations look less effective against new strains, Dr. Anthony Fauci warned before the market opened. Stocks never had a chance.",Barrons,"Fri, 22 Jan 2021 16:55:00 -0500",paywall,Negative,Article
https://www.youtube.com/watch?v=qDqcQVsVsjY,https://cdn.snapi.dev/images/v1/z/3/vc-partner-mercedes-bent-on-retail-investing-themes-in-2021.jpg,VC partner Mercedes Bent on retail investing themes in 2021,"Mercedes Bent, Lightspeed Venture Partners, joins 'Closing Bell' to talk about millennial investing themes and how brands are tapping into what users are looking for when they invest in companies.",CNBC Television,"Fri, 22 Jan 2021 16:42:42 -0500",,Positive,Video
https://www.kiplinger.com/investing/stocks/602141/stock-market-today-012221-nasdaq-scratches-out-another-record-finish,https://cdn.snapi.dev/images/v1/d/x/stock-market-today-012221.jpg,Stock Market Today: Nasdaq Scratches Out Another Record Finish,"The Nasdaq came out of a mixed day with yet another fresh high. More interesting were Friday's moves by IBM, Intel and GameStop.",Kiplinger,"Fri, 22 Jan 2021 16:39:00 -0500",,Positive,Article
https://www.youtube.com/watch?v=85yYMaelJlM,https://cdn.snapi.dev/images/v1/r/6/victoria-fernandez-warns-there-may-be-pullback-in-us-equities.jpg,Victoria Fernandez warns there may be pullback in US equities,"Victoria Fernandez, Crossmark global investments chief market strategist, says uncertainty on whether the $1.9 trillion coronavirus plan may pass in Congress may create some consolidation and pullback in U.S. equities. She joins 'Closing Bell' to discuss.",CNBC Television,"Fri, 22 Jan 2021 16:38:58 -0500",,Negative,Video
https://www.youtube.com/watch?v=df0s5dhoi0U,https://cdn.snapi.dev/images/v1/m/q/how-bidens-stimulus-plan-could-impact-municipal-bonds.jpg,How Biden's Stimulus Plan Could Impact Municipal Bonds,"Jan.22 -- Nick Venditti, Wells Fargo Asset Management senior portfolio manager, discusses what the Biden administration's $1.9 trillion stimulus plan means for the municipal bond market. He speaks with Bloomberg's Taylor Riggs on ""Bloomberg Markets: The Close.",Bloomberg Markets and Finance,"Fri, 22 Jan 2021 16:25:15 -0500",Political,Negative,Video
https://www.youtube.com/watch?v=1mY-rbRKljU,https://cdn.snapi.dev/images/v1/m/q/loomis-sayles-vice-chair-fuss-on-inflation-credit-market.jpg,"Loomis Sayles Vice Chair Fuss on Inflation, Credit Market","Jan.22 -- Loomis Sayles & Co. Vice Chairman Dan Fuss discusses the outlook for U.S. inflation and the credit market with Bloomberg's Vonnie Quinn on ""Bloomberg Markets.""",Bloomberg Markets and Finance,"Fri, 22 Jan 2021 16:21:11 -0500",,Neutral,Video
https://www.reuters.com/article/us-usa-biden/biden-wields-executive-power-to-tackle-u-s-pandemic-economic-crisis-idUSKBN29R122,https://cdn.snapi.dev/images/v1/w/e/m02d20210122t2i1548763539w940fhfwllplsqrlynxmpeh0l1hm.jpg,Biden wields executive power to tackle U.S. pandemic economic crisis,"U.S. President Joe Biden on Friday ordered the faster issuance of pandemic stimulus checks to needy families and increased food aid for children who normally rely on school meals, an effort to ease Americans' burdens while Congress negotiates over his proposed $1.9 trillion economic stimulus package.",Reuters,"Fri, 22 Jan 2021 16:21:00 -0500",Political,Neutral,Article
https://www.youtube.com/watch?v=A_OiZto2Aq0,https://cdn.snapi.dev/images/v1/m/q/biden-if-we-act-now-our-economy-will-be-better-stronger.jpg,"Biden: If we act now our economy will be better, stronger","President Joe Biden announced he's signing two new executive orders to address the economic crisis. His orders include boosting food assistance, SNAP allotments, allowing workers to forgo working in unsafe workplaces, and increasing the minimum wage to $15 dollars.",CNBC Television,"Fri, 22 Jan 2021 16:04:43 -0500",Political,Neutral,Video
https://www.marketwatch.com/story/nasdaq-sets-new-record-as-stocks-hold-onto-weekly-gains-2021-01-22,https://cdn.snapi.dev/images/v1/x/k/103905600-gettyimages-94868577-nuegmzzwyp.jpg,Nasdaq sets new record as stocks hold onto weekly gains,"Stocks ended mixed on Friday, but managed to cling to weekly gains as investors eyed the economic impact of COVID-19 restrictions in Europe. The S&P 500 fell 0.3% to 3,841.",Market Watch,"Fri, 22 Jan 2021 16:04:07 -0500",paylimitwall,Positive,Article
https://www.youtube.com/watch?v=R2-lCKtky_0,https://cdn.snapi.dev/images/v1/m/q/jeremy-siegel-expects-higher-inflation-which-will-hurt-bond-holders.jpg,"Jeremy Siegel expects higher inflation, which will hurt bond holders","Jeremy Siegel, Wharton finance professor, says the Fed has poured a tremendous amount of money into the economy in response to the pandemic, which will eventually cause higher inflation and hurt bond holders. David Rosenberg of Rosenberg Research joins discussion on whether there will be higher inflation in 2021.",CNBC Television,"Fri, 22 Jan 2021 16:03:33 -0500",,Negative,Video
https://markets.businessinsider.com/news/stocks/stock-market-news-today-wrap-gamestop-price-short-stimulus-coronavirus-economy-1029995326,https://cdn.snapi.dev/images/v1/s/p/sp-500-falls-for-the-first-time-this-week-as-us-stocks-edge-lower.jpg,S&P 500 falls for the first time this week as US stocks edge lower,"US equities fell on Friday after closing at all-time highs, as investors weighed the outlook for Biden's nearly $2 trillion stimulus bill and grew concerned amid reports the new coronavirus strain may be deadlier. The S&P 500 fell for the first time this week.  There is some evidence the new variant of the coronavirus first identified in the UK may be up to 30% more deadly than previous variants, the UK government has said.",Business Insider,"Fri, 22 Jan 2021 16:02:52 -0500",paylimitwall,Negative,Article
https://www.forbes.com/sites/investor/2021/01/22/the-major-equity-averages-reached-risky-levels-heres-what-you-need-to-know/,https://cdn.snapi.dev/images/v1/t/h/the-major-equity-averages-reached-risky-levels-heres-what-you-need-to-know.jpg,The Major Equity Averages Reached Risky Levels. Here's What You Need To Know.,The major equity averages set all-time highs between January 14 and January 21,Forbes,"Fri, 22 Jan 2021 15:50:52 -0500",paylimitwall,Negative,Article
https://www.zacks.com/commentary/1250712/q4-and-2021-earnings-estimates-keep-going-up,https://cdn.snapi.dev/images/v1/t/g/computer-electronic36.jpg,Q4 and 2021 Earnings Estimates Keep Going Up,"We are off to a great start in the Q4 earnings season, with a historically high proportion of the reporting companies not only beating consensus EPS and revenue estimates, but also providing positive and reassuring guidance and commentary about the current and coming periods. This is helping sustain the positive revisions trend that has been in place since July 2020, as the chart below shows.",Zacks Investment Research,"Fri, 22 Jan 2021 15:48:05 -0500",earnings,Positive,Article
https://www.youtube.com/watch?v=_KgFRiL_rnQ,https://cdn.snapi.dev/images/v1/m/q/china-stock-bans-what-investors-need-to-know.jpg,China Stock Bans: What Investors Need To Know,"After some back and forth, three Chinese state-owned companies were booted off the New York Stock Exchange on Jan. 11 based on an executive order signed by President Donald Trump last November. KraneShares CIO Brendan Ahern breaks down the latest news and what investors need to know about the China stock bans.",Investors Business Daily,"Fri, 22 Jan 2021 15:41:03 -0500",,Negative,Video
https://www.marketwatch.com/story/stock-market-legend-sees-few-weeks-of-putting-your-last-desperate-chips-into-the-gamethen-pop-11611347617,https://cdn.snapi.dev/images/v1/z/h/im-289325width620size14988290398126465.jpg,"Key Words: Stock-market legend sees few weeks of ‘putting your last, desperate chips into the game'—then pop","In an interview with Bloomberg TV's “Front Row,” the storied investor, Jeremy Grantham, who is often credited with several prescient market calls over the past two decades, insists that a steady rise in stocks, fostered by free money from the Federal Reserve and the government can't continue without consequences.",Market Watch,"Fri, 22 Jan 2021 15:33:00 -0500",paylimitwall,Negative,Article
https://seekingalpha.com/article/4400461-time-preference-interest-rates-and-stagflation,https://cdn.snapi.dev/images/v1/l/c/shorth12-jtiplsjkor.jpg,"Time Preference, Interest Rates, And Stagflation",The central bank influences the short-term interest rates by influencing monetary liquidity in the markets. Increases in real wealth tend to lower individuals' time preferences whereas decreases in real wealth tend to raise them.,Seeking Alpha,"Fri, 22 Jan 2021 15:13:42 -0500",paylimitwall,Neutral,Article
https://www.schaeffersresearch.com/content/news/2021/01/22/inauguration-week-marked-by-record-highs,https://cdn.snapi.dev/images/v1/u/s/us-stocks-set-to-pull-back-from-record-highs-as-covid-and-economic-worries-come-to-the-fore---ss6nsx2e4u.jpg,Inauguration Week Marked by Record Highs,"Coming off last week's losses, it has been a positive holiday-shortened week for the major indexes.",Schaeffers Research,"Fri, 22 Jan 2021 14:40:03 -0500",,Positive,Article
https://www.fool.com/investing/general/the-100-things-ive-learned-in-investing/,https://cdn.snapi.dev/images/v1/9/c/urlhttps3a2f2fgfoolcdncom2feditorial2fimages2f2695142f100-lessons-investingjpgw700opresize.jpg,The 100 Things I've Learned in Investing,Please learn from my mistakes!,The Motley Fool,"Fri, 22 Jan 2021 14:22:00 -0500",,Neutral,Article
https://www.cnn.com/2021/01/22/success/existing-home-sales-december-2020/index.html,https://cdn.snapi.dev/images/v1/f/w/210122113741-us-home-for-sale-1208-super-169.jpg,"Home sales hit 14-year high in 2020, pushing prices to record levels","Last year brought skyrocketing unemployment and a global pandemic that battered the economy, but people were still buying homes. Existing home sales in 2020 rose to the highest level in 14 years as prices climbed to a record high.",CNN Business,"Fri, 22 Jan 2021 14:19:37 -0500",,Positive,Article
https://seekingalpha.com/article/4400441-federal-reserve-watch-fed-keeps-things-steady,https://cdn.snapi.dev/images/v1/o/f/im-244305width620size15041128084606346.jpg,Federal Reserve Watch: Fed Keeps Things Steady,"The Federal Reserve continues to purchase open-market securities outright as it attempts to support the economic recovery and get inflation moving at a faster rate. Through its actions over the past year, there seems to be plenty of liquidity in the banking sector and in the corporate sector, keeping short-term interest rates low.",Seeking Alpha,"Fri, 22 Jan 2021 14:18:26 -0500",paylimitwall,Positive,Article
https://www.marketwatch.com/story/junk-bonds-off-to-record-start-in-2021-as-goldman-sees-low-chance-of-higher-rates-that-kill-the-business-cycle-11611343033,https://cdn.snapi.dev/images/v1/t/h/the-sp-500-will-jump-another-8-but-looming-risks-could-spark-a-sudden-pullback-rbc-says---cfzkpezf4m.jpg,In One Chart: Junk bonds off to record start in 2021 as Goldman sees low chance of higher rates that ‘kill the business cycle',"U.S. companies with 'junk,' or below investment-grade ratings, are borrowing in the bond market at a record clip to start 2021, defying concerns that trillions worth of pandemic aid for the economy could lead to higher borrowing costs that end the business cycle.",Market Watch,"Fri, 22 Jan 2021 14:17:00 -0500",paylimitwall,Positive,Article
https://www.cnn.com/2021/01/22/investing/stocks-biden-harris-moderates/index.html,https://cdn.snapi.dev/images/v1/t/e/210122051657-03-joe-biden-0121-super-169.jpg,"Wall Street can relax, moderates have the mandate",Stocks have surged since Election Day and are near record highs. Wall Street is clearly a fan of President Joe Biden's new administration -- and it's largely because of growing hope that moderates in both parties will continue to call the shots.,CNN Business,"Fri, 22 Jan 2021 13:49:38 -0500",,Positive,Article
https://www.reuters.com/article/us-usa-stocks-weekahead/tech-shares-could-retake-market-reins-as-earnings-heat-up-idUSKBN29R2BI,https://cdn.snapi.dev/images/v1/m/0/m02d20210122t2i1548745046w940fhfwllplsqrlynxmpeh0l1bs.jpg,Tech shares could retake market reins as earnings heat up,"A bevy of major U.S. earnings reports next week led by Apple, Microsoft and Facebook could help technology and growth stocks reassert their dominance after a recent run by banks, energy and other potential beneficiaries of an economic reopening.",Reuters,"Fri, 22 Jan 2021 13:02:00 -0500",earnings,Positive,Article
https://www.youtube.com/watch?v=mL31He8VIkk,https://cdn.snapi.dev/images/v1/m/q/fund-flows-show-lack-of-market-froth-bnps-morris-says.jpg,"Fund Flows Show Lack of Market Froth, BNP's Morris Says","Jan.22 -- Daniel Morris, senior investment strategist at BNP Paribas Asset Management, discusses what fund flows are signaling about equity markets. He speaks with Bloomberg's Tom Keene on “Bloomberg Surveillance.",Bloomberg Markets and Finance,"Fri, 22 Jan 2021 12:42:46 -0500",,Neutral,Video
https://www.youtube.com/watch?v=ApN_3XKQkNg,https://cdn.snapi.dev/images/v1/m/q/why-bank-of-america-private-banks-cio-expects-robust-economic-recovery.jpg,Why Bank of America Private Bank's CIO expects 'robust economic recovery',"CNBC's ""Halftime Report"" discusses whether a bull market can continue, opportunity costs in equities and more with Chris Hyzy, chief investment officer at Merrill and Bank of America Private Bank.",CNBC Television,"Fri, 22 Jan 2021 12:42:39 -0500",,Positive,Video
https://www.youtube.com/watch?v=7RV6eZSQoYE,https://cdn.snapi.dev/images/v1/m/q/grantham-sees-bubble-signal-in-huge-penny-stock-volumes.jpg,Grantham Sees Bubble Signal in Huge Penny-Stock Volumes,"Jan.22 -- Jeremy Grantham, co-founder and chief investment strategist of Boston's GMO, points to the trillions of shares traded in penny stocks as the kind of “crazy behavior” indicative of a bubble top in the equity market. He also discusses investors' misplaced faith in monetary stimulus.",Bloomberg Markets and Finance,"Fri, 22 Jan 2021 12:42:17 -0500",,Negative,Video
https://www.youtube.com/watch?v=y9PVSUAi_bs,https://cdn.snapi.dev/images/v1/o/z/why-most-of-the-halftime-traders-are-expecting-a-market-pullback.jpg,Why most of the 'Halftime' traders are expecting a market pullback,"CNBC's ""Halftime Report"" team discuss why some of them are anticipating  a market pullback and how they're investing right now. For access to live and exclusive video from CNBC subscribe to CNBC PRO: https://cnb.cx/2NGeIvi U.S. stocks fell slightly on Friday, retreating from record levels, as the market is set to end the strong week with modest losses.",CNBC Television,"Fri, 22 Jan 2021 12:31:35 -0500",,Negative,Video
https://www.youtube.com/watch?v=9NofJ33NAPs,https://cdn.snapi.dev/images/v1/m/q/bumbles-strategy-is-empowering-but-could-be-limiting-wsjs-forman.jpg,"Bumble's strategy is empowering, but could be limiting: WSJ's Forman","Laura Forman of the Wall Street Journal joins ""Squawk Alley"" to discuss Bumble's business strategy ahead of its IPO. For access to live and exclusive video from CNBC subscribe to CNBC PRO: https://cnb.cx/2NGeIvi » Subscribe to CNBC TV: https://cnb.cx/SubscribeCNBCtelevision » Subscribe to CNBC: https://cnb.cx/SubscribeCNBC » Subscribe to CNBC Classic: https://cnb.cx/SubscribeCNBCclassic Turn to CNBC TV for the latest stock market news and analysis.",CNBC Television,"Fri, 22 Jan 2021 12:31:22 -0500",,Neutral,Video
