news_url,image_url,title,text,source_name,date,topics,sentiment,type
https://www.businessinsider.com/us-business-activity-climbs-ihs-markit-flash-pmi-economic-recovery-2021-1,https://cdn.snapi.dev/images/v1/u/s/us-business-activity-picks-up-as-manufacturing-gauge-hits-record-high-ihs-markit-says.jpg,"US business activity picks up as manufacturing gauge hits record high, IHS Markit says","A key gauge of US business activity swung higher this month as strong demand lifted manufacturers and service businesses alike. IHS Markit's composite output index climbed to 58 from 55.3 in an early January reading, hitting its highest level in two months. The firm's index of service-industry business activity improved to 57.5 from 54.8, while its purchasing managers' index for manufacturers leaped to a record high of 59.1 from 57.1.",Business Insider,"Fri, 22 Jan 2021 12:25:27 -0500",paylimitwall,Positive,Article
https://www.businessinsider.com/stock-market-outlook-bubble-fueled-by-dc-policies-bofa-warns-2021-1,https://cdn.snapi.dev/images/v1/t/h/the-stock-market-is-in-a-bubble-that-is-being-fueled-by-the-policies-out-of-dc-bofa-warns.jpg,"The stock market is in a bubble that is being fueled by the policies out of DC, BofA warns","The stock market is in a bubble that is being fueled by the policies out of Washington D.C., Bank of America said in a note on Friday. ""DC's policy bubble [is] fueling Wall St's asset bubble,"" BofA said, adding that a rise in inflation and interest rates could be on the horizon.",Business Insider,"Fri, 22 Jan 2021 12:06:07 -0500",paylimitwall,Negative,Article
https://www.youtube.com/watch?v=ekNocVHJIvI,https://cdn.snapi.dev/images/v1/j/x/grantham-says-stock-prices-reveal-folly-of-fed-policy.jpg,Grantham Says Stock Prices Reveal Folly of Fed Policy,"Jan.22 -- GMO co-founder and Chief Investment Strategist Jeremy Grantham criticizes the Federal Reserve for pursuing policies that produced a state of “mild hysteria” in stocks, not the hoped-for improvements in economic output and productivity. He spoke exclusively to Erik Schatzker on Bloomberg's “Front Row.",Bloomberg Markets and Finance,"Fri, 22 Jan 2021 12:02:14 -0500",,Negative,Video
https://www.youtube.com/watch?v=GPeE7QG10B8,https://cdn.snapi.dev/images/v1/m/q/biden-to-sign-executive-order-on-covid-19-relief.jpg,Biden to sign executive order on COVID-19 relief,"President Joe Biden will sign two executive orders Friday, one on COVID-19 relief and another on workers' protections. #FoxBusiness Subscribe to Fox Business!",Fox Business,"Fri, 22 Jan 2021 12:00:06 -0500",Political,Positive,Video
https://www.investopedia.com/2020-was-a-rough-year-for-short-sellers-5097042,https://cdn.snapi.dev/images/v1/g/e/gettyimages-1064571022-e659a191c52d43be8d83f33514daad60.jpg,2020 Was a Rough Year for Short Sellers,"As stocks rose on retail investor-fueled euphoria, short sellers faced with mounting losses and high borrowing fees were forced to close their positions and buy.",Investopedia,"Fri, 22 Jan 2021 11:35:35 -0500",,Positive,Article
https://www.barrons.com/articles/stocks-ignore-tax-hikes-that-are-likely-after-pandemic-ends-51611333358,https://cdn.snapi.dev/images/v1/i/m/im-250653.jpg,Stocks Ignore Tax Hikes That Are Likely After Pandemic Ends,"Higher levies on corporate earnings and investors' dividends and capital gains could be in the mix, along with curbs on share buybacks.",Barrons,"Fri, 22 Jan 2021 11:35:00 -0500",paywall,Neutral,Article
https://www.youtube.com/watch?v=WDEd4VQWu8k,https://cdn.snapi.dev/images/v1/q/x/existing-home-sales-data-shows-a-rise-in-december-capping-off-the-best-year-since-2006.jpg,Existing home sales data shows a rise in December capping off the best year since 2006,"#homessales #realestate #homesales Yahoo Finance's Julie Hyman and Myles Udland report on the rise in existing home sales, strong demand and lack of supply. For 2020 election results please visit: Election results: https://www.yahoo.com/elections Subscribe to Yahoo Finance: https://yhoo.it/2fGu5Bb About Yahoo Finance: At Yahoo Finance, you get free stock quotes, up-to-date news, portfolio management resources, international market data, social interaction and mortgage rates that help you manage your financial life.",Yahoo Finance,"Fri, 22 Jan 2021 11:27:10 -0500",earnings,Positive,Video
