news_url,image_url,title,text,source_name,date,topics,sentiment,type
https://www.forbes.com/sites/judeclemente/2021/02/14/is-the-anti-oil-movement-installing-the-next-recession/,https://cdn.snapi.dev/images/v1/i/s/is-the-anti-oil-movement-installing-the-next-recession.jpg,Is The Anti-Oil Movement Installing The Next Recession?,"From politicians to environmental groups to some on Wall Street demanding ESG at all costs, it seems everywhere we turn we are being told that new investment in oil and natural gas is simply not needed. Reality check: nothing could be further from the truth.",Forbes,"Sun, 14 Feb 2021 19:14:13 -0500","oil,paylimitwall",Negative,Article
https://www.youtube.com/watch?v=x-ltQECFlL0,https://cdn.snapi.dev/images/v1/m/q/stocks-theres-room-for-earnings-to-improve-but-the-labor-market-is-a-risk-near-term-strategist.jpg,Stocks: There's room for earnings to improve... but the labor market is a risk near term: Strategist,"This segment originally aired on February 12, 2021. Yahoo Finance's Adam Shapiro and Seana Smith spoke with U.S. Bank Wealth Management Sr. Investment Strategist, Rob Haworth about the outlook for stocks, jobs, and the economy in 2021.",Yahoo Finance,"Sun, 14 Feb 2021 17:03:44 -0500",earnings,Neutral,Video
https://seekingalpha.com/article/4406074-markets-remain-firmly-bullish-technically-speaking-for-week-of-2-8minus-2-12,https://cdn.snapi.dev/images/v1/b/t/what-do-the-dow-sp-nasdaq-and-russell-2000-charts-look-like-now.jpg,The Markets Remain Firmly Bullish (Technically Speaking For The Week Of 2/8-2/12),The labor market is still very soft. The indexes performed well last week.,Seeking Alpha,"Sun, 14 Feb 2021 16:06:21 -0500","tanalysis,paylimitwall",Positive,Article
https://seekingalpha.com/article/4406068-struggling-with-the-pandemic-and-brexit-in-the-uk,https://cdn.snapi.dev/images/v1/l/x/106630005-1595532860080-gettyimages-1227707089-363421803-1-5.jpeg,Struggling With The Pandemic And Brexit In The U.K.,"The UK did not manage the pandemic well last year, with the result that the UK has had more COVID deaths than any other European country and the highest death rate, 164.2 per 100,000 people. The new virus strain and the strict third national lockdown have clearly reduced the momentum of the UK economy.",Seeking Alpha,"Sun, 14 Feb 2021 15:37:24 -0500",paylimitwall,Negative,Article
https://seekingalpha.com/article/4406065-an-outstanding-performance-q4-earnings-season-shattering-expectations,https://cdn.snapi.dev/images/v1/6/k/wedw322-6wdaea84k2.jpg,An Outstanding Performance: Q4 Earnings Season Shattering Expectations,"Powell signals Fed to remain in accommodative stance. Surpassing expectations, and then some: Impressive Q4 earnings to-date.",Seeking Alpha,"Sun, 14 Feb 2021 15:24:27 -0500","earnings,paylimitwall",Positive,Article
https://seekingalpha.com/article/4406063-the-human-ups-and-downs-of-market-mania,https://cdn.snapi.dev/images/v1/o/w/software27-2.jpg,The Human Ups And Downs Of Market Mania,"In the midst of manic market cycles, it is very human for one to imagine in retrospect where one ""could have bought"" and ""should have sold."" In reality, speculation is much more complicated, attention diverting, peace-destructive, and financially dangerous for individuals than commonly understood.",Seeking Alpha,"Sun, 14 Feb 2021 15:16:45 -0500",paylimitwall,Neutral,Article
https://seekingalpha.com/article/4406060-weakening-economic-expectations-pull-down-consumer-sentiment,https://cdn.snapi.dev/images/v1/q/9/103905600-gettyimages-94868577-nuegmzzwyp.jpg,Weakening Economic Expectations Pull Down Consumer Sentiment,The preliminary February results from the University of Michigan Surveys of Consumers show overall consumer sentiment fell in early February and remains well below pre-lockdown levels. Overall consumer sentiment decreased to 76.2 in early February.,Seeking Alpha,"Sun, 14 Feb 2021 14:35:52 -0500",paylimitwall,Negative,Article
https://seekingalpha.com/article/4406056-week-ahead-cause-for-optimism,https://cdn.snapi.dev/images/v1/u/5/markets-covid-2020.jpg,Week Ahead - Cause For Optimism,Investors are growing increasingly hopeful about the economic outlook and next week's PMIs will tell us whether businesses share their optimism. Central bank minutes will also provide more insight into whether policy makers are encouraged and what it means for monetary policy.,Seeking Alpha,"Sun, 14 Feb 2021 14:19:40 -0500",paylimitwall,Positive,Article
https://invezz.com/news/2021/02/14/dow-jones-sp-500-and-nasdaq-closed-at-record-highs-here-are-the-next-targets/,https://cdn.snapi.dev/images/v1/a/g/imagedetail-ced128e6-c046-48d3-9ded-430a0a34ded4-large.jpg,"Dow Jones, S&P 500, and Nasdaq closed at record highs. Here are the next targets",The U.S. stock market advanced last week as investors remain optimistic about the large U.S. stimulus package. The S&P 500 and the Nasdaq set record closing highs on Friday while the Dow Jones did earlier in the week.,Invezz,"Sun, 14 Feb 2021 14:15:24 -0500",,Positive,Article
https://seekingalpha.com/article/4406053-5-closed-end-fund-buys-get-income-snowball-rolling-2021,https://cdn.snapi.dev/images/v1/1/8/aaad1.jpg,5 Closed-End Fund Buys To Get The Income Snowball Rolling For 2021,"Markets remained quite lofty, though later in January we got some volatility to spice things up. Overall, still holding a considerable cash position to take advantage of any market correction when it comes.",Seeking Alpha,"Sun, 14 Feb 2021 14:00:34 -0500",paylimitwall,Positive,Article
https://www.barrons.com/articles/roku-walmart-palantir-and-other-stocks-to-watch-this-week-51613242647,https://cdn.snapi.dev/images/v1/t/q/im-289564.jpg,"Roku, Walmart, Palantir, and Other Stocks to Watch This Week","The market is closed on Monday. Then, earnings season continues with results from Walmart, Occidental, Palantir, Roku, CVS, Shopify, Newmont, and many more.",Barrons,"Sun, 14 Feb 2021 14:00:00 -0500",paywall,Positive,Article
https://www.seeitmarket.com/sp-500-nears-inflection-point-as-volatility-stirs/,https://cdn.snapi.dev/images/v1/g/t/how-to-trade-dow-industrials-sp-500-nasdaq-dow-transports-and-russell-2000.jpg,S&P 500 Nears Inflection Point as Volatility Stirs,"The markets should peak soon. I am eyeing February 18-19, as the S&P 500 Index and NASDAQ Composite still could push a bit higher to satisfy daily Demark counts.",See It Market,"Sun, 14 Feb 2021 13:06:37 -0500",,Positive,Article
https://www.cnbc.com/2021/02/14/why-wall-street-banker-thinks-flying-taxis-will-replace-helicopters.html,https://cdn.snapi.dev/images/v1/p/g/106838318-1612961233063-20-222-arch-aircraft-03-interiora-comp04-ste-qc-jm.jpg,Why one big Wall Street banker is betting flying taxis will replace helicopters,Electric aircraft maker Archer Air has a deal with United Airlines and plans to be flying by 2024. Wall Street's Ken Moelis says it can replace helicopters.,CNBC,"Sun, 14 Feb 2021 10:48:16 -0500",,Neutral,Article
https://www.cnn.com/2021/02/14/investing/stocks-to-love/index.html,https://cdn.snapi.dev/images/v1/2/1/210212114740-02-google-ny-offices-1020-file-super-169.jpg,Want solid returns you can depend on? Here are stocks we love,"People are obsessed lately with trying to find a way to get rich quick through short-term trades. Just look at bitcoin, GameStop or cannabis stocks.",CNN Business,"Sun, 14 Feb 2021 10:39:40 -0500",,Positive,Article
https://www.cnn.com/2021/02/14/investing/stocks-week-ahead/index.html,https://cdn.snapi.dev/images/v1/2/1/210212075346-heathrow-airport-england-0117-super-169.jpg,'We don't see a clear exit strategy',"When the coronavirus pandemic erupted in early 2020, the ensuing border closures and stay-at-home orders brought travel and tourism to its knees. One year on, governments are using the same playbook, inflicting more pain on a sector that accounts for 10% of global GDP and a similar share of jobs.",CNN Business,"Sun, 14 Feb 2021 09:39:36 -0500",,Negative,Article
https://seekingalpha.com/article/4405792-managing-risk-how-to-rebalance-your-portfolio,https://cdn.snapi.dev/images/v1/k/h/etf36.jpg,Managing Risk: How To Rebalance Your Portfolio,A common mistake for investors to make is to bet too much of their portfolio on a handful of stocks. Diversification is essential to protecting your hard-earned money.,Seeking Alpha,"Sun, 14 Feb 2021 09:35:00 -0500",paylimitwall,Neutral,Article
https://seekingalpha.com/article/4405847-why-dividend-cuts-can-be-good-thing-for-investors,https://cdn.snapi.dev/images/v1/e/t/103905600-gettyimages-94868577-nuegmzzwyp.jpg,Why Dividend Cuts Can Be A Good Thing For Investors,"Dividends offer several benefits to companies and shareholders, and dividend-paying companies tend to outperform. However, sometimes a dividend cut can be a wise decision that increases a company's value.",Seeking Alpha,"Sun, 14 Feb 2021 09:00:00 -0500","dividend,paylimitwall",Neutral,Article
https://seekingalpha.com/article/4406038-dividend-increases-january-30-february-5-2021,https://cdn.snapi.dev/images/v1/n/p/bank44.jpg,"Dividend Increases: January 30-February 5, 2021",This weekly article series provides a summary of dividend changes. A table with relevant data and key statistics of dividend increases is provided.,Seeking Alpha,"Sun, 14 Feb 2021 09:00:00 -0500","dividend,paylimitwall",Positive,Article
https://markets.businessinsider.com/news/stocks/stock-market-outlook-consumer-confidence-recovery-rally-strategy-paulsen-leuthold-2021-2-1030080328,https://cdn.snapi.dev/images/v1/m/0/m02d20210212t2i1551385370w940fhfwllplsqrlynxmpeh1b1t1.jpg,"The record-setting stock market has further upside ahead with depressed consumer confidence spring-loaded for a recovery, says a Wall Street chief strategist","The stock market's next leg up will have more to do with Main Street optimism than Wall Street bullishness, according to James Paulsen, the chief investment strategist at The Leuthold Group. Stocks wavered near all-time highs to close out the week as investors weighed stretched valuations against hopes for economic recovery. The surge to fresh records has led some to grow increasingly worried that a market correction will come later in the year as investor bullishness reaches a fever pitch.",Business Insider,"Sun, 14 Feb 2021 08:55:00 -0500",paylimitwall,Positive,Article
https://markets.businessinsider.com/news/stocks/stock-market-outlook-vix-decline-suggests-more-upside-ahead-fundstrat-2021-2-1030080319,https://cdn.snapi.dev/images/v1/s/t/stock-market-today-021221.jpg,"Wall Street's fear index is on the verge of closing below a key level that signals more upside ahead for the stock market, Fundstrat says","There's more upside ahead for the stock market if Wall Street's fear index continues its decline below a key level, Fundstrat's Tom Lee said in a note on Friday. The CBOE Volatility index, known as the VIX, helps gauge the level of fear among investors and recently traded at 20.55 Friday afternoon. If the index manages to fall below the 20 level, it would be a bullish signal for stocks, according to Lee.",Business Insider,"Sun, 14 Feb 2021 08:30:00 -0500",paylimitwall,Positive,Article
https://seekingalpha.com/article/4406016-monthly-review-divgro-january-2021,https://cdn.snapi.dev/images/v1/x/v/food3.jpg,Monthly Review Of DivGro: January 2021,"My monthly review of DivGro provides a summary of transactions and explains how those transactions affect projected annual dividend income. DivGro is my portfolio of dividend growth stocks. In January, I didn't add to or open any positions. However, I reduced the size of one existing position and closed another position. DivGro now contains 89 different positions.",Seeking Alpha,"Sun, 14 Feb 2021 08:10:10 -0500",paylimitwall,Neutral,Article
https://www.fool.com/investing/2021/02/14/diamonds-are-forever-and-so-are-these-500-stocks/,https://cdn.snapi.dev/images/v1/u/q/snsy23.jpg,"Diamonds Are Forever, and So Are These 500 Stocks",These stocks are the investment of a lifetime.,The Motley Fool,"Sun, 14 Feb 2021 07:29:00 -0500",,Neutral,Article
https://seekingalpha.com/article/4406009-week-7-mda-breakout-stocks-february-2021-short-term-picks-to-give-you-edge,https://cdn.snapi.dev/images/v1/c/y/the-mirage-within-the-market-a-current-snapshot.jpg,Week 7 MDA Breakout Stocks - February 2021: Short-Term Picks To Give You An Edge,Two new breakout stocks for Week 7 of 2021 with better than 10% short-term upside potential. This past week all 4 picks gained over 10% with peak average gains of +17.4% before pulling back midweek to close with +13.7% one week returns.,Seeking Alpha,"Sun, 14 Feb 2021 07:26:21 -0500",paylimitwall,Neutral,Article
https://seekingalpha.com/article/4406006-weekly-commentary-the-short-but-momentous-history-of-fed-qe,https://cdn.snapi.dev/images/v1/i/5/aaedd2.jpg,Weekly Commentary: The Short But Momentous History Of Fed QE,"Central banking traditionally operated as a judicious and conservative institution, with an overarching mandate focused on promoting monetary and financial stability. The world is now in the throes of history's greatest experiment in central bank doctrine and operations.",Seeking Alpha,"Sun, 14 Feb 2021 07:08:54 -0500",paylimitwall,Neutral,Article
https://seekingalpha.com/article/4405999-speculative-mania-continues-as-it-goes-up-in-smoke,https://cdn.snapi.dev/images/v1/e/o/m02d20200928t2i1535196174w940fhfwllplsqrlynxmpeg8r11p.jpg,Speculative Mania Continues As It 'Goes Up In Smoke',"With the money flow signals still positive, the overall bias to the market remains bullish for now. However, the rally is still at risk currently, given the more extreme overbought and bullish conditions.",Seeking Alpha,"Sun, 14 Feb 2021 06:19:44 -0500",paylimitwall,Negative,Article
https://seekingalpha.com/article/4405995-top-stocks-earnings-beats-history,https://cdn.snapi.dev/images/v1/1/6/1613150502-shutterstock-391056130---0i0yj4iyz7.jpg,These Top Stocks Have A History Of Beating Earnings Estimates,Presented are the top-ranked stocks in our research that have beat analyst earnings estimates in each of the past four quarters. High-scoring stocks with a track record of beating on earnings can provide a great hunting ground for new stock ideas.,Seeking Alpha,"Sun, 14 Feb 2021 05:54:43 -0500","earnings,paylimitwall",Positive,Article
https://seekingalpha.com/article/4405986-the-algebra-of-wealth,https://cdn.snapi.dev/images/v1/f/1/sdw212w-2.jpg,The Algebra Of Wealth,"This post is about how to rebel against the algebra of wealth, or… how to get rich. It's not your income, but your income-to-expense ratio, that determines if you're rich.",Seeking Alpha,"Sun, 14 Feb 2021 03:44:52 -0500",paylimitwall,Neutral,Article
https://seekingalpha.com/article/4405983-weighing-week-ahead-letter-from-mr-market,https://cdn.snapi.dev/images/v1/x/w/sikdjd2.jpg,Weighing The Week Ahead: A Letter From Mr. Market,"We face a big economic calendar and only four days for data digestion. Market participants will not be troubled, since they have shown little appetite for economic data.",Seeking Alpha,"Sun, 14 Feb 2021 03:06:28 -0500",paylimitwall,Neutral,Article
https://seekingalpha.com/article/4405982-bull-bear-spread-spiking,https://cdn.snapi.dev/images/v1/p/y/despite-flood-of-dramatic-headlines-market-continues-heading-higher-and-shrugging-off-worries.jpg,Bull-Bear Spread Spiking,Sentiment has understandably followed price action. The percentage of investors reporting as bullish in the AAII's weekly survey has risen to 45.5% from 37.4% this week.,Seeking Alpha,"Sun, 14 Feb 2021 03:01:16 -0500",paylimitwall,Neutral,Article
