news_url,image_url,title,text,source_name,date,topics,sentiment,type
https://www.cnbc.com/2019/06/06/goldman-sachs-and-ubs-execs-markets-are-overpricing-fed-rate-cuts.html,https://cdn.snapi.dev/images/v1/3/c/105802039-1553007636265rts2dtjq.jpg,Goldman Sachs and UBS execs warn: Markets are 'overpricing' Fed rate cuts,"The financial markets are getting too far ahead on expectations for potential for Federal Reserve rate cuts, according to a pair of top global bankers at UBS and Goldman Sachs.",CNBC,"Wed, 05 Jun 2019 23:56:00 -0400",,Neutral,Article
https://techcrunch.com/2019/06/05/didi-chile-colombia-latin-america/,https://cdn.snapi.dev/images/v1/d/i/didi4jpegw572.jpg,China’s Didi kicks off Latin America expansion with moves into Chile and Colombia,"The wheels are turning on Didi Chuxing’s first major expansion in Latin America after the Chinese ride-hailing firm announced moves into Chile and Colombia to double its presence in the region. Didi said it rolled into Valparaiso, Chile’s third largest metropolis, and Colombian capital city Bogota this week.",TechCrunch,"Wed, 05 Jun 2019 23:17:02 -0400",,Positive,Article
https://www.cnbc.com/2019/06/06/push-for-us-listed-china-firms-to-comply-with-financial-oversight.html,https://cdn.snapi.dev/images/v1/1/0-2/105951503-1559786865633gettyimages-1133267607.jpeg,Lawmakers push US-listed Chinese firms to comply with financial oversight,"A bipartisan group of U.S. lawmakers introduced a bill on Wednesday to force Chinese companies listed on American stock exchanges to submit to regulatory oversight, including providing access to audits and other steps now restricted by Chinese law.",CNBC,"Wed, 05 Jun 2019 22:18:00 -0400",,Positive,Article
https://www.reuters.com/article/us-didi-chuxing-chile/chinas-didi-chuxing-starts-ride-hailing-services-in-chile-colombia-idUSKCN1T705F,https://cdn.snapi.dev/images/v1/d/i/didi92.jpg,"China's Didi Chuxing starts ride-hailing services in Chile, Colombia","Chinese ride-hailing giant Didi Chuxing said on Thursday that it  had launched services in Chile and Colombia, as part of its push into Latin America.",Reuters,"Wed, 05 Jun 2019 22:01:22 -0400",,Positive,Article
https://nypost.com/2019/06/05/why-the-jobs-report-could-be-better-than-everyone-expects/,https://cdn.snapi.dev/images/v1/1/9/190605-jobs-report-crudelejpgquality90stripall.jpg,Why the jobs report could be better than everyone expects,Can I predict the employment report correctly for the second straight month? We’ll know Friday.,New York Post,"Wed, 05 Jun 2019 21:58:22 -0400",,Positive,Article
https://www.cnbc.com/2019/06/06/oil-market-us-crude-stockpiles-opec-supply-cuts-in-focus.html,https://cdn.snapi.dev/images/v1/1/0-2/102952093-unknown.jpg,"Oil stutters at over four-month low on rising US supply, demand fears",Oil prices on Tuesday hovered around their lowest levels since January as markets remain under pressure from rising U.S. supply and stalling demand amid an economic slowdown.,CNBC,"Wed, 05 Jun 2019 21:30:00 -0400",,Negative,Article
https://www.cnbc.com/2019/06/06/in-a-double-whammy-fitch-downgrades-mexico-and-moodys-lowers-outlook.html,https://cdn.snapi.dev/images/v1/1/0-2/105951480-1559782579752gettyimages-1085681530.jpeg,"In a double whammy, Fitch downgrades Mexico and Moody's lowers outlook","Cutting Mexico's rating to BBB, nearing junk status, Fitch said the financial woes of state oil company Pemex were taking a toll on the nation's prospects.",CNBC,"Wed, 05 Jun 2019 21:00:00 -0400",,Negative,Article
https://www.reuters.com/article/us-global-markets/asia-markets-cautious-as-trump-presses-mexico-on-trade-idUSKCN1T7020,https://cdn.snapi.dev/images/v1/m/0/m02d20190606t2i1394799199rlynxnpef5501xw640.jpg,Asia markets cautious as Trump presses Mexico on trade,"Asian shares got off to a hesitant start on Thursday as investors feared a looming U.S. trade war with Mexico would further depress global growth, even as they wagered central banks would have to respond with fresh stimulus.",Reuters,"Wed, 05 Jun 2019 20:30:15 -0400",,Negative,Article
https://www.reuters.com/article/us-cuba-usa-economy/cubas-private-sector-workers-say-trumps-travel-curbs-will-hurt-them-too-idUSKCN1T700Z,https://cdn.snapi.dev/images/v1/c/i/cib23-2.jpg,Cuba's private-sector workers say Trump's travel curbs will hurt them too,"Lazaro Hernandez, who has made a good living showing U.S. cruise ship passengers around Havana in his pink 1950s Chevrolet, says the new U.S. ban on cruises to Cuba will wipe out 90% of his business overnight.",Reuters,"Wed, 05 Jun 2019 20:17:15 -0400",,Negative,Article
https://www.fool.com/investing/2019/06/05/companies-and-governments-are-paying-people-to-get.aspx?source=iedfolrf0000001,https://cdn.snapi.dev/images/v1/h/e/he34.jpg,"Companies and Governments Are Paying People to Get Healthy, and It Works","Financial rewards can entice us to exercise more, and the benefits are lasting, according to a new research review.",The Motley Fool,"Wed, 05 Jun 2019 19:44:00 -0400",,Positive,Article
https://www.reuters.com/article/us-usa-trade-mexico-oil/u-s-refiners-warn-trump-mexico-tariffs-could-result-in-higher-fuel-prices-idUSKCN1T62XW,https://cdn.snapi.dev/images/v1/m/0/m02d20190605t2i1394784294rlynxnpef5425dw640.jpg,U.S. refiners warn Trump: Mexico tariffs could result in higher fuel prices,"U.S. refiners warned the Trump administration that tariffs on imports from Mexico could deliver a punishing blow to refiners and raise the cost of gasoline just as the U.S. driving season kicks into high gear, according to sources familiar with the discussions.",Reuters,"Wed, 05 Jun 2019 19:31:53 -0400",,Negative,Article
https://www.reuters.com/article/us-usa-trade-mexico-ebrard/mexicos-ebrard-says-talks-with-u-s-focused-on-migration-flows-not-tariffs-idUSKCN1T62WS,https://cdn.snapi.dev/images/v1/m/0/m02d20190605t2i1394778643rlynxnpef5424cw640.jpg,"Mexico's Ebrard says talks with U.S. focused on migration flows, not tariffs",Mexican Foreign Minister Marcelo Ebrard said his meeting with U.S. officials on Wednesday focused on migration flows and what Mexico is trying to do to slow them rather than U.S.,Reuters,"Wed, 05 Jun 2019 19:10:50 -0400",,Neutral,Article
https://www.nytimes.com/2019/06/05/us/politics/amazon-apple-facebook-google-lobbying.html,https://cdn.snapi.dev/images/v1/m/e/merlin-155976321-5368ae52-d2a0-4d22-972c-d8465b1bae66-articlelargejpgquality75autowebpdisableupscale.jpg,Tech Giants Amass a Lobbying Army for an Epic Washington Battle,"Amazon, Apple, Facebook and Google, facing the growing possibility of antitrust action and legislation to rein in their power, are spending freely to gain influence and access.",NYTimes,"Wed, 05 Jun 2019 19:04:39 -0400",paywall,Negative,Article
https://www.reuters.com/article/us-usa-trade-mexico-trump/trump-says-progress-made-in-talks-with-mexico-but-not-nearly-enough-idUSKCN1T62VQ,https://cdn.snapi.dev/images/v1/m/0/m02d20190605t2i1394774817rlynxnpef5423iw640.jpg,Trump says progress made in talks with Mexico but 'not nearly enough',"President Donald Trump said on Wednesday that progress was being made in talks with Mexico to stem the flow of migrants to the United States and would continue on Thursday, but unless an agreement can be reached a 5% tariff on Mexican goods would begin on Monday.",Reuters,"Wed, 05 Jun 2019 18:57:18 -0400",,Neutral,Article
https://techcrunch.com/2019/06/05/bird-is-acquiring-scoot/,https://cdn.snapi.dev/images/v1/s/c/scoot-kick-1jpgw600.jpg,Sources: Bird is in talks to acquire scooter startup Scoot,Consolidation is afoot in the micro-mobility industry.,TechCrunch,"Wed, 05 Jun 2019 18:56:58 -0400",manda,Positive,Article
https://www.forbes.com/sites/hayleykim/2019/06/05/peloton-confidentially-files-for-ipo/,https://cdn.snapi.dev/images/v1/0/x/0x600-209.jpg,Peloton Confidentially Files For IPO,"Famous for its pricey bikes and treadmills, Peloton follows a string of other unicorns filing IPOs this year.",Forbes,"Wed, 05 Jun 2019 18:51:00 -0400",,Positive,Article
https://www.nytimes.com/2019/06/05/business/energy-environment/oil-price.html,https://cdn.snapi.dev/images/v1/m/e/merlin-145147482-505fc71f-f811-4a05-90d6-395b52926336-articlelargejpgquality75autowebpdisableupscale.jpg,Another Sign of Economic Worry: Tumbling Oil Prices,Prices have dropped more than 20 percent since late April as investors worry that growth is slowing and trade disputes could slow growth further.,NYTimes,"Wed, 05 Jun 2019 18:29:55 -0400",paywall,Negative,Article
https://www.reuters.com/article/us-usa-trade-mexico-congress-explainer/explainer-how-the-u-s-congress-could-challenge-trump-tariffs-on-mexico-idUSKCN1T62U0,https://cdn.snapi.dev/images/v1/m/0/m02d20190605t2i1394767430rlynxnpef5422qw640.jpg,Explainer: How the U.S. Congress could challenge Trump tariffs on Mexico,"If President Donald Trump follows through on his threat to impose across-the-board tariffs on Mexican goods entering the United States, the U.S. Congress will likely try to halt the action with legislation that would face formidable hurdles to enactment.",Reuters,"Wed, 05 Jun 2019 18:29:50 -0400",,Negative,Article
https://www.gurufocus.com/news/890212/us-market-stays-in-the-green-on-wednesday-,https://cdn.snapi.dev/images/v1/s/n/sny23.jpg,US Market Stays in the Green on Wednesday,U.S. stocks were in positive territory on Wednesday on news that the Federal Reserve will help preserve the economic expansion despite trade tensions.,GuruFocus,"Wed, 05 Jun 2019 18:17:53 -0400",,Positive,Article
https://www.cnbc.com/2019/06/05/investors-are-betting-a-recession-is-coming-jim-cramer-says.html,https://cdn.snapi.dev/images/v1/1/0-2/105103000-rts1ou7a.jpg,"Investors are betting a recession is coming, Jim Cramer says","""[Defensive stocks] can do just fine during a slowdown,"" the ""Mad Money"" host says.",CNBC,"Wed, 05 Jun 2019 18:15:00 -0400",,Negative,Article
https://www.youtube.com/watch?v=Pl1ymYGJDos,https://cdn.snapi.dev/images/v1/m/q-5/peloton-prepares-to-go-public-amid-music-copyright-troubles.jpg,Peloton prepares to go public amid music copyright troubles,CNBC's Leslie Picker reports on the anticipated IPO of fitness company Peloton.,CNBC Television,"Wed, 05 Jun 2019 18:13:55 -0400",,Neutral,Video
https://www.nytimes.com/2019/06/05/business/economy/mexico-tariffs-state-by-state.html,https://cdn.snapi.dev/images/v1/e/s/es33.jpg,Which States Will Be Hit Hardest by Trump’s Tariffs on Mexico,"Tariffs on Mexican imports will ripple across the United States and could cause significant pain for consumers and businesses, even those far from the southwestern border.",NYTimes,"Wed, 05 Jun 2019 18:13:12 -0400",paywall,Negative,Article
https://www.youtube.com/watch?v=M8pGGrXvil0,https://cdn.snapi.dev/images/v1/m/q-5/economically-driven-rate-cut-would-send-markets-lower-says-strategist.jpg,"Economically-driven rate cut would send markets lower, says strategist","Josh Brown of Ritholtz Wealth Management and Tobias Levkovich of Citi join CNBC's ""Closing Bell"" to discuss the trading day.",CNBC Television,"Wed, 05 Jun 2019 18:08:40 -0400",,Negative,Video
https://www.benzinga.com/news/19/06/13870705/research-group-to-launch-delivery-locker-pilot-in-downtown-seattle,https://cdn.snapi.dev/images/v1/l/o/locker.jpg,Research Group To Launch Delivery Locker Pilot In Downtown Seattle,"Seattle's Urban Freight Lab (UFL) will put common delivery lockers next to transit stops in the central city starting January 1, 2020.",Benzinga,"Wed, 05 Jun 2019 18:07:20 -0400",,Neutral,Article
https://www.benzinga.com/m-a/19/06/13870706/jardine-transport-acquires-gil-trucking,https://cdn.snapi.dev/images/v1/j/r/jr43e.jpg,Jardine Transport Acquires Gil Trucking,"Jardine Transport Group has acquired Gil Trucking, a fellow New Brunswick carrier that provides open-deck transportation on long-haul routes in Canada and the United States.",Benzinga,"Wed, 05 Jun 2019 18:02:25 -0400",manda,Positive,Article
https://www.youtube.com/watch?v=nTxdeSnremU,https://cdn.snapi.dev/images/v1/m/q-5/stocks-just-had-one-of-their-biggest-rallies-of-the-year-shaking-off-major-warning-signs-in-the-mar.jpg,"Stocks just had one of their biggest rallies of the year, shaking off major warning signs in the mar","Stocks stage a major two-day rally, as the Dow is up 700 points in two days.",CNBC Television,"Wed, 05 Jun 2019 18:00:10 -0400",,Positive,Video
https://www.cnbc.com/2019/06/05/us-and-mexico-trade-officials-fail-to-reach-a-deal-on-tariffs-immigration-nbc-news.html,https://cdn.snapi.dev/images/v1/1/0-2/104295135-gettyimages-108476682.jpg,"US and Mexico trade officials fail to reach a deal on tariffs, immigration: NBC News",The meetings at the White House came days before the 5% tariffs on all Mexican imports were set to kick in.,CNBC,"Wed, 05 Jun 2019 17:53:00 -0400",,Negative,Article
https://www.gurufocus.com/news/890210/us-indexes-continue-gains-closing-higher-for-a-2nd-day-on-wednesday-,https://cdn.snapi.dev/images/v1/s/w/swe3-2.jpg,"US Indexes Continue Gains, Closing Higher for a 2nd Day on Wednesday","The Dow Jones Industrial Average closed at 25,539.57 on Wednesday with a gain of 207.39 points or 0.82%.",GuruFocus,"Wed, 05 Jun 2019 17:36:59 -0400",,Positive,Article
https://investorplace.com/2019/06/powell-backstops-the-bull/,https://cdn.snapi.dev/images/v1/s/t/st43.jpg,Powell Backstops the Bull,"Powell nods toward interest rate cuts … Meanwhile, our politicians have Big Tech in the crosshairs",InvestorPlace,"Wed, 05 Jun 2019 17:23:00 -0400",,Positive,Article
https://www.fool.com/investing/2019/06/05/trumps-mexico-tariffs-dont-make-sense-but-american.aspx?source=iedfolrf0000001,https://cdn.snapi.dev/images/v1/m/o/modo23.jpg,"Trump’s Mexico Tariffs Don’t Make Sense, but Americans Will Pay a Steep Price Anyway if They Go into Effect",President Trump plans to put a 5% tariff on every Mexican good that crosses the border unless Mexico does more to reduce the flow of migrants.,The Motley Fool,"Wed, 05 Jun 2019 17:23:00 -0400",,Negative,Article
https://www.youtube.com/watch?v=HMQbnud3Xak,https://cdn.snapi.dev/images/v1/m/q-5/megaphone-ceo-on-producing-a-successful-podcast.jpg,Megaphone CEO on producing a successful podcast,"Megaphone CEO Brendan Monaghan discusses the business of podcasts, target audiences and advertising.",Yahoo Finance,"Wed, 05 Jun 2019 17:01:18 -0400",CEO,Neutral,Video
https://www.gurufocus.com/news/890165/tweedy-browne-comments-on-wuliangye,https://cdn.snapi.dev/images/v1/s/2/s23-5.jpg,Tweedy Browne Comments on Wuliangye,"Wuliangye is recognized as one of China’s premium baijiu (spirit) brands. Wuliangye literally translated means “five grains liquid,” as it is brewed by a unique formula that combines the flavor of five different grains.",GuruFocus,"Wed, 05 Jun 2019 16:55:57 -0400",,Neutral,Article
https://www.gurufocus.com/news/890166/tweedy-browne-comments-on-basf,https://cdn.snapi.dev/images/v1/a/s/asset-management44.jpg,Tweedy Browne Comments on BASF,"Founded in 1865, BASF is a global chemicals company with 122,404 employees operating in over 80 countries around the world.",GuruFocus,"Wed, 05 Jun 2019 16:55:51 -0400",,Neutral,Article
https://www.gurufocus.com/news/890167/royce-funds-commentary-francis-gannon-on-innovation-in-smallcaps,https://cdn.snapi.dev/images/v1/s/w/swe3.jpg,Royce Funds Commentary: Francis Gannon on Innovation in Small-Caps,Co-CIO Francis Gannon details opportunities for small-cap investors in sectors he believes may be overlooked,GuruFocus,"Wed, 05 Jun 2019 16:54:27 -0400",,Neutral,Article
https://www.reuters.com/article/us-usa-trade-mexico-pence/mexico-u-s-officials-meet-in-high-stakes-tariff-talks-at-white-house-idUSKCN1T60D6,https://cdn.snapi.dev/images/v1/s/w/swe2.jpg,"Mexico, U.S. officials meet in high-stakes tariff talks at White House","Mexican officials met with their U.S. counterparts for talks in Washington on Wednesday aimed at reaching a deal to stave off the imposition of U.S. tariffs on Mexican goods next week, even as their government prepared to retaliate if duties go ahead.",Reuters,"Wed, 05 Jun 2019 16:51:15 -0400",,Neutral,Article
https://investorplace.com/2019/06/dow-jones-today-stocks-get-some-support-from-the-middle/,https://cdn.snapi.dev/images/v1/d/o/dowmsn-300x165-2.jpg,Dow Jones Today: Stocks Get Some Support from the Middle,"Stocks like Coca Cola, Disney, Walmart and Procter and Gamble were among the strongest performers in the Dow Jones today.",InvestorPlace,"Wed, 05 Jun 2019 16:34:46 -0400",,Neutral,Article
https://www.reuters.com/article/us-usa-stocks/wall-st-climbs-as-weak-private-jobs-data-boost-rate-cut-hopes-idUSKCN1T61B8,https://cdn.snapi.dev/images/v1/m/0/m02d20190605t2i1394653536rlynxnpef541brw640.jpg,Wall St. climbs as weak private jobs data boost rate cut hopes,Wall Street's major indexes rose on Wednesday as investors bet on a Federal Reserve interest rate cut after weak private sector jobs data and hopes grew that the United States and Mexico would reach an agreement to avoid U.S. tariffs on Mexican goods.,Reuters,"Wed, 05 Jun 2019 16:31:17 -0400",,Positive,Article
https://www.cnbc.com/2019/06/05/people-are-buying-up-the-asset-class-that-loves-trade-wars-central-bank-easing-and-volatility.html,https://cdn.snapi.dev/images/v1/1/0-2/104872459-gettyimages-514762114.jpg,"People are buying up the asset class that loves trade wars, central bank easing and volatility","Fear about slowing growth and the prospect of lower interest rates have pushed the price of gold higher, but analysts say it may be nearing the top of its run for now.",CNBC,"Wed, 05 Jun 2019 16:26:00 -0400",,Positive,Article
https://www.reuters.com/article/us-usa-trade-china-levers-explainer/explainer-u-s-china-trade-war-the-levers-they-can-pull-idUSKCN1T62KY,https://cdn.snapi.dev/images/v1/m/0/m02d20190605t2i1394732651rlynxnpef541wnw640.jpg,Explainer: U.S.-China trade war - the levers they can pull,The escalating trade war between the United States and China has gone beyond tariffs as the countries increase pressure on each other to cede ground.,Reuters,"Wed, 05 Jun 2019 16:19:59 -0400",,Negative,Article
https://www.youtube.com/watch?v=eEMibkCBSI8,https://cdn.snapi.dev/images/v1/m/q-5/bgc-partners-ceo-says-economy-not-slowing.jpg,BGC Partners CEO says economy not slowing,"CNBC's Bob Pisani sits down with BGC Partners CEO Howard Lutnick to discuss his view of the economy, how tariffs will impact markets, what investors should watch and more.",CNBC Television,"Wed, 05 Jun 2019 16:16:28 -0400",CEO,Neutral,Video
https://www.marketwatch.com/story/stocks-pull-together-back-to-back-gains-on-fed-rate-cut-hopes-2019-06-05,https://cdn.snapi.dev/images/v1/s/2/s23-4.jpg,Stocks pull together back-to-back gains on Fed rate-cut hopes,U.S. stocks ended solidly higher on Wednesday as investors battered by tariff threats took solace in rising expectations for easier monetary policy from the Federal Reserve.,Market Watch,"Wed, 05 Jun 2019 16:04:46 -0400",,Positive,Article
https://www.benzinga.com/markets/cannabis/19/06/13868970/gillibrand-would-federally-legalize-cannabis-make-it-top-priority,https://cdn.snapi.dev/images/v1/j/o/joint-4185417-1920-2.jpg,"Gillibrand Would Federally Legalize Cannabis, Make It Top Priority",Ending the federal prohibition on marijuana would be a top priority for U.S. Sen.,Benzinga,"Wed, 05 Jun 2019 16:01:20 -0400",cannabis,Positive,Article
https://www.benzinga.com/news/19/06/13869078/chartersync-brings-visibility-into-time-critical-air-cargo-booking-operations,https://cdn.snapi.dev/images/v1/a/i/airport-1043636-1920-10.jpg,CharterSync Brings Visibility Into Time-Critical Air Cargo Booking Operations,"CharterSync, a startup catering to the air cargo charter market, launched at the Transport Logistic event in Munich, with the company demonstrating its innovative platform that helps businesses book air cargo charter planes on-demand.",Benzinga,"Wed, 05 Jun 2019 15:59:33 -0400",,Positive,Article
https://www.forbes.com/sites/jamiehopkins/2019/06/05/sec-brings-increased-confusion-for-investors-with-new-best-interest-rule/,https://cdn.snapi.dev/images/v1/r/d/rdxwe-1.jpg,SEC Brings Increased Confusion For Investors With New 'Best Interest' Rule,"The SEC held a vote on June 5 to advance forward four final rules intended to expand the fiduciary and best interest standards of investment advice out to brokers. However, consumer advocates and fiduciary supporters question if the regulations further the intended goals.",Forbes,"Wed, 05 Jun 2019 15:55:00 -0400",,Neutral,Article
https://www.gurufocus.com/news/890146/christopher-browne-finding-the-silver-lining-when-markets-dip,https://cdn.snapi.dev/images/v1/d/o/dola823.jpg,Christopher Browne: Finding the Silver Lining When Markets Dip,"The Santa Claus for value investors is not a person, but a dip in the markets. It’s what Christopher Browne called “things that go bump in the market” in chapter nine of “The Little Book of Value Investing.",GuruFocus,"Wed, 05 Jun 2019 15:53:59 -0400",,Neutral,Article
https://www.youtube.com/watch?v=tJEJsfQwoqc,https://cdn.snapi.dev/images/v1/m/q-5/housing-market-correcting-to-more-sustainable-place-says-expert.jpg,"Housing market correcting to more sustainable place, says expert","Meghan McGarth of Buckingham Research and Skylar Olsen, Zillow director of economic research, join CNBC's ""Power Lunch"" team to discuss what is happening in the housing market.",CNBC Television,"Wed, 05 Jun 2019 15:48:06 -0400",,Positive,Video
https://www.youtube.com/watch?v=lqHC_amcq0U,https://cdn.snapi.dev/images/v1/m/q-5/midwest-farmers-devastated-by-flooding.jpg,Midwest farmers devastated by flooding,TJM Investments Scott Shelladio discusses the impact massive floods in the midwest are having on wheat and corn production.,Yahoo Finance,"Wed, 05 Jun 2019 15:45:39 -0400",,Negative,Video
https://www.investors.com/market-trend/stock-market-today/oil-slammed-dow-jones-retakes-200-day-blue-chip-stocks-trade-near-buy-point/,https://cdn.snapi.dev/images/v1/e/t/etf20-16.jpg,"Oil Slammed, But Dow Jones Retakes 200-Day",The Dow Jones Industrial Average maintained an edge over the Nasdaq composite in a rally in stocks today. Oil fell more than 3%.,Investors Business Daily,"Wed, 05 Jun 2019 15:31:09 -0400",,Neutral,Article
https://www.reuters.com/article/us-usa-trade-mexico-pence/hope-grows-for-deal-to-ward-off-trumps-tariffs-on-mexican-imports-idUSKCN1T60D6,https://cdn.snapi.dev/images/v1/m/0/m02d20190605t2i1394649734rlynxnpef541afw640.jpg,Hope grows for deal to ward off Trump's tariffs on Mexican imports,Hope grew on Wednesday for a deal to avoid the United States imposing tariffs on Mexican goods in return for Mexico doing more to halt illegal immigration but President Donald Trump said he was willing to go ahead with the import duties if he is not satisfied.,Reuters,"Wed, 05 Jun 2019 15:27:44 -0400",,Positive,Article
https://www.youtube.com/watch?v=0Xp2LdqUXiU,https://cdn.snapi.dev/images/v1/m/q-5/billionaire-ken-fisher-doesnt-think-the-fed-matters-heres-why.jpg,Billionaire Ken Fisher doesn't think the Fed matters here's why,"Rate hike, rate cut — the Federal Reserve isn’t as relevant as you might think.",Yahoo Finance,"Wed, 05 Jun 2019 15:24:10 -0400",,Neutral,Video
