news_url,image_url,title,text,source_name,date,topics,sentiment,type,tickers
https://www.zacks.com/commentary/888172/are-the-equity-markets-over-optimistic,https://cdn.snapi.dev/images/v1/0/1/software8.jpg,Are The Equity Markets Over Optimistic?,Are The Equity Markets Over Optimistic?,Zacks Investment Research,"Fri, 24 Apr 2020 18:44:00 -0400",,Neutral,Article,"ADBE,BABA,FB,GILD,LMT,MSFT,SE,SPY,TWLO"
https://www.fool.com/investing/2020/04/24/stock-market-wrap-up-facebook-goes-video-wayfair-g.aspx,https://cdn.snapi.dev/images/v1/q/z/stockstobuymsn-2.jpg,Stock Market Wrap-Up: Facebook Goes Video; Wayfair Gets an Analyst 2-Step,The stock market finished the week on a winning note.,The Motley Fool,"Fri, 24 Apr 2020 18:25:00 -0400",,Neutral,Article,"FB,W"
https://www.fool.com/investing/2020/04/24/facebook-takes-aim-at-zoom-with-new-video-conferen.aspx,https://cdn.snapi.dev/images/v1/n/x/urlhttps3a2f2fgfoolcdncom2feditorial2fimages2f5696502ffacebook-roomsjpgw700opresize.jpg,Facebook Takes Aim at Zoom With New Video-Conferencing Features,Zoom stock dipped after the social media giant unveiled expanded video-chat features.,The Motley Fool,"Fri, 24 Apr 2020 18:08:00 -0400",,Positive,Article,FB
https://www.youtube.com/watch?v=rz7z6oCrbAo,https://cdn.snapi.dev/images/v1/i/d/idkcdet5.jpg,Cornerstone Macro's Carter Worth charts where Big Tech is headed,"Carter Worth, Cornerstone Macro, on where the charts are pointing for Big Tech.",CNBC Television,"Fri, 24 Apr 2020 17:50:28 -0400",earnings,Positive,Video,"AAPL,AMZN,FB,GOOG,GOOGL,MSFT"
https://www.youtube.com/watch?v=mJ4-4mXK5zw,https://cdn.snapi.dev/images/v1/r/g/rghnhgre456.jpg,"Big Tech reports next week, here's what to watch for",Getting ready for next week's Big Tech earnings.,CNBC Television,"Fri, 24 Apr 2020 16:45:26 -0400",earnings,Neutral,Video,"AMZN,FB,GOOG,GOOGL,MSFT,AAPL"
https://investorplace.com/2020/04/4-top-stock-trades-for-monday-intc-fb-w-ostk/,https://cdn.snapi.dev/images/v1/z/r/data-internet8.jpg,"4 Top Stock Trades for Monday: INTC, FB, W, OSTK","Facebook, Intel, Wayfair and Overstock were our top stock trades for Monday. That said, here's a look at the charts are telling us now.",InvestorPlace,"Fri, 24 Apr 2020 16:42:30 -0400",,Neutral,Article,"FB,INTC,OSTK,W"
https://deadline.com/2020/04/facebook-zoom-messenger-rooms-videoconferencing-coronavirus-1202917366/,https://cdn.snapi.dev/images/v1/p/y/facebook-2.jpg,Facebook Takes On Zoom With New Messenger Rooms For Video Conferencing,"Zoom stock was rattled Friday, falling 6%, after Facebook introduced Messenger Rooms, a product that will let users invite as many as 50 people to a video call with no time limit. Messenger Rooms is rolling out in some countries this week and will expand to the rest of the world in coming weeks, Facebook",Deadline,"Fri, 24 Apr 2020 16:27:19 -0400",,Positive,Article,FB
https://www.forbes.com/sites/rachelsandler/2020/04/24/facebook-goes-to-war-with-zoom-introduces-50-person-chat-feature/,https://cdn.snapi.dev/images/v1/m/l/facebook-goes-to-war-with-zoom-introduces-50-person-chat-feature.jpg,"Facebook Goes To War With Zoom, Introduces 50-Person Chat Feature",Zoom has become a staple during the coronavirus lockdowns. Now Facebook wants in.,Forbes,"Fri, 24 Apr 2020 16:25:30 -0400",,Positive,Article,FB
https://investorplace.com/2020/04/stock-market-today-facebook-vs-zoom-att-ceo-leaves/,https://cdn.snapi.dev/images/v1/y/f/738-1.jpg,Stock Market Today: Facebook vs. Zoom; AT&T CEO Leaves,"Facebook vs. Zoom could be emerging, even though the latter is on fire.",InvestorPlace,"Fri, 24 Apr 2020 16:14:04 -0400",,Neutral,Article,"FB,T,ZM"
https://www.cnn.com/2020/04/24/tech/facebook-video-calling-upgrades/index.html,https://cdn.snapi.dev/images/v1/u/f/m02d20190618t2i1398988328rlynxnpef5h0mlw640.jpg,Facebook is taking on Zoom with new video features,"Facebook has a long history of expanding its features to emulate major tech competitors. Now, it's taking on platform-of-the-moment Zoom.",CNN Business,"Fri, 24 Apr 2020 14:55:26 -0400",,Positive,Article,FB
https://www.marketwatch.com/story/facebook-is-readying-a-competing-service-to-zoom-microsoft-teams-2020-04-24,https://cdn.snapi.dev/images/v1/f/v/fvkw234r55.jpg,"Facebook is readying a competing service to Zoom, Microsoft Teams","Facebook Inc. FB, +2.37% on Friday said it is launching a new video chat feature that appears to be a rival to Zoom Video Communications Inc.",Market Watch,"Fri, 24 Apr 2020 14:41:14 -0400",,Positive,Article,FB
https://www.reuters.com/article/us-facebook-messenger/facebook-enters-the-videoconferencing-fray-with-messenger-rooms-idUSKCN22630S,https://cdn.snapi.dev/images/v1/m/0/m02d20200424t2i1516380289rlynxnpeg3n21xw640.jpg,Facebook enters the videoconferencing fray with Messenger Rooms,"Facebook Inc  introduced a videoconferencing tool and expanded livestreaming features on Friday, capitalizing on a surge in demand for video chats during the coronavirus pandemic while taking its first steps toward a planned integration of messaging products across its apps.",Reuters,"Fri, 24 Apr 2020 14:18:32 -0400",,Positive,Article,FB
https://www.fastcompany.com/90495552/facebooks-messenger-rooms-take-on-zoom-and-houseparty,https://cdn.snapi.dev/images/v1/p/-/p-1-fb-messenger-rooms.jpg,Facebook’s Messenger Rooms take on Zoom and Houseparty,"As folks turn to video to stay social, Facebook is launching a service that lets you chat with friends—even if they don’t have a Facebook account.
Of all the tools we’re using to survive this time of social isolation, none has seen more explosive growth than videoconferencing.",Fast Company,"Fri, 24 Apr 2020 14:15:42 -0400",,Positive,Article,FB
https://techcrunch.com/2020/04/24/facebook-to-launch-virtual-dating-over-messenger/,https://cdn.snapi.dev/images/v1/a/t/fb-2.jpg,Facebook to launch ‘virtual dating’ over Messenger for Facebook Dating users,"Facebook will soon allow users to go on “virtual dates,” the company announced today. The social network is planning to introduce a new video calling feature that will allow users of its Facebook Dating service to connect and video call over Messenger, as an alternative to going on a real-world date.",TechCrunch,"Fri, 24 Apr 2020 14:15:32 -0400",,Positive,Article,FB
https://www.cnbc.com/2020/04/24/facebook-messenger-rooms-offers-video-calls-for-up-to-50-people.html,https://cdn.snapi.dev/images/v1/0/3/03lfvpch-2.jpg,Facebook rolling out free video calling for up to 50 people,"Facebook on Friday announced a slew of new video-calling features including Messenger Rooms, which allows users to host video calls of up to 50 people.",CNBC,"Fri, 24 Apr 2020 14:15:15 -0400",,Positive,Article,FB
https://techcrunch.com/2020/04/24/faceboo-launches-drop-in-video-chat-rooms-to-rival-houseparty/,https://cdn.snapi.dev/images/v1/f/a/facebook-messenger-roomsjpgw730.jpg,Facebook launches drop-in video chat Rooms to rival Houseparty,"Facebook is co-opting some of the top video chat innovations like Zoom’s gallery view for large groups and Houseparty’s spontaneous hangouts for a new feature called Rooms. Launching today on mobile and desktop, you can start a video chat Room that friends can discover via a new section above the News Feed or notifications Facebook […]",TechCrunch,"Fri, 24 Apr 2020 14:15:08 -0400",,Positive,Article,FB
https://www.cnet.com/news/facebook-takes-on-zoom-with-new-video-calling-features/,https://cdn.snapi.dev/images/v1/r/g/facebook-f8-2015-messenger-platform-mark-zuckerberg.jpg,Facebook takes on Zoom with new video calling features,Messenger Rooms will let you join group video calls even if you don't have a Facebook account.,CNET,"Fri, 24 Apr 2020 14:15:00 -0400",,Positive,Article,FB
https://www.cnet.com/news/facebook-ftc-settlement-what-you-need-to-know-about-the-5-billion-deal/,https://cdn.snapi.dev/images/v1/z/n/facebook.jpg,Facebook-FTC settlement: What you need to know about the $5 billion deal,Some of the requirements are just common sense.,CNET,"Fri, 24 Apr 2020 11:55:00 -0400",,Neutral,Article,FB
https://www.reuters.com/article/us-australia-media-ireland/ireland-should-consider-forcing-google-facebook-to-pay-media-for-content-pm-idUSKCN2262I4,https://cdn.snapi.dev/images/v1/m/0/m02d20200424t2i1516353020rlynxnpeg3n1nzw640.jpg,"Ireland should consider forcing Google, Facebook to pay media for content: PM","The Irish government should consider copying Australia's plan to force Facebook Inc and Alphabet Inc's Google to share advertising revenue with local media, Prime Minister Leo Varadkar said on Friday.",Reuters,"Fri, 24 Apr 2020 11:31:24 -0400",,Neutral,Article,"FB,GOOG,GOOGL"
https://www.zacks.com/stock/news/887655/facebook-fb-to-report-q1-earnings-whats-in-the-cards,https://cdn.snapi.dev/images/v1/a/w/zi-uci4b3nov-2-1.jpg,Facebook (FB) to Report Q1 Earnings: What's in the Cards?,"Facebook's (FB) Q1 results are likely to reflect continued subscriber growth. However, ad sales are expected to have been drained by the coronavirus pandemic.",Zacks Investment Research,"Fri, 24 Apr 2020 10:53:00 -0400",earnings,Neutral,Article,FB
https://www.cnet.com/news/federal-court-approves-facebook-settlement-with-ftc-over-cambridge-analytica/,https://cdn.snapi.dev/images/v1/o/r/fb66-1.jpg,Federal court approves Facebook settlement with FTC over Cambridge Analytica,Now it's official.,CNET,"Fri, 24 Apr 2020 10:18:00 -0400",,Neutral,Article,FB
https://www.zacks.com/stock/news/887271/how-feasible-are-big-techs-plans-to-win-the-gaming-market,https://cdn.snapi.dev/images/v1/k/h/200224161455-apple-iphone-1103-file-super-170.jpg,How Feasible Are Big Tech's Plans to Win the Gaming Market?,The gaming industry is clearly thriving amid lockdowns and the Big Tech team wants to make the most of it.,Zacks Investment Research,"Fri, 24 Apr 2020 08:29:00 -0400",,Neutral,Article,"AAPL,AMZN,ATVI,FB,GOOGL"
https://www.fool.com/investing/2020/04/24/surprise-most-faang-stocks-are-historically-cheap.aspx,https://cdn.snapi.dev/images/v1/k/g/vitaldata1600-300x169.jpg,Surprise! Most FAANG Stocks Are Historically Cheap,"For Facebook, Amazon, Apple, Netflix, and Google (now a subsidiary of Alphabet), cash flow tells an interesting tale.",The Motley Fool,"Fri, 24 Apr 2020 07:21:00 -0400",,Positive,Article,"AAPL,AMZN,FB,GOOG,GOOGL,NFLX"
https://www.zacks.com/stock/news/887141/tech-giants-fight-fake-news-google-facebook-lead-the-race,https://cdn.snapi.dev/images/v1/a/i/104710820-gettyimages-502404740530x298.jpg,"Tech Giants Fight Fake News: Google, Facebook Lead the Race",Tech giants are making all efforts to curb fake news doing rounds on various social media platforms following the COVID-19 outbreak.,Zacks Investment Research,"Fri, 24 Apr 2020 07:01:00 -0400",,Neutral,Article,FB
https://www.fool.com/investing/2020/04/24/better-buy-facebook-vs-alphabet.aspx,https://cdn.snapi.dev/images/v1/k/p/urlhttps3a2f2fgfoolcdncom2feditorial2fimages2f5670402fman-at-laptop-with-digital-media-icons-floating-around-gettyimages-1169192820jpgw700opresize.jpg,Better Buy: Facebook vs. Alphabet,"Both companies thrive off advertising, but is there a future beyond ads? Find out which has the superior growth strategy.",The Motley Fool,"Fri, 24 Apr 2020 06:41:00 -0400",,Neutral,Article,"FB,GOOG,GOOGL"
https://seekingalpha.com/article/4339704-technologys-big-5-report-next-week-20-of-s-and-p-500-market-cap,https://cdn.snapi.dev/images/v1/i/j/ij9223f-5.jpg,Technology's 'Big 5' Report Next Week - 20% Of S&P 500 Market Cap,"Regardless of their sector label, most readers view these companies as ""Tech"" and they comprise an enormous amount of the S&P 500 market cap.",Seeking Alpha,"Fri, 24 Apr 2020 02:54:00 -0400",,Neutral,Article,"AAPL,AMZN,FB,GOOG,GOOGL,MSFT"
