news_url,image_url,title,text,source_name,date,topics,sentiment,type,tickers
https://www.benzinga.com/markets/options/20/04/15877347/large-facebook-option-trader-betting-on-earnings-sell-off,https://cdn.snapi.dev/images/v1/9/j/fb-8.jpg,Large Facebook Option Trader Betting On Earnings Sell-Off,"Facebook, Inc (NASDAQ: FB) shares are up 24.9% over the past month. But at least one large option trader is betting next week’s earnings report will be a reality check for the stock.",Benzinga,"Sat, 25 Apr 2020 16:08:32 -0400",earnings,Negative,Article,FB
https://www.cnbc.com/2020/04/25/google-facebook-twitter-support-addiction-recovery-during-pandemic.html,https://cdn.snapi.dev/images/v1/a/g/104367170-gettyimages-648471036.jpg,"Google, Facebook, Twitter team up to support addiction recovery during pandemic","Google, Facebook, and Twitter have partnered with the nonprofit Center for Safe Internet Pharmacies to launch Tech Together, offering support to individuals with substance use disorder.",CNBC,"Sat, 25 Apr 2020 10:16:01 -0400",,Positive,Article,"FB,GOOG,GOOGL,TWTR"
https://www.fool.com/investing/2020/04/25/facebook-stock-buy-sell-or-hold.aspx,https://cdn.snapi.dev/images/v1/r/f/rfvfdew34555.jpg,"Facebook Stock: Buy, Sell, or Hold?",The social network's stock is still down sharply from highs earlier this year. Is now the time to scoop up shares?,The Motley Fool,"Sat, 25 Apr 2020 08:46:00 -0400",,Positive,Article,FB
https://www.youtube.com/watch?v=3VX7n-R_L7w,https://cdn.snapi.dev/images/v1/j/v/facebooks-group-video-chat-feature-takes-aim-at-zoom.jpg,Facebook's Group Video-Chat Feature Takes Aim at Zoom,"Facebook Inc. is launching a new group video chat product meant to capitalize on a world that is now stuck indoors and offer an alternative to services like Zoom Video Communications. Bloomberg's Kurt Wagner reports on ""Bloomberg Technology.""",Bloomberg Technology,"Sat, 25 Apr 2020 08:30:53 -0400",,Positive,Video,FB
https://invezz.com/news/2020/04/25/facebook-debuts-in-the-video-conferencing-market-with-messenger-rooms/,https://cdn.snapi.dev/images/v1/e/o/45701270-s-740x416.jpg,Facebook debuts in the video conferencing market with Messenger Rooms,"Video Chats are in great demand as the Coronavirus pandemic restricts people to their homes and pushes businesses into relying on work from home arrangements. To capitalize on the opportunity, Facebook Inc.",Invezz,"Sat, 25 Apr 2020 06:47:03 -0400",,Positive,Article,FB
