news_url,image_url,title,text,source_name,date,topics,sentiment,type,tickers
https://invezz.com/news/2020/11/25/facebook-shares-remain-in-a-bull-market-supported-by-q3-results/,https://cdn.snapi.dev/images/v1/7/9/facebook-740x416.jpg,Facebook shares remain in a bull market supported by Q3 results,"Facebook (NASDAQ: FB) shares extended its correction from the recent highs above $297, registered in the first week of November but the price of the stock is still near multi-year highs. Facebook reported better-than-expected Q3 results and the company expects that the Q4 ad revenue growth will be even higher.",Invezz,"Wed, 25 Nov 2020 16:57:33 -0500",,Positive,Article,FB
https://investorplace.com/2020/11/4-ai-stocks-on-the-cutting-edge-fb-work-crm-docu/,https://cdn.snapi.dev/images/v1/l/g/study-links-nike-adidas-and-apple-to-forced-uighur-labor-3.jpg,4 AI Stocks on the Cutting Edge,"AI stocks present the next frontier of investment, and these four companies are revolutionizing how we interact with their services. The post 4 AI Stocks on the Cutting Edge appeared first on InvestorPlace.",InvestorPlace,"Wed, 25 Nov 2020 14:39:23 -0500",,Positive,Article,"CRM,DOCU,FB,WORK"
https://www.cnn.com/2020/11/25/tech/france-digital-taxes/index.html,https://cdn.snapi.dev/images/v1/x/u/190826102823-01-amazon-france-super-169.jpg,France orders Big Tech to pay digital tax despite threat of US tariffs,"France will require big tech companies to pay its digital services tax, a move that is likely to trigger retaliation by President Donald Trump and pitch the incoming US administration into another trade fight.",CNN Business,"Wed, 25 Nov 2020 12:40:23 -0500",,Negative,Article,"AMZN,FB,GOOG,GOOGL"
https://www.reuters.com/article/us-eu-tech-rules/tech-giants-face-fines-or-even-break-up-if-they-breach-new-rules-eus-breton-idUSKBN2852NI,https://cdn.snapi.dev/images/v1/m/0/m02d20201125t2i1542443170w940fhfwllplsqrlynxmpegao1f4.jpg,Tech giants face fines or even break-up if they breach new rules: EU's Breton,"Tech giants that break new EU rules aimed at curbing their powers could face fines, be ordered to change their practices or even be forced to break up their European businesses, the bloc's digital chief Thierry Breton said on Wednesday.",Reuters,"Wed, 25 Nov 2020 12:07:00 -0500",,Negative,Article,"AAPL,AMZN,FB,GOOG,GOOGL,MSFT"
https://www.gurufocus.com/news/1296663/li-lus-himalaya-capital-doubled-up-on-facebook-in-3rd-quarter,https://cdn.snapi.dev/images/v1/6/i/gettyimages-1153735128.jpg,Li Lu's Himalaya Capital Doubled Up on Facebook in 3rd Quarter,"Li Lu (Trades, Portfolio) is arguably one of the world's most underappreciated value investors. While most investors are aware of Warren Buffett (Trades, Portfolio) and Charlie Munger (Trades, Portfolio), both of whom Li learned from, he is less well-known than the two billionaires.",GuruFocus,"Wed, 25 Nov 2020 10:01:02 -0500",,Positive,Article,FB
https://www.marketwatch.com/story/french-tax-authorities-have-started-demanding-us-firms-pay-digital-tax-report-2020-11-25,https://cdn.snapi.dev/images/v1/s/m/smu5---er6kxukfzf.jpg,French tax authorities have started demanding U.S. firms pay digital tax: report,"French tax authorities have started demanding U.S. technology groups pay their 3% digital services tax, the Financial Times reported, citing French officials, company officials and advisers. Facebook and Amazon are among the companies that have received communications, the report said.",Market Watch,"Wed, 25 Nov 2020 07:16:06 -0500",paywall,Negative,Article,"AAPL,AMZN,FB,GOOG,GOOGL,TWTR"
https://www.businessinsider.com/france-starts-implementing-big-tech-tax-despite-us-threats-2020-11,https://cdn.snapi.dev/images/v1/f/r/france-is-pushing-ahead-with-its-tax-on-us-big-tech-after-a-10-month-standoff-with-trump-setting-the-stage-for-a-trade-war-over-makeup-and-handbags.jpg,"France is pushing ahead with its tax on US Big Tech after a 10-month standoff with Trump, setting the stage for a trade war over makeup and handbags","France has demanded US tech giants pay its new 3% digital services tax, in a re-escalation of a trade war with the White House that was put on hold in January. The Financial Times reported Wednesday that tech companies including Facebook and Amazon had been told by French authorities over the past few days that they need to pay the tax for 2020. The FT cited company executives, advisors, and French officials.",Business Insider,"Wed, 25 Nov 2020 07:12:37 -0500",Political,Negative,Article,"AAPL,AMZN,FB,GOOG,GOOGL,TWTR"
https://www.benzinga.com/government/20/11/18525989/french-tax-authorities-nudge-amazon-facebook-to-shell-out-digital-tax-ft,https://cdn.snapi.dev/images/v1/j/c/morning-brew-gl689nie1xg-unsplash-1.jpg,"French Tax Authorities Nudge Amazon, Facebook To Shell Out Digital Tax: FT","Facebook, Inc (NASDAQ: FB) and Amazon.com, Inc (NASDAQ: AMZN) have received a demand of millions of euros from the French tax authorities, the Financial Times reports. What Happened: France seeks to collect ""digital tax"" for 2020 from the U.S. technology groups.",Benzinga,"Wed, 25 Nov 2020 04:01:55 -0500",,Negative,Article,"AMZN,FB"
https://www.reuters.com/article/us-facebook-southkorea-fine/south-korean-watchdog-fines-facebook-6-1-million-for-sharing-user-info-without-consent-idUSKBN2850YW,https://cdn.snapi.dev/images/v1/d/2/m02d20201125t2i1542387629w940fhfwllplsqrlynxmpegao0gb.jpg,South Korean watchdog fines Facebook $6.1 million for sharing user info without consent,A South Korean agency for protecting personal information on Wednesday fined Facebook Inc 6.7 billion won ($6.06 million) and sought a criminal investigation for providing users' personal information to other operators without consent.,Reuters,"Wed, 25 Nov 2020 03:50:00 -0500",,Negative,Article,FB
