news_url,image_url,title,text,source_name,date,topics,sentiment,type,tickers
https://www.investopedia.com/facebook-gathers-companies-to-back-cryptocurrency-launch-4690619,https://cdn.snapi.dev/images/v1/v/q/fac23-2.jpg,Facebook Gathers Companies to Back Libra coin Launch,Facebook's Libra coin will serve users on the social media platform as well as across the internet.,Investopedia,"Fri, 14 Jun 2019 21:03:24 -0400",,Positive,Article,FB
https://www.marketwatch.com/story/facebooks-cryptocurrency-foray-leads-bitcoin-to-its-best-trading-stretch-in-3-weeks-2019-06-14,https://cdn.snapi.dev/images/v1/u/r-2/m02d20190602t2i1393636452rlynxnpef510u5w640.jpg,Cryptos: Facebook’s cryptocurrency foray leads bitcoin to its best trading stretch in 3 weeks,Reports that Facebook Inc. is about to roll out a cryptocurrency as soon as next week have helped bitcoin to notch its best weekly trading period in about three weeks.,Market Watch,"Fri, 14 Jun 2019 18:37:27 -0400",,Positive,Article,FB
https://www.youtube.com/watch?v=8ZvZ4ce4hn4,https://cdn.snapi.dev/images/v1/f/b/fb62-2.jpg,Facebook goes full crypto: 3 trades,"The ""Fast Money"" traders give you 3 trades in Facebook as the company launches it's own cryptocurrency.",CNBC Television,"Fri, 14 Jun 2019 18:25:18 -0400",,Positive,Video,FB
https://www.youtube.com/watch?v=x2H_0owMhRA,https://cdn.snapi.dev/images/v1/f/b/fb32.jpg,Facebook's cryptocurrency venture getting some new backers,"With CNBC's Melissa Lee and the Fast Money traders, Tim Seymour, Steve Grasso, Dan Nathan and Guy Adami.",CNBC Television,"Fri, 14 Jun 2019 18:05:13 -0400",manda,Positive,Video,"FB,MA,PYPL,UBER,V"
https://www.youtube.com/watch?v=0zMloWVpOQ0,https://cdn.snapi.dev/images/v1/u/u/uu7.jpg,Facebook to introduce cryptocurrency backed by Mastercard and Visa,"Liz Hoffman of The Wall Street Journal and Meltem Demirors of Coinshares join CNBC's ""Closing Bell"" to discuss Facebook's cryptocurrency initiatives.",CNBC Television,"Fri, 14 Jun 2019 17:07:57 -0400",,Positive,Video,"FB,MA,V"
https://www.zacks.com/stock/news/429940/facebook-watch-gaining-steam-new-features-to-aid-user-growth,https://cdn.snapi.dev/images/v1/9/1/910.jpg,"Facebook Watch Gaining Steam, New Features to Aid User Growth","Facebook (FB) Watch has now more than 720-million monthly and 140-million daily users, who spend at least one minute on Watch.",Zacks Investment Research,"Fri, 14 Jun 2019 16:51:00 -0400",,Positive,Article,FB
https://www.youtube.com/watch?v=fFPd-FmJY_Y,https://cdn.snapi.dev/images/v1/w/a/facebook-to-introduce-its-own-cryptocurrency.jpg,Facebook to introduce its own cryptocurrency,"Surevest CEO Robert Luna on how Facebook is planning to introduce its own cryptocurrency, Libra.",Fox Business,"Fri, 14 Jun 2019 15:15:29 -0400",,Positive,Video,FB
https://www.cnet.com/news/facebooks-libra-cryptocurrency-reportedly-boasts-big-name-backers/,https://cdn.snapi.dev/images/v1/d/n/gettyimages-1146342188.jpg,Facebook's Libra cryptocurrency reportedly boasts big-name backers,"It's got support from Visa, Mastercard, Uber and PayPal and could be announced as soon as next week, according to The Wall Street Journal.",CNET,"Fri, 14 Jun 2019 14:43:02 -0400",,Positive,Article,FB
https://www.fool.com/investing/2019/06/14/facebook-really-wants-you-to-know-how-sorry-it-is.aspx?source=iedfolrf0000001,https://cdn.snapi.dev/images/v1/d/s/fb64-3.jpg,Facebook Really Wants You to Know How Sorry It Is,And is willing to put its money where its mouth is.,The Motley Fool,"Fri, 14 Jun 2019 14:20:00 -0400",,Neutral,Article,FB
https://www.youtube.com/watch?v=7ubqOYBqDSw,https://cdn.snapi.dev/images/v1/e/e/ees2.jpg,SunTrust: Big Tech breakups would drive shares higher,"Mark Mahaney of RBC Capital Markets and Youssef Squali of SunTrust join ""Squawk Alley"" to discuss the potential for a break up of some of the biggest names in tech.",CNBC Television,"Fri, 14 Jun 2019 13:04:47 -0400",,Neutral,Video,"AAPL,AMZN,FB,GOOG,GOOGL"
https://techcrunch.com/2019/06/14/facebook-is-creating-photorealistic-homes-for-ais-to-work-and-learn-in/,https://cdn.snapi.dev/images/v1/v/u/fb-habitat-hedjpgw684.jpg,Facebook is creating photorealistic homes for AIs to work and learn in,"If AI-powered robots are ever going to help us out around the house, they're going to need a lot of experience navigating human environments. Simulators, virtual worlds that look and behave just like real life are the best place for them to learn, and Facebook has created one of the most advanced such systems yet.",TechCrunch,"Fri, 14 Jun 2019 12:01:56 -0400",,Positive,Article,FB
https://www.cnet.com/news/momentum-grows-to-break-up-big-tech-as-amazon-facebook-google-and-apple-face-scrutiny/,https://cdn.snapi.dev/images/v1/b/i/bigte62.jpg,"Momentum grows to break up big tech, as Amazon, Facebook, Google and Apple face scrutiny     - CNET",Regulators are gearing up to investigate the largest US tech companies. But are breakups of these corporations on the horizon?,CNET,"Fri, 14 Jun 2019 11:43:00 -0400",,Negative,Article,"AAPL,AMZN,FB,GOOG,GOOGL"
https://investorplace.com/2019/06/fb-cryptocurrency-details/,https://cdn.snapi.dev/images/v1/k/g/facebook-3474124b-11.jpg,FB Cryptocurrency: 12 Things We Know About Facebook’s Project Libra,"A FB cryptocurrency is on the way and 'InvestorPlace' has a few things you might want to know about the virtual currency.
The post FB Cryptocurrency: 12 Things We Know About Facebook’s Project Libra appeared first on InvestorPlace.",InvestorPlace,"Fri, 14 Jun 2019 11:23:11 -0400",,Neutral,Article,FB
https://247wallst.com/media/2019/06/14/how-facebook-is-breaking-into-crypto/,https://cdn.snapi.dev/images/v1/v/w/face2.jpg,How Facebook Is Breaking Into Crypto,Facebook Inc. (NASDAQ: FB) shares made a handy gain on Friday after over a dozen companies said that they were ready to back its upcoming foray into cryptocurrency.,24/7 Wall Street,"Fri, 14 Jun 2019 11:20:15 -0400",,Neutral,Article,FB
https://www.investors.com/news/technology/facebook-cryptocurrency-plans-facebook-coin/,https://cdn.snapi.dev/images/v1/f/b/fbcry4.jpg,Will Facebook Unveil Its Plans For A Cryptocurrency This Week?,"A Facebook cryptocurrency could enable a new era of e-commerce and payments for the social network, allowing users to change dollars and other currencies into digital coins for purchases.",Investors Business Daily,"Fri, 14 Jun 2019 11:16:18 -0400",,Neutral,Article,FB
https://www.benzinga.com/markets/cryptocurrency/19/06/13921269/report-facebooks-planned-cryptocurrency-has-visa-paypal-others-on-board,https://cdn.snapi.dev/images/v1/f/a/fa33.jpg,"Report: Facebook's Planned Cryptocurrency Has Visa, PayPal, Others On Board",Facebook is set to unveil the cryptocurrency.,Benzinga,"Fri, 14 Jun 2019 09:58:10 -0400",,Positive,Article,"FB,PYPL,V,MA,UBER"
https://www.youtube.com/watch?v=jT1MJHxT3q4,https://cdn.snapi.dev/images/v1/e/s/esa2-3.jpg,Concerns over Big Tech's power has collided with inequality.,Concerns over Big Tech's power has collided with the nationwide debate on inequality.,CNBC Television,"Fri, 14 Jun 2019 09:56:46 -0400",,Negative,Video,"AAPL,AMZN,FB,GOOG,GOOGL"
https://www.zacks.com/stock/news/429675/is-facebook-fb-stock-outpacing-its-computer-and-technology-peers-this-year,https://cdn.snapi.dev/images/v1/6/x/facebook-ios2.jpg,Is Facebook (FB) Stock Outpacing Its Computer and Technology Peers This Year?,Is  (FB) Outperforming Other Computer and Technology Stocks This Year?,Zacks Investment Research,"Fri, 14 Jun 2019 09:30:16 -0400",,Positive,Article,FB
https://www.cnbc.com/2019/06/14/facebook-cryptocurrency-token-may-be-very-important-to-company-rbc.html,https://cdn.snapi.dev/images/v1/f/w/facebook-4002400-1920.jpg,"Facebook's cryptocurrency may be 'one of the most important initiatives' in its history, RBC says","RBC Capital Markets believes that Facebook has a ""crypto opportunity,"" explaining in a note to investors the firm's high expectation.",CNBC,"Fri, 14 Jun 2019 07:54:00 -0400",,Positive,Article,FB
https://www.cnbc.com/2019/06/14/facebook-google-twitter-need-to-do-more-to-tackle-fake-news-eu-says.html,https://cdn.snapi.dev/images/v1/t/3/sel23-2.jpg,"Facebook, Google and Twitter need to do more to tackle fake news, EU says","In a report published Friday, the EU found evidence of ""coordinated inauthentic behavior"" on online platforms ahead of the European Parliament elections last month.",CNBC,"Fri, 14 Jun 2019 07:31:00 -0400",,Neutral,Article,"FB,GOOG,GOOGL,TWTR"
https://www.marketwatch.com/story/want-to-get-paid-for-sharing-your-data-with-facebook-read-this-first-2019-06-14,https://cdn.snapi.dev/images/v1/f/b/fba723.jpg,Want to get paid for sharing your data with Facebook? Read this first,"Facebook wants to pay users to fork over their data, but privacy experts say the risks could outweigh the potential financial benefits.",Market Watch,"Fri, 14 Jun 2019 05:51:46 -0400",,Neutral,Article,FB
