news_url,image_url,title,text,source_name,date,topics,sentiment,type,tickers
https://www.benzinga.com/news/21/01/19175871/facebook-sues-two-over-scraping-user-data-through-malicious-browser-extensions,https://cdn.snapi.dev/images/v1/d/g/4323jpgwidth460quality85autoformatfitmaxsd23509160f577b87a766eca084f53ac1.jpg,Facebook Sues Two Over Scraping User Data Through Malicious Browser Extensions,Facebook Inc (NASDAQ: FB) said Thursday that the company and its Irish unit have filed a lawsuit in Portugal against two people who they accuse of scraping user-profiles from its website. What Happened: The Mark Zuckerberg-led company accused the unnamed defendants of violating its terms of service and Portugal's Database Protection Law in a statement.,Benzinga,"Thu, 14 Jan 2021 23:41:44 -0500",,Negative,Article,FB
https://www.nytimes.com/2021/01/14/technology/trump-facebook-twitter.html,https://cdn.snapi.dev/images/v1/m/e/merlin-182048325-ada21b28-647a-4ed2-b2a2-0fbfc1897693-articlelargejpgquality75autowebpdisableupscale.jpg,Facebook and Twitter Face International Scrutiny after Trump Ban,Human rights groups and activists have spent years urging the companies to do more to remove content that encouraged violence.,NYTimes,"Thu, 14 Jan 2021 13:51:57 -0500","paywall,Political",Negative,Article,"FB,TWTR"
https://techcrunch.com/2021/01/14/whatsapp-faces-legal-challenge-over-privacy-in-its-biggest-market/,https://cdn.snapi.dev/images/v1/g/e/gettyimages-1230557386jpgw601.jpg,WhatsApp faces legal challenge over privacy in its biggest market,"WhatsApp is facing a legal challenge in India, its biggest market, after a petition was filed Thursday before Delhi High Court over the upcoming change in the Facebook-owned app's data sharing policy. The petition alleges the new terms that WhatsApp requires its roughly 450 million users in the country to accept is a violation of […]",TechCrunch,"Thu, 14 Jan 2021 10:59:48 -0500",,Negative,Article,FB
https://www.reuters.com/article/us-india-facebook-whatsapp-l-g/whatsapp-faces-first-legal-challenge-in-india-over-privacy-idUSKBN29J1TR,https://cdn.snapi.dev/images/v1/g/e/gettyimages-1194141073jpgw600-2-webcpt7d69.jpg,WhatsApp faces first legal challenge in India over privacy,"WhatsApp's updated privacy policy verges on user surveillance and threatens India's security, a petition filed in an Indian court said on Thursday, presenting another legal challenge for the Facebook Inc-owned messenger.",Reuters,"Thu, 14 Jan 2021 09:00:00 -0500",,Negative,Article,FB
https://www.reuters.com/article/us-india-facebook-whatsapp/whatsapp-scrambles-as-users-in-big-indian-market-fret-over-privacy-idUSKBN29J148,https://cdn.snapi.dev/images/v1/m/0/m02d20210114t2i1547760188w940fhfwllplsqrlynxmpeh0d0ke.jpg,WhatsApp scrambles as users in big Indian market fret over privacy,"WhatsApp is battling mistrust globally after it updated its privacy policy to let it share some user data with parent Facebook and other group firms, and the backlash risks thwarting its ambitions in its biggest market, India.",Reuters,"Thu, 14 Jan 2021 04:48:00 -0500",,Negative,Article,FB
