news_url,image_url,title,text,source_name,date,topics,sentiment,type,tickers
https://www.cnbc.com/2019/08/12/facebook-hires-daniel-povey-fired-johns-hopkins-professor.html,https://cdn.snapi.dev/images/v1/t/9/f2.jpg,Facebook has hired the professor who Johns Hopkins fired after he stormed a building occupied by protesters,"Facebook told CNBC it has hired Daniel Povey, a speech recognition researcher who was fired this week from John Hopkins University.",CNBC,"Mon, 12 Aug 2019 18:00:00 -0400",,Neutral,Article,FB
https://www.youtube.com/watch?v=zp_KC2CKWN4,https://cdn.snapi.dev/images/v1/m/c/3000jpgwidth460quality85autoformatfitmaxs4e95c5fba5b39bfa448d1e05b6343781.jpg,"Avoid names associated with China, look at software, internet stocks: Alpha One's Niles","Dan Niles, Alpha One Capital founding partner, joins CNBC's ""Closing Bell"" to discuss semiconductor stocks and President Donald Trump's additional proposed tariffs.",CNBC Television,"Mon, 12 Aug 2019 17:13:47 -0400",,Positive,Video,"FB,GOOG,GOOGL"
https://www.theguardian.com/technology/2019/aug/12/facebook-denies-giving-contradictory-evidence-to-parliament,https://cdn.snapi.dev/images/v1/s/l/fbuu.jpg,Facebook denies giving contradictory evidence to parliament,Committee chairman suggested staff knew Cambridge Analytica had misused data,The Guardian,"Mon, 12 Aug 2019 15:38:05 -0400",,Negative,Article,FB
https://www.fool.com/investing/2019/08/12/why-facebook-is-shortening-the-leash-on-its-top-ap.aspx,https://cdn.snapi.dev/images/v1/8/x/facebook-1084449-1920-2-0.jpg,Why Facebook Is Shortening the Leash on Its Top Apps,"The social media giant revealed earlier this month that it will attach its name to a pair of its top-performing subsidiary apps, Instagram and WhatsApp.",The Motley Fool,"Mon, 12 Aug 2019 15:37:00 -0400",,Neutral,Article,FB
https://www.fool.com/investing/2019/08/12/facebook-wants-to-be-source-for-trustworthy-news.aspx,https://cdn.snapi.dev/images/v1/r/6/gettyimages-487867268jpgw618.jpg,"Facebook Wants to Become a Source for ""Trustworthy News""",The social media giant is working on a dedicated news section with premium content.,The Motley Fool,"Mon, 12 Aug 2019 13:43:21 -0400",,Neutral,Article,FB
https://www.investopedia.com/goldman-sachs-service-stocks-will-win-the-trade-war-4767284,https://cdn.snapi.dev/images/v1/s/t/stock923.jpg,Goldman Sachs: Service Stocks will Win the Trade War,Investors should consider services-providing stocks as opposed to goods-producing stocks amid an ongoing trade war that is unlikely to end soon.,Investopedia,"Mon, 12 Aug 2019 10:58:27 -0400",,Positive,Article,"AMZN,BAC,BRK-A,BRK-B,FB,GOOG,GOOGL,JPM,MA,MSFT,V,WMT"
https://www.cnbc.com/2019/08/12/facebook-reportedly-ditched-plans-to-buy-houseparty-over-antitrust-fears.html,https://cdn.snapi.dev/images/v1/5/h/facebook-1jpgquality90stripall.jpg,Facebook reportedly ditched plans to buy a social networking competitor over antitrust fears,"Facebook reportedly considered acquiring video chat app Houseparty, but it abandoned the deal due to concerns around heightened antitrust scrutiny.",CNBC,"Mon, 12 Aug 2019 09:52:00 -0400",,Neutral,Article,FB
https://www.nytimes.com/2019/08/12/technology/facebook-antitrust.html,https://cdn.snapi.dev/images/v1/k/q/chc0cw-ghts-1.jpg,How Facebook Is Changing to Deal With Scrutiny of Its Power,"In both pre-emptive and defensive ways, the social network is modifying its behavior to fend off antitrust concerns.",NYTimes,"Mon, 12 Aug 2019 03:00:04 -0400",paywall,Neutral,Article,FB
