news_url,image_url,title,text,source_name,date,topics,sentiment,type,tickers
https://techcrunch.com/2020/03/03/zuckerberg-details-the-ways-facebook-and-chan-zuckerberg-initiative-are-responding-to-covid-19/,https://cdn.snapi.dev/images/v1/m/a/mark-zuckerberg-georgetownpngw730.jpg,Zuckerberg details the ways Facebook and Chan Zuckerberg Initiative are responding to COVID-19,"Mark Zuckerberg has outlined some of the steps that Facebook and his family’s non-profit, the Chan Zuckerberg Initiative, are taking to respond to the spread of both the novel coronavirus known as COVID-19 and viral misinformation about the illness, in a statement posted earlier this evening.",TechCrunch,"Tue, 03 Mar 2020 23:20:02 -0500",CEO,Positive,Article,FB
https://www.cnbc.com/2020/03/04/coronavirus-facebook-offers-free-ads-to-who-will-remove-flase-claims.html,https://cdn.snapi.dev/images/v1/1/0/105974278-1560857198722gettyimages-1146088646.jpeg,Facebook is giving free ads to the WHO and taking down 'conspiracy theories' about coronavirus,"Facebook CEO Mark Zuckerberg said that the social network will remove ""false claims and conspiracy theories that have been flagged by leading global health organizations.""",CNBC,"Tue, 03 Mar 2020 23:06:51 -0500",,Positive,Article,FB
https://www.cnet.com/news/facebook-might-change-its-libra-cryptocurrency-project-to-include-other-coins/,https://cdn.snapi.dev/images/v1/g/e/gettyimages-1151102628.jpg,Facebook might change Libra cryptocurrency project to include other coins,The social network and its partners are facing regulatory scrutiny.,CNET,"Tue, 03 Mar 2020 18:50:32 -0500",,Neutral,Article,FB
https://www.fool.com/investing/2020/03/03/3-top-artificial-intelligence-stocks-to-watch-in-m.aspx,https://cdn.snapi.dev/images/v1/8/f/urlhttps3a2f2fgfoolcdncom2feditorial2fimages2f5608742fglowing-android-head-with-the-words-artificial-intelligencejpgw700opresize.jpg,3 Top Artificial Intelligence Stocks to Watch in March,Stocks went on sale last week. Here are three to watch.,The Motley Fool,"Tue, 03 Mar 2020 09:27:00 -0500",,Positive,Article,"BIDU,FB,GOOG,GOOGL"
https://www.youtube.com/watch?v=5IvfUf7NZyw,https://cdn.snapi.dev/images/v1/s/o/sosk2wef-1.jpg,"Dwek: Valuations are much more attractive today, and plenty of sectors like tech are going to be appealing","Esty Dwek of Natixis Investment Managers Solutions and Kari Firestone of Aureus Asset Management discuss the markets' massive bounce-back, whether there could be more volatility ahead, and what sectors and stocks offer good opportunities for investors now.",CNBC Television,"Tue, 03 Mar 2020 07:53:06 -0500",,Positive,Video,"AMZN,BABA,CRM,FB,PSX,PYPL,RMAX"
