news_url,image_url,title,text,source_name,date,topics,sentiment,type,tickers
https://seekingalpha.com/article/4336752-facebook-stock-wont-collapse-because-of-fake-accounts,https://cdn.snapi.dev/images/v1/y/4/urlhttps3a2f2fgfoolcdncom2feditorial2fimages2f5163602ffacebook.jpg,Facebook: The Stock Won't Collapse Because Of Fake Accounts,Facebook: The Stock Won't Collapse Because Of Fake Accounts,Seeking Alpha,"Wed, 08 Apr 2020 17:48:02 -0400",,Neutral,Article,FB
https://www.fool.com/investing/2020/04/08/facebook-joins-esports-fray-with-early-debut-of-ga.aspx,https://cdn.snapi.dev/images/v1/y/0/fb77.jpg,Facebook Joins Esports Fray With Early Debut of Gaming Tournaments,"With people all over the world stuck at home with no live sports to watch, competitive video gaming has become all the rage.",The Motley Fool,"Wed, 08 Apr 2020 14:23:00 -0400",,Neutral,Article,FB
https://www.cnbc.com/2020/04/08/instagrams-kevin-systrom-ignored-suggestions-to-copy-snapchat-stories.html,https://cdn.snapi.dev/images/v1/g/o/goek2m33.jpg,Instagram's co-founder ignored suggestions to copy Snapchat's best feature before finally relenting,"In the upcoming book ""No Filter: The Inside Story of Instagram,"" Bloomberg reporter Sarah Frier lays out the case that Instagram Co-founder Kevin Systrom was actually the main obstacle to be overcome in the social network's decision to rip off rival Snapchat's Stories feature, rather than the mastermind behind the sea-shifting decision.",CNBC,"Wed, 08 Apr 2020 13:08:01 -0400",,Neutral,Article,FB
https://techcrunch.com/2020/04/08/lacking-eyeballs-facebooks-ad-review-system-fails-to-spot-coronavirus-harm/,https://cdn.snapi.dev/images/v1/l/6/105632161-1545065307257employeewalkspastafacebooklogo.jpg,"Lacking eyeballs, Facebook’s ad review system fails to spot coronavirus harm","Facebook’s ad review system is failing to prevent coronavirus misinformation from being targeted at its users, according to an investigation by Consumer Reports. The not-for-profit consumer advocacy organization set out to test Facebook’s system by setting up a page for a made-up organization, called the Self Preservation Society, and creating ads that contained false or […]",TechCrunch,"Wed, 08 Apr 2020 12:36:46 -0400",,Neutral,Article,FB
https://www.youtube.com/watch?v=NGzF4lg8EOg,https://cdn.snapi.dev/images/v1/m/q/there-was-a-lot-of-opportunity-in-second-half-of-q1-oakmarks-coniaris.jpg,There was a lot of opportunity in second half of Q1: Oakmark's Coniaris,"Tony Coniaris, portfolio manager at Oakmark, joins ""Squawk Alley"" to discuss the markets and trading during the selloff.",CNBC Television,"Wed, 08 Apr 2020 12:24:39 -0400",,Positive,Video,"BKNG,EOG,FB,STZ,STZ-B"
https://investorplace.com/2020/04/3-reasons-facebook-fb-stock-is-a-long-term-buy/,https://cdn.snapi.dev/images/v1/9/3/fb-6.jpg,3 Reasons Facebook Stock Is a Long-Term Buy,"Facebook stock is still well off its highs. While that's frustrating for current investors, it presents a long-term opportunity in FB stock.",InvestorPlace,"Wed, 08 Apr 2020 10:51:40 -0400",,Positive,Article,FB
https://www.zacks.com/stock/news/860699/facebook-fb-launches-tuned-app-for-couples-amid-lockdown,https://cdn.snapi.dev/images/v1/p/m/m02d20190509t2i1385364613rlynxnpef481eaw640-2.jpg,Facebook (FB) Launches Tuned App for Couples Amid Lockdown,Facebook (FB) launches free Tuned app for couples in the United States and Canada amid coronavirus-induced lockdown.,Zacks Investment Research,"Wed, 08 Apr 2020 09:30:00 -0400",,Positive,Article,FB
https://news.sky.com/story/facebook-launches-tuned-app-to-let-couples-build-digital-scrapbook-11970522,https://cdn.snapi.dev/images/v1/s/k/skynews-facebook-tuned-4965106jpg20200408133348.jpg,Facebook launches Tuned app for couples,Facebook has launched an app for couples called Tuned that will allow them to build a digital scrapbook.,Skynews,"Wed, 08 Apr 2020 08:25:00 -0400",,Positive,Article,FB
https://www.fool.com/investing/2020/04/08/coronavirus-bear-market-5-large-cap-stocks-to-buy.aspx,https://cdn.snapi.dev/images/v1/y/8/urlhttps3a2f2fgfoolcdncom2feditorial2fimages2f5668052ffinancial-newspaper-dollar-sign-gettyjpgw700opresize.jpg,Coronavirus Bear Market: 5 Large-Cap Stocks to Buy,Adding brand-name businesses to your portfolio is a smart way to play the steepest downturn in stock market history.,The Motley Fool,"Wed, 08 Apr 2020 06:06:00 -0400",,Positive,Article,"AMT,CVS,FB,KO,MCD"
