news_url,image_url,title,text,source_name,date,topics,sentiment,type,tickers
https://seekingalpha.com/article/4341309-facebook-inc-fb-ceo-mark-zuckerberg-on-q1-2020-results-earnings-call-transcript,https://cdn.snapi.dev/images/v1/n/z/transcript31-2.jpg,"Facebook, Inc. (FB) CEO Mark Zuckerberg on Q1 2020 Results - Earnings Call Transcript","Facebook, Inc. (FB) CEO Mark Zuckerberg on Q1 2020 Results - Earnings Call Transcript",Seeking Alpha,"Wed, 29 Apr 2020 23:56:17 -0400",CallScript,Neutral,Article,FB
https://www.marketwatch.com/story/musk-vs-zuck-a-tale-of-two-ceos-acting-much-differently-during-a-pandemic-2020-04-29,https://cdn.snapi.dev/images/v1/w/d/wdew23.jpg,MarketWatch First Take: Musk vs. Zuck: A tale of two CEOs acting much differently during a pandemic,"The stark contrast in how Elon Musk and Mark Zuckerberg are dealing with the global pandemic was on display Wednesday, with Tesla’s CEO calling the ongoing shelter-in-place orders fascist, while Facebook’s CEO sounded like a realistic statesman in their conference calls with Wall Street.",Market Watch,"Wed, 29 Apr 2020 22:23:36 -0400",CEO,Neutral,Article,"FB,TSLA"
https://www.youtube.com/watch?v=dXjvVCzP4jc,https://cdn.snapi.dev/images/v1/k/g/facebooks-recovery-will-be-slow-due-to-other-business-re-opening-says-emarketer-analyst.jpg,"Facebook's Recovery Will be Slow Due to Other Business' Re-opening, Says eMarketer Analyst","Debra Aho Williamson, eMarketer analyst, discusses Facebook earnings on ""Bloomberg Technology.",Bloomberg Technology,"Wed, 29 Apr 2020 19:46:49 -0400",earnings,Neutral,Video,FB
https://www.cnbc.com/2020/04/29/facebook-needs-an-encore-beyond-advertising-says-gene-munster.html,https://cdn.snapi.dev/images/v1/l/n/104114592-gettyimages-620896858.jpg,Facebook needs an 'encore' beyond advertising to make Gene Munster believe in the stock,"The Loup Ventures managing partner said progress on virtual reality and augmented reality would make him ""more optimistic"" around Facebook's stock.",CNBC,"Wed, 29 Apr 2020 19:07:58 -0400",earnings,Neutral,Article,FB
https://www.cnet.com/news/facebook-sees-strong-user-growth-as-coronavirus-pandemic-creates-uncertainty/,https://cdn.snapi.dev/images/v1/h/m/fbt2-2.jpg,Facebook sees strong user growth as coronavirus pandemic creates uncertainty,"A total of 2.6 billion people are using the social network every month, says Facebook.",CNET,"Wed, 29 Apr 2020 18:15:00 -0400",earnings,Positive,Article,FB
https://www.nytimes.com/2020/04/29/technology/facebook-earnings-advertising-virus.html,https://cdn.snapi.dev/images/v1/j/z/ze2.jpg,Facebook Points to ‘Signs of Stability’ as Ad Declines Flatten,The company reported rising revenue and profit in the first quarter and said it was also saving on expenses.,NYTimes,"Wed, 29 Apr 2020 18:08:07 -0400","earnings,paywall",Positive,Article,FB
https://www.gurufocus.com/news/1120735/facebook-vs-tesla-follow-up,https://cdn.snapi.dev/images/v1/9/e/ij9223f-1.jpg,Facebook vs. Tesla: Follow Up,"Hi fellow investors,",GuruFocus,"Wed, 29 Apr 2020 17:57:51 -0400",,Neutral,Article,"FB,TSLA"
https://www.youtube.com/watch?v=_30tatOXYP8,https://cdn.snapi.dev/images/v1/0/d/loup-ventures-gene-munster-breaks-down-facebooks-quarter.jpg,Loup Ventures' Gene Munster breaks down Facebook's quarter,Loup Ventures' Gene Munster breaks down the near- and long-term outlook for Facebook.,CNBC Television,"Wed, 29 Apr 2020 17:56:16 -0400",earnings,Positive,Video,FB
https://www.cnn.com/2020/04/29/tech/facebook-earnings-pandemic/index.html,https://cdn.snapi.dev/images/v1/b/s/facebook-downpngw730.jpg,Facebook's business is looking resilient despite pandemic,"Facebook's core advertising business has been upended by the pandemic, but the company said it saw ""signs of stability"" in the first three weeks of April.",CNN Business,"Wed, 29 Apr 2020 17:54:43 -0400",,Positive,Article,FB
https://www.cnbc.com/2020/04/29/facebook-ceo-zuckerberg-warns-against-reopening-public-spaces-too-soon.html,https://cdn.snapi.dev/images/v1/1/0/106393418-158180152976620200215-mzuckerberg-alone-1.jpg,Zuckerberg warns against reopening public spaces too soon,"Facebook CEO Mark Zuckerberg warned Wednesday that reopening public spaces too soon ""almost guarantees"" continued outbreaks and longer economic outcomes.",CNBC,"Wed, 29 Apr 2020 17:44:54 -0400",CEO,Neutral,Article,FB
https://www.youtube.com/watch?v=1gqxY_z7ANQ,https://cdn.snapi.dev/images/v1/w/a/facebook-reports-earnings-do-the-fm-traders-like-what-they-heard.jpg,"Facebook reports earnings, do the FM traders like what they heard?",Facebook soars after announcing earnings.,CNBC Television,"Wed, 29 Apr 2020 17:44:17 -0400",earnings,Neutral,Video,FB
https://techcrunch.com/2020/04/29/the-quarantine-is-driving-record-usage-growth-at-facebook/,https://cdn.snapi.dev/images/v1/4/y/fb66-1.jpg,The quarantine is driving record usage growth at Facebook,"The quarantine lockdown is driving a record number of users to Facebook’s products. On a conference call, CEO Mark Zuckerberg disclosed a number of new metrics highlighting a significant bump in Facebook usage during the broader quarantine lockdown.",TechCrunch,"Wed, 29 Apr 2020 17:43:58 -0400",earnings,Positive,Article,FB
https://www.zacks.com/stock/news/899507/facebook-fb-q1-earnings-lag-estimates,https://cdn.snapi.dev/images/v1/s/f/fb66-2.jpg,Facebook (FB) Q1 Earnings Lag Estimates,"Facebook (FB) delivered earnings and revenue surprises of -1.16% and 2.61%, respectively, for the quarter ended March 2020. Do the numbers hold clues to what lies ahead for the stock?",Zacks Investment Research,"Wed, 29 Apr 2020 17:25:08 -0400",earnings,Negative,Article,FB
https://investorplace.com/2020/04/4-top-stock-trades-for-thursday-fb-amd-ba-aprn/,https://cdn.snapi.dev/images/v1/i/h/stoc92.jpg,"4 Top Stock Trades for Thursday: FB, AMD, BA, APRN","Facebook, Advanced Micro Devices, Boeing and Blue Apron were our top stock trades for Thursday. That said, here's a look at the charts.",InvestorPlace,"Wed, 29 Apr 2020 17:23:40 -0400",,Neutral,Article,"AMD,BA,FB,APRN"
https://www.reuters.com/article/us-facebook-results/facebook-beating-revenue-estimates-sees-signs-of-stability-in-ad-spending-idUSKBN22B34L,https://cdn.snapi.dev/images/v1/i/x/osqxj4-0a7y-1.jpg,"Facebook, beating revenue estimates, sees signs of stability in ad spending","Facebook Inc  beat analysts' estimates for quarterly revenue on Wednesday and said it has seen ""signs of stability"" for sales in April after a plunge in March, in yet another indication that tech giants may weather the coronavirus-induced economic collapse better than other sectors.",Reuters,"Wed, 29 Apr 2020 17:20:05 -0400",earnings,Positive,Article,FB
https://www.fastcompany.com/90499025/facebook-sees-a-big-jump-in-users-during-lockdowns-but-advertising-takes-a-hit,https://cdn.snapi.dev/images/v1/1/d/chc0cw-ghts-1.jpg,"Facebook sees a big jump in users during lockdowns, but advertising takes a hit",Your suspicions were correct. More people are using Facebook services as coronavirus lockdowns keep us trapped indoors.,Fast Company,"Wed, 29 Apr 2020 17:10:02 -0400",earnings,Positive,Article,FB
https://www.cnbc.com/2020/04/29/facebook-cfo-cautious-on-companys-ad-revenue-amid-pandemic.html,https://cdn.snapi.dev/images/v1/f/z/fb2.jpg,Facebook CFO David Wehner says ad revenue outlook 'really uncertain' amid pandemic,Facebook shares jumped in after-hours trading Wednesday after the company announced mixed first-quarter results.,CNBC,"Wed, 29 Apr 2020 17:06:06 -0400","earnings,CFO",Negative,Article,FB
https://www.youtube.com/watch?v=key_w7MADE8,https://cdn.snapi.dev/images/v1/4/t/facebook-cfo-we-had-a-steep-decline-in-ad-revenue-in-march.jpg,Facebook CFO: 'We had a steep decline in ad revenue in March',"Facebook CFO David Wehner joins ""Closing Bell"" to talk about the company's earnings and advertising revenue.",CNBC Television,"Wed, 29 Apr 2020 16:55:11 -0400","earnings,CFO",Neutral,Video,FB
https://www.theguardian.com/technology/2020/apr/29/facebook-quarterly-earnings-results,https://cdn.snapi.dev/images/v1/n/h/fb1-6.jpg,Facebook reports slowest quarterly growth since going public,Company earns $4.9bn as it faces slowdown in digital advertising market amid coronavirus,The Guardian,"Wed, 29 Apr 2020 16:39:52 -0400",earnings,Negative,Article,FB
https://www.reuters.com/article/us-facebook-results/facebook-sees-signs-of-stability-in-ad-spending-idUSKBN22B34L,https://cdn.snapi.dev/images/v1/s/p/fb4.jpg,Facebook sees signs of stability in ad spending,"Facebook Inc  beat analysts' estimates for quarterly revenue on Wednesday, and said it has seen signs of stability in ad spending during the first three weeks of April.",Reuters,"Wed, 29 Apr 2020 16:27:21 -0400",earnings,Positive,Article,FB
https://investorplace.com/2020/04/facebook-earnings-boost-fb-stock-up/,https://cdn.snapi.dev/images/v1/w/c/105223282-gettyimages-953502232530x298.jpg,Facebook Earnings: FB Stock Soars 10% Despite Q1 EPS Miss,"Facebook (FB) earnings for the social media company's first quarter of 2020 have FB stock soaring higher after-hours Wednesday.
The post Facebook Earnings: FB Stock Soars 10% Despite Q1 EPS Miss appeared first on InvestorPlace.",InvestorPlace,"Wed, 29 Apr 2020 16:26:21 -0400",earnings,Positive,Article,FB
https://www.cnet.com/news/facebook-sees-strong-user-growth-amid-coronavirus-pandemic/,https://cdn.snapi.dev/images/v1/u/8/ftw2.jpg,Facebook sees strong user growth amid coronavirus pandemic,"A total of 2.6 billion people are using the social network every month, says Facebook.",CNET,"Wed, 29 Apr 2020 16:26:00 -0400",earnings,Positive,Article,FB
https://techcrunch.com/2020/04/29/facebook-stock-spikes-despite-significant-reduction-in-demand-for-ads/,https://cdn.snapi.dev/images/v1/k/e/f2.jpg,Facebook stock spikes despite ‘significant reduction’ in demand for ads,"The coronavirus pandemic is significantly slowing the growth of Facebook’s ads business, but investors seems pleased with the company’s performance in Q1 after Facebook released its earnings report Wednesday. The company beat Wall Street expectations on revenue, sharing that they had made $17.74 billion on while follow short on earnings per share at $1.71.",TechCrunch,"Wed, 29 Apr 2020 16:23:31 -0400",earnings,Positive,Article,FB
https://deadline.com/2020/04/facebook-tops-q1-1202921332/,https://cdn.snapi.dev/images/v1/g/3/facebook-1084449-1920-2-0.jpg,Facebook Surpasses 2.6B Users But Misses Q1 Profit Target On Pandemic Ad Slowdown,"Facebook topped Wall Street estimates for revenue in the first quarter with an 18% gain but missed targets for earnings per share. Total revenue came in at $17.7 billion, while earnings of $1.71 per share missed analysts’ consensus by three cents. The company said its daily active users rose 11% in March compared with the",Deadline,"Wed, 29 Apr 2020 16:22:19 -0400",earnings,Negative,Article,FB
https://www.marketwatch.com/story/facebook-earnings-and-user-growth-miss-expectations-but-stock-still-spikes-2020-04-29,https://cdn.snapi.dev/images/v1/d/r/fb64-3.jpg,"Facebook earnings and user growth miss expectations, but stock still spikes",The advertising bug that bit Alphabet Inc. and Snap Inc. got around to Facebook Inc.,Market Watch,"Wed, 29 Apr 2020 16:22:01 -0400",earnings,Positive,Article,FB
https://www.forbes.com/sites/sergeiklebnikov/2020/04/29/facebook-shares-jump-over-8-after-beating-q1-revenue-expectations/,https://cdn.snapi.dev/images/v1/f/u/facebook-shares-jump-over-8-after-beating-q1-revenue-expectations.jpg,Facebook Shares Jump Over 8% After Beating Q1 Revenue Expectations,"The company reported “stability” in ad revenue, despite a slowdown in March.",Forbes,"Wed, 29 Apr 2020 16:21:38 -0400",earnings,Positive,Article,FB
https://www.benzinga.com/news/earnings/20/04/15913747/facebook-reports-q1-sales-beat-users-up-10,https://cdn.snapi.dev/images/v1/g/6/105239873-gettyimages-962171220.jpg,"Facebook Reports Q1 Sales Beat, Users Up 10%","Facebook Inc (NASDAQ: FB) reported quarterly earnings of $1.71 per share on Wednesday, which missed the analyst consensus estimate of $1.74.",Benzinga,"Wed, 29 Apr 2020 16:20:54 -0400",earnings,Positive,Article,FB
https://247wallst.com/media/2020/04/29/why-facebook-earnings-are-so-great/,https://cdn.snapi.dev/images/v1/p/k/106293222-1576170081424gettyimages-1185053406.jpeg,Why Facebook Earnings Are So Great,Facebook Inc. (NASDAQ: FB) released first-quarter financial results after markets closed Wednesday.,24/7 Wall Street,"Wed, 29 Apr 2020 16:19:43 -0400",earnings,Positive,Article,FB
https://www.reuters.com/article/us-facebook-results/facebook-beats-quarterly-revenue-estimates-idUSKBN22B34L,https://cdn.snapi.dev/images/v1/r/f/rfew245.jpg,Facebook beats quarterly revenue estimates,"Facebook Inc  beat analysts' estimates for quarterly revenue on Wednesday, and said it will not provide a specific revenue forecast for the second quarter or full-year 2020.",Reuters,"Wed, 29 Apr 2020 16:15:58 -0400",earnings,Positive,Article,FB
https://www.cnbc.com/2020/04/29/facebook-fb-earnings-q1-2020.html,https://cdn.snapi.dev/images/v1/b/3/gettyimages-630348652.jpg,Here's what to expect when Facebook (FB) reports earnings after the bell,"Facebook has seen an increase in user engagement as a result of the coronavirus, but it has also warned that the pandemic has adversely affected the company's advertising business.",CNBC,"Wed, 29 Apr 2020 15:32:48 -0400",earnings,Neutral,Article,FB
https://news.sky.com/story/coronavirus-facebook-warns-increased-engagement-during-lockdowns-may-not-last-11980827,https://cdn.snapi.dev/images/v1/2/h/fbwa7.jpg,Facebook warns 'increased engagement' during lockdowns may not last,Facebook has reported a leap in user numbers as many of its key territories entered lockdown conditions to combat the spread of coronavirus.,Skynews,"Wed, 29 Apr 2020 15:24:00 -0400",earnings,Neutral,Article,FB
https://www.fool.com/investing/2020/04/29/why-facebook-stock-popped-today.aspx,https://cdn.snapi.dev/images/v1/r/n/m02d20190618t2i1398988328rlynxnpef5h0mlw640.jpg,Why Facebook (FB) Stock Popped Today,Shares of the social media giant rose after rival Alphabet passed its earnings report.,The Motley Fool,"Wed, 29 Apr 2020 12:26:00 -0400",,Positive,Article,FB
https://247wallst.com/media/2020/04/29/how-will-advertising-play-into-facebooks-q1-results/,https://cdn.snapi.dev/images/v1/6/o/105178559-rts1pfzi.jpg,How Will Advertising Play Into Facebook’s Q1 Results?,Facebook Inc. (NASDAQ: FB) is set to report its most recent quarterly results after the markets close on Wednesday.,24/7 Wall Street,"Wed, 29 Apr 2020 11:18:17 -0400",earnings,Positive,Article,FB
https://seekingalpha.com/article/4340928-price-outweighs-performance,https://cdn.snapi.dev/images/v1/9/0/wd2e.jpg,Price Outweighs Performance,Price Outweighs Performance,Seeking Alpha,"Wed, 29 Apr 2020 09:52:55 -0400",,Neutral,Article,"AMZN,FB,GOOG,GOOGL,NFLX"
https://www.forbes.com/sites/adamsarhan/2020/04/29/earnings-preview-what-to-expect-from-facebook-on-wednesday/,https://cdn.snapi.dev/images/v1/u/n/earnings-preview-what-to-expect-from-facebook-on-wednesday.jpg,Earnings Preview: What To Expect From Facebook On Wednesday,Facebook Inc. is expected to report $1.72/share on $17.61 billion in revenue.,Forbes,"Wed, 29 Apr 2020 09:23:53 -0400",earnings,Positive,Article,FB
https://www.investors.com/news/technology/facebook-stock-ad-outlook-quarterly-earnings-could-hit/,https://cdn.snapi.dev/images/v1/b/j/910.jpg,Ad Outlook In Earnings Report Could Have Big Impact On Facebook Stock,"Facebook reports quarterly earnings Wednesday, providing an inside look at the ad market in the coronavirus environment. Facebook stock fell the last time it commented on ad spending.",Investors Business Daily,"Wed, 29 Apr 2020 09:00:39 -0400",earnings,Neutral,Article,FB
https://investorplace.com/2020/04/buy-roku-or-snap-avoid-fb-stock/,https://cdn.snapi.dev/images/v1/8/e/data-internet22.jpg,"Buy Roku or Snap, but Avoid FB Stock Before and After Earnings","A rule change by Google and high IT security spending will hurt Facebook's results. Consequently, investors should avoid FB stock.",InvestorPlace,"Wed, 29 Apr 2020 07:57:30 -0400",earnings,Neutral,Article,"FB,ROKU,SNAP"
