news_url,image_url,title,text,source_name,date,topics,sentiment,type,tickers
https://investorplace.com/2020/05/7-stocks-to-buy-from-the-trimtabs-all-cap-us-free%e2%80%90cash%e2%80%90flow-etf/,https://cdn.snapi.dev/images/v1/d/w/urlhttps3a2f2fgfoolcdncom2feditorial2fimages2f5518482flaptop-computer-coffee-mug-and-phone-sitting-on-desk-with-sunrise-in-background-morning-1jpgw700opresize.jpg,7 Stocks to Buy From the TrimTabs All Cap US Free‐Cash‐Flow ETF,"As companies scramble for cash during the novel coronavirus outbreak, the ones with growing free cash flow are the best stocks to buy. ",InvestorPlace,"Tue, 05 May 2020 13:45:56 -0400",,Positive,Article,"AAPL,FB,LULU,MNST,MSCI,SAM,ZTS"
https://www.fool.com/investing/2020/05/05/facebooks-vr-unit-working-on-new-quest-headset.aspx,https://cdn.snapi.dev/images/v1/g/g/urlhttps3a2f2fgfoolcdncom2feditorial2fimages2f5163602ffacebook.jpg,Facebook's VR Unit Working on New Quest Stand-Alone Headset,The timing for the launch of the new standalone VR headset is questionable given the supply chain disruptions caused by the pandemic.,The Motley Fool,"Tue, 05 May 2020 10:30:00 -0400",,Neutral,Article,FB
https://seekingalpha.com/article/4343039-faangs-reported-earnings-last-week-valuation-implications-and-recommendations,https://cdn.snapi.dev/images/v1/a/d/facebook-google-and-the-rest-of-big-tech-have-too-much-influence-hardly.jpg,The FAANGs Reported Earnings Last Week: Valuation Implications And Recommendations,Last week the mega cap tech names reported earnings.,Seeking Alpha,"Tue, 05 May 2020 10:15:01 -0400",,Neutral,Article,"AAPL,AMZN,FB,GOOG,GOOGL,MSFT,NFLX"
https://investorplace.com/2020/05/7-tech-stocks-you-should-buy-now-despite-coronavirus-fears/,https://cdn.snapi.dev/images/v1/d/5/tech1600a-768x432.jpg,7 Tech Stocks You Should Buy Now Despite Coronavirus Fears,Don't throw out all your tech stocks in a panic. These seven companies will continue to seriously deliver through this year and beyond.,InvestorPlace,"Tue, 05 May 2020 09:18:02 -0400",,Positive,Article,"AVLR,BR,FB,PANW,ROP,WORK"
https://www.fool.com/investing/2020/05/05/why-facebooks-share-price-soared-23-in-april.aspx,https://cdn.snapi.dev/images/v1/w/j/fb64-3.jpg,Why Facebook's Share Price Soared 23% in April,Lockdowns due to the coronavirus pandemic have massively increased usage of the social media giant's apps.,The Motley Fool,"Tue, 05 May 2020 09:13:00 -0400",,Positive,Article,FB
https://www.fool.com/investing/2020/05/05/facebook-eyes-a-huge-opportunity-in-e-commerce.aspx,https://cdn.snapi.dev/images/v1/c/a/fb4.jpg,Facebook Eyes a Huge Opportunity in E-Commerce,The pandemic could provide the final push for the social media giant to break into online retail.,The Motley Fool,"Tue, 05 May 2020 09:10:00 -0400",,Positive,Article,FB
https://www.fool.com/investing/2020/05/05/facebook-stock-deal-avoiding-coronavirus-earnings.aspx,https://cdn.snapi.dev/images/v1/u/h/chc0cw-ghts-1.jpg,Facebook Stock Is a Deal After Avoiding a Coronavirus Earnings Disaster,It's less about this year’s profit margins and more about the massive cash hoard getting deployed for the future.,The Motley Fool,"Tue, 05 May 2020 09:02:47 -0400",earnings,Positive,Article,FB
https://www.zacks.com/stock/news/913797/6-tech-giants-setting-the-northbound-trajectory-of-wall-street,https://cdn.snapi.dev/images/v1/5/s/paoakdew3-1.jpg,6 Tech Giants Setting the Northbound Trajectory of Wall Street,"Among the top performers, it was the technology sector that alone set the Wall Street rally on track.",Zacks Investment Research,"Tue, 05 May 2020 08:47:00 -0400",,Positive,Article,"AAPL,ADBE,FB,GOOGL,MSFT,NVDA"
https://seekingalpha.com/article/4342983-facebook-long-term-winner-short-term-headwinds,https://cdn.snapi.dev/images/v1/e/k/fbt2-2.jpg,Facebook: Long-Term Winner But Short-Term Headwinds,Facebook: Long-Term Winner But Short-Term Headwinds,Seeking Alpha,"Tue, 05 May 2020 08:33:17 -0400",,Neutral,Article,FB
