news_url,image_url,title,text,source_name,date,topics,sentiment,type,tickers
https://www.marketwatch.com/story/facebook-reaches-deals-to-show-official-music-videos-report-2020-07-30,https://cdn.snapi.dev/images/v1/j/y/facebook-logo-1.jpg,Facebook reaches deals to show official music videos: report,"Facebook Inc. FB, +0.51% has reached agreements with the three largest music companies for the rights to show official music videos on its platform, Bloomberg News reported Thursday night.",Market Watch,"Thu, 30 Jul 2020 23:54:22 -0400",,Positive,Article,FB
https://www.youtube.com/watch?v=9Sdhyh7cLLI,https://cdn.snapi.dev/images/v1/2/d/facebook-q2-earnings-and-revenues-beat-estimates.jpg,Facebook Q2 earnings and revenues beat estimates,Facebook grew its revenue 11% over last year as its advertising business remained resilient despite the pandemic-related slowdown across the broader ad industry.,Yahoo Finance,"Thu, 30 Jul 2020 23:13:11 -0400",earnings,Positive,Video,FB
https://seekingalpha.com/article/4362679-facebook-inc-fb-ceo-mark-zuckerberg-on-q2-2020-results-earnings-call-transcript,https://cdn.snapi.dev/images/v1/c/2/transcript16.jpg,"Facebook, Inc. (FB) CEO Mark Zuckerberg on Q2 2020 Results - Earnings Call Transcript","Facebook, Inc. (FB) CEO Mark Zuckerberg on Q2 2020 Results - Earnings Call Transcript",Seeking Alpha,"Thu, 30 Jul 2020 22:24:04 -0400",CallScript,Neutral,Article,FB
https://www.youtube.com/watch?v=UUa5nYDg1o8,https://cdn.snapi.dev/images/v1/m/q/the-crisis-is-a-terrible-thing-to-waste-for-big-tech-jim-cramer-says.jpg,"The crisis is a 'terrible thing to waste' for Big Tech, Jim Cramer says","""These big tech stocks have been roaring because they either benefit directly from the pandemic or they've figured out how to thrive, in spite of it,"" the ""Mad Money"" host said.",CNBC Television,"Thu, 30 Jul 2020 19:03:32 -0400","earnings,cramer,madmoney",Positive,Video,"AAPL,AMZN,FB,GOOG,GOOGL"
https://www.cnbc.com/2020/07/30/jim-cramer-reacts-to-amazon-apple-facebook-and-alphabet-earnings.html,https://cdn.snapi.dev/images/v1/9/2/105940458-1559231679482img-5187.jpg,"Jim Cramer reacts to Amazon, Apple, Facebook and Alphabet earnings","""These big tech stocks have been roaring because they either benefit directly from the pandemic or they've figured out how to thrive in spite of it,"" the ""Mad Money"" host said.",CNBC,"Thu, 30 Jul 2020 18:51:40 -0400","earnings,cramer",Neutral,Article,"AAPL,AMZN,FB,GOOG,GOOGL"
https://www.cnbc.com/2020/07/30/facebook-ceo-zuckerberg-no-end-in-sight-for-work-from-home.html,https://cdn.snapi.dev/images/v1/x/r/osqxj4-0a7y-1.jpg,Zuckerberg says there's 'no end in sight' for Facebook employees working from home,Facebook CEO Mark Zuckerberg on Thursday said there is no timetable for when employees will return to the company's offices amid a continuing surge in Covid-19 cases in the U.S.,CNBC,"Thu, 30 Jul 2020 18:29:48 -0400",,Neutral,Article,FB
https://www.youtube.com/watch?v=P6H2b2vFJdc,https://cdn.snapi.dev/images/v1/r/u/amazon-apple-facebook-and-google-all-report-earnings-cnbc-after-hours.jpg,"Amazon, Apple, Facebook and Google all report earnings: CNBC After Hours",CNBC.com's MacKenzie Sigalos brings you the day's top business news headlines.,CNBC,"Thu, 30 Jul 2020 18:28:28 -0400",earnings,Positive,Video,"AAPL,AMZN,FB,GOOG,GOOGL"
https://techcrunch.com/2020/07/30/big-tech-crushes-q2-earnings-expectations/,https://cdn.snapi.dev/images/v1/o/s/osls2222.jpg,Big tech crushes Q2 earnings expectations,"Today after the bell, Apple, Alphabet, Facebook and Amazon reported their earnings results. Each bested expectations, and all but one are up sharply in after-hours trading.",TechCrunch,"Thu, 30 Jul 2020 17:43:14 -0400",earnings,Positive,Article,"AAPL,AMZN,FB,GOOG,GOOGL"
https://www.fastcompany.com/90535006/facebook-stock-rockets-to-record-high-despite-an-advertiser-boycott-and-never-ending-pandemic,https://cdn.snapi.dev/images/v1/o/s/osls222.jpg,"Facebook stock rockets to record high, despite advertiser boycott and never-ending pandemic","More people are using Facebook services, including Instagram, WhatsApp, and Messenger, during the coronavirus shutdowns.
Facebook shares catapulted to an all-time high in after-hours trading today after the social media giant posted significantly better-than-expected earnings for the second quarter of 2020.",Fast Company,"Thu, 30 Jul 2020 17:37:35 -0400",earnings,Positive,Article,FB
https://www.cnbc.com/2020/07/30/facebook-q2-2020-earnings-report-says-ad-boycott-will-impact-q3.html,https://cdn.snapi.dev/images/v1/g/i/74.jpg,"Facebook says the ad boycott is having an impact, but you wouldn't know that looking at its forecast","Facebook said its third quarter ad revneue will be impacted by ad boycotts. But with a year-over-year ad revenue growth rate in the first three weeks of July in-line with the second quarter, the boycott doesn't seem to hurt much.",CNBC,"Thu, 30 Jul 2020 17:36:47 -0400",,Neutral,Article,FB
https://www.youtube.com/watch?v=DouDCXGYQA8,https://cdn.snapi.dev/images/v1/m/i/facebook-2q-sales-top-estimates-shares-surge.jpg,"Facebook 2Q Sales Top Estimates, Shares Surge","Facebook Inc.’s second-quarter sales topped analysts’ highest estimates, rebounding from a pandemic-fueled disruption to digital advertising earlier in the year. The social media company’s shares surged in late trading. Revenue was up 11% and the social network had 2.7 billion monthly active users. David Kirkpatrick, Techonomy founder, appears on ""What'd You Miss?""",Bloomberg Technology,"Thu, 30 Jul 2020 17:35:41 -0400",earnings,Positive,Video,FB
https://www.theguardian.com/business/2020/jul/30/amazon-apple-facebook-google-profits-earnings,https://cdn.snapi.dev/images/v1/3/2/3250jpgwidth460quality85autoformatfitmaxs839e02a2bd52ab353388dd6b409c38c0.jpg,Tech giants' shares soar as companies benefit from Covid-19 pandemic,"Amazon, Apple, Facebook and Google all reported positive second quarter results",The Guardian,"Thu, 30 Jul 2020 17:27:14 -0400",earnings,Positive,Article,"AAPL,AMZN,FB,GOOG,GOOGL"
https://www.zacks.com/stock/news/1028198/facebook-fb-q2-earnings-and-revenues-surpass-estimates,https://cdn.snapi.dev/images/v1/q/w/m02d20191212t2i1463383007rlynxmpefbb1xsw640.jpg,Facebook (FB) Q2 Earnings and Revenues Surpass Estimates,"Facebook (FB) delivered earnings and revenue surprises of 25.00% and 8.08%, respectively, for the quarter ended June 2020. Do the numbers hold clues to what lies ahead for the stock?",Zacks Investment Research,"Thu, 30 Jul 2020 17:25:07 -0400",earnings,Positive,Article,FB
https://www.cnbc.com/2020/07/30/big-tech-six-experts-on-key-takeaways-from-the-congressional-hearing.html,https://cdn.snapi.dev/images/v1/o/d/odlw11.jpg,Big Tech CEOs were just grilled on Capitol Hill—here's what six market analysts took away from the hearing,"Tech CEOs from Apple, Google, Amazon and Facebook testified Wednesday in front of the House Judiciary subcommittee on antitrust. Six experts discuss what they took away from the hearing.",CNBC,"Thu, 30 Jul 2020 17:18:22 -0400",CEO,Negative,Article,"AAPL,AMZN,FB,GOOG,GOOGL"
https://www.cnbc.com/2020/07/30/apple-amazon-alphabet-facebook-added-200-billion-in-value-thursday.html,https://cdn.snapi.dev/images/v1/k/w/106634274-1595875871283-untitled-1.jpg,Four of the largest tech companies added $200 billion in value after hours Thursday following strong earnings reports,"As of Thursday's close, Apple, Amazon, Alphabet and Facebook were collectively worth $4.9 trillion. The companies will likely surpass $5.1 trillion as of Friday's open, taking into account Thursday's after-hours gains.",CNBC,"Thu, 30 Jul 2020 17:17:34 -0400",earnings,Positive,Article,"AAPL,AMZN,FB,GOOG,GOOGL"
https://www.marketwatch.com/story/pandemic-antitrust-doesnt-matter-to-big-tech-which-just-reported-nearly-200-billion-in-sales-2020-07-30,https://cdn.snapi.dev/images/v1/o/k/okddde21.jpg,"Pandemic? Antitrust? Doesn’t matter to Big Tech, which just reported nearly $200 billion in sales","Total profits for Alphabet, Amazon, Apple and Facebook near $30 billion, blowing away Wall Street’s expectations and adding to combined $5 trillion valuation",Market Watch,"Thu, 30 Jul 2020 17:11:47 -0400",earnings,Positive,Article,"AAPL,AMZN,FB,GOOG,GOOGL"
https://www.youtube.com/watch?v=XyX_v0Fw9h0,https://cdn.snapi.dev/images/v1/n/b/jefferies-brent-thill-optimistic-on-facebook.jpg,Jefferies' Brent Thill optimistic on Facebook,"Brent Thill, Wall Street Analyst at Jefferies, joins ""Closing Bell"" to talk about Facebook.",CNBC Television,"Thu, 30 Jul 2020 17:07:31 -0400",earnings,Positive,Video,FB
https://www.cnn.com/2020/07/30/tech/facebook-earnings/index.html,https://cdn.snapi.dev/images/v1/r/k/facebook.jpg,Facebook stock jumps 7% as pandemic leads to user bump,The global pandemic is proving to be a boon for Facebook's user numbers -- at least for now.,CNN Business,"Thu, 30 Jul 2020 17:03:59 -0400",earnings,Positive,Article,FB
https://www.gurufocus.com/news/1199232/facebook-shares-rocket-despite-reporting-slowest-revenue-growth-since-ipo,https://cdn.snapi.dev/images/v1/t/x/191028111649-mark-zuckerberg-facebook-news-1025-super-169.jpg,Facebook Shares Rocket Despite Reporting Slowest Revenue Growth Since IPO,"Shares of Facebook Inc. (NASDAQ:FB), a major social media platform, soared over 6% in aftermarket trading despite reporting its slowest quarterly revenue growth since its 2012 initial public offering.",GuruFocus,"Thu, 30 Jul 2020 17:03:01 -0400",earnings,Positive,Article,FB
https://news.sky.com/story/amazon-apple-facebook-and-alphabet-defy-coronavirus-to-post-better-results-than-expected-12039488,https://cdn.snapi.dev/images/v1/i/r/105940455-1559231679482img-5373.jpg,"Amazon, Apple, Facebook and Alphabet defy coronavirus to post better results than expected",Some of America's biggest tech companies have defied the coronavirus pandemic to post better-than-expected financial results.,Skynews,"Thu, 30 Jul 2020 16:43:00 -0400",earnings,Positive,Article,"AAPL,AMZN,FB,GOOG,GOOGL"
https://www.youtube.com/watch?v=pKPWYP-V1zU,https://cdn.snapi.dev/images/v1/u/x/analyst-facebook-and-amazon-numbers-were-pretty-shocking.jpg,Analyst: Facebook and Amazon numbers were pretty shocking,"Michael Levine, Pivotal Research, joins ""Closing Bell"" to discuss Alphabet earnings.",CNBC Television,"Thu, 30 Jul 2020 16:42:06 -0400",earnings,Positive,Video,"AMZN,FB"
https://investorplace.com/2020/07/facebook-earnings-send-fb-stock-higher/,https://cdn.snapi.dev/images/v1/x/5/fbfb23e2.jpg,Facebook Earnings: FB Stock Soars 8% on Massive Q2 Beats,"Facebook (FB) earnings for the social media company's second quarter of 2020 have FB stock on the rise after-hours Thursday.
The post Facebook Earnings: FB Stock Soars 8% on Massive Q2 Beats appeared first on InvestorPlace.",InvestorPlace,"Thu, 30 Jul 2020 16:27:54 -0400",earnings,Positive,Article,FB
https://www.benzinga.com/news/earnings/20/07/16859861/facebook-surges-after-big-q2-earnings-beat-12-user-growth,https://cdn.snapi.dev/images/v1/7/w/f23.jpg,"Facebook Surges After Big Q2 Earnings Beat, 12% User Growth","Shares of Facebook, Inc. (NASDAQ: FB) traded higher by more than 8% after reporting second-quarter results.",Benzinga,"Thu, 30 Jul 2020 16:25:22 -0400",earnings,Positive,Article,FB
https://247wallst.com/media/2020/07/30/facebook-q2-not-phased-by-covid-19-or-advertising-boycott/,https://cdn.snapi.dev/images/v1/i/t/gettyimages-1097534160jpgw599.jpg,Facebook Q2 Not Phased By COVID-19 or Advertising Boycott,"Facebook, Inc. (NASDAQ: FB) released its most recent quarterly results after the closing bell on Thursday.",24/7 Wall Street,"Thu, 30 Jul 2020 16:24:08 -0400",earnings,Positive,Article,FB
https://www.youtube.com/watch?v=kiHw7vmpGEs,https://cdn.snapi.dev/images/v1/q/z/facebook-beats-top-and-bottom-line-in-q2.jpg,Facebook beats top and bottom line in Q2,CNBC's Julia Boorstin reports Facebook's second quarter earnings report.,CNBC Television,"Thu, 30 Jul 2020 16:21:34 -0400",earnings,Positive,Video,FB
https://www.marketwatch.com/story/facebook-shares-rally-as-quarterly-result-easily-top-street-view-2020-07-30,https://cdn.snapi.dev/images/v1/f/b/fbffdw.jpg,Earnings Results: Facebook shares rally as quarterly result easily top Street view,Facebook Inc. shares rallied in the extended session Thursday after the social-media giant blew past Wall Street estimates for the second quarter.,Market Watch,"Thu, 30 Jul 2020 16:16:11 -0400",earnings,Positive,Article,FB
https://www.cnbc.com/2020/07/30/facebook-fb-earnings-q2-2020.html,https://cdn.snapi.dev/images/v1/e/z/xzuk2-1.jpg,Facebook reports 11% revenue growth even amid pandemic slowdown,"Facebook has seen an increase in user engagement as a result of the coronavirus, but has also endured an ad boycott that may crimp revenue.",CNBC,"Thu, 30 Jul 2020 16:15:08 -0400",earnings,Positive,Article,FB
https://deadline.com/2020/07/facebook-beats-street-sales-earnings-2-7-billion-users-1202999860/,https://cdn.snapi.dev/images/v1/a/w/m02d20191212t2i1463383007rlynxmpefbb1xsw640.jpg,"Facebook Beats Street On Q2 Sales, Earnings; Hits 2.7 Billion Users","Facebook said users hit 2.7 billion as it beat Wall Street estimates on revenue and earnings in the midst of the ongoing COVID-19 pandemic and a highly-public boycott by advertisers. If you didn’t get enough Mark Zuckerberg, Facebook and tech giants yesterday during hours of Congressional testimony, they’re all back today with a rat-a-tat-tat of",Deadline,"Thu, 30 Jul 2020 16:14:52 -0400",earnings,Positive,Article,FB
https://www.cnet.com/news/facebook-continues-to-grow-despite-ad-boycott/,https://cdn.snapi.dev/images/v1/q/1/fbt2-2.jpg,Facebook continues to grow despite ad boycott,Advertisers are calling on Facebook to do more to combat hate speech.,CNET,"Thu, 30 Jul 2020 16:12:00 -0400",earnings,Positive,Article,FB
https://www.prnewswire.com/news-releases/facebook-reports-second-quarter-2020-results-301103475.html,https://cdn.snapi.dev/images/v1/b/p/press20-2.jpg,Facebook Reports Second Quarter 2020 Results,"MENLO PARK, Calif., July 30, 2020 /PRNewswire/ -- Facebook, Inc.",PRNewsWire,"Thu, 30 Jul 2020 16:05:00 -0400","earnings,PressRelease",Neutral,Article,FB
https://www.youtube.com/watch?v=5oMgJVV8KxA,https://cdn.snapi.dev/images/v1/t/e/techtech12.jpg,How these investors are trading Big Tech stocks after the antitrust hearing,"CNBC's ""Halftime Report"" team breaks down Apple, Amazon, Alphabet and Facebook ahead of earnings and after their CEOs testifying in front of Congress on antitrust issues.",CNBC Television,"Thu, 30 Jul 2020 12:27:05 -0400",,Neutral,Video,"AAPL,AMZN,FB,GOOG,GOOGL"
https://www.youtube.com/watch?v=Nxmn7k7i9Zc,https://cdn.snapi.dev/images/v1/o/k/okks2e34-2.jpg,"Big Tech CEOs grilled on Capitol Hill over antitrust concerns, policies and content",Yahoo Finance's Dan Howley breaks down the Big Tech antitrust hearings on Capitol Hill.,Yahoo Finance,"Thu, 30 Jul 2020 11:25:17 -0400",CEO,Negative,Video,"AAPL,AMZN,FB,GOOG,GOOGL"
https://www.cnbc.com/2020/07/30/apple-amazon-facebook-google-internal-emails-released-by-congress.html,https://cdn.snapi.dev/images/v1/a/5/urlhttps3a2f2fgfoolcdncom2feditorial2fimages2f5279172fdome-of-us-capitol-building-with-american-flag-waving-in-foreground-washington-dc-capital-politics-policy-government-congressjpgw700opresize.jpg,"Congress has the goods on Apple, Amazon, Facebook and Google","The House Antitrust Subcommittee did a lot of the good and dirty work over the last year, gathering over 1 million documents from Apple, Amazon, Facebook and Google in its antitrust probe against the companies.",CNBC,"Thu, 30 Jul 2020 10:04:56 -0400",,Neutral,Article,"AAPL,AMZN,FB,GOOG,GOOGL"
https://www.forbes.com/sites/jjkinahan/2020/07/30/amazon-apple-facebook-and-alphabet-all-prepare-to-report-earnings-after-closing-bell/,https://cdn.snapi.dev/images/v1/f/i/amazon-apple-facebook-and-alphabet-all-prepare-to-report-earnings-after-closing-bell.jpg,"Amazon, Apple, Facebook, And Alphabet All Prepare To Report Earnings After Closing Bell","The market could be about to have its busiest day of the quarter. There’s just so much going on, with four FAANGs reporting after the close and initial claims and GDP this morning.",Forbes,"Thu, 30 Jul 2020 09:45:16 -0400",earnings,Neutral,Article,"AAPL,AMZN,FB,GOOG,GOOGL"
https://www.investors.com/news/technology/facebook-stock-second-quarter-earnings/,https://cdn.snapi.dev/images/v1/8/f/facebook-4.jpg,Facebook Second-Quarter Earnings Arrive During Complex Period,"Facebook reports quarterly earnings late Thursday, at a time when the company is under intense scrutiny for its business practices. Facebook stock is trading about 7% below its record high.",Investors Business Daily,"Thu, 30 Jul 2020 09:41:50 -0400",earnings,Neutral,Article,FB
https://www.zacks.com/stock/news/1024716/all-eyes-on-big-tech-earnings-heres-what-to-expect,https://cdn.snapi.dev/images/v1/z/5/stock-market-ticker-lights-768x432.jpg,All Eyes on Big Tech Earnings: Here's What to Expect,"Big four tech companies are mostly expected to have benefitted from the coronavirus-led shutdown measures, as some of their businesses gained immensely from consumers working from home.",Zacks Investment Research,"Thu, 30 Jul 2020 08:12:00 -0400",earnings,Neutral,Article,"AAPL,AMZN,FB,GOOGL,MSFT"
https://www.youtube.com/watch?v=1E7XoW747Vs,https://cdn.snapi.dev/images/v1/m/q/former-us-chief-technology-officer-on-big-tech-ceo-antitrust-hearing.jpg,Former US chief technology officer on Big Tech CEO antitrust hearing,"Aneesh Chopra, president of CareJourney who served as the first U.S. Chief Technology Officer under President Obama, joins ""Squawk Box"" to give his thoughts on Wednesday's historic antitrust hearing with the CEOs of Amazon, Apple, Alphabet and Facebook",CNBC Television,"Thu, 30 Jul 2020 07:13:39 -0400",CEO,Neutral,Video,"AAPL,AMZN,FB,GOOG,GOOGL"
https://www.reuters.com/article/us-facebook-ads-boycott/facebook-ad-boycott-organizers-ask-european-firms-to-join-campaign-idUSKCN24V1R4,https://cdn.snapi.dev/images/v1/k/b/m02d20200730t2i1527682604w940fhfwllplsqrlynxnpeg6t0vz.jpg,Facebook ad boycott organizers ask European firms to join campaign,"Organizers of a Facebook Inc advertising boycott said on Thursday the campaign would ""not go away"" until their concerns were addressed and they would ask advertisers in Europe to join their cause.",Reuters,"Thu, 30 Jul 2020 06:17:00 -0400",,Negative,Article,FB
https://www.forbes.com/sites/jemimamcevoy/2020/07/30/facebook-ad-boycott-extends-beyond-july-everyone-agrees-facebook-has-got-to-change/,https://cdn.snapi.dev/images/v1/s/5/facebook-ad-boycott-extends-beyond-july-everyone-agrees-facebook-has-got-to-change.jpg,Facebook Ad Boycott Extends Beyond July: ‘Everyone Agrees Facebook Has Got To Change’,"Unsatisfied with Facebook’s concessions, some major advertisers will continue their boycott.",Forbes,"Thu, 30 Jul 2020 06:00:00 -0400",,Negative,Article,FB
https://www.youtube.com/watch?v=Yf-JsLpebbA,https://cdn.snapi.dev/images/v1/h/z/apple-google-facebook-amazon-hearing-what-you-need-to-know.jpg,"Apple, Google, Facebook & Amazon hearing: what you need to know","CEOs of Amazon, Apple, Facebook, and Google testified before Congress in the tech antitrust hearing.",The Verge,"Thu, 30 Jul 2020 00:23:39 -0400",,Neutral,Video,"AAPL,AMZN,FB,GOOG,GOOGL"
