news_url,image_url,title,text,source_name,date,topics,sentiment,type,tickers
https://www.benzinga.com/government/21/02/19902804/judge-approves-landmark-650-million-class-action-suit-against-facebook-over-privacy-claims,https://cdn.snapi.dev/images/v1/0/h/mw-hu061-facebo-20191025172424-zhjpguuidd0f478d0-f76d-11e9-b6c4-9c8e992d421e-700015.jpg,Judge Approves 'Landmark' $650 Million Class-Action Suit Against Facebook Over Privacy Claims,"A federal judge has approved a $650 million settlement of a class-action privacy lawsuit against Facebook that claimed the company used its facial recognition feature without user consent. What Happened: In 2015, Chicago attorney Jay Edelson filed a lawsuit against Facebook, Inc (NASDAQ: FB) in Cook County Circuit Court.",Benzinga,"Sun, 28 Feb 2021 12:32:20 -0500",,Negative,Article,FB
https://www.fool.com/investing/2021/02/28/how-ad-revenue-powers-facebooks-entire-business/,https://cdn.snapi.dev/images/v1/p/o/podc4-699959.jpg,How Ad Revenue Powers Facebook's Entire Business,"All of Facebook's platforms are free to use, but it's still the king of profiting from its users.",The Motley Fool,"Sun, 28 Feb 2021 09:45:00 -0500",podcast,Neutral,Article,FB
https://www.fool.com/investing/2021/02/28/how-facebook-beats-pinterest-and-snapchat-at-user/,https://cdn.snapi.dev/images/v1/p/o/podc3-699948.jpg,How Facebook Beats Pinterest And Snapchat At User Monetization,"All of Facebook's platforms are free to use, but it's still the king of profiting from its users.",The Motley Fool,"Sun, 28 Feb 2021 08:55:00 -0500",podcast,Positive,Article,FB
https://www.fool.com/investing/2021/02/28/antitrust-regulation-and-facebook-were-in-a-brave/,https://cdn.snapi.dev/images/v1/p/o/podc15-699924.jpg,Antitrust Regulation And Facebook: We're in a Brave New World,Could regulators break up Facebook and what would that mean for investors?,The Motley Fool,"Sun, 28 Feb 2021 07:55:00 -0500",podcast,Negative,Article,FB
https://www.fool.com/investing/2021/02/28/how-facebook-is-using-its-data-for-good-in-the-cor/,https://cdn.snapi.dev/images/v1/p/o/podc12-699914.jpg,How Facebook Is Using Its Data For Good in the Coronavirus Pandemic,Facebook's Head of Health KX Jin describes how the social media giant is supporting local COVID responses.,The Motley Fool,"Sun, 28 Feb 2021 07:15:00 -0500",podcast,Neutral,Article,FB
https://www.fool.com/investing/2021/02/28/can-facebook-help-you-get-vaccinated/,https://cdn.snapi.dev/images/v1/p/o/podc11-699912.jpg,Can Facebook Help You Get Vaccinated?,We spoke with Facebook's Head of Health KX Jin about the social media giant's new campaign to help users find out when and where they can get their COVID vaccine.,The Motley Fool,"Sun, 28 Feb 2021 06:55:00 -0500",podcast,Neutral,Article,FB
