news_url,image_url,title,text,source_name,date,topics,sentiment,type,tickers
https://www.fool.com/investing/2019/06/13/facebook-kicked-out-of-socially-responsible-index.aspx?source=iedfolrf0000001,https://cdn.snapi.dev/images/v1/n/2/urlhttps3a2f2fgfoolcdncom2feditorial2fimages2f5287872fzuck-f8-2019jpgw700opresize.jpg,"Facebook Kicked Out of Socially Responsible Index Over Privacy Practices","S&P Dow Jones doesn't seem to think the social networking giant is good for the world.","The Motley Fool","Thu, 13 Jun 2019 19:30:00 -0400",,Neutral,Article,FB
https://www.marketwatch.com/story/facebook-has-big-companies-backing-its-upcoming-cryptocurrency-2019-06-13,https://cdn.snapi.dev/images/v1/b/c/105356873-1532642038130zuck530x298.jpg,"The Wall Street Journal: Facebook has big companies backing its upcoming cryptocurrency","Facebook Inc. has signed up more than a dozen companies including Visa Inc. V, -1.31%  , Mastercard Inc.","Market Watch","Thu, 13 Jun 2019 18:28:34 -0400",,Positive,Article,FB
https://www.cnbc.com/2019/06/13/facebook-blockchain-uber-payments-firms-reportedly-sign-onto-project.html,https://cdn.snapi.dev/images/v1/n/j/fb34.jpg,"Uber, payments firms reportedly sign on to back Facebook's blockchain project","Uber, PayPal, Visa and Mastercard have reportedly signed up to support Facebook's upcoming blockchain project.",CNBC,"Thu, 13 Jun 2019 18:24:00 -0400",,Positive,Article,"FB,UBER,MA,PYPL,V"
https://www.cnet.com/news/instagram-is-down/,https://cdn.snapi.dev/images/v1/2/y/instagram-logo-promo-2954.jpg,"Instagram is down across the web","An outage has hit Instagram.",CNET,"Thu, 13 Jun 2019 18:12:28 -0400",,Negative,Article,FB
https://www.cnet.com/news/facebook-youtube-twitter-must-team-up-to-fight-threat-from-deepfakes-experts-say/,https://cdn.snapi.dev/images/v1/i/f/gettyimages-1155477850.jpg,"Facebook, YouTube, Twitter must team up to fight threat from deepfakes, experts say","Deepfake specialists tell Congress that for society and democracy to weather the storm of manipulated media, social-media competitors must work together.",CNET,"Thu, 13 Jun 2019 17:24:46 -0400",,Neutral,Article,"FB,GOOG,GOOGL,TWTR"
https://www.cnet.com/news/facebooks-banned-research-app-collected-data-on-almost-200k-users/,https://cdn.snapi.dev/images/v1/k/h/facebook-logo-cybersecurity-data.jpg,"Facebook's banned research app collected data on almost 200K users","The app paid users, including teens, up to $20 a month for data on how they used their phones.",CNET,"Thu, 13 Jun 2019 16:49:22 -0400",,Neutral,Article,FB
https://www.cnbc.com/2019/06/13/facebook-dumped-from-sp-esg-index-of-socially-responsible-companies.html,https://cdn.snapi.dev/images/v1/s/h/105645446-1545658950549gettyimages-1027116848530x298.jpg,"Facebook gets dumped from an S&P index that tracks socially responsible companies","S&P Dow Jones Indices announced Thursday that the social network no longer will be part of the S&P 500 ESG Index.",CNBC,"Thu, 13 Jun 2019 14:55:00 -0400",,Negative,Article,FB
https://www.benzinga.com/news/19/06/13917498/facebook-buys-stake-in-indias-meesho,https://cdn.snapi.dev/images/v1/1/0-2/105882883-1556646716996rtx6tthd.jpg,"Facebook Buys Stake In India's Meesho","Facebook Inc. is buying a stake in the Indian social commerce start-up Meesho, according to Reuters.",Benzinga,"Thu, 13 Jun 2019 13:19:40 -0400",manda,Positive,Article,FB
https://www.benzinga.com/analyst-ratings/analyst-color/19/06/13916907/legal-expert-breaks-down-antitrust-risk-for-big-us-tech-stocks,https://cdn.snapi.dev/images/v1/i/c/icon-3256062-1920-1.jpg,"Legal Expert Breaks Down Antitrust Risk For Big US Tech Stocks","One of the biggest uncertainties for U.S. tech stock investors these days is the growing uncertainty surrounding potential antitrust action.",Benzinga,"Thu, 13 Jun 2019 13:12:57 -0400",,Negative,Article,"AAPL,FB"
https://www.youtube.com/watch?v=Vmi9m0G8zYY,https://cdn.snapi.dev/images/v1/e/i/zuckerberg-values-profits-over-privacy-tech-expert.jpg,"Zuckerberg values profits over privacy: Tech expert","Disruptive Tech Research founder Lou Basenese on Facebook CEO Mark Zuckerberg knowing of privacy issues on the platform.","Fox Business","Thu, 13 Jun 2019 12:46:13 -0400",,Negative,Video,FB
https://www.youtube.com/watch?v=LS-C_o64k5E,https://cdn.snapi.dev/images/v1/b/v/bvd3.jpg,"Antitrust expert Doug Melamed on the new probes into Big Tech","Doug Melamed, Stanford law professor, joins ""Squawk Alley"" to discuss how the Microsoft antitrust case he helped bring to court might affect the new probes into major tech companies.","CNBC Television","Thu, 13 Jun 2019 12:39:54 -0400",,Negative,Video,"AAPL,FB,GOOG,GOOGL"
https://www.youtube.com/watch?v=M5M2DAn_F6U,https://cdn.snapi.dev/images/v1/r/n/facebook-under-fire-from-another-privacy-controversy.jpg,"Facebook under fire from another privacy controversy","Stephanie Mehta, editor-in-chief of Fast Company, and Kevin Delaney, editor-in-chief of Quartz, discuss Facebook's latest privacy controversy and whether the CEO Mark Zuckerberg is serious about privacy.","CNBC Television","Thu, 13 Jun 2019 12:36:24 -0400",,Negative,Video,FB
https://www.cnet.com/news/facebooks-banned-research-app-collected-data-on-almost-200000-users-report-says/,https://cdn.snapi.dev/images/v1/k/m/facebook-logo-cybersecurity-data.jpg,"Facebook's banned research app collected data on almost 200K users, report says     - CNET","The app paid users, including teens, $20 to give Facebook access to how they use their phones.",CNET,"Thu, 13 Jun 2019 12:20:33 -0400",,Neutral,Article,FB
https://www.marketwatch.com/story/this-overlooked-facebook-business-could-be-worth-5-billion-a-year-deutsche-bank-says-2019-06-13,https://cdn.snapi.dev/images/v1/f/b/fb443.jpg,"This overlooked Facebook business could be worth $5 billion a year, Deutsche Bank says","Facebook Watch has been conspicuously overlooked since it made its debut in 2017.","Market Watch","Thu, 13 Jun 2019 11:57:50 -0400",,Positive,Article,FB
https://www.marketwatch.com/story/this-underrated-facebook-business-is-an-emerging-part-of-the-bull-case-says-deutsche-bank-2019-06-13,https://cdn.snapi.dev/images/v1/9/e/m02d20190601t2i1393118526rlynxnpef502fgw640.jpg,"This underrated Facebook business is 'an emerging part' of the bull case, says Deutsche Bank","Facebook Inc.'s [s; fb] Facebook Watch video product hasn't received much love from investors since it launched two summers ago, but Deutsche Bank's Lloyd Walmsley sees room for the offering to become a $5 billion annual business ""in the next few years.","Market Watch","Thu, 13 Jun 2019 09:31:35 -0400",,Positive,Article,FB
https://www.youtube.com/watch?v=dZVyGl4Hj-A,https://cdn.snapi.dev/images/v1/f/b/fb542.jpg,"Social Media: Two experts break down the top media story of the week","Tom Rogers, Winview Executive Chairman and former CEO of TiVo, and Ed Lee, New York Times media reporter, join ""Squawk Box"" to discuss the latest details of social media controversies.","CNBC Television","Thu, 13 Jun 2019 09:22:49 -0400",,Negative,Video,"AAPL,FB,GOOG,GOOGL"
https://www.youtube.com/watch?v=ID_ut0A-P6s,https://cdn.snapi.dev/images/v1/s/2/s23-10.jpg,"Here's what social media regulation might look like","Questions circle whether Facebook will have to pay for hosting inappropriate content.","CNBC Television","Thu, 13 Jun 2019 09:00:37 -0400",,Negative,Video,"AAPL,FB,GOOG,GOOGL"
https://www.youtube.com/watch?v=aFaiwERBbxU,https://cdn.snapi.dev/images/v1/r/y/lawmakers-consider-regulating-the-news-shared-on-facebook.jpg,"Lawmakers consider regulating the news shared on Facebook","Questions circle whether Facebook will have to regulate the news content shared on the site.","CNBC Television","Thu, 13 Jun 2019 08:58:29 -0400",,Neutral,Video,FB
https://techcrunch.com/2019/06/13/facebook-meesho-first-indian-startup-investment/,https://cdn.snapi.dev/images/v1/4/v/gettyimages-672318600jpgw601.jpg,"Facebook backs social commerce startup Meesho in first India investment","As Facebook explores ways to generate revenue from WhatsApp, the company is now turning to a startup that already has a lead. The social juggernaut said today it has invested in social-commerce startup Meesho in what is the first time the firm takes equity in an Indian startup.",TechCrunch,"Thu, 13 Jun 2019 07:31:49 -0400",,Positive,Article,FB
https://www.cnet.com/news/facebook-twitter-and-youtube-grapple-with-altered-videos-ahead-of-the-2020-election/,https://cdn.snapi.dev/images/v1/x/g/gettyimages-1075622554.jpg,"Facebook, Twitter and YouTube grapple with altered videos ahead of 2020 election     - CNET","Doctored Pelosi video might be the tip of the iceberg.",CNET,"Thu, 13 Jun 2019 07:00:12 -0400",,Negative,Article,"FB,GOOG,GOOGL,TWTR"
https://www.youtube.com/watch?v=J71qJuabAyw,https://cdn.snapi.dev/images/v1/e/f/efb33.jpg,"Irish data watchdog: Some Facebook probes to conclude in coming months","Helen Dixon, Ireland's data protection commissioner, says she has met with senior executives at the social media giant.","CNBC International TV","Thu, 13 Jun 2019 05:30:02 -0400",,Neutral,Video,FB
https://www.investopedia.com/why-microsoft-s-old-antitrust-case-is-a-bad-omen-for-google-and-facebook-4690465,https://cdn.snapi.dev/images/v1/p/w/gsfe2.jpg,"Why Microsoft’s Old Antitrust Case Is a Bad Omen for Google and Facebook","New Big Tech antitrust probes recall memories of Microsoft and others whose valuations suffered after the commencing of antitrust lawsuits.",Investopedia,"Thu, 13 Jun 2019 04:25:07 -0400",,Neutral,Article,"FB,GOOG,GOOGL"
https://www.cnbc.com/2019/06/13/facebook-investigations-by-eu-ireland-regulator-nearing-conclusions.html,https://cdn.snapi.dev/images/v1/d/i/105223282-gettyimages-953502232.jpg,"Facebook's EU regulator says it 'remains to be seen' if Mark Zuckerberg is serious about privacy","Ireland's Data Protection Commission will conclude some of its investigations into Facebook in ""coming months,"" its boss told CNBC.",CNBC,"Thu, 13 Jun 2019 02:50:00 -0400",,Negative,Article,FB
https://www.fool.com/investing/2019/06/12/facebook-watch-viewership-doubled-in-6-months.aspx?source=iedfolrf0000001,https://cdn.snapi.dev/images/v1/s/s/ss23-16.jpg,"Facebook Watch Viewership Doubled in 6 Months","Facebook shared an update on Watch, and the competition is on notice.","The Motley Fool","Wed, 12 Jun 2019 22:15:00 -0400",,Positive,Article,FB
https://nypost.com/2019/06/12/facebooks-coo-sandberg-goes-silent-over-zuckerberg-privacy-concerns/,https://cdn.snapi.dev/images/v1/5/h/sheryl-sandbergjpgquality90stripall.jpg,"Facebook’s COO Sandberg goes silent over Zuckerberg privacy concerns","MENLO PARK, Calif. — Sheryl Sandberg isn’t worried about the elephant in the room.","New York Post","Wed, 12 Jun 2019 22:06:37 -0400",COO,Negative,Article,FB
https://www.youtube.com/watch?v=kiVoLVBoexc,https://cdn.snapi.dev/images/v1/s/k/wsj-report-on-zuckerberg-raises-more-questions-about-facebooks-privacy-practices.jpg,"WSJ Report on Zuckerberg Raises More Questions About Facebook's Privacy Practices","Facebook Inc. uncovered emails that seem to show Chief Executive Officer Mark Zuckerberg was aware of potentially problematic privacy practices at the company. Bloomberg Opinion's Shira Ovide and Bloomberg's Tom Giles discuss on ""Bloomberg Technology."" Ovide's opinions are her own.","Bloomberg Technology","Wed, 12 Jun 2019 19:54:29 -0400",,Negative,Video,FB
https://www.youtube.com/watch?v=cpdoPJA3CVk&t=359s,https://cdn.snapi.dev/images/v1/f/b/fbt64.jpg,"Mad Money: Jim Cramer on Facebook","Here's how to spot the market bottom and maximize returns in your portfolio.","CNBC Television","Wed, 12 Jun 2019 19:31:19 -0400","cramer,madmoney",Positive,Video,FB
https://www.youtube.com/watch?v=j89o4_hJKRU,https://cdn.snapi.dev/images/v1/f/b/fb344.jpg,"Facebook stock plunges after report says Zuckerberg knew about privacy issues","FOX Business’ Kristina Partsinevelos, Kingsview Asset Management’s Scott Martin, Layfield Report CEO John Layfield and Forbes Media Chairman Steve Forbes discuss a report that Facebook CEO Mark Zuckerberg knew about the company’s privacy issues.","Fox Business","Wed, 12 Jun 2019 19:19:07 -0400",,Negative,Video,FB
https://www.cnbc.com/2019/06/12/the-wild-wild-west-days-of-big-tech-are-over-says-sen-mark-warner.html,https://cdn.snapi.dev/images/v1/1/0-2/105841832-1554837741943warner.jpg,"The 'wild, wild West days of Big Tech' are over, says Sen. Mark Warner","Silicon Valley’s tech giants have “enormous power” and need to be regulated, says Sen. Mark Warner.",CNBC,"Wed, 12 Jun 2019 19:03:00 -0400",,Negative,Article,"FB,GOOG,GOOGL"
https://www.youtube.com/watch?v=QB9Eb1rW5N0,https://cdn.snapi.dev/images/v1/f/a/fa22-4.jpg,"Facebook is sinking back into bear market after emails reveal Zuckerberg knew of privacy issues","Facebook sinks back into a bear market.","CNBC Television","Wed, 12 Jun 2019 18:07:24 -0400",,Negative,Video,FB
https://www.reuters.com/article/us-usa-tech-congress/republican-senator-criticizes-potential-dual-u-s-antitrust-tech-probes-idUSKCN1TD2RN,https://cdn.snapi.dev/images/v1/u/r-2/urlhttps3a2f2fgfoolcdncom2feditorial2fimages2f5279172fdome-of-us-capitol-building-with-american-flag-waving-in-foreground-washington-dc-capital-politics-policy-government-congressjpgw700opresize.jpg,"Republican senator criticizes potential dual U.S. antitrust tech probes","The Republican chairman of the Senate's antitrust panel criticized plans by the Justice Department and Federal Trade Commission to potentially investigate four of the biggest U.S. tech firms.",Reuters,"Wed, 12 Jun 2019 17:31:26 -0400",,Negative,Article,"AAPL,AMZN,FB,GOOG,GOOGL"
https://www.marketwatch.com/story/internal-emails-could-show-mark-zuckerberg-knew-about-facebooks-questionable-privacy-practices-2019-06-12,https://cdn.snapi.dev/images/v1/x/h/105135707-gettyimages-944827400jpgv1555422332.jpg,"The Wall Street Journal: Internal emails could show Mark Zuckerberg knew about Facebook’s questionable privacy practices","Facebook Inc. uncovered emails that appear to connect Chief Executive Mark Zuckerberg to potentially problematic privacy practices at the company, according to people familiar with the matter.","Market Watch","Wed, 12 Jun 2019 17:17:02 -0400",,Negative,Article,FB
https://techcrunch.com/2019/06/12/facebook-project-atlas-research-apple-banned/,https://cdn.snapi.dev/images/v1/c/n/gettyimages-487867268jpgw618.jpg,"Facebook collected device data on 187,000 users using banned snooping app","Facebook obtained personal and sensitive device data on about 187,000 users of its now-defunct Research app, which Apple banned earlier this year after the app violated its rules. The social media giant said in a letter to lawmakers — which TechCrunch obtained — that it collected data on 31,000 users in the U.S.",TechCrunch,"Wed, 12 Jun 2019 17:09:43 -0400",,Negative,Article,FB
https://www.fool.com/investing/2019/06/12/facebook-wants-to-pay-you-for-your-data.aspx?source=iedfolrf0000001,https://cdn.snapi.dev/images/v1/f/b/fb53-2.jpg,"Facebook Wants to Pay You for Your Data","The social media company has a new market research app called Study that will pay you to collect phone data.","The Motley Fool","Wed, 12 Jun 2019 16:33:04 -0400",,Neutral,Article,FB
https://www.cnbc.com/2019/06/12/facebook-watch-growth-stats-questioned-by-advertisers.html,https://cdn.snapi.dev/images/v1/z/z/105882883-1556646716996rtx6tthd.jpg,"Facebook says its YouTube competitor is growing, but advertisers want more details","The company said Wednesday that Watch now has more than 720 million people monthly and 140 million people who spend at least one minute on the service per day. By way of comparison, YouTube says more than 1.9 billion watch video every month.",CNBC,"Wed, 12 Jun 2019 15:55:00 -0400",,Neutral,Article,FB
https://investorplace.com/2019/06/5-top-stock-trades-for-thursday-fb-ge-ttd-ayx-adbe/,https://cdn.snapi.dev/images/v1/d/a/data-internet8.jpg,"5 Top Stock Trades for Thursday: FB, GE, TTD","Adobe Systems, General Electric, Facebook, The Trade Desk and Alteryx are our top stock trades for Thursday.",InvestorPlace,"Wed, 12 Jun 2019 15:50:59 -0400",,Positive,Article,"FB,GE,ADBE,AYX,TTD"
https://www.gurufocus.com/news/893314/calls-to-break-up-big-tech-are-growing,https://cdn.snapi.dev/images/v1/g/o/go23-7.jpg,"Calls to Break Up Big Tech Are Growing","Concerns about privacy and anticompetitive behavior are incentivizing politicians on both the left and the right to go after the large tech companies that have dominated U.S. consumer life for the past decade.",GuruFocus,"Wed, 12 Jun 2019 15:47:08 -0400",,Negative,Article,"AAPL,AMZN,FB,GOOG,GOOGL"
https://www.youtube.com/watch?v=OObMqEzBzEw,https://cdn.snapi.dev/images/v1/t/8/artist-tests-facebook-video-policy-with-deepfake-of-mark-zuckerberg.jpg,"Artist tests Facebook video policy with 'deepfake' of Mark Zuckerberg","An artist by the name of Bill Posters published a 'deepfake' video to Instagram in which Facebook CEO Mark Zuckerberg joked about knowing the public's secrets and praised the artist's new installation.","CNBC Television","Wed, 12 Jun 2019 15:34:54 -0400",,Neutral,Video,FB
https://www.cnet.com/news/facebook-emails-could-show-ceo-mark-zuckerberg-knew-of-privacy-issues-report-says/,https://cdn.snapi.dev/images/v1/x/z/facebook-f8-2019-9339.jpg,"Facebook emails could show CEO Mark Zuckerberg knew of privacy issues, report says","It's another potential black eye for the company.",CNET,"Wed, 12 Jun 2019 15:15:46 -0400",CEO,Negative,Article,FB
https://www.youtube.com/watch?v=q77EfuX01TY,https://cdn.snapi.dev/images/v1/e/o/facebook-faces-higher-stakes-with-zuckerberg-deepfake-on-instagram.jpg,"Facebook faces higher stakes with Zuckerberg deepfake on Instagram","A deepfake video of Mark Zuckerberg brings into question how Facebook will address fake or altered images and videos.","Yahoo Finance","Wed, 12 Jun 2019 14:50:17 -0400",,Positive,Video,FB
https://investorplace.com/2019/06/7-u-s-stocks-to-buy-with-limited-trade-war-exposure/,https://cdn.snapi.dev/images/v1/o/o/oos92-1.jpg,"7 U.S. Stocks to Buy With Limited Trade War Exposure","When it comes to the trade war, not all stocks are created equal, and these stocks to buy should fare better than the broader market.",InvestorPlace,"Wed, 12 Jun 2019 14:26:24 -0400",,Positive,Article,"AEP,FB,FIVE,GOOG,GOOGL,NFLX,SHOP"
https://www.fool.com/investing/2019/06/12/facebook-nearly-doubles-watch-users-in-6-months.aspx?source=iedfolrf0000001,https://cdn.snapi.dev/images/v1/b/a/urlhttps3a2f2fgfoolcdncom2feditorial2fimages2f5286402fwatch-dark-backgroundpngw700opresize.jpg,"Facebook Nearly Doubles Watch Users in 6 Months","The social network's video platform now has 720 million monthly active users.","The Motley Fool","Wed, 12 Jun 2019 13:28:32 -0400",,Positive,Article,FB
https://www.benzinga.com/government/19/06/13910690/wsj-emails-may-show-zuckerberg-knew-of-privacy-problems-at-facebook,https://cdn.snapi.dev/images/v1/s/a/facebook-3291987-1920-4.jpg,"WSJ: Emails May Show Zuckerberg Knew Of Privacy Problems At Facebook","Internal company emails being examined in connection with a Federal Trade Commission investigation into privacy practices at Facebook Inc.",Benzinga,"Wed, 12 Jun 2019 13:07:33 -0400",,Negative,Article,FB
https://www.youtube.com/watch?v=P92jxOUD5J0&t=179s,https://cdn.snapi.dev/images/v1/y/s/ys7724.jpg,"GS: Reduce Exposure to Stocks Facing Antitrust Lawsuits","Yahoo FInance's Dan Howley on Antitrust Regulation Concerns.","Yahoo Finance","Wed, 12 Jun 2019 12:58:10 -0400",,Negative,Video,FB
https://www.youtube.com/watch?v=teA-C9hhsBo,https://cdn.snapi.dev/images/v1/m/q-5/phil-libin-we-should-return-to-simple-business-models-instead-of-selling-data.jpg,"Phil Libin: We should return to 'simple' business models instead of selling data","Phil Libin, CEO of All Turtles and former Evernote co-founder, joins CNBC's ""Squawk Alley"" team to discuss the latest scandal surrounding Facebook and calls to break up big tech firms.","CNBC Television","Wed, 12 Jun 2019 12:23:10 -0400",,Neutral,Video,FB
https://www.youtube.com/watch?v=oscDnlrZlvM,https://cdn.snapi.dev/images/v1/f/b/fb72.jpg,"WSJ: Emails show Mark Zuckerberg was aware of problematic privacy practices","CNBC's Julia Boorstin reports on a new story from the Wall Street Journal which says that Facebook uncovered emails that may show that CEO Mark Zuckerberg was aware of problematic privacy policies.","CNBC Television","Wed, 12 Jun 2019 12:18:56 -0400",,Negative,Video,FB
https://www.youtube.com/watch?v=oonRfZjtRIY,https://cdn.snapi.dev/images/v1/s/j/sj823-2.jpg,"Upside to Tech Breakup?","Needham's Laura Martin and Pangea Policy's Terry Haines join ""Squawk Alley"" to discuss the growing scrutiny of big tech companies like Google and Facebook, and why there might be a benefit to their hypothetical break up.","CNBC Television","Wed, 12 Jun 2019 12:11:25 -0400",,Neutral,Video,"GOOG,GOOGL,AAPL,FB"
https://www.cnbc.com/2019/06/12/facebook-falls-on-report-of-zuckerberg-emails.html,https://cdn.snapi.dev/images/v1/n/b/105913721-1557902981326gettyimages-1148265335.jpeg,"Facebook falls following report that Zuckerberg emails link him to controversial privacy practices","Facebook stock dropped on a Wall Street Journal report that the company uncovered emails linking CEO Mark Zuckerberg to the social media giant's controversial privacy practices.",CNBC,"Wed, 12 Jun 2019 12:03:00 -0400",,Negative,Article,FB
https://www.cnbc.com/2019/06/12/states-ramp-up-pressure-on-federal-regulators-to-rein-in-facebook-apple-google.html,https://cdn.snapi.dev/images/v1/1/0-2/103334235-gettyimages-498338509.jpg,"States ramp up pressure on federal regulators to rein in big tech","Attorneys general in several states have already opened or are preparing to launch their own investigations into Facebook, Apple and Google over concerns about privacy and anti-competitive practices.",CNBC,"Wed, 12 Jun 2019 11:55:00 -0400",,Negative,Article,"GOOG,AAPL,FB,GOOGL"
https://investorplace.com/2019/06/investors-clicked-like-fb-stock-quickly/,https://cdn.snapi.dev/images/v1/g/y/mw-fq871-facebo-20170724114709-zh.jpg,"The Recent Decline of Facebook Stock Was a Great Buying Opportunity","FB has already recovered its losses from the antitrust probe announcement, showing that investors widely see these probes as a time to buy FB stock.
The post The Recent Decline of Facebook Stock Was a Great Buying Opportunity appeared first on InvestorPlace.",InvestorPlace,"Wed, 12 Jun 2019 10:30:12 -0400",,Positive,Article,FB
