news_url,image_url,title,text,source_name,date,topics,sentiment,type,tickers
https://techcrunch.com/2019/10/20/in-a-big-reversal-libra-reportedly-could-peg-its-cryptocurrencies-to-national-currencies/,https://cdn.snapi.dev/images/v1/r/f/rfcw222-1.jpg,"In a big reversal, Libra reportedly could peg its cryptocurrencies to national currencies","Facebook is willing to reverse course on its plans to tie its digital currency project to a synthetic currency tied to a basket of global currencies",TechCrunch,"Sun, 20 Oct 2019 19:19:06 -0400",,Neutral,Article,FB
https://www.cnn.com/2019/10/20/media/facebook-john-stanton-reliable-podcast/index.html,https://cdn.snapi.dev/images/v1/0/y/105974278-1560857198722gettyimages-1146088646.jpeg,"Save Journalism Project co-founder: Mark Zuckerberg embodies the 'antithesis of free speech'","During a ""Conversation on Free Expression"" at Georgetown University on Thursday, just after Mark Zuckerberg delivered his ""unfiltered take"" on free speech, journalist John Stanton issued a statement from his seat in the audience. The Facebook CEO had stressed the importance of ""voice and inclusion,"" defending the platform's impartiality.","CNN Business","Sun, 20 Oct 2019 17:27:38 -0400",CEO,Negative,Article,FB
https://www.reuters.com/article/us-imf-worldbank-facebook/facebook-open-to-currency-pegged-stablecoins-for-libra-project-idUSKBN1WZ0NX,https://cdn.snapi.dev/images/v1/g/d/gdbb2-1.jpg,"Facebook open to currency-pegged stablecoins for Libra project","Facebook Inc , facing growing skepticism about its digital currency project Libra, on Sunday said the initiative could use cryptocurrencies based on national currencies such as the dollar, instead of the synthetic one it initially proposed.",Reuters,"Sun, 20 Oct 2019 15:38:14 -0400",,Positive,Article,FB
https://techcrunch.com/2019/10/20/facebook-isnt-free-speech-its-algorithmic-amplification-optimized-for-outrage/,https://cdn.snapi.dev/images/v1/v/m/m02d20190602t2i1393636452rlynxnpef510u5w640.jpg,"Facebook isn’t free speech, it’s algorithmic amplification optimized for outrage","This week Mark Zuckerberg gave a speech in which he extolled “giving everyone a voice” and fighting “to uphold a wide a definition of freedom of expression as possible.” That sounds great, of course!",TechCrunch,"Sun, 20 Oct 2019 09:00:07 -0400",,Negative,Article,FB
https://www.cnbc.com/2019/10/20/facebook-employees-turn-to-hong-kong-hacker-jane-manchun-wong-for-info.html,https://cdn.snapi.dev/images/v1/q/h/mw-gx419-facebo-20181031133215-zh.jpg,"Facebook employees turn to rogue hacker from Hong Kong to learn what other teams are building","Jane Manchun Wong is a hacker whose passion for finding new features has made her a must-follow for Facebook employees hoping to stay up to date with their colleagues' work.",CNBC,"Sun, 20 Oct 2019 09:00:00 -0400",,Negative,Article,FB
https://www.theguardian.com/us-news/2019/oct/19/elizabeth-warren-facebook-break-up,https://cdn.snapi.dev/images/v1/q/t/105356873-1532642038130zuck530x298.jpg,"'Too much power': it's Warren v Facebook in a key 2020 battle","The presidential hopeful and Mark Zuckerberg are facing off over big tech and its influence over our lives","The Guardian","Sun, 20 Oct 2019 08:04:37 -0400",,Negative,Article,FB
https://www.nytimes.com/2019/10/20/business/economy/this-week-in-business-brexit-mark-zuckerberg-facebook-boeing.html,https://cdn.snapi.dev/images/v1/b/n/sd.jpg,"This Week in Business: A Brexit Battering, and Mark Zuckerberg Plays Defense","Plus, the monthlong strike at General Motors may be over soon.",NYTimes,"Sun, 20 Oct 2019 07:00:05 -0400","CEO,paywall",Neutral,Article,FB
https://www.fool.com/investing/2019/10/20/downside-facebook-libra-not-what-you-think.aspx,https://cdn.snapi.dev/images/v1/w/q/osqxj4-0a7y-1.jpg,"The Downside of Facebook's Libra May Not Be What You Think It Is","The Libra project's Achilles' heel may be hiding in plain sight.","The Motley Fool","Sun, 20 Oct 2019 06:55:00 -0400",,Negative,Article,FB
https://www.fool.com/investing/2019/10/19/facebooks-brand-crisis-isnt-over-yet.aspx,https://cdn.snapi.dev/images/v1/u/p/facebook-like-3d-1200x675.jpg,"Facebook's Brand Crisis Isn't Over Yet","A decline in an annual brand ranking and Zuckerberg's bizarre free-speech address show that the company still has work to do to mend its image.","The Motley Fool","Sat, 19 Oct 2019 14:17:00 -0400",,Negative,Article,FB
https://www.fool.com/investing/2019/10/19/facebook-moves-ahead-with-libra-despite-some-major.aspx,https://cdn.snapi.dev/images/v1/t/l/105976033-1560925615431gettyimages-1156523636.jpeg,"Facebook Moves Ahead With Libra Despite Some Major Setbacks","The world may not be ready for Facebook's digital token Libra, but that's not stopping the social media giant from forging ahead.","The Motley Fool","Sat, 19 Oct 2019 12:30:00 -0400",,Positive,Article,FB
https://www.nytimes.com/2019/10/18/technology/biden-facebook-ad.html,https://cdn.snapi.dev/images/v1/w/l/fb-9.jpg,"Biden Escalates Attack on Facebook Over False Political Ads","Joseph R. Biden Jr.’s presidential campaign sent Facebook a letter about a false video ad that a super PAC ran on the social network.",NYTimes,"Fri, 18 Oct 2019 21:08:54 -0400",paywall,Negative,Article,FB
https://www.reuters.com/article/us-facebook-news-corp-content/news-corp-to-supply-headlines-for-facebooks-upcoming-news-tab-idUSKBN1WX2P0,https://cdn.snapi.dev/images/v1/7/s/m02d20191018t2i1442465330rlynxmpef9h262w640.jpg,"News Corp to supply headlines for Facebook's upcoming news tab","Facebook Inc's  upcoming news tab will feature headlines from the Wall Street Journal and some other News Corp  media properties when it launches in fall of 2019, the social network said on Friday.",Reuters,"Fri, 18 Oct 2019 18:42:17 -0400",,Neutral,Article,"FB,NWSA,NWS"
https://www.cnbc.com/2019/10/18/zuckerberg-says-facebook-top-priority-is-ftc-mandated-privacy-program.html,https://cdn.snapi.dev/images/v1/0/l/gettyimages-1140405810jpgw600.jpg,"Mark Zuckerberg says Facebook's top priority is setting up FTC-mandated privacy program","Mark Zuckerberg said Facebook plans to implement a new privacy program that was mandated after the company's $5 billion settlement with the FTC in July.",CNBC,"Fri, 18 Oct 2019 17:20:00 -0400",CEO,Positive,Article,FB
https://www.cnn.com/2019/10/18/business/jamie-dimon-libra-facebook-private/index.html,https://cdn.snapi.dev/images/v1/s/y/191018145202-jamie-dimon-iif-conference-1018-restricted-super-169.jpg,"Jamie Dimon says Libra will never happen","Jamie Dimon doesn't think Libra, Facebook's embattled cryptocurrency project, will ever get off the ground.","CNN Business","Fri, 18 Oct 2019 16:46:25 -0400",CEO,Negative,Article,FB
https://investorplace.com/2019/10/tiktok-is-just-noise-for-facebook-stock/,https://cdn.snapi.dev/images/v1/g/e/gettyimages-1153735128.jpg,"TikTok Is Just Noise for Facebook Stock","Few things have me worried about Facebook stock. While TikTok made some news when it literally moved into Facebook’s turf, this is mostly showmanship.",InvestorPlace,"Fri, 18 Oct 2019 14:30:23 -0400",,Positive,Article,FB
https://www.cnbc.com/2019/10/18/jamie-dimon-on-facebook-libra-a-neat-idea-that-will-never-happen.html,https://cdn.snapi.dev/images/v1/n/7/106148480-1569425526605gettyimages-1171027604.jpg,"Jamie Dimon says Facebook's libra is 'a neat idea that'll never happen'","Dimon's comments come as a raft of corporate partners have dropped out of the libra crypto project.",CNBC,"Fri, 18 Oct 2019 14:11:00 -0400",CEO,Neutral,Article,FB
https://techcrunch.com/2019/10/18/facebook-35-billion-lawsuit/,https://cdn.snapi.dev/images/v1/s/k/sk2bface-1.jpg,"$35B face data lawsuit against Facebook will proceed","Facebook just lost a battle in its war to stop a $35 billion class action lawsuit regarding alleged misuse of facial recognition data in Illinois. Today it was denied its request for an en banc hearing before the full slate of ninth circuit judges that could have halted the case.",TechCrunch,"Fri, 18 Oct 2019 13:53:29 -0400",,Negative,Article,FB
https://www.youtube.com/watch?v=vEDtBz6-XGE,https://cdn.snapi.dev/images/v1/y/f/zuckerberg-backs-free-speech-after-alleged-political-bias-on-facebook.jpg,"Zuckerberg backs free speech after alleged political bias on Facebook","Tech analyst Shana Glenzer weighs in on Mark Zuckerberg defending free speech.","Fox Business","Fri, 18 Oct 2019 13:21:18 -0400",CEO,Neutral,Video,FB
https://www.youtube.com/watch?v=nNhXIX5Vx0Q,https://cdn.snapi.dev/images/v1/k/x/facebook-would-be-happy-to-accept-regulation-says-the-verges-nilay-patel.jpg,"Facebook would be happy to accept regulation, says The Verge's Nilay Patel","Early Facebook investor Roger McNamee and The Verge's Nilay Patel join ""Squawk Alley"" to discuss Facebook CEO Mark Zuckerberg's comments around free speech and the spread of disinformation on the social network.","CNBC Television","Fri, 18 Oct 2019 11:50:36 -0400",,Positive,Video,FB
https://www.zacks.com/stock/news/571440/facebooks-fb-watch-to-get-exclusive-shows-from-fox-sports,https://cdn.snapi.dev/images/v1/2/f/fbt2-2.jpg,"Facebook's (FB) Watch to Get Exclusive Shows From FOX Sports","Facebook's (FB) Watch to receive sports-related digital shows and content from recent partnership with Fox Sports amid the intensifying sports streaming battle.","Zacks Investment Research","Fri, 18 Oct 2019 11:50:00 -0400",,Neutral,Article,FB
https://www.youtube.com/watch?v=rEV5-MKDVWs,https://cdn.snapi.dev/images/v1/v/h/facebooks-mark-zuckerberg-draws-strong-reaction-to-free-expression-speech.jpg,"Facebook's Mark Zuckerberg draws strong reaction to free expression speech","Mark Zuckerberg was at Georgetown University yesterday, defending Facebook's light moderating touch on policing its content.","CNBC Television","Fri, 18 Oct 2019 10:25:51 -0400",CEO,Neutral,Video,FB
https://www.cnbc.com/2019/10/18/mark-zuckerberg-georgetown-speech-history-isnt-on-facebooks-side.html,https://cdn.snapi.dev/images/v1/h/i/his9222-1.jpg,"History will not be on Facebook's side, no matter what Zuckerberg says","Zuckerberg's address at Georgetown University was rooted in the principles of free speech, but ignored the role Facebook plays as a publisher.",CNBC,"Fri, 18 Oct 2019 09:44:00 -0400",CEO,Negative,Article,FB
https://www.theguardian.com/technology/2019/oct/18/how-the-wheels-came-off-facebook-libra-project,https://cdn.snapi.dev/images/v1/o/y/fn2-1.jpg,"How the wheels came off Facebook's Libra project","Support for Mark Zuckerberg mission to reshape global finance is slipping away slowly but surely","The Guardian","Fri, 18 Oct 2019 09:42:36 -0400",,Negative,Article,FB
https://www.fool.com/investing/2019/10/18/facebook-is-no-longer-a-top-10-global-brand.aspx,https://cdn.snapi.dev/images/v1/c/0/zi-uci4b3nov-2-1.jpg,"Facebook Is No Longer a Top 10 Global Brand","The social networking juggernaut saw its brand value fall by 12% this year.","The Motley Fool","Fri, 18 Oct 2019 09:00:00 -0400",,Negative,Article,FB
https://investorplace.com/2019/10/the-government-wants-to-bury-facebooks-libra-cryptocurrency-lrg/,https://cdn.snapi.dev/images/v1/h/a/lia92.jpg,"The Government Wants to Bury Facebook’s Libra Cryptocurrency","Zuck isn’t happy with “only” running the world’s largest and most powerful social network. He also wants to run the world’s largest currency.",InvestorPlace,"Fri, 18 Oct 2019 08:59:10 -0400",,Negative,Article,FB
https://www.cnbc.com/2019/10/18/warren-slams-zuckerbergs-speech-and-political-ad-policy.html,https://cdn.snapi.dev/images/v1/o/s/osk222-1.jpg,"Warren slams Zuckerberg's speech, saying Facebook's political ad policy could help Trump win again","The attack followed a speech the Facebook CEO gave at Georgetown University explaining his philosophy on free speech on the platform.",CNBC,"Fri, 18 Oct 2019 08:52:00 -0400",CEO,Negative,Article,FB
https://www.fastcompany.com/90419009/supply-chain-sources-say-facebook-portal-sales-are-very-low,https://cdn.snapi.dev/images/v1/o/s/osk022ff-1.jpg,"Supply-chain sources say Facebook Portal sales are ‘very low’","After the company’s many privacy sins, people are apparently hesitant to put a Facebook device with a camera in their living rooms. Imagine that.","Fast Company","Fri, 18 Oct 2019 08:30:59 -0400",product,Negative,Article,FB
https://www.fastcompany.com/90419140/facebook-should-treat-political-ads-like-psas,https://cdn.snapi.dev/images/v1/z/u/zuce334-1.jpg,"Facebook’s double standard for political ads shows its true intentions","Mark Zuckerberg says Facebook’s political ad policy is in service of democracy and the public good. But this claim is undermined by its profit motive.","Fast Company","Fri, 18 Oct 2019 05:56:23 -0400",,Neutral,Article,FB
https://www.youtube.com/watch?v=pUn_6u1pkGo,https://cdn.snapi.dev/images/v1/4/y/zuckerberg-changes-tune-on-free-speech-facebook-brand-value-declines.jpg,"Zuckerberg changes tune on free speech, Facebook brand value declines","MarketWatch Tech Editor Jeremy Owens and Chatham Road Partners Director of Research Colin Gillis discuss how Mark Zuckerberg's perspectives on free speech have changed recently.","Fox Business","Thu, 17 Oct 2019 19:13:41 -0400",CEO,Neutral,Video,FB
https://www.youtube.com/watch?v=SxrdMK95tGM,https://cdn.snapi.dev/images/v1/d/h/standards-for-facebook-should-be-same-as-magazine-or-tv-rep-ro-khanna.jpg,"Standards for Facebook should be same as magazine or TV: Rep. Ro Khanna","Congressman Ro Khanna (D-Calif.) discusses Facebook and the growing scrutiny of Big Tech companies.","CNBC Television","Thu, 17 Oct 2019 17:11:29 -0400",,Neutral,Video,FB
https://news.sky.com/story/facebook-boss-mark-zuckerberg-we-need-to-save-internet-from-chinese-influence-11838137,https://cdn.snapi.dev/images/v1/e/d/edce22-1.jpg,"Zuckerberg: We need to save internet from Chinese influence","Mark Zuckerberg thinks Facebook is the internet.",Skynews,"Thu, 17 Oct 2019 17:06:00 -0400",CEO,Neutral,Article,FB
https://investorplace.com/2019/10/5-top-stock-trades-for-friday-ms-fb-hon-gogo-unp/,https://cdn.snapi.dev/images/v1/e/t/etf37.jpg,"5 Top Stock Trades for Friday: MS, FB, HON, GOGO, UNP","Union Pacific, Facebook, Gogo, Morgan Stanley and Honeywell were our top stock trades from Thursday. Here's a look at the charts.",InvestorPlace,"Thu, 17 Oct 2019 16:03:56 -0400",,Positive,Article,"GOGO,FB,HON,MS,UNP"
https://www.theguardian.com/technology/2019/oct/17/mark-zuckerberg-facebook-free-expression-speech,https://cdn.snapi.dev/images/v1/l/j/fbzu72.jpg,"Zuckerberg defends Facebook as bastion of 'free expression' in speech","CEO faces quick backlash over highlighted policies, including on hate speech and voter suppression","The Guardian","Thu, 17 Oct 2019 15:54:11 -0400",CEO,Neutral,Article,FB
https://www.cnet.com/news/facebook-ceo-mark-zuckerberg-defends-decision-to-allow-politicians-to-lie-in-ads/,https://cdn.snapi.dev/images/v1/x/z/fb2-5.jpg,"Facebook CEO Mark Zuckerberg defends decision to allow politicians to lie in ads","The social network has faced criticism for not sending political speech to fact checkers.",CNET,"Thu, 17 Oct 2019 15:04:00 -0400",CEO,Negative,Article,FB
https://www.marketwatch.com/story/facebooks-mark-zuckerberg-defends-free-expression-will-allow-political-adds-without-fact-checking-2019-10-17,https://cdn.snapi.dev/images/v1/g/e/ger32-1.jpg,"The Wall Street Journal: Facebook’s Mark Zuckerberg defends free expression, will allow political adds without fact checking","Facebook Inc. Chief Executive Officer Mark Zuckerberg asserted his commitment to free speech over more aggressive policing of social-media platforms, in a rare policy speech that could have ramifications for the U.S.","Market Watch","Thu, 17 Oct 2019 14:54:20 -0400",CEO,Neutral,Article,FB
https://www.youtube.com/watch?v=MwYKVdg13Dk,https://cdn.snapi.dev/images/v1/x/g/facebooks-mark-zuckerberg-on-the-power-of-expression.jpg,"Facebook's Mark Zuckerberg on the Power of Expression","Facebook Inc. Chief Executive Officer Mark Zuckerberg said that the social network, with its enormous size and scale, offers people a new kind of power: the ability to share their thoughts with the masses. Zuckerberg spoke to students at Georgetown University’s Gaston Hall in Washington.","Bloomberg Markets and Finance","Thu, 17 Oct 2019 14:52:35 -0400",CEO,Positive,Video,FB
https://www.youtube.com/watch?v=1Rky3H2DwSw,https://cdn.snapi.dev/images/v1/i/s/facebook-ceo-mark-zuckerberg-speaks-on-free-expression-at-georgetown.jpg,"Facebook CEO Mark Zuckerberg speaks on free expression at Georgetown","CNBC's Ylan Mui on the headlines from Facebook CEO Mark Zuckerberg's speech at Georgetown University where he address the topic of free speech.","CNBC Television","Thu, 17 Oct 2019 14:17:25 -0400",CEO,Positive,Video,FB
https://www.cnbc.com/2019/10/17/mark-zuckerberg-says-he-wont-ban-political-ads-on-facebook.html,https://cdn.snapi.dev/images/v1/i/x/fb-2.jpg,"Zuckerberg: I thought about banning political ads from Facebook, but decided not to","""Political ads can be an important part of voice, especially for local candidates, up and coming challengers and advocacy groups that the media might not otherwise cover,"" Zuckerberg said.",CNBC,"Thu, 17 Oct 2019 13:51:00 -0400",CEO,Neutral,Article,FB
https://techcrunch.com/2019/10/17/zuckerberg-speech/,https://cdn.snapi.dev/images/v1/e/e/ee3ef4-1.jpg,"Zuckerberg on Chinese censorship: Is that the internet we want?","China is exporting its social values, political ads are an important part of free expression, and the definition of dangerous speech must be kept in check, Facebook’s CEO Mark Zuckerberg argued today. He criticized how American companies that do business with China were becoming influenced by the country’s values.",TechCrunch,"Thu, 17 Oct 2019 13:47:57 -0400",CEO,Neutral,Article,FB
https://www.nytimes.com/2019/10/17/business/zuckerberg-facebook-free-speech.html,https://cdn.snapi.dev/images/v1/h/w/gettyimages-630348652.jpg,"Zuckerberg, Inflaming Debate, Asserts Facebook Stands for Free Expression","In an address at Georgetown University, the Facebook chief executive called for more free speech — not less — as his company has been assailed for allowing lies and falsehoods to appear.",NYTimes,"Thu, 17 Oct 2019 13:47:13 -0400","CEO,paywall",Neutral,Article,FB
https://www.youtube.com/watch?v=aOO21OIfKkM,https://cdn.snapi.dev/images/v1/m/t/facebooks-zuckerberg-on-the-hill-whats-at-stake.jpg,"Facebook’s Zuckerberg on the Hill: What’s at Stake?","» Check out the Fortt Knox podcast: http://forttknox.com/apple
» Subscribe to Fortt Knox: http://youtube.com/forttknox

Connect with CNBC News Online
Get the latest news: http://www.cnbc.com/
Find CNBC News on Facebook: http://cnb.cx/LikeCNBC
Follow CNBC News on Twitter: http://cnb.cx/FollowCNBC
Follow CNBC News on Google+: http://cnb.cx/PlusCNBC
Follow CNBC News on Instagram: http://cnb.cx/InstagramCNBC","CNBC Television","Thu, 17 Oct 2019 13:26:37 -0400",CEO,Neutral,Video,FB
https://www.youtube.com/watch?v=1sCWQ9Zv_Qo,https://cdn.snapi.dev/images/v1/7/e/zuckerberg-to-deliver-remarks-at-georgetown-on-free-expression.jpg,"Zuckerberg to deliver remarks at Georgetown on free expression","..Description of the video goes here.","Yahoo Finance","Thu, 17 Oct 2019 12:30:03 -0400",CEO,Neutral,Video,FB
https://www.cnn.com/2019/10/17/tech/mark-zuckerberg-free-expression-speech-georgetown/index.html,https://cdn.snapi.dev/images/v1/w/s/zecu223-1.jpg,"Mark Zuckerberg giving speech on freedom of expression","Facebook CEO Mark Zuckerberg is set to deliver what he says is his most ""comprehensive take"" yet on freedom of expression Thursday in Washington, amid a roiling controversy over how the company handles political speech.","CNN Business","Thu, 17 Oct 2019 11:36:13 -0400",CEO,Neutral,Article,FB
https://www.fastcompany.com/90418934/the-comments-on-mark-zuckerbergs-free-speech-address-sure-looked-censored,https://cdn.snapi.dev/images/v1/w/6/fb443.jpg,"The comments on Mark Zuckerberg’s free-speech address sure look censored","Almost every single one includes the words “thank you.” 
As Mark Zuckerberg gave a speech on free speech today, there was something funky happening in the comments on his Facebook Live broadcast.","Fast Company","Thu, 17 Oct 2019 10:04:56 -0400",CEO,Neutral,Article,FB
https://www.cnn.com/2019/10/17/tech/mind-your-own-business-bill/index.html,https://cdn.snapi.dev/images/v1/1/9/191017090323-01-mark-zuckerberg-0524-file-super-169.jpg,"A new bill threatens years of jail time for companies that misuse consumer data","A privacy-focused US senator is introducing sweeping legislation on Thursday that imposes sharp penalties on companies and executives who fail to protect consumer data, bringing additional pressure to bear on the tech industry.","CNN Business","Thu, 17 Oct 2019 09:34:23 -0400",,Negative,Article,FB
https://www.cnbc.com/2019/10/17/facebook-falls-off-top-10-best-global-brands-behind-apple-and-google.html,https://cdn.snapi.dev/images/v1/k/l/sd.jpg,"Facebook loses spot in top-ten on list of most valuable brands","This top list of valuable brands includes Apple, Google and Amazon, but not Facebook.",CNBC,"Thu, 17 Oct 2019 09:26:00 -0400",,Negative,Article,FB
https://www.marketwatch.com/story/kohls-will-partner-with-facebook-in-2020-2019-10-17,https://cdn.snapi.dev/images/v1/i/j/ijd299222-1.jpg,"Kohl's will partner with Facebook in 2020","Kohl's Corp. KSS, -0.84% said Thursday that it will partner with Facebook Inc. FB, +0.35% in 2020 to select and engage with brands that will be included in its recently launched platform, Curated by Kohl's, and its platform for emerging beauty and skincare brands, The Beauty Checkout.","Market Watch","Thu, 17 Oct 2019 08:16:28 -0400",,Positive,Article,"FB,KSS"
https://investorplace.com/2019/10/libra-disaster-facebook-stock-keep-growing/,https://cdn.snapi.dev/images/v1/t/b/gettyimages-1146342188.jpg,"Even If Libra Is a Disaster, Facebook Stock Will Keep on Growing","As I noted about three months ago when I last visited Facebook stock in this space, the company, by its own doing, is viewed by some as arrogant if not somewhat reckless, prone to public relations gaffes and lacks for trust among the public. The latter issue is one of the sticking points when it comes to Libra.",InvestorPlace,"Thu, 17 Oct 2019 08:10:29 -0400",,Positive,Article,FB
https://www.youtube.com/watch?v=st3o_vPr3kU,https://cdn.snapi.dev/images/v1/v/t/investment-strategist-doubts-facebooks-libra-will-be-a-real-payments-disruptor-squawk-box-europe.jpg,"Investment strategist doubts Facebook's Libra will be a real payments disruptor","Richard Harris, chief executive of Port Shelter Investment Management, says there are plenty of innovations in the payments sector already.","CNBC International TV","Thu, 17 Oct 2019 07:30:02 -0400",,Negative,Video,FB
https://www.fool.com/investing/2019/10/17/facebook-is-losing-employees-to-one-of-its-most-vi.aspx,https://cdn.snapi.dev/images/v1/o/f/facebook-box-1334045-1920-4.png,"Facebook Is Losing Employees to One of Its Most Viable Emerging Competitors","The social networking giant can't buy its rival this time.","The Motley Fool","Thu, 17 Oct 2019 07:00:00 -0400",,Negative,Article,FB
