news_url,image_url,title,text,source_name,date,topics,sentiment,type
https://www.reuters.com/article/us-global-markets/asian-shares-inch-up-as-cautious-investors-await-u-s-data-earnings-idUSKCN1UB03U,https://cdn.snapi.dev/images/v1/y/y/m02d20190716t2i1408417704rlynxnpef6f01qw640.jpg,"Asian shares inch up as cautious investors await U.S. data, earnings","Major Asian equity indicators nudged higher on Monday as investors awaited U.S. retail sales data and corporate earnings to gauge the health of the world's biggest economy, with markets remaining focused on a likely U.S.",Reuters,"Mon, 15 Jul 2019 23:25:20 -0400",earnings,Positive,Article
https://www.forbes.com/sites/yuwahedrickwong/2019/07/15/chinas-economy-grows-at-slowest-pace-in-nearly-30-years-but-is-the-trade-war-to-blame/,https://cdn.snapi.dev/images/v1/u/c/trump-1200x800.jpg,"China's Economy Grows At Slowest Pace In Nearly 30 Years, But Is The Trade War To Blame?",Donald Trump wasted no time in tweeting that “U.S. tariffs are having a major effect on companies wanting to leave China for non-tariffed countries.,Forbes,"Mon, 15 Jul 2019 22:15:00 -0400",,Negative,Article
https://www.reuters.com/article/us-global-markets/asian-shares-tick-up-u-s-data-earnings-in-focus-ahead-of-fed-idUSKCN1UB03U,https://cdn.snapi.dev/images/v1/f/4/m02d20190716t2i1408417704rlynxnpef6f01qw640.jpg,"Asian shares tick up, U.S. data, earnings in focus ahead of Fed","Asian shares inched up on Tuesday as traders awaited U.S. retail sales data and more corporate earnings to gauge the health of the world’s biggest economy, with markets remaining focused on a likely U.S. rate cut by the end of the month.",Reuters,"Mon, 15 Jul 2019 21:31:09 -0400",,Positive,Article
https://www.reuters.com/article/us-global-oil/oil-down-for-a-second-day-as-u-s-gulf-of-mexico-output-returns-idUSKCN1UB01V,https://cdn.snapi.dev/images/v1/m/0/m02d20190716t2i1408408208rlynxnpef6f00yw640.jpg,Oil down for a second day as U.S. Gulf of Mexico output returns,"Oil prices fell for a second day on Tuesday as more production facilities returned to operation in the U.S. Gulf after Hurricane Barry swept through over the weekend, while Chinese economic data dimmed the outlook for crude demand.",Reuters,"Mon, 15 Jul 2019 20:49:02 -0400",oil,Negative,Article
https://www.investopedia.com/how-2q-guidance-could-hammer-the-bull-market-4692899,https://cdn.snapi.dev/images/v1/e/t/etf48-44.jpg,How 2Q Guidance Could Hammer The Bull Market,"Corporate profits for 2Q 2019 are expected to be weak, and a growing number of CEOs and other top executives are offering negative guidance.",Investopedia,"Mon, 15 Jul 2019 20:25:00 -0400",,Negative,Article
https://www.youtube.com/watch?v=qTr21Y7TZ88,https://cdn.snapi.dev/images/v1/b/e/cramer-the-fed-is-on-the-bulls-side-thats-bad-news-for-the-bears.jpg,Cramer: The Fed is on the bulls' side — that's bad news for the bears,Jim Cramer explains why bad results from companies this earnings season may not cause stocks to plummet this earnings season.,CNBC Television,"Mon, 15 Jul 2019 19:58:28 -0400","cramer,madmoney",Positive,Video
https://www.youtube.com/watch?v=5ewNVrlLBYs,https://cdn.snapi.dev/images/v1/m/s/msj23-1.jpg,Jim Cramer's guide to this earnings season,"Mad Money host Jim Cramer says the same thing every quarter: Just step away from the roulette wheel, because if you try to trade around these quarterly reports, you're going to get burned.",CNBC Television,"Mon, 15 Jul 2019 19:21:42 -0400","earnings,cramer,madmoney",Neutral,Video
https://www.reuters.com/article/us-usa-trade-mexico-canada/trump-presses-for-usmca-passage-as-lighthizer-lawmakers-prepare-to-meet-idUSKCN1UA1YZ,https://cdn.snapi.dev/images/v1/m/0/m02d20190715t2i1408297709rlynxnpef6e188w640.jpg,"Trump presses for USMCA passage as Lighthizer, lawmakers prepare to meet","President Donald Trump and his top advisers on Monday stepped up their drive to win congressional passage of a trade deal with Canada and Mexico, as the administration's top trade official prepared to meet with Democratic lawmakers again this week.",Reuters,"Mon, 15 Jul 2019 19:07:20 -0400",,Neutral,Article
https://www.investopedia.com/markets-cautious-as-earnings-season-kicks-off-4692987,https://cdn.snapi.dev/images/v1/e/t-2/etf35-54.jpg,Markets Cautious as Earnings Season Kicks Off,Big banks are taking center stage as China growth slows to multi-decade lows and oil falls again on demand worries.,Investopedia,"Mon, 15 Jul 2019 18:54:53 -0400",earnings,Neutral,Article
https://www.cnbc.com/2019/07/15/cramers-guide-to-earnings-season-conference-calls-quarterly-trades.html,https://cdn.snapi.dev/images/v1/f/3/106019640-1563211364364rts2lxgf.jpg,Cramer's guide to earnings season: Don't try to outsmart the system — it's 'always rough',"""The important thing is that you shouldn't try to hit homeruns this week, because you're much more likely to end up striking out,"" Jim Cramer says.",CNBC,"Mon, 15 Jul 2019 18:40:00 -0400","earnings,cramer,madmoney",Neutral,Article
https://www.investors.com/market-trend/stock-market-today/dow-jones-futures-stock-market-rally-navigate-earnings-season/,https://cdn.snapi.dev/images/v1/m/0/m02d20190712t2i1407271404rlynxnpef6b14nw640.jpg,Dow Jones Futures: Stock Market Rally At Highs; 5 Steps For Playing Earnings Season,"Futures: The stock market rally is at record highs, but earnings are about to flood in. Here are five steps for navigating earnings season.",Investors Business Daily,"Mon, 15 Jul 2019 18:29:44 -0400",earnings,Positive,Article
https://investorplace.com/2019/07/dont-miss-out-next-big-stock-market-rally/,https://cdn.snapi.dev/images/v1/2/w/2ws-10.jpg,Don’t Miss Out on the Next Big Stock Market Rally,"If you haven’t invested yet, then I strongly encourage you begin investing now so you don’t miss out on the big gains ahead. Here's why.",InvestorPlace,"Mon, 15 Jul 2019 17:21:48 -0400",,Neutral,Article
https://techcrunch.com/2019/07/15/what-to-expect-from-tomorrows-antitrust-hearing-featuring-big-tech/,https://cdn.snapi.dev/images/v1/y/e/gettyimages-909067474-th21jpgw600.jpg,What to expect from tomorrow’s antitrust hearing featuring big tech,"Tomorrow, representatives from Facebook, Google, Amazon and Apple will testify before Congress in the second hearing organized as part of the House Judiciary Committee’s antitrust investigation into the world’s largest technology companies. While the first hearing focused on the ways technology companies busted the traditional news business, this one promises to look at the “impact […]",TechCrunch,"Mon, 15 Jul 2019 16:54:55 -0400",,Negative,Article
https://investorplace.com/2019/07/nasdaq-today-bitcoin-libra-whats-broadcom-doing/,https://cdn.snapi.dev/images/v1/g/n/asset-management30-10.jpg,Nasdaq Today: Bitcoin & Libra; What’s Broadcom Doing?,"It was quiet for the Nasdaq today, but bitcoin, Facebook's Libra and the Broadcom-Symantec deal were in focus. 
The post Nasdaq Today: Bitcoin & Libra; What’s Broadcom Doing?",InvestorPlace,"Mon, 15 Jul 2019 16:48:52 -0400",,Neutral,Article
https://www.cnbc.com/2019/07/15/hurricane-barry-oil-gas-producers-in-the-gulf-of-mexico-restart.html,https://cdn.snapi.dev/images/v1/o/i/oil24-11.jpg,Oil and gas producers in the Gulf of Mexico restart after Barry,"US oil companies on Monday began restoring some of the more than nearly 74% production shut at U.S. Gulf of Mexico platforms ahead of Hurricane Barry, the US offshore drilling regulator said.",CNBC,"Mon, 15 Jul 2019 16:47:00 -0400",oil,Neutral,Article
https://www.youtube.com/watch?v=y54XazO4M-E,https://cdn.snapi.dev/images/v1/m/q-6/multiples-should-be-higher-true-bargains-in-market-ubs-tom-digenan.jpg,"Multiples should be higher, true bargains in market: UBS' Tom Digenan","Tom Digenan, head of U.S. intrinsic value equity at UBS, joins CNBC's ""Closing Bell"" to discuss the markets' record closes and whether investors should be worried.",CNBC Television,"Mon, 15 Jul 2019 16:44:17 -0400",,Neutral,Video
https://www.gurufocus.com/news/909040/us-indexes-post-another-day-of-closing-record-highs-monday-,https://cdn.snapi.dev/images/v1/4/s/4srj-4.jpg,US Indexes Post Another Day of Closing Record Highs Monday,"The Dow Jones Industrial Average closed at 27,359.16 on Monday with a gain of 27.13 points or 0.10%.",GuruFocus,"Mon, 15 Jul 2019 16:43:16 -0400",,Positive,Article
https://www.youtube.com/watch?v=-yZG_uloA6U,https://cdn.snapi.dev/images/v1/i/u/closing-countdown-look-to-industrials-chemicals-this-earnings-season.jpg,"Closing Countdown: Look to industrials, chemicals this earnings season","Mike Lewis of Barclays joins CNBC's ""Closing Bell"" to discuss the U.S.",CNBC Television,"Mon, 15 Jul 2019 16:38:15 -0400",,Neutral,Video
https://www.youtube.com/watch?v=8JFOWbvDf_M,https://cdn.snapi.dev/images/v1/4/s/why-were-watching-crude-oils-uptrend-this-week.jpg,Why We're Watching Crude Oil's Uptrend This Week,"Jul.15 -- In ""Charting Futures: This Week,” Bloomberg's Bill Maloney discusses crude oil's recent uptrend from June's low.",Bloomberg Markets and Finance,"Mon, 15 Jul 2019 16:34:57 -0400",oil,Positive,Video
https://www.youtube.com/watch?v=29c-_xuRxhI,https://cdn.snapi.dev/images/v1/3/h/does-a-july-rate-cut-really-make-sense.jpg,Does a July rate cut really make sense?,Yahoo Finance's Editor-in-Chief Andy Serwer and Myles Udland discuss the impact of a July rate cut on the economy and the markets.,Yahoo Finance,"Mon, 15 Jul 2019 16:28:30 -0400",,Neutral,Video
https://investorplace.com/2019/07/dow-jones-today-china-earnings-anticipation-stall-stocks-on-monday/,https://cdn.snapi.dev/images/v1/d/o/dow1600-300x169-4.jpg,"Dow Jones Today: China, Earnings Anticipation Stall Stocks on Monday","Stocks fought off some concerning economic news out of China on Monday, indicating the emphasis is on earnings and the Fed.",InvestorPlace,"Mon, 15 Jul 2019 16:22:50 -0400",earnings,Neutral,Article
https://www.benzinga.com/analyst-ratings/analyst-color/19/07/14067646/what-to-expect-from-q2-earnings-season,https://cdn.snapi.dev/images/v1/6/7/mu-icon-fed-1200x801-5.jpg,What To Expect From Q2 Earnings Season,"Second-quarter earnings season is just around the corner, and experienced traders know the next few weeks will likely be extremely volatile.",Benzinga,"Mon, 15 Jul 2019 16:10:29 -0400",earnings,Neutral,Article
https://www.youtube.com/watch?v=f6czK9dzGyM,https://cdn.snapi.dev/images/v1/q/o/china-trade-talks-havent-been-major-factor-in-market-strategist.jpg,China trade talks haven't been major factor in market: Strategist,"Keith Bliss of Cuttone and Company and James Bianco of Bianco Research join CNBC's ""Closing Bell"" team to talk about how markets are trading and what investors should watch.",CNBC Television,"Mon, 15 Jul 2019 16:09:32 -0400",,Neutral,Video
https://www.marketwatch.com/story/dow-nasdaq-end-at-records-as-citigroup-results-mark-start-of-earnings-season-2019-07-15,https://cdn.snapi.dev/images/v1/n/s/bank6.jpg,"Dow, Nasdaq end at records as Citigroup results mark start of earnings season",U.S. stocks ended slightly higher on Monday as investors saw results from Citigroup kicking off the unofficial start of earnings season for the second-quarter.,Market Watch,"Mon, 15 Jul 2019 16:06:50 -0400",,Positive,Article
https://www.gurufocus.com/news/908933/wall-street-mixed-on-monday,https://cdn.snapi.dev/images/v1/m/w/mw-hm888-flag-w-20190709071716-zhjpguuid1b8fcbb6-a23b-11e9-8c0a-9c8e992d421e-4.jpg,Wall Street Mixed on Monday,U.S. stocks were mixed on Monday as banks and tech companies kick off second-quarter earnings.,GuruFocus,"Mon, 15 Jul 2019 15:34:47 -0400",,Neutral,Article
https://www.cnet.com/news/huawei-5g-ban-could-spread-across-north-america/,https://cdn.snapi.dev/images/v1/h/u/huawei-moody-5.jpg,Huawei 5G ban could spread across North America,The Canadian decision has reportedly been postponed until after the nation's election.,CNET,"Mon, 15 Jul 2019 15:32:53 -0400",,Negative,Article
https://www.youtube.com/watch?v=pFI0ho6PUIM,https://cdn.snapi.dev/images/v1/x/7/larry-kudlow-trumps-tariffs-have-hurt-china.jpg,Larry Kudlow: Trump's tariffs have hurt China,"National Economic Council Director Larry Kudlow on billionaire investor Peter Thiel's comments about Google, the future of USMCA, U.S.",Fox Business,"Mon, 15 Jul 2019 15:26:11 -0400",,Negative,Video
https://www.forbes.com/sites/kenkam/2019/07/15/legg-mason-makes-a-strong-case-for-active-management-in-fixed-income/,https://cdn.snapi.dev/images/v1/0/x/0x600-399.jpg,Legg Mason Makes A Strong Case For Active Management In Fixed Income,"According to Legg Mason, an astounding 96% of their Fixed Income assets outperformed their benchmark over the last 10 years. In stark contrast, only 35% of their Equity assets beat their benchmarks over the same period.",Forbes,"Mon, 15 Jul 2019 15:20:00 -0400",,Positive,Article
https://www.gurufocus.com/news/908930/learning-to-think-like-charlie-mathematics-part-2,https://cdn.snapi.dev/images/v1/r/k/rk4-3.jpg,Learning to Think Like Charlie: Mathematics Part 2,"A deep dive into risk and uncertainty, and how we can use mathematics to partially come to grips with them",GuruFocus,"Mon, 15 Jul 2019 15:15:03 -0400",,Neutral,Article
https://www.youtube.com/watch?v=Qt9DxaAsQOA,https://cdn.snapi.dev/images/v1/t/p/morgan-stanleys-carla-harris-on-investing-in-diverse-businesses.jpg,Morgan Stanley's Carla Harris on investing in diverse businesses,"Carla Harris, vice chairman at Morgan Stanley and head of the multicultural client strategy group, joins ""The Exchange"" to discuss investing in diverse businesses and entrepreneurs.",CNBC Television,"Mon, 15 Jul 2019 15:14:43 -0400",,Neutral,Video
https://www.youtube.com/watch?v=TRUEQCv7uy4,https://cdn.snapi.dev/images/v1/m/q-6/mnuchin-have-made-significant-progress-in-talks-with-china.jpg,Mnuchin: Have made significant progress in talks with China,"Treasury Secretary Steve Mnuchin delivers remarks about concerns regarding cryptocurrencies, including Facebook's proposed digital currency, Libra.",CNBC Television,"Mon, 15 Jul 2019 15:13:45 -0400",,Positive,Video
https://www.youtube.com/watch?v=75vYIiHRC0A,https://cdn.snapi.dev/images/v1/9/f/treasury-department-says-us-could-hit-debt-ceiling-by-september.jpg,Treasury Department says U.S. could hit debt ceiling by September,CNBC's Ylan Mui reports on discussions between Treasury Secretary Steven Mnuchin and House Speaker Nancy Pelosi regarding the debt ceiling.,CNBC Television,"Mon, 15 Jul 2019 15:12:26 -0400",,Negative,Video
https://www.youtube.com/watch?v=LmK6ncFq1ew,https://cdn.snapi.dev/images/v1/h/1/president-trump-talks-of-firing-wilbur-ross-rpt.jpg,President Trump talks of firing Wilbur Ross: RPT,Yahoo Finance's Editor-in-Chief Andy Serwer discusses reports that President Trumo is considering firing Secretary of Commerce Wilbur Ross after losing a Supreme Court case on adding a citizenship question to the census.,Yahoo Finance,"Mon, 15 Jul 2019 15:11:21 -0400",,Negative,Video
https://www.youtube.com/watch?v=tEBkUs2AmGk,https://cdn.snapi.dev/images/v1/m/q-6/mnuchin-harriet-tubman-currency-postponement-non-political.jpg,Mnuchin: Harriet Tubman currency postponement non-political,"Treasury Secretary Steve Mnuchin delivers remarks about concerns regarding cryptocurrencies, including Facebook's proposed digital currency, Libra.",CNBC Television,"Mon, 15 Jul 2019 15:01:17 -0400",,Neutral,Video
https://www.reuters.com/article/us-global-oil/oil-prices-down-on-dwindling-storm-impact-chinese-economic-data-idUSKCN1UA01R,https://cdn.snapi.dev/images/v1/o/x/m02d20190715t2i1408083374rlynxnpef6e00mw640.jpg,"Oil prices down on dwindling storm impact, Chinese economic data","Oil prices sank about 1% on Monday on signs that the impact of a tropical storm on U.S. Gulf Coast production and refining would be short-lived, while Chinese economic data dimmed the crude demand outlook.",Reuters,"Mon, 15 Jul 2019 15:00:51 -0400",oil,Negative,Article
https://www.youtube.com/watch?v=-P2FzgHHulw,https://cdn.snapi.dev/images/v1/b/b/somewhere-along-the-line-tariffs-are-going-to-bite-the-consumer-retail-expert.jpg,'Somewhere along the line (tariffs) are going to bite the consumer: Retail expert,Rick Helfenbein AAFA CEO and President discusses the impact of tariffs on the retail industry and consumers.,Yahoo Finance,"Mon, 15 Jul 2019 14:55:32 -0400",,Negative,Video
https://www.reuters.com/article/us-usa-trade-china-mnuchin/u-s-chinese-officials-to-discuss-trade-in-phone-call-this-week-mnuchin-idUSKCN1UA25R,https://cdn.snapi.dev/images/v1/l/m/m02d20190715t2i1408322020rlynxnpef6e1f5w640.jpg,"U.S., Chinese officials to discuss trade in phone call this week: Mnuchin",U.S. Treasury Secretary Steven Mnuchin on Monday told reporters he expects to have another telephone call with Chinese officials this week as part of resumed discussions about a trade agreement.,Reuters,"Mon, 15 Jul 2019 14:53:23 -0400",,Neutral,Article
https://www.youtube.com/watch?v=gzzJeukvGh4,https://cdn.snapi.dev/images/v1/m/q-6/mnuchin-we-want-technology-to-evolve.jpg,Mnuchin: We want technology to evolve,"Treasury Secretary Steve Mnuchin delivers remarks about concerns regarding cryptocurrencies, including Facebook's proposed digital currency, Libra.",CNBC Television,"Mon, 15 Jul 2019 14:51:49 -0400",,Neutral,Video
https://www.youtube.com/watch?v=hbvhJ0MoWqM,https://cdn.snapi.dev/images/v1/g/y/mnuchin-us-regulators-will-work-against-illicit-crypto-activity.jpg,Mnuchin: US regulators will work against illicit crypto activity,"Treasury Secretary Steve Mnuchin delivers remarks about concerns regarding cryptocurrencies, including Facebook's proposed digital currency, Libra.",CNBC Television,"Mon, 15 Jul 2019 14:50:36 -0400",,Neutral,Video
https://www.youtube.com/watch?v=tIsn4APIRIU,https://cdn.snapi.dev/images/v1/m/q-6/mnuchin-going-to-make-sure-financial-system-protected.jpg,Mnuchin: Going to make sure financial system protected,"Treasury Secretary Steve Mnuchin delivers remarks about concerns regarding cryptocurrenices, including Facebook's proposed digital currency, Libra.",CNBC Television,"Mon, 15 Jul 2019 14:48:54 -0400",,Neutral,Video
https://www.reuters.com/article/us-global-markets/china-data-supports-stocks-as-u-s-earnings-season-begins-idUSKCN1UA01J,https://cdn.snapi.dev/images/v1/g/a/m02d20190715t2i1408237655rlynxnpef6e0xdw640.jpg,China data supports stocks as U.S. earnings season begins,"A gauge of global stocks edged higher on Monday after economic data from China came in as expected, although stocks on Wall Street slipped as financials showed some weakness in the wake of Citigroup's earnings report.",Reuters,"Mon, 15 Jul 2019 14:38:23 -0400",earnings,Positive,Article
https://www.youtube.com/watch?v=lsUVkxkm_Gk,https://cdn.snapi.dev/images/v1/v/1/mnuchin-dont-want-bad-actors-using-cryptocurrencies.jpg,Mnuchin: Don't want bad actors using cryptocurrencies,"Treasury Secretary Steve Mnuchin delivers remarks about concerns regarding cryptocurrenices, including Facebook's proposed digital currency, Libra.",CNBC Television,"Mon, 15 Jul 2019 14:36:52 -0400",,Neutral,Video
https://www.marketwatch.com/story/bitcoin-prices-hold-slight-loss-as-treasurys-mnuchin-aims-to-ratchet-up-cryptocurrency-regulation-2019-07-15,https://cdn.snapi.dev/images/v1/b/i/bit82-1.jpg,Bitcoin prices off 8% as Mnuchin says Treasury will ratchet up cryptocurrency regulation,"Treasury Secretary Steven Mnuchin on Monday afternoon said digital-payment ventures need to be held to the same anti-money laundering, or AML, standards as traditional banks.",Market Watch,"Mon, 15 Jul 2019 14:29:02 -0400",,Negative,Article
https://www.reuters.com/article/us-global-oil/oil-prices-fall-on-fading-storm-impact-chinese-economic-data-idUSKCN1UA01R,https://cdn.snapi.dev/images/v1/2/p/m02d20190715t2i1408083374rlynxnpef6e00mw640.jpg,"Oil prices fall on fading storm impact, Chinese economic data","Oil prices edged lower on Monday on signs that the impact of a tropical storm on U.S. Gulf Coast production and refining would be short-lived, while Chinese economic data dimmed the crude demand outlook.",Reuters,"Mon, 15 Jul 2019 14:21:54 -0400",oil,Negative,Article
https://www.marketwatch.com/story/eia-forecasts-us-shale-oil-output-to-climb-by-49000-barrels-a-day-in-august-2019-07-15,https://cdn.snapi.dev/images/v1/o/i/oil2-13.jpg,"EIA forecasts U.S. shale oil output to climb by 49,000 barrels a day in August","Crude-oil production from seven major U.S. shale plays is forecast to climb by 49,000 barrels a day in August to 8.546 million barrels a day, according to a report from the Energy Information Administration released Monday.",Market Watch,"Mon, 15 Jul 2019 14:17:14 -0400",oil,Positive,Article
https://www.marketwatch.com/story/gulf-of-mexico-oil-and-natural-gas-production-starts-to-recover-after-hurricane-barry-2019-07-15,https://cdn.snapi.dev/images/v1/o/i/oil26-4.jpg,Gulf of Mexico oil and natural-gas production starts to recover after Hurricane Barry,"Oil and natural-gas production in the Gulf of Mexico on Monday was picking up again after Hurricane Barry was downgraded to a tropical depression. About 69% of Gulf oil production and nearly 61% of natural-gas production have been shut in, according to the Bureau of Safety and Environmental Enforcement.",Market Watch,"Mon, 15 Jul 2019 14:12:59 -0400",oil,Positive,Article
https://www.benzinga.com/markets/cannabis/19/07/14075959/cannabis-countdown-top-10-marijuana-stock-news-stories-of-the-week-july-15,https://cdn.snapi.dev/images/v1/e/c/cannabis-2152604-1920-35.jpg,"Cannabis Countdown: Top 10 Marijuana Stock News Stories Of The Week, July 15",This story originally appeared on TheCannabisInvestor.ca. Welcome to the Cannabis Countdown.,Benzinga,"Mon, 15 Jul 2019 14:11:00 -0400",cannabis,Positive,Article
https://www.reuters.com/article/us-canada-huawei-tech/exclusive-canada-set-to-postpone-huawei-5g-decision-to-after-vote-given-sour-ties-with-china-sources-idUSKCN1UA20R,https://cdn.snapi.dev/images/v1/m/0/m02d20190715t2i1408306984rlynxnpef6e19cw640.jpg,"Exclusive: Canada set to postpone Huawei 5G decision to after vote, given sour ties with China - sources","Canada is likely to postpone a decision on whether to allow China's Huawei Technologies Co Ltd to supply 5G network equipment until after the October federal election, given increasingly strained relations with Beijing, say three well-placed sources.",Reuters,"Mon, 15 Jul 2019 14:01:03 -0400",,Neutral,Article
https://www.marketwatch.com/story/treasury-secretary-mnuchin-to-hold-briefing-to-discuss-cryptocurrency-regulation-at-2-pm-et-2019-07-15,https://cdn.snapi.dev/images/v1/1/0-3/105956463-1560052012690gettyimages-1148486432.jpeg,Treasury Secretary Mnuchin to hold briefing to discuss cryptocurrency regulation at 2 p.m. ET,"Treasury Secretary Steven Mnuchin was slated to discuss digital currency regulation at 2 p.m. Eastern on Monday, the White House said",Market Watch,"Mon, 15 Jul 2019 13:59:07 -0400",,Neutral,Article
https://www.cnbc.com/2019/07/15/wall-street-sees-chance-that-trump-takes-action-to-weaken-the-dollar.html,https://cdn.snapi.dev/images/v1/t/4/105249656-rts1qbzl.jpg,Wall Street firms see increased chance that Trump takes action to weaken the dollar,Wall Street analysts say it is increasingly possible the Trump administration will try using a stronger weapon in the currency wars than just presidential tweets.,CNBC,"Mon, 15 Jul 2019 13:55:00 -0400",,Neutral,Article
