news_url,image_url,title,text,source_name,date,topics,sentiment,type
https://www.reuters.com/article/us-global-markets/asia-shares-rise-on-trade-war-hopes-firm-u-s-data-safe-havens-sold-idUSKCN1VR03Q,https://cdn.snapi.dev/images/v1/a/d/m02d20190906t2i1426721125rlynxnpef8503uw640.jpg,"Asia shares rise on trade war hopes, firm U.S. data; safe havens sold",Asian stocks joined global peers and rose on Friday while safe havens such as government bonds and the yen were on the defensive amid hopes for easing U.S.-China trade tensions and as firm U.S.,Reuters,"Thu, 05 Sep 2019 23:12:19 -0400",,Positive,Article
https://www.cnbc.com/2019/09/06/oil-prices-edge-higher-set-for-weekly-gain-amid-us-china-trade-optimism.html,https://cdn.snapi.dev/images/v1/j/d/102862389-rtx1i2kz.jpg,"Oil prices edge higher, set for weekly gain amid trade optimism","Oil prices edged higher on Friday, with crude benchmarks poised for multi-week gains amid a sharp draw down in U.S. crude inventories, while trade tensions eased after Washington and Beijing agreed to hold high-level talks next month.",CNBC,"Thu, 05 Sep 2019 22:11:00 -0400",oil,Positive,Article
https://www.reuters.com/article/us-global-markets/shares-rise-safe-havens-sold-on-trade-war-optimism-firm-u-s-data-idUSKCN1VR03Q,https://cdn.snapi.dev/images/v1/d/3/m02d20190906t2i1426721125rlynxnpef8503uw640.jpg,"Shares rise, safe havens sold on trade war optimism, firm U.S. data",Asian stocks tracked global peers and rose on Friday while safe havens such as government bonds and the yen were sold amid signs of easing U.S.-China trade tensions and as firm U.S.,Reuters,"Thu, 05 Sep 2019 21:01:01 -0400",,Positive,Article
https://www.cnbc.com/2019/09/06/trade-war-taiwan-japanese-companies-moving-home-due-to-us-tariffs.html,https://cdn.snapi.dev/images/v1/u/b/106112377-1567643576965gettyimages-1146798292.jpeg,"With tariffs eating into profits, some Asian companies are moving home","As tariffs rise, some Asian companies are returning home to produce their goods, or moving away from China where their factories were located.",CNBC,"Thu, 05 Sep 2019 21:00:00 -0400",,Neutral,Article
https://www.youtube.com/watch?v=Y4koHmsiqik,https://cdn.snapi.dev/images/v1/y/9/jim-cramer-thursdays-rally-is-not-a-momentous-moment-in-the-stock-market.jpg,Jim Cramer: Thursday's rally is not a 'momentous moment in the stock market',Jim Cramer reviews the latest stock market developments since his return from vacation and reveals what he thinks is ahead for Wall Street.,CNBC Television,"Thu, 05 Sep 2019 19:58:21 -0400","cramer,madmoney",Neutral,Video
https://www.cnbc.com/2019/09/05/jim-cramers-top-stock-picks-for-his-2019-fantasy-portfolio-draft.html,https://cdn.snapi.dev/images/v1/b/v/106114671-1567719602333gettyimages-1163261808.jpeg,Jim Cramer makes his top stock picks in his annual 'fantasy portfolio' draft,"""Managing a diversified portfolio of stocks has a lot in common with putting together a fantasy football team,"" the ""Mad Money"" host says.",CNBC,"Thu, 05 Sep 2019 19:50:00 -0400","cramer,madmoney",Positive,Article
https://www.reuters.com/article/us-usa-trade-china-manufacturers/no-place-like-home-chinese-firms-stung-by-trade-war-build-up-domestic-brands-idUSKCN1VQ2W4,https://cdn.snapi.dev/images/v1/i/j/m02d20190905t2i1426698555rlynxnpef8426yw640.jpg,No place like home: Chinese firms stung by trade war build up domestic brands,"For over a decade, manufacturer Matsutek plied away at building its business with big Western brands, supplying firms such as Philips and Honeywell with products made in its Chinese factories for the U.S. and other overseas markets.",Reuters,"Thu, 05 Sep 2019 19:17:26 -0400",,Negative,Article
https://www.youtube.com/watch?v=FxKAbZz22vY,https://cdn.snapi.dev/images/v1/t/u/positive-economic-data-triggered-a-sea-change-in-the-stocks-that-are-working-on-wall-street-jim-c.jpg,"Positive economic data triggered a 'sea change' in the stocks that are working on Wall Street, Jim Cramer","With positive trade, payroll and manufacturing news, recession talk could subside over the course of a few days, Jim Cramer says.",CNBC Television,"Thu, 05 Sep 2019 19:16:51 -0400","cramer,madmoney",Neutral,Video
https://www.youtube.com/watch?v=ECa02XZJhjo,https://cdn.snapi.dev/images/v1/x/s/jim-cramer-makes-offense-defense-picks-in-his-annual-fantasy-portfolio-draft.jpg,"Jim Cramer makes offense, defense picks in his annual 'fantasy portfolio' draft","""Managing a diversified portfolio of stocks has a lot in common with putting together a fantasy football team,"" the ""Mad Money"" host says.",CNBC Television,"Thu, 05 Sep 2019 19:16:35 -0400","cramer,madmoney",Neutral,Video
https://www.theguardian.com/environment/2019/sep/06/oil-and-gas-companies-undermining-climate-goals-says-report,https://cdn.snapi.dev/images/v1/m/e/4288jpgwidth460quality85autoformatfitmaxsfcb6200c9506314b12526ea9957f82ad.jpg,"Oil and gas companies undermining climate goals, says report",Biggest fossil fuel extractors warned they risk wasting $2.2tn ‘in a low-carbon world’,The Guardian,"Thu, 05 Sep 2019 19:01:21 -0400",oil,Negative,Article
https://www.reuters.com/article/us-usa-trade-china-talks-explainer/explainer-u-s-china-more-divided-than-ever-as-new-trade-talks-loom-idUSKCN1VQ2VS,https://cdn.snapi.dev/images/v1/2/q/m02d20190905t2i1426692910rlynxnpef8425ew640.jpg,"Explainer: U.S., China more divided than ever as new trade talks loom",Senior U.S. and Chinese officials have pledged to meet in October to settle their ongoing trade war but a lasting peace seems more elusive than ever.,Reuters,"Thu, 05 Sep 2019 18:55:53 -0400",,Neutral,Article
https://www.cnbc.com/2019/09/05/jim-cramer-good-economic-data-triggered-a-sea-change-on-wall-street.html,https://cdn.snapi.dev/images/v1/6/j/103432870-rts8s1o.jpg,Good economic data triggered a 'sea change' in investments on Wall Street: Jim Cramer,"With positive trade, payroll and manufacturing news, recession talk could subside over the course of a few days, Jim Cramer says.",CNBC,"Thu, 05 Sep 2019 18:43:00 -0400","cramer,madmoney",Neutral,Article
https://www.youtube.com/watch?v=UzIsEwAsyUQ,https://cdn.snapi.dev/images/v1/y/t/play-the-volatility-buy-all-the-dips-and-expect-a-santa-claus-rally-lee-munson.jpg,"'Play the volatility, buy all the dips and expect a Santa Claus rally...': Lee Munson",Portfolio Wealth Advisors President and CIO talks investing and investment strategy for the next six to twelve months.,Yahoo Finance,"Thu, 05 Sep 2019 18:07:52 -0400",,Neutral,Video
https://www.youtube.com/watch?v=00XvxPEvt1E,https://cdn.snapi.dev/images/v1/n/d/10-year-yield-could-fall-to-zero-this-year-jpmorgans-top-fixed-income-strategist-says.jpg,"10-year yield could fall to zero this year, JPMorgan's top fixed income strategist says",JPMorgan's Bob Michele on global rate cuts and what's to come.,CNBC Television,"Thu, 05 Sep 2019 18:05:24 -0400",,Neutral,Video
https://www.youtube.com/watch?v=sNk1umdoQ98,https://cdn.snapi.dev/images/v1/l/f/the-global-rate-cut-frenzy-may-just-be-in-its-early-stages.jpg,The global rate cut frenzy may just be in its early stages,Discussing the global frenzy to cut rates.,CNBC Television,"Thu, 05 Sep 2019 17:54:34 -0400",,Neutral,Video
https://www.youtube.com/watch?v=OET5MVeQD6w,https://cdn.snapi.dev/images/v1/m/q/wework-isnt-worth-anywhere-near-20-billion-nyus-galloway-says.jpg,"WeWork Isn't Worth Anywhere Near $20 Billion, NYU's Galloway Says","Sep.05 -- Scott Galloway, professor at New York University's Stern School of Business, discusses WeWork's targeted initial public offering valuation with Bloomberg's Romaine Bostick, Joe Weisenthal and Caroline Hyde on ""Bloomberg Markets: What'd You Miss?",Bloomberg Technology,"Thu, 05 Sep 2019 17:54:23 -0400",,Neutral,Video
https://www.youtube.com/watch?v=iE5N7ChKRPY,https://cdn.snapi.dev/images/v1/m/2/bloomberg-oils-next-big-boom-cold-open.jpg,Bloomberg: Oil's Next Big Boom (Cold Open),Mexico and Venezuela have long been the oil powerhouses of Latin America.,Bloomberg Markets and Finance,"Thu, 05 Sep 2019 17:49:28 -0400",oil,Neutral,Video
https://www.youtube.com/watch?v=iE3nozbDrcE,https://cdn.snapi.dev/images/v1/a/5/if-you-dont-trust-todays-rally-bet-on-the-trump-trade.jpg,"If you don't trust today's rally, bet on the T.R.U.M.P. trade?",Cornerstone Macro's Michael Kantrowitz says it's still a good time to be defensively positioned.,CNBC Television,"Thu, 05 Sep 2019 17:43:39 -0400",,Neutral,Video
https://www.youtube.com/watch?v=0Jq48WcDV1A,https://cdn.snapi.dev/images/v1/m/q/market-way-up-today-so-is-everything-awesome-again.jpg,"Market way up today, so is everything awesome again?","The Dow was up over 370 points today.The traders discuss what that means for investors. With CNBC's Melissa Lee and the Fast Money traders, Pete Najarian, Brian Kelly, Steve Grasso and Guy Adami.",CNBC Television,"Thu, 05 Sep 2019 17:39:18 -0400",,Neutral,Video
https://www.reuters.com/article/us-usa-treasury-housing/u-s-treasury-calls-for-recapitalizing-fannie-freddie-in-long-awaited-overhaul-plan-idUSKCN1VQ2QQ,https://cdn.snapi.dev/images/v1/y/q/m02d20190905t2i1426671796rlynxnpef8422fw640.jpg,"U.S. Treasury calls for recapitalizing Fannie, Freddie in long-awaited overhaul plan","The U.S. Treasury on Thursday said the government should draw up a plan to begin recapitalizing mortgage giants Fannie Mae and Freddie Mac, while calling on Congress to pen comprehensive housing reform that would allow the pair to be safely freed from government control.",Reuters,"Thu, 05 Sep 2019 17:28:31 -0400",,Neutral,Article
https://www.youtube.com/watch?v=6mAr5XU0e3w,https://cdn.snapi.dev/images/v1/m/q/leutholds-paulsen-economic-momentum-around-globe-has-started-to-break-out-to-upside.jpg,Leuthold's Paulsen: Economic momentum around globe has started to break out to upside,"Stephanie Link, head of global equities at Nuveen, and Jim Paulsen, chief investment strategist at Leuthold Group, join CNBC's ""Closing Bell"" to discuss the day's market action and what's driving today's rally.",CNBC Television,"Thu, 05 Sep 2019 16:41:52 -0400",,Positive,Video
https://www.etftrends.com/leveraged-inverse-channel/will-the-fed-rate-cut-satisfy-markets/,https://cdn.snapi.dev/images/v1/p/x/will-the-fed-rate-cut-satisfy-markets-915x510.jpg,Will the Fed Rate Cut Satisfy Markets?,"There is significant debate among Federal Reserve officials as to whether or not they will cut interest rates at the next meeting this month. Some officials feel the economy is strong and does not warrant a rate cut, others believe it makes sense to monitor the current situations, and some feel that now is the [.",ETF Trends,"Thu, 05 Sep 2019 16:41:10 -0400",,Neutral,Article
https://www.reuters.com/article/us-global-markets/stocks-rally-treasury-yields-rise-on-easing-trade-fears-idUSKCN1VQ047,https://cdn.snapi.dev/images/v1/k/d/m02d20190905t2i1426578166rlynxnpef841jlw640.jpg,"Stocks rally, Treasury yields rise on easing trade fears",U.S. stocks followed worldwide equities to one-month highs and Treasury yields rose sharply on Thursday as renewed U.S.-China trade optimism and upbeat U.S. economic data stoked risk appetite and lured investors away from safe-haven assets.,Reuters,"Thu, 05 Sep 2019 16:19:50 -0400",,Positive,Article
https://www.youtube.com/watch?v=YBtLg-PnEVY,https://cdn.snapi.dev/images/v1/m/q/chief-market-strategist-market-rebound-shows-pent-up-demand-for-equities.jpg,Chief market strategist: Market rebound shows pent-up demand for equities,"JJ Kinahan, chief market strategist at TD Ameritrade, joins CNBC's ""Closing Bell"" for trade the close to discuss the day's market action and how far he thinks the market rally can go.",CNBC Television,"Thu, 05 Sep 2019 16:18:45 -0400",,Positive,Video
https://investorplace.com/2019/09/dow-stocks-were-boosted-by-some-good-news-on-the-trade-front/,https://cdn.snapi.dev/images/v1/e/t/etf38.jpg,"Dow Jones Today: Finally, Some Relief on the Trade Front","Adding to stocks' gains today was a bullish private payroll survey from ADP, which showed the addition of 195,000 private sector jobs in August, easily topping the 148,000 new jobs economists expected. The Department of Labor reveals its August number tomorrow before the bell with economists expecting the addition of 160,000 new jobs with unemployment holding steady at 3.7% and wages growing 3%.",InvestorPlace,"Thu, 05 Sep 2019 16:16:39 -0400",,Positive,Article
https://www.youtube.com/watch?v=GUbbrVo4qYE,https://cdn.snapi.dev/images/v1/g/s/volatility-down-sps-been-decoupling-from-rest-of-the-world-tom-lee.jpg,"Volatility down, S&P's been decoupling from rest of the world: Tom Lee",Fundstrat Global Advisors' Tom Lee and Nuveen's Stephanie Link discuss today's market rally and where they see stocks headed.,CNBC Television,"Thu, 05 Sep 2019 15:56:44 -0400",,Neutral,Video
https://www.etftrends.com/alternatives-channel/an-infrastructure-etf-to-diversify-assets/,https://cdn.snapi.dev/images/v1/d/x/an-infrastructure-etf-to-diversify-assets-915x510.jpg,An Infrastructure ETF To Diversify Assets,"We use infrastructure every day, often without recognizing what we are doing. Infrastructure provides us with our water, electricity, and natural gas.",ETF Trends,"Thu, 05 Sep 2019 15:41:23 -0400",,Neutral,Article
https://www.reuters.com/article/us-usa-trade-china/u-s-china-agree-to-resume-trade-talks-markets-jump-idUSKCN1VQ061,https://cdn.snapi.dev/images/v1/e/b/m02d20190905t2i1426413766rlynxnpef8403sw640.jpg,"U.S., China agree to resume trade talks, markets jump","China and the United States on Thursday agreed to hold high-level talks in early October in Washington, cheering investors hoping for a trade war thaw as new U.S. tariffs on Chinese consumer goods chip away at global growth.",Reuters,"Thu, 05 Sep 2019 15:34:17 -0400",,Neutral,Article
https://www.reuters.com/article/us-argentina-economy/argentina-opposition-front-runner-strikes-populist-tone-in-madrid-markets-hold-steady-idUSKCN1VQ20E,https://cdn.snapi.dev/images/v1/c/r/m02d20190905t2i1426639924rlynxnpef841iiw640.jpg,"Argentina opposition front-runner strikes populist tone in Madrid, markets hold steady","Argentina's likely next President, opposition front-runner Alberto Fernandez, laid out his populist credentials during a visit to Madrid on Thursday, saying local Argentine interests would trump those of creditors and energy investors.",Reuters,"Thu, 05 Sep 2019 15:22:30 -0400",,Neutral,Article
https://www.reuters.com/article/us-usa-fed-trade/trade-uncertainty-to-trim-850-billion-global-output-fed-paper-idUSKCN1VQ2KH,https://cdn.snapi.dev/images/v1/t/m/m02d20190905t2i1426639751rlynxnpef841w6w640.jpg,Trade uncertainty to trim $850 billion global output: Fed paper,"Trade policy uncertainty driven by the Trump administration's escalating dispute with China means hundreds of billions of dollars in lost U.S. output and as much as $850 billion lost globally through early next year, research published this week by the Federal Reserve suggests.",Reuters,"Thu, 05 Sep 2019 15:20:30 -0400",,Negative,Article
https://www.reuters.com/article/us-mexico-oil-hedge-exclusive/exclusive-mexico-moves-to-launch-worlds-largest-oil-hedge-program-sources-idUSKCN1VQ2E1,https://cdn.snapi.dev/images/v1/j/o/m02d20190905t2i1426636149rlynxnpef841vlw640.jpg,Exclusive: Mexico moves to launch world's largest oil hedge program - sources,"Mexico has made the first moves to launch its annual $1 billion oil hedging program by asking banks for quotes, sources familiar with the deal said, while buying in financial oil options contracts for 2020 has risen in recent days, consistent with the giant trade.",Reuters,"Thu, 05 Sep 2019 14:59:12 -0400",oil,Neutral,Article
https://www.reuters.com/article/us-usa-stocks/what-trade-fears-wall-street-is-back-in-rally-mode-idUSKCN1VQ1H5,https://cdn.snapi.dev/images/v1/z/d/m02d20190905t2i1426595089rlynxnpef841muw640.jpg,What trade fears? Wall Street is back in rally mode,"U.S. stocks surged on Thursday on expectations of a de-escalation in trade tensions after Washington and Beijing agreed to hold high-level talks next month, while strong economic data eased fears of a domestic slowdown.",Reuters,"Thu, 05 Sep 2019 14:48:22 -0400",,Positive,Article
https://www.youtube.com/watch?v=1ZMWC_wvun4,https://cdn.snapi.dev/images/v1/g/l/i-still-think-were-headed-toward-a-2020-recession-says-hugh-johnson.jpg,"I still think we're headed toward a 2020 recession, says Hugh Johnson","Hugh Johnson, Hugh Johnson Advisors; Sandip Bhagat, Whittier Trust; and CNBC's Steve Liesman discuss the markets ahead of tomorrow's jobs number.",CNBC Television,"Thu, 05 Sep 2019 14:45:55 -0400",,Negative,Video
https://www.youtube.com/watch?v=sIxU8QJNXQI,https://cdn.snapi.dev/images/v1/t/x/ellis-on-applying-pressure-on-china-trump-meeting-with-gm-ceo.jpg,"Ellis on applying pressure on China, Trump meeting with GM CEO",Former Trump trade & jobs advisor Curtis Ellis on the U.S.,Fox Business,"Thu, 05 Sep 2019 14:44:49 -0400",,Neutral,Video
https://www.etftrends.com/innovative-etfs-channel/trade-war-de-escalation-hopes-drive-u-s-stock-etf-rally/,https://cdn.snapi.dev/images/v1/m/n/trade-war-de-escalation-hopes-drive-us-stock-etf-rally.jpg,Trade War De-Escalation Hopes Drive U.S. Stock ETF Rally,"U.S. markets and stock ETFs surged Thursday after the United States and China said they will reconvene and talk trade in Washington, D.C. next month, renewing hopes for a break in the prolonged trade war.",ETF Trends,"Thu, 05 Sep 2019 14:41:01 -0400",,Positive,Article
https://www.youtube.com/watch?v=JZT2akTJJJA,https://cdn.snapi.dev/images/v1/a/l/recession-thoughts-move-to-back-burner-ahead-of-friday-jobs-report.jpg,Recession thoughts move to back burner ahead of Friday jobs report,CNBC's Steve Liesman breaks down the tale of two U.S. economies ahead of Friday's big jobs report.,CNBC Television,"Thu, 05 Sep 2019 14:40:09 -0400",,Negative,Video
https://www.forbes.com/sites/gauravsharma/2019/09/05/big-oil-companies-lead-emea-companies-cash-reserves-spike-to-1-2t/,https://cdn.snapi.dev/images/v1/b/o/0x600.jpg,Big Oil Companies Lead EMEA Companies' Cash Reserves Spike To $1.2T,Corporate cash piles at non-financial companies in the region saw a doubt-digit percentage rise in 2018 courtesy energy sector players.,Forbes,"Thu, 05 Sep 2019 14:37:00 -0400",oil,Neutral,Article
https://www.cnbc.com/2019/09/05/fed-rates-investors-unlikely-to-be-satisfied-with-quarter-point-cut.html,https://cdn.snapi.dev/images/v1/v/f/106111686-15676156310301u8a1736.jpg,"The Fed is expected to cut rates only a quarter point, and that may not satisfy markets",A quarter-point reduction could leave the central bank open to charges that it is tone-deaf about market and economic data signals.,CNBC,"Thu, 05 Sep 2019 14:13:00 -0400",earnings,Neutral,Article
https://www.reuters.com/article/us-global-markets/stocks-jump-treasury-yields-soar-on-news-of-u-s-china-trade-talks-idUSKCN1VQ047,https://cdn.snapi.dev/images/v1/n/m/m02d20190905t2i1426578166rlynxnpef841jlw640.jpg,"Stocks jump, Treasury yields soar on news of U.S.-China trade talks",Stocks worldwide hit one-month highs and U.S. Treasury yields surged on Thursday as renewed U.S.,Reuters,"Thu, 05 Sep 2019 14:07:51 -0400",,Positive,Article
https://www.iris.xyz/advisor/investment-performance-of-sustainable-and-impact-strategies-by-asset-class,https://cdn.snapi.dev/images/v1/k/s/investment-performance-of-sustainable-and-impact-strategies-by-asset-class-1000x600.jpg,Sacrifice Nothing: A Fresh Look At Investment Performance Of Sustainable And Impact Strategies By Asset Class,"Despite decades of competitive returns, a “myth” persists that sustainable and impact investment strategies financially underperform conventional strategies. The myth should be dead.",Iris,"Thu, 05 Sep 2019 14:00:58 -0400",,Positive,Article
https://www.youtube.com/watch?v=kM8YLVlWgKk,https://cdn.snapi.dev/images/v1/t/t/ray-dalio-sees-25-chance-of-recession-through-2020.jpg,Ray Dalio Sees 25% Chance of Recession Through 2020,"Ray Dalio, the billionaire founder of Bridgewater Associates, says he sees a 25% chance of recession in 2019 and 2020.",Bloomberg Markets and Finance,"Thu, 05 Sep 2019 13:57:18 -0400",,Negative,Video
https://www.youtube.com/watch?v=4S3Mlv0a6n0,https://cdn.snapi.dev/images/v1/t/t/until-trade-deal-is-settled-we-will-continue-to-see-fickle-response-from-markets-nancy-tengler.jpg,"Until trade deal is settled, we will continue to see fickle response from markets: Nancy Tengler","Nancy Tengler, Butcher Joseph Asset Management, and CNBC's Mike Santoli join ""The Exchange"" to discuss why stocks and copper are trading higher after positive U.S.",CNBC Television,"Thu, 05 Sep 2019 13:36:11 -0400",,Neutral,Video
https://www.reuters.com/article/us-usa-stocks/robust-economic-data-easing-trade-worries-push-wall-street-higher-idUSKCN1VQ1H5,https://cdn.snapi.dev/images/v1/s/d/m02d20190905t2i1426595089rlynxnpef841muw640.jpg,"Robust economic data, easing trade worries push Wall Street higher","U.S. stocks hit a one-month high on Thursday on hopes of a de-escalation in trade tensions after Washington and Beijing agreed to hold high-level talks next month, while strong economic data eased concerns of a domestic slowdown.",Reuters,"Thu, 05 Sep 2019 13:35:59 -0400",,Negative,Article
https://www.youtube.com/watch?v=1tChjFyoZIM,https://cdn.snapi.dev/images/v1/h/w/tennis-legend-andy-roddick-says-dont-be-afraid-to-ask-questions-when-it-comes-to-investing.jpg,Tennis legend Andy Roddick says don't be afraid to ask questions when it comes to investing,"Tennis legend Andy Roddick joins ""Fast Money Halftime Report"" to discuss his strategy when it comes to investing and how he got started in managing his money.",CNBC Television,"Thu, 05 Sep 2019 13:21:59 -0400",,Neutral,Video
https://www.youtube.com/watch?v=h2JvsF_uXGA,https://cdn.snapi.dev/images/v1/p/d/santoli-rally-suggests-people-overly-nervous-about-market-in-august.jpg,Santoli: Rally suggests people overly nervous about market in August,"Brian Belski of BMO Capital Markets and CNBC's Mike Santoli discuss the markets with CNBC's ""Squawk Alley"" as stocks rally on news that the U.S.",CNBC Television,"Thu, 05 Sep 2019 13:12:32 -0400",,Negative,Video
https://www.youtube.com/watch?v=0SBF_-c1VFA,https://cdn.snapi.dev/images/v1/v/o/vox-05-09.jpg,Vox Media CEO Jim Bankoff on media and sports betting,"Vox Media chairman and CEO Jim Bankoff joins ""Squawk Alley"" to discuss SB Nation's new partnership with Draft Kings.",CNBC Television,"Thu, 05 Sep 2019 13:11:21 -0400",CEO,Neutral,Video
https://www.youtube.com/watch?v=7aiG0jiGN5w,https://cdn.snapi.dev/images/v1/m/u/you-dont-have-to-chase-this-rally-but-do-buy-the-pullback-says-citis-kristen-bitterly.jpg,"You don't have to chase this rally, but do buy the pullback, says Citi's Kristen Bitterly","Kristen Bitterly, Citi Private Bank, joins ""Fast Money Halftime Report"" to discuss how investors should be trading on new U.S.-China trade developments.",CNBC Television,"Thu, 05 Sep 2019 13:07:54 -0400",,Positive,Video
https://www.theguardian.com/business/2019/sep/05/events-dear-boy-events-how-politics-is-making-markets-volatile,https://cdn.snapi.dev/images/v1/n/h/3500jpgwidth460quality85autoformatfitmaxsda6df798953c1b42919768d63712a2cf.jpg,"Events, dear boy, events: how politics is making markets volatile",The goings-on in the White House and Westminster are having as much effect as economic indicators,The Guardian,"Thu, 05 Sep 2019 13:00:24 -0400",,Neutral,Article
https://techcrunch.com/2019/09/05/parallel-markets/,https://cdn.snapi.dev/images/v1/q/u/istock-2.jpg,Parallel Markets is trying to make it easy to buy and sell private stock,"Parallel Markets is a new startup aiming to make it as easy to buy and sell private company shares as it is for public company stock. COO Nicholas Goss said this is becoming issue for startups as they stay private for longer, which means early employees can find their equity locked up for longer periods […]",TechCrunch,"Thu, 05 Sep 2019 12:52:21 -0400",,Neutral,Article
https://nypost.com/2019/09/05/dow-surges-450-points-as-us-and-china-set-trade-talks/,https://cdn.snapi.dev/images/v1/u/v/marts-higher-chinajpgquality90stripall.jpg,Dow surges 450 points as US and China set trade talks,"US stocks hit one-month highs on Thursday on hopes of a de-escalation in trade tensions after Washington and Beijing agreed to hold high-level talks next month, while strong US economic data allayed some concerns of a slowdown. Wall Street’s three main indexes touched their highest level since Aug.",New York Post,"Thu, 05 Sep 2019 12:43:43 -0400",,Positive,Article
