news_url,image_url,title,text,source_name,date,topics,sentiment,type
https://www.youtube.com/watch?v=eiiqlKKqrnY,https://cdn.snapi.dev/images/v1/m/q/uber-is-said-to-select-morgan-stanley-to-lead-public-offering.jpg,Uber Is Said to Select Morgan Stanley to Lead Public Offering,"Dec.11 -- Uber Technologies Inc. has selected Morgan Stanley to lead its public offering next year, according to two people familiar with the matter, meaning the investment bank will reap a larger share of the fees associated with a listing valuing the company at as much as $120 billion. Bloomberg's Tom Giles and Emma Chandra have more on ""Bloomberg Markets: Balance of Power.""",Bloomberg Technology,"Wed, 27 Mar 2019 17:41:40 -0400",,Neutral,Video
https://www.youtube.com/watch?v=ZF_s9ZhJDF8,https://cdn.snapi.dev/images/v1/m/q/lyft-ipo-price-range-now-70-to-72.jpg,Lyft IPO price range now $70 to $72,CNBC's Deirdre Bosa reports on Lyft's recent increase in its expected IPO price range.,CNBC Television,"Wed, 27 Mar 2019 17:10:39 -0400",,Neutral,Video
https://feeds.marketwatch.com/~r/marketwatch/marketpulse/~3/-y__3iYszmA/story.aspx,https://cdn.snapi.dev/images/v1/l/y/ly77.jpg,"Lyft increases IPO range, expects to charge $70 to $72 a share","Lyft Inc. increased the amount it expects to charge for shares in its initial public offering Wednesday afternoon, raising the expected range to $70 to $72 a share.",Market Watch,"Wed, 27 Mar 2019 15:52:50 -0400",,Neutral,Article
https://www.youtube.com/watch?v=4wqtRBPFwsQ,https://cdn.snapi.dev/images/v1/m/q/casper-sleep-reportedly-hires-underwriters-for-an-ipo.jpg,Casper Sleep reportedly hires underwriters for an IPO,"CNBC's Rahel Solomon breaks down news that U.S. online mattress retailer Casper Sleep Inc is seeking to hire underwriters for an initial public offering, according to Reuters.",CNBC Television,"Wed, 27 Mar 2019 15:17:19 -0400",,Neutral,Video
https://www.youtube.com/watch?v=yoJlMZy4gSE,https://cdn.snapi.dev/images/v1/m/q/q1-gdp-tracking-at-15-percent.jpg,Q1 GDP tracking at 1.5 percent,CNBC's Steve Liesman joins the 'Fast Money Halftime Report' team to discuss what CNBC and Moody's Analytics are seeing for Q1 GDP.,CNBC Television,"Wed, 27 Mar 2019 13:13:17 -0400",,Neutral,Video
https://www.youtube.com/watch?v=gqQVLVNFQg8,https://cdn.snapi.dev/images/v1/m/q/why-this-expert-says-the-ipo-market-is-a-dangerous-place.jpg,Why this expert says the IPO market is a 'dangerous place',"Eric Hippeau, managing partner at Lerer Hippeau, and Larry Haverty, managing director at LJH Investment Advisors, joins ""Squawk Alley"" to look ahead at some of the biggest IPOs of 2019, and why they might not be the best investments.",CNBC Television,"Wed, 27 Mar 2019 12:59:30 -0400",,Neutral,Video
https://www.youtube.com/watch?v=_-JJJb4oIx8,https://cdn.snapi.dev/images/v1/m/q/casper-seeking-underwriters-for-ipo.jpg,Casper seeking underwriters for IPO,"Melody Hahm, Heidi Cheung, Myles Udland and Dan Roberts of Yahoo Finance discuss the online mattress company Casper  which is seeking underwriters for its IPO.",Yahoo Finance,"Wed, 27 Mar 2019 11:55:17 -0400",,Neutral,Video
https://www.youtube.com/watch?v=us9H1K9o4Ys,https://cdn.snapi.dev/images/v1/m/q/how-this-portfolio-manager-is-navigating-market-volatility.jpg,How this portfolio manager is navigating market volatility,"Bryant VanCronkhite, Wells Fargo portfolio manager, and Eric Marshall, Hodges Small Cap Fund portfolio manager, discuss the state of the markets and how they're navigating ongoing volatility with CNBC's ""Squawk on the Street.""",CNBC Television,"Wed, 27 Mar 2019 11:01:59 -0400",,Positive,Video
https://www.youtube.com/watch?v=KnaaOhN1_Y8,https://cdn.snapi.dev/images/v1/m/q/market-optimism-rises-in-cnbcs-all-america-economic-survey.jpg,Market optimism rises in CNBC's All-America Economic Survey,CNBC's Steve Liesman breaks down new survey data from CNBC's All-America Economic Survey that shows Americans' confidence in the economy and markets are rising.,CNBC Television,"Wed, 27 Mar 2019 10:48:17 -0400",,Positive,Video
https://www.youtube.com/watch?v=YhLHhBYnEBQ,https://cdn.snapi.dev/images/v1/m/q/watch-cnbcs-full-interview-with-senator-ted-cruz.jpg,Watch CNBC's full interview with Senator Ted Cruz,"Sen. Ted Cruz (R-Texas) joins ""Squawk Box"" to discuss the congressional hearing on the Boeing 737 Max crashes, the ACA court challenge, the Mueller report, and the future of space exploration.",CNBC Television,"Wed, 27 Mar 2019 10:43:40 -0400",,Neutral,Video
https://feeds.benzinga.com/~r/benzinga/~3/92hNg1qMv-Q/the-lyft-ipo-what-you-need-to-know,https://cdn.snapi.dev/images/v1/l/y/ly7.jpg,The Lyft IPO: What You Need To Know,"In the race to the U.S. markets, Lyft is about to lap Uber and other ride-hailing rivals.",Benzinga,"Wed, 27 Mar 2019 09:40:17 -0400",,Neutral,Article
https://www.cnbc.com/2019/03/27/us-pushes-chinese-owner-of-grindr-to-divest-the-dating-app-sources.html,https://cdn.snapi.dev/images/v1/1/0/105094618-gettyimages-625496254530x298.jpg,US reportedly pushes Chinese owner of Grindr to divest the dating app,Chinese gaming company Beijing Kunlun Tech is seeking to sell Grindr after a U.S. government panel raised concerns about its ownership.,CNBC,"Wed, 27 Mar 2019 09:32:00 -0400",,Neutral,Article
https://www.youtube.com/watch?v=t5XHkawhRAk,https://cdn.snapi.dev/images/v1/m/q/watch-triton-research-ceo-explain-his-scoring-system-for-tech-ipo-valuations.jpg,Watch Triton Research CEO explain his scoring system for tech IPO valuations,"Rett Wallace, CEO and co-founder of Triton Research, joins ""Squawk Box"" to give his expertise on how investors should evaluate the highly anticipated tech IPOs.",CNBC Television,"Wed, 27 Mar 2019 08:40:42 -0400",CEO,Neutral,Video
https://www.youtube.com/watch?v=-dItRhZvC70,https://cdn.snapi.dev/images/v1/m/q/heres-how-economic-confidence-affects-the-markets.jpg,Here's how economic confidence affects the markets,"According to CNBC's All-America Economic Survey, half of all Americans believe the economy is in excellent or good shape.",CNBC Television,"Wed, 27 Mar 2019 07:14:56 -0400",,Positive,Video
https://www.youtube.com/watch?v=4LXFt1ASrVc,https://cdn.snapi.dev/images/v1/m/q/uber-and-careem-deal-is-hugely-exciting-for-the-region-expert-says-capital-connection.jpg,"Uber and Careem deal is 'hugely exciting' for the region, expert says | Capital Connection","Tom Hudson, managing director at Kestrel Global, discusses the significance of a deal between Uber and Careem in the Middle East.",CNBC International TV,"Wed, 27 Mar 2019 07:00:01 -0400",manda,Neutral,Video
https://www.youtube.com/watch?v=dglL5R9vSl8,https://cdn.snapi.dev/images/v1/m/q/should-investors-avoid-lyft-ipo.jpg,Should investors avoid Lyft IPO?,"Flynn Zito Capital Management's Doug Flynn on the Lyft IPO, the outlook for Apple and UPS' use of drones.",Fox Business,"Wed, 27 Mar 2019 06:42:54 -0400",,Negative,Video
https://www.cnbc.com/2019/03/27/eu-demands-scrutiny-of-5g-risks-but-no-bloc-wide-huawei-ban.html,https://cdn.snapi.dev/images/v1/1/0/105707766-1548817096008gettyimages-645921982530x298.jpeg,EU shuns US calls to ban Huawei from its future 5G networks,"The European Union move comes despite U.S. pressure to boycott Huawei, citing fears of China using its equipment for espionage.",CNBC,"Wed, 27 Mar 2019 03:19:00 -0400",,Negative,Article
