news_url,image_url,title,text,source_name,date,topics,sentiment,type
https://www.reuters.com/article/us-global-oil/oil-falls-on-caution-ahead-of-econ-data-offsets-trade-deal-optimism-idUSKBN1XE02X,https://cdn.snapi.dev/images/v1/m/0/m02d20191104t2i1448137841rlynxmpefa301ww640.jpg,"Oil falls on caution ahead of econ data, offsets trade deal optimism","Oil prices eased on Monday as traders took profit ahead of fresh European and U.S. economic data, despite hopes for some resolution to the U.S.",Reuters,"Sun, 03 Nov 2019 23:29:03 -0500",oil,Negative,Article
https://www.forbes.com/sites/johntobey/2019/11/03/last-week-confirms-it-goodbye-recessionhello-bull-market/,https://cdn.snapi.dev/images/v1/a/6/0x600.jpg,"Last Week Confirms It. Goodbye, Recession - Hello, Bull Market",It's time to get optimistic,Forbes,"Sun, 03 Nov 2019 21:23:09 -0500",,Positive,Article
https://investorplace.com/2019/11/the-basket-approach-for-huge-returns/,https://cdn.snapi.dev/images/v1/s/d/sdfr3222-1.jpg,The ‘Basket Approach’ for Huge Returns,How the ‘Buy a Basket’ Approach Works With Early Stage Stocks.,InvestorPlace,"Sun, 03 Nov 2019 21:15:00 -0500",,Positive,Article
https://www.cnbc.com/2019/11/03/a-market-melt-up-is-becoming-a-real-risk-ed-yardeni-warns.html,https://cdn.snapi.dev/images/v1/s/m/105026115-img-4610s.jpg,Wall Street bull Ed Yardeni worries a 'market melt-up' is unfolding,"Yardeni Research's Edward Yardeni is concerned stocks are running too far, too fast.",CNBC,"Sun, 03 Nov 2019 17:00:00 -0500",,Negative,Article
https://seekingalpha.com/article/4301968-u-s-ipo-weekly-recap-deals-price-3-ipo-week,https://cdn.snapi.dev/images/v1/t/z/nas82-1.jpg,U.S. IPO Weekly Recap: More Deals Price Down In A 3-IPO Week,"Two biotechs and a Chinese real estate company entered the public market, accompanied by two SPACs.",Seeking Alpha,"Sun, 03 Nov 2019 13:54:39 -0500",,Neutral,Article
https://www.youtube.com/watch?v=Uy3eiW-QoIc,https://cdn.snapi.dev/images/v1/8/k/big-tech-and-health-care-the-next-frontier.jpg,Big Tech and health care: The next frontier,"Yahoo Finance's Rick Newman sat down with Steven Van Kuiken, McKinsey Senior Partner to discuss the role of technology to improve patient care.",Yahoo Finance,"Sun, 03 Nov 2019 13:15:02 -0500",,Neutral,Video
https://www.benzinga.com/fintech/19/11/14701722/ipo-outlook-for-the-week-biotech-fintech-waste-management-and-the-chinese-techcrunch,https://cdn.snapi.dev/images/v1/p/5/stock-market-4440015-1280.jpg,"IPO Outlook For The Week: Biotech, Fintech, Waste Management And The Chinese TechCrunch","For a more comprehensive IPO calendar, check out the offering in Benzinga Cloud. The IPO dates below are expected but not confirmed.",Benzinga,"Sun, 03 Nov 2019 10:46:46 -0500",,Neutral,Article
https://www.forbes.com/sites/simonmoore/2019/11/03/why-winter-may-offer-improved-stock-performance/,https://cdn.snapi.dev/images/v1/a/i/0x600.jpg,Why Winter May Offer Improved Stock Performance,Surprising data on stock market seasonality may make the coming months a good time to invest.,Forbes,"Sun, 03 Nov 2019 10:21:00 -0500",,Positive,Article
https://www.forbes.com/sites/garthfriesen/2019/11/03/dazed-and-confused-why-do-so-many-investors-hate-the-stock-market/,https://cdn.snapi.dev/images/v1/c/e/stock-exchange-738671-1280-25.jpg,Dazed And Confused. Why Do So Many Investors Hate The Stock Market?,"Markets have an uncanny knack for moving in the direction that hurts the most people. At the moment, that direction is higher.",Forbes,"Sun, 03 Nov 2019 10:09:45 -0500",,Negative,Article
https://www.reuters.com/article/us-usa-trade-autos/u-s-may-not-need-to-impose-tariffs-on-autos-this-month-bloomberg-citing-ross-idUSKBN1XD0C3,https://cdn.snapi.dev/images/v1/9/y/m02d20191103t2i1447988619rlynxmpefa209pw640.jpg,"U.S. may not need to impose tariffs on autos this month: Bloomberg, citing Ross","U.S. Commerce Secretary Wilbur Ross said the United States may not need to impose tariffs on imported vehicles later this month after holding ""good conversations"" with automakers in the European Union, Japan and Korea, in an interview with Bloomberg published on Sunday.",Reuters,"Sun, 03 Nov 2019 09:57:30 -0500",,Positive,Article
https://www.reuters.com/article/us-usa-stocks-quality-analysis/wall-streets-leading-stocks-reveal-investor-caution-idUSKBN1XD0AT,https://cdn.snapi.dev/images/v1/7/h/m02d20191103t2i1447975992rlynxmpefa208nw640.jpg,Wall Street's leading stocks reveal investor caution,"Wall Street stocks have climbed to record highs as worries over U.S.-China trade relations and the Federal Reserve’s monetary policy have receded, but cautious investors have been sticking with technology shares and some defensive stocks over value stocks and more speculative plays such as IPOs.",Reuters,"Sun, 03 Nov 2019 09:04:37 -0500",,Negative,Article
https://www.forbes.com/sites/investor/2019/11/03/sp-500-and-nasdaq-composite-power-to-new-highs-as-risky-levels-loom/,https://cdn.snapi.dev/images/v1/v/d/marveling-at-the-equity-markets-remarkable-bull-run.jpg,S&P 500 And Nasdaq Composite Power To New Highs As Risky Levels Loom,As the major averages rise to major risky levels it’s time to reduce allocations to stocks to the minimum percentages in your investment guidelines.,Forbes,"Sun, 03 Nov 2019 08:12:26 -0500",,Positive,Article
https://www.cnn.com/2019/11/03/investing/stocks-week-ahead/index.html,https://cdn.snapi.dev/images/v1/x/a/191101122611-01-nyse-1030-super-169.jpg,Why corporate earnings season is going better than expected,Happy Sunday. A version of this story first appeared in CNN Business' Before the Bell newsletter. Not a subscriber? You can sign up right here.,CNN Business,"Sun, 03 Nov 2019 07:51:34 -0500",earnings,Positive,Article
https://www.forbes.com/sites/panosmourdoukoutas/2019/11/03/us-china-trade-war-will-never-end/,https://cdn.snapi.dev/images/v1/m/w/0x600.jpg,US-China Trade War Will Never End,America and China will never reach a real deal that changes the structure and the culture of the Chinese society—and therefore end the trade war.,Forbes,"Sun, 03 Nov 2019 07:08:04 -0500",,Negative,Article
https://www.theguardian.com/business/2019/nov/03/saudi-oil-giant-aramco-gets-go-ahead-for-17-trillion-stock-listing,https://cdn.snapi.dev/images/v1/g/l/3500jpgwidth460quality85autoformatfitmaxsbda7f5b26780fdbec05af04f41241df2.jpg,Saudi oil giant Aramco gets go-ahead for $1.5tn stock listing,World’s biggest ever IPO poised to take place next month after regulators give approval,The Guardian,"Sun, 03 Nov 2019 06:34:35 -0500",oil,Positive,Article
https://www.cnbc.com/2019/11/03/saudi-arabia-kick-starts-ipo-of-worlds-largest-oil-company.html,https://cdn.snapi.dev/images/v1/u/v/106074062-1565612575513preview.jpg,Saudi Arabia kick-starts IPO of the world's largest oil company,Saudi Arabia launched Aramco's IPO as its market regulator approved the oil giant's application to create the world's most valuable listed firm.,CNBC,"Sun, 03 Nov 2019 01:51:00 -0500",oil,Neutral,Article
https://www.reuters.com/article/us-saudi-aramco-ipo/saudi-arabia-kick-starts-ipo-of-worlds-largest-oil-company-idUSKBN1XD02V,https://cdn.snapi.dev/images/v1/o/w/m02d20191103t2i1447877891rlynxmpefa2025w640.jpg,Saudi Arabia kick-starts IPO of world's largest oil company,Saudi Arabia kick-started Aramco's initial public offering (IPO) on Sunday as its market regulator approved the oil giant's application to list on the domestic bourse and create the world's most valuable listed firm.,Reuters,"Sun, 03 Nov 2019 01:41:11 -0500",oil,Neutral,Article
