news_url,image_url,title,text,source_name,date,topics,sentiment,type
https://www.cnn.com/2019/12/05/business/asian-market-latest/index.html,https://cdn.snapi.dev/images/v1/k/4/191205221448-sci-file-restricted-super-169.jpg,Asian stocks tick up following Trump's upbeat signals on a trade deal,"Asian markets were cautiously optimistic on Thursday, as President Donald Trump's latest remarks on US-China trade talks sent a flicker of hope through the region.",CNN Business,"Thu, 05 Dec 2019 23:09:00 -0500",,Positive,Article
https://www.youtube.com/watch?v=EBhfTQXXKDk,https://cdn.snapi.dev/images/v1/m/q/opec-deal-aramco-ipo-headline-the-global-oil-market.jpg,"OPEC Deal, Aramco IPO Headline the Global Oil Market","Saudi Aramco raised $25.6 billion from the world’s biggest initial public offering, and OPEC failed to nail down the details of an agreement to adjust it’s official production target, as six hours of talks found no resolution amid objections. Bob Yawger, energy futures strategist at Mizuho, and Thibault Laconde, CEO and founder at Callendar, talks with Bloomberg's Alix Steel on ""Bloomberg Commodities Edge"". Callendar is a company that provides local data on the evolution",Bloomberg Markets and Finance,"Thu, 05 Dec 2019 22:49:12 -0500",oil,Neutral,Video
https://www.youtube.com/watch?v=4s7ZmV6b3Gw,https://cdn.snapi.dev/images/v1/m/q/supply-crunch-hits-the-global-cooper-market.jpg,Supply Crunch Hits the Global Cooper Market,"In Chile, worker strikes, extreme weather events and civil unrest have weighed on copper miners. The protests shut among other things mines, roads and ports, and all took place amid signs of slowing economic growth in China and the U.S., the two biggest copper users.",Bloomberg Markets and Finance,"Thu, 05 Dec 2019 22:33:28 -0500",,Negative,Video
https://www.reuters.com/article/us-global-markets/asian-shares-firm-oil-near-two-month-high-after-deeper-output-cut-idUSKBN1YA025,https://cdn.snapi.dev/images/v1/m/0/m02d20191206t2i1460707728rlynxmpefb501ew640.jpg,"Asian shares firm, oil near two-month high after deeper output cut","Asian stocks held firm on Friday as U.S. President Donald Trump's rhetoric kept investors' hopes up on a trade deal with China, while oil sat near two-month highs after producers led by Saudi Arabia and Russia agreed on further output cuts.",Reuters,"Thu, 05 Dec 2019 19:41:48 -0500",oil,Positive,Article
https://www.youtube.com/watch?v=lDMwD2kii5k,https://cdn.snapi.dev/images/v1/m/q/jim-cramer-blames-bears-media-for-the-publics-lack-of-interest-in-stocks.jpg,"Jim Cramer blames bears, media for the public's lack of interest in stocks","""There are vast sums of money to be made here and far too many people are missing out because they've been frightened away from the whole asset class,"" the ""Mad Money"" host says.",CNBC Television,"Thu, 05 Dec 2019 19:01:13 -0500","cramer,madmoney",Negative,Video
https://www.youtube.com/watch?v=9KVeZSu_7As,https://cdn.snapi.dev/images/v1/m/q/top-trade-recommendations-for-2020-from-bofa-merrills-david-woo.jpg,Top Trade Recommendations for 2020 From BofA Merrill's David Woo,"David Woo, Bank of America Merrill Lynch head of global rates and currencies research, discusses his top trade recommendations for 2020 with Bloomberg's Joe Weisenthal, Scarlet Fu and Romaine Bostick on ""Bloomberg Markets: What'd You Miss?""",Bloomberg Markets and Finance,"Thu, 05 Dec 2019 18:35:23 -0500",,Positive,Video
https://www.youtube.com/watch?v=tcdx5PbFEQ0,https://cdn.snapi.dev/images/v1/m/q/credit-suisses-jonathan-golub-new-year-new-rally.jpg,"Credit Suisse's Jonathan Golub: New Year, New Rally","Credit Suisse's Jonathan Golub says there's more uncertainty ahead for the markets. With CNBC's Scott Wapner and the Fast Money traders, Tim Seymour, Dan Nathan, Karen Finerman and Guy Adami.",CNBC Television,"Thu, 05 Dec 2019 18:05:41 -0500",,Positive,Video
https://www.cnbc.com/2019/12/05/global-economy-will-recover-in-the-second-half-of-2020-says-ubs.html,https://cdn.snapi.dev/images/v1/1/0/106085061-1566155348985gettyimages-1143921395.jpeg,"Global economy will recover in the second half of 2020, says UBS Global Wealth Management",Global growth will recover in the second half of 2020 as the trade war between Washington and Beijing eases and central banks' monetary policies come into effect says UBS Global Wealth Management.,CNBC,"Thu, 05 Dec 2019 18:00:00 -0500",,Positive,Article
https://www.youtube.com/watch?v=qr8DqBfCFP4,https://cdn.snapi.dev/images/v1/m/q/opec-meeting-concludes.jpg,OPEC meeting concludes,"CNBC's Brian Sullivan reports on the conclusion of the OPEC meeting in Vienna. With CNBC's Scott Wapner and the Fast Money traders, Tim Seymour, Dan Nathan, Karen Finerman and Guy Adami.",CNBC Television,"Thu, 05 Dec 2019 17:41:12 -0500",oil,Neutral,Video
https://seekingalpha.com/article/4310935-trend-following-plan-for-next-bear-market-market-breadth,https://cdn.snapi.dev/images/v1/e/t/etf21.jpg,Trend Following: Plan For The Next Bear Market With Market Breadth,Trend following provides a game plan for when the next bear market inevitably comes.,Seeking Alpha,"Thu, 05 Dec 2019 17:40:00 -0500",,Negative,Article
https://www.youtube.com/watch?v=ioCiZXpvbTQ,https://cdn.snapi.dev/images/v1/m/q/peter-spiegel-discusses-market-rallys-impact-on-americans-finances.jpg,Peter Spiegel discusses market rally's impact on Americans' finances,"Peter Spiegel, U.S. managing editor at Financial Times, joins CNBC's ""Closing Bell"" to discuss market rally impact on Americans and their finances.",CNBC Television,"Thu, 05 Dec 2019 17:08:28 -0500",,Neutral,Video
https://www.fastcompany.com/90439964/apple-is-about-to-get-toppled-by-oil-giant-saudi-aramco-as-the-most-valuable-listed-company,https://cdn.snapi.dev/images/v1/p/-/p-2-apple-saudi-aramco.jpg,Apple is about to get toppled by oil giant Saudi Aramco as the most valuable listed company,"A staggering $1.7 trillion valuation still fell short of Saudi Crown Prince Mohammed bin Salman’s goal.
In what is expected to be the largest initial public offering in history, a state-owned oil and gas behemoth in Saudi Arabia is about to become the most valuable publicly traded company in the world.",Fast Company,"Thu, 05 Dec 2019 17:07:26 -0500",oil,Positive,Article
https://investorplace.com/2019/12/dow-jones-today-trade-influenced-stocks-more-than-impeachment-news/,https://cdn.snapi.dev/images/v1/d/w/dwkj2222-1.jpg,Dow Jones Today: Trade Influenced Stocks More Than Impeachment News,"It was a mostly quiet day for domestic equities, but the Dow Jones Industrial Average eked out a gain today thanks to Nike and Apple.",InvestorPlace,"Thu, 05 Dec 2019 16:29:26 -0500",,Positive,Article
https://www.youtube.com/watch?v=yccpKXZGRxA,https://cdn.snapi.dev/images/v1/m/q/major-indexes-two-day-winning-streak-dec-5.jpg,Major indexes' two-day winning streak (Dec 5),"Barry Knapp, director of research at Ironsides Macroeconomics, join CNBC's ""Closing Bell"" to discuss markets after the bell.",CNBC Television,"Thu, 05 Dec 2019 16:27:51 -0500",,Positive,Video
https://investorplace.com/2019/12/stock-market-today-impeachment-shrug-buy-msft-aapl/,https://cdn.snapi.dev/images/v1/a/s/asset-management46.jpg,"Stock Market Today: Impeachment Shrug; Buy MSFT, AAPL? ","It was a quiet day in the stock market today, but the analyst community was making some noise for Nike, Apple, Microsoft and AMD.",InvestorPlace,"Thu, 05 Dec 2019 16:22:20 -0500",,Positive,Article
https://www.reuters.com/article/us-usa-stocks/wall-street-inches-higher-as-dec-15-tariff-deadline-looms-idUSKBN1Y81LJ,https://cdn.snapi.dev/images/v1/p/t/m02d20191205t2i1460554758rlynxmpefb41dww640.jpg,Wall Street inches higher as Dec. 15 tariff deadline looms,Wall Street eked out slight gains on Thursday as investors waited for concrete news on a hoped-for interim trade deal between the United States and China before a new round of tariffs scheduled to kick in on Dec. 15.,Reuters,"Thu, 05 Dec 2019 16:18:58 -0500",,Positive,Article
https://www.youtube.com/watch?v=aRl0bh0ygMg,https://cdn.snapi.dev/images/v1/n/1/nasdaq-president-adena-friedman-discusses-investing-the-economy-and-ipos.jpg,"Nasdaq President Adena Friedman discusses investing, the economy, and IPOs",Some people rise to the top and then plateau.,Yahoo Finance,"Thu, 05 Dec 2019 16:11:49 -0500",,Neutral,Video
https://www.youtube.com/watch?v=x6CgXhin6EA,https://cdn.snapi.dev/images/v1/m/q/anu-aiyengar-ma-deals-a-good-sign-of-what-to-expect-in-2020.jpg,Anu Aiyengar: M&A deals a good sign of what to expect in 2020,"Anu Aiyengar, head of J.P.",CNBC Television,"Thu, 05 Dec 2019 16:11:37 -0500",manda,Positive,Video
https://www.cnbc.com/2019/12/05/what-happened-to-stock-market-thursday-small-moves-ahead-of-jobs-data.html,https://cdn.snapi.dev/images/v1/3/8/105492447-1538957183293gettyimages-1045675106.jpeg,Here's what happened to the stock market on Thursday (Dec 5),Stocks hovered around the flatline for most of the day as investors weighed strong jobs data and trade uncertainty.,CNBC,"Thu, 05 Dec 2019 16:08:00 -0500",,Positive,Article
https://www.reuters.com/article/us-usa-stocks/wall-st-barely-gains-as-investors-wait-for-trade-progress-idUSKBN1Y81LJ,https://cdn.snapi.dev/images/v1/5/s/m02d20191125t2i1456380636rlynxmpefao04ew640.jpg,Wall St. barely gains as investors wait for trade progress,Wall Street eked out gains on Thursday as investors awaited concrete news on a hoped-for interim trade deal between the United States and China before a new round of tariffs are scheduled to kick in on Dec. 15.,Reuters,"Thu, 05 Dec 2019 16:07:12 -0500",,Positive,Article
https://www.marketwatch.com/story/stocks-close-slightly-higher-as-investors-shake-off-trade-concerns-amid-improving-data-2019-12-05,https://cdn.snapi.dev/images/v1/e/t/etf35.jpg,Stocks close slightly higher as investors shake off trade concerns amid improving data,"U.S. stocks closed higher for a second consecutive session Thursday as U.S. and Chinese officials continued to express optimism that a limited trade deal can be reached that would ratchet back tensions, though news reports suggest that sticking points remain ahead of a Dec. 15 deadline, when the U.S. plans to implement further tariffs.",Market Watch,"Thu, 05 Dec 2019 16:03:14 -0500",,Positive,Article
https://www.youtube.com/watch?v=da7-Xyd8hE4,https://cdn.snapi.dev/images/v1/m/q/the-biggest-deals-and-attempted-deals-in-merger-and-acquisition-activity-in-the-last-10-years.jpg,The biggest deals and attempted deals in merger and acquisition activity in the last 10 years,This was a year of mega deals. Think Raytheon Company and United Technologies’ $135 billion merger; AbbVie’s takeover of Allergan; and Bristol-Myers Squibb’s $74 billion acquisition of Celgene.,Yahoo Finance,"Thu, 05 Dec 2019 15:59:42 -0500",manda,Positive,Video
https://www.youtube.com/watch?v=e2p_3lhQYNg,https://cdn.snapi.dev/images/v1/c/s/repo-madness-hits-wall-street.jpg,Repo madness hits Wall Street,CNBC's Steve Liesman looks at the Fed's balance sheet and parses the 'repo madness' that's hit Wall Street.,CNBC Television,"Thu, 05 Dec 2019 15:58:41 -0500",,Negative,Video
https://www.reuters.com/article/us-global-markets/global-stocks-falter-on-trade-uncertainty-sterling-gains-idUSKBN1Y903L,https://cdn.snapi.dev/images/v1/m/0/m02d20191205t2i1460642356rlynxmpefb41r4w640.jpg,Global stocks falter on trade uncertainty; sterling gains,"The dollar slid and global equity markets traded little changed on Thursday as enthusiasm over Apple shares was offset by doubts about the likelihood of a ""phase one"" trade deal before a new round of U.S. tariffs on Chinese imports begins in 10 days.",Reuters,"Thu, 05 Dec 2019 15:52:43 -0500",,Negative,Article
https://www.gurufocus.com/news/996507/us-indexes-end-slightly-higher-thursday,https://cdn.snapi.dev/images/v1/s/t/stocks-0.jpeg,US Indexes End Slightly Higher Thursday,"The Dow Jones Industrial Average closed at 27,677.79 on Thursday with a gain of 28.01 points or 0.10%.",GuruFocus,"Thu, 05 Dec 2019 15:46:52 -0500",,Positive,Article
https://www.cnbc.com/2019/12/05/market-outlook-for-friday-jobs-report-consumer-sentiment-kudlow.html,https://cdn.snapi.dev/images/v1/1/0/106247904-1573828727366gettyimages-1174230745.jpeg,"Jobs report, consumer sentiment, Kudlow speaks: 3 things to watch for Friday","Investors will digest a big jobs report, consumer sentiment data and an interview with Larry Kudlow on Friday.",CNBC,"Thu, 05 Dec 2019 15:44:00 -0500",,Neutral,Article
https://www.cnbc.com/2019/12/05/us-and-china-at-odds-over-size-of-agriculture-purchases-report-says.html,https://cdn.snapi.dev/images/v1/1/0/106269186-1574907949640gettyimages-871925646.jpeg,"US and China disagree on the size of agriculture purchases, report says","The Trump administration is demanding that China publicly announce its purchasing plans, the Wall Street Journal reported.",CNBC,"Thu, 05 Dec 2019 15:19:00 -0500",,Negative,Article
https://www.youtube.com/watch?v=klgnTYYJ1r0,https://cdn.snapi.dev/images/v1/v/u/wall-street-in-crosshairs-after-new-proposals-come-out-of-dc.jpg,Wall Street in crosshairs after new proposals come out of D.C.,Pimco's Libby Cantrill and Loews' Jonathan Tisch discuss a new set of proposals out of Washington that could put Wall Street in the spotlight.,CNBC Television,"Thu, 05 Dec 2019 15:06:51 -0500",,Neutral,Video
https://www.youtube.com/watch?v=ZwJ3lx0KyKs,https://cdn.snapi.dev/images/v1/m/q/investors-brace-for-important-jobs-report-as-uncertainty-weighs-on-economy.jpg,Investors brace for important jobs report as uncertainty weighs on economy,"CNBC's Steve Liesman looks ahead to tomorrow's jobs report, the last one to come out this year and this decade. With Jonathan Tisch, chairman and CEO of Loews Hotels.",CNBC Television,"Thu, 05 Dec 2019 14:59:35 -0500",,Negative,Video
https://www.seeitmarket.com/sp-500-index-near-term-tilts-bearish-for-stocks/,https://cdn.snapi.dev/images/v1/1/4/stock-market-4440015-1280.jpg,S&P 500 Index: Near-Term Tilts Bearish For Stocks,"S&P 500 Index “Hourly” Trading Chart Analysis – December 5, 2019 S&P 500 Index Trading Outlook (3-5 Days): Bearish  I am staying negative on the broader stock market (S&P 500 Index) until 3132 is exceeded. As long as that does not occur, I am expecting a pullback to 3027 and below that to 2985-90 before […]
The post S&P 500 Index: Near-Term Tilts Bearish For Stocks appeared first on See It Market.",See It Market,"Thu, 05 Dec 2019 14:54:14 -0500",,Negative,Article
https://investorplace.com/2019/12/trade-deal-negativity-investors-priced-in-optimism/,https://cdn.snapi.dev/images/v1/3/j/214.jpg,Trade Deal Negativity Could Pop Investors’ Priced-In Optimism,"Keep an eye on China's stock indexes and high-yield bond funds as the market awaits more trade deal updates from President Donald Trump.
The post Trade Deal Negativity Could Pop Investors’ Priced-In Optimism appeared first on InvestorPlace.",InvestorPlace,"Thu, 05 Dec 2019 14:53:33 -0500",,Positive,Article
https://www.reuters.com/article/us-usa-stocks/wall-street-bides-its-time-awaiting-news-from-trade-front-idUSKBN1Y81LJ,https://cdn.snapi.dev/images/v1/p/4/m02d20191205t2i1460554758rlynxmpefb41dww640.jpg,"Wall Street bides its time, awaiting news from trade front","Wall Street was largely uncharged on Thursday as market participants largely stayed on the sidelines, awaiting further developments in the hoped-for interim trade deal between the United States and China.",Reuters,"Thu, 05 Dec 2019 14:37:50 -0500",,Neutral,Article
https://www.youtube.com/watch?v=RrEJacAu0W4,https://cdn.snapi.dev/images/v1/m/q/schwarzman-says-geopolitical-risks-are-biggest-economic-challenge.jpg,Schwarzman Says Geopolitical Risks Are Biggest Economic Challenge,Blackstone Group Inc. Chairman Steve Schwarzman says geopolitical risks are the biggest challenge facing global economies. He speaks during an interview with BNN's Amanda Lang.,Bloomberg Markets and Finance,"Thu, 05 Dec 2019 14:26:16 -0500",,Negative,Video
https://www.youtube.com/watch?v=YcVblmp5_Q0,https://cdn.snapi.dev/images/v1/m/q/small-caps-is-the-safer-place-to-put-your-money-kari-firestone.jpg,Small caps is the safer place to put your money: Kari Firestone,"Kari Firestone, Aureus Asset Management CEO, joins 'Fast Money Halftime Report' to make the case for small cap stocks.",CNBC Television,"Thu, 05 Dec 2019 14:02:19 -0500",,Positive,Video
https://www.seeitmarket.com/sp-500-index-weighing-risks-of-another-december-stock-market-plunge/,https://cdn.snapi.dev/images/v1/w/v/interest-ratesjpgquality90stripall.jpg,S&P 500 Index: Weighing Risks of Another December Stock Market Plunge,"WILL IT HAPPEN AGAIN? Human beings tend to remember emotional events, especially painful events.",See It Market,"Thu, 05 Dec 2019 13:35:56 -0500",,Negative,Article
https://www.reuters.com/article/us-usa-stocks/wall-street-dips-as-investors-stay-off-big-bets-eye-developments-on-trade-idUSKBN1Y81LJ,https://cdn.snapi.dev/images/v1/x/m/stock-exchange-738671-1280-1-24.jpg,"Wall Street dips as investors stay off big bets, eye developments on trade","U.S. stocks dipped on Thursday as declines in defensive sectors such as consumer staples overshadowed gains in technology stocks, while a lack of new developments in trade talks between Washington and Beijing kept investors on the sidelines.",Reuters,"Thu, 05 Dec 2019 13:29:18 -0500",,Negative,Article
https://www.reuters.com/article/us-usa-trade-china-mnuchin/u-s-china-trade-talks-are-on-track-mnuchin-idUSKBN1Y92E8,https://cdn.snapi.dev/images/v1/z/w/m02d20191205t2i1460600357rlynxmpefb41mjw640.jpg,U.S.-China trade talks are 'on track': Mnuchin,"U.S. Treasury Secretary Steven Mnuchin said on Thursday that trade talks with China are on track, with deputy negotiators from both countries holding a call Thursday as they actively worked toward a deal, but he said the United States is not bound to a deadline.",Reuters,"Thu, 05 Dec 2019 13:28:25 -0500",,Positive,Article
https://www.reuters.com/article/us-usa-economy/u-s-trade-deficit-shrinks-sharply-labor-market-tight-idUSKBN1Y91QV,https://cdn.snapi.dev/images/v1/m/0/m02d20191205t2i1460547590rlynxmpefb41bxw640.jpg,U.S. trade deficit shrinks sharply; labor market tight,"The U.S. trade deficit dropped to its lowest level in nearly 1-1/2 years in October, suggesting trade could contribute to economic growth in the fourth quarter, though a broad decline in imports hinted at a slowdown in domestic demand.",Reuters,"Thu, 05 Dec 2019 13:23:13 -0500",,Negative,Article
https://www.youtube.com/watch?v=5wfH0vE1ZMA,https://cdn.snapi.dev/images/v1/m/q/why-is-the-russell-2000-doing-well-and-where-are-the-opportunities.jpg,Why is the Russell 2000 doing well and where are the opportunities?,"Villere Balanced Fund Portfolio Manager discusses small caps, the Russell 2000 and what he looks for when investing.",Yahoo Finance,"Thu, 05 Dec 2019 13:17:47 -0500",,Positive,Video
https://www.youtube.com/watch?v=nlJjrRunBX8,https://cdn.snapi.dev/images/v1/m/q/trade-remains-a-problem-that-doesnt-want-to-go-away-for-tech-says-wolfes-steve-milunovich.jpg,"Trade remains a problem that doesn't want to go away for tech, says Wolfe's Steve Milunovich","Steve Milunovich, Wolfe Research tech strategist, and Tom Forte, DA Davidson senior research analyst, join ""Squawk Alley"" to discuss tech stocks",CNBC Television,"Thu, 05 Dec 2019 12:48:11 -0500",,Negative,Video
https://www.marketwatch.com/story/mnuchin-says-us-economic-growth-will-pick-up-in-coming-quarters-2019-12-05,https://cdn.snapi.dev/images/v1/1/0/105977864-1560979300588gettyimages-1150825123r.jpg,Mnuchin says U.S. economic growth will pick up in coming quarters,"Treasury Secretary Stephen Mnuchin on Thursday said he expected a significant pickup in the economy in coming quarters. ""There is no question Americans are seeing the benefits of tax cuts,"" with the U.S.",Market Watch,"Thu, 05 Dec 2019 12:39:04 -0500",,Positive,Article
https://www.youtube.com/watch?v=XemlCA7G2PA,https://cdn.snapi.dev/images/v1/m/q/bofamls-blanch-brent-could-hit-70-in-2020-if-demand-recovers.jpg,BofAML’s Blanch: Brent Could Hit $70 in 2020 If Demand Recovers,"Dec.05 -- Francisco Blanch, head of global commodities at Bank of America Merrill Lynch, discusses his outlook for oil prices and demand in the year ahead.",Bloomberg Markets and Finance,"Thu, 05 Dec 2019 12:31:26 -0500",,Positive,Video
https://www.youtube.com/watch?v=30QOBSipok0,https://cdn.snapi.dev/images/v1/l/b/manufacturing-recession-makes-allianzgis-dwane-cautious-for-2020.jpg,Manufacturing Recession Makes AllianzGI’s Dwane Cautious for 2020,"Dec.05 -- Neil Dwane, global strategist at Allianz Global Investors, and Alessio de Longis, senior portfolio manager at Invesco Investment Solutions, examine the state of the U.S.",Bloomberg Markets and Finance,"Thu, 05 Dec 2019 12:31:21 -0500",,Negative,Video
https://www.reuters.com/article/us-usa-stocks/wall-street-dips-as-investors-stay-off-big-bets-eye-trade-talks-idUSKBN1Y81LJ,https://cdn.snapi.dev/images/v1/v/r/105638005-1545256725122gettyimages-1084667734.jpg,"Wall Street dips as investors stay off big bets, eye trade talks","U.S. stocks dipped on Thursday as declines in defensive sectors such as consumer staples overshadowed gains in technology stocks, while the absence of new updates in U.S.-China trade talks kept investors on the sidelines.",Reuters,"Thu, 05 Dec 2019 12:10:57 -0500",,Negative,Article
https://www.iris.xyz/financial-podcasts/better-manage-your-futures-trading,https://cdn.snapi.dev/images/v1/b/e/better-manage-your-futures-trading-934x600.jpeg,How to Better Manage Your Futures Trading,"In this episode, Nell Sloane speaks with Joel Groen, CIO of 3i Capital Advisors. Considering that he has over 20 years of experience in the finance industry, stellar credentials, and deep knowledge of many aspects of trading, Joel is an ideal guest for our podcast.",Iris,"Thu, 05 Dec 2019 12:00:22 -0500",,Neutral,Article
https://www.seeitmarket.com/stock-market-today-broad-breadth-indicators-remain-bullish/,https://cdn.snapi.dev/images/v1/f/f/m02d20191127t2i1457385542rlynxmpefaq199w640.jpg,Stock Market Today: Broad Breadth Indicators Remain Bullish,The U.S. stock market bounced back on Wednesday and appears set for a firm opening on Thursday (today). Traders continue buy and sell the latest “trade” news and this is keeping the market off balance the past week.,See It Market,"Thu, 05 Dec 2019 11:51:34 -0500",,Positive,Article
https://www.youtube.com/watch?v=YtU17cqRjkE,https://cdn.snapi.dev/images/v1/x/z/threat-of-tariffs-debilitating-says-atalanta-president-tom-gellert.jpg,"Threat of tariffs 'debilitating,' says Atalanta president Tom Gellert","Thomas Gellert, Atalanta Corporation president, discusses how tariffs are impacting the import business with CNBC's ""Squawk on the Street.",CNBC Television,"Thu, 05 Dec 2019 11:38:54 -0500",,Negative,Video
https://www.youtube.com/watch?v=9_UOBYQrTwc,https://cdn.snapi.dev/images/v1/m/q/repo-market-turmoil-prompts-a-full-scale-review.jpg,Repo Market Turmoil Prompts a Full-Scale Review,Dec.05 -- The repo turmoil traders faced in September has prompted a full-scale review by regulators who identified potential risks to the U.S.,Bloomberg Markets and Finance,"Thu, 05 Dec 2019 11:34:13 -0500",,Neutral,Video
https://www.youtube.com/watch?v=Njo_T9NvytQ,https://cdn.snapi.dev/images/v1/m/q/goldman-commodity-research-head-jeff-currie-on-weighing-opecs-options.jpg,Goldman commodity research head Jeff Currie on weighing OPEC's options,"Jeff Currie, Goldman Sachs global head of commodity research, joins ""Squawk on the Street"" to discuss OPEC's strategy as leaders meet in Vienna.",CNBC Television,"Thu, 05 Dec 2019 11:26:56 -0500",oil,Neutral,Video
https://www.benzinga.com/news/19/12/14938552/us-solar-cell-tariffs-darken-62-000-american-jobs,https://cdn.snapi.dev/images/v1/r/e/solar-energy-2157212-1920-2.jpg,"US Solar Cell Tariffs Darken 62,000 American Jobs","Since the imposition of U.S. tariffs on crystalline silicon photovoltaic solar cell imports in 2018, 62,000 Americans have either lost their jobs or were never hired, according to a study released by the Solar Energy Industries Association (SEIA).",Benzinga,"Thu, 05 Dec 2019 11:21:06 -0500",,Negative,Article
