news_url,image_url,title,text,source_name,date,topics,sentiment,type
https://www.youtube.com/watch?v=Aaba3sdrgqQ,https://cdn.snapi.dev/images/v1/a/i/china-hawk-navarro-says-trumps-trade-deal-in-the-bag.jpg,China Hawk Navarro Says Trump's Trade Deal 'In the Bag',"The White House’s leading China hawk, trade adviser Peter Navarro, said Monday that a preliminary trade deal with Beijing is completed.",Bloomberg Markets and Finance,"Mon, 30 Dec 2019 23:55:12 -0500",,Positive,Video
https://www.forbes.com/sites/johntobey/2020/12/30/santa-delivers-12-days-of-stock-market-new-highs-then-flies-away-on-day-13--now-what/,https://cdn.snapi.dev/images/v1/p/r/santa-delivers-12-days-of-stock-market-new-highs-then-flies-away-on-day-13-now-what.jpg,"Santa Delivers 12 Days Of Stock Market New Highs, Then Flies Away On Day 13 – Now, What?",All those stock market new highs were not as important as presented,Forbes,"Mon, 30 Dec 2019 22:46:58 -0500",,Neutral,Article
https://nypost.com/2019/12/30/2020-all-about-federal-reserve-interest-rates-says-my-crystal-ball/,https://cdn.snapi.dev/images/v1/l/l/federal-reserve-2jpgquality90stripall.jpg,"2020 all about Federal Reserve interest rates, my crystal ball says","It's the most important question for everyone — home buyers, credit card users, savers, banks and stock market investors: What will the Fed do to interest rates in 2020?",New York Post,"Mon, 30 Dec 2019 22:23:58 -0500",,Neutral,Article
https://www.reuters.com/article/us-global-markets/asian-shares-lower-as-investors-book-decade-end-profits-idUSKBN1YZ035,https://cdn.snapi.dev/images/v1/m/0/m02d20191231t2i1470321244rlynxmpefbu01ww640.jpg,Asian shares lower as investors book decade-end profits,"Asian shares slipped on the last trading day of the decade, echoing falls on Wall Street, as investors locked in gains made since the United States and China reached a preliminary trade deal earlier this month.",Reuters,"Mon, 30 Dec 2019 21:10:32 -0500",,Negative,Article
https://www.reuters.com/article/us-global-oil/oil-prices-edge-down-but-set-for-biggest-yearly-rise-since-2016-idUSKBN1YZ02T,https://cdn.snapi.dev/images/v1/m/0/m02d20191231t2i1470320002rlynxmpefbu01mw640.jpg,Oil prices edge down but set for biggest yearly rise since 2016,"Oil prices edged lower on the final day of the year on Tuesday, but were on track for their biggest annual rise since 2016, supported by a thaw in U.S.-China trade dispute and ongoing supply cuts.",Reuters,"Mon, 30 Dec 2019 21:04:46 -0500",oil,Negative,Article
https://www.youtube.com/watch?v=L4yHEaDfs4g,https://cdn.snapi.dev/images/v1/p/r/prke2n1455-1.jpg,"Market re-cap December 30, 2019: Market rally loses steam after weeks of record highs","After weeks of record highs, the U.S. global stock market slipped and the year-end rally lost steam. Yahoo Finance's Aikiko Fujita and Jared Blikre discuss.",Yahoo Finance,"Mon, 30 Dec 2019 18:15:53 -0500",,Negative,Video
https://www.youtube.com/watch?v=-vJo2pIshI4,https://cdn.snapi.dev/images/v1/m/q/it-was-a-record-year-so-now-what.jpg,"It was a record year, so now what?","A look back at the year that was, with CNBC's Scott Wapner and the Fast Money traders, Steve Grasso, Steve Chiavarone, Dan Nathan and Guy Adami.",CNBC Television,"Mon, 30 Dec 2019 18:04:25 -0500",,Neutral,Video
https://www.youtube.com/watch?v=mj8xBICrJL4,https://cdn.snapi.dev/images/v1/m/q/there-are-signs-a-day-of-reckoning-could-be-coming-for-stocks.jpg,There are signs a day of reckoning could be coming for stocks,"CNBC's Bob Pisani on what today's market drop means going forward. With CNBC's Scott Wapner and the Fast Money traders, Steve Grasso, Steve Chiavarone, Dan Nathan and Guy Adami.",CNBC Television,"Mon, 30 Dec 2019 17:41:42 -0500",,Negative,Video
https://www.youtube.com/watch?v=JYaCU3ZVcdk,https://cdn.snapi.dev/images/v1/d/l/dlokm1344-1.jpg,Art Laffer: ‘No reason’ to worry about economy in 2020,Former Reagan economic adviser Art Laffer shares his insights on how the Trump administration’s policies have affected the U.S. economy.,Fox Business,"Mon, 30 Dec 2019 17:32:14 -0500",,Positive,Video
https://www.youtube.com/watch?v=jHeNcdJYqn0,https://cdn.snapi.dev/images/v1/m/q/stocks-close-lower-have-worst-day-in-weeks.jpg,"Stocks close lower, have worst day in weeks",FOX Business’ Deirdre Bolton breaks down today’s financial stats as markets close.,Fox Business,"Mon, 30 Dec 2019 17:31:40 -0500",,Negative,Video
https://www.youtube.com/watch?v=EHjlp6EmsqU,https://cdn.snapi.dev/images/v1/m/q/michael-nemeroff-2020-to-lag-2019-in-ma.jpg,Michael Nemeroff: 2020 to lag 2019 in M&A,"Michael Nemeroff, president and CEO of Vedder Price, discusses his outlook on U.S.deals and mergers in 2020 on ""Closing Bell.""",CNBC Television,"Mon, 30 Dec 2019 16:59:40 -0500",manda,Neutral,Video
https://www.youtube.com/watch?v=TbhdwOOxCRA,https://cdn.snapi.dev/images/v1/m/q/elliott-robinson-renewed-interest-in-capital-efficiency.jpg,Elliott Robinson: Renewed interest in capital efficiency,"Elliott Robinson from Bessemer Venture Partners discusses his 2020 outlook on venture capital on ""Closing Bell.",CNBC Television,"Mon, 30 Dec 2019 16:48:27 -0500",,Positive,Video
https://investorplace.com/2019/12/dow-jones-today-a-rough-way-to-end-2019/,https://cdn.snapi.dev/images/v1/0/w/dowjones1600b-768x432.jpg,Dow Jones Today: A Rough Way to End 2019,"After a stellar run, stocks pulled back on Monday with Apple ranking as the only real winner on the Dow Jones Industrial Average.
The post Dow Jones Today: A Rough Way to End 2019 appeared first on InvestorPlace.",InvestorPlace,"Mon, 30 Dec 2019 16:25:53 -0500",,Negative,Article
https://www.youtube.com/watch?v=pFsg7go5xEI,https://cdn.snapi.dev/images/v1/m/q/worst-day-in-4-weeks-for-stocks.jpg,Worst day in 4 weeks for stocks,"Josh Brown, Ritholtz Wealth Management, and David Ellison, portfolio manager at Hennessy Funds, discuss markets after the bell on ""Closing Bell.""",CNBC Television,"Mon, 30 Dec 2019 16:23:42 -0500",,Negative,Video
https://www.reuters.com/article/us-usa-stocks/wall-street-slips-from-records-as-investors-lock-in-year-end-gains-idUSKBN1YY0UE,https://cdn.snapi.dev/images/v1/a/f/m02d20191230t2i1470130002rlynxmpefbt0mqw640.jpg,Wall Street slips from records as investors lock in year-end gains,Wall Street's major stock indexes slipped from record highs on Monday as investors booked profits from gains made this month after the United States and China reached a trade deal.,Reuters,"Mon, 30 Dec 2019 16:22:02 -0500",,Negative,Article
https://www.marketwatch.com/story/major-stock-indexes-finish-lower-in-second-last-trading-session-of-year-2019-12-30,https://cdn.snapi.dev/images/v1/t/b/new-highs-as-the-dow-sp-and-nasdaq-parabolic-bubbles-continue-to-inflate.jpg,Major stock indexes finish lower in second last trading session of year,"U.S. stocks ended lower on Monday in a year set to leave investors with significant returns, buoyed by a preliminary trade deal with China and policy support from the Federal Reserve.",Market Watch,"Mon, 30 Dec 2019 16:11:09 -0500",,Negative,Article
https://www.cnbc.com/2019/12/30/heres-what-happened-to-the-stock-market-on-monday.html,https://cdn.snapi.dev/images/v1/h/e/106299288-15765316151102019-12-09t160754z-1661570400-rc2srd9jei1d-rtrmadp-3-usa-stocks.jpg,Here's what happened to the stock market on Monday (Dec 30),"Some of the biggest winners of the year, including Microsoft and Visa, were in the red on Monday as investors took profits.",CNBC,"Mon, 30 Dec 2019 16:09:32 -0500",,Negative,Article
https://www.youtube.com/watch?v=wBrPI0kHXs4,https://cdn.snapi.dev/images/v1/4/a/why-quad-groups-borish-is-bullish-on-silver.jpg,Why Quad Group's Borish Is Bullish on Silver,"In this edition of ""Charting Futures,"" Quad Group Chief Investment Strategist Peter Borish examines silver futures with Bloomberg's Abigail Doolittle on ""Bloomberg Markets: The Close.""",Bloomberg Markets and Finance,"Mon, 30 Dec 2019 16:06:27 -0500",,Positive,Video
https://www.youtube.com/watch?v=G6cuEVlJuwk,https://cdn.snapi.dev/images/v1/o/l/olm2rggg-1.jpg,Sri-Kumar's 2020 forecast: 'Stay defensive',"Sri-Kumar of Sri-Kumar Global Strategies and Barry James of James Advantage Funds discuss whether the new year will see the same market rally with CNBC's ""Power Lunch"" team.",CNBC Television,"Mon, 30 Dec 2019 15:52:37 -0500",,Negative,Video
https://www.youtube.com/watch?v=AWQR7AzVS8o,https://cdn.snapi.dev/images/v1/m/i/uncertainty-going-into-2020s-lower-but-risks-remain-stock-traders-almanacs-hirsch.jpg,"Uncertainty going into 2020s lower, but risks remain: Stock Trader's Almanac's Hirsch","Jeff Hirsch, editor-in-chief of The Stock Trader's Almanac and chief market strategist at Probabilities Fund Management, joins CNBC's ""Power Lunch"" team to discuss whether markets are entering the roaring 2020s.",CNBC Television,"Mon, 30 Dec 2019 15:44:25 -0500",,Negative,Video
https://www.youtube.com/watch?v=4EuDonmO8kw,https://cdn.snapi.dev/images/v1/m/q/were-seeing-profit-taking-and-reweighting-of-portfolios-loops-gibson.jpg,We're seeing profit-taking and reweighting of portfolios: Loop's Gibson,"CNBC's ""Closing Bell"" team discusses how markets performed in 2019 and what investors should anticipate in 2020 with Josh Brown of Ritholtz Wealth Management and Kourtney Gibson of Loop Capital Markets.",CNBC Television,"Mon, 30 Dec 2019 15:34:38 -0500",,Negative,Video
https://www.reuters.com/article/us-usa-stocks/wall-street-pulls-back-from-records-as-investors-take-profits-idUSKBN1YY0UE,https://cdn.snapi.dev/images/v1/8/b/m02d20191230t2i1470130002rlynxmpefbt0mqw640.jpg,Wall Street pulls back from records as investors take profits,Wall Street's major stock indexes slipped from record highs on Monday as investors booked profits from gains made this month after the United States and China reached a trade deal.,Reuters,"Mon, 30 Dec 2019 15:04:22 -0500",,Negative,Article
https://www.etftrends.com/core-etf-channel/2020-marks-the-start-of-a-big-commodity-rally/,https://cdn.snapi.dev/images/v1/2/0/2020-marks-the-start-of-a-big-commodity-rally.jpg,2020 Marks The Start Of A Big Commodity Rally,"By Michael A. Gayed, CFA Expectations for 2020 are for higher inflation and a rotation to commodities.",ETF Trends,"Mon, 30 Dec 2019 15:00:55 -0500",gold,Positive,Article
https://www.cnbc.com/2019/12/30/jim-paulsen-stocks-are-acting-like-it-is-just-year-two-of-bull-market.html,https://cdn.snapi.dev/images/v1/e/z/104866156-20171129-6760-2518c.jpg,"Stocks are acting like it's only the second year of a bull market, strategist Jim Paulsen says","Strategist Jim Paulsen told CNBC the S&P 500 may reach an area of 3,500 to 3,600 next year.",CNBC,"Mon, 30 Dec 2019 15:00:46 -0500",,Positive,Article
https://www.cnbc.com/2019/12/30/stocks-and-earnings-could-get-a-boost-from-a-weaker-dollar-in-2020.html,https://cdn.snapi.dev/images/v1/1/0/105170104-gettyimages-844285300.jpg,Stocks and earnings could get a boost from a weaker dollar in 2020,"The U.S. dollar is widely expected to be weaker in the coming year, as other economies do better and catch up to the U.S.",CNBC,"Mon, 30 Dec 2019 14:55:02 -0500",,Positive,Article
https://www.youtube.com/watch?v=1N9FhenXzsE,https://cdn.snapi.dev/images/v1/m/q/market-outlook-2020-should-investors-hang-tight-or-sell-off-2.jpg,Market outlook 2020: Should investors hang tight or sell-off?,The Haverford Trust Compnay Co-CIO discusses the market outlook for 2020.,Yahoo Finance,"Mon, 30 Dec 2019 14:53:39 -0500",,Neutral,Video
https://www.benzinga.com/tech/19/12/15051616/pro-says-to-expect-more-m-a-deals-in-streaming-media,https://cdn.snapi.dev/images/v1/t/v/tv-2213140-1920-1-2.png,Pro Says To Expect More M&A Deals In Streaming Media,"The streaming video battle has ""just began,"" and companies looking to solidify their dominance may pursue M&A deals to help them along the way, New York Times tech reporter Cecilia Kang said Monday on CNBC's ""Squawk Box.",Benzinga,"Mon, 30 Dec 2019 14:07:12 -0500",manda,Positive,Article
https://www.cnbc.com/2019/12/30/the-fed-seems-to-have-halted-a-potential-crisis-in-the-repo-market.html,https://cdn.snapi.dev/images/v1/1/0/106312448-1577372581085rts2ujby.jpg,The Fed seems to have halted a potential crisis in the overnight lending market — for now,Repo market activity is not showing the stress it did back in mid-September.,CNBC,"Mon, 30 Dec 2019 14:02:25 -0500",,Neutral,Article
https://www.theguardian.com/business/2019/dec/30/white-house-expecting-agreement-with-china-within-next-week-or-so,https://cdn.snapi.dev/images/v1/2/2/2275jpgwidth460quality85autoformatfitmaxs1fab66b5586e95b89a0cf0bb34ac92f5.jpg,White House expecting agreement with China 'within next week or so',Trade adviser Peter Navarro says little more than translation of text is needed,The Guardian,"Mon, 30 Dec 2019 13:11:41 -0500",,Positive,Article
https://www.reuters.com/article/us-usa-stocks/wall-streets-record-rally-loses-steam-on-profit-taking-idUSKBN1YY0UE,https://cdn.snapi.dev/images/v1/p/o/m02d20191230t2i1470130002rlynxmpefbt0mqw640.jpg,Wall Street's record rally loses steam on profit-taking,U.S stock indexes slipped from record highs on Monday as investors booked profits on the penultimate day of the decade after optimism over improving U.S.-China trade relations fueled a Wall Street rally this month.,Reuters,"Mon, 30 Dec 2019 12:59:51 -0500",,Negative,Article
https://www.seeitmarket.com/stock-market-today-watch-that-dollar/,https://cdn.snapi.dev/images/v1/b/q/106007058-1562599908150bull.jpg,Stock Market Today: Watch That Dollar! (Dec 30),2 more days and 2019 is in the books for investors. It’s been a great year for stock market returns.,See It Market,"Mon, 30 Dec 2019 12:38:57 -0500",,Neutral,Video
https://www.youtube.com/watch?v=QL5gLB3rHvg,https://cdn.snapi.dev/images/v1/t/e/tech-30-13.jpg,Here are the tech stocks Aegis Capital's Victor Anthony says will outperform in 2020,"Victor Anthony of Aegis Capital and Christopher Retzler of Needham join ""Squawk Alley"" to discuss tech stocks they think will perform in 2020.",CNBC Television,"Mon, 30 Dec 2019 12:32:12 -0500",,Positive,Video
https://www.youtube.com/watch?v=Y-QN_EwpOXI,https://cdn.snapi.dev/images/v1/m/q/stick-with-the-market-when-it-gets-scary-pro.jpg,Stick with the market when it gets scary: Pro,"Should investors stick with the markets heading into the new year, or should they take profits?",CNBC Television,"Mon, 30 Dec 2019 12:26:33 -0500",,Neutral,Video
https://www.youtube.com/watch?v=QlXIydjr87w,https://cdn.snapi.dev/images/v1/r/9/chinese-vice-premier-to-visit-dc-to-sign-phase-one-of-trade-deal-with-china.jpg,Chinese Vice Premier to visit DC to sign phase one of trade deal with China,Chinese Vice Premier Liu He will be traveling to the United States to sign phase-one of the trade deal between the United States and China.,Yahoo Finance,"Mon, 30 Dec 2019 12:17:18 -0500",,Positive,Video
https://www.youtube.com/watch?v=UcJtaDhiIgY,https://cdn.snapi.dev/images/v1/e/i/consumers-could-feel-pain-with-prosecco-champagne-if-french-tariffs-go-into-effect.jpg,"Consumers could feel pain with Prosecco, Champagne if French tariffs go into effect","Michael Bilello, Wine & Spirits Wholesale of America, joins ""Squawk on the Street"" to discuss the proposed tariffs on French goods, such as wine and cheese.",CNBC Television,"Mon, 30 Dec 2019 12:04:35 -0500",,Negative,Video
https://www.etftrends.com/smart-beta-channel/sec-taking-a-closer-look-at-esg-funds/,https://cdn.snapi.dev/images/v1/s/e/sec-taking-a-closer-look-at-esg-funds-915x510.jpg,SEC Taking a Closer Look at ESG Funds,"The rise of environmental, social and governance (ESG) funds is now drawing the attention of the Securities Exchange Commission (SEC) just as the topic became one of the most searched financial terms in 2019, according to a 401(k) Specialist post.",ETF Trends,"Mon, 30 Dec 2019 12:00:52 -0500",,Neutral,Article
https://www.reuters.com/article/us-global-markets/world-stocks-slip-as-rally-pauses-dollar-eases-idUSKBN1YY02P,https://cdn.snapi.dev/images/v1/r/s/m02d20191230t2i1470172842rlynxmpefbt0v3w640.jpg,"World stocks slip as rally pauses, dollar eases","The dollar slid on Monday on a loss of safe-haven appeal, and global stock markets fell as a year-end rally lost steam after pushing stocks to record highs in 2019.",Reuters,"Mon, 30 Dec 2019 11:52:04 -0500",,Negative,Article
https://www.youtube.com/watch?v=Hi2xWXTnhk8,https://cdn.snapi.dev/images/v1/m/q/the-no-good-very-bad-year-for-hedge-funds.jpg,"The No-Good, Very Bad Year for Hedge Funds","The pain kept coming for hedge funds in 2019: if they weren’t being killed off, they were bleeding cash or wringing out dismal returns. Bloomberg's Katherine Burton has more on ""Bloomberg Markets.""",Bloomberg Markets and Finance,"Mon, 30 Dec 2019 11:44:39 -0500",,Negative,Video
https://www.forbes.com/sites/sergeiklebnikov/2020/12/30/phase-one-us-china-trade-deal-to-be-signed-this-week-report/,https://cdn.snapi.dev/images/v1/7/w/phase-one-us-china-trade-deal-to-be-signed-this-week-report.jpg,"Phase One U.S., China Trade Deal To Be Signed This Week: Report",The two countries have been formalizing the agreement since earlier this month.,Forbes,"Mon, 30 Dec 2019 11:28:51 -0500",,Neutral,Article
https://www.investopedia.com/markets-reach-overbought-signal-red-ahead-4780118,https://cdn.snapi.dev/images/v1/s/t/stocks111-3.jpg,"Markets Reach Overbought, Signal Red Ahead","Now is not the time to buy. It's the time to trim, hedge, and prep your buying lists for when a pullback inevitably comes.",Investopedia,"Mon, 30 Dec 2019 11:23:08 -0500",,Negative,Article
https://247wallst.com/technology-3/2019/12/30/wedbushs-top-10-tech-predictions-for-2020/,https://cdn.snapi.dev/images/v1/p/a/palsdm213-1.jpg,Wedbush’s Top 10 Tech Predictions for 2020,"After a solid 2019 for the broad markets in general, and the tech sector specifically, 2020 poses an interesting question on what’s next for this sector.",24/7 Wall Street,"Mon, 30 Dec 2019 11:20:14 -0500",,Neutral,Article
https://www.youtube.com/watch?v=9mRkdF61j-o,https://cdn.snapi.dev/images/v1/m/q/economy-has-done-well-despite-trade-uncertainty-says-deutsche-bank-economist.jpg,"Economy has done well despite trade uncertainty, says Deutsche Bank economist","Torsten Slok of Deutsche Bank and Ed Campbell of QMA join ""Squawk on the Street"" to discuss the state of the markets headed into 2020.",CNBC Television,"Mon, 30 Dec 2019 11:19:27 -0500",,Positive,Video
https://www.cnn.com/2019/12/30/investing/dow-stock-market-today/index.html,https://cdn.snapi.dev/images/v1/1/9/191210104317-01-dow-stock-market-trade-super-169.jpg,Major indexes are on track for their worst performances since the start of the month,"Stocks slipped on the second-to-last trading day of the year, putting the major indexes on track for their worst performances since the start of the month.",CNN Business,"Mon, 30 Dec 2019 11:11:17 -0500",,Negative,Article
https://www.marketwatch.com/story/here-are-the-best-and-worst-dow-and-sp-500-stocks-of-2019-2019-12-30,https://cdn.snapi.dev/images/v1/n/5/mw-hx541-cook-2-20191230104345-zhjpguuid2a248c02-2b1b-11ea-9f11-9c8e992d421e.jpg,Deep Dive: Here are the best and worst Dow and S&P 500 stocks of 2019,"There’s no question 2019 was a breakout year for the U.S. stock market, as the Federal Reserve reversed course and lowered interest rates and negative rates abroad kept even more money flowing into the U.S.",Market Watch,"Mon, 30 Dec 2019 11:09:35 -0500",,Neutral,Article
https://seekingalpha.com/article/4314524-what-to-expect-from-stock-market-in-2020-based-on-history-and-statistics,https://cdn.snapi.dev/images/v1/u/r/urlhttps3a2f2fgfoolcdncom2feditorial2fimages2f5510162fstock-chart-going-upjpgw700opresize-3.jpg,What To Expect From The Stock Market In 2020 Based On History And Statistics,"According to some analysts, tax-related (delayed) sales might hit us in January, consequently causing the market to somewhat correct itself during the early days of 2020.",Seeking Alpha,"Mon, 30 Dec 2019 11:06:00 -0500",,Positive,Article
https://www.reuters.com/article/us-usa-trade-china/white-house-adviser-says-china-trade-deal-signing-expected-soon-idUSKBN1YY0YK,https://cdn.snapi.dev/images/v1/l/2/m02d20191230t2i1470159158rlynxmpefbt0u6w640.jpg,White House adviser says China trade deal signing expected soon,"The White House's trade adviser on Monday said the U.S.-China Phase 1 trade deal would likely be signed in the next week, but said confirmation would come from President Donald Trump or the U.S.",Reuters,"Mon, 30 Dec 2019 11:01:37 -0500",,Neutral,Article
https://www.forbes.com/sites/robisbitts2/2020/12/30/the-bullish-case-for-stocks-and-what-pre-retirees-can-do-about-it/,https://cdn.snapi.dev/images/v1/q/r/the-bullish-case-for-stocks-and-what-pre-retirees-can-do-about-it.jpg,"The Bullish Case For Stocks, And What Pre-Retirees Can Do About It","There are real reasons to be bullish on stocks...for a little while, anyway.",Forbes,"Mon, 30 Dec 2019 11:00:00 -0500",,Positive,Article
https://www.etftrends.com/leveraged-inverse-channel/5-things-to-consider-before-trading-etfs/,https://cdn.snapi.dev/images/v1/5/-/5-things-to-consider-before-trading-etfs-915x510.jpg,5 Things to Consider Before Trading ETFs,"Just like an individual stock, an exchange-traded fund (ETF) can be bought and sold freely via an exchange. This dynamic ability gives traders the option to make quick intraday trades to seek a profit.",ETF Trends,"Mon, 30 Dec 2019 10:55:48 -0500",,Positive,Article
https://nypost.com/2019/12/30/chinas-top-trade-representative-signals-he-will-sign-phase-one-of-us-trade-deal/,https://cdn.snapi.dev/images/v1/s/8/china-trade-warjpgquality90stripall.jpg,China’s top trade representative signals he will sign ‘phase one’ of US trade deal,"China's top trade negotiator will travel to Washington this week to sign ""phase one"" of a trade deal with the US - a development that could de-escalate the bitter trade war between the world's two biggest economies, according to a report on Monday.",New York Post,"Mon, 30 Dec 2019 10:42:16 -0500",,Positive,Article
https://www.youtube.com/watch?v=UUJ2EHGM_BU,https://cdn.snapi.dev/images/v1/e/t/etf-30-12.jpg,Markets turn into a 'classic Santa Claus rally',CNBC's Bob Pisani reports on today's market activity.,CNBC Television,"Mon, 30 Dec 2019 10:29:26 -0500",,Positive,Video
