news_url,image_url,title,text,source_name,date,topics,sentiment,type
https://www.cnbc.com/2019/04/10/uber-plans-to-sell-around-10-billion-worth-of-stock-in-ipo.html,https://cdn.snapi.dev/images/v1/6/u/6ub.jpg,Uber plans to sell around $10 billion worth of stock in IPO,"Uber Technologies Inc has decided it will seek to sell around $10 billion worth of stock in its initial public offering, and will make public the registration of this offering",CNBC,"Tue, 09 Apr 2019 21:31:00 -0400",,Positive,Article
https://www.cnbc.com/2019/04/09/cramer-some-may-think-the-market-will-soon-top-but-im-not-buying-it.html,https://cdn.snapi.dev/images/v1/1/0/105842208-15548493583ed2-mm-block-a-short-040919600x337.jpg,"Investors may think the market is reaching a top, but I'm not buying it, Jim Cramer says",Jim Cramer breaks down 10 reasons that people forecast the market could soon reverse course.,CNBC,"Tue, 09 Apr 2019 18:09:00 -0400",,Negative,Article
https://www.youtube.com/watch?v=b0z4F15NwGM,https://cdn.snapi.dev/images/v1/m/q-2/number-of-deals-a-barometer-of-ma-market-wolf-says.jpg,"Number of Deals a Barometer of M&A Market, Wolf Says","Apr.09 -- Daniel Wolf, mergers and acquisitions partner at Kirkland & Ellis LLP, discusses the m&a landscape with Bloomberg's Ed Hammond and Vonnie Quinn on ""Bloomberg Markets.""",Bloomberg Markets and Finance,"Tue, 09 Apr 2019 17:12:38 -0400",,Neutral,Video
https://www.youtube.com/watch?v=MyQjmUU3wN4,https://cdn.snapi.dev/images/v1/m/q-2/sp-500-nasdaq-on-pace-for-worst-day-since-march-27.jpg,"S&P 500, Nasdaq on pace for worst day since March 27","Ben Laidler, HSBC global equity strategist, and Jack Bouroudjian, UCX chief economist and co-founder, joins 'Closing Bell' for Closing Bell Exchange. The panel discusses the inversion of the yield curve, signs of a global slowdown and other factors weighing on the stock market.",CNBC Television,"Tue, 09 Apr 2019 15:57:34 -0400",,Negative,Video
https://www.youtube.com/watch?v=LC_LP_8iaSE,https://cdn.snapi.dev/images/v1/m/q-2/laurentian-ceo-says-canadian-banks-are-strong-resilient.jpg,"Laurentian CEO Says Canadian Banks Are Strong, Resilient","Apr.09 -- Laurentian Bank of Canada Chief Executive Officer Francois Desjardins discusses the health of Canadian banks, stock shorting, and Canada's economy. He speaks with Bloomberg's Amanda Lang and Vonnie Quinn on ""Bloomberg Markets.",Bloomberg Markets and Finance,"Tue, 09 Apr 2019 15:43:59 -0400",CEO,Positive,Video
https://www.youtube.com/watch?v=Rpt5BHrU2Ec,https://cdn.snapi.dev/images/v1/m/q-2/the-us-could-be-stuck-in-a-forever-trade-war.jpg,The US could be stuck in a 'Forever Trade War',"CNBC's Steve Liesman sits down with the ""Power Lunch"" team to discuss the IMF cutting their forecast on fears of a global slowdown and a potential, perpetual trade war with no end in sight.",CNBC Television,"Tue, 09 Apr 2019 14:32:16 -0400",,Negative,Video
https://www.youtube.com/watch?v=pDch4m8tGIc,https://cdn.snapi.dev/images/v1/m/q-2/lawsuit-alleges-uber-didnt-do-enough-to-stop-fake-drivers-in-los-angeles.jpg,Lawsuit alleges Uber didn't do enough to stop fake drivers in Los Angeles,Nine women are alleging in a new lawsuit against Uber that the company didn't do enough to respond to fake drivers sexually assualting women. CNBC's Deirdre Bosa reports.,CNBC Television,"Tue, 09 Apr 2019 13:50:46 -0400",,Negative,Video
https://www.youtube.com/watch?v=G0lzrTrUENA,https://cdn.snapi.dev/images/v1/m/q-2/we-never-had-free-trade-says-former-director-of-the-nec.jpg,"We never had free trade, says former director of the NEC","Larry Lindsey, CEO and president of The Lindsey Group and former director of the National Economic Council, joins CNBC's ""The Exchange"" to talk about the possibility of a semi-permanent trade war and how the markets will react.",CNBC Television,"Tue, 09 Apr 2019 13:41:40 -0400",,Neutral,Video
https://feedproxy.google.com/~r/InternetTechnologyRss/~3/dKUlkQYby5c/,https://cdn.snapi.dev/images/v1/z/o/zoom99.jpg,Zoom Video Sets Price Terms As IPO Market Activity Intensifies,"The Zoom Video IPO comes as the market for public offerings accelerates, fueled by the Lyft IPO, to be followed by Jumia Technologies, PagerDuty and Tufin Software Technologies this week.",Investors Business Daily,"Tue, 09 Apr 2019 13:11:00 -0400",,Positive,Article
https://www.youtube.com/watch?v=ShIN-7M3Q9w,https://cdn.snapi.dev/images/v1/m/q-2/retail-is-detail-siam-piwat-ceo-reflects-on-her-fathers-legacy-managing-asia.jpg,'Retail is detail': Siam Piwat CEO reflects on her father's legacy | Managing Asia,"Chadatip Chutrakul, CEO of Siam Piwat, shares how Iconsiam, the biggest mall in Thailand, was borne out of her father's vision to have a development by the Chao Phraya River that will bring ""fame to the nation"".",CNBC International TV,"Tue, 09 Apr 2019 13:00:03 -0400",CEO,Positive,Video
https://www.youtube.com/watch?v=XHgPEQMuUA4,https://cdn.snapi.dev/images/v1/m/q-2/ias-ceo-on-the-opportunity-of-new-media-platform-ad-measurement-marketing-media-money.jpg,IAS CEO on the opportunity of new media platform ad measurement | Marketing Media Money,"Lisa Utzschneider tells CNBC's James Wright what they're doing to help marketers measure marketing ROI with new media advertising opportunities, but why is it giving her a small headache?",CNBC International TV,"Tue, 09 Apr 2019 13:00:03 -0400",CEO,Neutral,Video
https://www.youtube.com/watch?v=OhRiy7PmGD8,https://cdn.snapi.dev/images/v1/m/q-2/use-money-parties-to-take-control-of-your-finances.jpg,"Use money ""parties"" to take control of your finances","Money coach, Ashley Feinstein Gerstley breaks down her four tools to take control of your finances as a couple. 

Invest in You: Ready.",CNBC Television,"Tue, 09 Apr 2019 12:34:32 -0400",,Positive,Video
https://www.youtube.com/watch?v=DyMHJyqU-Ik,https://cdn.snapi.dev/images/v1/m/q-2/untuckit-ceo-on-brand-credibility-and-disrupting-the-retail-shirt-business.jpg,Untuckit CEO on brand credibility and disrupting the retail shirt business,"Chris Riccobono CEO of Untuckit discusses the success of his shirt business, branding and the company's plan for expansion.",Yahoo Finance,"Tue, 09 Apr 2019 11:29:52 -0400",CEO,Positive,Video
https://www.cnbc.com/2019/04/09/workers-worry-about-robots-stealing-jobs-just-not-their-jobs.html,https://cdn.snapi.dev/images/v1/1/0/105189418-cafex-02600x400.jpg,"Workers worry about robots stealing jobs, just not their jobs. They may be overconfident","A majority of workers across the US say they do not feel their job security is threatened by technology, according to a new CNBC/SurveyMonkey workplace analysis.",CNBC,"Tue, 09 Apr 2019 10:56:00 -0400",,Neutral,Article
https://www.youtube.com/watch?v=nf1SvQA1rY8,https://cdn.snapi.dev/images/v1/m/q-2/likelihood-markets-go-higher-on-us-china-trade-deal-is-modest-oppenheimerfunds-cio.jpg,Likelihood markets go higher on US-China trade deal is modest: OppenheimerFunds CIO,"Shawn Matthews, former Cantor Fitzgerald CEO, and Krishna Memani, Oppenheimer Funds CIO, join 'Squawk on the Street' to discuss the concerns weighing on the markets and where they see it headed.",CNBC Television,"Tue, 09 Apr 2019 10:46:50 -0400",,Neutral,Video
https://www.youtube.com/watch?v=Pk6LKzx-qEE,https://cdn.snapi.dev/images/v1/m/q-2/markets-open-lower-amid-trade-and-tariff-fears.jpg,Markets open lower amid trade and tariff fears,CNBC's Bob Pisani looks ahead at the day's market action.,CNBC Television,"Tue, 09 Apr 2019 10:21:55 -0400",,Negative,Video
https://www.forbes.com/sites/jjkinahan/2019/04/09/on-edge-awaiting-key-developments-market-appears-pensive-ahead-of-news/,https://cdn.snapi.dev/images/v1/m/u/mu-oil-rig-1200x799.jpg,"On Edge: Awaiting Key Developments, Market Appears Pensive Ahead Of News","The market looks like it’s on the cusp of a lot of big news, including Brexit, earnings and Fed minutes. But the China tariff situation is still number one on the list of important things to consider watching.",Forbes,"Tue, 09 Apr 2019 09:50:00 -0400",,Neutral,Article
https://www.youtube.com/watch?v=THwf9OaUzk4,https://cdn.snapi.dev/images/v1/m/q-2/heres-how-jim-cramer-thinks-central-banks-might-react-to-the-imf-growth-outlook-cut.jpg,Here's how Jim Cramer thinks central banks might react to the IMF growth outlook cut,"The IMF expects the world economy to grow by 3.3% in 2019, down from 3.5%. CNBC's Jim Cramer discusses how central banks around the world might react to the forecast.",CNBC Television,"Tue, 09 Apr 2019 09:48:22 -0400",,Neutral,Video
https://www.fool.com/investing/2019/04/09/3-things-to-know-about-zoom-before-its-ipo.aspx?source=iedfolrf0000001,https://cdn.snapi.dev/images/v1/z/o/zoom.jpg,3 Things to Know About Zoom Before Its IPO,The second thing might surprise you for such a young company,The Motley Fool,"Tue, 09 Apr 2019 08:55:00 -0400",,Positive,Article
https://www.youtube.com/watch?v=Un_jQNtav54,https://cdn.snapi.dev/images/v1/m/q-2/heres-what-to-expect-from-earnings-season.jpg,Here's what to expect from earnings season,"Charles Campbell, trading desk specialist at MKM Partners, and Chris Retzler, portfolio manager at Needham Growth Fund, join ""Squawk Box"" ahead of the Fed's minutes and the onset of earnings week.",CNBC Television,"Tue, 09 Apr 2019 08:44:41 -0400",,Positive,Video
https://www.cnbc.com/2019/04/09/75000-more-stores-need-to-close-ubs-estimates-as-online-sales-grow.html,https://cdn.snapi.dev/images/v1/1/0/103529842-gettyimages-171305235530x298.jpg,"75,000 more stores need to close across the US, UBS estimates, as online sales and Amazon grow","Clothing retailers, consumer electronics companies and home furnishing businesses will need to close more stores across the U.S., as e-commerce sales continue to account for a larger portion of total retail sales, UBS writes in a note to clients.",CNBC,"Tue, 09 Apr 2019 07:59:00 -0400",,Neutral,Article
https://www.cnbc.com/2019/04/09/robotic-heads-powered-by-ai-to-help-passengers-at-major-airport.html,https://cdn.snapi.dev/images/v1/1/0/105840713-1554807979026fraport-and-deutsche-bahn-to-test-artificial-intelligence530x298.jpg,Robotic heads powered by A.I. to help passengers at a major German airport,The trial will last for six weeks at Frankfurt Airport in Germany.,CNBC,"Tue, 09 Apr 2019 07:39:00 -0400",,Positive,Article
https://www.youtube.com/watch?v=KObh4D6_l38,https://cdn.snapi.dev/images/v1/m/q-2/saudi-aramcos-first-ever-international-bond-sale-reportedly-tops-85-billion.jpg,Saudi Aramco's first-ever international bond sale reportedly tops $85 billion,"CNBC's ""Street Signs Europe"" anchors Joumanna Bercetche and Julianna Tatelbaum discuss Saudi Aramco's debut bond offering.",CNBC International TV,"Tue, 09 Apr 2019 07:30:01 -0400",,Positive,Video
https://www.youtube.com/watch?v=5ZZi5gsRDLs,https://cdn.snapi.dev/images/v1/m/q-2/bapis-q1-earnings-will-be-a-real-gut-check-for-companies.jpg,Bapis: Q1 earnings will be a real gut-check for companies,"Michael Bapis of Vios Advisors at Rockefeller Capital Management says companies will have to outperform with their Q1 results, as investors are skeptical about the market's rise so far this year.",CNBC Television,"Tue, 09 Apr 2019 07:16:26 -0400",,Positive,Video
https://www.forbes.com/sites/michaellynch/2019/04/09/the-security-premium-will-keep-oil-prices-high/,https://cdn.snapi.dev/images/v1/0/x/0x600-47.jpg,The Security Premium Will Keep Oil Prices High,"Political conflict, unrest and violence should keep oil prices elevated for the near future.",Forbes,"Tue, 09 Apr 2019 06:53:00 -0400",,Neutral,Article
https://www.forbes.com/sites/mayrarodriguezvalladares/2019/04/09/financial-stability-board-calls-for-vigilance-of-global-financial-system-vulnerabilities/,https://cdn.snapi.dev/images/v1/p/t/pt-6196-728-o.jpg,Financial Stability Board Calls For Vigilance Of Global Financial System Vulnerabilities,"While many banks are in better shape than they were in 2008, a number of vulnerabilities exist in the financial system.",Forbes,"Tue, 09 Apr 2019 06:00:00 -0400",,Neutral,Article
https://www.cnbc.com/2019/04/09/china-aircraft-leasing-says-has-not-put-boeing-737-max-order-on-hold.html,https://cdn.snapi.dev/images/v1/1/0/105830310-1554292650408rts2ecea530x298.jpg,China Aircraft Leasing says has not put Boeing 737 Max order on hold,"China Aircraft Leasing Group says it has not put its order for 100 Boeing 737 Max jets on hold nor had it suspended payment, rebutting an earlier report by the South China Morning Post newspaper.",CNBC,"Tue, 09 Apr 2019 03:30:47 -0400",,Neutral,Article
https://www.cnbc.com/2019/04/09/argentinas-peso-could-slip-into-crisis-mode-ahead-of-elections.html,https://cdn.snapi.dev/images/v1/1/0/105838749-1554727541781argentinapeso530x298.jpg,The world's worst-performing currency could slip into 'crisis' mode later this year,"Market volatility in Argentina could spark another currency crisis, analysts have told CNBC, as the country prepares for presidential elections later this year.",CNBC,"Tue, 09 Apr 2019 02:13:00 -0400",,Negative,Article
https://www.cnbc.com/2019/04/09/hsbc-predicts-china-2019-gdp-will-soar-past-others-estimates.html,https://cdn.snapi.dev/images/v1/c/h/chi.jpg,HSBC predicts China's 2019 GDP will soar past others' estimates,"China's stimulus-boosted private sector is on track to lead the economy to a ""self-sustained recovery"" that could see growth hit 6.6 percent this year, according to HSBC.",CNBC,"Tue, 09 Apr 2019 01:58:00 -0400",,Positive,Article
