news_url,image_url,title,text,source_name,date,topics,sentiment,type
https://feeds.marketwatch.com/~r/marketwatch/internet/~3/eJrPslQpyDA/story.asp,https://cdn.snapi.dev/images/v1/m/w/mw-gf034-kalani-20180307224559-zh.jpg,"MarketWatch First Take: Uber, 2 years after getting spanked, acts like a grown-up in its IPO","Two years ago, Uber Technologies Inc. was the quintessential Silicon Valley problem child.",Market Watch,"Thu, 11 Apr 2019 21:33:00 -0400",,Positive,Article
https://www.youtube.com/watch?v=0SsFntWkCyc,https://cdn.snapi.dev/images/v1/m/q-2/spacex-falcon-heavy-sticks-historic-landing-what-the-future.jpg,SpaceX Falcon Heavy sticks historic landing | What the Future,"Following its second launch, the SpaceX Falcon Heavy completed a perfect landing of all three boosters. Also, Israel attempts its first moon landing, we check out the Cue 3 three-point-shooting robot, and Chinese scientists say they've made monkeys smarter using human genes.",CNET,"Thu, 11 Apr 2019 21:08:17 -0400",,Positive,Video
https://www.fool.com/investing/2019/04/11/5-things-we-learned-uber-ipo-filing-s-1.aspx?source=iedfolrf0000001,https://cdn.snapi.dev/images/v1/u/b/uber6.jpg,5 Things We Just Learned From Uber's IPO Filing,"Details from the ridesharing giant's report show revenue of $11.3 billion in 2018, but slowing quarterly growth.",The Motley Fool,"Thu, 11 Apr 2019 20:27:00 -0400",,Positive,Article
https://feeds.marketwatch.com/~r/marketwatch/internet/~3/Xevi4Jx1hSk/story.asp,https://cdn.snapi.dev/images/v1/m/w/mw-gn311-slack-20180727123402-zh.jpg,Outside the Box: Why Slack’s IPO will have more in common with Spotify than Uber or Lyft,Direct listings have clear advantages over IPOs for companies and investors.,Market Watch,"Thu, 11 Apr 2019 18:48:53 -0400",,Positive,Article
https://www.fool.com/investing/2019/04/11/what-happens-when-you-miss-the-best-days-in-the-st.aspx?source=iedfolrf0000001,https://cdn.snapi.dev/images/v1/u/r/urlhttps3a2f2fgfoolcdncom2feditorial2fimages2f5178672fsenior-man-and-woman-sitting-at-table-resting-their-faces-on-their-hands-looking-bored-couple-retirement.jpg,What Happens When You Miss the Best Days in the Stock Market?,Tempted to sit on the sidelines during a market correction? Here's what you'd give up.,The Motley Fool,"Thu, 11 Apr 2019 18:45:00 -0400",,Neutral,Article
https://www.youtube.com/watch?v=MnCm7N-rt-U,https://cdn.snapi.dev/images/v1/m/q-2/uber-files-to-go-public.jpg,Uber files to go public,Jared Blikre of Yahoo Finance reports on the latest news on Uber filing to go public.,Yahoo Finance,"Thu, 11 Apr 2019 17:26:04 -0400",,Positive,Video
https://www.cnbc.com/2019/04/11/uber-s-1-risk-factors-competitors-deleteuber-campaign-reputation.html,https://cdn.snapi.dev/images/v1/1/0/105694867-1548253543511preview530x298.jpg,Uber lists competitors like Alphabet and Amazon and addresses past scandals in its IPO filing,"Uber says Amazon, DHL, Didi, GrubHub, Lyft and Tesla are among its major competitors in IPO prospectus.",CNBC,"Thu, 11 Apr 2019 17:15:00 -0400",,Neutral,Article
https://feeds.benzinga.com/~r/benzinga/~3/pSffmrXMfYg/uber-files-for-ipo-on-nyse-says-personal-mobility-a-vast-market-opportunity,https://cdn.snapi.dev/images/v1/u/b/uberim-20069-1-0.jpg,"Uber Files For IPO On NYSE, Says Personal Mobility A 'Vast' Market Opportunity","Ride-hailing service Uber filed Thursday with the Securities and Exchange Commission for an initial public offering on the New York Stock Exchange under the ticker symbol ""UBER,"" following its ride-hailing rival Lyft Inc to Wall Street.",Benzinga,"Thu, 11 Apr 2019 17:00:58 -0400",,Positive,Article
https://www.forbes.com/sites/petercohan/2019/04/11/decelerating-ubers-ipo-valuation-could-fall-20-billion-short-of-2018-hopes/,https://cdn.snapi.dev/images/v1/u/b/ub7-2.jpg,Decelerating Uber's IPO Valuation Could Fall $20 Billion Short Of 2018 Hopes,Uber is slowing down and burning through cash. Don't buy into its IPO.,Forbes,"Thu, 11 Apr 2019 16:57:00 -0400",,Negative,Article
https://www.youtube.com/watch?v=DeQcApZgTz0&t=0s,https://cdn.snapi.dev/images/v1/m/q-2/uber-files-to-ipo-on-the-nyse.jpg,Uber files to IPO on the NYSE,Uber has officially filed to go public on the NYSE under the ticker UBER. CNBC's Leslie Picker and Deirdre Bosa report.,CNBC Television,"Thu, 11 Apr 2019 16:43:14 -0400",,Positive,Video
https://www.cnbc.com/2019/04/11/j-crew-is-considering-an-ipo-for-its-madewell-clothing-brand.html,https://cdn.snapi.dev/images/v1/1/0/102815696-madewell530x298.jpg,J. Crew is considering an IPO for its Madewell clothing brand,"J.Crew said it is exploring a potential initial public offering for its fasted growing brand Madewell, the company said in a release Thursday.",CNBC,"Thu, 11 Apr 2019 16:12:00 -0400",,Positive,Article
https://www.cnbc.com/2019/04/11/uber-releases-s-1-filing-for-ipo.html,https://cdn.snapi.dev/images/v1/1/0/105322077-1531271506040sun-valley-dara530x298.jpg,Uber finally files to go public,"Uber's offering is likely to be significantly larger than rival Lyft's, and one of the largest offerings this year.",CNBC,"Thu, 11 Apr 2019 16:09:00 -0400",,Positive,Article
https://www.youtube.com/watch?v=hz4vU4erW8E,https://cdn.snapi.dev/images/v1/m/q-2/here-are-the-three-stories-to-keep-in-mind-heading-into-earnings-season.jpg,Here are the three stories to keep in mind heading into earnings season,"Lawrence Golub, Golub Capital CEO, joins 'Power Lunch' to discuss what investors should expect for this quarter's earnings season.",CNBC Television,"Thu, 11 Apr 2019 15:32:53 -0400",earnings,Positive,Video
https://www.youtube.com/watch?v=CWwkoHYm2e0,https://cdn.snapi.dev/images/v1/m/q-2/cbd-could-be-the-underpinnings-for-full-legalization-in-the-us-says-investor.jpg,"'CBD could be the underpinnings for full legalization' in the US, says investor",Northern Swan CEO Kyle Detwiler discusses where the cannabis industry is headed and some of the investment opportunities around the world.,Yahoo Finance,"Thu, 11 Apr 2019 15:17:35 -0400",cannabis,Neutral,Video
https://www.youtube.com/watch?v=lqfq-sPFvqY,https://cdn.snapi.dev/images/v1/m/q-2/watch-cnbcs-full-interview-with-former-fda-commissioner-scott-gottlieb.jpg,Watch CNBC's full interview with former FDA Commissioner Scott Gottlieb,"Former FDA Commissioner Scott Gottlieb sits down with 'Power Lunch' to discuss the concern of marijuana entering the general society, e-cigarette sales and the measles outbreak in America.",CNBC Television,"Thu, 11 Apr 2019 15:08:17 -0400",,Neutral,Video
https://www.youtube.com/watch?v=2rknwEUAT8c,https://cdn.snapi.dev/images/v1/m/q-2/sorrell-tells-cnbc-that-even-chinese-authorities-worry-about-data-privacy-cnbc-conversation.jpg,Sorrell tells CNBC that even Chinese authorities worry about data privacy | CNBC Conversation,Sir Martin Sorrell explains what marketers need in an era of consumer privacy concerns,CNBC International TV,"Thu, 11 Apr 2019 15:00:00 -0400",,Neutral,Video
https://www.youtube.com/watch?v=4beCrBgAD4c,https://cdn.snapi.dev/images/v1/m/q-2/how-to-avoid-the-latest-phishing-scam-targeting-direct-desposit.jpg,How to avoid the latest phishing scam targeting direct desposit,"CNBC's ""The Exchange"" talks about the uptick in scam and phishing emails with Judith Pinto, managing director of the cybersecurity practice at IBM's Promontory Financial Group, and Kate Fazzini, CNBC.com tech reporter and former cybersecurity vice president at J.P. Morgan. There's an ongoing scam targeting paychecks that impersonate corporate executives.",CNBC Television,"Thu, 11 Apr 2019 14:47:56 -0400",,Negative,Video
https://www.youtube.com/watch?v=j8nzWszl7-0,https://cdn.snapi.dev/images/v1/m/q-2/us-charges-julian-assange-with-conspiracy-to-commit-computer-hacking-engadget-today.jpg,US charges Julian Assange with conspiracy to commit computer hacking | Engadget Today,The Justice Department says Assange agreed to break a password to a classified government computer.,Engadget,"Thu, 11 Apr 2019 14:23:32 -0400",,Neutral,Video
https://www.forbes.com/sites/nickkovacevich/2019/04/11/the-legislative-mess-around-legalizing-cannabis/,https://cdn.snapi.dev/images/v1/c/1/c1.jpg,The Legislative Mess Around Legalizing Cannabis,"There’s lots of support for ending the prohibition against cannabis, but it’s anyone’s guess which bill will prevail.",Forbes,"Thu, 11 Apr 2019 14:21:00 -0400",cannabis,Neutral,Article
https://www.youtube.com/watch?v=I4SVFMFmpY8,https://cdn.snapi.dev/images/v1/m/q-2/market-has-been-great-at-overlooking-what-will-be-a-weak-first-half-expert.jpg,Market has been great at overlooking what will be a weak first half: Expert,"CNBC's ""Fast Money Halftime Report"" team is joined by Rob Sechan of UBS Private Wealth Management and Kari Firestone, CEO of Aureus Asset Management to discuss what investors should be trading in Thursday's markets.",CNBC Television,"Thu, 11 Apr 2019 13:51:49 -0400",,Neutral,Video
https://www.youtube.com/watch?v=We8vgi9DKys,https://cdn.snapi.dev/images/v1/m/q-2/santelli-exchange-grant-on-inflation.jpg,Santelli Exchange: Grant on inflation,Grant's Interest Rate Observer Founder and Editor James Grant and CNBC's Rick Santelli discuss the fed chasing its tail and rates.,CNBC Television,"Thu, 11 Apr 2019 13:40:38 -0400",,Neutral,Video
https://www.cnbc.com/2019/04/11/shadow-banking-is-now-a-52-trillion-industry-and-posing-risks.html,https://cdn.snapi.dev/images/v1/a/s/asset-management40-2.jpg,"Shadow banking is now a $52 trillion industry, posing a big risk to the financial system","Nonbank lending, an industry that played a central role in the financial crisis, has been expanding rapidly and is still posing risks should credit conditions deteriorate.",CNBC,"Thu, 11 Apr 2019 13:18:00 -0400",,Neutral,Article
https://www.youtube.com/watch?v=wojo-Z4PtXo,https://cdn.snapi.dev/images/v1/m/q-2/uber-is-positioned-as-the-amazon-of-transportation-says-expert.jpg,"Uber is positioned as the Amazon of transportation, says expert","Paul Holland of Foundation Capital and the New York Times' Mike Isaac join ""Squawk Alley"" to discuss Uber ahead of its expected IPO filing on Thursday.",CNBC Television,"Thu, 11 Apr 2019 13:17:27 -0400",,Positive,Video
https://feeds.marketwatch.com/~r/marketwatch/internet/~3/1_cEF-efaGU/story.asp,https://cdn.snapi.dev/images/v1/m/w/mw-hg692-lyft-b-20190329165226-zh-2.jpg,"The Ratings Game: As unicorn deals loom, IPO market has work to do to catch up with last year’s pace","Several high-profile unicorns are expected to make their public debuts in the coming weeks, but the 2019 initial-public-offering market still has some catching up to do to match last year’s pace.",Market Watch,"Thu, 11 Apr 2019 13:16:25 -0400",,Neutral,Article
https://www.youtube.com/watch?v=5XHrjlunZ9A,https://cdn.snapi.dev/images/v1/m/q-2/thomas-siebel-we-will-not-do-business-in-china.jpg,Thomas Siebel: We will not do business in China,"Tom Siebel, chairman and CEO of C3 and founder of Siebel Systems, joins ""Squawk Alley"" to discuss ongoing trade talks between the U.S. and China, as well as data privacy.",CNBC Television,"Thu, 11 Apr 2019 13:15:50 -0400",,Positive,Video
https://feeds.marketwatch.com/~r/marketwatch/internet/~3/WkDhZq9nnAo/story.asp,https://cdn.snapi.dev/images/v1/m/w/mw-hh444-big-sh-20190411121831-zh.jpg,Outside the Box: The 5 market crashes I lived through and what I learned,Don’t get caught up in the panic.,Market Watch,"Thu, 11 Apr 2019 12:36:09 -0400",,Neutral,Article
https://www.youtube.com/watch?v=rSZlOyb2K44,https://cdn.snapi.dev/images/v1/m/q-2/gary-vaynerchuk-talks-talent-success-and-being-an-entrepreneur.jpg,"Gary Vaynerchuk talks talent, success and being an entrepreneur",Gary Vaynerchuk of Vaynermedia discusses being an entrepreneur on why talent is the key to success.,Yahoo Finance,"Thu, 11 Apr 2019 12:34:42 -0400",,Positive,Video
https://www.youtube.com/watch?v=LMzKvBWHPY4,https://cdn.snapi.dev/images/v1/m/q-2/why-this-investor-says-uber-is-just-getting-started.jpg,Why this investor says Uber is 'just getting started',"Angel investor Jason Calacanis joins ""Squawk Alley"" to look at Lyft's IPO success and the potential success for Uber's upcoming public debut.",CNBC Television,"Thu, 11 Apr 2019 12:19:24 -0400",,Neutral,Video
https://www.fool.com/investing/2019/04/11/can-marijuana-revive-the-restaurant-industry.aspx?source=iedfolrf0000001,https://cdn.snapi.dev/images/v1/u/r/urlhttps3a2f2fgfoolcdncom2feditorial2fimages2f5064602fmarijuana-muffins-getty.jpeg,Can Marijuana Revive the Restaurant Industry?,Alcoholic beverage sellers are pairing up with legal marijuana companies for a potentially big opportunity.,The Motley Fool,"Thu, 11 Apr 2019 12:16:00 -0400",cannabis,Neutral,Article
https://www.youtube.com/watch?v=GBCLHSJnpQc,https://cdn.snapi.dev/images/v1/m/q-2/china-offers-access-to-cloud-computing-but-is-it-a-trojan-horse.jpg,China offers access to cloud computing - but is it a trojan horse?,"Julie Hyman, Adam Shapiro and Andy Serwer of Yahoo Finance along with Paul Shatz of Heritage Capital discuss the latest news on China granting access to their cloud computing sector and the Untied States and China trade negotiations.",Yahoo Finance,"Thu, 11 Apr 2019 12:13:24 -0400",,Neutral,Video
https://www.youtube.com/watch?v=NNJ2n6XKmmA,https://cdn.snapi.dev/images/v1/m/q-2/inside-discord-the-gaming-chat-platform-thats-bigger-than-slack.jpg,Inside Discord - The Gaming Chat Platform That's Bigger Than Slack,"Discord, a free chat app designed for gamers, has been rapidly growing since it launched in 2015. According to the company, it has 250 million user accounts, about the same as Fortnite, plus 14 million daily active users, which is more than business chat-app Slack.",CNBC,"Thu, 11 Apr 2019 12:00:04 -0400",,Neutral,Video
https://www.youtube.com/watch?v=i6DxC6Bfxv0,https://cdn.snapi.dev/images/v1/m/q-2/how-banks-could-put-pressure-on-gun-retailers.jpg,How banks could put pressure on gun retailers,"The ""Squawk Box"" news team discusses some of the morning's most provocative headlines.",CNBC Television,"Thu, 11 Apr 2019 12:00:04 -0400",,Neutral,Video
https://www.forbes.com/sites/kathryntully/2019/04/11/phillips-ceo-collectors-not-art-businesses-have-profited-most-from-art-markets-growth/,https://cdn.snapi.dev/images/v1/0/x/0x600-53.jpg,"Phillips CEO: Collectors, Not Art Businesses, Have Profited Most From Art Market's Growth","“The people who have really made a great deal of money in the art market over the last few years are the people who put capital to work in it,” Phillips CEO, Edward Dolman, said in a speech this week.",Forbes,"Thu, 11 Apr 2019 11:57:00 -0400",CEO,Neutral,Article
https://www.cnbc.com/2019/04/11/why-billionaires-warren-buffett-and-bill-gates-agree-this-is-the-best-business-book-of-all-time.html,https://cdn.snapi.dev/images/v1/1/0/104795869-gettyimages-6328588141910x1000.jpg,Warren Buffett and Bill Gates agree this 1969 classic is still the No. 1 business book of all time—here's why,What truly makes this book so brilliant (apart from its wonderful prose) is that it can appeal to readers who aren't even interested in the world of Wall Street.,CNBC,"Thu, 11 Apr 2019 11:44:00 -0400",wbuffett,Positive,Article
https://www.cnbc.com/2019/04/11/ahead-of-ipo-buzz-robinhood-introduces-new-premium-trading-features.html,https://cdn.snapi.dev/images/v1/1/0/105200310-gettyimages-911805438600x400.jpg,"Ahead of IPO buzz, Robinhood introduces new premium trading features","Popular stock-trading app Robinhood, which has been disrupting Wall St. with its zero-fee transaction models, has rolled out a new suite of premium features to its Gold membership.",CNBC,"Thu, 11 Apr 2019 11:37:00 -0400",,Positive,Article
https://www.youtube.com/watch?v=vvqoH6VZAcE,https://cdn.snapi.dev/images/v1/m/q-2/warren-buffett-says-im-surprised-at-the-economy.jpg,"Warren Buffett says, 'I'm surprised at the economy'",Berkshire Hathaway CEO Warren Buffett sat down with Yahoo Finance Editor-in-Chief Andy Serwer to discuss the state of the U.S. economy.,Yahoo Finance,"Thu, 11 Apr 2019 11:29:34 -0400",wbuffett,Positive,Video
https://www.youtube.com/watch?v=chk2Slm8j6w,https://cdn.snapi.dev/images/v1/m/q-2/watch-cnbcs-full-interview-with-world-bank-president-david-malpass.jpg,Watch CNBC's full interview with World Bank president David Malpass,"World Bank president David Malpass joins CNBC's Sara Eisen for a First on CNBC interview to discuss the organization, what changes he would make and more.",CNBC Television,"Thu, 11 Apr 2019 11:21:03 -0400",,Neutral,Video
https://www.youtube.com/watch?v=PWBOyO7Dipc,https://cdn.snapi.dev/images/v1/m/q-2/julian-assanges-lawyers-deliver-remarks-after-court-appearance.jpg,Julian Assange's lawyers deliver remarks after court appearance,Julian Assange's lawyers made a statement to the press after Assange's appearance at Westminster Magistrates' Court. He has been found guilty of breaching his bail.,Fox Business,"Thu, 11 Apr 2019 11:15:36 -0400",,Neutral,Video
https://www.fool.com/investing/2019/04/11/how-stock-buybacks-work.aspx?source=iedfolrf0000001,https://cdn.snapi.dev/images/v1/u/r/urlhttps3a2f2fgfoolcdncom2feditorial2fimages2f5175712fstock-traders-looking-at-screens.jpg,How Stock Buybacks Work,"Dividends aren’t the only way companies can return capital to investors, and buybacks are an extremely important concept to understand.",The Motley Fool,"Thu, 11 Apr 2019 11:14:00 -0400",,Neutral,Article
https://www.youtube.com/watch?v=chW2z4icCKI,https://cdn.snapi.dev/images/v1/m/q-2/how-the-personal-finance-company-sofi-is-catering-to-millennials.jpg,How the personal finance company SoFi is catering to millennials,Millennial online lender SoFi is launching two new zero-fee exchange-traded funds. SoFi CEO Anthony Noto joins 'Squawk on the Street' to discuss the initiative.,CNBC Television,"Thu, 11 Apr 2019 11:12:43 -0400",,Positive,Video
https://www.youtube.com/watch?v=ks7VSe3veS0,https://cdn.snapi.dev/images/v1/m/q-2/world-bank-needs-to-be-very-effective-at-its-job-says-new-president-david-malpass.jpg,"World Bank needs to be very effective at its job, says new president David Malpass",World Bank president David Malpass sits down with CNBC's Sara Eisen to discuss what changes he might bring to the World Bank as president.,CNBC Television,"Thu, 11 Apr 2019 11:06:57 -0400",,Neutral,Video
https://feedproxy.google.com/~r/BusinessRss/~3/l3-_yl7iEXI/,https://cdn.snapi.dev/images/v1/m/o/mo9-3.jpg,This Company Is About To Make History With Moon Landing Today,"Nonprofit Israeli startup SpaceIL is poised to become the first private company to achieve a moon landing, which is expected Thursday.",Investors Business Daily,"Thu, 11 Apr 2019 11:03:59 -0400",,Positive,Article
https://www.youtube.com/watch?v=bqFzzultXGw,https://cdn.snapi.dev/images/v1/m/q-2/ape-racing-is-the-best-motorsport-youve-never-heard-of.jpg,Ape Racing Is The Best Motorsport You've Never Heard Of,"The Piaggio Ape is a tiny three-wheeled cargo vehicle popular throughout Italy. However, with a little mechanical work it makes an impressive race car, and is used in one of the most exciting up and coming motorsports.",Business Insider,"Thu, 11 Apr 2019 11:00:06 -0400",,Positive,Video
https://www.youtube.com/watch?v=rtuqtj-Ph94,https://cdn.snapi.dev/images/v1/m/q-2/calstrs-cio-challenges-ahead-for-uber-lyft.jpg,"CalSTRS CIO: Challenges Ahead for Uber, Lyft","In a Worldwide Exchange exclusive, CalSTRS Chief Investment Officer Christopher Ailman says companies like Uber and Lyft are facing questions from investors for good reason. Ailman also shares his investment outlook and discusses the state of U.S.",CNBC Television,"Thu, 11 Apr 2019 10:44:13 -0400",,Neutral,Video
https://www.youtube.com/watch?v=VKWhqjPI14I,https://cdn.snapi.dev/images/v1/m/q-2/larry-kudlow-white-house-sticking-by-herman-cain-as-fed-candidate.jpg,Larry Kudlow: White House sticking by Herman Cain as Fed candidate,White House adviser Larry Kudlow says the White House still wants Herman Cain to join the Federal Reserve.,Fox Business,"Thu, 11 Apr 2019 10:26:32 -0400",,Neutral,Video
https://www.youtube.com/watch?v=vM_H92ZjF0s,https://cdn.snapi.dev/images/v1/m/q-2/us-markets-open-higher-amid-better-than-expected-earnings.jpg,US markets open higher amid better than expected earnings,CNBC's Bob Pisani looks ahead at the day's market action.,CNBC Television,"Thu, 11 Apr 2019 10:14:55 -0400",earnings,Neutral,Video
https://feeds.benzinga.com/~r/benzinga/~3/NdUIE10VFC4/investors-manual-what-are-options,https://cdn.snapi.dev/images/v1/a/d/adult-3327336-1920-13.jpg,Investor's Manual: What Are Options?,"Options are contracts that give the owner (holder) the right to buy or sell an underlying asset, like a stock, at a certain price (the strike or exercise price) before a certain day (the expiration date).",Benzinga,"Thu, 11 Apr 2019 09:49:05 -0400",,Neutral,Article
https://www.youtube.com/watch?v=-dHjgaEuO14,https://cdn.snapi.dev/images/v1/m/q-2/us-weekly-jobless-claims-total-196000-vs-210000-expected.jpg,"US weekly jobless claims total 196,000, vs 210,000 expected","First-time claims for state unemployment benefits were expected to total 210,000 for the most recent week, up from 202,000 claims reported for the previous week.",CNBC Television,"Thu, 11 Apr 2019 09:40:26 -0400",,Positive,Video
https://www.youtube.com/watch?v=twhVy80ZDIk,https://cdn.snapi.dev/images/v1/m/q-2/calamos-ceo-koudounis-stresses-the-importance-of-managing-risk.jpg,Calamos CEO Koudounis Stresses the Importance of Managing Risk,"Apr.11 -- John Koudounis, chief executive officer at Calamos Investments, discusses his firm's current investment strategy, the importance of managing risk, and how banks have improved since the financial crisis. He speaks on ""Bloomberg Surveillance.",Bloomberg Markets and Finance,"Thu, 11 Apr 2019 09:28:20 -0400",CEO,Neutral,Video
https://www.cnbc.com/2019/04/11/us-charges-wikileaks-co-founder-julian-assange-with-conspiracy-to-commit-computer-hacking.html,https://cdn.snapi.dev/images/v1/1/0/105846058-1554987238781gettyimages-1136256458530x298.jpeg,US charges Wikileaks co-founder Julian Assange with conspiracy to commit computer hacking,"The announcement followed an extradition request by the U.S. for Assange, who was removed from the Ecuadorian embassy in London.",CNBC,"Thu, 11 Apr 2019 09:04:00 -0400",,Negative,Article
