news_url,image_url,title,text,source_name,date,topics,sentiment,type
https://www.benzinga.com/news/20/02/15400844/china-japan-stocks-edge-lower-as-coronavirus-fears-continue-south-korea-recoups,https://cdn.snapi.dev/images/v1/t/v/blur-1853262-1280-7.jpg,"China, Japan Stocks Edge Lower As Coronavirus Fears Continue, South Korea Recoups",Markets in China and Japan edged lower in early trade on Tuesday as fears over the international spread of the novel coronavirus (COVID-19) continued.,Benzinga,"Mon, 24 Feb 2020 23:35:04 -0500",,Negative,Article
https://www.cnn.com/2020/02/24/investing/asian-market-latest/index.html,https://cdn.snapi.dev/images/v1/2/0/200224201024-tokyo-stock-exchange-file-restricted-super-169.jpg,Global markets are still getting hammered by the coronavirus outbreak,Fears about the novel coronavirus outbreak are still roiling global markets Tuesday.,CNN Business,"Mon, 24 Feb 2020 22:22:17 -0500",,Negative,Article
https://www.youtube.com/watch?v=e6BTXBUtS8c,https://cdn.snapi.dev/images/v1/n/h/kocherlakota-makes-the-case-for-an-immediate-fed-rate-cut.jpg,Kocherlakota Makes the Case for an Immediate Fed Rate Cut,"Feb.24 -- Former Federal Reserve Bank of Minneapolis President Narayana Kocherlakota, a Bloomberg Opinion columnist, argues that the Fed shouldn't wait to cut rates amid the current economic ""shock"" caused by the coronavirus outbreak.",Bloomberg Markets and Finance,"Mon, 24 Feb 2020 22:21:17 -0500",,Neutral,Video
https://www.reuters.com/article/us-global-markets/asian-shares-try-to-stabilize-as-sp-futures-bounce-idUSKCN20I2N2,https://cdn.snapi.dev/images/v1/m/0/m02d20200225t2i1494768868rlynxnpeg1o00kw640.jpg,Asian shares try to stabilize as S&P futures bounce,"Asian share markets were trying to stabilize on Tuesday after a wave of early selling petered out and Wall Street futures managed a solid bounce, allowing investors to take a break from coronavirus fears.",Reuters,"Mon, 24 Feb 2020 21:12:44 -0500",,Positive,Article
https://www.youtube.com/watch?v=uJtSIAnVLE8,https://cdn.snapi.dev/images/v1/6/e/10-year-treasury-yield-hits-lowest-since-2016.jpg,10-year Treasury yield hits lowest since 2016,The 10-year Treasury yield is falling to its lowest level since 2016 amid coronavirus concerns.,Yahoo Finance,"Mon, 24 Feb 2020 19:52:28 -0500",,Negative,Video
https://www.youtube.com/watch?v=TxMakiDcid8,https://cdn.snapi.dev/images/v1/m/q/coronavirus-fears-hit-markets-as-stocks-plummet-1000-points.jpg,Coronavirus fears hit markets as stocks plummet 1000 points,"The rapid spread of coronavirus outside of Asia sent a chill through markets on Monday, and plunged both the Dow and S&P 500 to their worst days in two years.",Yahoo Finance,"Mon, 24 Feb 2020 19:18:58 -0500",,Negative,Video
https://www.forbes.com/sites/ellenrwald/2020/02/24/oil-markets-plunge-on-coronavirus-fears-but-will-the-sell-off-continue/,https://cdn.snapi.dev/images/v1/r/k/oil-markets-plunge-on-coronavirus-fears-but-will-the-sell-off-continue.jpg,"Oil Markets Plunge On Coronavirus Fears, But Will The Sell-Off Continue?",Coronavirus fears are again sweeping markets and oil is no exception.,Forbes,"Mon, 24 Feb 2020 19:08:40 -0500",oil,Negative,Article
https://www.youtube.com/watch?v=7zbPMNxkdps,https://cdn.snapi.dev/images/v1/x/t/tech-market-is-fragile-to-a-setback-like-coronavirus-says-mcnamee.jpg,"Tech Market Is Fragile to a Setback Like Coronavirus,  Says McNamee","Feb.24 -- Roger McNamee, Elevation Partners co-founder and author of 'Zucked', discusses the coronavirus impact on tech and election security on ""Bloomberg Markets.",Bloomberg Technology,"Mon, 24 Feb 2020 19:07:03 -0500",,Negative,Video
https://www.cnn.com/2020/02/24/investing/coronavirus-outlook-companies/index.html,https://cdn.snapi.dev/images/v1/2/0/200224164834-united-airlines-new-livery-super-169.jpg,Major American companies are reeling from coronavirus,A growing number of major American companies are saying coronavirus is hurting their business.,CNN Business,"Mon, 24 Feb 2020 19:06:36 -0500",,Negative,Article
https://www.youtube.com/watch?v=e77vW7LsciI,https://cdn.snapi.dev/images/v1/m/q/five-things-investors-must-consider-after-a-major-sell-off-according-to-jim-cramer.jpg,"Five things investors must consider after a major sell-off, according to Jim Cramer","""If you want to buy stocks into weakness, take your time,"" CNBC's Jim Cramer says.",CNBC Television,"Mon, 24 Feb 2020 19:05:20 -0500","cramer,madmoney",Neutral,Video
https://www.youtube.com/watch?v=sET7qHSJsww,https://cdn.snapi.dev/images/v1/1/j/jim-cramers-stand-out-sectors-after-market-tanks-on-coronavirus-outbreak.jpg,Jim Cramer's stand out sectors after market tanks on coronavirus outbreak,"""If you want to buy stocks into weakness, take your time,"" CNBC's Jim Cramer says.",CNBC Television,"Mon, 24 Feb 2020 19:04:10 -0500","cramer,madmoney",Positive,Video
https://nypost.com/2020/02/24/heres-why-the-stock-market-sunk-1000-points-today/,https://cdn.snapi.dev/images/v1/t/n/200224-coronavirus-stocksjpgquality90stripall.jpg,"Here’s why the stock market sunk 1,000 points today","To understand why there was a huge decline in the stock market on Monday, you have to understand what happened last week. News that the coronavirus was spreading was hardly a secret a week ago.",New York Post,"Mon, 24 Feb 2020 18:56:02 -0500",,Negative,Article
https://www.forbes.com/sites/johnnavin/2020/02/24/stock-market-sell-off-were-any-uptrend-lines-broken-on-big-names/,https://cdn.snapi.dev/images/v1/o/w/stock-market-sell-off-were-any-uptrend-lines-broken-on-big-names.jpg,Stock Market Sell Off: Were Any Uptrend Lines Broken On Big Names?,"The big one is Microsoft, often thought to be the Godzilla of stocks, a tech name so big and perfect that no one could dare to put in a sell ticket.",Forbes,"Mon, 24 Feb 2020 18:47:51 -0500",,Neutral,Article
https://nypost.com/2020/02/24/dow-ends-down-3-5-on-coronavirus-fears-worst-drop-in-two-years/,https://cdn.snapi.dev/images/v1/d/o/dow-coronajpgquality90stripall.jpg,"Dow ends down 3.5% on coronavirus fears, worst drop in two years","The Dow dropped more than 1,000 points — its worst single-day point drop in two years — as the coronavirus epidemic spread beyond China and world leaders warned it could dampen global economic growth. The Dow Jones industrial average on Monday ended the day down 1,031.40 points, or 3.56 percent, to 27,960.80 as the virus’s.",New York Post,"Mon, 24 Feb 2020 18:45:58 -0500",,Negative,Article
https://www.seeitmarket.com/what-price-levels-does-the-stock-market-have-to-hold/,https://cdn.snapi.dev/images/v1/n/h/etf31.jpg,What Price Levels Does the Stock Market Have to Hold?,"Now that many stock market bulls got bit by the vampire bear early on, the question for tomorrow and beyond is whether those bulls can rescind the vampire bear’s invitation. As we explored over the weekend, humans can rescind their invitations to vampires, which causes the vampires to immediately leave the house.",See It Market,"Mon, 24 Feb 2020 18:37:10 -0500",,Neutral,Article
https://www.forbes.com/sites/waynerash/2020/02/24/coronavirus-disinformation-may-have-contributed-to-market-drop/,https://cdn.snapi.dev/images/v1/u/9/coronavirus-disinformation-may-have-contributed-to-market-drop.jpg,Coronavirus Disinformation May Have Contributed To Market Drop,Financial markets are particularly susceptible to disinformation driven manipulation,Forbes,"Mon, 24 Feb 2020 18:35:26 -0500",,Negative,Article
https://www.youtube.com/watch?v=WKbnovqyIsg,https://cdn.snapi.dev/images/v1/m/q/cornerstone-macros-carter-worth-charts-todays-market-carnage.jpg,Cornerstone Macro's Carter Worth charts today's market carnage,"Cornerstone Macro's Carter Worth tries to make sense of what happened today. With CNBC's Brian Sullivan and the Fast Money traders, Steve Grasso, Brian Kelly, Karen Finerman and Guy Adami.",CNBC Television,"Mon, 24 Feb 2020 18:27:41 -0500",tanalysis,Negative,Video
https://www.youtube.com/watch?v=1x_907Bk1dc,https://cdn.snapi.dev/images/v1/m/q/people-should-rejoice-at-the-dow-dip-says-suze-orman.jpg,"People should 'rejoice' at the Dow dip, says Suze Orman",Personal finance expert Suze Orman joins 'Closing Bell' to discuss why a dip in the market benefits your retirement savings.,CNBC Television,"Mon, 24 Feb 2020 18:15:59 -0500",,Positive,Video
https://www.reuters.com/article/us-usa-fed-mester/feds-mester-sees-u-s-economy-performing-well-coronavirus-a-big-risk-idUSKCN20I2C2,https://cdn.snapi.dev/images/v1/y/a/m02d20200224t2i1494746211rlynxnpeg1n204w640.jpg,"Fed's Mester sees U.S. economy performing well, coronavirus a 'big risk'","The U.S. economy should continue to perform well this year and monetary policy is currently well positioned despite the risk posed by the coronavirus outbreak, Cleveland Fed President Loretta Mester said on Monday, as Wall Street stocks tumbled on worries the spread of the virus to multiple countries outside China could pose an escalating threat to global growth.",Reuters,"Mon, 24 Feb 2020 18:10:46 -0500",,Positive,Article
https://www.youtube.com/watch?v=eC_clrrWmiQ,https://cdn.snapi.dev/images/v1/m/q/nyse-president-stacey-cunningham-on-market-plunge.jpg,NYSE President Stacey Cunningham on market plunge,NYSE President Stacey Cunningham joins CNBC's 'Closing Bell' to discuss the significance of the market plunge.,CNBC Television,"Mon, 24 Feb 2020 18:09:26 -0500",,Neutral,Video
https://www.cnbc.com/2020/02/24/stock-futures-are-flat-in-overnight-trading-following-the-dows-1000-point-rout.html,https://cdn.snapi.dev/images/v1/b/z/106367132-1580487252387rts2yece.jpg,"Stock futures are flat in overnight trading following the Dow's 1,000 point rout",Investors fled the stock market rapidly in Monday's session as a surge in coronavirus cases outside of China intensified fears of a prolonged global economic slowdown.,CNBC,"Mon, 24 Feb 2020 18:04:29 -0500",,Neutral,Article
https://www.reuters.com/article/us-china-health-stocks/coronavirus-sparks-deepest-sp-500-drop-since-early-2018-idUSKCN20I2KL,https://cdn.snapi.dev/images/v1/r/u/m02d20200224t2i1494743961rlynxnpeg1n24uw640.jpg,Coronavirus sparks deepest S&P 500 drop since early 2018,The S&P 500 suffered its worst day in two years on Monday as a surge in coronavirus cases outside China rattled investors already worried about valuations following recent record highs.,Reuters,"Mon, 24 Feb 2020 18:02:30 -0500",,Negative,Article
https://www.youtube.com/watch?v=mBCc5t-bF-o,https://cdn.snapi.dev/images/v1/a/r/market-melts-down-over-coronavirus-fears.jpg,Market melts down over coronavirus fears,"The stock market melts down due to fears the coronavirus is spreading, as new cases crop up in Italy and Iran.",CNBC Television,"Mon, 24 Feb 2020 17:57:53 -0500",,Negative,Video
https://www.cnbc.com/2020/02/24/heres-why-the-coronavirus-market-sell-off-is-happening-now.html,https://cdn.snapi.dev/images/v1/2/s/106402987-1582296778402rts30bqf.jpg,Here's why the coronavirus market sell-off is happening now,Technical trading and the rise of Bernie Sanders appeared to help fuel Monday's pullback.,CNBC,"Mon, 24 Feb 2020 17:57:32 -0500",,Negative,Article
https://www.forbes.com/sites/johntobey/2020/02/24/coronavirus-just-destroyed-growth-stock-investing/,https://cdn.snapi.dev/images/v1/a/a/coronavirus-just-destroyed-growth-stock-investing.jpg,Coronavirus Just Destroyed Growth Stock Investing,This sets up a major change from growth-to-value or bull-to-bear,Forbes,"Mon, 24 Feb 2020 17:47:51 -0500",,Negative,Article
https://www.youtube.com/watch?v=HvK4aEaLW1g,https://cdn.snapi.dev/images/v1/m/q/warren-buffett-on-coronavirus-fears-i-wont-be-selling-stocks.jpg,Warren Buffett on coronavirus fears: I won’t be selling stocks,Berkshire Hathaway CEO Warren Buffett isn't panicking about the impact of the coronavirus on markets in the long-term.,Yahoo Finance,"Mon, 24 Feb 2020 17:47:12 -0500",wbuffett,Positive,Video
https://www.gurufocus.com/news/1049478/us-indexes-close-lower-monday-as-coronavirus-spreads,https://cdn.snapi.dev/images/v1/s/t/iush25-1.jpg,US Indexes Close Lower Monday as Coronavirus Spreads (Feb 24),"The Dow Jones Industrial Average closed at 27,960.80 on Monday with a loss of 1,031.61 points or -3.56%.",GuruFocus,"Mon, 24 Feb 2020 17:41:59 -0500",,Negative,Article
https://www.forbes.com/sites/jjkinahan/2020/02/24/fear-of-the-unknown-stocks-plunge-amid-worst-day-in-two-years-as-virus-spreads/,https://cdn.snapi.dev/images/v1/f/e/fear-of-the-unknown-stocks-plunge-amid-worst-day-in-two-years-as-virus-spreads.jpg,Fear Of The Unknown: Stocks Plunge Amid Worst Day In Two Years As Virus Spreads,"Volatility and investor concern isn’t likely to be a one-day affair. This could last a few sessions, especially because people are concerned about the impact on Q1 earnings and might see a need to bring stock prices down to match new projections.",Forbes,"Mon, 24 Feb 2020 17:12:29 -0500",,Negative,Article
https://www.youtube.com/watch?v=D4iYbdLF7Ec,https://cdn.snapi.dev/images/v1/y/n/not-expecting-recession-this-year-greenwich-wealth-managements-janjigian.jpg,Not expecting recession this year: Greenwich Wealth Management's Janjigian,"Peter Boockvar, Bleakley Advisory Group; Vahan Janjigian, Greenwich Wealth Management; and Fred Kempe, Atlantic Council CEO, join 'The Exchange' to discuss the state of the markets amid the coronavirus outbreak.",CNBC Television,"Mon, 24 Feb 2020 17:11:48 -0500",,Positive,Video
https://www.youtube.com/watch?v=QzB9DqpV_3c,https://cdn.snapi.dev/images/v1/m/q/oil-copper-prices-fall-amid-coronavirus-fears.jpg,"Oil, copper prices fall amid coronavirus fears","Jim Iuorio, TJM Institutional Services managing director, joins 'The Exchange' to discuss the market sell-off and if commodities are seeing a hit.",CNBC Television,"Mon, 24 Feb 2020 17:11:39 -0500",oil,Negative,Video
https://www.youtube.com/watch?v=aRXrb6psNl0,https://cdn.snapi.dev/images/v1/l/q/could-be-approaching-end-of-coronavirus-market-sell-off-strategist.jpg,Could be approaching end of coronavirus market sell-off: Strategist,"Katie Stockton, Fairlead Strategies founder and managing partner, joins 'The Exchange' to discuss technicals amid the coronavirus outbreak.",CNBC Television,"Mon, 24 Feb 2020 17:11:36 -0500",,Neutral,Video
https://www.cnbc.com/2020/02/24/turnaround-tuesday-stocks-tend-to-bounce-back-quickly-from-market-drops-like-this-one.html,https://cdn.snapi.dev/images/v1/1/0/102699730-rtx1dz4e.jpg,Turnaround Tuesday? Stocks tend to bounce back quickly from market drops like this one,"The major averages slid more than 3% on Monday, but if history is any indication, Tuesday could bring a relief rally.",CNBC,"Mon, 24 Feb 2020 17:07:01 -0500",,Positive,Article
https://www.youtube.com/watch?v=sK_Ha5CArsk,https://cdn.snapi.dev/images/v1/x/r/market-move-is-a-natural-reaction-to-coronavirus-outbreak-wells-fargos-paul-christopher.jpg,Market move is a natural reaction to coronavirus outbreak: Wells Fargo's Paul Christopher,"Paul Christopher, Wells Fargo Investment Institute, and Richard Weiss, American Century Investments, join 'The Exchange' to discuss the state of the markets and how investors should be positioned during current conditions.",CNBC Television,"Mon, 24 Feb 2020 17:01:03 -0500",,Neutral,Video
https://www.youtube.com/watch?v=6e12c7hyeKk,https://cdn.snapi.dev/images/v1/m/q/travel-energy-related-businesses-can-be-impacted-by-coronavirus-blackstones-gray.jpg,"Travel, energy-related businesses can be impacted by coronavirus: Blackstone's Gray","Jonathan Gray, president and COO of Blackstone Group, joins 'Closing Bell' to talk about the stock plunge due to the coronavirus.",CNBC Television,"Mon, 24 Feb 2020 17:00:25 -0500",,Negative,Video
https://www.marketwatch.com/story/trump-says-coronavirus-under-control-in-us-and-stocks-look-attractive-2020-02-24,https://cdn.snapi.dev/images/v1/1/0/191121101804-nyse-1113-powell-super-169.jpg,Trump says coronavirus under control in U.S. and stocks look attractive,"The coronavirus is ""very much under control"" in the U.S., President Donald Trump said in a tweet on Monday after the stock market's SPX, -3.35% close.",Market Watch,"Mon, 24 Feb 2020 16:57:54 -0500",,Neutral,Article
https://www.youtube.com/watch?v=dkko_Bc78LE,https://cdn.snapi.dev/images/v1/m/q/gold-jumps-to-its-highest-level-in-7-years.jpg,Gold jumps to its highest level in 7 years,"Investors are turning to safe-haven amid coronavirus concerns, with gold jumping to its highest level in 7 years. Yahoo Finance’s Jared Blikre joins Seana Smith to discuss on The Ticker. #Gold #stocks #market",Yahoo Finance,"Mon, 24 Feb 2020 16:54:44 -0500",gold,Positive,Video
https://www.youtube.com/watch?v=l7yyrj3OxUs,https://cdn.snapi.dev/images/v1/m/q/oil-expert-were-looking-at-a-worst-case-scenario-of-41-a-barrel-by-first-half-of-2020.jpg,Oil expert: We’re looking at a worst-case scenario of $41 a barrel by first half of 2020,Oil prices are tumbling as the coronavirus stokes concerns over demand.,Yahoo Finance,"Mon, 24 Feb 2020 16:54:22 -0500",oil,Negative,Video
https://www.youtube.com/watch?v=AOBu0Zl6BD8,https://cdn.snapi.dev/images/v1/m/q/anastasia-amorosos-last-chance-trade-pick-small-caps.jpg,Anastasia Amoroso's Last Chance Trade pick: Small Caps,"Anastasia Amoroso, global investment strategist at J.P. Morgan Private Bank, explains why she chose small caps as her Last Chance Trade on 'Closing Bell.'",CNBC Television,"Mon, 24 Feb 2020 16:46:19 -0500",,Neutral,Video
https://www.youtube.com/watch?v=LeX8GAbQUHA,https://cdn.snapi.dev/images/v1/m/q/jim-cramer-on-plunge-not-too-late-to-sell-if-you-dont-have-any-cash.jpg,Jim Cramer on plunge: Not too late to sell if you don't have any cash,Jim Cramer joins 'Closing Bell' to discuss the market plunge and the impact of the coronavirus.,CNBC Television,"Mon, 24 Feb 2020 16:46:08 -0500","cramer,madmoney",Negative,Video
https://www.cnbc.com/2020/02/24/what-happened-to-the-stock-market-monday-stocks-plunge-coronavirus-cases-grow-outside-of-china.html,https://cdn.snapi.dev/images/v1/o/v/106221889-1572876496004gettyimages-1173177616.jpeg,Here's what happened to the stock market on Monday (Feb 24),A jump in coronavirus cases outside of China spooked investors out of stocks in favor of bonds and gold.,CNBC,"Mon, 24 Feb 2020 16:35:53 -0500",,Negative,Article
https://investorplace.com/2020/02/stock-market-today-coronavirus-sparks-1000-point-dow-fall/,https://cdn.snapi.dev/images/v1/5/y/m02d20191126t2i1457022131rlynxmpefap1e4w640.jpg,"Stock Market Today: Coronavirus Sparks 1,000-Point Dow Fall","At one point, the Dow Jones slid 1,000 and the Nasdaq was down more than 4% thanks to the coronavirus. Here's the stock market today.",InvestorPlace,"Mon, 24 Feb 2020 16:35:34 -0500",,Negative,Article
https://investorplace.com/2020/02/dow-jones-today-monday-bloody-monday/,https://cdn.snapi.dev/images/v1/b/t/dowjones1600b-768x432.jpg,"Dow Jones Today: Monday, Bloody Monday","It was the worst day for the S&P 500 in two years and the Dow Jones was included in the blood bath today as well.
The post Dow Jones Today: Monday, Bloody Monday appeared first on InvestorPlace.",InvestorPlace,"Mon, 24 Feb 2020 16:31:40 -0500",,Negative,Article
https://www.cnbc.com/2020/02/24/stock-market-outlook-for-tuesday-coronavirus-updates-earnings-consumer-confidence.html,https://cdn.snapi.dev/images/v1/1/0/105393937-1534187710944gettyimages-958426156.jpeg,"Coronavirus update, earnings, consumer confidence: 3 things to watch for in the markets on Tuesday","We'll get updates on the coronavirus, earnings from Home Depot and Salesforce, and a reading on consumer confidence on Tuesday.",CNBC,"Mon, 24 Feb 2020 16:28:15 -0500",earnings,Neutral,Article
https://www.youtube.com/watch?v=swy0rh_FVQE,https://cdn.snapi.dev/images/v1/m/6/stocks-sink-dow-drops-as-much-as-1000-points.jpg,"Stocks Sink: Dow Drops as Much as 1,000 Points",Feb.24 -- Fear over the coronavirus grip markets around the globe.,Bloomberg Markets and Finance,"Mon, 24 Feb 2020 16:24:49 -0500",,Negative,Video
https://www.marketwatch.com/story/dow-ends-more-than-1000-points-lower-as-fears-over-virus-spark-equity-rout-2020-02-24,https://cdn.snapi.dev/images/v1/1/0/106403576-1582316643611gettyimages-483121702.jpeg,"Dow ends more than 1,000 points lower as fears over virus spark equity rout","Stocks ended sharply lower Monday, with the Dow Jones Industrial Average and S&P 500 giving up their gains for the year as investors dumped global equities and other assets perceived as risky amid worries over the spread of COVID-19 outside of China. The Dow Jones Industrial Average ended around 1,031 points lower, a drop of 3.6%,near 27,961, according to preliminary figures, leaving the blue-chip gauge down 2% for the year to date.",Market Watch,"Mon, 24 Feb 2020 16:07:45 -0500",,Negative,Article
https://www.reuters.com/article/us-usa-stocks/wall-street-clobbered-as-pandemic-fears-rattle-markets-idUSKCN20I1GD,https://cdn.snapi.dev/images/v1/s/t/stocks111-14.jpg,Wall Street clobbered as pandemic fears rattle markets,Wall Street's three major stock indexes tumbled on Monday as investors looked for safety on intensifying fears about the  global economic impact of the coronavirus after a surge in cases outside China fanned worries about a pandemic.,Reuters,"Mon, 24 Feb 2020 16:05:45 -0500",,Negative,Article
https://www.youtube.com/watch?v=_SA14Gdz3xM,https://cdn.snapi.dev/images/v1/m/q/companies-unsure-how-long-coronavirus-will-impact-business-expert.jpg,Companies unsure how long coronavirus will impact business: Expert,"Liz Ann Sonders, chief investment strategist and senior vice president at Charles Schwab joins 'Closing Bell' to discuss the impact of the coronavirus on markets.",CNBC Television,"Mon, 24 Feb 2020 16:05:07 -0500",,Negative,Video
https://www.youtube.com/watch?v=bwIfG6vBUx4,https://cdn.snapi.dev/images/v1/m/q/chamber-of-commerce-ceo-tom-donohue-on-the-coronavirus-sell-off.jpg,Chamber of Commerce CEO Tom Donohue on the coronavirus sell-off,"Tom Donohue, CEO of the U.S. Chamber of Commerce, joins ""Closing Bell"" to discuss the state of the economy and business amid the coronavirus outbreak.",CNBC Television,"Mon, 24 Feb 2020 16:02:37 -0500",CEO,Neutral,Video
https://www.youtube.com/watch?v=BlfFNmzqEKE,https://cdn.snapi.dev/images/v1/m/q/how-home-refinancing-has-stagnated-the-housing-market.jpg,How home refinancing has stagnated the housing market,"CNBC's Diana Olick explains how homeowners have decided to stay in their homes after refinancing, leading to less inventory and a weaker housing market.",CNBC Television,"Mon, 24 Feb 2020 15:33:13 -0500",,Negative,Video
https://www.cnbc.com/2020/02/24/coronavirus-fears-slam-stockswhat-investors-should-watch.html,https://cdn.snapi.dev/images/v1/1/0/106397851-1582115106367gettyimages-1201764744.jpeg,Coronavirus fears slam stocks—what investors should watch now,"Coronavirus chaos reigned over global markets on Monday, but commentators weren't running for the hills just yet.",CNBC,"Mon, 24 Feb 2020 15:33:00 -0500",,Negative,Article
