news_url,image_url,title,text,source_name,date,topics,sentiment,type
https://www.youtube.com/watch?v=g-UIV8NHDhE,https://cdn.snapi.dev/images/v1/m/q/rough-week-for-stocks.jpg,Rough week for stocks,A look back at a really bad week for the markets.,CNBC Television,"Fri, 28 Feb 2020 20:59:40 -0500",,Negative,Video
https://www.youtube.com/watch?v=-Glm0NRXd6g,https://cdn.snapi.dev/images/v1/m/q/looking-ahead-to-next-week.jpg,Looking ahead to next week,"Ron Insana, sr. advisor to Schroders North America, and Michael Farr, Farr, Miller & Washington, discuss what investors should look for going into next week.",CNBC Television,"Fri, 28 Feb 2020 20:53:03 -0500",,Neutral,Video
https://www.youtube.com/watch?v=qjMMFVbWSk8,https://cdn.snapi.dev/images/v1/4/k/hannon-armstrong-ceo-wall-street-needs-more-climate-change-action.jpg,Hannon Armstrong CEO: Wall Street needs more climate-change action,Hannon Armonstrong CEO Jeffrey Eckel explains to CNBC's Jim Cramer the three steps Wall Street can take to demonstrate it's serious about climate change.,CNBC Television,"Fri, 28 Feb 2020 20:07:58 -0500",CEO,Neutral,Video
https://www.youtube.com/watch?v=St45SfKrCH8,https://cdn.snapi.dev/images/v1/m/q/is-it-still-too-early-to-buy-market-experts-weigh-in.jpg,Is it still too early to buy? Market experts weigh in,"Michael Farr, Farr, Miller and Washington, and Maneesh Deshpande, Barclays, discuss whether it's still too early to buy stocks.",CNBC Television,"Fri, 28 Feb 2020 20:04:41 -0500",,Neutral,Video
https://www.reuters.com/article/us-china-health-banks/wall-street-in-coronavirus-contingency-mode-with-staff-visitors-regulators-idUSKCN20N01A,https://cdn.snapi.dev/images/v1/b/o/m02d20200229t2i1496746479rlynxnpeg1s017w640.jpg,"Wall Street in coronavirus contingency mode with staff, visitors, regulators","Big U.S. banks have been rolling out contingency plans to respond to the global coronavirus outbreak - requiring some staff to work from home, implementing travel restrictions, and talking to regulators about potential stresses.",Reuters,"Fri, 28 Feb 2020 20:02:00 -0500",,Negative,Article
https://www.youtube.com/watch?v=tletjruEOJY,https://cdn.snapi.dev/images/v1/s/g/morgan-stanley-lays-out-3-possible-covid-19-scenarios-for-the-market.jpg,Morgan Stanley lays out 3 possible Covid-19 scenarios for the market,"Morgan Stanley is weighing in on the economic impact of the coronavirus outbreak, detailing the three possible scenarios investors should prepare for.",Yahoo Finance,"Fri, 28 Feb 2020 19:57:37 -0500",,Neutral,Video
https://www.nytimes.com/2020/02/28/business/economy/coronavirus-economy.html,https://cdn.snapi.dev/images/v1/f/l/merlin-169708329-f05120ad-38b0-403a-8d56-40a7807ee4b1-articlelargejpgquality75autowebpdisableupscale.jpg,Coronavirus Fears Reverberate Across Global Economy,"The stock market had its worst week since 2008, signaling that one of the longest expansions in history could be ending. Policymakers said they were ready to act.",NYTimes,"Fri, 28 Feb 2020 19:49:33 -0500",paywall,Negative,Article
https://www.youtube.com/watch?v=dNixt22qIHI,https://cdn.snapi.dev/images/v1/m/q/buy-stocks-slowly-were-getting-closer-to-a-bottom-jim-cramer-says.jpg,"Buy stocks slowly — 'we're getting closer to a bottom,' Jim Cramer says","""I'm urging you to have a lot of cash on the sidelines and put money to work gradually 'cause there may be more bad [coronavirus] stories"" next week, the ""Mad Money"" host said.",CNBC Television,"Fri, 28 Feb 2020 19:49:21 -0500",cramer,Positive,Video
https://www.youtube.com/watch?v=KR6kKmMN5o0,https://cdn.snapi.dev/images/v1/z/0/fed-chair-powell-coronavirus-poses-evolving-risks-to-economic-activity.jpg,Fed Chair Powell: Coronavirus poses evolving risks to economic activity,"Yahoo Finance’s Brian Cheung joins Seana Smith on The Ticker to discuss Federal Reserve Chair Jerome Powell’s statement on the spread of the coronavirus, monetary policy and the economy.",Yahoo Finance,"Fri, 28 Feb 2020 19:40:12 -0500",,Negative,Video
https://www.youtube.com/watch?v=EXEjzBJgYzU,https://cdn.snapi.dev/images/v1/u/z/the-market-and-coronavirus-take-center-stage.jpg,The market and coronavirus take center stage,CNBC's Eamon Javers reports from Washington on the Trump administration's efforts to combat the spread of the coronavirus.,CNBC Television,"Fri, 28 Feb 2020 19:33:50 -0500",,Negative,Video
https://www.youtube.com/watch?v=HSZUqMSz5sc,https://cdn.snapi.dev/images/v1/m/q/cramers-week-ahead-get-ready-for-another-rough-day-on-monday.jpg,Cramer's week ahead: 'Get ready for another rough day on Monday',CNBC's Jim Cramer gave a preview of the corporate earnings and economic data he has circled on his calendar next week.,CNBC Television,"Fri, 28 Feb 2020 19:28:29 -0500",cramer,Negative,Video
https://www.cnbc.com/2020/02/28/hannon-armstrong-ceo-says-wall-street-needs-more-climate-change-action.html,https://cdn.snapi.dev/images/v1/p/f/106416707-1582926535576eckel-jeff-mm-200228-005.jpg,"Three things Wall Street can do to show it's serious about climate change, according to green investor","""Our investment thesis is based in statistics, physics and economics,"" Hannon Armstrong CEO Jeffrey Eckel said.",CNBC,"Fri, 28 Feb 2020 19:24:04 -0500",,Neutral,Article
https://www.youtube.com/watch?v=T45zT4MRqtc,https://cdn.snapi.dev/images/v1/l/6/jim-cramer-bond-market-is-warning-the-coronavirus-is-worse-than-most-realize.jpg,Jim Cramer: Bond market is warning the coronavirus is worse than most realize,CNBC's Jim Cramer recapped a tough week of trading on Wall Street.,CNBC Television,"Fri, 28 Feb 2020 19:09:19 -0500",cramer,Negative,Video
https://www.youtube.com/watch?v=vyR6ghR6iro,https://cdn.snapi.dev/images/v1/e/o/fed-has-more-ammunition-than-the-ecb-boj-bofa-head-of-us-economics.jpg,"Fed has More Ammunition than the ECB, BOJ: BofA Head of U.S. Economics",Feb.28 -- BofA Head of U.S.,Bloomberg Markets and Finance,"Fri, 28 Feb 2020 19:08:19 -0500",,Neutral,Video
https://www.youtube.com/watch?v=ScuqPOHDkC8,https://cdn.snapi.dev/images/v1/c/y/uncertainty-surrounding-coronavirus-similar-to-category-6-hurricane-loews-ceo.jpg,Uncertainty Surrounding Coronavirus Similar to Category 6 Hurricane: Loews CEO,"Michelle Meyer, BofA Securities Head of U.S. Economics and Jim Tisch, Loews President & CEO discuss the impact of the spread of coronavirus on both the corporate world and the global economy. They spoke with David Westin on ""Bloomberg Wall Street Week.""",Bloomberg Markets and Finance,"Fri, 28 Feb 2020 19:02:51 -0500",CEO,Negative,Video
https://www.youtube.com/watch?v=y4hl6SOwzi4,https://cdn.snapi.dev/images/v1/n/3/wall-street-week-ahead-ism-manufacturing.jpg,Wall Street Week Ahead: ISM Manufacturing,"Feb.28 -- Michelle Meyer, BofA Securities Head of U.S.",Bloomberg Markets and Finance,"Fri, 28 Feb 2020 18:53:00 -0500",,Neutral,Video
https://www.forbes.com/sites/alejandrochafuen/2020/02/28/judy-shelton-would-be-a-great-addition-to-the-feds-board/,https://cdn.snapi.dev/images/v1/9/u/judy-shelton-would-be-a-great-addition-to-the-feds-board.jpg,Judy Shelton Would Be A Great Addition To The Fed’s Board,"We expected Dr. Shelton to be attacked by those who prefer government interference and the political manipulation of money, but she has also been attacked by those who do not want new ideas to challenge the cozy relationship between banks, the Fed and politicians.",Forbes,"Fri, 28 Feb 2020 18:34:19 -0500",,Positive,Article
https://www.cnbc.com/2020/02/28/the-dow-just-lost-12percent-in-one-week-heres-why-and-what-likely-happens-next.html,https://cdn.snapi.dev/images/v1/h/g/is-it-time-to-buy-emerging-markets-stocks-yes-says-ubs.jpg,The Dow just lost 12% in one week. Here's why and what likely happens next,"Stocks suffered a historic pullback this week as the coronavirus spread outside of China, spooking investors and traders out of equities.",CNBC,"Fri, 28 Feb 2020 18:28:17 -0500",,Negative,Article
https://www.youtube.com/watch?v=aHKaFesbivs,https://cdn.snapi.dev/images/v1/7/u/historic-week-on-wall-street-endsfinally.jpg,Historic week on Wall Street ends...finally,The S&P has its worse week since October 2008.,CNBC Television,"Fri, 28 Feb 2020 18:14:38 -0500",,Neutral,Video
https://www.youtube.com/watch?v=PyEmXD-i1kY,https://cdn.snapi.dev/images/v1/u/o/what-the-technicals-are-saying-about-oil-the-won-and-10-year-yield.jpg,"What the Technicals Are Saying About Oil, the Won and 10-Year Yield","Paul Ciana, Bank of America technical analyst, takes a look at some of the technicals behind oil prices, the South Korean won and the 10-year U.S. Treasury yield. He speaks with Bloomberg’s Abigail Doolittle on ""Bloomberg Market: The Close.""",Bloomberg Markets and Finance,"Fri, 28 Feb 2020 18:03:25 -0500","tanalysis,oil",Neutral,Video
https://www.youtube.com/watch?v=961r3CbXKtY,https://cdn.snapi.dev/images/v1/m/q/technician-lays-out-next-key-level-for-stocks-amid-sell-off.jpg,Technician lays out next key level for stocks amid sell-off,"Cornerstone Macro's Carter Worth on where we go from here. With CNBC's Brian Sullivan and the Fast Money traders, Tim Seymour, Steve Grasso, Dan Nathan and Guy Adami.",CNBC Television,"Fri, 28 Feb 2020 17:57:47 -0500",tanalysis,Negative,Video
https://www.cnbc.com/2020/02/28/traders-recap-scary-week-on-wall-street-and-see-more-wild-times-ahead.html,https://cdn.snapi.dev/images/v1/d/o/106410762-1582722220526rts33m2a.jpg,Traders recap scary week on Wall Street and see more wild times ahead,Traders on the floor of the New York Stock Exchange swapped stories all week about the extreme trading conditions they witnessed.,CNBC,"Fri, 28 Feb 2020 17:57:08 -0500",,Negative,Article
https://www.forbes.com/sites/juliejason/2020/02/28/what-every-worried-investor-needs-to-know-about-the-coronavirus-market/,https://cdn.snapi.dev/images/v1/t/z/what-every-worried-investor-needs-to-know-about-the-coronavirus-market.jpg,What Every Worried Investor Needs To Know About The Coronavirus Market,"Brought on by the Coronavirus, we’re now in correction territory, a broad market decline of over 10%, and that decline was fast and furious — over just 6 trading days.",Forbes,"Fri, 28 Feb 2020 17:48:40 -0500",,Negative,Article
https://www.reuters.com/article/us-global-markets/wall-street-bounce-too-little-too-late-as-world-stocks-post-shock-weekly-decline-idUSKCN20M001,https://cdn.snapi.dev/images/v1/y/q/m02d20200228t2i1496462206rlynxnpeg1r0phw640.jpg,"Wall Street bounce too little, too late as world stocks post shock weekly decline","Coronavirus panic sent world stock markets tumbling again on Friday, with an index of global stocks setting its largest weekly fall since the 2008 global financial crisis, and over $5 trillion wiped from global market value this week.",Reuters,"Fri, 28 Feb 2020 17:46:23 -0500",,Negative,Article
https://www.cnbc.com/2020/02/28/ubss-jason-katz-tells-investors-to-hold-stocks-take-a-deep-breath.html,https://cdn.snapi.dev/images/v1/w/t/106416536-1582921512798gettyimages-1203738074.jpeg,UBS's Jason Katz tells investors to hold their stocks and 'take a deep breath' this weekend,"""The best trade, at a minimum, is no trade,"" UBS senior portfolio manager Katz said.",CNBC,"Fri, 28 Feb 2020 17:43:14 -0500",,Positive,Article
https://www.marketwatch.com/story/tech-conferences-are-falling-as-fast-as-the-stock-market-2020-02-28,https://cdn.snapi.dev/images/v1/k/g/mw-ib168-tech-20200228153744-zhjpguuid2c7abe9e-5a6a-11ea-8382-9c8e992d421e.jpg,Tech conferences are falling as fast as the stock market,"Tech stocks aren’t the only things falling because of coronavirus fears — At least five tech conferences were canceled this week due to risks associated with COVID-19, and several more were hit with the loss of major participants.",Market Watch,"Fri, 28 Feb 2020 17:38:50 -0500",,Negative,Article
https://www.gurufocus.com/news/1058414/weitz-funds-market-perpective-perspectives-amid-coronavirus-uncertainty,https://cdn.snapi.dev/images/v1/s/h/rodo2111-1.jpg,Weitz Funds Market Perpective: Perspectives Amid Coronavirus Uncertainty,"In recent weeks, COVID-19, otherwise known as the coronavirus, has dominated headlines, and the outbreak seems to get scarier every day.",GuruFocus,"Fri, 28 Feb 2020 17:35:47 -0500",,Negative,Article
https://www.youtube.com/watch?v=2jCsdTT6WP4,https://cdn.snapi.dev/images/v1/x/c/there-is-deep-anxiety-and-fear-says-peter-tuchman-on-coronavirus-and-the-market-sell-off.jpg,"There is 'deep anxiety and fear,' says Peter Tuchman on coronavirus and the market sell off",Quattro Securities trader Peter Tuchman discusses what's behind the stock market sell-off.,Yahoo Finance,"Fri, 28 Feb 2020 17:34:43 -0500",,Negative,Video
https://www.seeitmarket.com/stock-market-volatility-challenges-investor-complacency/,https://cdn.snapi.dev/images/v1/5/i/etf35.jpg,Stock Market Volatility Challenges Investor Complacency,Key Stock Market Takeaways: – Cyclical rally challenged by deteriorating market breadth. – Investor sentiment shifts but pessimism slow to build.,See It Market,"Fri, 28 Feb 2020 17:29:59 -0500",,Negative,Article
https://www.cnn.com/2020/02/28/perspectives/coronavirus-federal-reserve-rate-cuts/index.html,https://cdn.snapi.dev/images/v1/x/i/200228110308-coronavirus-queens-ny-0227-super-169.jpg,Why this stock market sell-off is scarier than 2008,"Investors are in full-blown panic mode about the coronavirus. And while I hate to be the bearer of bad news, people shouldn't count on the Federal Reserve or other central banks to save the day.",CNN Business,"Fri, 28 Feb 2020 17:20:47 -0500",,Negative,Article
https://www.cnbc.com/2020/02/28/stock-rout-to-deepen-as-coronavirus-impact-starts-to-show-up-in-data.html,https://cdn.snapi.dev/images/v1/i/i/106359684-1580238017352gettyimages-1192656752.jpeg,Stock rout may deepen in the week ahead as coronavirus impact starts to show up in economic data,"The market might have more room to fall as the coronavirus damage starts to creep into upcoming economic data, analysts warned.",CNBC,"Fri, 28 Feb 2020 17:20:31 -0500",,Negative,Article
https://www.reuters.com/article/us-china-health-goldman-sachs-stocks/goldmans-asset-management-unit-ups-positions-in-hotel-cruise-line-stocks-idUSKCN20M3A6,https://cdn.snapi.dev/images/v1/1/l/m02d20200228t2i1496693082rlynxnpeg1r24cw640.jpg,"Goldman's asset management unit ups positions in hotel, cruise line stocks","Goldman Sachs Group Inc's  asset management unit has added to positions in travel stocks, including hotels and cruise lines, as well as Live Nation Entertainment Inc and Japanese cosmetics company Shiseido Co Ltd, executives said Friday.",Reuters,"Fri, 28 Feb 2020 17:07:25 -0500",,Neutral,Article
https://www.forbes.com/sites/sarahhansen/2020/02/28/10-numbers-that-show-how-hard-coronavirus-hit-the-stock-market-this-week/,https://cdn.snapi.dev/images/v1/z/4/10-numbers-that-show-how-hard-coronavirus-hit-the-stock-market-this-week.jpg,10 Numbers That Show How Hard Coronavirus Hit The Stock Market This Week,"Across the globe, markets lost a staggering $6 trillion in value this week.",Forbes,"Fri, 28 Feb 2020 17:06:29 -0500",,Negative,Article
https://www.youtube.com/watch?v=N_jnqRxMOXo,https://cdn.snapi.dev/images/v1/0/p/fed-will-cut-rates-50-basis-points-next-meeting-strategist-orlando-predicts.jpg,"Fed Will Cut Rates 50 Basis Points Next Meeting, Strategist Orlando Predicts","Feb.28 -- Phil Orlando, Federated Hermes chief equity market strategist, predicts the Federal Reserve will cut rates 50 basis points at their next meeting in March.",Bloomberg Markets and Finance,"Fri, 28 Feb 2020 17:06:28 -0500",,Positive,Video
https://www.cnbc.com/2020/02/28/trump-says-he-hopes-the-fed-gets-involved-soon-to-combat-market-sell-off-from-coronavirus.html,https://cdn.snapi.dev/images/v1/e/v/106401243-1582232398939rts32t58.jpg,Trump says he hopes the Fed gets involved 'soon' to combat market sell-off from coronavirus,President Donald Trump leaned on the Federal Reserve for help to deal with ramifications from the coronavirus impact on the stock market and the economy.,CNBC,"Fri, 28 Feb 2020 17:00:46 -0500",,Neutral,Article
https://www.forbes.com/sites/jjkinahan/2020/02/28/wild-week-ends-with-stocks-bond-yields-and-crude-oil-plunging-but-off-intraday-lows/,https://cdn.snapi.dev/images/v1/w/i/wild-week-ends-with-stocks-bond-yields-and-crude-oil-plunging-but-off-intraday-lows.jpg,"Wild Week Ends With Stocks, Bond Yields, And Crude Oil Plunging, But Off Intraday Lows","Some investors appear to be seeing a buying opportunity here, judging from the market’s rapid upswing in the last half hour of trade. There’s no guarantee this can last, and weekend events could play a big role.",Forbes,"Fri, 28 Feb 2020 16:58:07 -0500",oil,Negative,Article
https://www.cnbc.com/2020/02/28/us-stocks-erase-3point18-trillion-in-value-this-week-amid-coronavirus-tailspin.html,https://cdn.snapi.dev/images/v1/m/c/106065658-1565265949403preview.jpg,US stocks erase $3.18 trillion in value this week amid coronavirus tailspin,"The coronavirus wiped $3.18 trillion in market value from U.S. stocks this week, according to estimates from S&P Dow Jones Indices.",CNBC,"Fri, 28 Feb 2020 16:55:54 -0500",,Negative,Article
https://www.gurufocus.com/news/1058339/us-indexes-fall-further-friday-into-correction-territory,https://cdn.snapi.dev/images/v1/g/n/ww222222-1.jpg,US Indexes Fall Further Friday Into Correction Territory (Feb 28),"The Dow Jones Industrial Average closed at 25,409.36 on Friday with a loss of 357.28 points or -1.39%.",GuruFocus,"Fri, 28 Feb 2020 16:54:58 -0500",,Negative,Article
https://www.youtube.com/watch?v=0qLb7a0QfKk,https://cdn.snapi.dev/images/v1/m/q/stocks-end-their-worst-week-since-2008-feb-28.jpg,Stocks end their worst week since 2008 (Feb 28),"Lindsey Bell, chief investment strategist at Ally Invest; John Spallanzani, Miller Value Partners; and Gabriela Santos, JPMorgan Asset Management, join 'Closing Bell' to discuss markets.",CNBC Television,"Fri, 28 Feb 2020 16:47:23 -0500",,Negative,Video
https://www.fool.com/investing/2020/02/28/dow-falls-another-350-points-on-coronavirus-concer.aspx,https://cdn.snapi.dev/images/v1/p/z/5e57e2da2300007c0bddda86jpegcache30guyizd71ops640-360.jpg,"Dow Falls Another 350 Points on Coronavirus Concerns, Worst Week Since 2008",Markets around the world are continuing to plunge in what's been the worst week in over a decade.,The Motley Fool,"Fri, 28 Feb 2020 16:46:10 -0500",,Negative,Article
https://www.huffpost.com/entry/stock-market-plunge-worst-week-2008_n_5e598876c5b6450a30be6883,https://cdn.snapi.dev/images/v1/q/0/5e5989692300007d0c39c779jpegops640-360.jpg,Stocks Market Plunge Delivers Worst Week For Wall Street Since 2008,The stock swoon is being driven by fear that the coronavirus outbreak will derail the global economy.,Huffington Post,"Fri, 28 Feb 2020 16:44:45 -0500",,Negative,Article
https://www.cnbc.com/2020/02/28/a-historically-bad-weak-for-the-market-saw-everything-except-panic.html,https://cdn.snapi.dev/images/v1/1/0/106416136-15829080335502020-02-28t154219z-28646540-rc2r9f97ovy8-rtrmadp-3-usa-stocks.jpg,"A historically bad week for the market saw a little bit of everything, except panic","In a market that raced to its fastest correction in history and the worst week since the financial crisis, it's easy to imagine a frantic dash for the exits in which everyone is selling everything at whatever price they can get.",CNBC,"Fri, 28 Feb 2020 16:42:26 -0500",,Negative,Article
https://investorplace.com/2020/02/stock-market-today-nowhere-to-hide-cruise-stock-bottom/,https://cdn.snapi.dev/images/v1/p/c/forget-covid-19-these-2-problems-could-also-hammer-stock-markets-in-2020.jpg,Stock Market Today: Nowhere to Hide; Cruise Stock Bottom?,"There's nowhere to hide, as the markets continue to tumble lower. Here's what happened in the stock market today.",InvestorPlace,"Fri, 28 Feb 2020 16:31:02 -0500",,Negative,Article
https://www.youtube.com/watch?v=cL8lQSLBKzw,https://cdn.snapi.dev/images/v1/m/q/the-degree-of-panic-buying-in-longer-term-bonds-palpable-says-chief-fixed-income-strategist.jpg,"The degree of panic buying in longer-term bonds 'palpable,' says chief fixed income strategist","Guy Lebas, Janney Montgomery Scott Chief Fixed Income Strategist joins 'The Exchange' to discuss bonds.",CNBC Television,"Fri, 28 Feb 2020 16:29:57 -0500",,Neutral,Video
https://www.reuters.com/article/us-china-health-centralbanks-quotes-fact/factbox-global-central-bankers-on-coronavirus-possibility-of-rate-cuts-idUSKCN20M37J,https://cdn.snapi.dev/images/v1/l/h/m02d20191126t2i1457020850rlynxmpefap1esw640.jpg,"Factbox: Global central bankers on coronavirus, possibility of rate cuts","With the rapid global spread of the new coronavirus and the U.S. stock market suffering its worst week since the Great Recession, central bankers around the world are under rising pressure to reduce borrowing costs to create a cushion against economic harm.",Reuters,"Fri, 28 Feb 2020 16:27:34 -0500",,Positive,Article
https://investorplace.com/2020/02/dow-jones-today-still-bad-but-hope-emerges/,https://cdn.snapi.dev/images/v1/r/f/rff321111-1.jpg,"Dow Jones Today: Still Bad, But Hope Emerges","There were some inklings of a rebound Friday, but a massive number of Dow stocks closed lower, many with heavy losses.
The post Dow Jones Today: Still Bad, But Hope Emerges appeared first on InvestorPlace.",InvestorPlace,"Fri, 28 Feb 2020 16:27:01 -0500",,Neutral,Article
https://www.youtube.com/watch?v=a6AeMwUubI8,https://cdn.snapi.dev/images/v1/m/q/markets-needed-a-reason-to-give-back-this-is-a-correction-scott-galloway.jpg,Markets needed a reason to give back... this is a correction: Scott Galloway,NYU Marketing Professor Scott Galloway to discusses the market sell-off and how the coronavirus has been impacting the stock market with Payne Capital Management Financial Advisor Courtney Dominguez and Yahoo Finance’s Dan Roberts and Julia La Roche.,Yahoo Finance,"Fri, 28 Feb 2020 16:22:28 -0500",,Negative,Video
https://www.forbes.com/sites/sergeiklebnikov/2020/02/28/the-stock-market-is-in-freefall-on-coronavirus-fears-how-much-worse-will-it-get/,https://cdn.snapi.dev/images/v1/4/9/the-stock-market-is-in-freefall-on-coronavirus-fears-how-much-worse-will-it-get.jpg,The Stock Market Is In Freefall On Coronavirus Fears. How Much Worse Will It Get?,It was the stock market’s worst week since the 2008 financial crisis.,Forbes,"Fri, 28 Feb 2020 16:21:06 -0500",,Negative,Article
https://www.cnbc.com/2020/02/28/stocks-spiral-as-coronavirus-fears-persist-heres-what-to-watch.html,https://cdn.snapi.dev/images/v1/b/8/106416635-1582924578203gettyimages-1203951849.jpeg,Stock market spirals as coronavirus fears persist— Here's what to watch,Stock market faces its worst week since the financial crisis. Here's what three experts have to say.,CNBC,"Fri, 28 Feb 2020 16:20:34 -0500",,Neutral,Article
https://nypost.com/2020/02/28/dow-falls-357-points-capping-worst-week-since-financial-crisis/,https://cdn.snapi.dev/images/v1/7/m/gettyimages-1203253313jpgquality90stripall.jpg,"Dow falls 357 points, capping worst week since financial crisis","The widening coronavirus epidemic sent US stocks plunging for the sixth straight session on Friday, capping their worst week since the 2008 financial crisis. The Dow Jones Industrial Average went on a wild roller-coaster ride as new infections were reported beyond mainland China, sinking as much as 1086.07 points, or 4.3 percent, before narrowing its.",New York Post,"Fri, 28 Feb 2020 16:18:27 -0500",,Negative,Article
