news_url,image_url,title,text,source_name,date,topics,sentiment,type
https://www.youtube.com/watch?v=nP-UoMw3S64,https://cdn.snapi.dev/images/v1/v/t/huge-opportunity-seen-in-value-stocks-research-affiliates-cio.jpg,'Huge Opportunity' Seen in Value Stocks: Research Affiliates CIO,"Chris Brightman, chief investment officer at Research Affiliates LLC who co-manages the PIMCO All Asset and All Asset All Authority funds, discusses the volatility in financial markets and his strategy.",Bloomberg Markets and Finance,"Wed, 01 Apr 2020 23:04:18 -0400",,Positive,Video
https://www.forbes.com/sites/zackfriedman/2020/04/01/do-you-qualify-for-a-stimulus-check/,https://cdn.snapi.dev/images/v1/j/v/do-you-qualify-for-a-stimulus-check.jpg,Do You Qualify For A Stimulus Check?,How much money will you get?,Forbes,"Wed, 01 Apr 2020 22:07:50 -0400",,Neutral,Article
https://nypost.com/2020/04/01/march-jobs-report-numbers-might-appear-better-than-reality/,https://cdn.snapi.dev/images/v1/a/w/job-reportjpgquality90stripall.jpg,March jobs report numbers might appear better than reality,Be prepared for a shock — the employment report for March that’s coming out on Friday may not be as bad as people are expecting. But don’t misunderstand what I’m saying.,New York Post,"Wed, 01 Apr 2020 22:00:19 -0400",,Neutral,Article
https://www.youtube.com/watch?v=36MkyjAY2l0,https://cdn.snapi.dev/images/v1/m/q/etfs-to-watch-amid-covid-19.jpg,ETFs to watch amid COVID-19,ETF.com Managing Editor Cinthia Murphy joins Yahoo Finance's Seana Smith to break down the best ETFs to watch in the second quarter of 2020.,Yahoo Finance,"Wed, 01 Apr 2020 21:29:42 -0400",,Neutral,Video
https://www.youtube.com/watch?v=EDqpCS7PC2A,https://cdn.snapi.dev/images/v1/i/p/stocks-plunge-over-coronavirus-fears-possibility-of-longer-economic-shutdown.jpg,"Stocks plunge over coronavirus fears, possibility of longer economic shutdown","Wall Street suffered another volatile day on Wednesday, with the Dow sinking over 900 points after intensifying coronavirus fears, and the possibility of an extended economic shutdown.",Yahoo Finance,"Wed, 01 Apr 2020 21:08:12 -0400",,Negative,Video
https://www.seeitmarket.com/sp-500-index-price-pattern-similar-to-2008/,https://cdn.snapi.dev/images/v1/0/i/etf21.jpg,S&P 500 Index Price Pattern Similar to 2008 Market Crash?,"S&P 500 Index “weekly” Chart Last week’s sharp rally off the lows, gave bulls some relief. But if the bulls are going to have reason to cheer, they will need to see another move higher… and fast!",See It Market,"Wed, 01 Apr 2020 20:34:08 -0400",,Negative,Article
https://www.youtube.com/watch?v=ro6X_aW3YzI,https://cdn.snapi.dev/images/v1/e/a/this-is-not-a-panic-moment-investment-pro.jpg,This is not a panic moment: Investment pro,"Mark Luschini, Janney, Montgomery, Scott, and Tom Stringfellow, Frost Investment Advisors, discuss where they see the markets headed.",CNBC Television,"Wed, 01 Apr 2020 20:20:38 -0400",,Neutral,Video
https://www.youtube.com/watch?v=NUaZ5kwh_us,https://cdn.snapi.dev/images/v1/m/q/jim-cramer-breaks-down-the-first-quarters-biggest-winners-and-losers.jpg,Jim Cramer breaks down the first quarter's biggest winners and losers,"""You can learn a lot about a market by looking at its winners and losers,"" the ""Mad Money"" host said.",CNBC Television,"Wed, 01 Apr 2020 19:56:09 -0400","cramer,madmoney",Neutral,Video
https://www.reuters.com/article/us-global-markets/asian-stocks-slip-as-global-recession-looms-idUSKBN21J74A,https://cdn.snapi.dev/images/v1/e/h/m02d20200402t2i1511257777rlynxmpeg31004w640.jpg,Asian stocks slip as global recession looms,"Asian equity markets and crude oil looked set for further losses on Thursday, after a dire warning about the U.S. coronavirus death toll and mounting evidence the fast-spreading disease has sent the world economy hurtling into a deep recession.",Reuters,"Wed, 01 Apr 2020 19:50:05 -0400",,Negative,Article
https://www.youtube.com/watch?v=7il1AdA3Ofk,https://cdn.snapi.dev/images/v1/r/n/people-starting-to-see-a-much-lower-earnings-profile-for-sp-500-trennert.jpg,People starting to see a much lower earnings profile for S&P 500: Trennert,"Jason Trennert, Strategas Research Partners, on what happened in the markets today and where we're headed from here.",CNBC Television,"Wed, 01 Apr 2020 19:47:10 -0400",earnings,Negative,Video
https://www.cnbc.com/2020/04/01/jim-cramer-investors-can-learn-a-lot-from-q1-winners-and-losers.html,https://cdn.snapi.dev/images/v1/c/8/105418438-1535386856068gettyimages-916203026.jpeg,Jim Cramer: Investors can 'learn a lot' from first-quarter winners and losers,"""In the end, I think the winners from the first quarter keep winning as long as the pandemic rages, and the losers [will] keep losing,"" the ""Mad Money"" host said.",CNBC,"Wed, 01 Apr 2020 19:46:44 -0400","earnings,cramer",Neutral,Article
https://www.cnbc.com/2020/04/01/coronavirus-trump-considering-halting-us-flights-between-hot-spots.html,https://cdn.snapi.dev/images/v1/1/0/106470893-1585780796821rts37vb3.jpg,Trump says he's considering halting domestic flights between certain coronavirus hot spots,"""I am looking where flights are going into hot spots. Some of those flights I didn't like from the beginning,"" Trump said at a White House coronavirus briefing.",CNBC,"Wed, 01 Apr 2020 19:39:23 -0400",,Neutral,Article
https://www.marketwatch.com/story/guid/5eae6eb8-edb6-455e-92ea-42e5bae92334,https://cdn.snapi.dev/images/v1/2/f/m02d20191127t2i1457385542rlynxmpefaq199w640.jpg,U.S. stock futures tick up after Wall Street's ugly start to April,"U.S. stock index futures rose late Wednesday, suggesting gains when trading resumes Thursday morning following another day of sharp losses on Wall Street.",Market Watch,"Wed, 01 Apr 2020 19:31:36 -0400",,Positive,Article
https://www.reuters.com/article/us-global-oil/u-s-crude-oil-futures-up-4-8-support-at-20-idUSKBN21J6ZR,https://cdn.snapi.dev/images/v1/d/w/m02d20200401t2i1511246946rlynxmpeg3051dw640.jpg,"U.S. crude oil futures up 4.8%, support at $20","U.S. crude oil futures opened 5% higher on Thursday, reversing Wednesday's losses, despite growing concerns about a looming economic depression due to the coronavirus pandemic.",Reuters,"Wed, 01 Apr 2020 19:25:59 -0400",oil,Positive,Article
https://www.cnbc.com/2020/04/01/jim-cramer-wall-street-to-retest-lows-after-rude-awakening-on-coronavirus.html,https://cdn.snapi.dev/images/v1/r/8/106463586-15853127854612020-03-13t160156z-895557083-hp1eg3d18j8d1-rtrmadp-3-health-coronavirus-new-york.jpg,"Wall Street must retest lows after 'rude awakening' from White House on coronavirus, Jim Cramer says","""I can't blame anyone for selling after that miserable first quarter with very little good news on any front in the battle against COVID,"" the ""Mad Money"" host said.",CNBC,"Wed, 01 Apr 2020 19:01:14 -0400",cramer,Negative,Article
https://www.youtube.com/watch?v=xapMR2NBV5E,https://cdn.snapi.dev/images/v1/6/z/wall-street-must-retest-lows-after-trumps-rude-awakening-jim-cramer-says.jpg,"Wall Street must retest lows after Trump's 'rude awakening,' Jim Cramer says","""I can't blame anyone for selling after that miserable first quarter with very little good news on any front in the battle against COVID,"" the ""Mad Money"" host said.",CNBC Television,"Wed, 01 Apr 2020 19:00:47 -0400","cramer,madmoney",Negative,Video
https://www.marketwatch.com/story/guid/6d5c2bb1-68f2-4939-8f73-c36cddafe5f9,https://cdn.snapi.dev/images/v1/a/2/105545779-1541079407243rtx6fbtj.jpg,"Trump says Russia, Saudi Arabia will work out oil dispute",President Donald Trump on Wednesday said he was confident Russia and Saudi Arabia would resolve an oil-price dispute that has damaged the industry.,Market Watch,"Wed, 01 Apr 2020 18:48:30 -0400",oil,Neutral,Article
https://www.cnbc.com/2020/04/01/brace-for-coronavirus-fallout-to-take-stocks-to-new-lows-meghan-shue.html,https://cdn.snapi.dev/images/v1/x/e/106468320-15856581191502020-03-24t142229z-470140335-rc2eqf99aa0a-rtrmadp-3-health-coronavirus-banks-bonuses.jpg,"Brace for coronavirus fallout to take stocks to new lows, $107B money manager warns",Wilmington Trust's Meghan Shue warns investors will see two grim quarters of losses — not just one.,CNBC,"Wed, 01 Apr 2020 18:48:24 -0400",,Negative,Article
https://www.forbes.com/sites/pedrodacosta/2020/04/01/federal-reserve-reluctantly-embraces-even-larger-role-in-economy/,https://cdn.snapi.dev/images/v1/m/w/federal-reserve-reluctantly-embraces-even-larger-role-in-economy.jpg,Federal Reserve Reluctantly Embraces Even Larger Role In Economy,"“The Fed has moved from being the lender of last resort for the banking system to being the lender of last resort for the entire economy.""",Forbes,"Wed, 01 Apr 2020 18:46:26 -0400",,Neutral,Article
https://www.cnn.com/2020/04/01/investing/global-stocks/index.html,https://cdn.snapi.dev/images/v1/n/8/200401180906-nyse-file-super-169.jpg,US stock futures up Wednesday after a rough start to Q2 for Wall Street,US stock futures were up Wednesday following a rough start to the second quarter for Wall Street.,CNN Business,"Wed, 01 Apr 2020 18:45:55 -0400",,Positive,Article
https://www.reuters.com/article/us-global-oil-wti/u-s-crude-oil-futures-jump-5-at-open-idUSKBN21J6ZR,https://cdn.snapi.dev/images/v1/1/y/m02d20200401t2i1511229590rlynxmpeg3051dw640.jpg,U.S. crude oil futures jump 5% at open,"U.S. crude oil futures rose 5% on the open on Thursday, reversing Wednesday's losses, despite growing concerns about a looming economic depression due to the coronavirus pandemic.",Reuters,"Wed, 01 Apr 2020 18:27:08 -0400",oil,Positive,Article
https://www.cnbc.com/2020/04/01/stock-market-futures-open-to-close-news.html,https://cdn.snapi.dev/images/v1/a/d/106468320-15856581191502020-03-24t142229z-470140335-rc2eqf99aa0a-rtrmadp-3-health-coronavirus-banks-bonuses.jpg,Stock futures positive as market tries to rebound from second quarter's rocky start,"U.S. stock futures pointed to modest gains at the open on Thursday, one day after markets kicked off the second quarter in the red",CNBC,"Wed, 01 Apr 2020 18:16:38 -0400",earnings,Positive,Article
https://www.youtube.com/watch?v=Ak1k98FZR7U,https://cdn.snapi.dev/images/v1/i/g/this-is-a-global-slowdown-we-have-not-seen-since-the-great-depression-says-portfolio-manager.jpg,"'This is a global slowdown... we have not seen since the Great Depression,' says portfolio manager",Satori Fund Founder & Portfolio Manager Dan Niles joins Yahoo Finance’s Zack Guzman to break down what investors should be looking for in markets as stocks continue to face pressure from COVID-19.,Yahoo Finance,"Wed, 01 Apr 2020 17:50:30 -0400",,Negative,Video
https://www.cnbc.com/2020/04/01/jobless-claims-will-be-huge-but-millions-more-are-expected.html,https://cdn.snapi.dev/images/v1/z/c/106136732-1568826999419gettyimages-1175322959.jpeg,"Jobless claims will be huge, but millions more are expected from the 'earthquake shaking the whole country'","Economists expect more than 4 million to 5 million workers filed unemployment claims last week, but millions more are expected.",CNBC,"Wed, 01 Apr 2020 17:31:09 -0400",,Negative,Article
https://www.nytimes.com/2020/04/01/business/economy/trump-tariffs-coronavirus.html,https://cdn.snapi.dev/images/v1/a/2/merlin-171096192-8f25d527-2df3-4b5d-8d04-c39bccb20b04-articlelargejpgquality75autowebpdisableupscale.jpg,Trump Rebuffs Demands to Lift Tariffs as Economy Falters,"The calls by corporate leaders have intensified as the coronavirus inflicts financial pain, but President Trump has argued that the levies do not hurt American companies.",NYTimes,"Wed, 01 Apr 2020 17:26:24 -0400",paywall,Neutral,Article
https://www.gurufocus.com/news/1093279/us-indexes-close-lower-wednesday-with-new-virus-warnings,https://cdn.snapi.dev/images/v1/5/a/iush25-1.jpg,US Indexes Close Lower Wednesday With New Virus Warnings (April 01),"The Dow Jones Industrial Average closed at 20,943.51 on Wednesday with a loss of 973.65 points or -4.44%.",GuruFocus,"Wed, 01 Apr 2020 17:08:33 -0400",,Negative,Article
https://www.marketwatch.com/story/guid/577697ba-7452-11ea-9abe-1a59c2664716,https://cdn.snapi.dev/images/v1/1/a/mw-id571-trumpp-20200401161444-zhjpguuid6dae6d34-7455-11ea-83a1-9c8e992d421e.jpg,Deep Dive: These U.S. stocks fell the most April 1 after Trump turned grim on coronavirus forecast,U.S. stocks began the second quarter Wednesday with big declines after President Trump’s tone when discussing potential COVID-19 deaths turned dire.,Market Watch,"Wed, 01 Apr 2020 17:04:48 -0400",,Negative,Article
https://www.youtube.com/watch?v=ZgtN2GJwx1U,https://cdn.snapi.dev/images/v1/m/q/banks-are-well-equipped-to-handle-horrendous-virus-crisis-tony-ressler-says.jpg,"Banks Are Well-Equipped to Handle 'Horrendous' Virus Crisis, Tony Ressler Says","Ares Management Executive Chairman Tony Ressler says banks are in better shape to weather the coronavirus pandemic than they were before the financial crisis of 2008. He speaks with Bloomberg's Erik Schatzker on ""Bloomberg Markets.""",Bloomberg Markets and Finance,"Wed, 01 Apr 2020 17:03:36 -0400",,Neutral,Video
https://www.gurufocus.com/news/1093274/warren-buffetts-market-indicator-falls-near-3year-low,https://cdn.snapi.dev/images/v1/b/3/m02d20191126t2i1457020850rlynxmpefap1esw640.jpg,Warren Buffett’s Market Indicator Falls Near 3-Year Low,"On Wednesday, “April Fool’s Day,” Berkshire Hathaway Inc. (NYSE:BRK.A)(NYSE:BRK.B) CEO Warren Buffett (Trades, Portfolio)’s favorite market indicator stood at 113.6%, up 2.1% from the March 16 level of 111.5% yet down 25% from the March 3 level of 138.6%.",GuruFocus,"Wed, 01 Apr 2020 17:00:44 -0400",wbuffett,Negative,Article
https://www.reuters.com/article/uk-usa-stocks/wall-street-dives-4-as-virus-pandemic-fears-intensify-idUSKBN21J50J,https://cdn.snapi.dev/images/v1/w/o/etf35.jpg,Wall Street dives 4% as virus pandemic fears intensify,"Wall Street's three major indexes fell more than 4% on Wednesday, after President Donald Trump's dire warning on the U.S. death toll from the coronavirus sent investors running from even the most defensive equities.",Reuters,"Wed, 01 Apr 2020 17:00:12 -0400",,Negative,Article
https://www.youtube.com/watch?v=6QMdD_a4gJM,https://cdn.snapi.dev/images/v1/n/1/youll-see-more-sustained-money-coming-back-into-markets-koesterich.jpg,You'll see more sustained money coming back into markets: Koesterich,"Russ Koesterich, Portfolio Manager at BlackRock Global Allocation Fund, joins ""Closing Bell"" to discuss markets.",CNBC Television,"Wed, 01 Apr 2020 16:54:58 -0400",,Neutral,Video
https://www.seeitmarket.com/sp-500-index-pullback-price-targets-for-next-low/,https://cdn.snapi.dev/images/v1/v/d/200401102427-nyse-0330-super-169.jpg,S&P 500 Index: Pullback Price Targets For Next Low,"S&P 500 Index Futures Chart In an article yesterday, I asked “Is It Time To Retest The Lows?“ After a sharp bear market rally that saw the S&P 500 Index stall at initial resistance, I pointed out that a pullback was highly likely.",See It Market,"Wed, 01 Apr 2020 16:49:46 -0400",,Negative,Article
https://investorplace.com/2020/04/dow-jones-today-no-april-fools-joke-stocks-sink-to-start-new-quarter/,https://cdn.snapi.dev/images/v1/0/g/wall-street-sign-buildings-162x88.jpg,"Dow Jones Today: No April Fool’s Joke, Stocks Sink to Start New Quarter","A new quarter begins, but it's the same old song for riskier assets as stocks tumbled, prompting concerns Q2 will be another rough patch.
The post Dow Jones Today: No April Fool’s Joke, Stocks Sink to Start New Quarter appeared first on InvestorPlace.",InvestorPlace,"Wed, 01 Apr 2020 16:46:34 -0400",earnings,Negative,Article
https://www.youtube.com/watch?v=19Z9hXqrAwM,https://cdn.snapi.dev/images/v1/4/x/stocks-plummet-amid-fears-coronavirus-will-worsen.jpg,Stocks plummet amid fears coronavirus will worsen,FOX Business' Lauren Simonetti discusses the stock plunge on Wednesday as well as the initial jobless claims estimates.,Fox Business,"Wed, 01 Apr 2020 16:46:17 -0400",,Negative,Video
https://www.benzinga.com/general/education/20/04/15719452/how-to-make-sure-you-get-the-largest-possible-covid-19-stimulus-check,https://cdn.snapi.dev/images/v1/t/m/financial-4560047-1920.jpg,How To Make Sure You Get The Largest Possible COVID-19 Stimulus Check,"President Donald Trump signed a $2-trillion stimulus package last week that will send most Americans up to $1,200 in direct payment as a lifeline during the coronavirus (COVID-19) economic shutdown.",Benzinga,"Wed, 01 Apr 2020 16:41:44 -0400",,Neutral,Article
https://www.forbes.com/sites/jjkinahan/2020/04/01/crude-oil-consumer-staples-bright-spots-but-small-cap-russell-leads-all-indices-lower-in-broad-selloff/,https://cdn.snapi.dev/images/v1/x/p/crude-oil-consumer-staples-bright-spots-but-small-cap-russell-leads-all-indices-lower-in-broad-selloff.jpg,"Crude Oil, Consumer Staples Bright Spots, But Small-Cap Russell Leads All Indices Lower In Broad Selloff",The new quarter started out with an ugly day as investors seem to be repricing stocks based on President Trump’s warning that the U.S. faces a tough two weeks.,Forbes,"Wed, 01 Apr 2020 16:41:27 -0400",,Negative,Article
https://www.nytimes.com/2020/04/01/business/economy/fed-coronavirus-municipal-debt.html,https://cdn.snapi.dev/images/v1/h/m/merlin-163234626-00e1328a-3dea-491e-a291-9ccf3917bba0-articlelargejpgquality75autowebpdisableupscale.jpg,Why State and Local Debt Is Fraught Territory for the Fed,The central bank is weighing what it can do to help local bond markets. Here’s why Democrats’ big ask — direct purchases — are so tough.,NYTimes,"Wed, 01 Apr 2020 16:40:11 -0400",paywall,Negative,Article
https://www.reuters.com/article/us-health-coronavirus-hedgefunds/multi-strategy-hedge-funds-outperformed-peers-as-market-plunged-idUSKBN21J6S8,https://cdn.snapi.dev/images/v1/a/4/m02d20200401t2i1511194123rlynxmpeg304wgw640.jpg,Multi-strategy hedge funds outperformed peers as market plunged,"Multi-strategy hedge funds - those that bet on a broad array of markets using teams of traders, leverage and centralized risk management - have flourished as stocks ended their worst three months since the 2008 financial crisis.",Reuters,"Wed, 01 Apr 2020 16:30:29 -0400",,Positive,Article
https://www.youtube.com/watch?v=O5vd2iweGZw,https://cdn.snapi.dev/images/v1/x/j/utilizing-etfs-to-access-specific-sectors.jpg,Utilizing ETFs To Access Specific Sectors,"Knowing which sectors are poised to make big moves is one thing, but trying to pick the top peformers in a certain group is something else.",Investors Business Daily,"Wed, 01 Apr 2020 16:30:04 -0400",,Neutral,Video
https://www.youtube.com/watch?v=1szVhyDX8f8,https://cdn.snapi.dev/images/v1/m/q/vanguard-a-leader-in-index-funds-but-has-15-trillion-in-actively-managed-assets.jpg,"Vanguard A Leader In Index Funds, But Has $1.5 Trillion In Actively Managed Assets","Vanguard is known as a leader in index-tracking funds, but it also has $1.6 trillion in actively managed fund assets.",Investors Business Daily,"Wed, 01 Apr 2020 16:28:59 -0400",,Positive,Video
https://www.youtube.com/watch?v=c-U_q5DhnbU,https://cdn.snapi.dev/images/v1/8/n/podc12.jpg,What's The Secret To Best Use Sector ETFs?,ETFs’ original purpose was to simply match the direction of broad market indexes at a low cost.,Investors Business Daily,"Wed, 01 Apr 2020 16:28:45 -0400",podcast,Neutral,Video
https://www.cnbc.com/2020/04/01/small-businesses-grapple-with-paycheck-protection-program-in-stimulus.html,https://cdn.snapi.dev/images/v1/1/0/106470587-1585769658479man.jpg,Firms fear small business loan program in coronavirus rescue package will run out of money,"The Treasury Department issued guidelines Tuesday about the $349 billion paycheck protection program, part of the $2 trillion economic bailout package signed into law last week.",CNBC,"Wed, 01 Apr 2020 16:27:41 -0400",,Negative,Article
https://www.reuters.com/article/us-usa-stocks/wall-streets-major-stock-indexes-plunge-as-coronavirus-anxiety-grows-idUSKBN21J50J,https://cdn.snapi.dev/images/v1/v/k/dpek2fff-1.jpg,Wall Street's major stock indexes plunge as coronavirus anxiety grows,The U.S. benchmark S&P 500 stock index fell more than 4% on Wednesday after a dire warning on the U.S. death toll from the coronavirus sent investors running from even the most defensive equities.,Reuters,"Wed, 01 Apr 2020 16:24:20 -0400",,Negative,Article
https://www.youtube.com/watch?v=yLEglRiT1V4,https://cdn.snapi.dev/images/v1/3/f/sell-off-due-to-length-of-time-before-we-can-get-back-to-normal-josh-brown.jpg,Sell-off due to length of time before we can get back to normal: Josh Brown,"Josh Brown, Ritholtz Wealth Management, joins ""Closing Bell"" to discuss markets.",CNBC Television,"Wed, 01 Apr 2020 16:19:11 -0400",,Negative,Video
https://www.forbes.com/sites/sergeiklebnikov/2020/04/01/stocks-plunge-to-start-second-quarter-as-us-tops-200000-coronavirus-cases/,https://cdn.snapi.dev/images/v1/r/t/stocks-plunge-to-start-second-quarter-as-us-tops-200000-coronavirus-cases.jpg,"Stocks Plunge To Start Second Quarter As U.S. Tops 200,000 Coronavirus Cases",The market fell almost 5% after their worst quarter since 1987.,Forbes,"Wed, 01 Apr 2020 16:18:16 -0400",,Negative,Article
https://investorplace.com/2020/04/stock-market-today-q2-off-to-a-rough-start-little-3/,https://cdn.snapi.dev/images/v1/r/z/ip-stockmarkettoday1600-300x169.jpg,Stock Market Today: Q2 Off to a Rough Start; ‘Little 3?’,"It was a tough session in the stock market today, with the S&P 500 falling more than 5% at one point as we kick off Q2 on a sour note.
The post Stock Market Today: Q2 Off to a Rough Start; ‘Little 3?",InvestorPlace,"Wed, 01 Apr 2020 16:16:50 -0400",earnings,Negative,Article
https://www.forbes.com/sites/sarahhansen/2020/04/01/12-ways-to-donate-your-1200-stimulus-check-to-help-fight-the-coronavirus/,https://cdn.snapi.dev/images/v1/o/r/12-ways-to-donate-your-1200-stimulus-check-to-help-fight-the-coronavirus.jpg,"12 Ways To Donate Your $1,200 Stimulus Check To Help Fight The Coronavirus","If you don’t need the money, here’s how you can help.",Forbes,"Wed, 01 Apr 2020 16:16:45 -0400",,Neutral,Article
https://techcrunch.com/2020/04/01/stocks-fall-sharply-as-u-s-government-warns-of-hard-weeks-ahead/,https://cdn.snapi.dev/images/v1/0/s/gettyimages-1159096305jpgw608.jpg,Stocks fall sharply as U.S. government warns of hard weeks ahead,"A recent redbound in domestic equity prices faded further into the distance today, as American stocks fell for a second consecutive day following modest Tuesday declines. After rising from new 52 week lows, all domestic indices after the American president warned of difficult weeks ahead as the country reels from the economic and social impacts […]",TechCrunch,"Wed, 01 Apr 2020 16:15:07 -0400",,Negative,Article
https://www.cnbc.com/2020/04/01/what-happened-to-the-stock-market-wednesday-stocks-start-second-quarter-on-sour-note.html,https://cdn.snapi.dev/images/v1/t/g/106457322-1584996492185trump.jpg,Here's what happened to the stock market on Wednesday (April 01),Stocks fell sharply on the first day of the new quarter amid mounting concerns over the coronavirus and its health and economic ramifications.,CNBC,"Wed, 01 Apr 2020 16:13:01 -0400",,Negative,Article
https://www.cnbc.com/2020/04/01/coronavirus-update-phase-4-relief-bill-could-include-these-measures.html,https://cdn.snapi.dev/images/v1/1/0/106462186-1585237461867gettyimages-1208282625.jpeg,Politicians are already calling for a 4th coronavirus relief plan. Here's what could be in it,"As the U.S. tries to implement a historic $2 trillion coronavirus relief plan, lawmakers are outlining what they think the next bill should include.",CNBC,"Wed, 01 Apr 2020 16:07:55 -0400",,Neutral,Article
