news_url,image_url,title,text,source_name,date,topics,sentiment,type
https://www.cnbc.com/2019/04/21/elon-musks-spacex-suffers-capsule-anomaly-during-florida-tests.html,https://cdn.snapi.dev/images/v1/1/0-2/105849104-1555082053627rts2hdiz530x298.jpg,Elon Musk's SpaceX suffers capsule anomaly during Florida tests,"Elon Musk's SpaceX suffered an anomaly in one of its Crew Dragon capsules while conducting engine tests at the Cape Canaveral Air Force Station in Florida on Saturday, the company said.",CNBC,"Sat, 20 Apr 2019 23:01:00 -0400",,Neutral,Article
https://www.youtube.com/watch?v=vCIBvRuqigk,https://cdn.snapi.dev/images/v1/m/q-3/this-reality-does-not-exist-trust-in-an-age-of-synthetic-media-with-alexei-efros-and-hany-farid.jpg,This Reality Does Not Exist: Trust in an Age of Synthetic Media with Alexei Efros and Hany Farid,"AI-based tools are proving capable of fabricating or modifying imagery and audio in ways that are nearly indistinguishable from reality. How can these systems and media be detected, and how can we trust anything when everything could be faked?",TechCrunch,"Sat, 20 Apr 2019 18:10:50 -0400",,Positive,Video
https://www.youtube.com/watch?v=nRgplHWGbuM,https://cdn.snapi.dev/images/v1/m/q-3/fireside-chat-with-anthony-levandowski-prontoai.jpg,Fireside Chat with Anthony Levandowski (Pronto.AI),"Anthony Levandowski, the former star Google engineer and serial entrepreneur who was at the center of a trade secrets lawsuit between Uber and Waymo, is back with a new startup.",TechCrunch,"Sat, 20 Apr 2019 18:00:32 -0400",,Positive,Video
https://www.cnbc.com/2019/04/20/us-intelligence-reportedly-says-huawei-funded-by-chinese-state-security.html,https://cdn.snapi.dev/images/v1/1/0-2/105707766-1548817096008gettyimages-645921982530x298-2.jpeg,US intelligence reportedly says Huawei funded by Chinese state security,US authorities are probing the Chinese tech company for potential sanction violations.,CNBC,"Sat, 20 Apr 2019 15:52:00 -0400",,Negative,Article
https://www.cnbc.com/2019/04/18/weed-supporters-are-celebrating-this-420-as-legalization-gains-momentum.html,https://cdn.snapi.dev/images/v1/1/0-2/104416325-takoma-wellness-center530x298.jpg,Weed supporters are celebrating this 420 as legalization gains momentum,"Marijuana is now legal in 10 states and Washington, D.C. A handful of states are actively considering allowing adult recreational use.",CNBC,"Sat, 20 Apr 2019 13:00:00 -0400",,Positive,Article
https://www.cnbc.com/2019/04/20/blackrocks-larry-fink-says-there-are-no-signs-of-global-recession-in-the-next-12-months.html,https://cdn.snapi.dev/images/v1/1/0-2/105510032-1539702458533img-5222530x298.jpg,BlackRock’s Larry Fink says there are no signs of global recession in the next 12 months,"""We will go through a phase in which things are not great but also not bad.""",CNBC,"Sat, 20 Apr 2019 09:58:00 -0400",,Neutral,Article
https://feeds.marketwatch.com/~r/marketwatch/internet/~3/tn8HbU6I-7U/story.asp,https://cdn.snapi.dev/images/v1/m/w/mw-gb357-dispen-20180108181923-zh.jpg,"On 4/20, consider how living near a marijuana dispensary affects your home’s price",Do high times lead to higher home prices?,Market Watch,"Sat, 20 Apr 2019 09:38:04 -0400",cannabis,Neutral,Article
https://www.forbes.com/sites/billconerly/2019/04/20/housing-will-weaken-further-in-2019-and-2020/,https://cdn.snapi.dev/images/v1/p/t/pt-1891-4090-o.jpg,Housing Will Weaken Further In 2019 And 2020,Slightly weaker demand for housing will combine with a little too much supply. Home price appreciation will slow.,Forbes,"Sat, 20 Apr 2019 07:22:00 -0400",,Negative,Article
