news_url,image_url,title,text,source_name,date,topics,sentiment,type
https://www.youtube.com/watch?v=idChLshRy-A,https://cdn.snapi.dev/images/v1/x/h/heres-what-investors-need-to-know-about-the-secs-new-regulation-best-interest.jpg,Here’s what investors need to know about the SEC's new Regulation Best Interest,The SEC's Regulation Best Interest rolls out on June 30.,Yahoo Finance,"Fri, 26 Jun 2020 23:44:18 -0400",,Neutral,Video
https://www.youtube.com/watch?v=I-3jIWdydZo,https://cdn.snapi.dev/images/v1/1/n/why-another-round-of-stimulus-needed-for-economic-recovery-gary-cohn.jpg,Why another round of stimulus needed for economic recovery: Gary Cohn,"Former Director of the National Economic Council Gary Cohn joins Yahoo Finance’s On The Move to weigh in on PPP funding, the demand for more COVID-19 testing, and assess how the economy is faring amid the pandemic.",Yahoo Finance,"Fri, 26 Jun 2020 22:33:21 -0400",,Neutral,Video
https://seekingalpha.com/article/4355944-dont-buy-falling-financials-buy-stocks-instead,https://cdn.snapi.dev/images/v1/h/e/heres-why-you-need-to-hedge-your-stock-investments-7.jpg,"Don't Buy Falling Financials, Buy These Stocks Instead",Stress test results put the brakes on banking stocks.,Seeking Alpha,"Fri, 26 Jun 2020 21:32:48 -0400",,Neutral,Article
https://www.youtube.com/watch?v=lJuYHkkVb6Y,https://cdn.snapi.dev/images/v1/j/2/markets-sell-off-to-end-the-week-so-whats-in-store-for-the-second-half.jpg,"Markets sell off to end the week, so what's in store for the second half?",Cornerstone Macro's Carter Worth breaks down the second half.,CNBC Television,"Fri, 26 Jun 2020 17:47:33 -0400",tanalysis,Negative,Video
https://www.forbes.com/sites/chuckjones/2020/06/26/the-stock-markets-bear-market-rally-has-ended/,https://cdn.snapi.dev/images/v1/1/i/the-stock-markets-bear-market-rally-has-ended.jpg,The Stock Market’s Bear Market Rally Has Ended,"The stock market seems to have run out of juice. After the Dow rallied 48% from its March lows, it is now down over 9% from its recent peak.",Forbes,"Fri, 26 Jun 2020 17:43:08 -0400",,Negative,Article
https://techcrunch.com/2020/06/26/the-exchange-ipo-season-self-driving-misfires-and-a-fintech-letdown/,https://cdn.snapi.dev/images/v1/n/s/nsussman-techcrunch-exchange-multicolorjpgw533.jpg,"The Exchange: IPO season, self-driving misfires and a fintech letdown","Welcome to The TechCrunch Exchange, a forthcoming weekly newsletter from the TC crew about startups, money, and markets. You can sign up for it here, and receive it regularly when it formally launches in a few weeks.",TechCrunch,"Fri, 26 Jun 2020 17:32:11 -0400",,Neutral,Article
https://investorplace.com/2020/06/avoid-bursting-bubbles/,https://cdn.snapi.dev/images/v1/d/u/dudj1wdf.jpg,Avoid Bursting Bubbles,"The stock market is growing narrower … how to position your portfolio in strength … an example of a bubble stock waiting to get pricked We’re going to go into the bumpy summer months, and it’s going to get narrow, and it’s going to be every stock for itself … boy, there are some bubbles....",InvestorPlace,"Fri, 26 Jun 2020 17:18:54 -0400",,Negative,Article
https://www.gurufocus.com/news/1172636/us-indexes-close-lower-friday,https://cdn.snapi.dev/images/v1/x/6/rodo2111-1.jpg,US Indexes Close Lower Friday (June 26),"The Dow Jones Industrial Average closed at 25,015.55 on Friday with a loss of 730.05 points or -2.84%. The S&P 500 closed at 3,009.05 for a loss of 74.71 points or -2.42%.",GuruFocus,"Fri, 26 Jun 2020 17:12:55 -0400",,Negative,Article
https://www.benzinga.com/news/20/06/16414095/biden-leads-in-polls-coronavirus-cases-surge-micron-fedex-earnings-ahead-the-weekly-market-outlook,https://cdn.snapi.dev/images/v1/l/d/db-joe-biden-2.jpg,"Biden Leads In Polls, Coronavirus Cases Surge, Micron, FedEx Earnings Ahead: The Weekly Market Outlook",The S&P 500 dipped in a volatile week of trading as investors digested record numbers of daily U.S.,Benzinga,"Fri, 26 Jun 2020 17:11:22 -0400",,Neutral,Article
https://www.youtube.com/watch?v=OmKF1xhAtFA,https://cdn.snapi.dev/images/v1/u/d/oil-better-than-a-few-weeks-ago-harold-hamm.jpg,Oil better than a few weeks ago: Harold Hamm,"CNBC's Kelly Evans discusses oil with Harold Hamm, founder and executive chairman of Continental Resources.",CNBC Television,"Fri, 26 Jun 2020 16:58:12 -0400",oil,Positive,Video
https://www.youtube.com/watch?v=LNLV_4qF34E,https://cdn.snapi.dev/images/v1/n/0/market-sell-off-is-an-opportunity-to-rotate-into-proper-sectors-investing-pro.jpg,Market sell-off is an opportunity to rotate into proper sectors: Investing pro,CNBC's Kelly Evans discusses the markets and stock picks with Jeff Kilburg of KKM Financial.,CNBC Television,"Fri, 26 Jun 2020 16:58:04 -0400",,Positive,Video
https://www.youtube.com/watch?v=yQG4d5N4R7Y,https://cdn.snapi.dev/images/v1/g/u/imf-managing-director-georgieva-market-reacting-to-strong-action-by-central-banks.jpg,IMF Managing Director Georgieva: Market reacting to strong action by central banks,"Kristalina Georgieva, IMF Managing Director, joins ""Closing Bell"" to talk about the markets.",CNBC Television,"Fri, 26 Jun 2020 16:49:25 -0400",,Negative,Video
https://www.reuters.com/article/us-usa-stocks-weekahead/investors-eye-economic-data-stimulus-measures-as-stocks-rally-stalls-idUSKBN23X282,https://cdn.snapi.dev/images/v1/q/b/105378182-1534450322081nyse.jpg,"Investors eye economic data, stimulus measures as stocks rally stalls",Upcoming U.S. economic data and deadlines for renewing some fiscal stimulus measures in July could prove key tests for an equities rebound that has wavered in recent weeks.,Reuters,"Fri, 26 Jun 2020 16:47:00 -0400",,Negative,Article
https://www.youtube.com/watch?v=YEgDKS62hZQ,https://cdn.snapi.dev/images/v1/g/t/jefferies-chief-market-strategist-david-zervos-on-markets.jpg,Jefferies Chief Market Strategist David Zervos on markets,"David Zervos, Chief Market Strategist at Jefferies and Liz Young, BNY Mellon Investment Management, join ""Closing Bell"" to talk about the markets.",CNBC Television,"Fri, 26 Jun 2020 16:40:22 -0400",,Neutral,Video
https://www.cnbc.com/2020/06/26/stock-market-today-four-market-watchers-give-outlook-for-july.html,https://cdn.snapi.dev/images/v1/i/h/105287539-gettyimages-958440142.jpg,"After a rocky June, four market watchers share their outlook for July",Stocks dropped again on Friday with just days left in the month. The S&P 500 is on track to close out June down 1%.,CNBC,"Fri, 26 Jun 2020 16:29:27 -0400",,Negative,Article
https://seekingalpha.com/article/4355919-how-markets-set-prices-part-i,https://cdn.snapi.dev/images/v1/g/e/gettyimages-1187891590jpgw600-6.jpg,How Markets Set Prices: Part I,"Investors think they know how markets work, but the reality is often quite different.",Seeking Alpha,"Fri, 26 Jun 2020 16:16:00 -0400",,Neutral,Article
https://www.reuters.com/article/us-usa-stocks/wall-street-ends-lower-as-coronavirus-surge-prompts-renewed-restrictions-idUSKBN23X1K5,https://cdn.snapi.dev/images/v1/c/o/covid-1948.jpg,Wall Street ends lower as coronavirus surge prompts renewed restrictions,Wall Street's major indexes tumbled on Friday as several U.S. states imposed business restrictions in response to a surge in coronavirus cases.,Reuters,"Fri, 26 Jun 2020 16:04:00 -0400",,Negative,Article
https://www.forbes.com/sites/sergeiklebnikov/2020/06/26/dow-plunges-700-points-as-us-hits-record-number-of-new-coronavirus-cases/,https://cdn.snapi.dev/images/v1/d/l/dow-plunges-700-points-as-us-hits-record-number-of-new-coronavirus-cases.jpg,Dow Plunges 700 Points As U.S. Hits Record Number Of New Coronavirus Cases,Wall Street remains worried about a spike in new cases across the country.,Forbes,"Fri, 26 Jun 2020 16:00:34 -0400",,Negative,Article
https://www.forbes.com/sites/sergeiklebnikov/2020/06/26/china-warns-us-meddling-in-hong-kong-could-derail-phase-one-trade-deal/,https://cdn.snapi.dev/images/v1/e/f/china-warns-us-meddling-in-hong-kong-could-derail-phase-one-trade-deal.jpg,China Warns U.S. ‘Meddling’ In Hong Kong Could Derail Phase One Trade Deal,Rising U.S.-China tensions have put the trade deal in jeopardy.,Forbes,"Fri, 26 Jun 2020 15:15:48 -0400",,Negative,Article
https://www.youtube.com/watch?v=RvTaXj2laAw,https://cdn.snapi.dev/images/v1/d/7/why-wall-street-executives-are-planning-for-a-biden-presidential-win.jpg,Why Wall Street executives are planning for a Biden presidential win,"Brian Schwartz, CNBC political finance reporter, joins 'Power Lunch' to discuss how Wall Street executives are bracing for a Joe Biden presidential win.",CNBC Television,"Fri, 26 Jun 2020 15:06:30 -0400",,Neutral,Video
https://invezz.com/news/2020/06/26/ftse-100-ends-slightly-up-on-friday-but-remains-dovish-on-the-weekly-chart/,https://cdn.snapi.dev/images/v1/d/d/ddew1dddd.jpg,FTSE 100 ends slightly up on Friday but remains dovish on the weekly chart,The post FTSE 100 ends slightly up on Friday but remains dovish on the weekly chart appeared first on Invezz.,Invezz,"Fri, 26 Jun 2020 14:53:44 -0400",,Neutral,Article
https://www.youtube.com/watch?v=2ItQaamo_14,https://cdn.snapi.dev/images/v1/z/7/how-an-increase-in-coronavirus-cases-could-impact-economic-recovery-and-the-markets.jpg,How an increase in coronavirus cases could impact economic recovery and the markets,Principal Global Investors Global investment Strategist Seema Shah joins Yahoo Finance’s On The Move panel to discuss how a second wave of coronavirus cases could impact stocks and the economy.,Yahoo Finance,"Fri, 26 Jun 2020 14:52:04 -0400",,Negative,Video
https://www.marketwatch.com/story/oil-futures-end-with-a-loss-with-us-prices-down-more-than-3-for-the-week-2020-06-26,https://cdn.snapi.dev/images/v1/o/i/oil43-11.jpg,"Oil futures end with a loss, with U.S. prices down more than 3% for the week","Oil futures fell on Friday, sending U.S. prices down by more than 3% for the week as the increasing numbers of coronavirus cases looked to hamper a recovery in energy demand.",Market Watch,"Fri, 26 Jun 2020 14:50:28 -0400",oil,Negative,Article
https://www.youtube.com/watch?v=Dnxm_w36QtQ,https://cdn.snapi.dev/images/v1/7/m/pimcos-schneider-on-investing-in-low-rate-environment.jpg,PIMCO's Schneider on investing in low-rate environment,PIMCO's Jerome Schneider says look to the front-end of the market during Fed sponsorship for high-end quality and optionality.,CNBC Television,"Fri, 26 Jun 2020 14:12:39 -0400",,Neutral,Video
https://www.benzinga.com/personal-finance/financial-advisors/20/06/16411315/financial-advisors-looking-at-active-investing-in-a-new-way,https://cdn.snapi.dev/images/v1/v/e/business-1730089-1920-1-12.jpg,Financial Advisors: Looking at Active Investing in a New Way,"In volatile bear markets, there’s not much glory to be had in sensible index fund investing.",Benzinga,"Fri, 26 Jun 2020 14:10:54 -0400",,Neutral,Article
https://www.seeitmarket.com/sp-500-index-skews-bearish-over-short-term/,https://cdn.snapi.dev/images/v1/q/z/an-etf-strategy-to-smooth-out-the-volatility-in-small-cap-exposure.jpg,S&P 500 Index Skews Bearish Over Short-Term,S&P 500 Trading Outlook (3-5 Days):  Bearish Thursday’s snapback rally looked to be counter-trend in nature and should stop Friday and/or Monday and turn back lower. We would need to see the S&P 500 rally more than 61.8% of the Tuesday to Thursday decline to lessen our bearish short-term conviction.,See It Market,"Fri, 26 Jun 2020 14:00:36 -0400",,Negative,Article
https://www.benzinga.com/general/20/06/16410974/how-likely-a-v-shaped-economic-recovery-might-be,https://cdn.snapi.dev/images/v1/o/e/urlhttps3a2f2fgfoolcdncom2feditorial2fimages2f5799012fgettyimages-1213521693jpgw700opresize.jpg,How Likely A V Shaped Economic Recovery Might Be,"How likely is a V-shaped recovery curve? That question may still be up in the air, with positive May unemployment numbers giving hope to advocates of a fast recovery offset by climbing COVID-19 cases, hospitalizations and death rates in major cities throughout June, following a post-Memorial Day surge.",Benzinga,"Fri, 26 Jun 2020 13:49:43 -0400",,Neutral,Article
https://nypost.com/2020/06/26/us-stock-market-dive-on-fed-action-coronavirus-resurgence/,https://cdn.snapi.dev/images/v1/h/l/sized-bull-copyjpgquality90stripall.jpg,"Stocks dive on coronavirus spike, Fed’s cap on shareholder payouts",Wall Street’s major indexes dropped on Friday as the US set a new record for a one-day increase in coronavirus cases and bank stocks tumbled after the Federal Reserve decided to cap shareholder payouts. The S&P 500 banks sub-index declined 5 percent after the Fed limited dividend payments and barred share repurchases until at least.,New York Post,"Fri, 26 Jun 2020 13:48:17 -0400",,Negative,Article
https://www.reuters.com/article/us-usa-economy-sentiment/consumer-sentiment-tepid-in-u-s-south-as-covid-19-cases-spike-idUSKBN23X2JN,https://cdn.snapi.dev/images/v1/v/s/m02d20200626t2i1523776088w940fhfwllplsqrlynxmpeg5p1o2.jpg,Consumer sentiment tepid in U.S. South as COVID-19 cases spike,Consumers in southern U.S. states where COVID-19 infections spiked to record levels after authorities rushed to reopen businesses were less optimistic about economic conditions in June than residents in areas that proceeded more cautiously and followed the advice of health experts.,Reuters,"Fri, 26 Jun 2020 13:45:00 -0400",,Neutral,Article
https://www.benzinga.com/analyst-ratings/analyst-color/20/06/16406586/analyst-says-feds-stress-test-measures-an-earnings-issue,https://cdn.snapi.dev/images/v1/1/e/safe-913452-1920-24.jpg,Analyst Says Fed's Stress Test Measures An 'Earnings Issue',"The Federal Reserve's new restrictions on banks' ability to pay dividends and buyback shares is a ""big deal,"" but there are still opportunities for investors, Raymond James analyst Michael Rose said on CNBC's ""Worldwide Exchange.",Benzinga,"Fri, 26 Jun 2020 13:43:14 -0400",earnings,Negative,Article
https://www.cnbc.com/2020/06/26/jobs-report-will-be-a-litmus-test-for-economy-as-investors-focus-on-surge-in-virus-outbreaks.html,https://cdn.snapi.dev/images/v1/7/7/106551748-1590491426318gettyimages-1215156253.jpeg,Fragile economic recovery faces first big test with June jobs report in the week ahead,"The second half of 2020 is here, and now it's up to the economy to prove that the stock market was right about a sharp comeback in growth.",CNBC,"Fri, 26 Jun 2020 13:38:48 -0400",,Neutral,Article
https://www.marketwatch.com/story/gold-futures-post-a-gain-for-the-session-climb-for-the-week-2020-06-26,https://cdn.snapi.dev/images/v1/g/o/gold16-12.jpg,"Gold futures post a gain for the session, climb for the week","Gold futures rose Friday, posting a gain for the week as the rise in COVID-19 cases in the U.S.",Market Watch,"Fri, 26 Jun 2020 13:37:17 -0400",gold,Positive,Article
https://www.youtube.com/watch?v=etbZsfTKTy8,https://cdn.snapi.dev/images/v1/y/a/pgim-ceo-hunt-expects-risk-off-trade-to-last-through-august.jpg,PGIM CEO Hunt Expects Risk-Off Trade to Last Through August,"David Hunt, chief executive officer at PGIM, says the economic recovery from the coronavirus pandemic will be much slower than what is priced into the markets and the federal government needs to get more money into the hands of small businesses.",Bloomberg Markets and Finance,"Fri, 26 Jun 2020 13:35:22 -0400",CEO,Negative,Video
https://www.youtube.com/watch?v=Mb8NbAQFcfk,https://cdn.snapi.dev/images/v1/u/z/why-fundstrats-tom-lee-isnt-wavering-on-his-bullish-market-calls.jpg,Why Fundstrat's Tom Lee isn't wavering on his bullish market calls,CNBC's Scott Wapner discusses the market action and what traders should know with Tom Lee of Fundstrat.,CNBC Television,"Fri, 26 Jun 2020 13:18:01 -0400",,Positive,Video
https://www.reuters.com/article/us-global-markets/global-stock-markets-sink-as-u-s-virus-concerns-offset-europe-rebound-hopes-idUSKBN23X009,https://cdn.snapi.dev/images/v1/n/a/nash1eff-2.jpg,Global stock markets sink as U.S. virus concerns offset Europe rebound hopes,Global equities sank and perceived safe-haven assets like U.S. Treasuries and gold gained on Friday as investors weighed hopes that Europe will continue to rebound from the coronavirus pandemic's economic damage against concerns over a record surge in new COVID-19 infections in the United States.,Reuters,"Fri, 26 Jun 2020 13:16:00 -0400",,Negative,Article
https://www.youtube.com/watch?v=fnJgiuu_oSw,https://cdn.snapi.dev/images/v1/e/e/markets-will-drop-10-15-if-we-dont-get-another-stimulus-package-dennis-debusschere.jpg,Markets will drop 10-15% if we don't get another stimulus package: Dennis DeBusschere,"Dennis DeBusschere, Evercore ISISenior Managing Director discusses the need for more stimulus, increase in coronavirus cases and the stock market.",Yahoo Finance,"Fri, 26 Jun 2020 13:02:05 -0400",,Negative,Video
https://www.youtube.com/watch?v=gh54PQw6mLM,https://cdn.snapi.dev/images/v1/d/a/bair-says-banker-bonuses-should-take-a-hit-after-fed-caps-dividends.jpg,Bair Says Banker Bonuses Should 'Take a Hit' After Fed Caps Dividends,"Sheila Bair, former chairman of the U.S. Federal Deposit Insurance Corp. and senior policy adviser at DLA Piper, discusses the Federal Reserve's move to cap buybacks and dividend payments for the country's largest banks, limiting banker pay, and the need for increased regulatory oversight of the hedge fund and private equity industries. She speaks on ""Bloomberg Markets.""",Bloomberg Markets and Finance,"Fri, 26 Jun 2020 12:54:30 -0400",dividend,Negative,Video
https://seekingalpha.com/article/4355863-time-to-hedge-big-gains,https://cdn.snapi.dev/images/v1/s/t/stocks23-51.jpg,Time To Hedge Big Gains,The market has been in overdrive since its bottom on March 23rd.,Seeking Alpha,"Fri, 26 Jun 2020 12:49:36 -0400",,Positive,Article
https://247wallst.com/economy/2020/06/26/us-consumer-sentiment-edges-higher-in-june-survey/,https://cdn.snapi.dev/images/v1/j/u/rodo2111-1.jpg,US Consumer Sentiment Edges Higher in June Survey,The University of Michigan Consumer Sentiment Index improved from a final May reading of 72.3 to June’s final level of 78.1.,24/7 Wall Street,"Fri, 26 Jun 2020 12:39:46 -0400",,Positive,Article
https://www.youtube.com/watch?v=aAU4yZrnEEo,https://cdn.snapi.dev/images/v1/g/r/v-shaped-economic-recovery-unlikely-pgim-ceo-hunt-says.jpg,"V-Shaped Economic Recovery Unlikely, PGIM CEO Hunt Says","David Hunt, chief executive officer at PGIM, says the economic recovery from the coronavirus pandemic will be much slower and a lot more uneven than most people believe or what is priced into the markets.",Bloomberg Markets and Finance,"Fri, 26 Jun 2020 12:34:39 -0400",CEO,Negative,Video
https://www.benzinga.com/markets/futures/20/06/16401604/these-could-be-the-key-signs-of-economic-recovery,https://cdn.snapi.dev/images/v1/y/p/absolutvision-ucmkx2h1y38-unsplash-1.jpg,These Could Be The Key Signs Of Economic Recovery,Over the last three months we have seen the quickest pivot from economic prosperity to calamity in our nation's history.,Benzinga,"Fri, 26 Jun 2020 12:20:26 -0400",,Positive,Article
https://www.reuters.com/article/us-markets-stocks-europe/investors-warm-to-europe-as-biden-lead-virus-fears-rattle-wall-street-idUSKBN23X2BF,https://cdn.snapi.dev/images/v1/w/y/m02d20200626t2i1523764802w940fhfwllplsqrlynxmpeg5p1ij.jpg,"Investors warm to Europe as Biden lead, virus fears rattle Wall Street",European stocks look poised to make up ground on Wall Street in the second half of 2020 as Joe Biden consolidates his lead over Donald Trump ahead of the November U.S. presidential election and a surge of new COVID-19 cases threatens the U.S.,Reuters,"Fri, 26 Jun 2020 12:19:00 -0400",,Negative,Article
https://www.cnn.com/2020/06/26/investing/stocks-may-june-summer/index.html,https://cdn.snapi.dev/images/v1/c/h/200625170546-nyse-0622-restricted-super-169.jpg,Expect stock market fireworks in the next few months. Here's how to survive,The late spring and summer is supposed to be a sleepy time for the stock market. But this is shaping up to be an atypical summer in a year that has been anything but normal.,CNN Business,"Fri, 26 Jun 2020 12:12:02 -0400",,Positive,Article
https://www.seeitmarket.com/bearish-divergences-abound-in-nasdaq-100-index/,https://cdn.snapi.dev/images/v1/v/p/105638005-1545256725122gettyimages-1084667734.jpg,Bearish Divergences Abound in Nasdaq 100 Index,"Today’s chart is the Nasdaq 100 index, and the focus is on bearish divergences. The Nasdaq 100 chart doesn’t just show the Nasdaq 100, it actually reflects patterns that I’m seeing in plenty of Technology, Communication Services, and Consumer Discretionary stocks.",See It Market,"Fri, 26 Jun 2020 12:04:23 -0400",,Negative,Article
https://www.youtube.com/watch?v=kqcw0yLoWIQ,https://cdn.snapi.dev/images/v1/1/r/wilbur-ross-consumer-spending-will-continue-to-lead-economic-recovery.jpg,Wilbur Ross: ‘Consumer spending will continue to lead’ economic recovery,U.S. Commerce Secretary Wilbur Ross talks to FOX Business’ Stuart Varney about President Trump’s executive order and economic recovery in the U.S.,Fox Business,"Fri, 26 Jun 2020 12:00:27 -0400",,Positive,Video
https://www.youtube.com/watch?v=lnok-MBehaE,https://cdn.snapi.dev/images/v1/m/q/the-stock-market-seems-to-be-tracking-coronavirus-deaths-not-cases-strategist.jpg,The stock market seems to be tracking coronavirus deaths not cases: Strategist,"Yahoo Finance’s Alexis Christoforous and Brian Sozzi discuss what’s moving the markets Friday with Jeffrey Kleintop, Charles Schwab Chief Global Investment Strategist.",Yahoo Finance,"Fri, 26 Jun 2020 11:37:49 -0400",,Neutral,Video
https://www.reuters.com/article/us-usa-stocks-weekahead/wall-street-week-ahead-investors-eye-economic-data-stimulus-measures-as-stocks-rally-stalls-idUSKBN23X282,https://cdn.snapi.dev/images/v1/a/l/al2wedf2-6.jpg,"Wall Street Week Ahead: Investors eye economic data, stimulus measures as stocks rally stalls",Upcoming U.S. economic data and deadlines for renewing some fiscal stimulus measures in July could prove key tests for an equities rebound that has wavered in recent weeks.,Reuters,"Fri, 26 Jun 2020 11:35:00 -0400",,Negative,Article
https://www.etftrends.com/disruptive-technology-channel/exploring-strategic-allocation-in-uncertain-times/,https://cdn.snapi.dev/images/v1/o/g/ogktr66-22.jpg,Exploring Strategic Allocations In Uncertain Times,"To say the market has been thrown a few curveballs this year would be an understatement. As Ark Investment Management can attest, finding the right balance between growth and volatility has been especially challenging due to uncertainty stemming from nearly every direction.",ETF Trends,"Fri, 26 Jun 2020 11:19:15 -0400",,Neutral,Article
https://www.zacks.com/stock/news/993157/record-high-consumer-spending-in-may,https://cdn.snapi.dev/images/v1/s/t/stocks222-18.jpg,Record High Consumer Spending in May,"Market indexes on Thursday turned early morning selling into robust buying by the closing bell. This morning, we’re starting out the same way — down on COVID-19 updates in the South and Western U.S. and the subsequent obstacles to a clean reopening of the economy.",Zacks Investment Research,"Fri, 26 Jun 2020 11:12:00 -0400",,Positive,Article
https://www.cnn.com/2020/06/26/investing/dow-stock-market-today/index.html,https://cdn.snapi.dev/images/v1/w/3/200626104136-nyse-0603-restricted-super-169.jpg,Dow slides more than 500 points as the economic outlook gets drearier,The Dow and the broader US stock market tumbled Friday as investors grow increasingly worried about the economic outlook.,CNN Business,"Fri, 26 Jun 2020 11:09:15 -0400",,Negative,Article
