news_url,image_url,title,text,source_name,date,topics,sentiment,type
https://www.youtube.com/watch?v=sFGn_kASC-g,https://cdn.snapi.dev/images/v1/m/q/dollar-suffering-from-a-number-of-angles-td-securities.jpg,Dollar Suffering From a Number of Angles: TD Securities,"Mitul Kotecha, senior emerging markets strategist TD Securities, discusses the outlook for the dollar and Asian currencies. He speaks with Rishaad Salamat and Tom Mackenzie on ""Bloomberg Markets: Asia.""",Bloomberg Markets and Finance,"Thu, 23 Jul 2020 23:28:01 -0400",,Negative,Video
https://seekingalpha.com/article/4360495-are-in-secular-stagnating-market-neville?utm_source=feed_articles_market_outlook_economy&utm_medium=referral,https://cdn.snapi.dev/images/v1/d/e/dew2wed22-16.jpg,We Are In A Secular Stagnating Market: Neville,"The Fed’s monetary policies, especially in response to the pandemic, entrenches calcified mega-companies, rendering the zombification effect.",Seeking Alpha,"Thu, 23 Jul 2020 23:27:15 -0400",,Negative,Article
https://www.youtube.com/watch?v=wifaTJiGRoU,https://cdn.snapi.dev/images/v1/d/w/cant-see-why-gold-rally-will-stop-says-evolution-minings-klein.jpg,"Can’t See Why Gold Rally Will Stop, Says Evolution Mining's Klein","Jake Klein, executive chairman at Evolution Mining Ltd., discusses the rally in gold, where he sees prices heading and his outlook for silver. He speaks exclusively on “Bloomberg Daybreak: Asia.”",Bloomberg Markets and Finance,"Thu, 23 Jul 2020 23:06:49 -0400",gold,Positive,Video
https://www.reuters.com/article/us-global-oil/oil-rises-on-weaker-dollar-but-virus-woes-and-u-s-china-tensions-weigh-idUSKCN24P04M,https://cdn.snapi.dev/images/v1/q/k/m02d20200724t2i1526932856w940fhfwllplsqrlynxnpeg6n026.jpg,"Oil rises on weaker dollar, but virus woes and U.S.-China tensions weigh","Oil edged up on Friday as the dollar fell to an almost two-year low, although demand concerns stemming from rising coronavirus cases and U.S.-China tensions kept a lid on prices.",Reuters,"Thu, 23 Jul 2020 21:49:00 -0400",oil,Positive,Article
https://www.cnbc.com/2020/07/23/winning-main-street-trade-is-moving-too-far-too-fast-pncs-amanda-agati-says.html,https://cdn.snapi.dev/images/v1/9/d/105644950-1545622148395gettyimages-608724208.jpeg,"Winning Main Street trade is moving too far, too fast, PNC's Amanda Agati says",PNC Financial's Amanda Agati warns fundamentals don't support small cap value's strong run.,CNBC,"Thu, 23 Jul 2020 20:02:50 -0400",,Negative,Article
https://www.youtube.com/watch?v=HL1o03WrBtw,https://cdn.snapi.dev/images/v1/q/w/jim-cramer-tells-investors-to-be-patient-if-large-tech-stocks-start-to-sell-off-around-earnings.jpg,Jim Cramer tells investors to be patient if large tech stocks start to sell off around earnings,"CNBC's Jim Cramer says Big Tech stocks may come under pressure this earnings season, but that doesn't mean there is anything fundamentally wrong with the companies.",CNBC Television,"Thu, 23 Jul 2020 19:49:05 -0400","earnings,cramer",Neutral,Video
https://www.reuters.com/article/us-global-markets/asia-markets-to-fall-on-china-vow-to-retaliate-against-u-s-idUSKCN24O36J,https://cdn.snapi.dev/images/v1/e/i/m02d20200723t2i1526924476w940fhfwllplsqrlynxnpeg6m1xn.jpg,Asia markets to fall on China vow to retaliate against U.S.,"Asian markets are set to open mostly lower on Friday as China vowed to retaliate against a U.S. order to close one of its consulates, and the American equity markets fell on gloomy data about its labor market.",Reuters,"Thu, 23 Jul 2020 19:43:00 -0400",,Negative,Article
https://www.youtube.com/watch?v=K_tE0tOSa9M,https://cdn.snapi.dev/images/v1/o/f/ofkrew2.jpg,Scalise on the Senate GOP relief package,"Rep. Steve Scalise, (R-La.), the House Republican Whip, joins ""Closing Bell"" to talk about the Senate relief package that will be released early next week.",CNBC Television,"Thu, 23 Jul 2020 19:34:51 -0400",,Neutral,Video
https://www.forbes.com/sites/mikepatton/2020/07/23/the-disconnect-between-stock-performance-and-the-economy-4-reasons-stocks-are-poised-to-fall/,https://cdn.snapi.dev/images/v1/h/k/the-disconnect-between-stock-performance-and-the-economy-4-reasons-stocks-are-poised-to-fall.jpg,The Disconnect Between Stock Performance And The Economy: 4 Reasons Stocks Are Poised To Fall,Investors have been watching the disconnect between stock prices and the economy as stocks have continued to rise despite the worst economic downturn since the Great Depression.,Forbes,"Thu, 23 Jul 2020 19:00:48 -0400",,Negative,Article
https://www.nytimes.com/2020/07/23/business/economy/unemployment-economy-coronavirus.html,https://cdn.snapi.dev/images/v1/i/w/stocks22-34.jpg,Rise in Unemployment Claims Signals an Economic Reversal,Job losses showed no letup as a surge in coronavirus cases forced new business shutdowns and a $600 weekly federal benefit inched to its expiration.,NYTimes,"Thu, 23 Jul 2020 18:47:59 -0400",paywall,Negative,Article
https://www.youtube.com/watch?v=tOGrULkXrj8,https://cdn.snapi.dev/images/v1/e/4/trump-trade-deal-with-china-means-less-to-me-now.jpg,Trump: Trade deal with China 'means less to me now',President Trump discusses reopening schools during a news conference at the White House.,Fox Business,"Thu, 23 Jul 2020 18:20:01 -0400",,Negative,Video
https://www.fool.com/investing/2020/07/23/sp-500-index-falls-40-points-worst-day-since-june.aspx,https://cdn.snapi.dev/images/v1/j/4/urlhttps3a2f2fgfoolcdncom2feditorial2fimages2f5835062fcoronavirus-testjpgw700opresize.jpg,"S&P 500 Index Falls 40 Points: Worst Day Since June as Surge in Unemployment Claims, Coronavirus Cases Sends Apple, Tesla, Microsoft Stocks Down Sharply","Initial jobless claims surpassed 1.4 million last week, a higher figure than the prior week as surging cases of COVID-19 slow the economic recovery.",The Motley Fool,"Thu, 23 Jul 2020 18:18:20 -0400",,Negative,Article
https://www.youtube.com/watch?v=8zMH_WohidI,https://cdn.snapi.dev/images/v1/d/i/diewk2.jpg,How to play the magic metal run,"Here's what trader Brian Kelly says is driving gold's gains. With CNBC's Melissa Lee and the Fast Money traders, Tim Seymour, Bonawyn Eisen and Karen Finerman.",CNBC Television,"Thu, 23 Jul 2020 18:10:10 -0400",gold,Positive,Video
https://www.cnbc.com/2020/07/23/stock-market-futures-open-to-close-news.html,https://cdn.snapi.dev/images/v1/7/n/106200938-1571917270428rtx76uum.jpg,Stock futures rise slightly after Thursday's sharp sell-off,U.S. stock futures rose on Thursday night after broad declines in the major tech names pushed the major averages lower during regular trading.,CNBC,"Thu, 23 Jul 2020 18:02:15 -0400",,Positive,Article
https://www.youtube.com/watch?v=aE_RrNgemqo,https://cdn.snapi.dev/images/v1/s/u/dollar-weakness-trend-is-gaining-strength-state-streets-loh.jpg,Dollar Weakness Trend Is Gaining Strength: State Street’s Loh,"Jul.23 -- Marvin Loh, senior global market strategist at State Street, discusses the decline of the U.S.",Bloomberg Markets and Finance,"Thu, 23 Jul 2020 17:59:25 -0400",,Negative,Video
https://www.youtube.com/watch?v=SLeFaKFHp_Y,https://cdn.snapi.dev/images/v1/c/q/narrow-market-rally-can-broaden-out-in-second-half-ubss-haefele-says.jpg,"Narrow Market Rally Can Broaden Out in Second Half, UBS’s Haefele Says","“There are very few alternatives to equities right now,” says UBS Global Wealth Management Chief Investment Officer Mark Haefele, as he discusses the current stock market rally. He speaks with Bloomberg’s Francine Lacqua on “Bloomberg Surveillance.”",Bloomberg Markets and Finance,"Thu, 23 Jul 2020 17:59:16 -0400",,Positive,Video
https://www.youtube.com/watch?v=IiOVl32HtmI,https://cdn.snapi.dev/images/v1/m/q/dudley-calls-for-more-fiscal-aid-as-recovery-flattens-out.jpg,Dudley Calls for More Fiscal Aid as Recovery Flattens Out,Former New York Fed President William Dudley discusses the state of the U.S. economy and need for further stimulus for citizens and businesses. He speaks with Bloomberg’s Jonathan Ferro on “Bloomberg Surveillance.”,Bloomberg Markets and Finance,"Thu, 23 Jul 2020 17:58:55 -0400",,Negative,Video
https://deadline.com/2020/07/tech-stocks-except-twitter-drive-market-lower-disney-down-in-late-trade-mulan-theatrical-delays-1202993692/,https://cdn.snapi.dev/images/v1/z/u/twitter-stock-exchange.jpg,"Disney Down In Late Trade After ‘Mulan,’ Theatrical Delays; Tech Stocks — Except A Buoyant Twitter — Drive Market Lower","Shares of Walt Disney, which closed down 0.76%, got knocked around a bit in late trading on news that the studio is yanking Mulan’s August release date and is postponing Star Wars and Avatar pics. It was down 1.62% after hours. The news capped a day where tech stock drove shares lower with Twitter a",Deadline,"Thu, 23 Jul 2020 17:28:24 -0400",,Negative,Article
https://www.youtube.com/watch?v=aFwo_Q4SkvQ,https://cdn.snapi.dev/images/v1/u/g/how-the-fed-could-save-main-street.jpg,How the Fed could save Main Street,CNBC's Kelly Evans breaks down how fiscal and monetary policy are bolstering the U.S. economy amid the coronavirus pandemic with Hal Scott of Harvard Law School.,CNBC Television,"Thu, 23 Jul 2020 17:22:00 -0400",,Neutral,Video
https://www.youtube.com/watch?v=2rErl9S--_U,https://cdn.snapi.dev/images/v1/d/d/coronavirus-stimulus-mnuchin-says-there-is-a-fundamental-agreement-between-white-house-and-gop.jpg,Coronavirus stimulus: Mnuchin says there is a 'fundamental' agreement between White House and GOP,Yahoo Finance's Jessica Smith breaks down the latest between Republicans and the White House as they try to agree on the next round of stimulus.,Yahoo Finance,"Thu, 23 Jul 2020 17:20:48 -0400",,Positive,Video
https://www.youtube.com/watch?v=EFs2mByGuGk,https://cdn.snapi.dev/images/v1/t/e/techeth11.jpg,Here’s why tech companies are still growing,"In a remote working situation, tech is proving it may be the backbone of productivity.",Bloomberg Markets and Finance,"Thu, 23 Jul 2020 17:13:20 -0400",,Positive,Video
https://www.etftrends.com/etf-strategist-channel/signs-for-a-sustainable-recovery/,https://cdn.snapi.dev/images/v1/s/i/signs-for-a-sustainable-recovery-440x250.jpg,Signs for a Sustainable Recovery,Things We’re Watching In Addition To Stock Prices And COVID-19 Metrics We have been surprised at the magnitude of the stock market recovery since the March 23rd low.,ETF Trends,"Thu, 23 Jul 2020 17:12:59 -0400",,Neutral,Article
https://www.youtube.com/watch?v=im8CKc7WbVI,https://cdn.snapi.dev/images/v1/m/q/us-china-tensions-continue-to-escalate-toward-new-cold-war.jpg,US-China tensions continue to escalate toward new cold war,"Apjit Walia, Deutsche Bank Global Head of Technology Investment Strategy joins Yahoo Finance’s On The Move panel to break down why the tech cold war would cost $3.5 trillion and discuss how both countries approach the geopolitical trade-offs.",Yahoo Finance,"Thu, 23 Jul 2020 17:03:40 -0400",,Negative,Video
https://www.zacks.com/commentary/1014919/can-tech-stocks-keep-their-momentum,https://cdn.snapi.dev/images/v1/9/g/podc9.jpg,Can Tech Stocks Keep Their Momentum?,"While our Q1 GDP was down by 5%, the real story on the US economy will be told with the Q2 reading. Our Chief Equity Strategist and Economist, John Blank, joins me now to explain.",Zacks Investment Research,"Thu, 23 Jul 2020 17:03:00 -0400",podcast,Neutral,Article
https://www.zacks.com/commentary/1014917/should-you-buy-the-rally-in-non-us-stocks,https://cdn.snapi.dev/images/v1/s/h/podc8.jpg,Should You Buy the Rally in Non-US Stocks?,"Given the huge amount of U.S. and global central bank easing, it should be no surprise that Non-U.S. stocks are now moving up across the board! Our Chief Equity Strategist and Economist, John Blank, explains now.",Zacks Investment Research,"Thu, 23 Jul 2020 16:53:00 -0400",podcast,Neutral,Article
https://www.forbes.com/sites/brendarichardson/2020/07/23/real-estate-trails-behind-stocks-as-americans-favorite-way-to-invest/,https://cdn.snapi.dev/images/v1/m/n/real-estate-trails-behind-stocks-as-americans-favorite-way-to-invest.jpg,Real Estate Trails Behind Stocks As Americans’ Favorite Way To Invest,"A new Bankrate survey shows stocks top the list of Americans’ favorite investments,  with real estate coming in a close second.",Forbes,"Thu, 23 Jul 2020 16:49:07 -0400",,Neutral,Article
https://www.kiplinger.com/investing/stocks/601113/stock-market-today-072320-tech-stocks,https://cdn.snapi.dev/images/v1/g/b/stock-market-today-072320.jpg,Stock Market Today: Tech Stocks Take a Tumble,An increase in weekly jobless benefits applications and profit-taking in tech stocks sent the major indices to steep declines Thursday.,Kiplinger,"Thu, 23 Jul 2020 16:43:55 -0400",,Negative,Article
https://www.youtube.com/watch?v=Bq9y4qQ-mso,https://cdn.snapi.dev/images/v1/q/q/senate-gop-will-unveil-new-relief-package-early-next-week.jpg,Senate GOP will unveil new relief package early next week,"CNBC's Ylan Mui reports Majority Leader Mitch McConnell said the Senate will release a relief package early next week that will have a second round of PPP, money for education, liability protections and enhanced unemployment benefits.",CNBC Television,"Thu, 23 Jul 2020 16:42:08 -0400",,Neutral,Video
https://www.cnbc.com/2020/07/23/stock-market-today-jim-cramer-and-others-on-what-to-watch-as-markets-fall.html,https://cdn.snapi.dev/images/v1/a/f/106630008-1595533108005-wall.jpg,Stocks fall after disappointing unemployment data — Jim Cramer and others on what they're watching now,Stocks were lower after disappointing jobless claims data Thursday. Microsoft shares were also a drag despite the company beating earnings estimates.,CNBC,"Thu, 23 Jul 2020 16:32:49 -0400",cramer,Negative,Article
https://www.youtube.com/watch?v=JFn2A-RH1Vw,https://cdn.snapi.dev/images/v1/t/b/podc12.jpg,Andrew Chanin: How Investors Can Cash In On The Space Economy,"Andrew Chanin, CEO of ProcureAM, joined the podcast this week to discuss how tech stocks are driving the historic market recovery and the origins of the space-themed Procure Space UFO ETF.",Investors Business Daily,"Thu, 23 Jul 2020 16:28:34 -0400",podcast,Positive,Video
https://www.cnbc.com/2020/07/23/what-happened-to-the-stock-market-thursday-sp-500-snaps-4-day-winning-streak.html,https://cdn.snapi.dev/images/v1/w/q/106545633-1589984789341gettyimages-1225668325.jpeg,Here's what happened to the stock market on Thursday (July 23),Sharp losses from the major tech stocks led the broader market lower.,CNBC,"Thu, 23 Jul 2020 16:14:48 -0400",,Negative,Article
https://www.youtube.com/watch?v=aa7RtbHXfVc,https://cdn.snapi.dev/images/v1/m/q/blueprint-capital-co-founder-says-bankruptcies-will-continue-transportation-and-healthcare-will-be.jpg,"Blueprint Capital co-founder says bankruptcies will continue, transportation and healthcare will be","More and more companies are filing for bankruptcies due to the effects of the coronavirus pandemic. Blueprint Capital Management Co-Founder Jake Walthour joins ""Closing Bell"" to talk about bankruptcies.",CNBC Television,"Thu, 23 Jul 2020 16:09:00 -0400",,Negative,Video
https://www.fool.com/investing/2020/07/23/how-retailers-are-innovating-during-covid-19.aspx,https://cdn.snapi.dev/images/v1/p/o/podc13-2.jpg,How Retailers Are Innovating During COVID-19,Discover some key innovations happening in the retail and consumer goods space right now.,The Motley Fool,"Thu, 23 Jul 2020 16:08:00 -0400",podcast,Neutral,Article
https://www.marketwatch.com/story/dow-ends-more-than-350-points-lower-as-tech-shares-lead-stock-slide-2020-07-23,https://cdn.snapi.dev/images/v1/t/h/sdfr3222-1.jpg,Dow ends more than 350 points lower as tech shares lead stock slide,"Stocks ended lower Thursday, with a slide in tech shares leading the way, as investors sifted through corporate earnings and weekly data on jobless claims.",Market Watch,"Thu, 23 Jul 2020 16:06:27 -0400",,Negative,Article
https://www.reuters.com/article/us-usa-stocks/wall-street-closes-sharply-lower-on-tech-selloff-idUSKCN24O1BV,https://cdn.snapi.dev/images/v1/s/t/stocks23-56.jpg,Wall Street closes sharply lower on tech selloff,"Wall Street dropped sharply on Thursday as investors fled market-leading tech shares due to mixed earnings reports and growing signs of a worsening coronavirus pandemic, which could exacerbate a deep economic recession.",Reuters,"Thu, 23 Jul 2020 16:05:00 -0400",,Negative,Article
https://www.forbes.com/sites/sergeiklebnikov/2020/07/23/dow-plunges-350-points-after-another-14-million-americans-file-for-unemployment/,https://cdn.snapi.dev/images/v1/a/x/dow-plunges-350-points-after-another-14-million-americans-file-for-unemployment.jpg,Dow Plunges 350 Points After Another 1.4 Million Americans File For Unemployment,"Jobless claims rose for the first time since March, indicating a slowdown in the labor market’s recovery.",Forbes,"Thu, 23 Jul 2020 16:00:31 -0400",,Negative,Article
https://www.youtube.com/watch?v=Gu8WehvxNB8,https://cdn.snapi.dev/images/v1/b/u/coronavirus-stimulus-american-families-on-unemployment-struggling-to-pay-bills-wait-anxiously.jpg,"Coronavirus stimulus: American families on unemployment struggling to pay bills, wait anxiously","Tamara Fucile, Center on Budget and Policy Priorities Senior Advisor, joins Yahoo Finance’s Zack Guzman to discuss a new report, showcasing a growing number of households that are struggling to afford food and pay rent.",Yahoo Finance,"Thu, 23 Jul 2020 15:59:26 -0400",,Negative,Video
https://www.youtube.com/watch?v=vJsWjJ1LCiY,https://cdn.snapi.dev/images/v1/y/k/if-you-let-millions-of-businesses-fail-you-threaten-to-throw-us-into-the-worst-recession-ever-aust.jpg,"If you let millions of businesses fail, you threaten to throw us into the worst recession ever: Aust","Austan Goolsbee, former Council of Economic Advisors chair, and Jimmy Pethokoukis, American Enterprise Institute, join 'Closing Bell' to discuss whether businesses need more economic stimulus and what the government's next steps should be.",CNBC Television,"Thu, 23 Jul 2020 15:55:38 -0400",,Negative,Video
https://www.zacks.com/research-daily/1014821/is-the-earnings-improvement-for-real,https://cdn.snapi.dev/images/v1/2/d/2dew2q1-12.jpg,Is the Earnings Improvement for Real?,The Zacks Research Daily presents the best research output of our analyst team.,Zacks Investment Research,"Thu, 23 Jul 2020 15:36:00 -0400",earnings,Neutral,Article
https://www.reuters.com/article/us-global-markets/gold-rallies-on-u-s-china-row-apple-news-slams-stocks-idUSKCN24N35U,https://cdn.snapi.dev/images/v1/t/x/m02d20200723t2i1526882483w940fhfwllplsqrlynxnpeg6m1fy.jpg,"Gold rallies on U.S.-China row, Apple news slams stocks",The dollar slipped to an almost two-year low and gold rose further on Thursday as a gauge of global equities retreated on concerns about a potential probe of Apple Inc took the wind out of the high-flying tech sector.,Reuters,"Thu, 23 Jul 2020 15:22:00 -0400",gold,Neutral,Article
https://www.reuters.com/article/us-global-oil/oil-falls-on-coronavirus-demand-concerns-weak-u-s-jobs-numbers-idUSKCN24O027,https://cdn.snapi.dev/images/v1/o/i/oil33-13.jpg,"Oil falls on coronavirus demand concerns, weak U.S. jobs numbers","Oil prices fell 2% on Thursday as investors worried the U.S. Congress may not agree on a stimulus package and as jobless numbers rose, while analysts prepared to cut energy demand forecasts as the number of coronavirus cases surges higher.",Reuters,"Thu, 23 Jul 2020 15:14:00 -0400",oil,Negative,Article
https://www.cnn.com/2020/07/23/investing/dow-stock-market-today/index.html,https://cdn.snapi.dev/images/v1/g/0/200723142807-nyse-0723-super-169.jpg,Dow slides as stock market momentum fizzles out,The Dow and the broader US stock market took a hit on Thursday as momentum on Wall Street fizzled out.,CNN Business,"Thu, 23 Jul 2020 15:11:18 -0400",,Negative,Article
https://www.forbes.com/sites/raulelizalde/2020/07/23/a-major-reason-for-the-market-rally-is-the-inefficient-delivery-of-government-help/,https://cdn.snapi.dev/images/v1/b/a/a-major-reason-for-the-market-rally-is-the-inefficient-delivery-of-government-help.jpg,A Major Reason For The Market Rally Is The Inefficient Delivery Of Government Help,"The equity rally since March may seem in conflict with a sharp economic contraction, but it reflects the inefficient delivery of government stimulus. Instead of going to the most affected individuals and businesses, a large portion ended up in the financial markets instead.",Forbes,"Thu, 23 Jul 2020 15:10:49 -0400",,Neutral,Article
https://seekingalpha.com/article/4360320-summer-crash-of-2020-great-re-adjustment?utm_source=feed_articles_market_outlook_todays_market&utm_medium=referral,https://cdn.snapi.dev/images/v1/s/l/sl2werf44-4.jpg,"The Summer Crash Of 2020, Or The Great Re-Adjustment","A couple of key indicators have been screaming that conditions are favoring another risk-off period, and one that could be yet another crash.",Seeking Alpha,"Thu, 23 Jul 2020 15:10:34 -0400",,Negative,Article
https://investorplace.com/2020/07/earnings-reports-are-beating-very-low-expectations/,https://cdn.snapi.dev/images/v1/4/d/earrnings-reports-businessman-300x169.jpg,Earnings Reports Are Beating VERY Low Expectations,"As some investors focus on earnings beats and misses, you should pay more attention to the margins as earnings season continues.
The post Earnings Reports Are Beating VERY Low Expectations appeared first on InvestorPlace.",InvestorPlace,"Thu, 23 Jul 2020 14:48:56 -0400",earnings,Neutral,Article
https://www.marketwatch.com/story/us-oil-prices-down-2-natural-gas-futures-rally-2020-07-23,https://cdn.snapi.dev/images/v1/o/i/oil49-13.jpg,U.S. oil prices down 2%; natural-gas futures rally,"Oil futures declined on Thursday, with a climb in U.S. crude supplies and dull prospects for energy demand pulling U.S.",Market Watch,"Thu, 23 Jul 2020 14:44:07 -0400",oil,Negative,Article
https://www.youtube.com/watch?v=gSbTmxJrcLE,https://cdn.snapi.dev/images/v1/d/t/government-needs-to-do-whats-necessary-to-make-sure-economy-can-heal-ubss-ryan.jpg,Government needs to do what's necessary to make sure economy can heal: UBS's Ryan,"Mike Ryan, UBS Global Wealth Management divisional vice chairman, joins 'Power Lunch' to discuss why UBS sees a growing optimism for the U.S.",CNBC Television,"Thu, 23 Jul 2020 14:40:51 -0400",,Neutral,Video
https://www.youtube.com/watch?v=jKSa3kvSTBI,https://cdn.snapi.dev/images/v1/m/q/white-house-and-gop-still-negotiating-stimulus.jpg,White House and GOP still negotiating stimulus,CNBC's Ylan Mui reports on agreements the GOP and Treasury Secretary have made regarding the paycheck protection program.,CNBC Television,"Thu, 23 Jul 2020 14:27:57 -0400",,Neutral,Video
https://www.cnbc.com/2020/07/23/the-step-that-needs-to-come-before-rookie-investing-in-stocks-nfl-pro.html,https://cdn.snapi.dev/images/v1/n/a/nash1eff-7.jpg,What first-time investors should do before jumping into this bull market: NFL and financial pro Brandon Copeland,"Brandon Copeland, an NFL linebacker who teaches personal finance and financial literacy at UPenn, says investing education needs to be pursued before buying into a bull market.",CNBC,"Thu, 23 Jul 2020 14:27:56 -0400",,Neutral,Article
https://www.forbes.com/sites/sergeiklebnikov/2020/07/23/dow-plunges-250-points-after-another-14-million-americans-file-for-unemployment/,https://cdn.snapi.dev/images/v1/f/v/dow-plunges-250-points-after-another-14-million-americans-file-for-unemployment.jpg,Dow Plunges 250 Points After Another 1.4 Million Americans File For Unemployment,"Jobless claims rose for the first time since March, indicating a slowdown in the labor market’s recovery.",Forbes,"Thu, 23 Jul 2020 13:50:58 -0400",,Negative,Article
