news_url,image_url,title,text,source_name,date,topics,sentiment,type
https://seekingalpha.com/article/4377472-week-41-mda-breakout-forecast-short-term-picks-to-give-you-edge?utm_source=feed_articles_stock_ideas_quick_picks&utm_medium=referral,https://cdn.snapi.dev/images/v1/h/v/m02d20200928t2i1535150307w940fhfwllplsqrlynxmpeg8r08j.jpg,Week 41 MDA Breakout Forecast: Short-Term Picks To Give You An Edge,Two new sample breakout stocks for Week 41 with better than 10% short-term upside potential. Now up an average +220.4% YTD.,Seeking Alpha,"Sat, 03 Oct 2020 15:45:43 -0400",,Positive,Article
https://www.gurufocus.com/news/1247815/us-indexes-end-lower-friday-higher-for-the-week,https://cdn.snapi.dev/images/v1/b/1/software47.jpg,"US Indexes End Lower Friday, Higher for the Week","The Dow Jones Industrial Average closed at 27,682.81 on Friday with a loss of 134.09 points or -0.48%. The S&P 500 closed at 3,348.44 for a loss of 32.36 points or -0.96%.",GuruFocus,"Sat, 03 Oct 2020 15:41:11 -0400",,Negative,Article
https://www.youtube.com/watch?v=rR8Oh0kbb3g,https://cdn.snapi.dev/images/v1/y/u/september-jobs-report-is-incredibly-disconcerting-economist.jpg,September jobs report is 'incredibly disconcerting': Economist,"Nick Bunker, Indeed for North America Director of Economic Research, joins Yahoo Finance's Kristin Myers to discuss the outlook for the U.S. labor market. #jobsreport #economy #labormarket This segment originally aired on Friday October 2, 2020.",Yahoo Finance,"Sat, 03 Oct 2020 15:00:06 -0400",,Negative,Video
https://www.youtube.com/watch?v=GlpHgfLK2u0,https://cdn.snapi.dev/images/v1/w/c/theres-still-a-lot-of-ongoing-stress-in-the-labor-market-when-job-gains-are-slowing-economist.jpg,"'There’s still a lot of ongoing stress in the labor market,' when job gains are slowing: Economist","Sarah House, Wells Fargo Senior Economist, joins The Final Round to discuss her thoughts on the markets and the impact of the September jobs report, which was below estimates.",Yahoo Finance,"Sat, 03 Oct 2020 15:00:02 -0400",,Negative,Video
https://seekingalpha.com/article/4377461-weekly-commentary-covid-uncertainties?utm_source=feed_articles_market_outlook_todays_market&utm_medium=referral,https://cdn.snapi.dev/images/v1/c/m/ipos-banner-year-markets-e1600964930157jpgquality90stripall.jpg,Weekly Commentary: COVID Uncertainties,"It significantly raises the stakes for a potential nightmare scenario: with less than five weeks until election day, the President contracts COVID-19. As if this election cycle wasn't chaotic enough.",Seeking Alpha,"Sat, 03 Oct 2020 10:41:13 -0400",,Negative,Article
https://seekingalpha.com/article/4377460-macro-policy-mix-and-quad?utm_source=feed_articles_market_outlook_economy&utm_medium=referral,https://cdn.snapi.dev/images/v1/9/n/m02d20200922t2i1534450354w940fhfwllplsqrlynxnpeg8l0x4.jpg,Macro: The Policy Mix And The Quad,The pandemic has synchronized the global economic cycle.,Seeking Alpha,"Sat, 03 Oct 2020 10:39:59 -0400",,Neutral,Article
https://invezz.com/news/2020/10/03/dow-jones-sp-500-and-nasdaq-composite-advanced-on-a-weekly-basis/,https://cdn.snapi.dev/images/v1/w/a/dow-jones-march-19.jpg,"Dow Jones, S&P 500 and Nasdaq Composite advanced on a weekly basis","The US stock market weakened this Friday pressured by the news that US President Donald Trump has contracted COVID-19 and data showing a slowdown in recovery in the battered US labor market. The Dow Jones Industrial Average fell almost 0.5% while the Nasdaq Composite dropped 2.2%, capping the week up nearly 1.5%.",Invezz,"Sat, 03 Oct 2020 09:11:59 -0400",,Neutral,Article
https://seekingalpha.com/article/4377452-top-charts?utm_source=feed_articles_market_outlook_economy&utm_medium=referral,https://cdn.snapi.dev/images/v1/d/l/stocks141-82.jpg,Top Charts,The September jobs report was viewed by some as evidence that the recovery was slowing.,Seeking Alpha,"Sat, 03 Oct 2020 09:10:03 -0400",tanalysis,Neutral,Article
https://seekingalpha.com/article/4377450-is-u-s-economic-recovery-slowing-what-september-jobs-report-reveals?utm_source=feed_articles_market_outlook_economy&utm_medium=referral,https://cdn.snapi.dev/images/v1/8/g/m02d20200928t2i1535196174w940fhfwllplsqrlynxmpeg8r11p.jpg,Is The U.S. Economic Recovery Slowing? What The September Jobs Report Reveals,U.S. monthly job gains fall short of consensus forecasts.,Seeking Alpha,"Sat, 03 Oct 2020 08:57:39 -0400",,Negative,Article
https://seekingalpha.com/article/4377447-week-ahead-markets-hate-uncertainty?utm_source=feed_articles_market_outlook_todays_market&utm_medium=referral,https://cdn.snapi.dev/images/v1/r/d/wall-street-stocksjpgquality90stripall.jpg,Week Ahead - Markets Hate Uncertainty,You're going to be hearing the word uncertainty a lot over the next month.,Seeking Alpha,"Sat, 03 Oct 2020 08:27:45 -0400",,Negative,Article
https://seekingalpha.com/article/4377445-private-payrolls-added-877000-remain-well-below-prior-peak?utm_source=feed_articles_market_outlook_economy&utm_medium=referral,https://cdn.snapi.dev/images/v1/w/b/dow-rallies-350-points-but-stocks-are-down-for-a-fourth-week-in-a-row.jpg,"Private Payrolls Added 877,000, But Remain Well Below The Prior Peak","Private Payrolls Added 877,000, But Remain Well Below The Prior Peak",Seeking Alpha,"Sat, 03 Oct 2020 08:20:12 -0400",,Neutral,Article
https://www.fool.com/investing/2020/10/03/3-dates-for-investors-to-circle-in-october/,https://cdn.snapi.dev/images/v1/l/d/urlhttps3a2f2fgfoolcdncom2feditorial2fimages2f5938022fgettyholding-phone-while-typing-on-laptopjpgw700opresize.jpg,3 Dates for Investors to Circle in October,"This has been a wild and ultimately unpredictable year, so why not do one last unpredictable thing by trying to predict things that will happen in the next three months.",The Motley Fool,"Sat, 03 Oct 2020 06:08:00 -0400",,Neutral,Article
https://seekingalpha.com/article/4377435-s-and-p-500-weekly-update-october-surprise-doesnt-change-market-outlook?utm_source=feed_articles_market_outlook_todays_market&utm_medium=referral,https://cdn.snapi.dev/images/v1/3/t/m02d20200922t2i1534450354w940fhfwllplsqrlynxnpeg8l0x4.jpg,S&P 500 Weekly Update: An 'October Surprise' Doesn't Change The Market Outlook,S&P 500 Weekly Update: An 'October Surprise' Doesn't Change The Market Outlook,Seeking Alpha,"Sat, 03 Oct 2020 05:16:48 -0400",,Neutral,Article
https://www.nytimes.com/2020/10/03/upshot/pandemic-economy-recession.html,https://cdn.snapi.dev/images/v1/p/q/04up-recession-illo-articlelargejpgquality75autowebpdisableupscale.jpg,The Pandemic Depression Is Over. The Pandemic Recession Has Just Begun.,"Signs of a slower, grinding recovery sure look familiar.",NYTimes,"Sat, 03 Oct 2020 05:00:09 -0400",paywall,Negative,Article
https://seekingalpha.com/article/4377432-stimulus-and-stocks-beware-unintended-consequences?utm_source=feed_articles_market_outlook_todays_market&utm_medium=referral,https://cdn.snapi.dev/images/v1/g/y/wall-street-stocksjpgquality90stripall.jpg,Stimulus And Stocks: Beware The Unintended Consequences,Stimulus And Stocks: Beware The Unintended Consequences,Seeking Alpha,"Sat, 03 Oct 2020 03:01:20 -0400",,Negative,Article
https://seekingalpha.com/article/4377431-weekly-high-frequency-indicators-almost-all-data-improved-greatly-from-worst-pandemic-levels?utm_source=feed_articles_market_outlook_economy&utm_medium=referral,https://cdn.snapi.dev/images/v1/j/n/iu2jed.jpg,"Weekly High Frequency Indicators: Almost All Data Has Improved Greatly From Worst Pandemic Levels, But Will It Continue?","Weekly High Frequency Indicators: Almost All Data Has Improved Greatly From Worst Pandemic Levels, But Will It Continue?",Seeking Alpha,"Sat, 03 Oct 2020 01:49:27 -0400",,Neutral,Article
