news_url,image_url,title,text,source_name,date,topics,sentiment,type
https://www.youtube.com/watch?v=WXyXbxIlTIU,https://cdn.snapi.dev/images/v1/4/j/jobless-claims-rose-to-an-unexpected-885000-last-week-but-nov-housing-starts-top-estimates.jpg,"Jobless claims rose to an unexpected 885,000 last week, but Nov. housing starts top estimates","Yahoo Finance's Seana Smith and Emily McCormick break down the latest unemployment numbers for the week ending December 12, 2020. #unemploymentclaims #joblessclaims #extendedunemployment For 2020 election results please visit: Election results: https://www.yahoo.com/elections Subscribe to Yahoo Finance: https://yhoo.it/2fGu5Bb About Yahoo Finance: At Yahoo Finance, you get free stock quotes, up-to-date news, portfolio management resources, international market data, social interaction and mortgage rates that help you manage your financial life.",Yahoo Finance,"Thu, 17 Dec 2020 23:19:01 -0500",,Neutral,Video
https://www.barrons.com/articles/holiday-shopping-2020-these-retail-stocks-could-be-winners-51608250699,https://cdn.snapi.dev/images/v1/i/m/im-263853.jpg,There's a Week Left Until Christmas. These Stocks Could Be the Holiday Shipping Winners,Jefferies analyst Janine Stichter takes a look at the retail landscape.,Barrons,"Thu, 17 Dec 2020 19:18:00 -0500",paywall,Positive,Article
https://seekingalpha.com/article/4395275-debasing-dollar-inflation-looming-again,https://cdn.snapi.dev/images/v1/y/p/stocks8-105-s8rhooejdn.jpg,"Debasing The Dollar? (Or Inflation Looming, Again?","In a flexible price monetary model, changes in the money supply should be immediately reflected in the exchange rate. A plot of the trade weighted US dollar in nominal terms shows the dollar appreciated at the time of the beginning of money expansion.",Seeking Alpha,"Thu, 17 Dec 2020 18:57:11 -0500",,Neutral,Article
https://seekingalpha.com/article/4395274-markets-just-cant-be-stopped-right-now-technically-speaking-for-12-17,https://cdn.snapi.dev/images/v1/d/i/etf37-ti4t5qtm6d.jpg,The Markets Just Can't Be Stopped Right Now (Technically Speaking For 12/17),The Fed raised its 2021 growth projections. Stimulus talks might last through the weekend.,Seeking Alpha,"Thu, 17 Dec 2020 18:49:24 -0500",tanalysis,Positive,Article
https://www.reuters.com/article/us-health-coronavirus-usa-fed/u-s-republicans-seek-firm-end-to-feds-coronavirus-loans-complicating-aid-talks-idUSKBN28R3ET,https://cdn.snapi.dev/images/v1/x/t/m02d20201217t2i1544965493w940fhfwllplsqrlynxmpegbg1y3.jpg,"U.S. Republicans seek firm end to Fed's coronavirus loans, complicating aid talks",A new potential roadblock to a $900 billion coronavirus economic relief bill emerged in the U.S. Congress on Thursday as some Senate Republicans insisted on language ensuring that expiring Federal Reserve lending programs cannot be revived.,Reuters,"Thu, 17 Dec 2020 18:32:00 -0500",Political,Negative,Article
https://www.nytimes.com/2020/12/17/business/economy/state-jobless-claims.html,https://cdn.snapi.dev/images/v1/5/g/17economy-briefing-jobless-alt-articlelargejpgquality75autowebpdisableupscale.jpg,Unemployment Claims Show Impact of Layoffs as Virus Surges,"“It's going to be a challenging few months,” one economist says. A new pandemic relief bill from Congress could soften the blow.",NYTimes,"Thu, 17 Dec 2020 18:25:55 -0500","paywall,Layoffs",Negative,Article
https://www.youtube.com/watch?v=NTwkfOzzzxs,https://cdn.snapi.dev/images/v1/0/e/claims-calamity-jobless-claims-at-highest-level-since-september.jpg,Claims calamity: Jobless claims at highest level since September,"CNBC's Steve Liesman reports on whether the economy is in trouble even as the market hits new records. With CNBC's Melissa Lee and the Fast Money traders, Guy Adami, Tim Seymour, Karen Finerman and Dan Nathan.",CNBC Television,"Thu, 17 Dec 2020 18:06:43 -0500",,Negative,Video
https://www.investopedia.com/u-s-markets-top-record-highs-on-stimulus-hopes-5092879,https://cdn.snapi.dev/images/v1/x/f/unemployment-589de5793df78c47588e1d2e.jpg,U.S. Markets Top Record Highs on Stimulus Hopes,U.S. equity markets hit and topped all-time highs as investors are pretty sure we will see a stimulus bill passed by lawmakers in Washington before the weekend.,Investopedia,"Thu, 17 Dec 2020 17:47:16 -0500",,Positive,Article
https://www.reuters.com/article/us-usa-fed-mainstreet/feds-main-street-lending-sees-record-volume-in-closing-days-idUSKBN28R3CG,https://cdn.snapi.dev/images/v1/3/1/m02d20201217t2i1544961302w940fhfwllplsqrlynxmpegbg1x4.jpg,Fed's Main Street lending sees record volume in closing days,"With time running out on a loan program that had seen little use so far, U.S. small- and mid-sized businesses are tapping into the Federal Reserve's Main Street Lending Program at a record pace.",Reuters,"Thu, 17 Dec 2020 17:47:00 -0500",,Neutral,Article
https://www.youtube.com/watch?v=kPib49yffyo,https://cdn.snapi.dev/images/v1/n/2/merlin-180541158-0c92c2e2-5509-4d3b-82c0-fff5c2da090c-articlelargejpgquality75autowebpdisableupscale.jpg,885K file new jobless claims: Here are the states with the highest unemployment rates,"Yahoo Finance Live's Zack Guzman breaks down the states suffering from the worst jobless rates. #unemploymentrates #joblessclaims #highestunemploymentrates For 2020 election results please visit: Election results: https://www.yahoo.com/elections Subscribe to Yahoo Finance: https://yhoo.it/2fGu5Bb About Yahoo Finance: At Yahoo Finance, you get free stock quotes, up-to-date news, portfolio management resources, international market data, social interaction and mortgage rates that help you manage your financial life.",Yahoo Finance,"Thu, 17 Dec 2020 17:34:35 -0500",,Negative,Video
https://www.youtube.com/watch?v=8J-uJybwUs4,https://cdn.snapi.dev/images/v1/j/1/sp-500-nasdaq-hit-new-highs-strategist-says-dont-panic-if-theres-a-pullback.jpg,"S&P 500, Nasdaq hit new highs: Strategist says, 'don't panic' if theres a pullback","#stockmarketrally #stocks #2021investing PL Financial Chief Market Strategist Ryan Detrick joined Yahoo Finance's Seana Smith to discuss what investors can expect in the last two weeks of 2020 and opportunities to look for in 2021. For 2020 election results please visit: Election results: https://www.yahoo.com/elections Subscribe to Yahoo Finance: https://yhoo.it/2fGu5Bb About Yahoo Finance: At Yahoo Finance, you get free stock quotes, up-to-date news, portfolio management resources, international market data, social interaction and mortgage rates that help you manage your financial life.",Yahoo Finance,"Thu, 17 Dec 2020 17:21:21 -0500",,Positive,Video
https://www.youtube.com/watch?v=BkBgshgK6_I,https://cdn.snapi.dev/images/v1/m/q/nuveen-ceo-discusses-the-opportunity-in-esg.jpg,Nuveen CEO discusses the opportunity in ESG,"The first half of 2020 saw a record 20.9 billion dollars of net flows into sustainable assets. Investment firm Nuveen expects strong federal support for sustainability under a Biden administration and sees opportunity in clean energy, green tech, and infrastructure and real estate.",CNBC Television,"Thu, 17 Dec 2020 17:06:14 -0500",CEO,Positive,Video
https://www.etftrends.com/equity-etf-channel/morningstar-ishares-partner-up-to-launch-style-investment-etfs/,https://cdn.snapi.dev/images/v1/m/o/morningstar-ishares-partner-up-to-launch-style-investment-etfs-440x250.jpg,"Morningstar, iShares Partner Up to Launch Style Investment ETFs","Investors will soon be able to access BlackRock iShares exchange traded funds that reflect the iconic Morningstar Style Box. Morningstar Inc., a leading provider of independent investment research and a leader in style analysis and investing since the creation of the Morningstar Style Box in 1992, will launch a new index family, the Morningstar Broad [.",ETF Trends,"Thu, 17 Dec 2020 16:46:39 -0500",,Positive,Article
https://www.forbes.com/sites/sarahhansen/2020/12/17/heres-why-congressional-watchdogs-want-to-investigate-mnuchins-decision-to-cancel-emergency-fed-programs/,https://cdn.snapi.dev/images/v1/4/z/heres-why-congressional-watchdogs-want-to-investigate-mnuchins-decision-to-cancel-emergency-fed-programs.jpg,Here's Why Congressional Watchdogs Want To Investigate Mnuchin's Decision To Cancel Emergency Fed Programs,The Treasury Secretary asked the central bank to return nearly half a billion dollars of emergency funds.,Forbes,"Thu, 17 Dec 2020 16:41:22 -0500",Political,Neutral,Article
https://www.youtube.com/watch?v=-_fMm07ruu8,https://cdn.snapi.dev/images/v1/m/q/how-ma-will-fare-under-a-biden-administration.jpg,How M&A Will Fare Under a Biden Administration,"Dec.17 -- Daniel Wolf, M&A partner at Kirkland & Ellis, discuss the outlook for mergers and acquisitions in 2021 with Bloomberg's Ed Hammond on ""Bloomberg Markets: The Close."".",Bloomberg Markets and Finance,"Thu, 17 Dec 2020 16:38:40 -0500","manda,Political",Positive,Video
https://www.barrons.com/articles/dow-rose-148-points-because-bullishness-is-overpowering-51608240777,https://cdn.snapi.dev/images/v1/u/c/im-273323.jpg,The Dow Rose 148 Points Because Bullishness Is Overpowering,Investors were engaged in buying stocks and shying away from safer investments—the 10-year treasury yield jumped as the price fell.,Barrons,"Thu, 17 Dec 2020 16:34:00 -0500",paywall,Positive,Article
https://www.kiplinger.com/investing/stocks/601938/stock-market-today-121720-eyes-only-for-stimulus-investors-keep-buying,https://cdn.snapi.dev/images/v1/p/9/stock-market-today-121720.jpg,"Stock Market Today: With Eyes Only for Stimulus, Investors Keep Buying","Wall Street kept its sights squarely on the high likelihood of a stimulus bill Thursday, ignoring discouraging jobs and small business data.",Kiplinger,"Thu, 17 Dec 2020 16:33:00 -0500",,Positive,Article
https://www.youtube.com/watch?v=t3l6I071qqQ,https://cdn.snapi.dev/images/v1/v/a/we-still-think-there-are-trillion-dollars-waiting-to-go-into-the-equity-markets-says-jp-morgans.jpg,"We still think there are trillion dollars waiting to go into the equity markets, says J.P. Morgan's",Joyce Chang from J.P. Morgan joins 'Closing Bell' to discuss the state of the markets.,CNBC Television,"Thu, 17 Dec 2020 16:24:29 -0500",,Positive,Video
https://seekingalpha.com/article/4395263-covidminus-19-crisis-im-weekl-unemployment-monitor-update-12-17-2020,https://cdn.snapi.dev/images/v1/c/6/stocks18-1-gr70hpssze.jpg,Covid-19 Crisis: The iM-Weekl Unemployment Monitor: Update 12/17/2020,A truer picture of the employment situation is extracted from the Unemployment Insurance Weekly Claims (UIWC) report. Persons receiving some form of unemployment benefit account for 12.9% of the labor force.,Seeking Alpha,"Thu, 17 Dec 2020 16:23:38 -0500",,Negative,Article
https://www.businessinsider.com/recession-recovery-shapes,https://cdn.snapi.dev/images/v1/t/h/the-different-shapes-of-recovery-understanding-how-quickly-and-strongly-an-economy-can-bounce-back-after-a-recession.jpg,The different shapes of recovery: Understanding how quickly and strongly an economy can bounce back after a recession,"Though rarely pleasant, recessions are a normal part of the business cycle, the regular course of rise and fall that all free-market economies run. All recessions begin the same way, with a significant period of economic decline. But how they end can happen in a whole host of different ways. Economists dub the aftermath of a recession ""the recovery period."" They describe recoveries in graphic terms — literally: How the movement of the economy would look if plotted on a graph or chart.",Business Insider,"Thu, 17 Dec 2020 16:20:58 -0500",paylimitwall,Neutral,Article
https://www.businessinsider.com/stock-market-news-today-dow-sp500-records-final-stimulus-near-2020-12,https://cdn.snapi.dev/images/v1/d/o/dow-sp-500-close-at-records-as-investors-await-final-stimulus-deal-from-congress.jpg,"Dow, S&P 500 close at records as investors await final stimulus deal from Congress","The Dow Jones industrial average, S&P 500, and Nasdaq composite indexes all closed at record highs on Thursday as a $900 billion fiscal stimulus bill designed to hasten the ongoing economic recovery appeared imminent. The stimulus bill is said to include direct payments for Americans, $300 billion for the Paycheck Protection Program, and a $300 weekly federal unemployment benefit.",Business Insider,"Thu, 17 Dec 2020 16:12:47 -0500",paylimitwall,Positive,Article
https://www.marketwatch.com/story/us-stock-market-clinches-superfecta-of-record-highs-thursday-as-bulls-pin-buying-to-fiscal-spending-bill-2020-12-17,https://cdn.snapi.dev/images/v1/1/t/nike-and-powell-in-spotlight-but-european-virus-fears-could-be-sharing-stage.jpg,U.S. stock market clinches superfecta of record highs Thursday as bulls pin buying to fiscal spending bill,"Major U.S. stock benchmarks finished at record highs on Thursday as lawmakers neared a deal to extend a new financial lifeline to businesses and individuals amid the pandemic. The Dow Jones Industrial Average closed up 0.5% at around 30,303, the S&P 500 index finished the session up 0.6% at 3,722, while the Nasdaq Composite Index ended the session with a 0.8% gain at 12,765.",Market Watch,"Thu, 17 Dec 2020 16:05:46 -0500",paylimitwall,Positive,Article
https://seekingalpha.com/article/4395247-value-is-back-now-what,https://cdn.snapi.dev/images/v1/j/c/a-bullish-outlook-for-commodities-440x250.jpg,"Value Is Back, Now What?","As expected, small-cap and value stocks have significantly outperformed the S&P 500 as investors started to price in higher economic growth. At this point, I believe that this trade has become crowded as value is no longer flying under the radar.",Seeking Alpha,"Thu, 17 Dec 2020 15:37:08 -0500",,Neutral,Article
https://www.youtube.com/watch?v=1R3onhUB-BQ,https://cdn.snapi.dev/images/v1/i/e/stanfords-taylor-on-fed-guidance-cryptocurrencies-fiscal-policy.jpg,"Stanford's Taylor on Fed Guidance, Cryptocurrencies, Fiscal Policy","Dec.17 -- John Taylor, Stanford University professor of economics, discusses the need for more forward guidance from the Federal Reserve, the rise of cryptocurrencies, and U.S. fiscal policy on ""Bloomberg Markets: The Close.""",Bloomberg Markets and Finance,"Thu, 17 Dec 2020 15:32:34 -0500",,Neutral,Video
https://techcrunch.com/2020/12/17/coinbase-files-to-go-public-confidentially-and-were-hyped/,https://cdn.snapi.dev/images/v1/g/e/gettyimages-1046001872jpgw609.jpg,Coinbase files to go public confidentially and we're hyped,"Coinbase, perhaps the best-known American crypto company, announced today that it has filed confidentially to go public. The company's debut was expected, having been reported earlier in the year.",TechCrunch,"Thu, 17 Dec 2020 15:08:16 -0500",,Positive,Article
https://seekingalpha.com/article/4395239-recovery-in-u-s-inflation-breakevens-not-surprising,https://cdn.snapi.dev/images/v1/d/w/what-do-the-dow-sp-nasdaq-and-russell-2000-charts-look-like-now.jpg,Recovery In U.S. Inflation Breakevens Not Surprising,"The rise in breakeven inflation in the United States is not particularly surprising, as it is just a return to projecting previous conditions forward. Since inflation-linked bonds are based on overall CPI, the inflation payout is greatly influenced in the near run by changes in energy prices.",Seeking Alpha,"Thu, 17 Dec 2020 15:05:58 -0500",,Negative,Article
https://www.youtube.com/watch?v=W0aooVr8ync,https://cdn.snapi.dev/images/v1/m/q/we-are-building-towards-a-bubble-in-2021-caravel-concepts-ceo.jpg,We are building towards a bubble in 2021: Caravel Concepts CEO,"Michael Jones, Caravel Concepts CEO, and Matt Forester, CIO of Lockwood at BNY Mellon Pershing, join 'Power Lunch' to discuss if the market is too frothy and opportunities they're seeing in the market.",CNBC Television,"Thu, 17 Dec 2020 14:55:00 -0500",,Negative,Video
https://www.youtube.com/watch?v=P9L_ReRQVLg,https://cdn.snapi.dev/images/v1/m/q/highly-anticipated-tech-ipos-in-2021-including-instacart-and-poshmark.jpg,"Highly-anticipated tech IPOs in 2021, including Instacart and Poshmark","Instacart, Poshmark, ThredUp and Glossier are some of tech IPOs investors are looking forward to next year. There are also many fintech IPOs that are highly anticipated in 2021.",CNBC Television,"Thu, 17 Dec 2020 14:53:40 -0500",,Positive,Video
https://www.youtube.com/watch?v=39txdyoGkh0,https://cdn.snapi.dev/images/v1/m/q/theres-two-waves-of-growth-coming-to-impact-investors-castlearks-cio.jpg,"There's two waves of growth coming to impact investors, CastleArk's CIO","Jerry Castellini, CastleArk Management CIO, says countries like China, India have recovered better from Covid-19. But he expects there will be two waves of growth that will lead to strong cyclical stocks in the U.S. and overseas growth.",CNBC Television,"Thu, 17 Dec 2020 14:53:33 -0500",,Positive,Video
https://www.youtube.com/watch?v=-SMCXiQa1PE,https://cdn.snapi.dev/images/v1/m/q/how-one-firm-could-be-leading-the-future-of-esg-activism.jpg,How one firm could be leading the future of ESG activism,17-day-old firm Engine No. 1 is pushing Exxon to invest in more clean energy.,CNBC Television,"Thu, 17 Dec 2020 14:47:09 -0500",,Positive,Video
https://www.foxbusiness.com/markets/us-dollar-coronavirus-plunge-fed-interest-rates,https://cdn.snapi.dev/images/v1/b/o/dollar-cropped-1025p.jpg,US dollar sinks under Fed's pledge to keep rates low during coronavirus swoon,The U.S. dollar on Thursday plunged to a more than 2.5-year low against a basket of its peers after the Federal Reserve pledged to keep interest rates low until the economy shows signs of a sustainable recovery.,Fox Business,"Thu, 17 Dec 2020 14:44:43 -0500",,Negative,Article
https://www.theguardian.com/business/2020/dec/17/markets-record-highs-rising-optimism-pandemic-recovery-covid-vaccines-stimulus-economy-2021,https://cdn.snapi.dev/images/v1/u/x/5124jpgwidth460quality85autoformatfitmaxsc676bf226e9f6826621eb572052a52d3.jpg,Markets at record highs amid rising optimism of a pandemic recovery,Investors bet Covid vaccines and stimulus measures will propel economy forward in 2021,The Guardian,"Thu, 17 Dec 2020 14:31:05 -0500",,Positive,Article
https://www.youtube.com/watch?v=pSz2q9YHEyI,https://cdn.snapi.dev/images/v1/g/f/fed-keeps-rates-low-while-watching-recovery-sputter.jpg,Fed Keeps Rates Low While Watching Recovery Sputter,Inflation dipped slightly in 2020 with a slight rise expected next year. The Fed chose to hold its key rate between 0% and 0.25% to protect a fragile economy.,Bloomberg Markets and Finance,"Thu, 17 Dec 2020 14:29:55 -0500",,Negative,Video
https://www.gurufocus.com/news/1313405/how-to-find-value-opportunities-in-the-ipo-market,https://cdn.snapi.dev/images/v1/q/4/data-internet27.jpg,How to Find Value Opportunities in the IPO Market,"Initial public offerings have attracted the attention of investors this year with many large private companies deciding to go public amid the revival of the global economy. Finding lucrative opportunities in this space can prove to be difficult and time-consuming, but rewards far exceed the costs if an effective strategy can be formulated based on fundamentally acceptable reasons.",GuruFocus,"Thu, 17 Dec 2020 14:27:52 -0500",,Positive,Article
https://www.cnbc.com/2020/12/17/largest-us-cryptocurrency-exchange-coinbase-files-for-ipo-as-bitcoin-soars-past-23000.html,https://cdn.snapi.dev/images/v1/c/o/coind22.,"Largest U.S. cryptocurrency exchange Coinbase files for IPO as bitcoin soars past $23,000",Digital currency exchange Coinbase is going public as renewed investor interest in cryptocurrencies has pushed bitcoin to an all-time high.,CNBC,"Thu, 17 Dec 2020 14:26:00 -0500",,Positive,Article
https://seekingalpha.com/article/4395228-happy-holidays-and-this-is-what-makes-market,https://cdn.snapi.dev/images/v1/j/k/software27-2.jpg,Happy Holidays And This Is What Makes A Market,"First, I'd like to wish everyone a Happy Holiday Season and all the best for the New Year. Next, I'll admit that both teams have decent arguments here.",Seeking Alpha,"Thu, 17 Dec 2020 14:25:50 -0500",,Neutral,Article
https://www.youtube.com/watch?v=0ZzQ4HQpRSw,https://cdn.snapi.dev/images/v1/m/q/coinbase-confidentially-files-for-ipo.jpg,Coinbase confidentially files for IPO,Coinbase has submitted a draft registration statement for a S-1 with the SEC to go public. CNBC's Leslie Picker reports the details.,CNBC Television,"Thu, 17 Dec 2020 14:22:55 -0500",,Positive,Video
https://www.cnbc.com/2020/12/17/how-the-georgia-election-could-q.html,https://cdn.snapi.dev/images/v1/o/n/106810804-1607959959630-gettyimages-1230123473-775597571jm-014.jpeg,The stock market will face a big test early in 2021 with the Georgia runoffs,"The Georgia Senate runoff election is a wild card for markets, and it coul impact markets and the economy.",CNBC,"Thu, 17 Dec 2020 14:18:48 -0500",,Neutral,Article
https://www.gurufocus.com/news/1313399/will-the-fed-ever-stop-propping-up-zombie-companies,https://cdn.snapi.dev/images/v1/x/a/103905600-gettyimages-94868577-nuegmzzwyp.jpg,Will the Fed Ever Stop Propping Up Zombie Companies?,"The coronavirus pandemic has had a profound impact on the financial health of countless businesses in the United States. Yet many of these companies have had little trouble tapping credit markets in spite of both their specific business challenges and wider macroeconomic headwinds, thanks in large part to historic interventions by the Federal Reserve, including an unprecedented move to act as the marginal buyer in the high-yield credit market , as I have discussed previously.",GuruFocus,"Thu, 17 Dec 2020 14:13:03 -0500",,Negative,Article
https://www.schaeffersresearch.com/content/news/2020/12/17/wall-street-to-slow-down-next-week-ahead-of-christmas-holiday,https://cdn.snapi.dev/images/v1/s/s/ssoo222.,Wall Street to Slow Down Next Week Ahead of Christmas Holiday,"The market will be relatively quiet in the days leading up to Christmas, though there will still be a handful of economic indicators for investors to evaluate heading into the end of the year.",Schaeffers Research,"Thu, 17 Dec 2020 14:00:04 -0500",,Negative,Article
https://www.cnbc.com/2020/12/16/stock-market-futures-open-to-close-news.html,https://cdn.snapi.dev/images/v1/x/n/106806478-1607099448754trading-floor-photo-ob-201204-press-1-jpg.jpg,"S&P 500 and Nasdaq rise, hit record highs as stimulus hopes remain elevated","The S&P 500 and Nasdaq Composite opened at record highs, boosted by hope of Washington coming through on additional fiscal aid before the end of 2020.",CNBC,"Thu, 17 Dec 2020 13:59:46 -0500",,Positive,Article
https://www.youtube.com/watch?v=WoyWCtMcXOU,https://cdn.snapi.dev/images/v1/m/q/stimulus-a-bipartisan-deal-is-close-at-hand-senator-mitch-mcconnell.jpg,Stimulus: A bipartisan deal is close at hand: Senator Mitch McConnell,"Yahoo Finance's Jessica Smith breaks down the latest in stimulus negotiations as Congressional leaders inch toward a deal. #coronavirusstimulus #COVID19stimulus #stimulus For 2020 election results please visit: Election results: https://www.yahoo.com/elections Subscribe to Yahoo Finance: https://yhoo.it/2fGu5Bb About Yahoo Finance: At Yahoo Finance, you get free stock quotes, up-to-date news, portfolio management resources, international market data, social interaction and mortgage rates that help you manage your financial life.",Yahoo Finance,"Thu, 17 Dec 2020 13:56:22 -0500",Political,Positive,Video
https://www.youtube.com/watch?v=ms7yVBkcsDI,https://cdn.snapi.dev/images/v1/y/s/all-risks-fade-away-for-markets-next-year-says-jonathan-golub.jpg,"All Risks Fade Away for Markets Next Year, Says Jonathan Golub","Dec.17 -- Jonathan Golub of Credit Suisse says all risks to the market fade away next year. He is on ""Bloomberg The Open.",Bloomberg Markets and Finance,"Thu, 17 Dec 2020 13:25:05 -0500",,Positive,Video
https://www.marketwatch.com/story/the-u-s-dollar-is-getting-crushed-thank-the-fed-11608229441,https://cdn.snapi.dev/images/v1/d/d/im-274737width620size15384615384615385.jpg,Currencies: The U.S. dollar is getting crushed — thank the Fed,"The U.S. dollar fell sharply versus major rivals Thursday, after the Federal Reserve's reassurance that it won't be soon tapering its bond purchases gave bears a green light to sell the currency.",Market Watch,"Thu, 17 Dec 2020 13:24:00 -0500",paylimitwall,Negative,Article
https://seekingalpha.com/article/4395212-unknown-market-wizards-jack-schwager-joins-alpha-trader-podcast-transcript,https://cdn.snapi.dev/images/v1/p/7/podc6.jpg,Unknown Market Wizards - Jack Schwager Joins Alpha Trader (Podcast Transcript),"Welcome to Alpha Trader. Coming up on the show, an interview with Jack Schwager, the author of the legendary Market Wizards Series talking about the latest inflation, unknown market wizards, much more with Jack coming up on the show, but first Aaron Task and Steven Alpha talking to you at the beginning of the last full week of trading for 2020.",Seeking Alpha,"Thu, 17 Dec 2020 13:22:56 -0500",podcast,Neutral,Article
https://www.youtube.com/watch?v=pSbhZGuyeHw,https://cdn.snapi.dev/images/v1/z/0/this-fed-will-stay-dovish-for-a-long-time-bofa.jpg,This Fed Will Stay Dovish for a Long Time: BofA,"Dec.17 -- Mark Cabana of Bank of America says the Federal Reserve will stay dovish for a very long time. He appears on ""Bloomberg The Open.",Bloomberg Markets and Finance,"Thu, 17 Dec 2020 13:16:26 -0500",,Neutral,Video
https://www.cnn.com/2020/12/17/investing/economy-inflation-stocks/index.html,https://cdn.snapi.dev/images/v1/2/0/201217092305-janet-yellen-jerome-powell-split-super-169.jpg,Joe Biden's financial team could create a giant stock bubble,Federal Reserve Chair Jerome Powell has made abundantly clear that he is more concerned about the challenging job market than the possibility that more stimulus may eventually lead to higher inflation. It's a view shared by his former boss -- Janet Yellen.,CNN Business,"Thu, 17 Dec 2020 13:05:01 -0500",Political,Negative,Article
