news_url,image_url,title,text,source_name,date,topics,sentiment,type
https://seekingalpha.com/article/4400573-is-ballooning-u-s-government-debt-sustainable,https://cdn.snapi.dev/images/v1/2/u/aaad1.jpg,Is The Ballooning U.S. Government Debt Sustainable?,Is The Ballooning U.S. Government Debt Sustainable?,Seeking Alpha,"Sat, 23 Jan 2021 12:58:26 -0500",paylimitwall,Neutral,Article
https://seekingalpha.com/article/4400567-existing-home-sales-remained-robust-in-december,https://cdn.snapi.dev/images/v1/c/6/wall-street-4847629-1920-1.jpg,Existing-Home Sales Remained Robust In December,Existing-Home Sales Remained Robust In December,Seeking Alpha,"Sat, 23 Jan 2021 11:12:35 -0500",paylimitwall,Positive,Article
https://www.cnbc.com/2021/01/23/why-international-stocks-could-outperform-us-markets-in-2021.html,https://cdn.snapi.dev/images/v1/e/q/106615206-1594729516144gettyimages-1225240125.jpeg,Why international stocks could outperform U.S. markets this year,"China is on track to be a standout among global markets in 2021, market analysts say. Here's why international stocks could outperform U.S. markets this year.",CNBC,"Sat, 23 Jan 2021 10:38:54 -0500",,Neutral,Article
https://www.marketwatch.com/story/stock-market-bulls-brace-for-major-gut-check-as-earnings-fed-and-gdp-loom-11611411473,https://cdn.snapi.dev/images/v1/a/4/im-289345width620size14382022471910112.jpg,"Market Snapshot: Stock-market bulls brace for major gut check as earnings, Fed and GDP loom",Stark reality for the euphoric stock market? The coming week may present the closest thing to a gut check for bullish investors so far in 2021.,Market Watch,"Sat, 23 Jan 2021 09:17:00 -0500","earnings,paylimitwall",Negative,Article
https://www.foxbusiness.com/markets/stock-market-impact-rising-interest-rates,https://cdn.snapi.dev/images/v1/3/a/ap20302742602170.jpg,Rising interest rates spell trouble for stocks,Wall Street is growing increasingly concerned that rising interest rates could derail the red-hot U.S. equity market which is hovering near record levels.,Fox Business,"Sat, 23 Jan 2021 09:11:17 -0500",,Negative,Article
https://seekingalpha.com/article/4399927-buying-rental-vs-stocks-which-is-better-for-financial-independence,https://cdn.snapi.dev/images/v1/c/s/how-to-navigate-the-largest-economic-stimulus-in-us-history.jpg,Buying A Rental Vs. Stocks: Which Is Better For Financial Independence?,"Rental and stocks can help you achieve financial freedom, but which is the best in 2021? We believe that rental properties will help you get there faster, but there's a catch: you will need to get your hands dirty.",Seeking Alpha,"Sat, 23 Jan 2021 09:00:00 -0500","Real Estate,paylimitwall",Neutral,Article
https://seekingalpha.com/article/4400561-dividend-kings-ranked-quality-score-summary,https://cdn.snapi.dev/images/v1/1/0/106825461-1610740315010nyse-photo-210115-press-14-jpg---c0adodznuh.jpg,The Dividend Kings Ranked By Quality Score Summary,"Dividend Kings are companies with dividend increase streaks of 50 consecutive years. This article ranks the Dividend Kings using DVK Quality Snapshots, a system for assessing the quality of dividend growth stocks.",Seeking Alpha,"Sat, 23 Jan 2021 09:00:00 -0500","dividend,paylimitwall",Positive,Article
https://markets.businessinsider.com/news/stocks/jeremy-grantham-bidens-stimulus-will-inflate-the-stock-market-bubble-2021-1-1029995954,https://cdn.snapi.dev/images/v1/l/e/legendary-investor-jeremy-grantham-says-bidens-19-trillion-stimulus-plan-will-make-the-stock-market-bubble-even-worse.jpg,Legendary investor Jeremy Grantham says Biden's $1.9 trillion stimulus plan will make the stock market bubble even worse,"Legendary investor Jeremy Grantham warned investors during a Bloomberg interview that the $1.9 trillion in federal aid President Joe Biden is seeking from Congress will further inflate the stock market bubble. The GMO co-founder told Erik Schatzker that he has ""no doubt"" some of the stimulus aid will end up in the market. He said the ""sad truth"" about the last stimulus bill passed in 2020 was that it didn't increase capital spending and didn't increase real production, but it certainly flowed into stocks.  The plan that Biden is proposing contains a $1,400 boost to stimulus checks, robust state and local aid, and vaccine-distribution funds. Grantham said that if the package passed is worth $1.9 trillion, it could lead to the dangerous end of the bubble.",Business Insider,"Sat, 23 Jan 2021 08:45:00 -0500","Political,paylimitwall",Negative,Article
https://www.cnbc.com/2021/01/23/the-stock-market-is-at-or-near-the-most-expensive-levels-ever-by-most-measures-when-will-it-matter.html,https://cdn.snapi.dev/images/v1/g/g/106822129-1610369122362-gettyimages-1230511741-economou-notitle210109-npf38.jpeg,The stock market is at or near the most-expensive levels ever by most measures. When will it matter?,"There is a distinct ""greed hive"" that's boiling over with options speculation, engineered short squeezes and heedless momentum buying.",CNBC,"Sat, 23 Jan 2021 08:36:30 -0500",,Neutral,Article
https://www.marketwatch.com/story/the-u-s-economy-likely-grew-4-1-at-the-end-of-2020-but-gdp-seen-masking-weakness-in-some-sectors-11611355014,https://cdn.snapi.dev/images/v1/0/5/im-289201width620size15005861664712778.jpg,"Economic Report: The U.S. economy likely grew 4.1% at the end of 2020, but GDP seen masking weakness in some sectors","The U.S. economy may have grown about 4% on an annualized basis in the final three months of 2020, a great number even in the best of times. But these are not the best of times.",Market Watch,"Sat, 23 Jan 2021 08:30:00 -0500",paylimitwall,Neutral,Article
https://seekingalpha.com/article/4400557-week-ahead-earnings-to-dominate,https://cdn.snapi.dev/images/v1/d/a/ipos-banner-year-markets-e1600964930157jpgquality90stripall.jpg,Week Ahead - Earnings To Dominate,"Earnings season is up and running and next week will see some huge names reporting on the fourth quarter including Facebook, Apple and Tesla. The main event in the US is the Fed's policy meeting.",Seeking Alpha,"Sat, 23 Jan 2021 08:01:56 -0500","earnings,paylimitwall",Positive,Article
https://seekingalpha.com/article/4400553-short-and-sharp-what-all-goes-wrong,https://cdn.snapi.dev/images/v1/k/9/fed-economy-and-equities-940x600.jpg,Short And Sharp: What If It All Goes Wrong?,Global markets have started 2021 with the same enthusiasm for the global reflation trade that has been driving markets since November of last year. We expect global GDP growth to recover sharply as the second virus wave fades and vaccination rates pick up.,Seeking Alpha,"Sat, 23 Jan 2021 07:28:04 -0500",paylimitwall,Neutral,Article
https://seekingalpha.com/article/4400552-illusion-of-soaring-savings-amid-rising-economic-uncertainty,https://cdn.snapi.dev/images/v1/s/g/201006170805-nyse-1002-super-169.jpg,The Illusion Of Soaring Savings Amid Rising Economic Uncertainty,"To understand why the ""savings rate"" is not what it appears to be, you must understand its underlying construction. Since the top income earners have more than enough income to maintain their living standards, the balance falls into savings. This disparity in incomes also generates a ""skew"" to the savings rate.",Seeking Alpha,"Sat, 23 Jan 2021 07:25:18 -0500",paylimitwall,Neutral,Article
https://www.fool.com/investing/2021/01/23/the-3-biggest-threats-to-the-biden-bull-market/,https://cdn.snapi.dev/images/v1/z/6/m02d20210122t2i1548745046w940fhfwllplsqrlynxmpeh0l1bs.jpg,The 3 Biggest Threats to the Biden Bull Market,Stocks could be in for a bumpy ride if one or more of these events comes to pass.,The Motley Fool,"Sat, 23 Jan 2021 06:06:00 -0500",Political,Negative,Article
https://seekingalpha.com/article/4400538-compassionate-leadership,https://cdn.snapi.dev/images/v1/c/r/stocks8-105-s8rhooejdn.jpg,Compassionate Leadership,We expect at least an additional $3.5 trillion in stimulus programs this year on top of the near $1 trillion plan passed recently. Earnings estimates will be increased sequentially as management gets more confident that this recovery is sustainable. Follow the author and get alerts,Seeking Alpha,"Sat, 23 Jan 2021 06:00:00 -0500",paylimitwall,Neutral,Article
https://seekingalpha.com/article/4400548-european-fixed-income-in-2021-focused-on-recovery-and-politics,https://cdn.snapi.dev/images/v1/i/n/etf37-ti4t5qtm6d.jpg,"European Fixed Income In 2021: Focused On Recovery, And Politics","We are still grappling with the ravages of COVID-19, but vaccinations are being administered across the globe and should help bring confidence - and economic growth - back later in the year. Europe will almost assuredly see a double-dip recession, but that is due to lockdowns that are still in place.",Seeking Alpha,"Sat, 23 Jan 2021 04:54:17 -0500",paylimitwall,Neutral,Article
https://seekingalpha.com/article/4400546-which-shopping-center-reits-will-dominate,https://cdn.snapi.dev/images/v1/n/v/reit30.jpg,Which Shopping Center REITs Will Dominate,Shopping Center REITs remain depressed in price from their prior highs. All of them have the potential to produce good to excellent total returns over the next few years.,Seeking Alpha,"Sat, 23 Jan 2021 04:35:47 -0500","Real Estate,paylimitwall",Positive,Article
https://www.forbes.com/sites/mikeosullivan/2021/01/23/will-the-stock-market-sell-off-as-biden-starts/,https://cdn.snapi.dev/images/v1/l/s/will-the-stock-market-sell-off-as-biden-starts.jpg,Will The Stock Market Sell Off As Biden Starts?,"Inequality is very stretched in the USA, but so is the stock market. The Biden administration may close the gap between the two, and in coming weeks a stock market correction is likely.",Forbes,"Sat, 23 Jan 2021 04:05:05 -0500","Political,paylimitwall",Neutral,Article
https://seekingalpha.com/article/4400544-2021-new-year-new-u-s-president-new-optimism-for-markets,https://cdn.snapi.dev/images/v1/t/u/3efdsq1-mroyzslwqn.jpg,"2021: A New Year, New U.S. President, New Optimism For Markets",2021: A bumpy road to recovery. Early cycle conditions supportive of risk assets. Opportunities from earnings expansion in 2021 and 2022.,Seeking Alpha,"Sat, 23 Jan 2021 03:49:52 -0500",paylimitwall,Neutral,Video
https://seekingalpha.com/article/4400540-week-on-wall-street-every-major-index-posted-new-highs,https://cdn.snapi.dev/images/v1/h/w/stocks18-1-gr70hpssze.jpg,The Week On Wall Street: Every Major Index Posted New Highs,"Housing and Manufacturing continue their ""V""-shaped recovery as the economy continues to move forward despite the virus concerns. Earnings season is here, and once again, I believe EPS estimates are way too low as analysts are still listening to the ""darkest days ahead"" rhetoric. The Energy and Financial sectors have emerged as new market leaders. Whether that continues remains to be seen.",Seeking Alpha,"Sat, 23 Jan 2021 02:08:57 -0500",paylimitwall,Positive,Article
https://seekingalpha.com/article/4400537-weekly-high-frequency-indicators-here-comes-sun,https://cdn.snapi.dev/images/v1/3/c/nike-and-powell-in-spotlight-but-european-virus-fears-could-be-sharing-stage.jpg,Weekly High Frequency Indicators: 'Here Comes The Sun'?,"High frequency indicators can give us a nearly up-to-the-moment view of the economy. The metrics are divided into long leading, short leading, and coincident indicators. With the exception of the sectors most affected by the pandemic, the outlook in all time frames remains positive.",Seeking Alpha,"Sat, 23 Jan 2021 01:16:58 -0500",paylimitwall,Positive,Article
https://seekingalpha.com/article/4400535-credit-inflation-is-alive-and-well-investors-should-take-advantage-of,https://cdn.snapi.dev/images/v1/1/q/a-bullish-outlook-for-commodities-440x250.jpg,"Credit Inflation Is Alive And Well, Investors Should Take Advantage Of It","The federal government is ready to produce a massive economic stimulus package to reignite the economy and the Federal Reserve System has said it is ready to support it. Investors are realizing that credit inflation is alive and well in Washington, D.C. and, as been shown over the past forty years, this is a good environment for growing wealth.",Seeking Alpha,"Sat, 23 Jan 2021 00:20:07 -0500",paylimitwall,Positive,Article
