news_url,image_url,title,text,source_name,date,topics,sentiment,type
https://www.forbes.com/sites/greatspeculations/2021/01/30/bubble-markets-display-bizarre-behavior-right-before-they-tumble/,https://cdn.snapi.dev/images/v1/b/u/bubble-markets-display-bizarre-behavior-right-before-they-tumble.jpg,Bubble Markets Display Bizarre Behavior Right Before They Tumble,"The typical signs of an approaching bubble bust were on full display in the equity markets last week, like the dot-com bubble of the 90s.",Forbes,"Sat, 30 Jan 2021 23:19:08 -0500",paylimitwall,Negative,Article
https://www.youtube.com/watch?v=WKWPZAdlFsw,https://cdn.snapi.dev/images/v1/y/s/stock-market-the-power-of-social-media-is-making-its-way-to-wall-street.jpg,Stock market: 'The power of social media is making its way to Wall Street',"This segment originally aired on January 27, 2021 Yahoo Finance's Zack Guzman and Akiko Fujita break down the stock market with Victoria Greene, G Squared Private Wealth Founding Partner and Portfolio Manager, and Jeffrey Weiner, Marcum LLP Chairman & CEO. For 2020 election results please visit: Election results: https://www.yahoo.com/elections Subscribe to Yahoo Finance: https://yhoo.it/2fGu5Bb About Yahoo Finance: At Yahoo Finance, you get free stock quotes, up-to-date news, portfolio management resources, international market data, social interaction and mortgage rates that help you manage your financial life.",Yahoo Finance,"Sat, 30 Jan 2021 22:13:13 -0500",,Neutral,Video
https://www.businessinsider.com/what-is-the-sp-500,https://cdn.snapi.dev/images/v1/t/h/the-sp-500-is-seen-as-a-gauge-of-the-stock-market-itself-heres-how-this-widely-watched-stock-index-works.jpg,The S&P 500 is seen as a gauge of the stock market itself — here's how this widely watched stock index works,"People often say ""The stock market is up,"" or ""The market is down."" But the stock market is an amorphous thing, encompassing thousands of equities and dozens of stock exchanges. What they actually mean is a particular stock market index, or group of publicly traded companies, is up or down. And if they're in the US, odds are that index is the Standard & Poor's 500, or S&P 500.",Business Insider,"Sat, 30 Jan 2021 17:52:03 -0500",paylimitwall,Neutral,Article
https://invezz.com/news/2021/01/30/cnbcs-santoli-short-hedge-funds-arent-powerful-predators/,https://cdn.snapi.dev/images/v1/1/0/106823143-1610471024421press-kuke-ob-photo-20210112-5-jpg.jpg,CNBC's Santoli: Short hedge funds aren't ‘powerful predators',"The epic battle playing out in GameStop Corp.'s (NYSE: GME) stock isn't the David versus Goliath battle some in the media play it out to be. In fact, hedge funds are far from the “all-powerful predators” that make a killing shorting stocks to zero, according to CNBC's Michael Santoli.",Invezz,"Sat, 30 Jan 2021 17:31:32 -0500",,Neutral,Article
https://seekingalpha.com/article/4402249-week-ahead-volatility-going-nowhere,https://cdn.snapi.dev/images/v1/n/s/sdw212w-2.jpg,Week Ahead - Volatility Going Nowhere,"While the battle between retail investors and hedge funds may continue to dominate the headlines in the coming weeks, there is plenty more that investors should pay close attention to. The two big data releases for the US will be the ISM manufacturing and the employment report.",Seeking Alpha,"Sat, 30 Jan 2021 16:45:44 -0500",paylimitwall,Negative,Article
https://www.forbes.com/sites/chuckjones/2021/01/30/gamestop-short-covering-is-not-responsible-for-the-markets-falling-last-week/,https://cdn.snapi.dev/images/v1/d/y/gamestop-short-covering-is-not-responsible-for-the-markets-falling-last-week.jpg,GameStop Short Covering Is Not Responsible For The Markets Falling Last Week,GameStop was not responsible for the markets falling last week.,Forbes,"Sat, 30 Jan 2021 16:30:06 -0500",paylimitwall,Negative,Article
https://seekingalpha.com/article/4402243-dividend-challenger-highlights-week-of-january-31,https://cdn.snapi.dev/images/v1/g/d/gdp-recovery-continues-440x250.jpg,Dividend Challenger Highlights: Week Of January 31,A weekly summary of dividend activity for Dividend Challengers. Companies which changed their dividends.,Seeking Alpha,"Sat, 30 Jan 2021 12:20:14 -0500","dividend,paylimitwall",Neutral,Article
https://www.nytimes.com/2021/01/30/business/robinhood-wall-street-gamestop.html,https://cdn.snapi.dev/images/v1/4/2/30robinhood-01-articlelargejpgquality75autowebpdisableupscale.jpg,The Silicon Valley Start-Up That Caused Wall Street Chaos,Robinhood pitched itself to investors as the antithesis of Wall Street. It didn't say that it also entirely relies on Wall Street.,NYTimes,"Sat, 30 Jan 2021 11:38:02 -0500",paywall,Negative,Article
https://invezz.com/news/2021/01/30/heres-what-bank-of-america-has-to-say-about-wsb-vs-short-sellers/,https://cdn.snapi.dev/images/v1/m/0/m02d20210129t2i1549524195w940fhfwllplsqrlynxmpeh0s0mj---ent1ajzabu.jpg,Here's what Bank of America has to say about WSB vs short-sellers,"In a week that has been marked by the direct confrontation between short-selling hedge funds and retail investors centered around Reddit's Wallstreetbets forum, major financial institutions have joined the debate. War on Equality For Michael Hartnett, the Chief Investment Strategist at Bank of America, the ongoing drama represents “another escalation in War on Inequality”.",Invezz,"Sat, 30 Jan 2021 10:51:06 -0500",,Neutral,Article
https://seekingalpha.com/article/4402240-u-s-ipo-week-ahead-canadian-and-german-chemicals-lead-diverse-9-ipo-week,https://cdn.snapi.dev/images/v1/t/i/the-mirage-within-the-market-a-current-snapshot.jpg,U.S. IPO Week Ahead: Canadian IT And German Chemicals Lead A Diverse 9-IPO Week,The IPO market is expected to remain active in the week ahead with nine IPOs scheduled to raise $2.7 billion. Canadian digital service provider TELUS International plans to raise $800 million at a $6.4 billion market cap.,Seeking Alpha,"Sat, 30 Jan 2021 10:42:33 -0500",paylimitwall,Neutral,Article
https://www.fool.com/investing/2021/01/30/scared-of-stock-market-3-investing-myths-debunked/,https://cdn.snapi.dev/images/v1/a/d/urlhttps3a2f2fgfoolcdncom2feditorial2fimages2f6104032fmyth-bustingjpgw700opresize.jpg,"Scared of the Stock Market? Don't Be. 3 Investing Myths, Debunked","If you're hesitant to get started as an investor, here are three eye-opening reality checks about the most stifling assumptions.",The Motley Fool,"Sat, 30 Jan 2021 10:18:00 -0500",,Neutral,Article
https://www.fool.com/investing/2021/01/30/3-reasons-you-should-invest-in-index-funds-and-2-r/,https://cdn.snapi.dev/images/v1/u/r/urlhttps3a2f2fgfoolcdncom2feditorial2fimages2f6102632ffigurines-of-bear-and-bulljpgw700opresize.jpg,3 Reasons You Should Invest in Index Funds -- and 2 Reasons You Shouldn't,"Index funds can be a fantastic investment, but they're not for everyone.",The Motley Fool,"Sat, 30 Jan 2021 09:34:00 -0500",,Neutral,Article
https://seekingalpha.com/article/4402236-macroview-2021-disappointment-of-growth-and-disinflation,https://cdn.snapi.dev/images/v1/u/b/despite-flood-of-dramatic-headlines-market-continues-heading-higher-and-shrugging-off-worries.jpg,MacroView: 2021 - A Disappointment Of Growth And Disinflation,"As we head into 2021, there is a large consensus that the massive monetary interventions in 2020 will lead to an explosion of economic growth, inflation, and higher interest rates. We suspect that the outcome of more debt-driven spending will lead to a disappointment in growth and disinflation instead.",Seeking Alpha,"Sat, 30 Jan 2021 09:13:31 -0500",paylimitwall,Negative,Article
https://www.cnbc.com/2021/01/30/what-is-a-spac.html,https://cdn.snapi.dev/images/v1/l/l/106831762-16118534192021-01-28t165813z-294449866-rc24hl9jlwzy-rtrmadp-0-usa-stocks-open.jpeg,What is a SPAC? Explaining one of Wall Street's hottest trends,"SPACs, which allow private companies to go public without a traditional IPO, raise billions of dollars in 2020. Here's how they work.",CNBC,"Sat, 30 Jan 2021 09:00:01 -0500",,Neutral,Article
https://seekingalpha.com/article/4401078-billionaire-investor-says-buy-office-and-urban-reits-and-avoid-big-tech,https://cdn.snapi.dev/images/v1/m/c/communication13---lmrsfci5vp.jpg,Billionaire Investor Says Buy Office And Urban REITs And Avoid Big Tech,Billionaire investor Sam Zell is bullish on real estate despite the COVID crisis. He does not buy into the work-from-home hype and expects urbanization to continue for decades to come.,Seeking Alpha,"Sat, 30 Jan 2021 09:00:00 -0500","Real Estate,paylimitwall",Neutral,Article
https://www.marketwatch.com/story/the-u-s-may-have-lost-jobs-again-in-january-but-the-economy-is-ripe-for-rebound-11611953537,https://cdn.snapi.dev/images/v1/c/x/im-292496width620size16819973718791064.jpg,"Economic Report: The U.S. may have lost jobs again in January, but the economy is ripe for rebound","The U.S. jobs market could also use a shot in the arm, just like the millions of Americans who are getting life-saving vaccines against the coronavirus. The economy lost jobs in December for the first time since the onset of the pandemic and employment could fall again in January.",Market Watch,"Sat, 30 Jan 2021 08:30:00 -0500",paylimitwall,Positive,Article
https://www.fool.com/investing/2021/01/30/watch-out-3-reasons-the-stock-market-could-be-over/,https://cdn.snapi.dev/images/v1/i/r/urlhttps3a2f2fgfoolcdncom2feditorial2fimages2f6097572fgettyimages-612736550jpgw700opresize.jpg,Watch Out! 3 Reasons the Stock Market Could Be Overvalued,Here's what to do if you're worried about a stock market crash.,The Motley Fool,"Sat, 30 Jan 2021 08:17:00 -0500",,Negative,Article
https://www.marketwatch.com/story/bumpier-path-to-normal-from-uneven-vaccine-rollout-alarms-u-s-stock-market-bulls-11611956467,https://cdn.snapi.dev/images/v1/b/p/im-292596width620size14382022471910112.jpg,Market Snapshot: ‘Bumpier' path to normal from uneven vaccine rollout alarms U.S. stock-market bulls,The naysayers warn recent delays and shortages in vaccine deliveries have started to gnaw away at the stock market's confidence that the U.S. economy will recover quickly this year when immunity to the coronavirus begins to build up in the population.,Market Watch,"Sat, 30 Jan 2021 08:15:00 -0500",paylimitwall,Negative,Article
https://www.fool.com/investing/2021/01/30/how-many-stocks-should-you-own/,https://cdn.snapi.dev/images/v1/p/o/podc13---jaoqrhweiy.jpg,How Many Stocks Should You Own?,Two investors discuss their different approaches.,The Motley Fool,"Sat, 30 Jan 2021 08:00:00 -0500",podcast,Neutral,Article
https://www.fool.com/investing/2021/01/30/why-this-investor-owns-more-than-100-stocks/,https://cdn.snapi.dev/images/v1/p/o/podc12---ucoerpi8m7.jpg,Why This Investor Owns More Than 100 Stocks,This investing approach may help you sleep better.,The Motley Fool,"Sat, 30 Jan 2021 07:30:00 -0500",podcast,Neutral,Article
https://seekingalpha.com/article/4402229-real-gross-domestic-product-posted-solid-gain-in-fourth-quarter-remains-below-trend,https://cdn.snapi.dev/images/v1/k/i/mw-im077-nyse-20200807155716-zqjpguuid31c8880c-d8e8-11ea-9376-9c8e992d421e.jpg,"Real Gross Domestic Product Posted A Solid Gain In The Fourth Quarter, But Remains Below Trend","Real gross domestic product rose at a 4.0 percent annualized rate in the fourth quarter, down from a 33.4 percent pace in the third quarter. Measured from fourth quarter 2019 to fourth quarter 2020, real gross domestic product decreased 2.5 percent.",Seeking Alpha,"Sat, 30 Jan 2021 06:49:56 -0500",paylimitwall,Positive,Article
https://www.fool.com/investing/2021/01/30/should-dividend-investors-buy-preferred-stock-an-e/,https://cdn.snapi.dev/images/v1/p/o/podc7---pivynillkz.jpg,Should Dividend Investors Buy Preferred Stock? An Expert Explains the Pros and Cons,All dividend stocks are not the same. Even if they're issued by the same company.,The Motley Fool,"Sat, 30 Jan 2021 06:02:00 -0500","dividend,podcast",Neutral,Article
https://seekingalpha.com/article/4402213-focus-on-fundamentals,https://cdn.snapi.dev/images/v1/x/l/m02d20201010t2i1536923540w940fhfwllplsqrlynxmpeg9813w.jpg,Focus On The Fundamentals,"Volatility in the financial markets accelerated last week due to the ""games"" being played by short sellers. Many investors believe these moves represent added risk and raised some cash taking risk-off.",Seeking Alpha,"Sat, 30 Jan 2021 06:00:00 -0500",paylimitwall,Neutral,Article
https://seekingalpha.com/article/4402219-federal-reserve-watch-credit-inflation-is-alive-and-well,https://cdn.snapi.dev/images/v1/o/u/quarterly-review-global-stocks-add-to-2q-gains-440x250.jpg,Federal Reserve Watch: Credit Inflation Is Alive And Well,"The Federal Reserve has two goals: first to get inflation rising for an extended period of time so as to, two, reduce the unemployment rate. The Fed for the time being is committed to keep buying $120 billion of securities outright per month, making sure it errs on the side of too much monetary ease.",Seeking Alpha,"Sat, 30 Jan 2021 03:06:52 -0500",paylimitwall,Neutral,Article
https://www.youtube.com/watch?v=lW4IT0F1SV4,https://cdn.snapi.dev/images/v1/m/q/why-wealthsimple-refuses-to-restrict-trading.jpg,Why Wealthsimple Refuses to Restrict Trading,"Jan.29 -- The Reddit-fueled rally in the likes of GameStop, BlackBerry and AMC prompted U.S. no-fee trading platform Robinhood to restrict the types of transactions retail investors could make in the names, prompting outrage. In Canada, Wealthsimple did no such thing, allowing investors to trade freely in those securities, helping drive the trading platform to the top of the app store.",Bloomberg Markets and Finance,"Sat, 30 Jan 2021 02:09:25 -0500",,Neutral,Video
https://seekingalpha.com/article/4402212-week-on-wall-street-let-games-begin,https://cdn.snapi.dev/images/v1/v/h/im-243414width620size144960362400906.jpg,The Week On Wall Street: Let The Games Begin,"There is a ""mania"" out there, but it is hardly “everywhere”. Earnings remain robust, and companies are raising guidance. The data doesn't lie; economic reports continue to roll in at or above pre-pandemic levels, and no one is talking about them.",Seeking Alpha,"Sat, 30 Jan 2021 01:24:01 -0500",paylimitwall,Neutral,Article
https://seekingalpha.com/article/4402209-weekly-high-frequency-indicators-commodities-jobless-claims-change-in-short-leading-forecast,https://cdn.snapi.dev/images/v1/v/g/2dew2q1-24.jpg,"Weekly High Frequency Indicators: Commodities, Jobless Claims Change In Short Leading Forecast","High frequency indicators can give us a nearly up-to-the-moment view of the economy. The metrics are divided into long leading, short leading, and coincident indicators. Vaccinations remain the most decisive single metric for now.",Seeking Alpha,"Sat, 30 Jan 2021 00:45:04 -0500",paylimitwall,Neutral,Article
