news_url,image_url,title,text,source_name,date,topics,sentiment,type
https://seekingalpha.com/article/4402583-markets-made-strong-moves-to-counter-last-weeks-selling-technically-speaking-for-2-1,https://cdn.snapi.dev/images/v1/5/g/m02d20200928t2i1535196174w940fhfwllplsqrlynxmpeg8r11p.jpg,The Markets Made Strong Moves To Counter Last Week's Selling (Technically Speaking For 2/1),"While the reflation trade is ongoing, it is weakening. This week's key economy report is Friday's employment report.",Seeking Alpha,"Mon, 01 Feb 2021 22:06:36 -0500","tanalysis,paylimitwall",Positive,Article
https://www.youtube.com/watch?v=R5NrmFQjcNY,https://cdn.snapi.dev/images/v1/m/q/stocks-its-important-to-differentiate-between-speculating-and-investing-strategist.jpg,Stocks: It's important to differentiate between speculating and investing: Strategist,"Yahoo Finance's Alexis Christoforous and Liz Ann Sonders, Charles Schwab Senior Vice President and Chief Investment Strategist, discuss the stock market and concerns with short squeezes and speculative investing. For 2020 election results please visit: Election results: https://www.yahoo.com/elections Subscribe to Yahoo Finance: https://yhoo.it/2fGu5Bb About Yahoo Finance: At Yahoo Finance, you get free stock quotes, up-to-date news, portfolio management resources, international market data, social interaction and mortgage rates that help you manage your financial life.",Yahoo Finance,"Mon, 01 Feb 2021 21:57:14 -0500",,Neutral,Video
https://www.seeitmarket.com/stock-market-indices-have-mixed-technical-picture/,https://cdn.snapi.dev/images/v1/f/q/sikdjd2.jpg,Stock Market Indices Have Mixed Technical Picture,"The Dow Jones Industrial Average (DIA) sits alone under the 50-day moving average, while his friends, Russell 2000 (IWM), Nasdaq 100 (QQQ) and S&P500 (SPY) cleared Fridays highs and remain above their 50-day moving averages.  Though only the DIA ended under the 50-day moving average, it still had an inside day which shows digestion of […] The post Stock Market Indices Have Mixed Technical Picture appeared first on See It Market.",See It Market,"Mon, 01 Feb 2021 21:21:38 -0500",tanalysis,Neutral,Article
https://www.reuters.com/article/us-usa-fed/fed-policy-makers-like-lawmakers-split-on-need-for-more-fiscal-aid-idUSKBN2A206V,https://cdn.snapi.dev/images/v1/d/b/m02d20210202t2i1549925446w940fhfwllplsqrlynxmpeh1103g.jpg,"Fed policy makers, like lawmakers, split on need for more fiscal aid","As the White House and Congressional Democrats press for a $1.9 trillion pandemic relief package that many Republicans say is more than what the country needs or can afford, Federal Reserve policymakers are also split on the issue.",Reuters,"Mon, 01 Feb 2021 21:21:00 -0500",,Neutral,Article
https://www.cnn.com/2021/02/01/success/how-to-start-investing-in-stocks-feseries/index.html,https://cdn.snapi.dev/images/v1/2/1/210121170645-new-york-stock-exchange-0112-super-169.jpg,How to start investing in stocks with little or no experience,Investing for the first time can be downright intimidating.,CNN Business,"Mon, 01 Feb 2021 20:30:42 -0500",,Neutral,Article
https://www.barrons.com/articles/stocks-are-expensive-what-investors-need-to-know-now-51612229366,https://cdn.snapi.dev/images/v1/i/m/im-293261.jpg,Stocks Are Expensive. Companies Are Confident.,Valuations and sentiment are sending conflicting messages on whether to buy stocks.,Barrons,"Mon, 01 Feb 2021 20:29:00 -0500",paywall,Negative,Article
https://www.youtube.com/watch?v=Ub9Gd3anSvE,https://cdn.snapi.dev/images/v1/6/l/should-be-a-good-year-for-equities-says-jpmorgans-craig.jpg,"Should be a Good Year for Equities, Says JPMorgan's Craig","Feb.01 -- Kerry Craig, global market strategist at JPMorgan Asset Management, discusses the volatility in markets, were he sees them heading and his outlook for the U.S. dollar. He speaks on “Bloomberg Daybreak: Asia.",Bloomberg Markets and Finance,"Mon, 01 Feb 2021 20:16:53 -0500",,Positive,Video
https://investorplace.com/2021/02/3-market-red-flags/,https://cdn.snapi.dev/images/v1/1/0/106831762-16118534192021-01-28t165813z-294449866-rc24hl9jlwzy-rtrmadp-0-usa-stocks-open---d6w3ucrtcy.jpeg,3 Market Red Flags,"Was last week the beginning of something worse? … three “euphoria” signals … John Jagerson and Wade Hansen remain cautiously bullish Last week's chaos surrounding the Reddit-traders, GameStop, and the Robinhood trading platform overshadowed something important … The S&P fell nearly 3.5%.",InvestorPlace,"Mon, 01 Feb 2021 19:53:53 -0500",,Negative,Article
https://nypost.com/2021/02/01/reddits-epic-silver-squeeze-is-only-helping-wall-street/,https://cdn.snapi.dev/images/v1/b/o/financial-markets-wall-street-2jpgquality90stripall.jpg,Reddit's ‘epic' silver squeeze is only helping Wall Street,"Finally, a “Reddit rally” Wall Street can get behind. The merry band of day traders behind runaway stocks like GameStop piled into silver on Monday in an effort to squeeze Wall Street.",New York Post,"Mon, 01 Feb 2021 19:35:26 -0500",,Positive,Article
https://www.cnbc.com/2021/02/01/major-correction-will-surprise-market-speculators-cfras-sam-stovall.html,https://cdn.snapi.dev/images/v1/1/0/106833061-1612184002610-gettyimages-1230857988-reddit-app.jpeg,"Speculative mania is setting market up for a major correction, CFRA's Sam Stovall warns",CFRA's Sam Stovall is telling investors to brace for a 10.5% market pullback this month.,CNBC,"Mon, 01 Feb 2021 19:19:51 -0500",,Negative,Article
https://www.reuters.com/article/us-usa-property-poll/u-s-housing-market-immune-to-covid-19-pandemic-reuters-poll-idUSKBN2A2005,https://cdn.snapi.dev/images/v1/m/0/m02d20210202t2i1549915071w940fhfwllplsqrlynxmpeh11007.jpg,U.S. housing market immune to COVID-19 pandemic: Reuters poll,"U.S. house prices will continue to race ahead over the next two years, according to a Reuters poll of analysts who said any COVID-19 resurgence was unlikely to knock housing market activity off its current upward course.",Reuters,"Mon, 01 Feb 2021 19:16:00 -0500",,Positive,Article
https://seekingalpha.com/article/4402571-new-shares-pumped,https://cdn.snapi.dev/images/v1/i/m/im-240050.jpg,New Shares Pumped,"As predicted, IVR issues new shares. You can't be surprised, we told you on 1/26/2021 that IVR should be looking to issue shares. Shares of IVR just closed at $4.01, which is about equal to management's stated BV range for 1/31/2021 of $4.00 to $4.10.",Seeking Alpha,"Mon, 01 Feb 2021 19:05:31 -0500","Real Estate,paylimitwall",Positive,Article
https://www.marketwatch.com/story/were-at-this-point-where-stock-markets-are-just-ludicrous-says-carson-block-11612223605,https://cdn.snapi.dev/images/v1/d/i/im-293425width620size14545454545454546.jpg,"Market Extra: ‘We're at this point where stock markets are just ludicrous,' says Carson Block",Muddy Waters founder Carson Block thinks that investing sentiment is reaching ludicrous levels---and that could eventually fracture a market that he views as fragile.,Market Watch,"Mon, 01 Feb 2021 18:53:00 -0500",paylimitwall,Negative,Article
https://www.cnbc.com/2021/02/01/cramer-recommends-theme-stocks-to-buy-on-the-next-market-sell-off.html,https://cdn.snapi.dev/images/v1/k/q/106823255-1610479020429-wall.jpg,Cramer recommends theme stocks to buy on the next market sell-off,"""With these 15 themes ... I'm confident you can safely buy more the next time the market gets hammered,"" the ""Mad Money"" host said.",CNBC,"Mon, 01 Feb 2021 18:47:03 -0500",cramer,Positive,Article
https://www.youtube.com/watch?v=yDh_SLS9YmA,https://cdn.snapi.dev/images/v1/m/q/white-house-stimulus-meeting-underway.jpg,White House stimulus meeting underway,"CNBC's Ylan Mui reports on stimulus discussions currently underway at the White House. With CNBC's Brian Sullivan and the Fast Money traders, Tim Seymour, Pete Najarian and Dan Nathan.",CNBC Television,"Mon, 01 Feb 2021 18:38:21 -0500",Political,Neutral,Video
https://seekingalpha.com/article/4402568-major-asset-classes-january-2021-performance-review,https://cdn.snapi.dev/images/v1/i/m/despite-flood-of-dramatic-headlines-market-continues-heading-higher-and-shrugging-off-worries.jpg,Major Asset Classes: January 2021 Performance Review,"Stocks in emerging markets continued to lead the major asset classes in January as the top monthly performer. Emerging markets shares have been up for four straight months, pushing this slice of the world's equities to a wide one-year lead of nearly 28%.",Seeking Alpha,"Mon, 01 Feb 2021 18:35:21 -0500",paylimitwall,Neutral,Article
https://www.reuters.com/article/us-retail-trading-usa-congress/u-s-house-panel-announces-february-18-hearing-on-gamestop-market-volatility-idUSKBN2A13UI,https://cdn.snapi.dev/images/v1/l/o/despite-flood-of-dramatic-headlines-market-continues-heading-higher-and-shrugging-off-worries.jpg,U.S. House panel announces February 18 hearing on GameStop market volatility,"The U.S. House of Representatives Financial Services Committee will hold a hearing on recent market volatility involving GameStop Corp and other stocks on Feb. 18, the committee said in a statement on Monday.",Reuters,"Mon, 01 Feb 2021 18:22:00 -0500",,Negative,Article
https://www.cnbc.com/2021/02/01/stock-market-futures-open-to-close-news.html,https://cdn.snapi.dev/images/v1/3/q/106831040-16117753122703-trading-foor-ob-photo-210127-press-7-jpg.jpg,Stock futures open little changed after Wall Street's strong start to the week,U.S. stock futures were little changed on Monday evening after the equity market kicked off the week with a bounce-back session.,CNBC,"Mon, 01 Feb 2021 18:03:09 -0500",,Neutral,Article
https://www.investors.com/market-trend/the-big-picture/stock-market-rebound-sends-nasdaq-above-key-chart-indicator/,https://cdn.snapi.dev/images/v1/c/d/3efdsq1-mroyzslwqn.jpg,Stock Market Rebound Sends Nasdaq Above This Key Chart Indicator,"Last week, media outlets raised concerns among hedge funds. Some may be forced to ""throw the baby out with the bathwater"" by selling good stocks to cover losses in short positions.",Investors Business Daily,"Mon, 01 Feb 2021 17:39:56 -0500",paywall,Positive,Article
https://www.cnbc.com/2021/02/01/feds-bostic-says-economy-could-recovery-more-quickly-than-expected.html,https://cdn.snapi.dev/images/v1/n/c/105739737-1550157174073bostic.jpg,Fed's Bostic says economy could recovery more quickly than expected,"Atlanta Fed President Raphael Bostic said Monday that he's not worried about overheating, though he does think growth could happen faster than many expect.",CNBC,"Mon, 01 Feb 2021 17:39:51 -0500",,Positive,Article
https://www.youtube.com/watch?v=MfOqtVQyOC8,https://cdn.snapi.dev/images/v1/b/i/ubs-global-cio-mark-haefele-on-how-to-manage-market-volatility.jpg,UBS Global CIO Mark Haefele on how to manage market volatility,"Mark Haefele, Global CIO of UBS Wealth Management, joins Worldwide Exchange to discuss how investors should be approaching this market volatility, and where to find opportunity for the future. Subscribe to CNBC Pro to access our live Pro Talk “How to Navigate the Reddit Market Mania” with Fundstrat's Tom Lee and CNBC's Mike Santoli: https://cnb.cx/3r7vPrJ",CNBC Television,"Mon, 01 Feb 2021 17:19:13 -0500",,Negative,Video
https://www.youtube.com/watch?v=N8jRBS8OrAc,https://cdn.snapi.dev/images/v1/m/q/brokers-limiting-access-to-stocks-is-un-american-and-un-capitalistic-investor.jpg,Brokers limiting access to stocks is 'un-American and un-capitalistic': Investor,Ironsides Macroeconomics managing partner Barry Knapp and Strategic Wealth Partners investment strategist Luke Lloyd discuss what's to follow the short squeeze saga. #FoxBusiness Subscribe to Fox Business!,Fox Business,"Mon, 01 Feb 2021 17:15:24 -0500",,Negative,Video
https://www.benzinga.com/markets/mutual-funds/21/02/19410759/this-is-not-the-market-participants-problem-volatility-arbitrage-trader-talks-gamestop-marke,https://cdn.snapi.dev/images/v1/z/8/gamestop-2.jpg,"'This Is Not The Market Participant's Problem': Volatility Arbitrage Trader Talks GameStop, Market Microstructure, Regulation","In 2019, former financial professional Keith Gill, who goes by “Roaring Kitty” on Reddit, began a movement that pushed GameStop Corporation's (NYSE: GME) stock price as high as $513.12 in premarket trade Jan. 28, after which numerous brokers made the controversial decision to limit trades, creating a synthetic imbalance that caused the stock to plummet to a low of $112.25 in regular trade. As part of the development, Benzinga chatted with Kris Sidial, a former institutional trader and the co-chief investment officer of The Ambrus Group, a volatility arbitrage fund that looks to exploit changing market structure dynamics.",Benzinga,"Mon, 01 Feb 2021 17:13:52 -0500",,Negative,Article
https://www.barrons.com/articles/dow-jones-industrial-average-rose-everything-went-right-stocks-51612216149,https://cdn.snapi.dev/images/v1/b/f/ap21020611618118.jpg,The Dow Rose 229 Points Because Everything Went Right for Stocks,GameStop and Bed Bath & Beyond stock tumbled as the broader market rallied. One observer cheered “opportunities for new money to get in.,Barrons,"Mon, 01 Feb 2021 17:06:00 -0500",paywall,Positive,Article
https://www.youtube.com/watch?v=D7OoY7gy9T8,https://cdn.snapi.dev/images/v1/y/l/atlanta-fed-president-discusses-economic-recovery-retail-frenzy-in-markets.jpg,"Atlanta Fed President discusses economic recovery, retail frenzy in markets","Atlanta Fed president Raphael Bostic joins 'Closing Bell' to talk about the stimulus relief package, retail frenzy in markets, and what can be done to bring back lost jobs and the economy.",CNBC Television,"Mon, 01 Feb 2021 17:00:33 -0500",,Negative,Video
https://seekingalpha.com/article/4402552-is-reddit-rebellion-to-stay,https://cdn.snapi.dev/images/v1/g/g/mw-im077-nyse-20200807155716-zqjpguuid31c8880c-d8e8-11ea-9376-9c8e992d421e.jpg,Is The Reddit Rebellion Here To Stay?,"All anyone wants to talk about is ""Gamestonk!"" Can't really blame them, when a stock advances more than 16X in 12 sessions, it definitely gets your attention.",Seeking Alpha,"Mon, 01 Feb 2021 16:59:16 -0500",paylimitwall,Neutral,Article
https://www.barrons.com/articles/junk-bonds-should-benefit-from-the-rally-in-unloved-stocks-investors-are-bailing-anyway-51612216422,https://cdn.snapi.dev/images/v1/o/z/m02d20201010t2i1536923540w940fhfwllplsqrlynxmpeg9813w.jpg,Junk Bonds Should Benefit from the Rally in Unloved Stocks. Investors Are Pulling Out Cash Anyway.,"High-yield bonds are seeing outflows but not underperformance during the recent stock market volatility, a sign that junk bonds may continue to hold up despite concerns about risky markets.",Barrons,"Mon, 01 Feb 2021 16:53:00 -0500",paywall,Negative,Article
https://www.youtube.com/watch?v=WJGr54Ol8Hk,https://cdn.snapi.dev/images/v1/m/q/unpacking-behavioral-investing-trends-behind-the-reddit-fueled-trading-frenzy.jpg,Unpacking behavioral investing trends behind the Reddit-fueled trading frenzy,"Dan Egan, managing director of behavioral finance and investing at Betterment, Todd Rosenbluth, senior director of ETF and mutual fund research at CFRA, Stephen Mathai-Davis, CEO and co-founder of Q.ai, and William Rhind, CEO and founder of GraniteShares, discuss the Reddit-fueled trading frenzy. With CNBC's Bob Pisani.",CNBC Television,"Mon, 01 Feb 2021 16:52:43 -0500",,Neutral,Video
https://www.kiplinger.com/investing/stocks/602185/stock-market-today-020121-big-tech-leads-another-snap-back-rally,https://cdn.snapi.dev/images/v1/f/w/stock-market-today-020121.jpg,Stock Market Today: Big Tech Leads Another Snap-Back Rally,"COVID worries, including a not-glowing reception to Johnson & Johnson vaccine, helped drag the major indices lower Friday",Kiplinger,"Mon, 01 Feb 2021 16:45:00 -0500",,Positive,Article
https://www.youtube.com/watch?v=xQh20gqRB6k,https://cdn.snapi.dev/images/v1/m/q/retail-activity-less-pronounced-than-before-omar-aguilar.jpg,Retail activity less pronounced than before: Omar Aguilar,"Omar Aguilar, Charles Schwab Investment Management, says he's noticed investors are now focusing more on long-term investments and have turned their attention back to earnings after the latest GameStop surge. He also discusses why tech is performing well.",CNBC Television,"Mon, 01 Feb 2021 16:37:18 -0500",,Neutral,Video
https://www.marketwatch.com/story/economy-still-in-depths-of-recession-feds-rosengren-says-11612215082,https://cdn.snapi.dev/images/v1/y/q/im-293370width620size11636363636363636.jpg,"The Fed: Economy still in ‘depths of recession,' Fed's Rosengren says","The U.S. economy is still in the depths of recession with high unemployment and many Americans still on temporary layoffs, said Boston Fed President Eric Rosengren on Monday.",Market Watch,"Mon, 01 Feb 2021 16:31:00 -0500",paylimitwall,Negative,Article
https://www.youtube.com/watch?v=jHUuhsqdAfA,https://cdn.snapi.dev/images/v1/b/l/210129082244-01-nyse-0127-super-169.jpg,Stock Market Rallies Powerfully After Rough Week,"The Nasdaq outperformed Monday, helped by strong performance from Google parent Alphabet, Align Technologies and Qualcomm. Investor's Business Daily has been helping people invest smarter results by providing exclusive stock lists, investing data, stock market research, education and the latest financial and business news to help investors make more money in the stock market.",Investors Business Daily,"Mon, 01 Feb 2021 16:13:18 -0500",tanalysis,Positive,Video
https://www.youtube.com/watch?v=8qs65k_5FGE,https://cdn.snapi.dev/images/v1/m/q/citis-shafir-ma-comeback-has-legs-spacs-here-to-stay.jpg,"Citi's Shafir: M&A Comeback Has Legs, SPACs Here to Stay","Feb.01 -- Mark Shafir, Citigroup's co-head of global M&A, discusses the outlook for M&A activity in 2021 and the ""robust"" use of special purpose acquisition companies (SPACs) for listings. He speaks with Bloomberg's Ed Hammond on ""Bloomberg Markets: The Close.",Bloomberg Markets and Finance,"Mon, 01 Feb 2021 16:09:42 -0500","manda,SPAC",Positive,Video
https://www.businessinsider.com/stocks-market-news-today-reddit-short-squeezes-subside-biggest-rally-2021-2,https://cdn.snapi.dev/images/v1/d/o/dow-soars-229-points-as-stocks-stage-biggest-rally-in-12-weeks.jpg,Dow soars 229 points as stocks stage biggest rally in 12 weeks,"The S&P 500 notched its biggest daily gain in 12 weeks on Monday after suffering from last week's 3% decline, which was its worst since October. Last week's volatility was driven by a number of short-squeezes in stocks that had been targeted by traders coordinating on Reddit's WallStreetBets forum, but JPMorgan said investors should take advantage of the decline and ""buy the dip.""",Business Insider,"Mon, 01 Feb 2021 16:07:20 -0500",paylimitwall,Positive,Article
https://www.marketwatch.com/story/stocks-mount-sharp-bounceback-as-markets-look-to-recover-from-gamestop-frenzy-2021-02-01,https://cdn.snapi.dev/images/v1/g/q/stocks18-1-gr70hpssze.jpg,Stocks mount sharp bounceback as markets look to recover from GameStop frenzy,"U.S. stocks ended sharply higher on Monday, led by gains in tech shares as investors looked to recover from last week's sharp losses sparked by wild trading in shares of videogame retailer GameStop Corp. and other small-cap companies. The S&P 500 rose 1.6% to 3,774.",Market Watch,"Mon, 01 Feb 2021 16:05:00 -0500",paylimitwall,Positive,Article
https://seekingalpha.com/article/4402540-newtons-first-law-of-motion,https://cdn.snapi.dev/images/v1/o/o/quarterly-review-global-stocks-add-to-2q-gains-440x250.jpg,Newton's First Law Of Motion,"Economic and financial trends that have been in place for years and even decades oftentimes reverse with major catalysts. Since the bottom of the 2007-2009 financial crisis, the S&P 500's total return (appreciation plus reinvested dividends) through the end of 2020 is 607.9% while the MSCI World Excluding US Stock Index is up 267.4% and the MSCI Emerging Market Index is up 247.3%.",Seeking Alpha,"Mon, 01 Feb 2021 16:03:53 -0500",paylimitwall,Neutral,Article
https://www.forbes.com/sites/jonathanponciano/2021/02/01/heres-what-could-spark-the-next-10-market-correction-bank-of-america-warns/,https://cdn.snapi.dev/images/v1/h/e/heres-what-could-spark-the-next-10-market-correction-bank-of-america-warns.jpg,"Here's What Could Spark The Next 10% Market Correction, Bank Of America Warns",Companies are no longer being rewarded by investors for blowout earnings–and that could spell trouble for stocks down the line.,Forbes,"Mon, 01 Feb 2021 15:59:21 -0500",paylimitwall,Negative,Article
https://www.marketwatch.com/story/a-dumb-money-confidence-stock-market-gauge-is-flashing-a-warning-11612213156,https://cdn.snapi.dev/images/v1/r/5/im-240050.jpg,The Tell: A ‘Dumb-Money Confidence' stock-market gauge is flashing a warning,"A gauge of the confidence of individual investors, colloquially referred to as “dumb money,” was breaching a level at 0.67 that SentimenTrader's Jay Kaeppel deemed indicative of trouble for forward returns in the S&P 500 index.",Market Watch,"Mon, 01 Feb 2021 15:59:00 -0500",paylimitwall,Negative,Article
https://seekingalpha.com/article/4402532-gamestop-momentum-makes-russell-outperform-now-look-out-for-major-market-peak,https://cdn.snapi.dev/images/v1/p/7/etf27.jpg,"Further GameStop Momentum Makes Russell Outperform, But Now Look Out For A Major Market Peak","The GME momentum higher will probably continue for some more days, even weeks. The Russell 2000 will continue to outperform in that case. This GME story is unlikely to morph into a Lehman style of market dislocation. More likely, some type of LCTM rescue/bail-out will be engineered by the Federal Reserve.",Seeking Alpha,"Mon, 01 Feb 2021 15:48:24 -0500",paylimitwall,Positive,Article
https://www.youtube.com/watch?v=iQRsdsUs2Ao,https://cdn.snapi.dev/images/v1/w/o/billionaire-tom-steyer-weighs-in-on-reddit-fueled-market-volatility.jpg,Billionaire Tom Steyer weighs in on Reddit-fueled market volatility,"Tom Steyer, former Democratic presidential candidate, NextGen America founder and billionaire, joins 'Closing Bell' to weigh in on the reddit-fueled market volatility last week and why he says it's about economic justice.",CNBC Television,"Mon, 01 Feb 2021 15:44:53 -0500",,Negative,Video
https://www.forbes.com/sites/vineerbhansali/2021/02/01/two-kinds-of-short-squeezes--reddit-squeezing-stocks-and-central-banks-squeezing-bonds/,https://cdn.snapi.dev/images/v1/j/8/two-kinds-of-short-squeezes-reddit-squeezing-stocks-and-central-banks-squeezing-bonds.jpg,Two Kinds Of Short Squeezes – Reddit Squeezing Stocks And Central Banks Squeezing Bonds,The stock market short squeeze orchestrated by Redditers is related to the bond market short squeeze orchestrated by global central banks.,Forbes,"Mon, 01 Feb 2021 15:40:33 -0500",paylimitwall,Neutral,Article
https://www.marketwatch.com/story/treasury-slashes-borrowing-estimates-for-first-three-months-of-2021-11612211516,https://cdn.snapi.dev/images/v1/i/m/im-293191width620size15005861664712778.jpg,Economic Report: Treasury slashes borrowing estimates for first three months of 2021,"The Treasury Department said Monday it expects to borrow $274 billion in the first quarter, which is $853 billion lower than previously estimated.",Market Watch,"Mon, 01 Feb 2021 15:31:00 -0500",paylimitwall,Negative,Article
https://www.youtube.com/watch?v=ztffYKHpNfQ,https://cdn.snapi.dev/images/v1/g/5/carson-block-says-financial-markets-are-broken.jpg,Carson Block Says Financial Markets Are Broken,"Feb.01 -- Carson Block, Muddy Waters Capital LLC chief executive officer, rejects the idea that he is part of the financial ""establishment"" and calls for more enforcement from the U.S. Securities and Exchange Commission in the wake of the GameStop Corp. frenzy. He speaks with Bloomberg's Erik Schatzker on ""Bloomberg Markets.",Bloomberg Markets and Finance,"Mon, 01 Feb 2021 15:27:24 -0500",,Negative,Video
https://seekingalpha.com/article/4402522-what-happens-when-game-stops,https://cdn.snapi.dev/images/v1/5/n/2dew2q1-24.jpg,What Happens When The Game Stops?,"Valuations are stretched, but speculative option trading may not necessarily be a sign of widespread, unsustainable froth. Reports indicate that single-stock option trading has been smashing single-day volume records during January.",Seeking Alpha,"Mon, 01 Feb 2021 15:24:23 -0500",paylimitwall,Neutral,Article
https://www.cnbc.com/2021/02/01/sec-could-set-short-interest-caps-hike-trading-taxes-to-combat-wild-moves-analysts-say.html,https://cdn.snapi.dev/images/v1/1/0/106832608-1611945827321-gettyimages-1230856640-gamestop-app.jpeg,"SEC could set short interest caps, hike trading taxes to combat wild moves, analysts say","The SEC could cap short interest on specific securities or aggressively tax short-term trading, according to Bank of America Merrill Lynch.",CNBC,"Mon, 01 Feb 2021 15:18:58 -0500",,Neutral,Article
https://www.forbes.com/sites/danrunkevicius/2021/02/01/gamestop-and-reddits-organized-trading-could-spark-a-stock-market-bloodbath/,https://cdn.snapi.dev/images/v1/i/d/gamestop-and-reddits-organized-trading-could-spark-a-stock-market-bloodbath.jpg,GameStop And Reddit's Organized Trading Could Spark A Stock Market Bloodbath,GameStop could be just the beginning. Reddit traders are plotting new “attacks” on the stock market.,Forbes,"Mon, 01 Feb 2021 15:07:19 -0500",paylimitwall,Negative,Article
