news_url,image_url,title,text,source_name,date,topics,sentiment,type
https://www.youtube.com/watch?v=U8asBs2SSWg,https://cdn.snapi.dev/images/v1/k/h/bullish-on-equities-constructive-on-energy-eastspring.jpg,"'Bullish' on Equities, 'Constructive' on Energy: Eastspring","Feb.18 -- Sarah Lien, client portfolio manager at Eastspring Investments, explains why she thinks the recent rise in Treasury yields signals bond markets are pricing in a global growth acceleration. She also discusses the outlook for markets and her strategy.",Bloomberg Markets and Finance,"Thu, 18 Feb 2021 23:55:58 -0500",,Positive,Video
https://seekingalpha.com/article/4407284-us-weekly-fundflows-insight-report-both-equity-etfs-funds-attract-net-new-money-despite-mixed-returns,https://cdn.snapi.dev/images/v1/z/9/us-etfs-rise-as-earnings-spotlight-growth-stocks-440x250.jpg,"U.S. Weekly FundFlows Insight Report: Both Equity ETFs, Funds Attract Net New Money Despite Mixed Returns","U.S. Weekly FundFlows Insight Report: Both Equity ETFs, Funds Attract Net New Money Despite Mixed Returns",Seeking Alpha,"Thu, 18 Feb 2021 23:53:38 -0500",paylimitwall,Positive,Article
https://seekingalpha.com/article/4407242-retail-sales-up-5_3-percent-in-january-beats-forecast,https://cdn.snapi.dev/images/v1/q/g/wall-street-740x416.jpg,"Retail Sales Up 5.3% In January, Beats Forecast",Headline sales came in at 5.3% month-over-month to one decimal and was well above the Investing.com forecast of 1.1%. Core sales (ex Autos) came in at 5.9% MoM.,Seeking Alpha,"Thu, 18 Feb 2021 19:27:05 -0500",paylimitwall,Positive,Article
https://www.reuters.com/article/us-usa-trade-china/yellen-says-u-s-will-keep-tariffs-on-china-in-place-for-now-idUSKBN2AI34D,https://cdn.snapi.dev/images/v1/c/w/im-242691width620size14463276836158192.jpg,Yellen says U.S. will keep tariffs on China in place for now,"The United States will keep tariffs imposed on Chinese goods by the former Trump administration in place for now, but will evaluate how to proceed after a thorough review, Treasury Secretary Janet Yellen told CNBC on Thursday.",Reuters,"Thu, 18 Feb 2021 19:03:00 -0500",Political,Negative,Article
https://seekingalpha.com/article/4407232-when-interest-rates-become-a-real-problem,https://cdn.snapi.dev/images/v1/f/x/ipos-banner-year-markets-e1600964930157jpgquality90stripall.jpg,When Interest Rates Become A Real Problem,"Will higher rates tank stocks? The higher rates are, the more expensive it is to borrow.",Seeking Alpha,"Thu, 18 Feb 2021 18:52:55 -0500",paylimitwall,Negative,Article
https://seekingalpha.com/article/4407216-covid-19-crisis-stalled-economic-recovery-im-weekly-unemployment-monitor-update-18-2,https://cdn.snapi.dev/images/v1/l/q/fed-economy-and-equities-940x600.jpg,Covid-19 Crisis - Stalled Economic Recovery: The iM-Weekly Unemployment Monitor: Update 02/18/2021,A truer picture of the employment situation is extracted from the Unemployment Insurance Weekly Claims (UIWC) report. Persons receiving some form of unemployment benefit account for 11.5% of the labor force.,Seeking Alpha,"Thu, 18 Feb 2021 18:42:33 -0500",paylimitwall,Negative,Article
https://www.cnbc.com/2021/02/18/stock-market-open-to-close-news.html,https://cdn.snapi.dev/images/v1/q/s/106837798-16128893051112-nyse-trading-floor-ob-photo-210209-press-2-jpg.jpg,Stock futures edge higher in overnight trading after Yellen pushes for more stimulus,Yellen told CNBC that more stimulus is necessary even as some economic data suggested a swift rebound.,CNBC,"Thu, 18 Feb 2021 18:02:48 -0500",,Positive,Article
https://www.schaeffersresearch.com/content/news/2021/02/18/february-finale-will-bring-plenty-earnings-economic-data,https://cdn.snapi.dev/images/v1/p/k/201006170805-nyse-1002-super-169.jpg,"February Finale Will Bring Plenty Earnings, Economic Data","The last week of February will start out slow, but plenty of economic data will be featured by the end, including the U.S. Federal Budget.",Schaeffers Research,"Thu, 18 Feb 2021 17:32:56 -0500",earnings,Neutral,Article
https://www.cnn.com/2021/02/18/economy/ceo-business-confidence/index.html,https://cdn.snapi.dev/images/v1/2/1/210218145113-restricted-nyse-0218-super-169.jpg,Corporate America is jumping for joy while millions remain jobless,"America's CEOs are the most confident they have been in 17 years, as company leaders expect fewer layoffs and further improvements in the business environment, according to a recent survey from the Conference Board, a non-profit think tank.",CNN Business,"Thu, 18 Feb 2021 17:29:37 -0500",,Negative,Article
https://www.barrons.com/articles/dow-jones-industrial-average-fell-as-high-rates-and-jobs-data-were-a-1-2-punch-51613685873,https://cdn.snapi.dev/images/v1/s/t/stocks22-1---en1jpd8o6t.jpg,The Dow Fell 119 Points Because High Rates and Jobs Data Were a 1-2 Punch,"All three major U.S. indexes closed in the red as high interest rates socked growth stocks, while disappointing jobs data jabbed value stocks.",Barrons,"Thu, 18 Feb 2021 17:04:00 -0500",paywall,Negative,Article
https://www.cnbc.com/2021/02/18/janet-yellen-may-be-parts-of-market-where-investors-should-be-careful.html,https://cdn.snapi.dev/images/v1/1/0/106829723-16116206572021-01-25t234200z-1503115600-rc2bfl95m9p4-rtrmadp-0-usa-biden-yellen---ubjznbk6sz.jpeg,"Yellen says investors should be very careful with some sectors, calls bitcoin 'highly speculative'","While low interest rates support higher stock valuations, Treasury chief Janet Yellen told CNBC some parts of the market may need to be viewed cautiously.",CNBC,"Thu, 18 Feb 2021 16:56:17 -0500",,Negative,Article
https://www.reuters.com/article/us-retail-trading-yellen/yellen-says-sec-will-prepare-report-on-retail-trading-volatility-idUSKBN2AI2XV,https://cdn.snapi.dev/images/v1/l/h/m02d20210218t2i1552066056w940fhfwllplsqrlynxmpeh1h1rs.jpg,Yellen says SEC will prepare report on retail trading volatility,"U.S. Treasury Secretary Janet Yellen said on Thursday that an increased prevalence of zero-commission trading has spurred retail investors to get more involved in stocks, and the Securities and Exchange Commission will prepare a report on trading practices amid recent volatility.",Reuters,"Thu, 18 Feb 2021 16:54:00 -0500",,Neutral,Article
https://www.kiplinger.com/investing/stocks/602294/stock-market-today-021821-disappointing-jobs-data-dings-the-dow,https://cdn.snapi.dev/images/v1/d/4/stock-market-today-021821.jpg,Stock Market Today: Disappointing Jobs Data Dings the Dow,"While Robinhood and Reddit leaders testified on Capitol Hill, Wall Street spent Thursday fretting over surprisingly high initial jobless claims.",Kiplinger,"Thu, 18 Feb 2021 16:27:00 -0500",,Negative,Article
https://www.cnbc.com/2021/02/18/short-interest-near-record-lows-traders-warn-on-short-squeeze-traps.html,https://cdn.snapi.dev/images/v1/1/0/106842457-16136797342021-02-18t161002z-1940431570-rc24vl92uw7w-rtrmadp-0-retail-trading-shortselling.jpeg,"As short interest falls to near-record lows, two traders sound the alarm on short squeeze traps",Two market analysts determine whether some of the most-shorted stocks in the market are still safe to trade.,CNBC,"Thu, 18 Feb 2021 16:25:36 -0500",earnings,Neutral,Article
https://www.proactiveinvestors.com//companies/news/941705/wall-street-recedes-after-disappointing-joblessness-data-down-day-for-tech-941705.html?SNAPI,https://cdn.snapi.dev/images/v1/x/2/spac-rover-ipo-pet-care-457x274.jpg,"Wall Street recedes after disappointing joblessness data, down day for tech","4:15pm: Dow improves but can't squeak out a win The blue-chip index ended Thursday down nearly 120 points, 0.4%, at 31,493 after being down almost 300 earlier in the session. The Nasdaq closed 100 points lower, a 0.7% dip, at 13,865, and the S&P 500 dipped 17 points, 0.4%, to 3,932.",Proactive Investors,"Thu, 18 Feb 2021 16:18:52 -0500",,Negative,Article
https://www.businessinsider.com/stock-market-news-jobless-claims-data-tech-stocks-gamestop-hearing-2021-2,https://cdn.snapi.dev/images/v1/u/s/us-stocks-dip-as-surprise-jump-in-jobless-claims-sparks-recovery-concerns.jpg,US stocks dip as surprise jump in jobless claims sparks recovery concerns,"US equities closed modestly lower on Thursday after an unexpected increase in weekly jobless claims prompted concerns the labor market's recovery hit a new snag. The number of Americans filing for unemployment benefits totaled an unadjusted 861,000 last week, the Labor Department said Thursday morning. The reading lands handily above the 773,000 claims expected by economists surveyed by Bloomberg. The sum is also the highest since mid-January.",Business Insider,"Thu, 18 Feb 2021 16:03:34 -0500",paylimitwall,Negative,Article
https://www.marketwatch.com/story/dow-halts-3-session-record-win-streak-as-walmart-boeing-weigh-on-index-sp-500-nasdaq-fall-a-third-strraight-day-2021-02-18,https://cdn.snapi.dev/images/v1/i/s/stocks8-105-s8rhooejdn.jpg,U.S. stocks finish lower after disappointing data on jobless claims,"U.S. stocks finished lower on Thursday, and the Dow Jones Industrial Average ended a three-session string of record closing highs, as a drop in retailer Walmart Inc. WMT, -6.41% and a decline in Boeing Co. BA, -3.29% dragged blue chips lower.",Market Watch,"Thu, 18 Feb 2021 16:01:36 -0500",paylimitwall,Negative,Article
https://www.youtube.com/watch?v=1UNygx4Ub8A,https://cdn.snapi.dev/images/v1/d/3/retail-investors-arent-dumb-money-says-catos-schulp.jpg,"Retail investors aren't 'dumb money,' says Cato's Schulp",The House Committee on Financial Services holds a hearing about the GameStop trading frenzy in late January 2021.,CNBC Television,"Thu, 18 Feb 2021 15:58:19 -0500",,Neutral,Video
https://www.youtube.com/watch?v=6k46BhAX7kk,https://cdn.snapi.dev/images/v1/m/q/nobody-looks-out-for-retail-investors-payne.jpg,Nobody looks out for retail investors: Payne,FOX Business' Charles Payne says he encourages everyone to be in the market despite everything working against them. Subscribe to Fox Business!,Fox Business,"Thu, 18 Feb 2021 15:50:21 -0500",,Neutral,Video
https://www.investopedia.com/investing/preferred-stock-etfs/,https://cdn.snapi.dev/images/v1/l/f/stocks-istock535199427-5bfc3adf46e0fb0051c1e47e.jpg,Best Preferred Stock ETFs for Q2 2021,"The best preferred stock ETFs for Q2 2021 are PFXF, FPE, and PFFD",Investopedia,"Thu, 18 Feb 2021 15:45:37 -0500",,Positive,Article
https://www.marketwatch.com/story/hedge-funds-on-the-lookout-they-dont-want-to-get-burned-says-analyst-as-gamestop-style-short-interest-falls-11613681086,https://cdn.snapi.dev/images/v1/i/m/im-301180width620size15041128084606346.jpg,"Market Extra: Hedge funds on the lookout: ‘they don't want to get burned', says analyst as GameStop-style short interest falls","GameStop-style short-squeeze chaos that reached a crescendo in late January has declined markedly, according to recent data from S&P Global Market Intelligence.",Market Watch,"Thu, 18 Feb 2021 15:44:00 -0500","earnings,paylimitwall",Negative,Article
https://www.reuters.com/article/us-usa-investments-mutualfunds/u-s-based-stock-funds-attract-7-8-billion-in-latest-week-lipper-idUSKBN2AI2TT,https://cdn.snapi.dev/images/v1/m/0/m02d20210218t2i1552057991w940fhfwllplsqrlynxmpeh1h1pa.jpg,U.S.-based stock funds attract $7.8 billion in latest week - Lipper,"U.S.-based stock funds attracted $7.8 billion in the week to Wednesday, as the S&P 500 traded near a record high, according to Lipper data released on Thursday.",Reuters,"Thu, 18 Feb 2021 15:44:00 -0500",,Positive,Article
https://seekingalpha.com/article/4407042-inflation-is-coming-and-stock-market-is-getting-worried,https://cdn.snapi.dev/images/v1/i/d/3efdsq1-mroyzslwqn.jpg,Inflation Is Coming And The Stock Market Is Getting Worried,Higher inflation readings continue pouring in and that's resulting in TIP rates finally pushing higher.,Seeking Alpha,"Thu, 18 Feb 2021 15:01:56 -0500",paylimitwall,Negative,Article
https://www.marketwatch.com/story/would-jack-bogle-invest-in-u-s-stocks-today-maybe-not-11613677597,https://cdn.snapi.dev/images/v1/h/f/etf20.jpg,Brett Arends's ROI: Would Jack Bogle invest in U.S. stocks today? Maybe not.,The Vanguard founder probably wouldn't be a fan of this high-flying market,Market Watch,"Thu, 18 Feb 2021 14:46:00 -0500",paylimitwall,Negative,Article
https://www.etftrends.com/etf-strategist-channel/valuations-could-stay-elevated-and-that-is-ok-in-our-view/,https://cdn.snapi.dev/images/v1/v/a/valuations-could-stay-elevated-and-that-is-ok-in-our-view-440x250.jpg,Valuations Could Stay Elevated… and that is OK in our View!,By Rebecca Felton Earnings Visibility Improving Last year during first quarter 2020 earnings season – the first period impacted by the novel coronavirus – we advised investors to pay attention to the words and tone used by management teams discussing current business conditions. Words mattered more than the numbers as Wall Street analysts were forced [.,ETF Trends,"Thu, 18 Feb 2021 14:39:11 -0500",,Neutral,Article
https://www.youtube.com/watch?v=A5uWxjKSJSk,https://cdn.snapi.dev/images/v1/r/6/catos-schulp-says-sec-should-look-into-wallstreetbets-during-gamestop-hearing.jpg,"Cato's Schulp says SEC should look into WallStreetBets, during GameStop hearing",The House Committee on Financial Services holds a hearing about the GameStop trading frenzy in late January 2021.,CNBC Television,"Thu, 18 Feb 2021 14:31:12 -0500",,Neutral,Video
https://www.barrons.com/articles/rising-rates-are-hurting-stocks-the-threat-isnt-going-away-51613675521,https://cdn.snapi.dev/images/v1/i/m/im-300958.jpg,Rising Rates Are Hurting Stocks. The Threat Isn't Going Away.,"The key point to watch is sudden, unexpected increases in bond yields.",Barrons,"Thu, 18 Feb 2021 14:12:00 -0500",paywall,Negative,Article
https://seekingalpha.com/article/4407043-triple-barrel-gatling-money-spigot-for-stocks,https://cdn.snapi.dev/images/v1/l/1/nike-and-powell-in-spotlight-but-european-virus-fears-could-be-sharing-stage.jpg,A Triple Barrel Gatling Money Spigot For Stocks,"So far in 2021 the rise in bond yields has had a high correlation to rising stock prices. While shares of GameStop were gathering the headlines of the recent ""Redditt short squeeze"" another company, Academy Sports and Outdoors was also being heavily and albeit quietly shorted over the last few weeks.",Seeking Alpha,"Thu, 18 Feb 2021 13:53:20 -0500",paylimitwall,Neutral,Article
https://www.youtube.com/watch?v=ICLUyBkjbSA,https://cdn.snapi.dev/images/v1/p/x/bank1-orbdz5a2wp.jpg,Another 861K Americans file new unemployment claims for week ending February 13,"#unemployment #stimulus #stockmarket Yahoo Finance's Zack Guzman and Aikiko Fujita spoke to Personal Capital Chief Investment Officer Craig Birk about the latest initial jobless claims for the week ending February 13 and what it means for the markets and the economy. Birk also weighed in on Robinhood, Reddit and retail trading and how it impacts markets.",Yahoo Finance,"Thu, 18 Feb 2021 13:34:00 -0500",,Negative,Video
https://www.nytimes.com/2021/02/18/business/economy/federal-reserve-climate-change-banks.html,https://cdn.snapi.dev/images/v1/m/y/18dc-fedclimate-articlelargejpgquality75autowebpdisableupscale.jpg,"As Winter Sweeps the South, Fed Officials Focus on Climate Change",A top Fed official says climate scenario analysis could be valuable in making sure that banks mind their climate-tied weak spots.,NYTimes,"Thu, 18 Feb 2021 13:21:11 -0500",paywall,Neutral,Article
https://www.youtube.com/watch?v=V0RIuE0kvfM,https://cdn.snapi.dev/images/v1/q/f/cato-institutes-schulp-gamestop-volatility-didnt-threaten-market-infrastructure.jpg,Cato Institute's Schulp: GameStop volatility didn't threaten market infrastructure,"Jennifer Schulp, Cato Institute director of financial regulation studies, delivers her opening remarks before the House Committee on Financial Services for GameStop trading frenzy hearing. Schulp joins Citadel CEO Ken Griffin, Robinhood CEO Vlad Tenev, Melvin Capital CEO Gabriel Plotkin, Reddit co-founder and CEO Steve Huffman and trader and Redditor Keith Gill.",CNBC Television,"Thu, 18 Feb 2021 13:09:44 -0500",,Neutral,Video
https://www.gurufocus.com/news/1363351/strategies-for-a-rising-rate-environment,https://cdn.snapi.dev/images/v1/x/2/bank18.jpg,Strategies For a Rising Rate Environment,"Bond yields are rising, and that is not a welcome sign for stock market investors. Even though the relationship between bond yields and stock prices tends to vary at different stages of the business cycle, these two variables usually exhibit a negative correlation, suggesting higher bond yields will lead to lower stock prices.",GuruFocus,"Thu, 18 Feb 2021 13:01:57 -0500",,Neutral,Article
https://investorplace.com/2021/02/the-wild-gme-stock-rally-will-have-a-lasting-impact-on-investing/,https://cdn.snapi.dev/images/v1/y/9/shutterstock-trading-screen-zkd1klslm5.jpg,The Wild GameStop Rally Will Have a Lasting Impact,The GME stock saga heads to court with major players in the trading frenzy expected to testify. Here's what to look out for at the hearings.,InvestorPlace,"Thu, 18 Feb 2021 13:00:28 -0500",,Neutral,Article
https://www.marketwatch.com/story/federal-reserve-starts-playing-catch-up-on-climate-change-11613670255,https://cdn.snapi.dev/images/v1/6/y/im-245886width620size15005861664712778.jpg,The Fed: Federal Reserve starts playing catch-up on climate change,Federal Reserve Governor Lael Brainard on Thursday outlined the work the central bank is undertaking to protect the financial system from climate-change risk.,Market Watch,"Thu, 18 Feb 2021 12:44:00 -0500",paylimitwall,Neutral,Article
https://www.youtube.com/watch?v=RW_Id_1FrAU,https://cdn.snapi.dev/images/v1/a/9/how-did-europes-negative-interest-rates-fare-over-the-long-term.jpg,How Did Europe's Negative Interest Rates Fare Over the Long Term?,"In 2014, the European Central Bank lowered key interest rates into negative territory, hoping to encourage growth through spending and investment. Years later, the Fed and other central banks around the world are evaluating whether that made sense.",Bloomberg Markets and Finance,"Thu, 18 Feb 2021 12:37:57 -0500",,Neutral,Video
https://www.proactiveinvestors.com//companies/news/941705/wall-street-shares-sink-at-lunch-as-traders-digest-economic-data-941705.html?SNAPI,https://cdn.snapi.dev/images/v1/z/j/1613668804-2019-12-18-12-10-26-66b8697beacfe5018c70f20463bae45d.jpg,Wall Street shares sink at lunch as traders digest economic data,"12.15pm; US stocks under pressure at lunch Wall Street shares dropped sharply at midsession as traders mulled a clutch of  economic data while virus fears persist. The Dow Jones Industrial Average lost 280 points at 31,333, while the S&P 500 shed around 39 to stand at 3,892.",Proactive Investors,"Thu, 18 Feb 2021 12:34:52 -0500",,Negative,Article
https://www.etftrends.com/etf-strategist-channel/market-strength-is-beginning-to-rotate/,https://cdn.snapi.dev/images/v1/m/a/market-strength-is-beginning-to-rotate-440x250.jpg,Market Strength is Beginning to Rotate,"Weekly Update Markets have a tendency to do what they can to surprise the masses.  We see this occur often, particularly when we try to relate the news to market events.",ETF Trends,"Thu, 18 Feb 2021 12:30:13 -0500",,Positive,Article
https://www.etftrends.com/model-portfolio-channel/fed-minutes-underscore-utility-of-model-portfolio/,https://cdn.snapi.dev/images/v1/1/g/fed-minutes-underscore-the-utility-of-this-model-portfolio-440x250.jpg,Fed Minutes Underscore the Utility of This Model Portfolio,"Perusing meeting minutes from the Federal Open Market Committee (FOMC) isn't always easy or entertaining, but the text out earlier this week may contain vital clues for advisors and asset allocators alike. Advisors can prepare for changes in the bond market with the WisdomTree Fixed Income Model Portfolio.",ETF Trends,"Thu, 18 Feb 2021 12:30:07 -0500",,Neutral,Article
https://www.youtube.com/watch?v=QyJpju2DeMs,https://cdn.snapi.dev/images/v1/m/q/stocks-growth-and-risk-outlook-for-2021-amid-the-coronavirus-and-beyond.jpg,"Stocks, growth, and risk outlook for 2021 amid the coronavirus and beyond","Yahoo Finance's Myles Udland, Brian Sozzi, and Julie Hyman spoke with Krishna Memani, chief investment officer at Lafayette College about stocks, growth outlook, and the biggest risks in the markets for 2021.",Yahoo Finance,"Thu, 18 Feb 2021 12:28:15 -0500",,Negative,Video
https://www.businessinsider.com/gamestop-reddit-frenzy-market-collapse-thomas-petterffy-interactive-brokers-2021-2,https://cdn.snapi.dev/images/v1/g/a/gamestop-frenzy-brought-the-market-dangerously-close-to-collapse-says-interactive-brokers-founder-thomas-petterffy.jpg,"GameStop frenzy brought the market 'dangerously close' to collapse, says Interactive Brokers founder Thomas Petterffy","Interactive Brokers Group Chairman and founder Thomas Peterffy said the country's financial markets came ""dangerously close"" to collapsing during the Reddit-fueled GameStop frenzy last month, more than the public realized. ""We have come dangerously close to the collapse of the entire system and the public seems to be completely unaware of that, including Congress and the regulators,"" Peterffy told CNBC in an interview on Wednesday.",Business Insider,"Thu, 18 Feb 2021 12:24:04 -0500",paylimitwall,Negative,Article
https://www.youtube.com/watch?v=Oj5DpJenMw0,https://cdn.snapi.dev/images/v1/m/q/congressmen-break-down-what-to-expect-from-gamestop-hearing.jpg,Congressmen break down what to expect from GameStop hearing,"CNBC's ""Squawk Alley"" team discusses what to expect from the Robinhood and GameStop hearing and how regulation may impact Wall Street with Rep. Stephen Lynch (D-Mass.",CNBC Television,"Thu, 18 Feb 2021 12:08:00 -0500",,Neutral,Video
https://www.youtube.com/watch?v=vKuQK2WwqOM,https://cdn.snapi.dev/images/v1/m/q/dont-be-placing-big-bets-in-this-market-says-mgs-lonergan.jpg,"Don't Be Placing Big Bets in this Market, Says M&G's Lonergan","Feb.18 -- Eric Lonergan, macro portfolio manager at M&G Investments, discusses the state of markets and his outlook for the next 3 to 6 months. He speaks on “Bloomberg Daybreak: Europe.",Bloomberg Markets and Finance,"Thu, 18 Feb 2021 11:28:14 -0500",,Negative,Video
https://www.youtube.com/watch?v=tDE6BBn2iSI,https://cdn.snapi.dev/images/v1/m/q/sec-commissioner-on-gamestop-fallout-we-can-consider-adjusting-short-selling-limitations.jpg,SEC commissioner on GameStop fallout: We can consider adjusting short selling limitations,"CNBC's ""Squawk on the Street"" team discusses the GameStop trade fallout and how it many impact regulation with Securities and Exchange Commission's Hester Peirce.",CNBC Television,"Thu, 18 Feb 2021 11:28:14 -0500",,Neutral,Video
https://www.youtube.com/watch?v=3XVI-hiLsLc,https://cdn.snapi.dev/images/v1/m/q/when-does-the-10-year-become-a-liability-for-stocks.jpg,When does the 10-year become a liability for stocks?,"Treasury yields edged slightly higher, as the market focuses on improving data on Covid cases and the prospect of fiscal stimulus. CNBC's ""Squawk on the Street"" crew discuss the lingering debate about at what level the 10-year starts to become a liability for stocks.",CNBC Television,"Thu, 18 Feb 2021 11:28:09 -0500",,Negative,Video
https://www.youtube.com/watch?v=Yq4jdShG_PU,https://cdn.snapi.dev/images/v1/a/a/peterffy-markets-were-frighteningly-close-to-collapse-amid-gamestop-turmoil.jpg,Peterffy: Markets Were 'Frighteningly Close' to Collapse Amid GameStop Turmoil,"Feb.18 -- Interactive Brokers Group Inc. Chairman Thomas Peterffy says financial markets came “frighteningly close” to collapsing during last month's Reddit-driven turmoil. He speaks on ""Bloomberg The Open.",Bloomberg Markets and Finance,"Thu, 18 Feb 2021 11:24:45 -0500",,Negative,Video
https://www.zacks.com/stock/news/1265448/inflation-metrics-creep-jobless-claims-spike-to-861k,https://cdn.snapi.dev/images/v1/l/h/employerstudentloanrepaymentextended-9f8b9322926447bf97fc862170684c41.jpg,Inflation Metrics Creep; Jobless Claims Spike to 861K,"As the post-pandemic era draws closer (we hope), and it's translating into an anticipation of interest rates eventually going up.",Zacks Investment Research,"Thu, 18 Feb 2021 11:21:25 -0500",,Negative,Article
https://www.zacks.com/stock/news/1265463/initial-jobless-claims-spikes,https://cdn.snapi.dev/images/v1/2/0/201001100605-01-nyse-0930-super-169---yhvfhob8ad.jpg,Initial Jobless Claims Spikes,Initial Jobless Claims Spikes,Zacks Investment Research,"Thu, 18 Feb 2021 11:21:17 -0500",,Negative,Article
https://www.marketwatch.com/story/oil-prices-pare-losses-as-eia-reports-a-more-than-7-million-barrel-weekly-fall-in-us-crude-supplies-2021-02-18,https://cdn.snapi.dev/images/v1/r/r/106630005-1595532860080-gettyimages-1227707089-363421803-1-5---daiszk6d4u.jpeg,Oil prices pare losses as EIA reports a more than 7 million-barrel weekly fall in U.S. crude supplies,"The Energy Information Administration reported Thursday that U.S. crude inventories declined by 7.3 million barrels for the week ended Feb. 12. The data, which were delayed by a day this week because of the Presidents Day holiday, compared with the average fall of 3.4 million barrels forecast by analysts polled by S&P Global Platts.",Market Watch,"Thu, 18 Feb 2021 11:07:22 -0500","oil,paylimitwall",Negative,Article
https://www.youtube.com/watch?v=Fl-UljuoZfI,https://cdn.snapi.dev/images/v1/t/o/washington-just-doesnt-understand-how-wall-street-works-mulvaney.jpg,Washington just doesn't understand how Wall Street works: Mulvaney,Former CFPB director Mick Mulvaney argues the GameStop hearing will prove 'Washington just doesn't understand how Wall Street works.',Fox Business,"Thu, 18 Feb 2021 11:06:13 -0500",,Neutral,Video
