news_url,image_url,title,text,source_name,date,topics,sentiment,type
https://seekingalpha.com/article/4414140-how-to-spot-a-bubble,https://cdn.snapi.dev/images/v1/i/a/etf21-724822.jpg,How To Spot A Bubble,"The defining feature of a bubble is inconsistency between expected returns based on price behavior and expected returns based on valuations. If we compare our most reliable valuation measures with the valuation measures that one would obtain from a proper long-term discounted cash flow analysis, we find that they're nearly identical.",Seeking Alpha,"Mon, 15 Mar 2021 22:20:21 -0400",paylimitwall,Neutral,Article
https://seekingalpha.com/article/4414122-deeper-look-at-sector-realignment-technically-speaking-for-3-15,https://cdn.snapi.dev/images/v1/q/k/103905600-gettyimages-94868577-nuegmzzwyp-724793.jpg,A Deeper Look At The Sector Realignment (Technically Speaking For 3/15),The reflation trade is still very much on. The Fed will announce its latest policy action this week.,Seeking Alpha,"Mon, 15 Mar 2021 20:57:29 -0400","tanalysis,paylimitwall",Neutral,Article
https://www.youtube.com/watch?v=H8JLwo4FNS4,https://cdn.snapi.dev/images/v1/k/3/valuations-are-elevated-because-so-much-money-is-in-the-market-bmo-global-asset-management-724797.jpg,Valuations are elevated because so much money is in the market: BMO Global Asset Management,Yahoo Finance's Adam Shapiro and Seana Smith spoke with BMO Global Asset Management CIO Ernesto Ramos about what sectors investors should consider as the economy opens.,Yahoo Finance,"Mon, 15 Mar 2021 20:49:46 -0400",,Neutral,Video
https://www.youtube.com/watch?v=uTRB5Pr4PD0,https://cdn.snapi.dev/images/v1/r/n/jim-cramer-risk-tolerance-investing-and-the-stock-market-724766.jpg,"Jim Cramer: Risk tolerance, investing and the stock market","""Mad Money"" host Jim Cramer breaks down how investors can take on the appropriate amount of risk in the stock market.",CNBC Television,"Mon, 15 Mar 2021 19:48:30 -0400","cramer,madmoney",Neutral,Video
https://www.youtube.com/watch?v=8Elqe9CHFAk,https://cdn.snapi.dev/images/v1/p/2/the-fed-learns-from-its-mistakes-on-employment-mike-konczal-724751.jpg,The Fed Learns From Its Mistakes on Employment: Mike Konczal,"Mar.15 -- Mike Konczal, director of progressive thought at the Roosevelt Institute, speaks with Bloomberg's Caroline Hyde, Romaine Bostick and Joe Weisenthal on ""What'd You Miss?"" about this week's FOMC meeting and the unequal economic recovery.",Bloomberg Markets and Finance,"Mon, 15 Mar 2021 19:16:41 -0400",,Neutral,Video
https://www.investors.com/market-trend/the-big-picture/growth-stocks-today-act-bullishly-reaffirm-recent-stock-market-shift/,https://cdn.snapi.dev/images/v1/6/w/stock-trader-ap-002-717217-725790.jpg,"Growth Stocks Today Act Bullishly, Reaffirm This Recent Stock Market Shift","Data storage, enterprise software, medical systems, financial software and tech services stocks also advanced more than 1%, early data showed. The post Growth Stocks Today Act Bullishly, Reaffirm This Recent Stock Market Shift appeared first on Investor's Business Daily.",Investors Business Daily,"Mon, 15 Mar 2021 18:48:04 -0400",paywall,Positive,Article
https://www.cnbc.com/2021/03/15/roaring-economy-to-benefit-more-than-reopening-trades-credit-suisse.html,https://cdn.snapi.dev/images/v1/5/3/106836583-1612562671268-gettyimages-1300566210-dsc07193-2021020530033829-724730.jpeg,"Roaring economy will benefit more than just reopening trades, Credit Suisse analyst says",Credit Suisse's Jonathan Golub said he believes the reopenings will be bigger and benefit more industries than Wall Street thinks.,CNBC,"Mon, 15 Mar 2021 18:34:21 -0400",,Positive,Article
https://www.cnbc.com/2021/03/15/stock-market-open-to-close-news.html,https://cdn.snapi.dev/images/v1/w/4/106847886-1614703835471-nyse-trading-floor-ob-photo-210302-press-10-724663.jpg,"Stock futures are little changed after Dow, S&P close at record",U.S. stock index futures were little changed during overnight trading on Monday.,CNBC,"Mon, 15 Mar 2021 18:03:19 -0400",,Neutral,Article
https://investorplace.com/2021/03/tech-will-drop-then-soar/,https://cdn.snapi.dev/images/v1/1/0/106845849-16142791783273-nyse-bell-podium-ob-photo-210225-press-39-jpg-722100-724645.jpg,"Tech Will Drop, then Soar","Innovation vs. inflation is a real battle … why Luke Lango is betting big on innovation … but get ready for some market tantrums when inflation comes We have a challenge … On one hand, innovative tech stocks have been generating triple- and quadruple-digit returns in recent months.",InvestorPlace,"Mon, 15 Mar 2021 17:36:17 -0400",,Positive,Article
https://www.etftrends.com/etf-strategist-channel/more-economic-and-market-upside-to-come/,https://cdn.snapi.dev/images/v1/s/t/stock-exchange-738671-1280-53-721896-724646.jpg,More Economic and Market Upside to Come,Our work suggests that U.S. economic prospects continue to brighten. Higher long-term interest rates currently reflect market expectations for faster economic growth and somewhat higher inflation.,ETF Trends,"Mon, 15 Mar 2021 17:33:33 -0400",,Positive,Article
https://seekingalpha.com/article/4414096-bond-yields-to-continue-rising,https://cdn.snapi.dev/images/v1/c/k/106727425-1601646130354-nyse-724634.jpg,Bond Yields Will Continue To Rise,"Bond yields will continue to rise as the pandemic resides, economic growth continues to pick up, and the Federal Reserve continues to err on the side of monetary ease.",Seeking Alpha,"Mon, 15 Mar 2021 17:31:52 -0400",paylimitwall,Positive,Article
https://www.youtube.com/watch?v=hps-_sBZR1w,https://cdn.snapi.dev/images/v1/m/q/fomc-preview-what-to-expect-from-the-march-2-day-policy-meeting-724652.jpg,FOMC preview: What to expect from the March 2-day policy meeting,Yahoo Finance's Brian Cheung weighs in on what to expect from the upcoming FOMC meeting.,Yahoo Finance,"Mon, 15 Mar 2021 17:26:29 -0400",,Neutral,Video
https://www.youtube.com/watch?v=oJufvOtVOOc,https://cdn.snapi.dev/images/v1/p/n/market-recap-monday-march-15-stocks-close-at-highs-of-the-day-724598.jpg,"Market Recap: Monday, March 15: Stocks close at highs of the day",Stocks ended mixed on Friday as technology stocks came under renewed pressure. Treasury yields resumed their march higher.,Yahoo Finance,"Mon, 15 Mar 2021 17:17:22 -0400",,Positive,Video
https://www.youtube.com/watch?v=1LPjOqMlxBM,https://cdn.snapi.dev/images/v1/l/n/whats-the-outlook-for-us-gdp-in-2021-724625.jpg,What's the Outlook for U.S. GDP in 2021?,President Biden's $1.9 trillion stimulus package is now arriving. Analysts expect the massive cash injection will result in a very strong second quarter.,Bloomberg Markets and Finance,"Mon, 15 Mar 2021 17:15:29 -0400",,Neutral,Video
https://seekingalpha.com/article/4414079-remember-value-investing,https://cdn.snapi.dev/images/v1/1/4/106419724-1583164885503rts34fgq-dahzkkx03s-724559.jpg,Remember Value Investing?,"After being ignored for 13 years, value sectors such as financials, materials, energy and industrials are back and we believe economic acceleration and rising rates set the stage for a multiyear recovery.",Seeking Alpha,"Mon, 15 Mar 2021 16:54:49 -0400",paylimitwall,Neutral,Article
https://www.youtube.com/watch?v=1PlkDd2uDsk,https://cdn.snapi.dev/images/v1/7/d/expect-no-change-in-policy-from-the-feds-fomc-meeting-strategist-charles-schwab-724558.jpg,Expect no change in policy from the Fed's FOMC meeting: Strategist Charles Schwab,Yahoo Finance's Alexis Christoforous spoke with Charles Schwab Chief Fixed Income Strategist about what to expect from the Fed's upcoming FOMC meeting.,Yahoo Finance,"Mon, 15 Mar 2021 16:52:52 -0400",,Neutral,Video
https://www.kiplinger.com/investing/stocks/602427/stock-market-today-031521-recovery-stocks-lead-the-way-as-stocks-calmly-climb,https://cdn.snapi.dev/images/v1/s/m/wedw322-6wdaea84k2-715341-724637.jpg,Stock Market Today: Recovery Plays Lead the Way as Stocks Calmly Climb,"Airlines, restaurants and cruise liners were among some of the session's biggest gainers in a smooth, fruitful Monday for stocks.",Kiplinger,"Mon, 15 Mar 2021 16:52:00 -0400",,Positive,Article
https://www.marketwatch.com/story/fed-should-switch-up-its-playbook-and-buy-more-treasurys-fewer-mortgage-bonds-urge-analysts-11615844557,https://cdn.snapi.dev/images/v1/l/w/im-311840width620size15183867141162515-724640.jpg,"Market Extra: Fed should ‘switch' up its playbook and buy more Treasurys, fewer mortgage bonds, urge analysts","As the economy reopens, the Federal Reserve should consider tweaking its $120 billion monthly asset purchase program to allow for more Treasury purchases and fewer government-backed mortgage bonds, say analysts.",Market Watch,"Mon, 15 Mar 2021 16:42:00 -0400",paylimitwall,Neutral,Article
https://www.cnbc.com/2021/03/15/why-this-weeks-fed-meeting-could-be-march-madness-for-markets.html,https://cdn.snapi.dev/images/v1/q/z/a-market-that-gets-no-respect-stocks-near-all-time-highs-despite-hand-wringing-723660-724496.jpg,Why this week's Fed meeting could be 'March madness' for markets,"The ball is in Fed Chairman Jerome Powell's court, and what he says Wednesday could tip when the Fed might begin to change policy.",CNBC,"Mon, 15 Mar 2021 16:19:57 -0400",,Negative,Article
https://www.proactiveinvestors.com//companies/news/943829/us-stocks-close-higher-on-reopening-optimism-943829.html?SNAPI,https://cdn.snapi.dev/images/v1/z/8/nasdaq-leads-the-way-as-yields-decline-following-ecb-decision-to-increase-bond-buys-719134-724438.jpg,US stocks close higher on reopening optimism,4:05pm: US equities close higher  US stocks closed higher as investors grew optimistic about pandemic reopenings and how that positively impacts the economy. The Dow Jones Industrial Average jumped to an all-time high as rising optimism continued to encourage the rotation into cyclical stocks amid the passage of the $1.9 trillion stimulus bill.,Proactive Investors,"Mon, 15 Mar 2021 16:14:56 -0400",,Positive,Article
https://seekingalpha.com/article/4414062-reits-surged-amid-mixed-run-for-major-asset-classes-last-week,https://cdn.snapi.dev/images/v1/x/e/201001100605-01-nyse-0930-super-169-724435.jpg,REITs Surged Amid Mixed Run For Major Asset Classes Last Week,"US real estate investment trusts (REITs) rebounded in last week's trading (through Mar. 12), posting the best performance by far for the major asset classes, which delivered mixed results overall, based on a set of proxy ETFs.",Seeking Alpha,"Mon, 15 Mar 2021 16:11:17 -0400","Real Estate,paylimitwall",Positive,Article
https://www.businessinsider.com/stock-market-news-today-dow-record-stimulus-checks-direct-amc-2021-3,https://cdn.snapi.dev/images/v1/d/o/dow-sp-500-close-at-record-highs-as-stimulus-fueled-optimism-continues-724520.jpg,"Dow, S&P 500 close at record highs as stimulus-fueled optimism continues","US stocks gained at the close with the Dow reaching a record closing high as investors remained optimistic on  economic growth following President Biden signing the $1.9 trillion stimulus program into law last week. Retail investors could buy a record $3 billion of US equities in a single day when they receive their $1,400 stimulus checks from the US government, according to Viraj Patel, global macro strategist at Vanda Research. That could happen as soon as Wednesday or Thursday, when most Americans will start seeing $1,400 deposited into their bank accounts.",Business Insider,"Mon, 15 Mar 2021 16:06:47 -0400",paylimitwall,Positive,Article
https://www.youtube.com/watch?v=vfIrKv4U5Cc,https://cdn.snapi.dev/images/v1/m/q/top-etf-themes-to-watch-as-2021s-first-quarter-comes-to-a-close-724491.jpg,Top ETF themes to watch as 2021's first quarter comes to a close,"Harry Whitton, Old Mission's head of ETF sales trading, highlights what he's watching for the rest of 2021. With Defiance ETFs CIO Sylvia Jablonski and CNBC's Bob Pisani.",CNBC Television,"Mon, 15 Mar 2021 16:02:06 -0400",,Neutral,Video
https://www.youtube.com/watch?v=fNWkvcs_5GQ,https://cdn.snapi.dev/images/v1/m/q/cea-chair-cecilia-rouse-discusses-19-covid-stimulus-package-724488.jpg,CEA chair Cecilia Rouse discusses $1.9 Covid stimulus package,"Cecilia Rouse, White House Council of Economic Advisers chair, joins 'Closing Bell' to discuss President Biden's economic agenda. She also discusses how the $1.9 trillion Covid relief package can help Americans who are struggling amid the pandemic.",CNBC Television,"Mon, 15 Mar 2021 15:59:43 -0400",,Neutral,Video
https://www.barrons.com/articles/the-u-s-is-trying-to-fix-the-chip-shortage-what-it-could-mean-for-semiconductor-stocks-51615838286,https://cdn.snapi.dev/images/v1/p/f/im-311790-724375.jpg,Stocks That Could Benefit as the U.S. Tries to Fix the Chip Shortage,A J.P. Morgan analyst estimated the incentives and subsidies from the U.S. government designed to spur semiconductor manufacturing and research could total between $35 billion and $37 billion.,Barrons,"Mon, 15 Mar 2021 15:58:00 -0400",paywall,Positive,Article
https://www.youtube.com/watch?v=pQ2yXxfq3BE,https://cdn.snapi.dev/images/v1/m/q/fomo-etf-in-registration-what-investors-can-expect-724495.jpg,'FOMO' ETF in registration. What investors can expect,"Tuttle Tactical Management CEO and Chief Investment Officer Matthew Tuttle discusses his firm's newly registered ""fear of missing out"" ETF with CNBC's Bob Pisani.",CNBC Television,"Mon, 15 Mar 2021 15:49:19 -0400",,Neutral,Video
https://www.youtube.com/watch?v=VKVVxz6h7Rk,https://cdn.snapi.dev/images/v1/m/q/higher-inflation-will-lead-to-value-outperformance-says-neuberger-bermans-salzmann-724364.jpg,"Higher inflation will lead to value outperformance, says Neuberger Berman's Salzmann",CNBC's Brian Sullivan discusses the rotation of value stocks and growth stocks with Eli Salzmann of the Neuberger Berman Large Cap Value Fund.,CNBC Television,"Mon, 15 Mar 2021 15:18:48 -0400",,Neutral,Video
https://www.youtube.com/watch?v=eysV1MTsin0,https://cdn.snapi.dev/images/v1/m/q/why-short-sellers-are-betting-against-spacs-724366.jpg,Why short sellers are betting against SPACs,CNBC's Brian Sullivan discusses the rising risks of SPACs and why short sellers are betting against it with Matt Wirz of the Wall Street Journal.,CNBC Television,"Mon, 15 Mar 2021 15:18:42 -0400",SPAC,Negative,Video
https://www.marketwatch.com/story/dow-records-fourth-straight-record-as-stocks-shake-off-early-weakness-2021-03-15,https://cdn.snapi.dev/images/v1/6/7/dow-climbs-100-points-stocks-post-minor-gains-despite-another-worse-than-expected-jobs-report-724455.jpg,Dow ends at record high for fourth straight session as stocks bounce back,Dow ends at record high for fourth straight session as stocks bounce back,Market Watch,"Mon, 15 Mar 2021 15:06:55 -0400",paylimitwall,Positive,Article
https://seekingalpha.com/article/4414050-february-consumer-inflation-begins-to-beat-up-a-little,https://cdn.snapi.dev/images/v1/n/d/a-significant-majority-of-democrats-and-republicans-support-strong-consumer-protection-regulations-and-tougher-rules-for-wall-street-724326.jpg,February Consumer Inflation Begins To Beat Up A Little,Seasonally adjusted consumer prices rose 0.4% in February.,Seeking Alpha,"Mon, 15 Mar 2021 15:02:20 -0400",paylimitwall,Negative,Article
https://seekingalpha.com/article/4414048-comfort-concerns-weekly-blog-672,https://cdn.snapi.dev/images/v1/e/r/snsy23-724321.jpg,Comfort Concerns - Weekly Blog # 672,"This week's US stock market performance numbers are great: Dow Jones Industrial Average (DJIA) +4.07%, NASDAQ +3.09%, and S&P 500 +2.74%. (Cannot expect to keep up this rate.).",Seeking Alpha,"Mon, 15 Mar 2021 15:00:30 -0400",paylimitwall,Neutral,Article
https://www.youtube.com/watch?v=l5uQSG4okU8,https://cdn.snapi.dev/images/v1/h/g/us-eyes-semiconductor-manufacturing-to-help-ailing-jobs-market-724328.jpg,U.S. Eyes Semiconductor Manufacturing to Help Ailing Jobs Market,"As a worldwide semiconductor shortage hammers American industries, trade groups are reaching out to the Biden administration with pleas to boost production in the U.S. Subscribe to Cheddar Now on YouTube: https://chdr.tv/NowYT",Cheddar,"Mon, 15 Mar 2021 15:00:09 -0400",,Neutral,Video
https://www.youtube.com/watch?v=c6X1aEcyjP0,https://cdn.snapi.dev/images/v1/m/q/10-percent-of-stimulus-checks-may-go-to-bitcoin-and-stocks-says-mizuhos-dolev-724317.jpg,"10 percent of stimulus checks may go to bitcoin and stocks, says Mizuho's Dolev","Mizuho asked how those expecting to receive stimulus checks are planning to use their money. Dan Dolev, Mizuho, joins 'Power Lunch' to discuss the company's survey results and methodology.",CNBC Television,"Mon, 15 Mar 2021 14:55:31 -0400",,Positive,Video
https://www.youtube.com/watch?v=RIlW4-vninc,https://cdn.snapi.dev/images/v1/m/q/investors-are-beginning-to-look-more-broadly-throughout-market-says-scott-clemons-724314.jpg,"Investors are beginning to look more broadly throughout market, says Scott Clemons","Quincy Krosby, Prudential Financial chief market strategist, and Scott Clemons, Brown Brothers Harriman Private Banking chief investment strategist, join 'Power Lunch' to discuss what's pushing tech stocks higher and how additional stimulus money could affect investment strategies.",CNBC Television,"Mon, 15 Mar 2021 14:53:55 -0400",,Positive,Video
https://www.foxbusiness.com/markets/bidens-1-9t-coronavirus-aid-package-to-give-bigger-boost-to-us-economy-goldman-sachs,https://cdn.snapi.dev/images/v1/j/i/biden-stimulus-blue-states-724304.jpg,Biden's $1.9T coronavirus aid package to supercharge US economy: Goldman Sachs,"President Biden's American Rescue Plan will provide a bigger lift to the U.S. economy than previously expected, according to Goldman Sachs.",Fox Business,"Mon, 15 Mar 2021 14:44:14 -0400",Political,Positive,Article
https://markets.businessinsider.com/news/stocks/shark-tank-kevin-oleary-tech-stocks-analysis-third-inning-growth-2021-3-1030207234,https://cdn.snapi.dev/images/v1/s/h/shark-tanks-kevin-oleary-says-its-only-the-third-inning-of-growth-for-tech-stocks-724290.jpg,Shark Tank's Kevin O'Leary says it's only the 'third inning' of growth for tech stocks,"Kevin O'Leary said he's picking up more shares in tech names despite the recent rotation trade hurting returns. The Shark Tank star argued tech stocks are only in the ""third inning"" of a long growth story in an interview with CNBC on Monday.",Business Insider,"Mon, 15 Mar 2021 14:26:05 -0400",paylimitwall,Positive,Article
https://www.businessinsider.com/stock-market-outlook-bonds-are-favorable-alternative-to-equities-bofa-2021-3,https://cdn.snapi.dev/images/v1/o/n/one-key-signal-suggests-bonds-are-a-favorable-alternative-to-the-stock-market-for-the-first-time-since-2019-bofa-says-724278.jpg,"One key signal suggests bonds are a favorable alternative to the stock market for the first time since 2019, BofA says","Ultra-low interest rates have fueled a popular stock market theme known as ""TINA"" (there is no alternative) over the past few years, as investors grapple with trillions of dollars worth of bonds offering a negative real rate of return.  But that dynamic is beginning to change, Bank of America's equity and quant strategist Savita Subramanian said in a note on Monday.",Business Insider,"Mon, 15 Mar 2021 14:21:24 -0400",paylimitwall,Positive,Article
https://www.youtube.com/watch?v=MPE1NGPfoew,https://cdn.snapi.dev/images/v1/x/d/rates-are-going-to-stay-lower-for-longer-says-tiaa-bank-president-of-world-markets-724262.jpg,"'Rates are going to stay lower for longer,' says TIAA Bank President of World Markets","TIAA Bank President of World Markets Chris Gaffney spoke with Yahoo Finance's Aikiko Fujita and Zack Guzman about the Federal Reserve, the bond market, inflation, and global economic recovery. Yahoo Finance's Aikiko Fujita spoke with",Yahoo Finance,"Mon, 15 Mar 2021 14:12:36 -0400",,Neutral,Video
https://www.youtube.com/watch?v=gMqGK7ZRe4A,https://cdn.snapi.dev/images/v1/m/q/charting-the-path-of-treasury-yields-724253.jpg,Charting the Path of Treasury Yields,"Mar.15 -- Goldman Sachs Co-head of Global FX, Interest Rates and EM Strategy Research Zach Pandl speaks with Bloomberg's Alix Steel and Guy Johnson about Goldman Sach's bullish outlook on the U.S. economy on ""Bloomberg Markets:"".",Bloomberg Markets and Finance,"Mon, 15 Mar 2021 14:10:51 -0400",,Neutral,Video
https://seekingalpha.com/article/4414033-market-may-go-from-orderly-to-disorderly-fed-disappoints,https://cdn.snapi.dev/images/v1/4/s/the-nasdaq-could-decline-20-if-the-10-year-treasury-yield-breaches-the-2-level-ned-davis-research-says-719693-724246.jpg,The Market May Go From Orderly To Disorderly If The Fed Disappoints,The Fed is not likely to give the markets what they want at the next meeting. The market is looking for clues on how the Fed will tackle inflation concerns and rising yields.,Seeking Alpha,"Mon, 15 Mar 2021 14:02:48 -0400",paylimitwall,Negative,Article
https://seekingalpha.com/article/4414030-dont-worry-10-year-why-stocks-are-moving-higher-from,https://cdn.snapi.dev/images/v1/b/c/wall-street-4847629-1920-1-724230.jpg,Don't Worry About The 10-Year: Why Stocks Are Moving Higher From Here,"There has been quite a bit of concern about interest rates lately. In fact, major market averages have slumped, with the Nasdaq composite declining by over 10% in the process.",Seeking Alpha,"Mon, 15 Mar 2021 13:55:04 -0400",paylimitwall,Positive,Article
https://seekingalpha.com/article/4414037-strong-restart-not-recovery,https://cdn.snapi.dev/images/v1/j/0/hunting-for-value-in-the-smallest-sp-500-sectors-724231.jpg,"A Strong Restart, Not A Recovery","We lay out three reasons why we see a strong economic restart, rather than a normal recovery, and believe markets still underappreciate its size and speed. U.S. Treasury yields hit 13-month highs. We see the recent rise in real yields as justified given the growth outlook and remain tactically pro-risk.",Seeking Alpha,"Mon, 15 Mar 2021 13:54:00 -0400",paylimitwall,Neutral,Article
https://www.businessinsider.com/stock-market-impact-of-stimulus-check-record-buying-spree-vanda-2021-3,https://cdn.snapi.dev/images/v1/r/e/retail-investors-could-buy-a-record-3-billion-of-us-stocks-the-day-they-get-their-stimulus-money-one-research-firm-says-724237.jpg,"Retail investors could buy a record $3 billion of US stocks the day they get their stimulus money, one research firm says","Retail investors could buy a record $3 billion of US equities in a single day when they receive their $1,400 stimulus checks from the US government, according to Viraj Patel, global macro strategist at Vanda Research The firm says this could happen as soon as Wednesday or Thursday of this week. JPMorgan Chase and Wells Fargo have previously said their customers are slated to start getting the $1,400 checks on Wednesday.",Business Insider,"Mon, 15 Mar 2021 13:52:39 -0400",paylimitwall,Positive,Article
https://seekingalpha.com/article/4414027-reopening-spark-profitability-returning-bullish-outlook-market-strategy-weekly-march-12-2021,https://cdn.snapi.dev/images/v1/t/w/ipos-banner-year-markets-e1600964930157jpgquality90stripall-724119.jpg,"Reopening Spark, Profitability Returning, Bullish Outlook - Market Strategy Weekly - March 12, 2021","The emergence of a growth catalyst - in this case, the reopening of the economy - should lead in succession to an increase in activity, demand, output, revenue, investment, and. Our bullish outlook was strengthened this week when President Biden signed the new stimulus package into law.",Seeking Alpha,"Mon, 15 Mar 2021 13:12:00 -0400",paylimitwall,Positive,Article
https://www.businessinsider.com/stock-market-outlook-value-rotation-stocks-jpmorgan-barclays-stimulus-vaccines-2021-3,https://cdn.snapi.dev/images/v1/t/h/the-rotation-into-value-stocks-has-a-long-way-left-to-run-jpmorgan-and-barclays-say-724164.jpg,"The rotation into value stocks has a long way left to run, JPMorgan and Barclays say","The global rotation into value stocks has further to go as countries reopen after the coronavirus pandemic and consumers start spending again, according to JPMorgan and Barclays. Value stocks — or cheaper shares such as banks and energy firms — have handsomely outperformed fast-growing stocks such as the big tech names in 2021 so far.",Business Insider,"Mon, 15 Mar 2021 13:09:15 -0400",paylimitwall,Positive,Article
https://www.youtube.com/watch?v=Qbw_-ejuGb8,https://cdn.snapi.dev/images/v1/m/q/story-isnt-over-for-tech-growth-stocks-says-kevin-oleary-724097.jpg,"Story isn't over for tech growth stocks, says Kevin O'Leary","CNBC's ""Halftime Report"" team discusses how they're investing and what they think of recent stock moves.",CNBC Television,"Mon, 15 Mar 2021 12:59:07 -0400",,Positive,Video
https://www.youtube.com/watch?v=Io00EV4N_-A,https://cdn.snapi.dev/images/v1/k/r/coronavirus-after-a-year-whats-next-for-markets-government-and-business-724079.jpg,"Coronavirus after a year: What's next for markets, government, and business","Yahoo Finance's Editor-in-Chief Andy Serwer examines the impact the coronavirus has had on the economy, the markets, women, government, and business around the world.",Yahoo Finance,"Mon, 15 Mar 2021 12:46:05 -0400",,Neutral,Video
